"astro-ph/9907007","David Barrado y Navascues","D. Barrado y Navascues (1), J.R. Stauffer (2), B.M. Patten (2) ((1)
  MPIA (2) CfA)","The Lithium Depletion Boundary and the Age of the Young Open Cluster
  IC~2391","ApJ Letters, acccepted","Astrophys.J.522:L53-L56,1999","10.1086/312212",,"astro-ph",,"  We have obtained new photometry and intermediate resolution ($\Delta \lambda
= 2.7$ \AA\ ) spectra of 19 of these objects
  (14.9 $\le$ $I_c$ $\le$ 17.5) in order to confirm cluster membership. We
identify 15 of our targets as likely cluster members based on their $VRI$
photometry, spectral types, radial velocity, and H$\alpha$ emission strengths.
Higher S/N spectra were obtained for 8 of these probable cluster members in
order to measure the strength of the lithium 6708 \AA\ doublet and thus obtain
an estimate of the cluster's age. One of these 8 stars has a definite lithium
detection and two other (fainter) stars have possible lithium detections. A
color-magnitude diagram for our program objects shows that the lithium
depletion boundary in IC~2391 is at $I_c$=16.2. Using recent theoretical model
predictions, we derive an age for IC~2391 of 53$\pm$5 Myr. While this is
considerably older than the age most commonly attributed for this cluster
($\sim$35 Myr) this result for IC~2391 is comparable those recently derived for
the Pleiades and Alpha Persei clusters and can be explained by new models for
high mass stars that incorporate a modest amount of convective core
overshooting.
","[{""version"":""v1"",""created"":""Thu, 1 Jul 1999 10:05:34 GMT""}]","2011-02-11"
"astro-ph/9907008","Agostino Martinelli","Agostino Martinelli and Francesca Matteucci","A possible solution of the G-dwarf problem in the frame-work of closed
  models with a time-dependent IMF","8 pages, 9 figures, Latex, Astronomy and Astrophysics accepted",,,,"astro-ph",,"  In this paper we present a method to solve the G-dwarf problem in the
frame-work of analytical models (based on the instantaneous recycling
approximation, IRA). We consider a one-zone closed model without inflows or
outflows. We suppose a time-dependent Initial Mass Function (IMF) and we find
an integral-differential equation which must be satisfied in order to honour
the G-dwarf metallicity distribution as a function of the oxygen abundance.
IMFs with one and two slopes are given and discussed also in the framework of a
numerical chemical evolution model without IRA. We conclude that it is
difficult to reproduce other observational constraints besides the G-dwarf
distribution (such as $[\frac{O}{Fe}]$ vs $[\frac{Fe}{H}]$), and that an IMF
with two slopes, with time-dependent shape at the low mass end, would be
required. However, even in this case the predicted oxygen gradient along the
disk is flat and radial flows would be required to reproduce the observed
gradient.
","[{""version"":""v1"",""created"":""Thu, 1 Jul 1999 11:08:55 GMT""}]","2007-05-23"
"astro-ph/9907009","C. Canosa","C. M. Canosa, D. M. Worrall, M. J. Hardcastle, M. Birkinshaw","X-ray observations of low-power radio galaxies from the B2 catalogue","To appear in MNRAS. 13 pages, 3 figures",,"10.1046/j.1365-8711.1999.02923.x","Bristol Astrophysics preprint 40","astro-ph",,"  We present an analysis of X-ray data, taken with ROSAT, for a well defined
sample of low-power radio galaxies from the Bologna B2 catalogue. Where
possible, the HRI has been used in order to take advantage of the higher
spatial resolution provided by this instrument. A variety of models are fitted
to radial profiles in order to separate the resolved and unresolved X-ray
emission from the galaxies. We demonstrate a strong, approximately linear,
correlation between the luminosities of the unresolved X-ray components and the
5-GHz luminosities of the radio cores in this sample. This suggests a physical
relationship between the soft X-ray emission of radio galaxies and the
jet-generated radio core emission. We infer a nuclear jet-related origin for at
least some of the X-ray emission.
","[{""version"":""v1"",""created"":""Thu, 1 Jul 1999 11:22:58 GMT""}]","2009-10-31"
"astro-ph/9907010","Knox S. Long","Knox S. Long (STScI)","What We Learn from Quantitative Ultraviolet Spectroscopy of Naked White
  D warfs in Cataclysmic Variables","6 pages, 8 figures, to be published in the proc. for Cataclysmic
  Variables: A 60th Birthday Symposium in Honour of Brian Warner",,"10.1016/S1387-6473(00)00025-7",,"astro-ph",,"  Using the Hopkins Ultraviolet Telescope and Hubble Space Telescope, observers
have now obtained UV spectra with sufficient signal to noise and resolution to
allow quantitative spectroscopic analyses of the WDs in several DNe. In the
``cleanest'' DNe, such as U Gem, the observations are allowing the basic
physical parameters of the WD -- temperature, radius, gravity, rotation rate,
and surface abundances -- to be established. A second component also exists in
these systems, which may either be the disk or may be related to the WD itself.
Here I summarize the current state of the observations and our understanding of
the data, highlighting some of the uncertainties in the analyses as well the
prospects for fundamentally advancing our understanding of DNe and WDs with
future observations.
","[{""version"":""v1"",""created"":""Thu, 1 Jul 1999 14:47:39 GMT""}]","2009-10-31"
"cond-mat/9906449","Jeff E. Sonier","J.E. Sonier, J.H. Brewer, R.F. Kiefl, D.A. Bonn, J. Chakhalian, S.R.
  Dunsiger, W.N. Hardy, R. Liang, W.A. MacFarlane, R.I. Miller, D.R. Noakes,
  T.M. Riseman and C.E. Stronach","Melting and Dimensionality of the Vortex Lattice in Underdoped
  YBa2Cu3O6.60","8 pages, 4 figures, 5 postscript files",,"10.1103/PhysRevB.61.R890",,"cond-mat.supr-con cond-mat.mtrl-sci",,"  Muon spin rotation measurements of the magnetic field distribution in the
vortex state of the oxygen deficient high-Tc superconductor YBa{2}Cu{3}O{6.60}
reveal a vortex-lattice melting transition at much lower temperature than that
in the fully oxygenated material. The transition is best described by a model
in which adjacent layers of ``pancake'' vortices decouple in the liquid phase.
Evidence is also found for a pinning-induced crossover from a solid 3D to
quasi-2D vortex lattice, similar to that observed in the highly anisotropic
superconductor Bi{2+x}Sr{2-x}CaCu{2}O{8+y}.
","[{""version"":""v1"",""created"":""Wed, 30 Jun 1999 16:15:21 GMT""}]","2009-10-31"
"cond-mat/9906451","Benichou","O.Benichou(1), A.M.Cazabat(2), M.Moreau(1) and G.Oshanin(1) ((1) LPTL,
  Universite Paris VI, France; (2) LPMC, College de France, Paris, France)","Directed random walk in adsorbed monolayer","Latex file, 33 pages with 4 eps figures. To appear in Physica A",,"10.1016/S0378-4371(99)00251-4",,"cond-mat.stat-mech cond-mat.soft",,"  We study the dynamics of a tracer particle, which performs a totally directed
random walk in an adsorbed monolayer composed of mobile hard-core particles
undergoing continuous exchanges with a vapour phase. In terms of a
mean-field-type approach, based on the decoupling of the
tracer-particle-particle correlation functions into the product of pairwise,
tracer-particle correlations, we determine the density profiles of the
monolayer particles, as seen from the stationary moving tracer, and calculate
its terminal velocity, V_{tr}. In the general case the latter is determined
implicitly, as the solution of a certain transcendental equation. In two
extreme limits of slow and fast monolayer particles diffusion, we obtain
explicit asymptotic forms of V_{tr}. We show next that the density profile in
the monolayer is strongly inhomogeneous: In front of the stationary moving
tracer the local density is higher than the average value, \rho_L, and
approaches \rho_L as an exponential function of the distance from the tracer.
Past the tracer the local density is lower than \rho_L and the approach to
\rho_L may proceed differently depending whether the particles number in the
monolayer is not or is explicitly conserved. In the former case the approach is
described by an exponential dependence with a different characteristic length,
compared to the behavior in front of the tracer; in the latter case, the
density tends to \rho_L algebraically. The characteristic lengths and the
amplitudes of the density relaxation functions are also determined explicitly
","[{""version"":""v1"",""created"":""Wed, 30 Jun 1999 16:17:53 GMT""}]","2009-10-31"
"cond-mat/9906452","Jeff E. Sonier","J.E. Sonier, J.H. Brewer, R.F. Kiefl, G.D. Morris, R.I. Miller, D.A.
  Bonn, J. Chakhalian, R.H. Heffner, W.N. Hardy and R. Liang","Field Induced Reduction of the Low Temperature Superfluid Density in
  YBa2Cu3O6.95","8 pages, 4 figures, 1 RevTex file and 4 postscript figures","Physical Review Letters 83, 4156 (1999)","10.1103/PhysRevLett.83.4156",,"cond-mat.supr-con cond-mat.str-el",,"  A novel high magnetic field (8 T) spectrometer for muon spin rotation has
been used to measure the temperature dependence of the in-plane magnetic
penetration depth in YBa2Cu3O6.95. At low H and low T, the penetration depth
exhibits the characteristic linear T dependence associated with the energy gap
of a d_x^2-y^2-wave superconductor. However, at higher fields the penetration
depth is essentially temperature independent at low T. We discuss possible
interpretations of this surprising new feature in the low-energy excitation
spectrum.
","[{""version"":""v1"",""created"":""Wed, 30 Jun 1999 16:06:19 GMT""},{""version"":""v2"",""created"":""Tue, 9 Nov 1999 23:20:18 GMT""}]","2009-10-31"
"cond-mat/9906453","Dmitry Green","N. Read (Yale University), Dmitry Green (Yale University)","Paired states of fermions in two dimensions with breaking of parity and
  time-reversal symmetries, and the fractional quantum Hall effect","Accepted by PRB; references added and typos corrected","Phys.Rev.B61:10267,2000","10.1103/PhysRevB.61.10267",,"cond-mat.mes-hall cond-mat.supr-con hep-th",,"  We analyze pairing of fermions in two dimensions for fully-gapped cases with
broken parity (P) and time-reversal (T), especially cases in which the gap
function is an orbital angular momentum ($l$) eigenstate, in particular $l=-1$
(p-wave, spinless or spin-triplet) and $l=-2$ (d-wave, spin-singlet). For
$l\neq0$, these fall into two phases, weak and strong pairing, which may be
distinguished topologically. In the cases with conserved spin, we derive
explicitly the Hall conductivity for spin as the corresponding topological
invariant. For the spinless p-wave case, the weak-pairing phase has a pair
wavefunction that is asympototically the same as that in the Moore-Read
(Pfaffian) quantum Hall state, and we argue that its other properties (edge
states, quasihole and toroidal ground states) are also the same, indicating
that nonabelian statistics is a {\em generic} property of such a paired phase.
The strong-pairing phase is an abelian state, and the transition between the
two phases involves a bulk Majorana fermion, the mass of which changes sign at
the transition. For the d-wave case, we argue that the Haldane-Rezayi state is
not the generic behavior of a phase but describes the asymptotics at the
critical point between weak and strong pairing, and has gapless fermion
excitations in the bulk. In this case the weak-pairing phase is an abelian
phase which has been considered previously. In the p-wave case with an unbroken
U(1) symmetry, which can be applied to the double layer quantum Hall problem,
the weak-pairing phase has the properties of the 331 state, and with nonzero
tunneling there is a transition to the Moore-Read phase. The effects of
disorder on noninteracting quasiparticles are considered.
","[{""version"":""v1"",""created"":""Wed, 30 Jun 1999 20:15:05 GMT""},{""version"":""v2"",""created"":""Sat, 3 Jul 1999 16:42:42 GMT""},{""version"":""v3"",""created"":""Mon, 24 Jan 2000 02:57:13 GMT""}]","2011-06-21"
"cond-mat/9906454","Daphne O. Klemme","Ziqiang Wang (Boston College), Matthew P.A. Fisher (Institute for
  Theoretical Physics), S.M. Girvin (Indiana University), and J.T. Chalker
  (Oxford University)","Short-Range Interactions and Scaling Near Integer Quantum Hall
  Transitions","9 pages, 4 figures, submitted to Physical Review B","Phys. Rev. B 61, 8326 (2000)","10.1103/PhysRevB.61.8326","IUCM99-018","cond-mat.mes-hall",,"  We study the influence of short-range electron-electron interactions on
scaling behavior near the integer quantum Hall plateau transitions. Short-range
interactions are known to be irrelevant at the renormalization group fixed
point which represents the transition in the non-interacting system. We find,
nevertheless, that transport properties change discontinuously when
interactions are introduced. Most importantly, in the thermodynamic limit the
conductivity at finite temperature is zero without interactions, but non-zero
in the presence of arbitrarily weak interactions. In addition, scaling as a
function of frequency, $\omega$, and temperature, $T$, is determined by the
scaling variable $\omega/T^p$ (where $p$ is the exponent for the temperature
dependence of the inelastic scattering rate) and not by $\omega/T$, as it would
be at a conventional quantum phase transition described by an interacting fixed
point. We express the inelastic exponent, $p$, and the thermal exponent, $z_T$,
in terms of the scaling dimension, $-\alpha < 0$, of the interaction strength
and the dynamical exponent $z$ (which has the value $z=2$), obtaining
$p=1+2\alpha/z$ and $z_T=2/p$.
","[{""version"":""v1"",""created"":""Wed, 30 Jun 1999 17:02:06 GMT""},{""version"":""v2"",""created"":""Mon, 13 Mar 2000 18:46:07 GMT""}]","2009-10-31"
"cond-mat/9906455","J. Ricardo G. Mendon\c{c}a","J. Ricardo G. de Mendon\c{c}a (UFSCar, Brazil)","Precise Critical Exponents for the Basic Contact Process","LaTeX 2.09, 9 pages, 1 figure","J. Phys. A: Math. Gen. 32, L467-L473 (1999)","10.1088/0305-4470/32/44/102",,"cond-mat.stat-mech","http://arxiv.org/licenses/nonexclusive-distrib/1.0/","  We calculated some of the critical exponents of the directed percolation
universality class through exact numerical diagonalisations of the master
operator of the one-dimensional basic contact process. Perusal of the power
method together with finite-size scaling allowed us to achieve a high degree of
accuracy in our estimates with relatively little computational effort. A simple
reasoning leading to the appropriate choice of the microscopic time scale for
time-dependent simulations of Markov chains within the so called quantum chain
formulation is discussed. Our approach is applicable to any stochastic process
with a finite number of absorbing states.
","[{""version"":""v1"",""created"":""Wed, 30 Jun 1999 21:14:41 GMT""},{""version"":""v2"",""created"":""Mon, 5 Jul 1999 14:27:03 GMT""},{""version"":""v3"",""created"":""Thu, 21 Oct 1999 19:05:30 GMT""},{""version"":""v4"",""created"":""Sun, 22 May 2011 16:16:47 GMT""}]","2011-05-24"
"cond-mat/9906456","Thom Mason","B. Lake (Oak Ridge), G. Aeppli (NEC Research), T.E. Mason (Oak Ridge),
  A. Schroder (University of Karlsruhe), D.F. McMorrow (Riso National Lab), K.
  Lefmann (Riso National Lab), M. Isshiki (University of Toyko), M. Nohara
  (University of Toyko), H. Takagi (University of Toyko), S.M. Hayden
  (University of Bristol)","Spin gap and magnetic coherence in a clean high-T_c superconductor","RevTeX,13 pages, 4 postscript figures, to Appear in Nature, July 1,
  1999",,"10.1038/21840",,"cond-mat.str-el cond-mat.supr-con",,"  A notable aspect of high-temperature superconductivity in the copper oxides
is the unconventional nature of the underlying paired-electron state. A direct
manifestation of the unconventional state is a pairing energy - that is, the
energy required to remove one electron from the superconductor - that varies
(between zero and a maximum value) as a function of momentum or wavevector: the
pairing energy for conventional superconductors is wavevector-independent. The
wavefunction describing the superconducting state will include not only the
pairing of charges, but also of the spins of the paired charges. Each pair is
usually in the form of a spin singlet, so there will also be a pairing energy
associated with transforming the spin singlet into the higher energy spin
triplet form without necessarily unbinding the charges. Here we use inelastic
neutron scattering to determine the wavevector-dependence of spin pairing in
La_{2-x}Sr_xCuO_4, the simplest high-temperature superconductor. We find that
the spin pairing energy (or 'spin gap') is wavevector independent, even though
superconductivity significantly alters the wavevector dependence of the spin
fluctuations at higher energies.
","[{""version"":""v1"",""created"":""Wed, 30 Jun 1999 21:30:44 GMT""}]","2009-10-31"
"cond-mat/9907001","Yoshifumi Morita","Y. Morita and Y. Hatsugai (Dept.of Applied Physics, Univ. of Tokyo)","Plateaux Transitions in the Pairing Model:Topology and Selection Rule","8 pages with 2 postscript figures, RevTeX",,"10.1103/PhysRevB.62.99",,"cond-mat.mes-hall",,"  Based on the two-dimensional lattice fermion model, we discuss transitions
between different pairing states. Each phase is labeled by an integer which is
a topological invariant and characterized by vortices of the Bloch
wavefunction. The transitions between phases with different integers obey a
selection rule. Basic properties of the edge states are revealed. They reflect
the topological character of the bulk. Transitions driven by randomness are
also discussed numerically.
","[{""version"":""v1"",""created"":""Thu, 1 Jul 1999 05:54:40 GMT""}]","2009-10-31"
"cond-mat/9907003","K. L. Sebastian","K.L. Sebastian (Indian Institute of Science, Bangalore)","Kink motion in the Kramers problem for a chain molecule","4 pages, 1 figure","Phys. Rev. E, 61 (2000) 3245","10.1103/PhysRevE.61.3245",,"cond-mat.soft nlin.PS patt-sol",,"  We consider the generalization of the Kramers escape over a barrier problem
to the case of a long chain molecule. It involves the motion of chain molecule
of N segments across a region where the free energy per segment is higher, so
that it has to cross a barrier. We use the Rouse model and find that the free
energy of activation has a square root dependence on the temperature leading to
a non-Arrhenius form for the rate. We also show that there is a special time
dependent solution of the model, which corresponds to a kink in the chain,
confined to the region of the barrier. The polymer goes from one side to the
other by the motion of the kink in the reverse direction. If there is no free
energy difference between the two sides of the barrier, then the kink moves by
diffusion and the time of crossing t_{cross}~ N^2/T^{3/2}. If there is a free
energy difference, then the kink moves with a non-zero velocity from the lower
free energy side to the otherleading to t_{cross} ~ N/sqrt{T}.
","[{""version"":""v1"",""created"":""Thu, 1 Jul 1999 13:30:55 GMT""}]","2009-10-31"
"cond-mat/9907004","Claudio Grimaldi","C. Grimaldi","Zeeman response of d-wave superconductors: Born approximation for
  impurity and spin-orbit scattering potentials","19 pages, 6 eps figures, submitted to Physica C","J. Phys.: Cond. Matter vol.12, p.1329 (2000)","10.1088/0953-8984/12/7/316",,"cond-mat.supr-con",,"  The effects of impurity and spin-orbit scattering potentials can strongly
affect the Zeeman response of a d-wave superconductor. Here, both the phase
diagram and the quasiparticle density of states are calculated within the Born
approximation and it is found that the spin-orbit interaction influences in a
qualitatively different way the Zeeman response of d-wave and s-wave
superconductors.
","[{""version"":""v1"",""created"":""Thu, 1 Jul 1999 08:57:43 GMT""}]","2009-10-31"
"cond-mat/9907005","Kabanov V. V.","D.Mihailovic, V.V.Kabanov, K.Zagar and J.Demsar","Distinct charge and spin gaps in underdoped YBa2Cu3O7-x","4 pages and 3 postscript figures, to be published in Phys. Rev.B
  (Rapid. Comm), Figure 1 is corrected","Phys. Rev. B 60, R6995 (1999)","10.1103/PhysRevB.60.R6995",,"cond-mat.supr-con cond-mat.str-el",,"  A systamatic quantitative comparison of ''pseudogap'' values obtained from
the analysis of charge and spin excitation spectroscopies in underdoped
YBa2Cu3O7-x using a temperature-independent gap shows two distinct excitations,
one visible in spin-flip spectroscopies like NMR and spin polarized neutron
scattering, and the other in charge excitation spectoscopies like single
particle tunneling and time-resolved quasiparticle relaxation. Both appear to
decrease with doping x approximately as 1/x and are T-independent, existing
above and below Tc. We suggest that the charge excitation can be attributed to
a pair-breaking local gap, while the spin excitation can be explained by an
intra-gap local triplet state.
","[{""version"":""v1"",""created"":""Thu, 1 Jul 1999 15:13:41 GMT""},{""version"":""v2"",""created"":""Tue, 13 Jul 1999 07:46:25 GMT""}]","2008-11-19"
"cond-mat/9907006","Akito Kobayashi","Akito Kobayashi, Atsushi Tsuruta, Tamifusa Matsuura and Yoshihiro
  Kuroda","Pseudogap Induced by Superconducting Fluctuation in the d-p Model","4 pages, 4 figures, to appear in J. Phys. Soc. Jpn. Vol. 68 No. 8",,"10.1143/JPSJ.68.2506",,"cond-mat.supr-con cond-mat.str-el",,"  Using the d-p model, we demonstrate that the pseudogap, which is induced by
the superconducting fluctuation, plays key roles in the determination of the
phase diagram observed in high-Tc superconducting materials. We take the
pairing interaction mediated by the spin fluctuation and calculate the
superconducting transition temperature Tc, the NMR relaxation rate 1/T1 and the
single-particle spectrum by treating both the superconducting fluctuation and
spin fluctuation in a consistent fashion. As temperature decreases, 1/T1T
increases at high temperatures, and it reaches a maximum followed by a sharp
drop in the underdoped region, due to the evolution of the pseudogap in the
single-particle spectrum. The evolution is also consistent with those of ARPES
experiments.
","[{""version"":""v1"",""created"":""Thu, 1 Jul 1999 10:14:58 GMT""}]","2009-10-31"
"cond-mat/9907007","luis Brey","Luis Brey","Effect of the Equivalence Between Topological and Electric Charge on the
  Magnetization of the Hall Ferromagnet","4 pages. Submitted to Phys.Rev.B",,"10.1103/PhysRevB.61.7257",,"cond-mat.mes-hall",,"  The dependence on temperature of the spin magnetization of a two-dimensional
electron gas at filling factor unity is studied. Using classical Monte Carlo
simulations we analyze the effect that the equivalence between topological and
electrical charge has on the the behavior of the magnetization. We find that at
intermediate temperatures the spin polarization increases in a thirty per cent
due to the Hartree interaction between charge fluctuations.
","[{""version"":""v1"",""created"":""Thu, 1 Jul 1999 10:57:51 GMT""}]","2009-10-31"
"cond-mat/9907008","Yoichi Ando","Yoichi Ando, N. Miyamoto, Kouji Segawa (CRIEPI), T. Kawata, and I.
  Terasaki (Waseda Univ.)","Specific-heat evidence for strong electron correlations in the
  thermoelectric material (Na,Ca)Co_{2}O_{4}","5 pages, 4 figures, accepted for publication in Phys. Rev. B","Phys. Rev. B 60, 10580-10583 (1999).","10.1103/PhysRevB.60.10580",,"cond-mat.str-el",,"  The specific heat of (Na,Ca)Co_{2}O_{4} is measured at low-temperatures to
determine the magnitude of the electronic specific-heat coefficient \gamma, in
an attempt to gain an insight into the origin of the unusually large
thermoelectric power of this compound. It is found that \gamma is as large as
48 mJ/molK^2, which is an order of magnitude larger than \gamma of simple
metals. This indicates that (Na,Ca)Co_{2}O_{4} is a strongly-correlated
electron system, where the strong correlation probably comes from the
low-dimensionality and the frustrated spin structure. We discuss how the large
thermopower and its dependence on Ca doping can be understood with the strong
electron correlations.
","[{""version"":""v1"",""created"":""Thu, 1 Jul 1999 11:59:07 GMT""}]","2009-10-31"
"cond-mat/9907009","Takahiko Miyakawa","T.Miyakawa, K.Oda, T.Suzuki and H.Yabu","Static Properties of Trapped Bose-Fermi Mixed Condensate of Alkali Atoms","8 pages,5 figures",,"10.1143/JPSJ.69.2779",,"cond-mat",,"  Static properties of a bose-fermi mixture of trapped potassium atoms are
studied in terms of coupled Gross-Pitaevskii and Thomas-Fermi equations for
both repulsive and attractive bose-fermi interatomic potentials. Qualitative
estimates are given for solutions of the coupled equations, and the parameter
regions are obtained analytically for the boson-density profile change and for
the boson/fermion phase separation. Especially, the parameter ratio $R_{int}$
is found that discriminates the region of the large boson-profile change. These
estimates are applied for numerical results for the potassium atoms and checked
their consistency. It is suggested that a small fraction of fermions could be
trapped without an external potential for the system with an attractive
boson-fermion interaction.
","[{""version"":""v1"",""created"":""Thu, 1 Jul 1999 11:50:15 GMT""},{""version"":""v2"",""created"":""Thu, 3 Feb 2000 04:17:46 GMT""}]","2009-10-31"
