"cond-mat/9907010","Nicola Manini","Nicola Manini and Paolo De Los Rios","Berry Phase and Ground State Symmetry in H x h Dynamical Jahn-Teller
  Systems","RevTex, 4 pages, 3 figures","Phys. Rev. B 62, 29 (2000)","10.1103/PhysRevB.62.29",,"cond-mat.mtrl-sci",,"  Due to the ubiquitous presence of a Berry phase, in most cases of dynamical
Jahn-Teller systems the symmetry of the vibronic ground state is the same as
that of the original degenerate electronic state. As a single exception, the
linear H x h icosahedral model, relevant to the physics of C60 cations, is
determined by an additional free parameter, which can be continuously tuned to
eliminate the Berry phase from the low-energy closed paths: accordingly, the
ground state changes to a totally-symmetric nondegenerate state.
","[{""version"":""v1"",""created"":""Thu, 1 Jul 1999 13:11:31 GMT""}]","2009-10-31"
"cond-mat/9907011","V. G. Benza","G.C.Ferrario, V.G.Benza","Hopping with time-dependent disorder","13 pages 6 figures",,,,"cond-mat.stat-mech",,"  We determine the propagation properties of a quantum particle in a
d-dimensional lattice with hopping disorder, delta-correlated in time. The
system is delocalized: the averaged transition probability shows a diffusive
behavior. Then, superimposed to the disorder, we consider a bias favouring the
motion with a given orientation, as in the dynamics of flux lines in
superconductors. The result is an effective Liouvillian for the density matrix,
which is characterized by competition between single particle and pair hopping.
In this case the transition probability is determined in terms of excitonic
motion, each exciton being extended along the bias direction and characterized
by a nontrivial dispersion law.
","[{""version"":""v1"",""created"":""Thu, 1 Jul 1999 14:00:46 GMT""}]","2007-05-23"
"cond-mat/9907012","Twan van Noije","T.P.C. van Noije and M.H. Ernst (Universiteit Utrecht)","Cahn-Hilliard Theory for Unstable Granular Flows","25 pages, including 11 figures",,"10.1103/PhysRevE.61.1765",,"cond-mat.stat-mech",,"  A Cahn-Hilliard-type theory for hydrodynamic fluctuations is proposed that
gives a quantitative description of the slowly evolving spatial correlations
and structures in density and flow fields in the early stages of evolution of
freely cooling granular fluids. Two mechanisms for pattern selection and
structure formation are identified: unstable modes leading to density
clustering (compare spinodal decomposition), and selective noise reduction
(compare peneplanation in structural geology) leading to vortex structures. As
time increases, the structure factor for the density field develops a maximum,
which shifts to smaller wave numbers. This corresponds to an approximately
diffusively growing length scale for density clusters. The spatial velocity
correlations exhibit algebraic decay $\sim r^{-d}$ on intermediate length
scales. The theoretical predictions for spatial correlation functions and
structure factors agree well with molecular dynamics simulations of a system of
inelastic hard disks.
","[{""version"":""v1"",""created"":""Thu, 1 Jul 1999 14:01:39 GMT""}]","2009-10-31"
"cond-mat/9907013","Joerg C. Lemm","J. C. Lemm, J. Uhlig, A. Weiguny (Institut fuer Theoretische Physik I,
  Universitaet Muenster)","A Bayesian Approach to Inverse Quantum Statistics","4 pages, 6 figures, revtex","Phys. Rev. Lett 84, 2068 (2000)","10.1103/PhysRevLett.84.2068","MS-TPI-99-6","cond-mat.stat-mech cond-mat.dis-nn physics.data-an quant-ph",,"  A nonparametric Bayesian approach is developed to determine quantum
potentials from empirical data for quantum systems at finite temperature. The
approach combines the likelihood model of quantum mechanics with a priori
information over potentials implemented in form of stochastic processes. Its
specific advantages are the possibilities to deal with heterogeneous data and
to express a priori information explicitly, i.e., directly in terms of the
potential of interest. A numerical solution in maximum a posteriori
approximation was feasible for one--dimensional problems. Using correct a
priori information turned out to be essential.
","[{""version"":""v1"",""created"":""Thu, 1 Jul 1999 14:09:15 GMT""}]","2009-10-31"
"cond-mat/9907014","Cicuta G. M.","G.M. Cicuta, M.Contedini, L.Molinari","Non-Hermitian tridiagonal random matrices and returns to the origin of a
  random walk","14 pages including 5 figures",,,,"cond-mat.stat-mech",,"  We study a class of tridiagonal matrix models, the ""q-roots of unity"" models,
which includes the sign ($q=2$) and the clock ($q=\infty$) models by Feinberg
and Zee. We find that the eigenvalue densities are bounded by and have the
symmetries of the regular polygon with $2 q$ sides, in the complex plane.
Furthermore the averaged traces of $M^k$ are integers that count closed random
walks on the line, such that each site is visited a number of times multiple of
$q$. We obtain an explicit evaluation for them.
","[{""version"":""v1"",""created"":""Thu, 1 Jul 1999 14:34:29 GMT""}]","2019-08-15"
"cs/9906034","Davide Turcato","Davide Turcato, Paul McFetridge, Fred Popowich, Janine Toole","A Unified Example-Based and Lexicalist Approach to Machine Translation","11 pages, to be presented at the 8th International Conference on
  Theoretical and Methodological Issues in Machine Translation (TMI-99)",,,,"cs.CL",,"  We present an approach to Machine Translation that combines the ideas and
methodologies of the Example-Based and Lexicalist theoretical frameworks. The
approach has been implemented in a multilingual Machine Translation system.
","[{""version"":""v1"",""created"":""Wed, 30 Jun 1999 23:06:09 GMT""}]","2007-05-23"
"gr-qc/9906123","Sergei A. Klioner","Sergei A. Klioner and Michael H. Soffel","Relativistic Celestial Mechanics with PPN Parameters","71 pages","Phys.Rev.D62:024019,2000","10.1103/PhysRevD.62.024019",,"gr-qc",,"  Starting from the global parametrized post-Newtonian (PPN) reference system
with two PPN parameters $\gamma$ and $\beta$ we consider a space-bounded
subsystem of matter and construct a local reference system for that subsystem
in which the influence of external masses reduces to tidal effects. Both the
metric tensor of the local PPN reference system in the first post-Newtonian
approximation as well as the coordinate transformations between the global PPN
reference system and the local one are constructed in explicit form. The terms
proportional to $\eta=4\beta-\gamma-3$ reflecting a violation of the
equivalence principle are discussed in detail. We suggest an empirical
definition of multipole moments which are intended to play the same role in PPN
celestial mechanics as the Blanchet-Damour moments in General Relativity.
Starting with the metric tensor in the local PPN reference system we derive
translational equations of motion of a test particle in that system. The
translational and rotational equations of motion for center of mass and spin of
each of $N$ extended massive bodies possessing arbitrary multipole structure
are derived. As an application of the general equations of motion a
monopole-spin dipole model is considered and the known PPN equations of motion
of mass monopoles with spins are rederived.
","[{""version"":""v1"",""created"":""Wed, 30 Jun 1999 17:05:54 GMT""}]","2011-07-19"
"gr-qc/9906124","Carsten Gundlach","C. Gundlach","Critical gravitational collapse of a perfect fluid: nonspherical
  perturbations","RevTex, 29 pages, 14 figures. Completely rewritten for resubmission
  to Phys. Rev. D","Phys.Rev. D65 (2002) 084021","10.1103/PhysRevD.65.084021",,"gr-qc",,"  Continuously self-similar (CSS) solutions for the gravitational collapse of a
spherically symmetric perfect fluid, with the equation of state p=kappa rho,
with 0<kappa<1 a constant, are constructed numerically and their linear
perturbations, both spherical and nonspherical, are investigated. The l=1 axial
perturbations admit an analytical treatment. All others are studied
numerically. For intermediate equations of state, with 1/9<kappa<0.49, the CSS
solution has one spherical growing mode, but no nonspherical growing modes.
That suggests that it is a critical solution even in (slightly) nonspherical
collapse. For this range of kappa we predict the critical exponent for the
black hole angular momentum to be 5(1+3kappa)/3(1+kappa) times the critical
exponent for the black hole mass. For kappa=1/3 this gives an angular momentum
critical exponent of mu=0.898, correcting a previous result. For stiff
equations of state, 0.49<kappa<1, the CSS solution has one spherical and
several nonspherical growing modes. For soft equations of state, 0<kappa<1/9,
the CSS solution has 1+3 growing modes: a spherical one, and an l=1 axial mode
(with m=-1,0,1).
","[{""version"":""v1"",""created"":""Wed, 30 Jun 1999 19:44:19 GMT""},{""version"":""v2"",""created"":""Tue, 9 Oct 2001 09:55:10 GMT""}]","2009-10-31"
"gr-qc/9906125","Alejandro Jakubi","Luis P. Chimento, Alejandro S. Jakubi and Diego Pavon","Inhomogeneous cosmologies with Q-matter and varying $\Lambda$","11 pages, Revtex. To be published in Physical Review D","Phys.Rev. D60 (1999) 103501","10.1103/PhysRevD.60.103501",,"gr-qc astro-ph",,"  Starting from the inhomogeneous shear--free Nariai metric we show, by solving
the Einstein--Klein--Gordon field equations, how a self--interacting scalar
field plus a material fluid, a variable cosmological term and a heat flux can
drive the universe to its currently observed state of homogeneous accelerated
expansion. A quintessence scenario where power-law inflation takes place for a
string-motivated potential in the late--time dominated field regime is
proposed.
","[{""version"":""v1"",""created"":""Wed, 30 Jun 1999 23:04:11 GMT""},{""version"":""v2"",""created"":""Thu, 1 Jul 1999 00:35:33 GMT""}]","2009-10-31"
"gr-qc/9906126","Steven Carlip","S. Carlip","Entropy from Conformal Field Theory at Killing Horizons","26 pages, LaTeX; corrected typo and minor changes in Misner string
  section","Class.Quant.Grav.16:3327-3348,1999","10.1088/0264-9381/16/10/322","UCD-99-12, NSF-ITP-99-069","gr-qc hep-th",,"  On a manifold with boundary, the constraint algebra of general relativity may
acquire a central extension, which can be computed using covariant phase space
techniques. When the boundary is a (local) Killing horizon, a natural set of
boundary conditions leads to a Virasoro subalgebra with a calculable central
charge. Conformal field theory methods may then be used to determine the
density of states at the boundary. I consider a number of cases---black holes,
Rindler space, de Sitter space, Taub-NUT and Taub-Bolt spaces, and dilaton
gravity---and show that the resulting density of states yields the expected
Bekenstein-Hawking entropy. The statistical mechanics of black hole entropy may
thus be fixed by symmetry arguments, independent of details of quantum gravity.
","[{""version"":""v1"",""created"":""Wed, 30 Jun 1999 23:53:02 GMT""},{""version"":""v2"",""created"":""Mon, 9 Aug 1999 23:24:59 GMT""}]","2010-04-28"
"gr-qc/9907001","Shahar Hod","Shahar Hod","Black-Hole Polarization and Cosmic Censorship","10 pages","Phys.Rev. D60 (1999) 104031","10.1103/PhysRevD.60.104031",,"gr-qc",,"  The destruction of the black-hole event horizon is ruled out by both cosmic
censorship and the generalized second law of thermodynamics. We test the
consistency of this prediction in a (more) `dangerous' version of the gedanken
experiment suggested by Bekenstein and Rosenzweig. A U(1)-charged particle is
lowered {\it slowly} into a near extremal black hole which is not endowed with
a U(1) gauge field. The energy delivered to the black hole can be {\it
red-shifted} by letting the assimilation point approach the black-hole horizon.
At first sight, therefore, the particle is not hindered from entering the black
hole and removing its horizon. However, we show that this dangerous situation
is excluded by a combination of {\it two} factors not considered in former
gedanken experiments: the effect of the spacetime curvature on the
electrostatic {\it self-interaction} of the charged system (the black-hole
polarization), and the {\it finite} size of the charged body.
","[{""version"":""v1"",""created"":""Thu, 1 Jul 1999 12:27:06 GMT""},{""version"":""v2"",""created"":""Tue, 2 Nov 1999 08:29:08 GMT""}]","2009-10-31"
"hep-ex/9906044","Laura Baudis","L. Baudis and H.V. Klapdor-Kleingrothaus","Detection of low energy solar neutrinos with HPGermanium","5 pages (latex) including 1 postscript figure and one table. to
  appear in Eur. Phys. J. A","Eur.Phys.J.A5:441-443,1999","10.1007/s100500050307",,"hep-ex",,"  The potential of the GENIUS proposal to measure the spectrum of low energy
solar neutrinos in real time is studied. The detection reaction is elastic
neutrino-electron scattering. The energy resolution for detecting the recoil
electrons is about 0.3 %, the energy threshold is a few keV. The expected
number of events for a target of one ton of natural germanium is 3.6 events/day
for pp-neutrinos and 1.3 events/day for 7Be-neutrinos, calculated in the
standard solar model (BP98). It should be feasible to achieve a background low
enough to measure the low energy solar neutrino spectrum.
","[{""version"":""v1"",""created"":""Wed, 30 Jun 1999 16:00:36 GMT""}]","2014-11-17"
"hep-ex/9906045","David A. Sanders","Fermilab Experiment E791 Collaboration: E.M. Aitala, et al","Search for Rare and Forbidden Dilepton Decays of the D+, Ds, and D0
  Charmed Mesons","12 pages, 3 figures, LaTeX, elsart.cls, epsf.sty, amsmath.sty
  Submitted to Physics Letters B","Phys.Lett.B462:401-409,1999","10.1016/S0370-2693(99)00902-8","FERMILAB-Pub-99/183-E, UMS/HEP/99-020","hep-ex",,"  We report the results of a search for flavor-changing neutral current,
lepton-flavor violating, and lepton-number violating decays of D+, Ds, and D0
mesons (and their antiparticles) into modes containing muons and electrons.
Using data from Fermilab charm hadroproduction experiment E791, we examine the
pi,l,l and K,l,l decay modes of D+ and Ds and the l+l- decay modes of D0. No
evidence for any of these decays is found. Therefore, we present
branching-fraction upper limits at 90% confidence level for the 24 decay modes
examined. Eight of these modes have no previously reported limits, and fourteen
are reported with significant improvements over previously published results.
","[{""version"":""v1"",""created"":""Wed, 30 Jun 1999 18:06:20 GMT""}]","2008-11-26"
"hep-ex/9907001","Ernesto Migliore","Ernesto Migliore (CERN)","Heavy quark asymmetries with DELPHI","7 pages, RevTeX, fonts changed in 2 eps files",,,,"hep-ex",,"  The measurements of the forward-backward asymmetry in Z -> c cbar and Z -> b
bbar decays are among the most precise determinations of sin^2(theta)_W. In
this paper the results obtained by the DELPHI experiment at LEP with three
different analyses are reviewed together with the impact of the combined LEP
result on the global Electroweak fit.
","[{""version"":""v1"",""created"":""Thu, 1 Jul 1999 15:39:57 GMT""},{""version"":""v2"",""created"":""Tue, 6 Jul 1999 08:39:50 GMT""}]","2009-09-25"
"hep-ph/9906551","Deog Ki Hong","Deog Ki Hong, Mannque Rho, and Ismail Zahed","Qualitons At High Density","13 pages, no figure, LaTeX. slight modifications in the manuscript","Phys.Lett. B468 (1999) 261-269","10.1016/S0370-2693(99)01227-7","KIAS-P99046, HUTP-99/A036","hep-ph hep-th nucl-th",,"  In the color-flavor-locked (CFL) phase of the QCD superconductor we show that
baryons behave as qualitons (called ""superqualitons"") with quantum numbers
$B=(1 {\rm mod} 2)/3$, S=1/2 and Y=B. An intriguing possibility implied by this
identification is that light baryonic modes in the form of superqualitons could
be excited below the (color) superconducting gap in the CFL phase, a novel
phenomenon foreign to normal superconductors.
","[{""version"":""v1"",""created"":""Wed, 30 Jun 1999 20:39:15 GMT""},{""version"":""v2"",""created"":""Sat, 7 Aug 1999 02:26:22 GMT""}]","2009-10-31"
"hep-ph/9906552","Jiri Chyla","Jiri Chyla and Marek Tasevsky","Partonic structure of the virtual photon","7 pages, Latex, 7 encapsulated eps figures","Nucl.Phys.Proc.Suppl. 82 (2000) 49-55","10.1016/S0920-5632(00)00131-6","Talk by J. Chyla at the Symposium PHOTON '99, Freiburg, May 1999","hep-ph",,"  Interactions of virtual photons are analyzed in terms of their parton
distribution functions. It is shown that the concept of parton distribution
functions is phenomenologically very useful even for highly virtual photonds
involved in hard collisions. The role of the longitudinal photons for proper
interpretation of the data on jet cross--sections in the region of moderate
photon virtualities accessible at HERA is explored.
","[{""version"":""v1"",""created"":""Wed, 30 Jun 1999 16:18:44 GMT""}]","2009-10-31"
"hep-ph/9906553","Qiuyu Liu","Q.Y. Liu (ICTP, Trieste)","Uncertainty of the Solar Neutrino Energy Spectrum","7 pages, proceeding latex file, Improvement of submitted version
  (April 15) to proceeding of 17 International Workshop on Weak Interactions
  and Neutrinos, South Africa, January 24-30, 1999. One figure added up",,,,"hep-ph astro-ph hep-ex",,"  The solar neutrino spectrum measured by the Super-Kamiokande shows an excess
in high energy bins, which may be explained by vacuum oscillation solution or
$hep$ neutrino effect. Here we reconsider an uncertainty of the data caused by
the tail of the energy resolution function. Events observed at energy higher
than 13.5 MeV are induced by the tail of the resolution. At Super-Kamiokande
precision level this uncertainty is no more than few percent within a Gaussian
tail. But a power-law decay tail at 3 $\sigma$ results considerable excesses in
these bins, which may be another possible explanation of the anomaly in
708d(825d) data.
","[{""version"":""v1"",""created"":""Wed, 30 Jun 1999 18:50:48 GMT""}]","2009-09-25"
"hep-ph/9906554","Claudio Destri","C. Destri and E. Manfredini","Out-of-equilibrium dynamics of \phi^4 QFT in finite volume","38 pages, 10 figures, LaTeX & RevTeX. Version submitted to PRD with
  corrected typos",,,"IFUM 646/FT-99 Bicocca-FT-99-18","hep-ph hep-th",,"  The $\lambda \phi^4$ model in a finite volume is studied in the infinite $N$
limit and within a non-gaussian Hartree-Fock approximation both at equilibrium
and out of equilibrium, with particular attention to certain fundamental
features of the broken symmetry phase. The numerical solution of the dynamical
evolution equations show that the zero-mode quantum fluctuations cannot grow
macroscopically large starting from microscopic initial conditions. Thus we
conclude that there is no evidence for a dynamical Bose-Einstein condensation.
On the other hand, out of equilibrium the long-wavelength fluctuations do scale
with the linear size of the system, signalling dynamical infrared properties
quite different from the equilibrium ones characteristic of the same
approximation schemes. This result suggests the cause, and the possible remedy,
of some unlikely features of the application to out--of--equilibrium dynamics
of the standard HF factorization scheme, which coincides with the gaussian
restriction of our Hartree--Fock approximation.
","[{""version"":""v1"",""created"":""Wed, 30 Jun 1999 18:54:27 GMT""},{""version"":""v2"",""created"":""Thu, 1 Jul 1999 11:02:27 GMT""},{""version"":""v3"",""created"":""Tue, 20 Jul 1999 10:05:21 GMT""}]","2007-05-23"
"hep-ph/9906555","Francesco Sannino","T. Appelquist, P.S. Rodrigues da Silva, F. Sannino (Yale University)","Enhanced Global Symmetries and The Chiral Phase Transition","Added references. 20 pages, RevTex format. To Appear in Phys. Rev. D","Phys.Rev.D60:116007,1999","10.1103/PhysRevD.60.116007","YCTP-P14-99","hep-ph hep-th",,"  We examine the possibility that the physical spectrum of a vector-like gauge
field theory exhibits an enhanced global symmetry near a chiral phase
transition. A transition from the Goldstone phase to the symmetric phase is
expected as the number of fermions N_f is increased to some critical value.
Various investigations have suggested that a parity-doubled spectrum develops
as the critical value is approached. Using an effective Lagrangian as a guide,
we note that parity doubling is associated with the appearance of an enhanced
global symmetry in the spectrum of the theory. The enhanced symmetry would
develop as the spectrum splits into two sectors, with the first exhibiting the
usual pattern of a spontaneously broken chiral symmetry, and the second
exhibiting an additional, unbroken symmetry and parity doubling. The first
sector includes the Goldstone bosons and other states such as massive scalar
partners. The second includes a parity-degenerate vector and axial vector along
with other possible parity partners. We note that if such a near-critical
theory describes symmetry breaking in the electroweak theory, the additional
symmetry suppresses the contribution of the parity doubled sector to the S
parameter.
","[{""version"":""v1"",""created"":""Wed, 30 Jun 1999 19:38:12 GMT""},{""version"":""v2"",""created"":""Tue, 21 Sep 1999 22:07:36 GMT""}]","2008-11-26"
"hep-ph/9906556","Aaron K. Grant","Aaron K. Grant and Zurab Kakushadze","Higgs as a Slepton","7 pages, no figures, reference added","Phys.Lett. B465 (1999) 108-112","10.1016/S0370-2693(99)01060-6","HUTP-99/A020, NUB 3197, EFI-99-12","hep-ph hep-th",,"  In theories with TeV scale quantum gravity there is a logical possibility
where the electroweak Higgs can be a fourth generation slepton. Despite maximal
supersymmetry breaking such a scenario turns out to be tightly constrained, and
might be testable already at present collider experiments. Also, a light Higgs
is no longer a prediction of supersymmetry.
","[{""version"":""v1"",""created"":""Wed, 30 Jun 1999 20:08:46 GMT""},{""version"":""v2"",""created"":""Tue, 6 Jul 1999 22:08:55 GMT""}]","2009-10-31"
"hep-ph/9907202","Yue-Liang Wu","Y.A. Yan, Y.L. Wu and W.Y. Wang (ITP)","Inclusive Decays of Bottom Hadrons in New Formulation of Heavy Quark
  Effective Field Theory","20 pages, RevTex, 8 figures, 3 tables, revised version with `dressed
  heavy quark' being addressed, to be published in Int. J. Mod. Phys. A","Int.J.Mod.Phys.A15:2735-2770,2000","10.1142/S0217751X00001026","AS-ITP-99-07","hep-ph",,"  We apply the new formulation of heavy quark effective field theory (HQEFT) to
the inclusive decays of bottom hadrons. The long-term ambiguity of using heavy
quark mass or heavy hadron mass for inclusive decays is clarified within the
framework of the new formulation of HQEFT. The $1/m_b$ order corrections are
absent and contributions from $1/m_b^2$ terms are calculated in detail. This
enables us to reliably extract the important CKM matrix element $|V_{cb}|$ from
the inclusive semileptonic decay rates. The resulting lifetime ratios
$\tau(B^0_s)/\tau(B^0)$ and $\tau(\Lambda_b)/\tau(B^0)$ are found to well agree
with the experimental data. We also calculate in detail the inclusive
semileptonic branching ratios and the ratios of the $\tau$ and $\beta$ decay
rates as well as the charm countings in the $B^0$, $B^0_s$ and $\Lambda_b$
systems. For $B^0$ decays, all the observables are found to be consistent with
the experimental data. More precise data for the $B^0$ decays and further
experimental measurements for the $B^0_s$ and $\Lambda_b$ systems will be very
useful for testing the framework of new formulation of HQEFT at the level of
higher order corrections.
","[{""version"":""v1"",""created"":""Thu, 1 Jul 1999 03:49:39 GMT""},{""version"":""v2"",""created"":""Thu, 17 Feb 2000 02:59:29 GMT""}]","2016-12-28"
"hep-ph/9907203","Werner Rodejohann","M. Flanz, W. Rodejohann, K. Zuber (Dortmund University)","Trimuon production in \nu N-scattering as a probe of massive neutrinos","19 pages, 7 figures, revised version to appear in Eur. Phys. J","Eur.Phys.J.C16:453-460,2000","10.1007/s100520000422","DO-TH 99/13","hep-ph",,"  The lepton-number violating process \nu_\mu N \to \mu^- \mu^+ \mu^+ X is
studied for the first time in connection with Majorana neutrino masses of the
second generation. The sensitivity for light and heavy Majorana neutrinos is
investigated. The ratio with respect to the standard model charged current
process is improved by some orders of magnitude if compared to previously
discussed Majorana induced \Delta L_{\mu} = 2 processes. Non-observation of
this process in previous experiments allows to demand the effective mass to be
< m_{\mu \mu} > \ls 10^4 GeV, being more stringent than previously discussed
direct bounds, however still unnaturally high. Therefore, in the forseeable
future, indirect bounds on effective masses other than m_{ee} will be more
stringent.
","[{""version"":""v1"",""created"":""Thu, 1 Jul 1999 08:50:12 GMT""},{""version"":""v2"",""created"":""Mon, 26 Jun 2000 13:41:51 GMT""}]","2009-01-07"
