"adap-org/9907001","Bartolo Luque Serrano","Bartolo Luque and Ricard V. Sole","Lyapunov Exponents in Random Boolean Networks","16 pages, 5 eps-figures included, article submitted to Physica A",,"10.1016/S0378-4371(00)00184-9",,"adap-org nlin.AO",,"  A new order parameter approximation to Random Boolean Networks (RBN) is
introduced, based on the concept of Boolean derivative. A statistical argument
involving an annealed approximation is used, allowing to measure the order
parameter in terms of the statistical properties of a random matrix. Using the
same formalism, a Lyapunov exponent is calculated, allowing to provide the
onset of damage spreading through the network and how sensitive it is to
minimal perturbations. Finally, the Lyapunov exponents are obtained by means of
different approximations: through distance method and a discrete variant of the
Wolf's method for continuous systems.
","[{""version"":""v1"",""created"":""Wed, 30 Jun 1999 18:46:35 GMT""}]","2009-10-31"
"astro-ph/9906494","Blinnikov S.","E.I.Sorokina (SAI), S.I.Blinnikov (ITEP,MPA), O.S.Bartunov (SAI)","Thermonuclear Burning Regimes and the Use of SNe Ia in Cosmology","20 pages, 5 figures, presented at the conference ""Astronomy at the
  Eve of the New Century"", Puschino, May 17-22, 1999. A few references and a
  table added, typos corrected","Astron.Lett.26:67,2000","10.1134/1.20370",,"astro-ph",,"  The calculations of the light curves of thermonuclear supernovae are carried
out by a method of multi-group radiation hydrodynamics. The effects of spectral
lines and expansion opacity are taken into account. The predictions for UBVI
fluxes are given. The values of rise time for B and V bands found in our
calculations are in good agreement with the observed values. We explain why our
results for the rise time have more solid physical justification than those
obtained by other authors. It is shown that small variations in the chemical
composition of the ejecta, produced in the explosions with different regimes of
nuclear burning, can influence drastically the light curve decline in the B
band and, to a lesser extent, in the V band. We argue that recent results on
positive cosmological constant Lambda, found from the high redshift supernova
observations, could be wrong in the case of possible variations of the
preferred mode of nuclear burning in the earlier Universe.
","[{""version"":""v1"",""created"":""Wed, 30 Jun 1999 19:38:56 GMT""},{""version"":""v2"",""created"":""Sat, 2 Oct 1999 13:51:54 GMT""}]","2009-12-30"
"astro-ph/9906496","David Branch","J. Millard, D. Branch, E. Baron, K. Hatano, A. Fisher (U. of
  Oklahoma), A. Filippenko (UC Berkeley), R. Kirshner, P. Challis (CfA), C.
  Fransson (Stockholm Observatory), N. Panagia (STScI), M. Phillips (CTIO), G.
  Sonneborn (GSFC), N. Suntzeff (CTIO), R. Wagoner (Stanford U.), J. Wheeler
  (U. of Texas)","Direct Analysis of Spectra of the Type Ic Supernova 1994I","18 pages, 12 figures, ApJ, in press",,"10.1086/308108",,"astro-ph",,"  Synthetic spectra generated with the parameterized supernova
synthetic-spectrum code SYNOW are compared to observed photospheric-phase
spectra of the Type Ic supernova 1994I. The observed optical spectra can be
well matched by synthetic spectra that are based on the assumption of spherical
symmetry. We consider the identification of the infrared absorption feature
observed near 10,250 \AA, which previously has been attributed to He I
$\lambda10830$ and regarded as strong evidence that SN 1994I ejected some
helium. We have difficulty accounting for the infrared absorption with He I
alone. It could be a blend of He I and C I lines. Alternatively, we find that
it can be fit by Si I lines without compromising the fit in the optical region.
  In synthetic spectra that match the observed spectra, from 4 days before to
26 days after the time of maximum brightness, the adopted velocity at the
photosphere decreases from 17,500 to 7000 \kms. Simple estimates of the kinetic
energy carried by the ejected mass give values that are near the canonical
supernova energy of $10^{51}$ ergs. The velocities and kinetic energies that we
find for SN 1994I in this way are much lower than those that we find elsewhere
for the peculiar Type Ic SNe 1997ef and 1998bw, which therefore appear to have
been hyper-energetic.
","[{""version"":""v1"",""created"":""Wed, 30 Jun 1999 16:23:39 GMT""}]","2009-10-31"
"astro-ph/9906497","Juan Garcia-Bellido","Juan Garcia-Bellido (Imperial College, London)","The origin of matter and structure in the universe","24 pages, 10 figures, LaTeX, uses rspublic.cls (included). To appear
  in the Special Millenium Issue of the Philosophical Transactions of The Royal
  Society","Phil.Trans.Roy.Soc.Lond. A357 (1999) 3237-3257","10.1098/rsta.1999.0492","IMPERIAL-TP-98/99-57","astro-ph hep-ph",,"  Cosmology is nowadays going through a true revolution in the quantity and
quality of observations that are capable of providing crucial information about
the origin and evolution of the universe. In the first years of the next
millenium we will have, for the first time in the history of cosmology, a
precise knowledge about a handful of parameters that determine our Standard
Cosmological Model. This standard model is based on the inflationary paradigm,
a period of exponential expansion in the early universe responsible for the
large scale homogeneity and flatness of our observable patch of the universe. A
spectrum of density perturbations, seen in the microwave background as
temperature anisotropies, could have been produced during inflation from
quantum fluctuations that were stretched to cosmological size by the expansion,
and later gave rise, via gravitational collapse, to the observed large scale
structure of clusters and superclusters of galaxies. Furthermore, the same
theory predicts that all the matter and radiation in the universe today
originated at the end of inflation from an explosive production of particles
that could also have been the origin of the present baryon asymmetry, before
the universe reached thermal equilibrium at a very large temperature. From
there on, the universe cooled down as it expanded, in the way described by the
standard hot big bang model. With the observations that will soon become
available in the next millenium, we will be able to test the validity of the
inflationary paradigm, and determine with unprecedented accuracy the parameters
of a truly Standard Model of Cosmology.
","[{""version"":""v1"",""created"":""Wed, 30 Jun 1999 17:27:51 GMT""}]","2015-06-24"
"astro-ph/9906498","Martin Bureau","M. Bureau, K. C. Freeman, D. W. Pfitzner and G. R. Meurer","The Shape and Figure Rotation of NGC 2915's Dark Halo","37 pages, including 8 figures and 2 tables (AASTeX, aaspp4.sty).
  Fig.1 and 2 available as jpg. Accepted for publication in The Astronomical
  Journal. Online manuscript with PostScript figures available at:
  http://www.strw.leidenuniv.nl/~bureau/pub_list.html",,"10.1086/301064",,"astro-ph",,"  NGC 2915 is a blue compact dwarf galaxy with a very extended HI disk showing
a short central bar and extended spiral arms, both reaching far beyond the
optical component. We use Tremaine & Weinberg (1984) method to measure the
pattern speed of the bar from HI radio synthesis data. Our measurements yield a
pattern speed of 0.21+/-0.06 km/s/arcsec (8.0+/-2.4 km/s/kpc for D=5.3 Mpc), in
disagreement with the general view that corotation in barred disks lies just
outside the end of the bar, but consistent with recent models of barred
galaxies with dense dark matter halos. Our adopted bar semi-length puts
corotation at more than 1.7 bar radii. The existence of the pattern is also
problematic. Because NGC 2915 is isolated, interactions cannot account for the
structure observed in the HI disk. We also demonstrate that the low observed
disk surface density and the location of the pseudo-rings make it unlikely that
swing amplification or bar-driven spiral arms could explain the bar and spiral
pattern.
  Based on the similarity of the dark matter and HI surface density profiles,
we discuss the possibility of dark matter distributed in a disk and following
closely the HI distribution. The disk then becomes unstable and can naturally
form a bar and spiral pattern. However, this explanation is hard to reconcile
with some properties of NGC 2915. We also consider the effect of a massive and
extended triaxial dark matter halo with a rotating figure. The existence of
such halos is supported by CDM simulations showing strongly triaxial dark halos
with slow figure rotation. The observed structure of the HI disk can then arise
through forcing by the rotating triaxial figure. We associate the measured
pattern speed in NGC 2915 with the figure rotation of its dark halo.
","[{""version"":""v1"",""created"":""Wed, 30 Jun 1999 17:01:52 GMT""}]","2009-10-31"
"astro-ph/9906499","Karl Gebhardt","Karl Gebhardt (UCO/Lick Observatory) and Markus Kissler-Patig (ESO)","Globular Cluster Systems I: V-I Color Distributions","30 pages, accepted AJ",,"10.1086/301059",,"astro-ph",,"  We have compiled data for the globular cluster systems of 50 galaxies from
the HST WFPC2 archive, of which 43 are type S0 or earlier. In this paper, we
present the data set and derive the V-I color distributions. We derive the
first four moments of the color distributions, as well as a measure for their
non--unimodality. The number of globular clusters in each galaxy ranges from 18
(in NGC 2778) to 781 (NGC 5846). For those systems having more than 100
clusters, seven of sixteen (44%) show significant bimodality. Overall, roughly
half of all the systems in our sample show hints of a bimodal color
distribution. In general, the distributions of the faint galaxies are
consistent with unimodality, whereas those of the brighter galaxies are not. In
comparing the moments of the V-I distributions with various galaxy properties
for the early-type galaxies, we find the following difference in the
correlations between the field and cluster galaxy populations: the peak V-I
color of the globular cluster distribution correlates well with the central
velocity dispersion---and hence the Mg2 index and total luminosity---for
galaxies in cluster environments; there exists no such correlation for field
galaxies. This difference between cluster and field galaxies possibly reflects
different formation scenarios for their globular cluster systems. Among the
explanations for such a correlation, we consider either a larger age spread in
the field populations or the possibility that cluster galaxies are always
affected by significant accretion whereas some field galaxies could host pure
``in situ'' formed populations.
","[{""version"":""v1"",""created"":""Wed, 30 Jun 1999 19:09:45 GMT""}]","2009-10-31"
"astro-ph/9906500","Jean Eilek","J. A. Eilek and J. C. Weatherall (New Mexico Tech, Socorro, USA)","Turbulent Particle Acceleration in the Diffuse Cluster Plasma","5 pages, 4 figures, to appear in ""Diffuse Thermal and Relativistic
  Plasma in Galaxy Clusters"", 1999, RIngberg workshop, Germany, MPE-Report",,,,"astro-ph",,"  In situ particle acceleration is probably occuring in cluster radio haloes.
This is suggested by the uniformity and extent of the haloes, given that
spatial diffusion is slow and that radiative losses limit particle lifetimes.
Stochastic acceleration by plasma turbulence is the most likely mechanism.
Alfven wave turbulence has been suggested as the means of acceleration, but it
is too slow to be important in the cluster environment. We propose, instead,
that acceleration occurs via strong lower-hybrid wave turbulence. We find that
particle acceleration will be effective in clusters if only a small fraction of
the cluster energy density is in this form.
","[{""version"":""v1"",""created"":""Wed, 30 Jun 1999 19:21:03 GMT""}]","2009-09-25"
"astro-ph/9906501","Michael Catanese","Michael Catanese and Trevor C. Weekes","Very High Energy Gamma-Ray Astronomy","Invited review to appear in PASP, 30 pages, 25 figures",,"10.1086/316435",,"astro-ph",,"  We present a review of the current status of very high energy gamma-ray
astronomy. The development of the atmospheric Cherenkov imaging technique for
ground-based gamma-ray astronomy has led to a rapid growth in the number of
observatories. The detection of TeV gamma rays from Active Galactic Nuclei was
unexpected and is providing new insights into the emission mechanisms in the
jets. Next generation telescopes are under construction and will increase
dramatically the knowledge available at this extreme end of the cosmic
electromagnetic spectrum.
","[{""version"":""v1"",""created"":""Wed, 30 Jun 1999 19:27:27 GMT""}]","2009-10-31"
"astro-ph/9906502","Chris Simpson","Chris Simpson, Peter Eisenhardt, Lee Armus, Arati Chokshi, Mark
  Dickinson, S. G. Djorgovski, Richard Elston, Buell T. Jannuzi, Patrick J.
  McCarthy, Michael A. Pahre and B. T. Soifer","Young stars and non-stellar emission in the aligned radio galaxy 3C 256","35 pages including 10 figures; to appear in Nov 10 ApJ",,"10.1086/307926",,"astro-ph",,"  We present ground-based images of the z=1.824 radio galaxy 3C 256 in the
standard BVRIJHK filters and an interference filter centered at 8800A, a Hubble
Space Telescope image in a filter dominated by Ly-alpha emission (F336W), and
spectra covering rest-frame wavelengths from Ly-alpha to [O III] 5007. Together
with published polarimetry observations, we use these to decompose the overall
spectral energy distribution into nebular continuum emission, scattered quasar
light, and stellar emission. The nebular continuum and scattered light together
comprise half (one third) of the V-band (K-band) light within a 4-arcsec
aperture, and are responsible for the strong alignment between the
optical/near-infrared light and the radio emission. The stellar emission is
dominated by a population estimated to be 100-200 Myr old (assuming a Salpeter
IMF), and formed in a short burst with a peak star formation rate of 1-4x10^3
Msun/yr. The total stellar mass is estimated to be no more than 2x10^{11} Msun,
which is far less than other luminous radio galaxies at similar redshifts, and
suggests that 3C 256 will undergo further star formation or mergers.
","[{""version"":""v1"",""created"":""Wed, 30 Jun 1999 21:39:03 GMT""}]","2009-10-31"
"astro-ph/9906503","Reem Sari","Re'em Sari (CALTECH)","Linear Polarization and Proper Motion in The Afterglow of Beamed GRBs","12 pages including 4 figures","Astrophys.J. 524 (1999) L43-L46","10.1086/312294",,"astro-ph",,"  We investigate the polarization and proper motion expected in a beamed
Gamma-Ray Burst's ejecta. We find that even if the magnetic field has well
defined orientation relative to the direction of motion of the shock, the
polarization is not likely to exceed 20%. Taking into account the dynamics of
beamed ejecta we find that the polarization rises and decays with peak around
the jet break time (when the Lorentz factor of the flow is comparable to the
initial opening angle of the jet). Interestingly, we find that when the offset
of the observer from the center of the beam is large enough, the polarization
as function of time has three peaks, and the polarization direction of the
middle peak is rotated by 90 degrees relative to the two other peaks. We also
show that some proper motion is expected, peaking around the jet break time.
Detection of both proper motion and the direction of polarization can determine
which component of the magnetic field is the dominant.
","[{""version"":""v1"",""created"":""Wed, 30 Jun 1999 23:46:36 GMT""}]","2009-10-31"
"astro-ph/9906504","Peter W. Gorham","P. W. Gorham, K. M. Liewer, and C. J. Naudet (Jet Propulsion
  Laboratory)","Initial Results from a Search for Lunar Radio Emission from Interactions
  of >= 10^{19} eV Neutrinos and Cosmic Rays","4 pages of LaTex, 2 figures, to appear in the Proc. of 26th ICRC,
  Salt Lake City, Utah, August 1999",,,"JPL-IOM 335.1-99-007","astro-ph",,"  Using the NASA Goldstone 70m antenna DSS 14 both singly and in coincidence
with the 34 m antenna DSS 13 (21.7 km to the southeast), we have acquired
approximately 12 hrs of livetime in a search for predicted pulsed radio
emission from extremely-high energy cascades induced by neutrinos or cosmic
rays in the lunar regolith. In about 4 hrs of single antenna observations, we
reduced our sensitivity to impulsive terrestrial interference to a negligible
level by use of a veto afforded by the unique capability of DSS 14. In the 8
hrs of dual-antenna observations, terrestrial interference is eliminated as a
background. In both observing modes the thermal noise floor limits the
sensitivity. We detected no events above statistical background. We report here
initial limits based on these data which begin to constrain several predictions
of the flux of EHE neutrinos.
","[{""version"":""v1"",""created"":""Wed, 30 Jun 1999 23:34:29 GMT""}]","2007-05-23"
"astro-ph/9907001","Tomonori Totani","Tomonori Totani (NAO, Japan)","Pair Creation by Very High Energy Photons in Gamma-Ray Bursts: A Unified
  Picture for Various Energetics of GRBs","6 pages, no figure. Accepted by MNRAS, pink pages",,"10.1046/j.1365-8711.1999.02901.x",,"astro-ph",,"  The extreme energetics of the gamma-ray burst (GRB) 990123 has revealed that
some of GRBs emit quite a large amount of energy, and total energy release from
GRBs seems to change from burst to burst by a factor of 10^{2-3} as E_{gamma,
iso} \sim 10^{52-55} erg, where E_{gamma, iso} is the observed GRB energy when
radiation is isotropic. If all GRBs are triggered by similar events, such a
wide dispersion in energy release seems odd. Here we propose a unified picture
for these various energetics of GRBs, in which all GRB events release roughly
the same amount of energy of E_{iso} \sim 10^{55-56} erg as relativistic
motion, with the baryon load problem almost resolved. A mild dispersion in the
initial Lorentz factor (\Gamma) results in difference of E_{gamma, iso} up to a
factor of m_p/m_e \sim 10^3. Protons work as ``a hidden energy reservoir'' of
the total GRB energy, and E_{gamma, iso} depends on the energy transfer
efficiency from protons into electrons (or positrons) in the internal shock. We
show that this transfer occurs via e^{+-} pair-creation by very high energy
photons of proton-synchrotron radiation, and this efficiency depends quite
sensitively on \Gamma. We also show that, in spite of the wide dispersion in
E_{gamma, iso}, this model predicts roughly a constant photon energy range of
the e^{+-} pair-synchrotron at \sim MeV, which is well consistent with GRB
observations. The optical flash of GRB 990123 can be explained by the internal
shock origin in our model. The apparent no-correlation between E_{gamma, iso}
and observed afterglow luminosity is consistent with the expectation of our
scenario.
","[{""version"":""v1"",""created"":""Thu, 1 Jul 1999 00:00:42 GMT""}]","2009-10-31"
"astro-ph/9907003","Patrick Cote","Patrick Cote (CalTech), Mario Mateo (Univ. of Michigan), Edward
  Olszewski (Steward Obs), Kem Cook (LLNL)","Internal Kinematics of the Andromeda II Dwarf Spheroidal Galaxy","9 pages, 3 postscript figures. Accepted for publication in the
  Astrophysical Journal",,"10.1086/307999",,"astro-ph",,"  The High Resolution Echelle Spectrometer on the Keck I telescope has been
used to measure nine radial velocities having a median precision of 2 km/s for
seven red giants belonging to the isolated dwarf spheroidal galaxy Andromeda
II. We find a weighted mean radial velocity of -188+/-3 km/s and a central
velocity dispersion of 9.3+/-2.7 km/s. There may be evidence for a radial
velocity gradient across the face of the galaxy, although the significance of
this result is low due to the small number of stars having measured velocities.
Our best estimate for the global mass-to-light ratio of And II is M/L_V =
20.9^{+13.9}_{-10.1} in solar units. This value is similar to those of several
Galactic dwarf spheroidal galaxies and is consistent with the presence of a
massive dark halo in Andromeda II.
","[{""version"":""v1"",""created"":""Thu, 1 Jul 1999 01:24:09 GMT""}]","2009-10-31"
"astro-ph/9907004","Jeremy R. Walsh","N. Ageorges (National University of Ireland - Galway), J. R. Walsh
  (European Southern Observatory)","Acquisition and analysis of adaptive optics imaging polarimetry data","20 pages, A&A LaTeX2e, 11 figures. To appear in Astronomy &
  Astrophysics, Supplement Series",,"10.1051/aas:1999270",,"astro-ph",,"  The process of data taking, reduction and calibration of near-infrared
imaging polarimetry data taken with the ESO Adaptive Optics System ADONIS is
described. The ADONIS polarimetric facility is provided by a rotating wire grid
polarizer. Images were taken at increments of 22.5 degrees of polarizer
rotation from 0 to 180 degrees, over-sampling the polarization curve but
allowing the effects of photometric variations to be assessed. Several
strategies to remove the detector signature are described. The instrumental
polarization was determined, by observations of stars of negligible
polarization, to be 1.7% at J, H and K bands. The lack of availability of
unpolarized standard stars in the IR, in particular which are not too bright as
to saturate current IR detectors, is highlighted. The process of making
polarization maps is described. Experiments at restoring polarimetry data, in
order to reach diffraction limited polarization, are outlined, with particular
reference to data on the Homunculus reflection nebula around Eta Carinae.
","[{""version"":""v1"",""created"":""Thu, 1 Jul 1999 07:27:44 GMT""}]","2009-10-31"
"astro-ph/9907005","Annibale D'Ercole","A. D'Ercole, F. Brighenti","Galactic winds and circulation of the ISM in dwarf galaxies","15 pages, 10 figures, accepted for publication in MNRAS",,"10.1046/j.1365-8711.1999.02911.x","BAP07-1999-13-OAB","astro-ph",,"  We study, through 2D hydrodynamical simulations, the feedback of a starburst
on the ISM of typical gas rich dwarf galaxies. The main goal is to address the
circulation of the ISM and metals following the starburst. We assume a
single-phase rotating ISM in equilibrium in the galactic potential generated by
a stellar disk and a spherical dark halo. The starburst is assumed to occur in
a small volume in the center of the galaxy, and it generates a mechanical power
of 3.8e39 erg/s or 3.8e40 erg/s for 30 Myr. We found, consistently with
previous investigations, that the galactic wind is not very effective in
removing the ISM. The metal rich stellar ejecta, instead, may be efficiently
expelled from the galaxy and dispersed in the intergalactic medium. Moreover,
we found that the central region of the galaxy is always replenished with cold
and dense gas after a few 100 Myr from the starbust, achieving the requisite
for a new star formation event in 0.5-1 Gyr. The hydrodynamical evolution of
galactic winds is thus consistent with the episodic star formation regime
suggested by many chemical evolution studies. We also discuss the X-ray
emission of these galaxies and find that the observable (emission averaged)
abundance of the hot gas underestimates the real one if thermal conduction is
effective. This could explain the very low hot gas metallicities estimated in
starburst galaxies.
","[{""version"":""v1"",""created"":""Thu, 1 Jul 1999 07:50:55 GMT""}]","2009-10-31"
"astro-ph/9907006","Alexander Potekhin","A.Y. Potekhin (1), G. Chabrier (2), Yu.A. Shibanov (1) ((1) Ioffe
  Phys.-Tech. Inst., St.Petersburg; (2) CRAL, ENS-Lyon)","Partially ionized hydrogen plasma in strong magnetic fields","17 pages, 11 figures (embedded using epsf.sty), REVTeX3. V2: two
  curves on the right panel of Fig. 8 are corrected. V3: a misprint (missed
  brackets) in Eq. (55) is corrected","Phys.Rev. E60 (1999) 2193","10.1103/PhysRevE.60.2193",,"astro-ph physics.plasm-ph",,"  We study the thermodynamic properties of a partially ionized hydrogen plasma
in strong magnetic fields, B ~ 10^{12}-10^{13} G, typical of neutron stars. The
properties of the plasma depend significantly on the quantum-mechanical sizes
and binding energies of the atoms, which are strongly modified by thermal
motion across the field. We use new fitting formulas for the atomic binding
energies and sizes, based on accurate numerical calculations and valid for any
state of motion of the atom. In particular, we take into account decentered
atomic states, neglected in previous studies of thermodynamics of magnetized
plasmas. We also employ analytic fits for the thermodynamic functions of
nonideal fully ionized electron-ion Coulomb plasmas. This enables us to
construct an analytic model of the free energy. An ionization equilibrium
equation is derived, taking into account the strong magnetic field effects and
the nonideality effects. This equation is solved by an iteration technique.
Ionization degrees, occupancies, and the equation of state are calculated.
","[{""version"":""v1"",""created"":""Thu, 1 Jul 1999 10:53:35 GMT""},{""version"":""v2"",""created"":""Thu, 24 Aug 2000 11:13:38 GMT""},{""version"":""v3"",""created"":""Sun, 21 Apr 2002 19:31:12 GMT""}]","2007-05-23"
