"astro-ph/9907342","Karl D. Gordon","Adolf N. Witt, Karl D. Gordon","Multiple Scattering in Clumpy Media. II. Galactic Environments","accepted by the ApJ (10 Dec 1999), 17 pages, color figures included,
  paper and data tables also at
  http://mips.as.arizona.edu/~kgordon/papers/clumpy_dust_II.html","Astrophys.J.528:799-816,2000","10.1086/308197",,"astro-ph",,"  We present and discuss the results of new multiple-scattering radiative
transfer calculations for three representative types of galactic environments,
filled with either homogeneous or two-phase clumpy dust distributions.
Extinction and scattering properties for two types of interstellar dust,
similar to those found in the average diffuse medium of the Milky Way Galaxy
(MW) and the Bar of the Small Magellanic Cloud (SMC), are considered. The
wavelength coverage extends from 1000 A to 30,000 A, with particular emphasis
on the rest-frame UV. This makes these models especially applicable to
starburst galaxies and Lyman-break galaxy samples. The examination of the
models concentrates on the study of UV/visual/near-IR reddening effects, the
wavelength dependence of attenuation, and on the changes that arise from the
transition from homogeneous to clumpy dust distributions in different star/dust
geometries. Embedded dust, especially when clumpy, leads to saturation at
fairly low reddening values with correspondingly gray attenuation functions.
This makes the assessment of the attenuation of the far-UV flux from starburst
galaxies difficult, if only UV/visual/near-IR data are available. Existing data
for UV-selected starburst galaxies indicate a range of UV attenuation factors
of 0-150. Our models reproduce the ""Calzetti Attenuation Law"", provided one
adopts SMC-type dust and a clumpy shell-type dust distribution surrounding the
starbursts. The average far-UV attenuation factor for the Calzetti sample is
found to be 7.4. The only relatively reliable measure for the UV attenuation
factor for single galaxies was found in the ratio of the integrated far-IR flux
to the far-UV flux, measured near 1600 A, requiring the measurement of the
entire spectral energy distribution of galaxies.
","[{""version"":""v1"",""created"":""Sun, 25 Jul 1999 18:17:42 GMT""}]","2009-10-05"
"astro-ph/9907343","Renato A. Dupke","Renato A. Dupke (U. of Michigan) and Raymond E. White III (U. of
  Alabama)","Constraints on Type Ia Supernova Models from X-ray Spectra of Galaxy
  Clusters","20 pages, 2 figures, accepted by The Astrophysical Journal",,"10.1086/308181",,"astro-ph",,"  We present constraints on theoretical models of Type Ia supernovae using
spatially resolved ASCA X-ray spectroscopy of three galaxy clusters: Abell 496,
Abell 2199 and Abell 3571. All three clusters have central iron abundance
enhancements; an ensemble of abundance ratios are used to show that most of the
iron in the central regions of the clusters comes from SN Ia. These
observations are consistent with the suppressed galactic wind scenario proposed
by Dupke and White (1999). At the center of each cluster, simultaneous analysis
of spectra from all ASCA instruments shows that the nickel to iron abundance
ratio (normalized by the solar ratio) is Ni/Fe ~ 4. We use the nickel to iron
ratio as a discriminator between SN Ia explosion models: the Ni/Fe ratio of
ejecta from the ""Convective Deflagration"" model W7 is consistent with the
observations, while those of ""delayed detonation"" models are not consistent at
the 90% confidence level.
","[{""version"":""v1"",""created"":""Sun, 25 Jul 1999 23:21:27 GMT""}]","2009-10-31"
"astro-ph/9907344","Walter Huchtmeier","W. K. Huchtmeier (Max-Planck-Institut fuer Radioastronomie, Bonn) I.
  D. Karachentsev (Special Astrophysical Observatory) V. E. Karachentseva
  (Astronomical Observatory Kiev University)","New Dwarf Galaxies in the IC342/Maffei Group","4 pages, 2 figures, uses paspconf.sty to be published in IAU Coll.
  174 ""Small Galaxy Groups"" M. Valtonen, C. Flynn (eds.) pasp conf.series",,,,"astro-ph",,"  We report detection of HI-emission from three 'new' dwarf galaxies Perseus A,
Perseus B, and Camelopardalis D in the IC342/Maffei group of galaxies and of
Draco A. The actual number of (probable) members of this group increases to 19
galaxies. Its velocity dispersion is 87 km/s. With a distance of 2.2+-0.5 Mpc
this group is the nearest to the Local Group and might have considerable
dynamical influence on the Local Group.
","[{""version"":""v1"",""created"":""Mon, 26 Jul 1999 08:33:47 GMT""}]","2007-05-23"
"astro-ph/9907345","Georg Drenkhahn","Georg Drenkhahn (1,2) and Tom Richtler (1) ((1) AIU Bonn, (2) MPA
  Garching)","SN1994D in NGC4526: a normally bright type Ia supernova","11 pages, 9 figures. Accepted by A&A; corrected citations","Astron.Astrophys.349:877,1999",,,"astro-ph",,"  SN1994D of type Ia has been suspected not to fit into the relation between
decline rate, colour, and brightness. However, an individual distance of its
host galaxy, NGC4526, other than that of the Virgo cluster, has not yet been
published. We determined the distance by the method of globular cluster
luminosity functions on the basis of HST archive data. A maximum-likelihood fit
returns apparent turn-over magnitudes of 23.16+-0.16mag in V and 21.96+-0.09mag
in I. The corresponding distance modulus is 30.4+-0.3mag, where the error
reflects our estimation of the absolute distance scale. The absolute magnitudes
(not corrected for decline rate and colour) are -18.67+-0.30mag,
-18.62+-0.30mag, and -18.40+-0.30mag for B, V, and I, respectively. The
corrected magnitudes are -18.69+-0.31mag, -18.69+-0.31mag, and -18.44+-0.31mag.
  Compared with other supernovae with reliably determined distances, SN1994D
fits within the errors. It is therefore not a counter-example against a uniform
decline-rate-colour-brightness relation.
","[{""version"":""v1"",""created"":""Mon, 26 Jul 1999 09:00:46 GMT""},{""version"":""v2"",""created"":""Mon, 2 Aug 1999 08:49:10 GMT""},{""version"":""v3"",""created"":""Tue, 7 Sep 1999 12:00:53 GMT""}]","2011-05-23"
"astro-ph/9907346","Mario Vietri","Luigi Stella, Mario Vietri, Sharon Morsink","Correlations in the QPO Frequencies of Low Mass X-Ray Binaries and the
  Relativistic Precession Model","To appear in ApJ Letters. AASTEX Latex v. 5.0, 1 figure not included",,"10.1086/312291",,"astro-ph",,"  A remarkable correlation between the centroid frequencies of quasi periodic
oscillations, QPOs, (or peaked noise components) from low mass X-ray binaries,
has been recently discovered by Psaltis, Belloni and van der Klis (1999). This
correlation extends over nearly 3 decades in frequency and encompasses both
neutron star and black hole candidate systems. We discuss this result in the
light of the relativistic precession model, which has been proposed to
interpret the kHz QPOs as well as some of the lower frequency QPOs of neutron
star low mass X-ray binaries of the Atoll and Z classes. Unlike other models
the relativistic precession model does not require the compact object to be a
neutron star and can be applied to black hole candidates as well. We show that
the predictions of the relativistic precession model match both the value and
dependence of the correlation to a very good accuracy without resorting to
additional assumptions.
","[{""version"":""v1"",""created"":""Mon, 26 Jul 1999 08:58:07 GMT""}]","2009-10-31"
"astro-ph/9907347","Barrau","Aurelien Barrau","Primordial black holes as a source of extremely high energy cosmic rays","Accepted for publication in Astroparticle Physics","Astropart.Phys.12:269-275,2000","10.1016/S0927-6505(99)00103-6",,"astro-ph hep-ph",,"  The origin of observed extremely high energy cosmic rays remains an
astrophysical enigma. We show that a single evaporating primordial black hole
should produce 8.5*10^14 particles over a 10^20 eV threshold. This emission
results from direct production of fundamental constituants and from
hadronization of quarks and gluons. The induced flux on the Earth is studied as
a function of the local density of exploding black holes and compared with
experimental data. The discovery potential of future detectors is finally
reviewed.
","[{""version"":""v1"",""created"":""Mon, 26 Jul 1999 10:13:40 GMT""}]","2011-05-23"
"astro-ph/9907348","HongSheng Zhao","HongSheng Zhao (Leiden), David Graff (Ohio State), Puragra
  Guhathakurta (UCO/Lick)","Magnitude bias of microlensed sources towards the Large Magellanic Cloud","To appear in ApJ Letters. Shortened to match the accepted version, 8
  pages plus 1 ps figure","Astrophys.J. 532 (2000) L37-L40","10.1086/312552",,"astro-ph",,"  There are lines of evidence suggesting that some of the observed microlensing
events in the direction of the Large Magellanic Cloud (LMC) are caused by
ordinary star lenses as opposed to dark Machos in the Galactic halo. Efficient
lensing by ordinary stars generally requires the presence of one or more
additional concentrations of stars along the line of sight to the LMC disk. If
such a population behind the LMC disk exists, then the source stars (for
lensing by LMC disk objects) will be drawn preferentially from the background
population and will show systematic differences from LMC field stars. One such
difference is that the (lensed) source stars will be farther away than the
average LMC field stars, and this should be reflected in their apparent
baseline magnitudes. We focus on red clump stars: these should appear in the
color-magnitude diagram at a few tenths of a magnitude fainter than the field
red clump. Suggestively, one of the two near-clump confirmed events,
MACHO-LMC-1, is a few tenths of magnitude fainter than the clump.
","[{""version"":""v1"",""created"":""Mon, 26 Jul 1999 11:57:42 GMT""},{""version"":""v2"",""created"":""Tue, 27 Jul 1999 08:47:58 GMT""},{""version"":""v3"",""created"":""Wed, 6 Oct 1999 08:12:54 GMT""},{""version"":""v4"",""created"":""Thu, 3 Feb 2000 09:59:39 GMT""}]","2009-10-31"
"astro-ph/9907349","Jesper Sommer-Larsen","Jesper Sommer-Larsen","Are Damped Ly-alpha Systems Large, Galactic Disks ?","8 pages incl. 5 figures (Kluwer Proceedings format). Contribution to
  the Euroconference ""The Evolution of Galaxies on Cosmological Timescales"",
  Tenerife, 30 Nov. - 5 Dec. 1998","Astrophys.Space Sci. 276 (2001) 999-1006","10.1023/A:1017584500541",,"astro-ph",,"  The hypothesis that the Damped Ly-alpha systems (DLAs) are large, galactic
disks (Milky Way sized) is tested by confronting predictions of models of the
formation and evolution of (large) disk galaxies with observations, in
particular the Zinc abundance distribution with neutral hydrogen column density
found for DLAs. A pronounced mismatch is found strongly hinting that the
majority of DLAs may not be large, galactic disks.
","[{""version"":""v1"",""created"":""Mon, 26 Jul 1999 12:02:35 GMT""}]","2009-10-31"
"astro-ph/9907350","Peter Dunsby","Mattias Marklund, Gert Brodin and Peter Dunsby","Radio wave emissions due to gravitational radiation","11 Pages, Latex, Uses aastex. To appear in Astrophysical Journal","Astrophys.J. 536 (2000) 875-879","10.1086/308957","uct-cosmology-99/01","astro-ph gr-qc physics.plasm-ph",,"  We consider the interaction of a weak gravitational wave with electromagnetic
fields in a thin plasma on a Minkowski background spacetime using the 1+3
orthonormal frame formalism. Because gravitational and electromagnetic waves
satisfy the same dispersion relation, electromagnetic waves can be effectively
generated as a result of this interaction. In the case of the interaction with
a static magnetic field, the amplitude of the electromagnetic waves depends on
the size of the excitation region in which the magnetic field is contained. It
is argued that due to the presence of a plasma this process can also lead to
the generation of higher harmonics of the original mode. Estimates are given
for this effect in the case of a binary pulsar and a cold electron plasma. It
is found that the emmited radiation will lie in the radio frequency band. We
also speculate on the possible relevance of this process on situations in
cosmology, in particular whether this could be used to constrain primordial
magnetic fields.
","[{""version"":""v1"",""created"":""Mon, 26 Jul 1999 12:26:22 GMT""},{""version"":""v2"",""created"":""Tue, 29 Feb 2000 13:08:29 GMT""}]","2009-10-31"
"astro-ph/9907351","Wolfgang J. Duschl","B. Vollmer (1,3), V. Cayatte (3), A. Boselli (4), C. Balkowski (3),
  W.J. Duschl (1,2) ((1) Institut fuer Theoretische Astrophysik, Heidelberg,
  Germany - (2) Max-Planck-Institut fuer Radioastronomie, Bonn, Germany - (3)
  Observatoire de Paris, Meudon, France - (4) Laboratoire d'Astronomie
  Spatiale, Marseille, France)","Kinematics of the anemic cluster galaxy NGC 4548 - Is stripping still
  active ?","12 pages, 15 figures, accepted for publication in Astronomy &
  Astrophysics",,,,"astro-ph",,"  We present new HI (20"" resolution) and CO observations of NGC 4548, an anemic
galaxy in the Virgo cluster. The atomic gas distribution shows a ring structure
which is distorted at the northern edge. The overall rotation curve is derived
with a tilted ring model. We compare our rotation curve with previous ones and
discuss the differences. The velocity field of the CO pointings fit very well
with the one of the atomic gas where they overlap. The CO emission permits to
extend the rotation curve towards the galaxy centre. The molecular fraction is
derived for the inner 120"" x 120"" centered on the galaxy. We compare the HI and
CO emission to H_alpha line and optical blue emission maps. The bar in the
centre favors star formation at the outer end of the bar. The HI intensity
distribution and velocity field of the northern perturbation are deprojected
with the help of a first order kinematical model. They are discussed in the
framework of warps. It is concluded that the scenario of ram pressure stripping
responsible for the gas removal and the northern perturbation is a very
probable one. In this case the ram pressure which may have caused the galaxy's
HI deficiency is now fading after the galaxy's close passage to the cluster
centre or increasing again due to a second approach of the galaxy to the
cluster centre.
","[{""version"":""v1"",""created"":""Mon, 26 Jul 1999 12:22:27 GMT""}]","2007-05-23"
"astro-ph/9907352","Julia Lee","J.C. Lee (Inst.Astr-Cambridge U.K.), A.C. Fabian(Inst.Astr-Cambridge
  U.K.), W.N. Brandt (Penn State,USA), C.S. Reynolds (JILA-U.Colorado,USA), K.
  Iwasawa (Inst.Astr-Cambridge U.K.)","First Constraints on Iron Abundance versus Reflection Fraction from the
  Seyfert~1 Galaxy MCG--6-30-15","8 pages, 8 figures, accepted for publication MNRAS 7/99","Mon.Not.Roy.Astron.Soc.310:973-981,1999","10.1046/j.1365-8711.1999.02999.x",,"astro-ph",,"  We report on a joint ASCA and RXTE observation spanning an $\sim$ 400~ks time
interval of the bright Seyfert~1 galaxy MCG--6-30-15. The data clearly confirm
the presence of a broad skewed iron line ($W_{K\alpha} \sim$ 266 eV) and
Compton reflection continuum at higher energies reported in our previous paper.
We also investigate whether the gravitational and Doppler effects that affect
the iron line may also be manifest in the reflected continuum. The uniqueness
of this data set is underlined by the extremely good statistics that we obtain
from the approximately four million photons that make up the 2-20 keV RXTE PCA
spectrum alone. This, coupled with the high energy coverage of HEXTE and the
spectral resolution of ASCA in the iron line regime has allowed us to constrain
the relationship between abundance and reflection fraction for the first time
at the 99 per cent confidence level. The reflection fraction is entirely
consistent with a flat disk, i.e. the cold material subtends $\rm 2 \pi$ sr at
the source, to an accuracy of 20 per cent. Monte Carlo simulations show that
the observed strong iron line intensity is explained by an overabundance of
iron by a factor of $\sim$ 2 and an underabundance of the lower-Z elements by a
similar factor. By considering non-standard abundances, a clear and consistent
picture can be made in which both the iron line and reflection continuum come
from the same material such as e.g. an accretion disk.
","[{""version"":""v1"",""created"":""Mon, 26 Jul 1999 14:16:22 GMT""}]","2009-09-17"
"astro-ph/9907353","Michael R. Merrifield","R.P. Olling (Rutgers University) and M.R. Merrifield (University of
  Nottingham)","Two measures of the shape of the Milky Way's dark halo","Accepted for publication in MNRAS. 10 pages, 6 figures, uses mn.sty
  and epsf.sty",,"10.1046/j.1365-8711.2000.03053.x",,"astro-ph",,"  In order to test the reliability of determinations of the shapes of galaxies'
dark matter halos, we have made such measurements for the Milky Way by two
independent methods, which make use of the stellar kinematics in the solar
neighbourhood and the observed flaring of the Galactic HI layer to estimate the
flattening of the Galactic dark halo. These techniques are found to produce a
consistent estimate for the halo shape, with a shortest-to-longest axis ratio
of q ~ 0.8, but only if one adopts somewhat non-standard values for the
distance to the Galactic centre, R_0, and the local Galactic rotation speed,
Theta_0. For consistency, one requires values of R_0 < 7.6 kpc and Theta_0 <
190 km/s. Although differing significantly from the current IAU-sanctioned
values, these upper limits are consistent with all existing observational
constraints. If future measurements confirm these lower values for the Galactic
constants, then the validity of the gas layer flaring method will be confirmed.
Further, dark matter candidates such as cold molecular gas and massive decaying
neutrinos, which predict very flat dark halos with q < 0.2, will be ruled out.
Conversely, if the Galactic constants were found to be close to the more
conventional values, then there would have to be some systematic error in the
methods for measuring dark halo shapes, so the existing modeling techniques
would have to be viewed with some scepticism.
","[{""version"":""v1"",""created"":""Mon, 26 Jul 1999 15:00:03 GMT""}]","2017-01-04"
"astro-ph/9907354","Joao Magueijo","John D. Barrow and Joao Magueijo","Can a changing $\alpha$ explain the Supernovae results?","Latex file, uses aasms4 style file, 1 ps figure. Replaced with
  revised version, to be published in Ap.J.Lett",,"10.1086/312572",,"astro-ph",,"  We show that the Supernovae results, implying evidence for an accelerating
Universe, may be closely related to the recent discovery of redshift dependence
in the fine structure constant $\alpha$. The link is a class of varying speed
of light (VSL) theories which contain cosmological solutions similar to
quintessence. During the radiation dominated epoch the cosmological constant
$\Lambda$ is prevented from dominating the Universe by the usual VSL mechanism.
In the matter epoch the varying c effects switch off, allowing $\Lambda$ to
eventually surface and lead to an accelerating Universe. By the time this
happens the residual variations in c imply a changing $\alpha$ at a rate that
is in agreement with observations.
","[{""version"":""v1"",""created"":""Mon, 26 Jul 1999 15:07:15 GMT""},{""version"":""v2"",""created"":""Tue, 22 Feb 2000 15:36:43 GMT""}]","2009-10-31"
"astro-ph/9907355","Florian Bauer","C. Afonso, et al. (The Eros collaboration)","Eros variable stars: A catalog of Cepheids in the Magellanic Clouds","17 pages, 4 Eps figures, 17 Gif figures Submitted to A&A Suppl.,
  Report with figures of higher quality (99 Eps figures) + catalog are
  available at
  http://www-dapnia.cea.fr/Phys/Spp/Experiences/EROS/Cepheides/catalog_cep.html",,,,"astro-ph",,"  We present a catalog containing 290 LMC and 590 SMC Cepheids which have been
obtained using the two 4k $\times$ 8k CCD cameras of the EROS~2 microlensing
survey. The Cepheids were selected from 1,134,000 and 504,000 stars in the
central regions of the LMC and SMC respectively, that were monitored over 150
nights between October 1996 and February 1997, at a rate of one measurement
every night. For each Cepheid the light curves, period, magnitudes in the
EROS~2 filter system, Fourier coefficients, J2000 coordinates and
cross-identifications with objects referenced in the CDS Simbad database are
presented. Finding charts of identified Cepheids in clusters NGC 1943, NGC 1958
and Bruck 56 are presented. The catalogue and the individual light--curves will
be electronically available through the CDS (Strasbourg).
","[{""version"":""v1"",""created"":""Mon, 26 Jul 1999 15:25:34 GMT""}]","2007-05-23"
"chao-dyn/9907033","Oleg V. Zhirov","V.V. Sokolov, O.V. Zhirov, D. Alonso, and G. Casati","Quantum Resonances of Kicked Rotor and SU(q) group","RevTeX, 4 pages, 3 figures","Phys. Rev. Lett., 84 (2000) 3566-3569","10.1103/PhysRevLett.84.3566",,"chao-dyn cond-mat nlin.CD",,"  The quantum kicked rotor (QKR) map is embedded into a continuous unitary
transformation generated by a time-independent quasi-Hamiltonian. In some
vicinity of a quantum resonance of order $q$, we relate the problem to the {\it
regular} motion along a circle in a $(q^2-1)$-component inhomogeneous
""magnetic"" field of a quantum particle with $q$ intrinsic degrees of freedom
described by the $SU(q)$ group. This motion is in parallel with the classical
phase oscillations near a non-linear resonance.
","[{""version"":""v1"",""created"":""Mon, 26 Jul 1999 10:10:28 GMT""}]","2013-01-16"
"cond-mat/9907382","Moshe Havilio","Moshe Havilio and Assa Auerbach","Superconductivity and Quantum Spin Disorder in Cuprates",,,"10.1103/PhysRevLett.83.4848",,"cond-mat.str-el cond-mat.supr-con",,"  A fundamental connection between superconductivity and quantum spin
fluctuations in underdoped cuprates, is revealed. A variational calculation
shows that {\em Cooper pair hopping} strongly reduces the local magnetization
$m_0$. This effect pertains to recent neutron scattering and muon spin rotation
measurements in which $m_0$ varies weakly with hole doping in the poorly
conducting regime, but drops precipitously above the onset of
superconductivity.
","[{""version"":""v1"",""created"":""Mon, 26 Jul 1999 14:35:23 GMT""},{""version"":""v2"",""created"":""Thu, 29 Jul 1999 12:22:56 GMT""}]","2009-10-31"
"cond-mat/9907383","Dietrich Belitz","D. Belitz and T.R. Kirkpatrick","The disordered Fermi-liquid fixed point and its instabilities","10 pp., LaTeX, no figs., requires annalen.cls (included), Invited
  contribution to Localisation 99, final version as published","Ann. Phys. (Leipzig) vol. 8, pp. 765-774 (1999)","10.1002/(SICI)1521-3889(199911)8:7/9<765::AID-ANDP765>3.0.CO;2-B","db/99/2","cond-mat.stat-mech",,"  The concept of a disordered Fermi-liquid fixed point is introduced and used
to understand various properties of disordered metals within a unifying
framework. Corrections to scaling near this fixed point give what are commonly
called weak-localization effects. Various instabilities of the disordered
Fermi-liquid phase are discussed. These include two distinct types of
superconducting-to-normal-metal quantum phase transitions. First, the quantum
phase transition from a disordered metal to a conventional superconductor in
bulk materials is considered. Second, a quantum phase transition in two
dimensions from metallic-like behavior to a novel type of disorder induced,
spin-triplet, even parity, superconductivity is treated. The paper is concluded
with a discussion of the nature of the ground state of two-dimensional,
disordered electron systems.
","[{""version"":""v1"",""created"":""Sun, 25 Jul 1999 19:24:04 GMT""},{""version"":""v2"",""created"":""Wed, 22 Dec 1999 21:43:12 GMT""}]","2017-09-27"
"cond-mat/9907384","Dietrich Belitz","R. Narayanan, Thomas Vojta, D. Belitz, and T.R. Kirkpatrick","Rare regions and annealed disorder in quantum phase transitions","4 pp., LaTeX, 1 eps fig., requires annalen.cls (included),
  Contribution to Localisation 99, final version as published","Ann. Phys. (Leipzig) vol. 8 Spec. Issue, pp. SI--185-SI--188
  (1999)",,"db/99/3","cond-mat.stat-mech",,"  The Griffiths region that is due to rare regions and the resulting local
moments in disordered itinerant quantum magnets, and its influence on the
critical behavior, is considered within the framework of an effective field
theory. It is shown that the local moments can be described in terms of static,
annealed disorder, and the physical consequences of this description are
discussed.
","[{""version"":""v1"",""created"":""Sun, 25 Jul 1999 19:34:05 GMT""},{""version"":""v2"",""created"":""Wed, 22 Dec 1999 21:57:10 GMT""}]","2007-05-23"
