"cs/9907041","Joerg Rothe","Bernd Borchert, Lane A. Hemaspaandra and Joerg Rothe","Restrictive Acceptance Suffices for Equivalence Problems","14 pages; to appear in Proc. FCT'99",,,"Revises Friedrich-Schiller-Universit\""at Jena Technical Report
  Math/Inf/96/13","cs.CC",,"  One way of suggesting that an NP problem may not be NP-complete is to show
that it is in the class UP. We suggest an analogous new approach---weaker in
strength of evidence but more broadly applicable---to suggesting that
concrete~NP problems are not NP-complete. In particular we introduce the class
EP, the subclass of NP consisting of those languages accepted by NP machines
that when they accept always have a number of accepting paths that is a power
of two. Since if any NP-complete set is in EP then all NP sets are in EP, it
follows---with whatever degree of strength one believes that EP differs from
NP---that membership in EP can be viewed as evidence that a problem is not
NP-complete.
  We show that the negation equivalence problem for OBDDs (ordered binary
decision diagrams) and the interchange equivalence problem for 2-dags are in
EP. We also show that for boolean negation the equivalence problem is in
EP^{NP}, thus tightening the existing NP^{NP} upper bound. We show that FewP,
bounded ambiguity polynomial time, is contained in EP, a result that is not
known to follow from the previous SPP upper bound. For the three problems and
classes just mentioned with regard to EP, no proof of membership/containment in
UP is known, and for the problem just mentioned with regard to EP^{NP}, no
proof of membership in UP^{NP} is known. Thus, EP is indeed a tool that gives
evidence against NP-completeness in natural cases where UP cannot currently be
applied.
","[{""version"":""v1"",""created"":""Mon, 26 Jul 1999 10:50:48 GMT""}]","2007-05-23"
"gr-qc/9907079","Pilar Infante","M. P. Infante (1 and 2), N. Sanchez (1) ((1) Obs. Paris-DEMIRM, (2)
  DFTUZ-Univ. Zaragoza)","Linking a Minimal Theoretical Model of Scale Factor Evolution with
  Observational Universe Information","LaTeX, 29 pages with 1 figure. Uses epsfig and psfrag",,,"DFTUZ/99/12","gr-qc astro-ph hep-ph hep-th",,"  We study several approaches for constructing a minimal model of Universe
evolution by matching different stages of scale factor laws. We discuss the
continuity in the transitions among the stages and the time variables involved.
We develop a way to modelize these transitions without loss of observational
predictability. The key is the scale factor and its connection with minimal but
well stablished observational information (transition times and expansion
ratii). This construction is clearly useful in metric perturbations type
computations, but it can be applied in whatever subject dealing with a
cosmology involving different evolution stages.
","[{""version"":""v1"",""created"":""Sun, 25 Jul 1999 17:00:18 GMT""}]","2007-05-23"
"gr-qc/9907080","Moshe Carmeli","Moshe Carmeli (Ben Gurion U.)","Aspects of Cosmological Relativity","15 pages; invited talk at the Fourth Alexander Friedmann Seminar on
  Gravitation and Cosmology; accepted for publication in Intern. J. Theor.
  Phys., to appear July 1999","Int.J.Theor.Phys. 38 (1999) 1993",,,"gr-qc astro-ph math-ph math.MP",,"  We review cosmological relativity, a new special theory of relativity that
was recently developed for cosmology, and discuss in detail some of its
aspects.
","[{""version"":""v1"",""created"":""Sun, 25 Jul 1999 16:57:58 GMT""}]","2007-05-23"
"gr-qc/9907081","Ilya Shapiro","J.A. Helayel-Neto, A. Penna-Firme and I. L. Shapiro","Conformal symmetry, anomaly and effective action for metric-scalar
  gravity with torsion","15 pages, LaTeX. Essentially extended version, in particular the
  discussion of the stability of the conformal factor in gravity theory with
  torsion and scalar added. Title also modified. To be published in Physics
  Letters B","Phys.Lett. B479 (2000) 411-420","10.1016/S0370-2693(00)00342-7","DF/UFJF-99/11","gr-qc",,"  We consider some aspects of conformal symmetry in a metric-scalar-torsion
system. It is shown that, for some special choice of the action, torsion acts
as a compensating field and the full theory is conformally equivalent to
General Relativity on classical level. Due to the introduction of torsion, this
equivalence can be provided for the positively-defined gravitational and scalar
actions. One-loop divergences arising from the scalar loop are calculated and
both the consequent anomaly and the anomaly-induced effective action are
derived.
","[{""version"":""v1"",""created"":""Mon, 26 Jul 1999 11:07:20 GMT""},{""version"":""v2"",""created"":""Tue, 21 Mar 2000 19:21:09 GMT""}]","2009-10-31"
"gr-qc/9907082","Sawa Manoff","Sawa Manoff, Rumyan Lazov","Projections and covariant divergency of energy-momentun tensors","39 pages",,,,"gr-qc",,"  The invariant projections of the energy-momentum tensors of Lagrangian
densities for tensor fields over differentiable manifolds with contravariant
and covariant affine connections and metrics [$(\bar{L}_n,g)$-spaces] are found
by the use of an non-null (non-isotropic) contravariant vector field and its
corresponding projective metrics. The notions of rest mass density, momentum
density, energy current density and stress tensor are introduced as
generalizations of these notions from the relativistic continuum media
mechanics. The energy-momentum tensors are represented by means of the
introduced notions and the corresponding identities are found. The notion of
covariant differential operator along a contravariant tensor field is
introduced. On its basis, as a special case, the notion of contravariant metric
differential operator is proposed. The properties of the operators are
considered. By the use of these operators the notion of covariant divergency of
a mixed tensor field is determined. The covariant divergency of tensor fields
of second rank of the types 1 and 2 is found. Invariant representations of the
covariant divergency of the energy-momentum tensor are obtained by means of the
projective metrics of a contravariant non-isotropic (non-null) vector field and
the corresponding rest mass density, momentum density, and energy flux density.
An invariant representation of the first Noether identity is found as well as
relations between the covariant divergencies of the different energy-momentum
tensors and their structures determining covariant local conserved quantities.
","[{""version"":""v1"",""created"":""Mon, 26 Jul 1999 13:06:05 GMT""}]","2007-05-23"
"hep-ph/9907482",,"Li Gang Jin (Peking Univ.), Chong Sheng Li (Peking Univ.), Robert J.
  Oakes (Northwestern Univ.), Shou Hua Zhu (ITP,Academia Sinica, Beijing)","Yukawa Corrections to Charged Higgs Boson Production in Association with
  a Top Quark at Hadron Colliders","19 pages including 2 eps figures, using axodraw.sty","Eur.Phys.J.C14:91-101,2000","10.1007/s100520050736",,"hep-ph",,"  We calculate the Yukawa corrections of order
$O(\alpha_{ew}m_{t(b)}^{2}/m_{W}^{2})$ to charged Higgs boson production in
association with a top quark at the Tevatron and the LHC. The corrections are
not very sensitive to the mass of the charged Higgs boson and can exceed -20%
for low values of $\tan\beta$, where the contribution of the top quark is
large, and high values of $\tan\beta$ where the contribution of the bottom
quark becomes large. These Yukawa corrections could be significant for charged
Higgs boson discovery searches based on this production process, particularly
at the LHC where the cross section is relatively large.
","[{""version"":""v1"",""created"":""Mon, 26 Jul 1999 10:12:39 GMT""},{""version"":""v2"",""created"":""Wed, 4 Aug 1999 01:32:58 GMT""},{""version"":""v3"",""created"":""Wed, 13 Oct 1999 09:12:50 GMT""}]","2019-08-17"
"hep-ph/9907484","Lianshou  Liu","Wang Qin, Li Zhiming and Liu Lianshou","Model Investigation of Non-Thermal Phase Transition in High Energy
  Collisions","8 pages 3 PS figures","Sci. China Ser. A43 (2000) 780-784",,"HZPP-9904","hep-ph",,"  The Non-thermal phase transition in high energy collisions is studied in some
detail in the framework of random cascade model. The relation between the
characteristic parameter $\lambda_q$ of phase transition and the rank $q$ of
moment is obtained using Monte Carlo simulation, and the existence of two
phases in self-similarly cascading multiparticle systems is shown. The relation
between the critical point $q_c$ of phase transition on the fluctuation
parameter $\alpha$ is obtained and compared with the experimental results from
NA22. The same study is carried out also by analytical calculation under
central limit approximation. The range of validity of the central limit
approximation is discussed.
","[{""version"":""v1"",""created"":""Mon, 26 Jul 1999 01:59:26 GMT""}]","2007-05-23"
"hep-ph/9907485","Carlo Giunti","C. Giunti","Four-neutrino mixing","8 pages. Talk presented at the Xth International School ""Particles
  and Cosmology"", 19-25 April 1999, Baksan Valley, Kabardino-Balkaria, Russia",,,"KIAS-P99067","hep-ph hep-ex",,"  It is shown that only two four-neutrino schemes are compatible with the
results of all neutrino oscillation experiments. These two schemes have a mass
spectrum composed of two pairs of neutrinos with close masses separated by the
""LSND gap"" of the order of 1 eV.
","[{""version"":""v1"",""created"":""Mon, 26 Jul 1999 07:55:08 GMT""},{""version"":""v2"",""created"":""Mon, 26 Jul 1999 23:16:28 GMT""}]","2007-05-23"
"hep-ph/9907486",,"L. D. Soloviev","Masses and Internal Structure of Mesons in the String Quark Model","30 pages, REVTEX, 6 tables","Phys.Rev. D61 (2000) 015009","10.1103/PhysRevD.61.015009","IHEP 99-10, Protvino 1999","hep-ph",,"  The relativistic quantum string quark model, proposed earlier, is applied to
all mesons, from pion to $\Upsilon$, lying on the leading Regge trajectories
(i.e., to the lowest radial excitations in terms of the potential quark
models). The model describes the meson mass spectrum, and comparison with
measured meson masses allows one to determine the parameters of the model:
current quark masses, universal string tension, and phenomenological constants
describing nonstring short-range interaction. The meson Regge trajectories are
in general nonlinear; practically linear are only trajectories for light-quark
mesons with non-zero lowest spins. The model predicts masses of many new
higher-spin mesons. A new $K^*(1^-)$ meson is predicted with mass 1910 Mev. In
some cases the masses of new low-spin mesons are predicted by extrapolation of
the phenomenological short-range parameters in the quark masses. In this way
the model predicts the mass of $\eta_b(1S)(0^{-+})$ to be $9500\pm 30$ MeV, and
the mass of $B_c(0^-)$ to be $6400\pm 30$ MeV (the potential model predictions
are 100 Mev lower). The relativistic wave functions of the composite mesons
allow one to calculate the energy and spin structure of mesons. The average
quark-spin projections in polarized $\rho$-meson are twice as small as the
nonrelativistic quark model predictions. The spin structure of $K^*$ reveals an
80% violation of the flavour SU(3). These results may be relevant to
understanding the ``spin crises'' for nucleons.
","[{""version"":""v1"",""created"":""Mon, 26 Jul 1999 10:06:16 GMT""}]","2009-10-31"
"hep-ph/9907487","Chi-Sing Lam","I.M. Dremin, C.S. Lam, and V.A. Nechitailo","High Order Perturbative QCD Approach to Multiplicity Distributions of
  Quark and Gluon Jets","17 pages with 1 figure","Phys.Rev.D61:074020,2000","10.1103/PhysRevD.61.074020",,"hep-ph",,"  The second and third factorial moments of the multiplicity distributions of
gluon and quark jets are calculated up to the next-to-next-to-next-to leading
order in perturbative QCD, using the equations for generating functions. The
results are confronted with experimental data. A general discussion on high
order corrections revealed by such an approach is given. Other possible
corrections and approaches are discussed as well.
","[{""version"":""v1"",""created"":""Mon, 26 Jul 1999 13:06:19 GMT""}]","2011-07-19"
"hep-ph/9907488","Marco Radici","A. Bianconi, S. Boffi, R. Jakob, M. Radici","Two-hadron interference fragmentation functions. Part II: a model
  calculation","RevTeX, 7 figures, 1 Table, second part of a work split in two, first
  part see hep-ph/9907475","Phys.Rev. D62 (2000) 034009","10.1103/PhysRevD.62.034009",,"hep-ph",,"  We present a model calculation of leading order interference fragmentation
functions arising from the distribution of two hadrons produced in the same jet
of a fragmenting quark in a hard process. Using a simple spectator model for
the mechanism of the hadronization process, for the first time we give a
complete calculation and numerical estimates for the example of a proton-pion
pair production with its invariant mass on the Roper resonance.
","[{""version"":""v1"",""created"":""Mon, 26 Jul 1999 13:06:27 GMT""}]","2009-10-31"
"hep-ph/9907489","Bernd Kniehl","B.A. Kniehl and A.A. Penin","Ultrasoft Effects in Heavy-Quarkonium Physics","14 pages (Latex), 5 figures (Axodraw), one reference added, accepted
  for publication in Nuclear Physics B","Nucl.Phys. B563 (1999) 200-210","10.1016/S0550-3213(99)00564-7","DESY 99-099, MPI/PhT/99-029","hep-ph",,"  In the framework of nonrelativistic QCD, we consider a new class of radiative
corrections, which are generated at next-to-next-to-next-to-leading order
through the chromoelectric dipole interaction of heavy quarkonium with
ultrasoft virtual gluons. We provide analytical formulae from which the
resulting shifts in the quarkonium energy levels and the wave functions at the
origin may be calculated. We discuss the phenomenological implications for the
top-antitop and Upsilon systems and point out some limitations of describing
charmonium using a Coulomb potential.
","[{""version"":""v1"",""created"":""Mon, 26 Jul 1999 13:55:08 GMT""},{""version"":""v2"",""created"":""Tue, 21 Sep 1999 17:38:41 GMT""}]","2009-10-31"
"hep-ph/9907490","Chi-Sing Lam","C.S. Lam","Time Ordering, Energy Ordering, and Factorization","16 pages in revtex","J.Math.Phys. 41 (2000) 4497-4507","10.1063/1.533356",,"hep-ph math-ph math.MP",,"  Relations between integrals of time-ordered product of operators, and their
representation in terms of energy-ordered products are studied. Both can be
decomposed into irreducible factors and these relations are discussed as well.
The energy-ordered representation was invented to separate various infrared
contributions in gauge theories. It is shown that the irreducible time-ordered
expressions can be used to accomplish the same purpose. Besides, it has the
added advantage of being factorizable.
","[{""version"":""v1"",""created"":""Mon, 26 Jul 1999 14:15:48 GMT""}]","2015-06-25"
"hep-ph/9907491","Thorsten Feldmann","Thorsten Feldmann (Univ. Wuppertal)","Quark structure of pseudoscalar mesons","48 pages, 7 figures, using epsfig.sty","Int.J.Mod.Phys.A15:159-207,2000","10.1142/S0217751X00000082","WUB 99/19","hep-ph nucl-th",,"  I review to which extent the properties of pseudoscalar mesons can be
understood in terms of the underlying quark (and eventually gluon) structure.
Special emphasis is put on the progress in our understanding of eta-eta'
mixing. Process-independent mixing parameters are defined, and relations
between different bases and conventions are studied. Both, the low-energy
description in the framework of Chiral Perturbation Theory and the high-energy
application in terms of light-cone wave functions for partonic Fock states, are
considered. A thorough discussion of theoretical and phenomenological
consequences of the mixing approach will be given. Finally, I will discuss
mixing with other states pi^0, eta(c), ...).
","[{""version"":""v1"",""created"":""Mon, 26 Jul 1999 14:21:53 GMT""},{""version"":""v2"",""created"":""Thu, 28 Oct 1999 12:17:16 GMT""}]","2014-11-17"
"hep-ph/9907492",,"H. Walliser and G. Holzwarth","The Casimir energy of skyrmions in the 2+1-dimensional O(3)-model","24 pages LaTeX, 14 figures",,"10.1103/PhysRevB.61.2819",,"hep-ph cond-mat",,"  One-loop quantum corrections to the classical vortices in 2+1 dimensional
O(3)-models are evaluated. Skyrme and Zeeman potential terms are used to
stabilize the size of topological solitons. Contributions from zero modes,
bound-states and scattering phase-shifts are calculated for vortices with
winding index n=1 and n=2. For both cases the S-matrix shows a pronounced
series of resonances for magnon-vortex scattering in analogy to the
well-established baryon resonances in hadron physics, while vortices with n>2
are already classically unstable against decay. The quantum corrections
destabilize the classically bound n=2 configuration. Approximate independence
of the results with respect to changes in the renormalization scale is
demonstrated.
","[{""version"":""v1"",""created"":""Mon, 26 Jul 1999 14:24:20 GMT""}]","2009-10-31"
"hep-ph/9907493","Alexander V. Kuznetsov","A.V. Kuznetsov, N.V. Mikheev","Plasma influence on the neutrino - electron processes in a strong
  magnetic field","8 pages, 1 ps figure, LaTeX, uses espcrc2.sty,epsf.sty, based on the
  talks presented at the Xth International Baksan School ""Particles and
  Cosmology"", Baksan Valley, Kabardino Balkaria, Russia, April 19-25, 1999 and
  the International Workshop ""Particles in Astrophysics and Cosmology: From
  Theory to Observation"", Valencia, Spain, May 3-8, 1999","Nucl.Phys.Proc.Suppl. 81 (2000) 302-308","10.1016/S0920-5632(99)00890-7","YARU-HE-99/05","hep-ph astro-ph",,"  An influence of the magnetized electron - positron plasma on the absorption
and loss of the energy and momentum in a process of neutrino propagation is
investigated. A total contribution of all crossed processes, $\nu \to \nu e^-
e^+$, $\nu e^- \to \nu e^-$, $\nu e^+ \to \nu e^+$, $\nu e^- e^+ \to \nu$, is
found for the first time, which appears not to depend on the chemical potential
of electron-positron gas. Relatively simple expressions for the probability and
mean losses of the neutrino energy and momentum are obtained, which are
suitable for a quantitative analysis.
","[{""version"":""v1"",""created"":""Mon, 26 Jul 1999 14:45:58 GMT""}]","2009-10-31"
"hep-ph/9907494","Carlo Oleari","C. Anastasiou, E.W.N. Glover and C. Oleari","Scalar One-Loop Integrals using the Negative-Dimension Approach","54 pages, 4 figures","Nucl.Phys.B572:307-360,2000","10.1016/S0550-3213(99)00637-9","DTP/99/80","hep-ph hep-th",,"  We study massive one-loop integrals by analytically continuing the Feynman
integral to negative dimensions as advocated by Halliday and Ricotta and
developed by Suzuki and Schmidt. We consider n-point one-loop integrals with
arbitrary powers of propagators in general dimension D. For integrals with m
mass scales and q external momentum scales, we construct a template solution
valid for all n which allows us to obtain a representation of the graph in
terms of a finite sum of generalised hypergeometric functions with m+q-1
variables. All solutions for all possible kinematic regions are given
simultaneously, allowing the investigation of different ranges of variation of
mass and momentum scales.
  As a first step, we develop the general framework and apply it to massive
bubble and vertex integrals. Of course many of these integrals are well known
and we show that the known results are recovered. To give a concrete new
result, we present expressions for the general vertex integral with one
off-shell leg and two internal masses in terms of hypergeometric functions of
two variables that converge in the appropriate kinematic regions. The kinematic
singularity structure of this graph is sufficiently complex to give insight
into how the negative-dimension method operates and gives some hope that more
complicated graphs can also be evaluated.
","[{""version"":""v1"",""created"":""Mon, 26 Jul 1999 14:48:09 GMT""}]","2008-11-26"
"hep-ph/9907495","Martin Maul","V. M. Braun (U. Regensburg), A. Khodjamirian (U. Wuerzburg), and M.
  Maul (NORDITA)","Pion Form Factor in QCD at Intermediate Momentum Transfers","to appear in Phys. Rev. D., one equation (Eq.(51) in old version) is
  eliminated and some new text added. None of the results are changed","Phys.Rev.D61:073004,2000","10.1103/PhysRevD.61.073004","TPR-99-10, WUE-ITP-99-014, NORDITA-1999/43 HE","hep-ph",,"  We present a quantitative analysis of the electromagnetic pion form factor in
the light-cone sum rule approach, including radiative corrections and
higher-twist effects. The comparison to the existing data favors the asymptotic
profile of the pion distribution amplitude and allows to estimate the
deviation: $(\int du/u \phi_\pi(u))/ (\int du/u \phi^{\rm as}_\pi(u))=$
1.1$\pm$ 0.1 at the scale 1 GeV. Special attention is payed to the precise
definition and interplay of soft and hard contributions at intermediate
momentum transfer, and to matching of the sum rule to the perturbative QCD
prediction. We observe a strong numerical cancellation between the soft (end
point) contribution and power suppressed hard contributions of higher twist, so
that the total nonperturbative correction to the usual pQCD result turns out to
be of order 30% for $Q^2\sim 1$ GeV$^2$.
","[{""version"":""v1"",""created"":""Mon, 26 Jul 1999 15:20:13 GMT""},{""version"":""v2"",""created"":""Mon, 8 Nov 1999 21:21:26 GMT""}]","2011-05-05"
"hep-ph/9907496","Lee Jae Sik","S.Y. Choi and Jae Sik Lee","Decays of the MSSM Higgs Bosons with Explicit CP Violation","28 pages, 10 figures, some references added and corrected","Phys.Rev.D61:015003,1999","10.1103/PhysRevD.61.015003","KIAS-P99066, MADPH-99-1131","hep-ph",,"  We study Higgs boson decays in the minimal supersymmetric standard model
where the tree-level CP invariance of the Higgs potential is explicitly broken
by loop effects of soft CP-violating Yukawa interactions related to scalar
quarks of the third generation. The scalar-pseudoscalar mixing among two
neutral CP-even Higgs bosons and one CP-odd Higgs boson due to explicit CP
violation modifies their tree-level couplings to fermions, to the W^\pm and Z
bosons and to Higgs bosons themselves significantly. We analyze the
phenomenological impact of explicit CP violation on the branching ratios of the
neutral Higgs boson decays in detail and discuss how to directly confirm the
existence of explicit CP violation through \tau^+ \tau^- and t \bar{t} spin
correlations in the decays of the neutral Higgs bosons into a tau-lepton pair
and a top-quark pair.
","[{""version"":""v1"",""created"":""Mon, 26 Jul 1999 15:32:09 GMT""},{""version"":""v2"",""created"":""Wed, 1 Sep 1999 02:50:50 GMT""},{""version"":""v3"",""created"":""Fri, 3 Sep 1999 06:40:07 GMT""}]","2008-11-26"
"hep-th/9907185","Pilar Infante","M. P. Infante (1 and 2), N. Sanchez (1) ((1) Obs. Paris-DEMIRM, (2)
  DFTUZ-Univ. Zaragoza)","The Primordial Gravitational Wave Background in String Cosmology","LaTeX, 50 pages with 2 figures. Uses epsfig and psfrag","Phys.Rev. D61 (2000) 083515","10.1103/PhysRevD.61.083515","DFTUZ/99/13","hep-th astro-ph gr-qc hep-ph",,"  We find the spectrum P(w)dw of the gravitational wave background produced in
the early universe in string theory. We work in the framework of String Driven
Cosmology, whose scale factors are computed with the low-energy effective
string equations as well as selfconsistent solutions of General Relativity with
a gas of strings as source. The scale factor evolution is described by an early
string driven inflationary stage with an instantaneous transition to a
radiation dominated stage and successive matter dominated stage. This is an
expanding string cosmology always running on positive proper cosmic time. A
careful treatment of the scale factor evolution and involved transitions is
made. A full prediction on the power spectrum of gravitational waves without
any free-parameters is given. We study and show explicitly the effect of the
dilaton field, characteristic to this kind of cosmologies. We compute the
spectrum for the same evolution description with three differents approachs.
Some features of gravitational wave spectra, as peaks and asymptotic
behaviours, are found direct consequences of the dilaton involved and not only
of the scale factor evolution. A comparative analysis of different treatments,
solutions and compatibility with observational bounds or detection perspectives
is made.
","[{""version"":""v1"",""created"":""Sun, 25 Jul 1999 17:06:05 GMT""}]","2009-10-31"
"hep-th/9907187","Jose Sande Lemos","Jos\'e P. S. Lemos and Richard Kerner","The Born-Infeld electromagnetism in Kaluza-Klein theory","19 pages, Latex","Grav.Cosmol. 6 (2000) 49-58",,,"hep-th",,"  We investigate the properties of non-linear electromagnetism based on the
Born-Infeld Lagrangian in multi-dimensional theories of Kaluza-Klein type. We
consider flat space-time solutions only, which means that the space-time metric
is constant, and the only supplementary variable is the dilaton field, a
scalar. We show that in the case of Kaluza-Klein theory, the Born-Infeld
Lagrangian describes an interesting interaction between the electromagnetic and
scalar fields, whose propagation properties are modified in a non-trivial
manner.
","[{""version"":""v1"",""created"":""Mon, 26 Jul 1999 08:40:15 GMT""}]","2007-05-23"
