"cond-mat/9907385","Kiet Anh Nguyen","A. K. Nguyen and A. Sudb{\o}","Topological phase-fluctuations, amplitude fluctuations, and criticality
  in extreme type-II superconductors","30 pages, 14 figures","Phys.Rev. B60 (1999) 15307-15331","10.1103/PhysRevB.60.15307",,"cond-mat.supr-con",,"  We study the effect of critical fluctuations on the $(B,T)$ phase diagram in
extreme type-II superconductors in zero and finite magnetic field using
large-scale Monte Carlo simulations on the Ginzburg-Landau model in a frozen
gauge approximation. We show that a vortex-loop unbinding gives a correct
picture of the zero field superconducting-normal transition even in the
presence of amplitude fluctuations, which are far from being critical at $T_c$.
We extract critical exponents of the dual model by studying the topological
excitations of the original model. From the vortex-loop distribution function
we extract the anomalous dimension of the dual field $\eta \simeq -0.18$, and
conclude that the charged Ginzburg-Landau model and the neutral 3DXY model
belong to different universality classes. We find are two distinct scaling
regimes for the vortex-line lattice melting line: a high-field scaling regime
and a distinct low-field 3DXY critical scaling regime. We also find indications
of an abrupt change in the connectivity of the vortex-tangle in the vortex
liquid along a line $T_L \geq T_M$. This is the finite field counter-part of
the zero-field vortex-loop blowout. Which at low enough fields appears to
coincide with $T_M$. Here, a description of the vortex system only in terms of
field induced vortex lines is inadequate at and above the VLL melting
temperature.
","[{""version"":""v1"",""created"":""Sun, 25 Jul 1999 22:02:57 GMT""}]","2009-10-31"
"cond-mat/9907386","Kiet Anh Nguyen","A. Sudb{\o}, A. K. Nguyen and J. Hove","Anomalous scaling dimensions and critical points in type-II
  superconductors","2 pages, 1 figure",,"10.1016/S0921-4526(99)01571-9",,"cond-mat.supr-con",,"  The existence of a {\it stable critical point}, separate from the Gaussian
and XY critical points, of the Ginzburg-Landau theory for superconductors, is
demonstrated by direct extraction via Monte-Carlo simulations, of a negative
anomalous dimension $\eta_{\phi}$ of a complex scalar field $\phi$ forming a
dual description of a neutral superfluid. The dual of the neutral superfluid is
isomorphic to a charged superfluid coupled to a massless gauge-field. The
anomalous scaling dimension of the superfluid order-field is positive, while we
find that the anomalous dimension of the dual field is negative. The dual
gauge-field does not decouple from the dual complex matter-field at the
critical point. {\it These two critical theories represent separate fixed
points.} The physical meaning of a negative $\eta_{\phi}$ is that the
vortex-loop tangle of the superfluid at the critical point fills space {\it
more} efficiently than random walkers, {\it without collapsing}. This is due to
the presence of the massless dual gauge-field, and the resulting long-ranged
{\it vectorial} Biot-Savart interaction between vortex-loop segments, which is
a relevant perturbation to the steric $|\psi|^4$ repulsion term. Hence, the
critical dual theory is not in the universality class of the $|\psi|^4$-theory.
","[{""version"":""v1"",""created"":""Sun, 25 Jul 1999 22:22:42 GMT""}]","2009-10-31"
"cond-mat/9907387","Hasegawa","Hideo Hasegawa (Tokyo Gakugei Univ.)","A quantitative comparison between spike-train responses of the
  Hodgkin-Huxley and integrate-and-fire neurons","15 pages, 4 figures; changed Title and augmented contents including
  the inhibitory-input case","Bull. Tokyo Gakugei Univ. Sect. IV, 53 (2001) 31",,,"cond-mat.dis-nn q-bio.NC",,"  Spike-train responses of single Hodgkin-Huxley (HH) and integrate-and-fire
(IF) neurons with and without the refractory period, are calculated and
compared. The HH and IF neurons are assumed to receive spike-train inputs with
the constant interspike intervals (ISIs) and stochastic ISIs given by the Gamma
distribution, through excitatory and inhibitory synaptic couplings: for both
the couplings the HH neuron can fire while the IF neuron can only for the
excitatory one. It is shown that the response to the constant-ISI inputs of the
IF neuron strongly depends on the refractory period and the synaptic strength
and that its response is rather different from that of the HH neuron. The
variability of HH and IF neurons depends not only on the jitter of the
stochastic inputs but also on their mean and the synaptic strength. Even for
the excitatory inputs, the type-I IF neuron may be a good substitute of the
type-II HH neuron only in the limited parameter range
","[{""version"":""v1"",""created"":""Mon, 26 Jul 1999 01:30:50 GMT""},{""version"":""v2"",""created"":""Wed, 28 Jul 1999 02:01:07 GMT""},{""version"":""v3"",""created"":""Mon, 4 Oct 1999 06:09:48 GMT""},{""version"":""v4"",""created"":""Tue, 5 Oct 1999 06:20:04 GMT""}]","2009-09-25"
"cond-mat/9907388","Masaki Oshikawa","Masaki Oshikawa (Tokyo Inst. Tech.)","Ordered phase and scaling in $Z_n$ models and the three-state
  antiferromagnetic Potts model in three dimensions","5 pages in REVTEX, 2 PostScript figures","Phys. Rev. B 61, 3430 (2000).","10.1103/PhysRevB.61.3430",,"cond-mat.stat-mech",,"  Based on a Renormalization-Group picture of $Z_n$ symmetric models in three
dimensions, we derive a scaling law for the $Z_n$ order parameter in the
ordered phase. An existing Monte Carlo calculation on the three-state
antiferromagnetic Potts model, which has the effective $Z_6$ symmetry, is shown
to be consistent with the proposed scaling law. It strongly supports the
Renormalization-Group picture that there is a single massive ordered phase,
although an apparently rotationally symmetric region in the intermediate
temperature was observed numerically.
","[{""version"":""v1"",""created"":""Mon, 26 Jul 1999 11:26:18 GMT""}]","2009-10-31"
"cond-mat/9907389","Shubashree Desikan","R.Shankar (Institute of Mathematical Sciences, INDIA.) and
  D.Shubashree (Mehta Research Institute of Mathematics and Mathematical
  Sciences, INDIA.)","A hidden Goldstone mechanism in the Kagom\'e lattice antiferromagnet","21 pages, latex file with 5 figures",,"10.1103/PhysRevB.61.12126","MRI-PHY/P990723","cond-mat.str-el",,"  In this paper, we study the phases of the Heisenberg model on the \kagome
lattice with antiferromagnetic nearest neighbour coupling $J_1$ and
ferromagnetic next neighbour coupling $J_2$. Analysing the long wavelength, low
energy effective action that describes this model, we arrive at the phase
diagram as a function of $\chi = \frac{J_2}{J_1} $. The interesting part of
this phase diagram is that for small $\chi$, which includes $\chi =0$, there is
a phase with no long range spin order and with gapless and spin zero low lying
excitations. We discuss our results in the context of earlier, numerical and
experimental work.
","[{""version"":""v1"",""created"":""Mon, 26 Jul 1999 10:38:23 GMT""}]","2009-10-31"
"cond-mat/9907390","Greetje Jongen","D. Bolle, G. Jongen and G.M. Shim","Q-Ising neural network dynamics: a comparative review of various
  architectures","To appear in the proceedings of the Int. Conf. on Math. Phys. and
  Stochastic Analysis (Lisbon, October, 1998), ed. S. Albevero et all (World
  Scientific)",,,,"cond-mat.dis-nn",,"  This contribution reviews the parallel dynamics of Q-Ising neural networks
for various architectures: extremely diluted asymmetric, layered feedforward,
extremely diluted symmetric, and fully connected. Using a probabilistic
signal-to-noise ratio analysis, taking into account all feedback correlations,
which are strongly dependent upon these architectures the evolution of the
distribution of the local field is found. This leads to a recursive scheme
determining the complete time evolution of the order parameters of the network.
Arbitrary Q and mainly zero temperature are considered. For the asymmetrically
diluted and the layered feedforward network a closed-form solution is obtained
while for the symmetrically diluted and fully connected architecture the
feedback correlations prevent such a closed-form solution. For these symmetric
networks equilibrium fixed-point equations can be derived under certain
conditions on the noise in the system. They are the same as those obtained in a
thermodynamic replica-symmetric mean-field theory approach.
","[{""version"":""v1"",""created"":""Mon, 26 Jul 1999 13:05:44 GMT""}]","2007-05-23"
"cond-mat/9907391","Nicholas A. Pertsev","N. A. Pertsev and V. G. Koukhar","Polarization Instability in Polydomain Ferroelectric Epitaxial Thin
  Films and the Formation of Heterophase Structures","5 pages, 3 figures","Physical Review Letters, vol. 84, No 16, p. 3722 (2000)","10.1103/PhysRevLett.84.3722",,"cond-mat.mtrl-sci",,"  A thermodynamic theory is developed for dense laminar domain structures in
epitaxial ferrolectric films. It is found that, at some critical misfit strain
between the film and substrate, the 90 degrees c/a/c/a domain structure becomes
unstable with respect to the appearance of the polarization component parallel
to domain walls, which results in the formation of a heterophase structure. For
PbTiO_3 and BaTiO_3 films, the stability ranges of polydomain and heterophase
states are determined using ""misfit strain - temperature"" diagrams. Dielectric
anomalies accompanying misfit-strain-driven structural transformations are
described.
","[{""version"":""v1"",""created"":""Mon, 26 Jul 1999 13:54:28 GMT""}]","2009-10-31"
"cond-mat/9907392","T. Verbeiren","D.Bolle and T.Verbeiren","Correlated patterns in non-monotonic graded-response perceptrons","4 pages, 4 figures",,"10.1103/PhysRevE.61.6027",,"cond-mat.dis-nn cond-mat.stat-mech",,"  The optimal capacity of graded-response perceptrons storing biased and
spatially correlated patterns with non-monotonic input-output relations is
studied. It is shown that only the structure of the output patterns is
important for the overall performance of the perceptrons.
","[{""version"":""v1"",""created"":""Mon, 26 Jul 1999 15:10:30 GMT""}]","2009-10-31"
"cond-mat/9907393","A. C. M. Green","A. C. M. Green and D. M. Edwards","Magnetic susceptibility of the double exchange model","18 pages, 8 figures, submitted to J. Phys.: Condens. Matter",,"10.1088/0953-8984/11/50/338",,"cond-mat.str-el",,"  Previously a many-body coherent potential approximation (CPA) was used to
study the double exchange (DE) model with quantum local spins S, both for S=1/2
and for general S in the paramagnetic state. This approximation, exact in the
atomic limit, was considered to be a many-body extension of Kubo's one-electron
dynamical CPA for the DE model. We now extend our CPA treatment to the case of
general S and spin polarization. We show that Kubo's one-electron CPA is always
recovered in the empty-band limit and that our CPA is equivalent to dynamical
mean field theory in the classical spin limit. We then solve our CPA equations
self-consistently to obtain the static magnetic susceptibility chi in the
strong-coupling limit. As in the case of the CPA for the Hubbard model we find
unphysical behaviour in chi at half-filling and no magnetic transition for any
finite S. We identify the reason for this failure of our approximation and
propose a modification which gives the correct Curie-law behaviour of chi at
half-filling and a transition to ferromagnetism for all S.
","[{""version"":""v1"",""created"":""Mon, 26 Jul 1999 15:27:00 GMT""}]","2009-10-31"
"cond-mat/9907394","Mikko Alava","M. Dube, M. Rost, K. Elder, M. Alava, S. Majaniemi, T. Ala-Nissila","Liquid Conservation and Non-local Interface Dynamics in Imbibition","4 pages, 3 figs, to appear in PRL","Phys. Rev. Lett. 83, 1628 (1999)","10.1103/PhysRevLett.83.1628",,"cond-mat.stat-mech cond-mat.dis-nn",,"  The propagation and roughening of a liquid-gas interface moving through a
disordered medium under the influence of capillary forces is considered. The
system is described by a phase-field model with conserved dynamics and spatial
disorder is introduced through a quenched random field. Liquid conservation
leads to slowing down of the average interface position H and imposes an
intrinsic correlation length \xi_\times \sim H^{1/2} on the spatial
fluctuations of the interface. The interface is statistically self affine in
space, with global roughness exponent \chi \simeq 1.25 and exhibits anomalous
scaling.
","[{""version"":""v1"",""created"":""Mon, 26 Jul 1999 15:29:21 GMT""}]","2009-10-31"
"cond-mat/9907396","Scott Zelakiewicz","S. Zelakiewicz(1), H. Noh(1), T. J. Gramila(1), L. N. Pfeiffer(2) and
  K. W. West(2) ((1) Pennsylvania State University, (2) Bell Labs -- Lucent
  Technologies)","Missing 2k_F Response for Composite Fermions in Phonon Drag","4 pages, 3 figures. Submitted to Phys. Rev. Lett",,"10.1103/PhysRevLett.85.1942",,"cond-mat.mes-hall cond-mat.str-el",,"  The response of composite Fermions to large wavevector scattering has been
studied through phonon drag measurements. While the response retains
qualitative features of the electron system at zero magnetic field, notable
discrepancies develop as the system is varied from a half-filled Landau level
by changing density or field. These deviations, which appear to be inconsistent
with the current picture of composite Fermions, are absent if half-filling is
maintained while changing density. There remains, however, a clear deviation
from the temperature dependence anticipated for 2k_F scattering.
","[{""version"":""v1"",""created"":""Mon, 26 Jul 1999 15:44:33 GMT""}]","2009-10-31"
"cs/9907033","Joerg Rothe","Lane A. Hemaspaandra and Joerg Rothe","Unambiguous Computation: Boolean Hierarchies and Sparse Turing-Complete
  Sets","27 pages","SIAM Journal on Computing vol. 26, no. 3, pp. 634--653, 1997",,"earlier version appeared as University of Rochester TR-94-483","cs.CC",,"  It is known that for any class C closed under union and intersection, the
Boolean closure of C, the Boolean hierarchy over C, and the symmetric
difference hierarchy over C all are equal. We prove that these equalities hold
for any complexity class closed under intersection; in particular, they thus
hold for unambiguous polynomial time (UP). In contrast to the NP case, we prove
that the Hausdorff hierarchy and the nested difference hierarchy over UP both
fail to capture the Boolean closure of UP in some relativized worlds.
  Karp and Lipton proved that if nondeterministic polynomial time has sparse
Turing-complete sets, then the polynomial hierarchy collapses. We establish the
first consequences from the assumption that unambiguous polynomial time has
sparse Turing-complete sets: (a) UP is in Low_2, where Low_2 is the second
level of the low hierarchy, and (b) each level of the unambiguous polynomial
hierarchy is contained one level lower in the promise unambiguous polynomial
hierarchy than is otherwise known to be the case.
","[{""version"":""v1"",""created"":""Mon, 26 Jul 1999 10:09:58 GMT""}]","2007-05-23"
"cs/9907034","Joerg Rothe","Lane A. Hemaspaandra, Zhigen Jiang, Joerg Rothe and Osamu Watanabe","Polynomial-Time Multi-Selectivity","40 pages","Journal of Universal Computer Science vol. 3, no. 3, pp. 197--229,
  1997",,"earlier version appeared as FSU Jena TR Math/Inf/96/11","cs.CC",,"  We introduce a generalization of Selman's P-selectivity that yields a more
flexible notion of selectivity, called (polynomial-time) multi-selectivity, in
which the selector is allowed to operate on multiple input strings. Since our
introduction of this class, it has been used to prove the first known (and
optimal) lower bounds for generalized selectivity-like classes in terms of
EL_2, the second level of the extended low hierarchy. We study the resulting
selectivity hierarchy, denoted by SH, which we prove does not collapse. In
particular, we study the internal structure and the properties of SH and
completely establish, in terms of incomparability and strict inclusion, the
relations between our generalized selectivity classes and Ogihara's P-mc
(polynomial-time membership-comparable) classes. Although SH is a strictly
increasing infinite hierarchy, we show that the core results that hold for the
P-selective sets and that prove them structurally simple also hold for SH. In
particular, all sets in SH have small circuits; the NP sets in SH are in Low_2,
the second level of the low hierarchy within NP; and SAT cannot be in SH unless
P = NP. Finally, it is known that P-Sel, the class of P-selective sets, is not
closed under union or intersection. We provide an extended selectivity
hierarchy that is based on SH and that is large enough to capture those
closures of the P-selective sets, and yet, in contrast with the P-mc classes,
is refined enough to distinguish them.
","[{""version"":""v1"",""created"":""Sun, 25 Jul 1999 20:55:21 GMT""}]","2007-05-23"
"cs/9907035","Joerg Rothe","Lane A. Hemaspaandra, Joerg Rothe and Gerd Wechsung","Easy Sets and Hard Certificate Schemes","26 pages","Acta Informatica vol. 34, no 11, pp. 859--879, 1997",,"earlier version appeared as FSU Jena TR Math/95/5","cs.CC",,"  Can easy sets only have easy certificate schemes? In this paper, we study the
class of sets that, for all NP certificate schemes (i.e., NP machines), always
have easy acceptance certificates (i.e., accepting paths) that can be computed
in polynomial time. We also study the class of sets that, for all NP
certificate schemes, infinitely often have easy acceptance certificates.
  In particular, we provide equivalent characterizations of these classes in
terms of relative generalized Kolmogorov complexity, showing that they are
robust. We also provide structural conditions---regarding immunity and class
collapses---that put upper and lower bounds on the sizes of these two classes.
Finally, we provide negative results showing that some of our positive claims
are optimal with regard to being relativizable. Our negative results are proven
using a novel observation: we show that the classical ``wide spacing'' oracle
construction technique yields instant non-bi-immunity results. Furthermore, we
establish a result that improves upon Baker, Gill, and Solovay's classical
result that NP \neq P = NP \cap coNP holds in some relativized world.
","[{""version"":""v1"",""created"":""Sun, 25 Jul 1999 21:05:19 GMT""}]","2007-05-23"
"cs/9907036","Joerg Rothe","Edith Hemaspaandra, Lane A. Hemaspaandra and Joerg Rothe","Exact Analysis of Dodgson Elections: Lewis Carroll's 1876 Voting System
  is Complete for Parallel Access to NP","22 pages","Journal of the ACM vol. 44, no. 6, pp. 806--825, 1997",,"earlier version appeared as University of Rochester TR-96-640","cs.CC",,"  In 1876, Lewis Carroll proposed a voting system in which the winner is the
candidate who with the fewest changes in voters' preferences becomes a
Condorcet winner---a candidate who beats all other candidates in pairwise
majority-rule elections. Bartholdi, Tovey, and Trick provided a lower
bound---NP-hardness---on the computational complexity of determining the
election winner in Carroll's system. We provide a stronger lower bound and an
upper bound that matches our lower bound. In particular, determining the winner
in Carroll's system is complete for parallel access to NP, i.e., it is complete
for $\thetatwo$, for which it becomes the most natural complete problem known.
It follows that determining the winner in Carroll's elections is not
NP-complete unless the polynomial hierarchy collapses.
","[{""version"":""v1"",""created"":""Sun, 25 Jul 1999 21:16:56 GMT""}]","2007-05-23"
"cs/9907037","Joerg Rothe","Lane A. Hemaspaandra, Zhigen Jiang, Joerg Rothe and Osamu Watanabe","Boolean Operations, Joins, and the Extended Low Hierarchy","12 pages","Theoretical Computer Science vol. 205, no. 1-2, pp. 317--327, 1998",,"earlier version appeared as University of Rochester TR-96-627","cs.CC",,"  We prove that the join of two sets may actually fall into a lower level of
the extended low hierarchy than either of the sets. In particular, there exist
sets that are not in the second level of the extended low hierarchy, EL_2, yet
their join is in EL_2. That is, in terms of extended lowness, the join operator
can lower complexity. Since in a strong intuitive sense the join does not lower
complexity, our result suggests that the extended low hierarchy is unnatural as
a complexity measure. We also study the closure properties of EL_ and prove
that EL_2 is not closed under certain Boolean operations. To this end, we
establish the first known (and optimal) EL_2 lower bounds for certain notions
generalizing Selman's P-selectivity, which may be regarded as an interesting
result in its own right.
","[{""version"":""v1"",""created"":""Sun, 25 Jul 1999 21:30:10 GMT""}]","2007-05-23"
"cs/9907038","Joerg Rothe","Lane A. Hemaspaandra and Joerg Rothe","A Second Step Towards Complexity-Theoretic Analogs of Rice's Theorem","14 pages. To appear in Theoretical Computer Science",,,"earlier version appeared as University of Rochester TR-97-662","cs.CC",,"  Rice's Theorem states that every nontrivial language property of the
recursively enumerable sets is undecidable. Borchert and Stephan initiated the
search for complexity-theoretic analogs of Rice's Theorem. In particular, they
proved that every nontrivial counting property of circuits is UP-hard, and that
a number of closely related problems are SPP-hard.
  The present paper studies whether their UP-hardness result itself can be
improved to SPP-hardness. We show that their UP-hardness result cannot be
strengthened to SPP-hardness unless unlikely complexity class containments
hold. Nonetheless, we prove that every P-constructibly bi-infinite counting
property of circuits is SPP-hard. We also raise their general lower bound from
unambiguous nondeterminism to constant-ambiguity nondeterminism.
","[{""version"":""v1"",""created"":""Sun, 25 Jul 1999 21:39:03 GMT""}]","2007-05-23"
"cs/9907039","Joerg Rothe","Edith Hemaspaandra, Lane A. Hemaspaandra and Joerg Rothe","Raising NP Lower Bounds to Parallel NP Lower Bounds","14 pages","SIGACT News vol. 28, no. 2, pp. 2--13, 1997",,"earlier version appeared as University of Rochester TR-97-658","cs.CC",,"  A decade ago, a beautiful paper by Wagner developed a ``toolkit'' that in
certain cases allows one to prove problems hard for parallel access to NP.
However, the problems his toolkit applies to most directly are not overly
natural. During the past year, problems that previously were known only to be
NP-hard or coNP-hard have been shown to be hard even for the class of sets
solvable via parallel access to NP. Many of these problems are longstanding and
extremely natural, such as the Minimum Equivalent Expression problem (which was
the original motivation for creating the polynomial hierarchy), the problem of
determining the winner in the election system introduced by Lewis Carroll in
1876, and the problem of determining on which inputs heuristic algorithms
perform well. In the present article, we survey this recent progress in raising
lower bounds.
","[{""version"":""v1"",""created"":""Sun, 25 Jul 1999 21:47:02 GMT""}]","2007-05-23"
"cs/9907040","Joerg Rothe","Joerg Rothe and Lane A. Hemaspaandra","Characterizations of the Existence of Partial and Total One-Way
  Permutations","12 pages; An extended abstract of this paper was presented at the
  Third Italian Conference on Algorithms and Complexity",,,,"cs.CC cs.CR",,"  In this note, we study the easy certificate classes introduced by
Hemaspaandra, Rothe, and Wechsung, with regard to the question of whether or
not surjective one-way functions exist. This is an important open question in
cryptology. We show that the existence of partial one-way permutations can be
characterized by separating P from the class of UP sets that, for all
unambiguous polynomial-time Turing machines accepting them, always have easy
(i.e., polynomial-time computable) certificates. This extends results of
Grollmann and Selman. By Gr\""adel's recent results about one-way functions,
this also links statements about easy certificates of NP sets with statements
in finite model theory. Similarly, there exist surjective poly-one one-way
functions if and only if there is a set L in P such that not all FewP machines
accepting L always have easy certificates. We also establish a condition
necessary and sufficient for the existence of (total) one-way permutations.
","[{""version"":""v1"",""created"":""Mon, 26 Jul 1999 10:42:16 GMT""}]","2007-05-23"
