"astro-ph/9902093","Eduardo Ros","E. Ros, J.A. Zensus, A.P. Lobanov (Max-Planck-Institut fuer
  Radioastronomie, Bonn, Germany)","Multiband polarimetric and total intensity imaging of 3C345","LaTeX file, 6 pages, 2 figures, needs ""elsart"" style package To be
  published in New Astronomy Reviews, special issue: Proceedings of the 4th
  EVN/JIVE VLBI Symposium, Eds. Garrett, M.A., Campbell, R.M., & Gurvits, L.J","New Astron.Rev. 43 (1999) 717-721","10.1016/S1387-6473(99)00085-8",,"astro-ph",,"  We monitored the superluminal QSO 3C 345 at three epochs during a one-year
period in 1995--1996, observing with the VLBA at 22, 15, 8.4, and 5 GHz. We
imaged the radio source both in total and in polarized intensity. In the images
at 5 and 8.4 GHz, the jet emission is traced up to 20 milliarcseconds (mas)
from the jet core. In the 15 and 22 GHz images, we identify several enhanced
emission regions moving at apparent speeds of 5c. Images of the linear
polarized emission show predominantly an alignment of the electric vector with
the extremely curved jet along the inner part of the high frequency jet. At 5
GHz, the jet shows remarkably strong fractional polarization (m~15%) with the
electric vector perpendicular to the jet orientation.
","[{""version"":""v1"",""created"":""Fri, 5 Feb 1999 14:59:57 GMT""}]","2009-10-31"
"chao-dyn/9902005","Kim S.-Y.","Sang-Yoon Kim","Nonlinear Dynamics of A Damped Magnetic Oscillator","12 pages, RevTeX",,"10.1088/0305-4470/32/39/302",,"chao-dyn nlin.CD",,"  We consider a damped magnetic oscillator, consisting of a permanent magnet in
a periodically oscillating magnetic field. A detailed investigation of the
dynamics of this dissipative magnetic system is made by varying the field
amplitude $A$. As $A$ is increased, the damped magnetic oscillator, albeit
simple looking, exhibits rich dynamical behaviors such as symmetry-breaking
pitchfork bifurcations, period-doubling transitions to chaos,
symmetry-restoring attractor-merging crises, and saddle-node bifurcations
giving rise to new periodic attractors. Besides these familiar behaviors, a
cascade of ``resurrections'' (i.e., an infinite sequence of alternating
restabilizations and destabilizations) of the stationary points also occurs. It
is found that the stationary points restabilize (destabilize) through
alternating subcritical (supercritical) period-doubling and pitchfork
bifurcations. We also discuss the critical behaviors in the period-doubling
cascades.
","[{""version"":""v1"",""created"":""Fri, 5 Feb 1999 03:22:32 GMT""}]","2009-10-31"
"comp-gas/9902001","Henryk Fuks","Henryk Fuks","Exact results for deterministic cellular automata traffic models","13 pages, 4 figures","Phys. Rev. E 60 197-202 (1999)","10.1103/PhysRevE.60.197",,"comp-gas cond-mat nlin.CG",,"  We present a rigorous derivation of the flow at arbitrary time in a
deterministic cellular automaton model of traffic flow. The derivation employs
regularities in preimages of blocks of zeros, reducing the problem of preimage
enumeration to a well known lattice path counting problem. Assuming infinite
lattice size and random initial configuration, the flow can be expressed in
terms of generalized hypergeometric function. We show that the steady state
limit agrees with previously published results.
","[{""version"":""v1"",""created"":""Thu, 4 Feb 1999 23:26:53 GMT""},{""version"":""v2"",""created"":""Tue, 2 Nov 1999 20:59:24 GMT""}]","2009-10-31"
"cond-mat/9902066","Yunbo Zhang","Y.-B. Zhang, J.-Q. Liang, H.J.W. Muller-Kirsten, S.-P. Kou, X.-B.
  Wang, F.-C. Pu","Quantum-Classical Phase Transition of Escape rate in Biaxial Spin
  Particles","15 pages, 8 figures","Phys.Rev.B60:12886,1999","10.1103/PhysRevB.60.12886",,"cond-mat.soft astro-ph cond-mat.mes-hall hep-th",,"  The escape rates of the biaxial single domain spin particles with and without
an applied magnetic field are investigated. Using the strict potential field
description of spin systems developed by Ulyanov and Zaslavskii we obtain new
effective Hamiltonians which are considered to be in exact spin-coordinate
correspondence unlike the well studied effective Hamiltonians with the
approximate correspondence. The sharp first-order transition is found in both
cases. The phase diagram of the transitions depending on the anisotropy
constant and the external field is also given.
","[{""version"":""v1"",""created"":""Thu, 4 Feb 1999 16:04:00 GMT""}]","2019-08-17"
"cond-mat/9902067","Bourges","Ph. Bourges, Y. Sidis, H.F. Fong, B. Keimer, L.P. Regnault, J. Bossy,
  A.S. Ivanov, D.L. Milius, and I.A. Aksay","Spin dynamics in high-$T_C$ superconductors","HTS99 Proceedings Miami (January 7-11 1999)","High Temperature Superconductivity Edited by S.E. Barnes {\it et
  al} 207-212 (CP483 American Institute of Physics, Amsterdam, 1999) .","10.1063/1.59619",,"cond-mat.supr-con cond-mat.str-el",,"  Key features of antiferromagnetic dynamical correlations in high-$T_C$
superconductors cuprates are discussed. In underdoped regime, the sharp
resonance peak, occuring exclusively in the SC state, is accompanied by a
broader contribution located around $\sim$ 30 meV which remains above $T_C$.
Their interplay may induce incommensurate structure in the superconducting
state.
","[{""version"":""v1"",""created"":""Thu, 4 Feb 1999 16:48:50 GMT""}]","2009-10-31"
"cond-mat/9902068","Susanna Manrubia","Susanna C. Manrubia and Damian H. Zanette","Stochastic multiplicative processes with reset events","8 pages, 3 figures. To appear in Phys. Rev. E","Phys. Rev. E, 59 (1999) 4945","10.1103/PhysRevE.59.4945",,"cond-mat",,"  We study a stochastic multiplicative process with reset events. It is shown
that the model develops a stationary power-law probability distribution for the
relevant variable, whose exponent depends on the model parameters. Two
qualitatively different regimes are observed, corresponding to intermittent and
regular behaviour. In the boundary between them, the mean value of the relevant
variable is time-independent, and the exponent of the stationary distribution
equals -2. The addition of diffusion to the system modifies in a non-trivial
way the profile of the stationary distribution. Numerical and analytical
results are presented.
","[{""version"":""v1"",""created"":""Thu, 4 Feb 1999 17:23:36 GMT""}]","2009-10-31"
"cond-mat/9902069","Ronald Holzloehner","Ronald Holzloehner, Martin Schoen","Attractive forces between anisotropic inclusions in the membrane of a
  vesicle","7 pages, 5 eps + 3 latex figures. REVTeX. Submitted to Eur. Phys. J.
  B",,"10.1007/s100510051023",,"cond-mat.soft cond-mat.stat-mech q-bio",,"  The fluctuation-induced interaction between two rod-like, rigid inclusions in
a fluid vesicle is studied by means of canonical ensemble Monte Carlo
simulations. The vesicle membrane is represented by a triangulated network of
hard spheres. Five rigidly connected hard spheres form rod-like inclusions that
can leap between sites of the triangular network. Their effective interaction
potential is computed as a function of mutual distance and angle of the
inclusions. On account of the hard-core potential among these, the nature of
the potential is purely entropic. Special precaution is taken to reduce lattice
artifacts and the influence of finite-size effects due to the spherical
geometry. Our results show that the effective potential is attractive and
short-range compared with the rod length L. Its well depth is of the order of
\kappa/10, where \kappa is the bending modulus.
","[{""version"":""v1"",""created"":""Thu, 4 Feb 1999 17:52:40 GMT""},{""version"":""v2"",""created"":""Fri, 30 Apr 1999 17:35:16 GMT""}]","2009-10-31"
"cond-mat/9902070","Carlos Rascon","C. Rascon, A.O. Parry, A. Sartori","Wetting at Non-Planar Substrates: Unbending & Unbinding","To be published in Physical Review E (14 pages, 4 figures)",,"10.1103/PhysRevE.59.5697",,"cond-mat.soft cond-mat.stat-mech",,"  We consider fluid wetting on a corrugated substrate using effective
interfacial Hamiltonian theory and show that breaking the translational
invariance along the wall can induce an 'unbending' phase transition in
addition to unbinding. Both first order and second order unbending transitions
can occur at and out of coexistence. Results for systems with short-ranged and
long-ranged forces establish that the unbending critical point is characterised
by hyperuniversal scaling behaviour. We show that, at bulk coexistence, the
adsorption at the unbending critical point is a universal multiple of the
adsorption for the correspondent planar system.
","[{""version"":""v1"",""created"":""Thu, 4 Feb 1999 18:28:02 GMT""}]","2009-10-31"
"cond-mat/9902071","Anthony Roberts","Anthony Roberts and Mark Knackstedt","Structure-Property Correlations in Model Composite Materials","16 pages, 19 figures","Physical Review E, Vol. 54, Pages 2313-2328 (1996)","10.1103/PhysRevE.54.2313",,"cond-mat.dis-nn cond-mat.mtrl-sci",,"  We investigate the effective properties (conductivity, diffusivity and
elastic moduli) of model random composite media derived from Gaussian random
fields and overlapping hollow spheres. The morphologies generated in the models
exhibit low percolation thresholds and give a realistic representation of the
complex microstructure observed in many classes of composites. The statistical
correlation functions of the models are derived and used to evaluate rigorous
bounds on each property. Simulation of the effective conductivity is used to
demonstrate the applicability of the bounds. The key morphological features
which effect composite properties are discussed.
","[{""version"":""v1"",""created"":""Thu, 4 Feb 1999 18:49:48 GMT""}]","2009-10-31"
"cond-mat/9902072","Enrique Diez Fernandez","V. Bellani(Pavia), E. Diez(Carlos III), R. Hey(Paul Drude), L.
  Toni(Parma), L. Tarricone(Parma), G.P. Parravicini(Pavia), F.
  Dominguez-Adame(Complutense), and R. Gomez-Alcala(Vigo)","Experimental evidence of delocalized states in random dimer
  superlattices","4 pages, 5 figures. Physical Review Letters (in press)",,"10.1103/PhysRevLett.82.2159",,"cond-mat.mes-hall cond-mat.dis-nn",,"  We study the electronic properties of GaAs-AlGaAs superlattices with
intentional correlated disorder by means of photoluminescence and vertical dc
resistance. The results are compared to those obtained in ordered and
uncorrelated disordered superlattices. We report the first experimental
evidence that spatial correlations inhibit localization of states in disordered
low-dimensional systems, as our previous theoretical calculations suggested, in
contrast to the earlier belief that all eigenstates are localized.
","[{""version"":""v1"",""created"":""Thu, 4 Feb 1999 19:59:26 GMT""}]","2009-10-31"
"cond-mat/9902073","Eli Ben-Naim","E. Ben-Naim and P.L. Krapivsky","Comment on ``Dynamic Scaling in the Spatial Distribution of Persistent
  Sites''","1 page, 2 figs",,,,"cond-mat.stat-mech",,"  In a recent paper (cond-mat/9901130), the spatial distribution of unvisited
sites in the one-dimensional single-species annihilation process was
investigated. It was claimed that this distribution is characterized by a new
length scale, and that the corresponding dynamical exponent depends upon the
initial concentration. We show numerically that this assertion is erroneous.
Regardless of the initial concentration, this spatial distribution is
characterized by the diffusive length scale.
","[{""version"":""v1"",""created"":""Thu, 4 Feb 1999 20:02:13 GMT""}]","2007-05-23"
"cond-mat/9902074","Chao Tang","Sergei Maslov, Chao Tang, and Yi-Cheng Zhang","1/f Noise and Long Configuration Memory in Bak-Tang-Wiesenfeld Models on
  Narrow Stripes","7 pages, 5 figures, Hands-on Java applets of sandpile models at
  http://cmth.phy.bnl.gov/~maslov/applets.htm","Phys. Rev. Lett. 83, 2449 (1999).","10.1103/PhysRevLett.83.2449",,"cond-mat.stat-mech adap-org nlin.AO",,"  We report our findings of an 1/f power spectrum for the total amount of sand
in directed and undirected Bak-Tang-Wiesenfeld models confined on narrow
stripes and driven locally. The underlying mechanism for the 1/f noise in these
systems is an exponentially long configuration memory giving rise to a very
broad distribution of time scales. Both models are solved analytically with the
help of an operator algebra to explicitly show the appearance of the long
configuration memory.
","[{""version"":""v1"",""created"":""Thu, 4 Feb 1999 21:31:43 GMT""}]","2009-10-31"
"cond-mat/9902075","Rudi Podgornik","Per Lyngs Hansen, Rudi Podgornik, Daniel Sven\v{s}ek and V. Adrian
  Parsegian","Buckling, Fluctuations and Collapse in Semiflexible Polyelectrolytes","30 pages + 4 eps figures",,,,"cond-mat.soft cond-mat.stat-mech",,"  We present a systematic statistical mechanical analysis of the conformational
properties of a stiff polyelectrolyte chain with intrachain attractions that
are due to counterion correlations. We show that the mean-field solution
corresponds to an Euler-like buckling instability. The effect of the
conformational fluctuations on the buckling instability is investigated, first,
qualitatively, within the harmonic (``semiclassical'') theory, then,
systematically, within a 1/d-expansion, where d denotes the dimension of
embedding space. Within the ``semiclassical'' approximation, we predict that
the effect of fluctuations is to renormalize the effective persistence length
to smaller values, but not to change the nature of the mean-field (i.e.,
buckling) behavior. Based on the 1/d-expansion we are, however, led to conclude
that thermal fluctuations are responsible for a change of the buckling behavior
which is turned into a polymer collapse. A phase diagram is constructed in
which a sequence of collapse transitions terminates at a buckling instability
that occurs at a place that varies with the magnitude of the bare persistence
length of the polymer chain, as well as with the strength and range of the
attractive potential.
","[{""version"":""v1"",""created"":""Thu, 4 Feb 1999 21:42:37 GMT""}]","2007-05-23"
"cond-mat/9902076","Carmen C. Almasan","T. Stein, G. A. Levin, and C. C. Almasan (1), D. A. Gajewski and M. B.
  Maple (2) ((1) Kent State University (2) University of California, San Diego)","Quantum Creep in Y_{1-x}Pr_{x}Ba_{2}Cu_{3}O_{7}$ Crystals: Magnetic
  Relaxation and Transport","5 Pages, 3 figures",,"10.1103/PhysRevLett.82.2955",,"cond-mat.supr-con",,"  We report transport and magnetic relaxation measurements in the mixed state
of strongly underdoped Y_{1-x}Pr_{x}Ba_{2}Cu_{3}O_{7} crystals. A transition
from thermally activated flux creep to temperature independent quantum flux
creep is observed in both transport and magnetic relaxation at temperatures T *
5 K. Flux transformer measurements indicate that the crossover to quantum creep
is preceded by a coupling transition. Based on these observations we argue that
below the coupling transition the current is confined within a very narrow
layer beneath the current contacts.
","[{""version"":""v1"",""created"":""Thu, 4 Feb 1999 22:09:10 GMT""},{""version"":""v2"",""created"":""Tue, 9 Feb 1999 22:20:01 GMT""}]","2009-10-31"
"cond-mat/9902077","Erica Carlson","E. W. Carlson, S. A. Kivelson, V. J. Emery, E. Manousakis","Classical Phase Fluctuations in High Temperature Superconductors","4 pages, 1 figure","Phys. Rev. Lett. 83, 612 (1999)","10.1103/PhysRevLett.83.612",,"cond-mat.supr-con",,"  Phase fluctuations of the superconducting order parameter play a larger role
in the cuprates than in conventional BCS superconductors because of the low
superfluid density of a doped insulator. In this paper, we analyze an XY model
of classical phase fluctuations in the high temperature superconductors using a
low-temperature expansion and Monte Carlo simulations. In agreement with
experiment, the value of the superfluid density at temperature T=0 is a quite
robust predictor of Tc, and the evolution of the superfluid density with T,
including its T-linear behavior at low temperature, is insensitive to
microscopic details.
","[{""version"":""v1"",""created"":""Thu, 4 Feb 1999 23:17:08 GMT""}]","2009-10-31"
"cond-mat/9902078","Gwang-Hee Kim","Gwang-Hee Kim (Sejong University)","Phase transition between quantum and classical regimes for the escape
  rate of a biaxial spin system","5 pages + 3 figures, to be published in Phys. Rev. B","Phys. Rev. B 59, 11847 (1999)","10.1103/PhysRevB.59.11847",,"cond-mat.mes-hall",,"  Employing the method of mapping the spin problem onto a particle one, we have
derived the particle Hamiltonian for a biaxial spin system with a transverse or
longitudinal magnetic field. Using the Hamiltonian and introducing the
parameter $p (\equiv (U_{max}-E)/(U_{max}-U_{min}))$ where $U_{max}$ (U_{min})
corresponds to the top (bottom) of the potential and $E$ is the energy of the
particle, we have studied the first- or second-order transition around the
crossover temperature between thermal and quantum regimes for the escape rate,
depending on the anisotropy constant and the external magnetic field. It is
shown that the phase boundary separating the first- and second-order transition
and its crossover temperature are greatly influenced by the transverse
anisotropy constant as well as the transverse or longitudinal magnetic field.
","[{""version"":""v1"",""created"":""Fri, 5 Feb 1999 05:31:04 GMT""}]","2009-10-31"
"cond-mat/9902079","Masaki Shigemori","Masaki Shigemori (1), Akira Shimizu (1 and 2), Tobias Brandes (1 and
  2), Jun-ichi Inoue (1 and 2) ((1) Department of Basic Science, University of
  Tokyo, Komaba, (2) Core Research for Evolutional Science and Technology, JST)","Strong Enhancement of Superconducting Correlation in a Two-Component
  Fermion Gas","5 pages including 5 PostScript figures","J. Phys. Soc. Jpn. 68, 2194-2197 (1999)","10.1143/JPSJ.68.2194",,"cond-mat.supr-con",,"  We study high-density electron-hole (e-h) systems with the electron density
slightly larger than the hole density. We find a new superconducting phase, in
which the excess electrons form Cooper pairs moving in an e-h BCS phase. The
coexistence of the e-h and e-e orders is possible because e and h have opposite
charges, whereas analogous phases are impossible in the case of two fermion
species that have the same charge or are neutral. Most strikingly, the e-h
order enhances the superconducting e-h order parameter by more than one order
of magnitude as compared with that given by the BCS formula, for the same value
of the effective e-e attractive potential \lambda^{ee}. This new phase should
be observable in an e-h system created by photoexcitation in doped
semiconductors at low temperatures.
","[{""version"":""v1"",""created"":""Fri, 5 Feb 1999 08:00:50 GMT""},{""version"":""v2"",""created"":""Sun, 7 Feb 1999 05:54:06 GMT""},{""version"":""v3"",""created"":""Wed, 19 May 1999 05:29:40 GMT""},{""version"":""v4"",""created"":""Thu, 5 Aug 1999 09:32:29 GMT""}]","2009-10-31"
"cond-mat/9902081","Jean-Louis Barrat","Pablo Jensen, Nicolas Combe, Hern\'an Larralde, Jean Louis Barrat,
  Chaouqi Misbah and Alberto Pimpinelli","Kinetics of shape equilibration for two-dimensional islands","9 pages, revtex",,"10.1007/s100510050961",,"cond-mat.mtrl-sci cond-mat.stat-mech",,"  We study the relaxation to equilibrium of two dimensional islands containing
up to 20000 atoms by Kinetic Monte Carlo simulations. We find that the commonly
assumed relaxation mechanism - curvature-driven relaxation via atom diffusion -
cannot explain the results obtained at low temperatures, where the island edges
consist in large facets. Specifically, our simulations show that the exponent
characterizing the dependence of the equilibration time on the island size is
different at high and low temperatures, in contradiction with the above cited
assumptions. Instead, we propose that - at low temperatures - the relaxation is
limited by the nucleation of new atomic rows on the large facets : this allows
us to explain both the activation energy and the island size dependence of the
equilibration time.
","[{""version"":""v1"",""created"":""Fri, 5 Feb 1999 09:23:15 GMT""}]","2009-10-31"
"cond-mat/9902082","Philippe Di Francesco","P. Di Francesco, E. Guitter (Saclay), C. Kristjansen (NBI)","Fully Packed O(n=1) Model on Random Eulerian Triangulations","12 pages, 3 figures, tex, harvmac, epsf","Nucl.Phys. B549 (1999) 657-667","10.1016/S0550-3213(99)00187-X","SPhT99/010, NBI-HE-99-03","cond-mat.stat-mech hep-th",,"  We introduce a matrix model describing the fully-packed O(n) model on random
Eulerian triangulations (i.e. triangulations with all vertices of even
valency). For n=1 the model is mapped onto a particular gravitational 6-vertex
model with central charge c=1, hence displaying the expected shift c -> c+1
when going from ordinary random triangulations to Eulerian ones. The case of
arbitrary n is also discussed.
","[{""version"":""v1"",""created"":""Fri, 5 Feb 1999 11:44:19 GMT""}]","2007-05-23"
"cond-mat/9902083","Helmut Kroger","C. Gerhardt, A. Fledderjohann, E. Aysal, K.-H. M\""utter, J.F. Audet,
  and H. Kr\""oger","\eta-Exponents in the one dimensional antiferromagnetic Heisenberg model
  with next to nearest neighbour coupling","LaTeX file (text) + 7 PS files (figures)","J. Phys. Condens. Matter 9 (1997) 3435","10.1088/0953-8984/9/16/015",,"cond-mat",,"  We investigate the critical exponents $\eta_3(\alpha,M), \eta_1(\alpha,M)$
associated with the singularities in the longitudinal and transverse structure
factors of the one dimensional antiferromagnetic Heisenberg model with nearest
(J_1) and next to nearest (J_2) neighbour coupling of relative strength $\alpha
= {J_2}/{J_1}$ and an external field $B$ with magnetization $M(B)$.
","[{""version"":""v1"",""created"":""Fri, 5 Feb 1999 15:03:05 GMT""}]","2009-10-31"
"cond-mat/9902084","Fabio Tedoldi","F. Tedoldi, R. Santachiara and M. Horvatic","Y NMR imaging of the staggered magnetization in doped Haldane chain
  Y(2)BaNi(1-x)Mg(x)O(5)","4 pages, 3 eps figures; changes in introduction and references","Phys. Rev. Lett. 83, 412 (1999)","10.1103/PhysRevLett.83.412",,"cond-mat.str-el",,"  We present a static, model-independent, experimental determination of the
spin-spin correlation length \xi in a quantum spin system. This is achieved in
doped Haldane (i.e., S=1 Heisenberg antiferromagnetic) chain
Y(2)BaNi(1-x)Mg(x)O(5) by Y NMR imaging of the staggered magnetization induced
around the Mg-impurities (i.e., chain boundaries) by magnetic field. The
magnitude of this magnetization is found to decay exponentially with \xi equal
to the theoretical prediction for an infinite S=1 chain, and the staggered
magnetic moment at the edge site showing the Curie behavior of an effective
S=1/2 spin.
","[{""version"":""v1"",""created"":""Fri, 5 Feb 1999 14:11:00 GMT""},{""version"":""v2"",""created"":""Wed, 10 Mar 1999 10:31:26 GMT""}]","2009-10-31"
"cond-mat/9902085","Henri Orland","Roland R. Netz (MPIKG, Teltow, Germany) and Henri Orland (CEA-Saclay,
  France)","Beyond Poisson-Boltzmann: Fluctuations and Correlations","12 pages, 8 postscript figures",,"10.1007/s101890050023","T99/011","cond-mat.soft cond-mat.stat-mech",,"  We formulate the non-linear field theory for a fluctuating counter-ion
distribution in the presence of a fixed, arbitrary charge distribution. The
Poisson-Boltzmann equation is obtained as the saddle-point, and the effects of
fluctuations and correlations are included by a loop-wise expansion around this
saddle point. We show that the Poisson equation is obeyed at each order in the
loop expansion and explicitly give the expansion of the Gibbs potential up to
two loops. We then apply our formalism to the case of an impenetrable, charged
wall, and obtain the fluctuation corrections to the electrostatic potential and
counter-ion density to one-loop order without further approximations. The
relative importance of fluctuation corrections is controlled by a single
parameter, which is proportional to the cube of the counter-ion valency and to
the surface charge density. We also calculate effective interactions between
charged particles, which reflect counter-ion correlation effects.
","[{""version"":""v1"",""created"":""Fri, 5 Feb 1999 13:03:20 GMT""}]","2015-06-25"
"cond-mat/9902086","A. Yu. Sivachenko","A. B. Dzyubenko (1 and 2), A. Yu. Sivachenko (3) ((1) Institut fuer
  Theoretische Physik, J.W. Goethe-Universitaet, Germany, (2) General Physics
  Institute, RAS, Moscow, Russia, (3) Weizmann Institute of Science, Israel)","Charged magnetoexcitons in two dimensions: Magnetic translations and
  families of dark states","LaTeX, 4 pages, 2 figures, replaced with a revised version",,"10.1103/PhysRevLett.84.4429",,"cond-mat.mes-hall",,"  We show that optical transitions of charged excitons in semiconductor
heterostructures are governed in magnetic fields by a novel exact selection
rule, a manifestation of magnetic translations. It is shown that the
spin-triplet ground state of the quasi-two-dimensional charged exciton X- --- a
bound state of two electrons and one hole --- is optically inactive in
photoluminescence at finite magnetic fields. Internal bound-to-bound X- triplet
transition has a specific spectral position, below the electron cyclotron
resonance, and is strictly prohibited in a translationally-invariant system.
These results allow one to discriminate between localized and free charged
excitons.
","[{""version"":""v1"",""created"":""Fri, 5 Feb 1999 14:22:50 GMT""},{""version"":""v2"",""created"":""Tue, 12 Oct 1999 19:05:56 GMT""}]","2009-10-31"
