"cond-mat/9902087","Francesco Cordero","F. Cordero (1), R. Cantelli (2), M. Corti (3), A. Campana (3) and A.
  Rigamonti (3) ((1) CNR, Ist. Acustica, Roma, Italy, (2) Univ. di Roma ``La
  Sapienza``, Dip. Fisica and INFM, Roma, Italy, (3) INFM - Dip. Fisica, Univ.
  di Pavia, Pavia, Italy)","Tilt waves dynamics of the oxygen octahedra in La2CuO4 from anelastic
  and 139La NQR relaxation","LaTeX, 3 PostScript figures, to be published in Phys. Rev. B","Phys. Rev. B 59, 12078 (1999)","10.1103/PhysRevB.59.12078",,"cond-mat.supr-con",,"  The anharmonic vibrational dynamics in nearly stoichiometric La2CuO4+delta is
studied by means of anelastic and ^{139}La NQR relaxation. In the absorption
component of the elastic susceptibility as well as in the nuclear relaxation
rate a peak is detected as a function of temperature, and a relaxation time tau
= 1.7 10^{-12} exp [(2800 K)/T] s is derived. The relaxation processes are
attributed to tilt motion of the CuO6 octahedra in doublewell potentials, whose
cooperative character increases the effective energy barrier to the observed
value. The analysis of the relaxation mechanisms has been carried out by
reducing the dynamics of the interacting octahedra to a one-dimensional
equation of motion. The soliton-like solutions correspond to parallel walls
separating domains of different tilt patterns and give rise to pseudo-diffusive
modes which appear as a central component in the spectral density of the motion
of the octahedra. The tilt waves may be considered to correspond to the
dynamical lattice stripes observed in La-based and Bi-based high-Tc
superconductors.
","[{""version"":""v1"",""created"":""Fri, 5 Feb 1999 14:56:58 GMT""}]","2010-07-23"
"cs/9902007","Craig Nevill-Manning","Ian H. Witten, Gordon W. Paynter, Eibe Frank, Carl Gutwin and Craig G.
  Nevill-Manning","KEA: Practical Automatic Keyphrase Extraction","9 pages",,,,"cs.DL",,"  Keyphrases provide semantic metadata that summarize and characterize
documents. This paper describes Kea, an algorithm for automatically extracting
keyphrases from text. Kea identifies candidate keyphrases using lexical
methods, calculates feature values for each candidate, and uses a
machine-learning algorithm to predict which candidates are good keyphrases. The
machine learning scheme first builds a prediction model using training
documents with known keyphrases, and then uses the model to find keyphrases in
new documents. We use a large test corpus to evaluate Kea's effectiveness in
terms of how many author-assigned keyphrases are correctly identified. The
system is simple, robust, and publicly available.
","[{""version"":""v1"",""created"":""Fri, 5 Feb 1999 03:15:45 GMT""}]","2016-08-31"
"cs/9902008","Mario Winter","Mario Winter","Managing Object-Oriented Integration and Regression Testing","Proc. 6th euroSTAR, Munich, 30 November-4 December 1998",,,,"cs.SE",,"  Systematic testing of object-oriented software turned out to be much more
complex than testing conventional software. Especially the highly incremental
and iterative development cycle demands both many more changes and partially
implemented resp. re-implemented classes. Much more integration and regression
testing has to be done to reach stable stages during the development. In this
presentation we propose a diagram capturing all possible dependencies and
interactions in an object-oriented program. Then we give algorithms and
coverage criteria to identify integration resp. regression test strategys and
all test cases to be executed after some implementation resp. modification
activities. Finally, we summarize some practical experiences and heuristics.
","[{""version"":""v1"",""created"":""Fri, 5 Feb 1999 12:01:56 GMT""}]","2007-05-23"
"gr-qc/9902017","John Baez","John C. Baez","Higher-Dimensional Algebra and Planck-Scale Physics","22 pages LaTeX, 6 encapsulated Postscript figures","In Physics Meets Philosophy at the Planck Length, eds. Craig
  Callender and Nick Huggett, Cambridge U. Press, Cambridge, 2001, pp. 177-195",,,"gr-qc hep-th math.CT math.QA",,"  This is a nontechnical introduction to recent work on quantum gravity using
ideas from higher-dimensional algebra. We argue that reconciling general
relativity with the Standard Model requires a `background-free quantum theory
with local degrees of freedom propagating causally'. We describe the insights
provided by work on topological quantum field theories such as quantum gravity
in 3-dimensional spacetime. These are background-free quantum theories lacking
local degrees of freedom, so they only display some of the features we seek.
However, they suggest a deep link between the concepts of `space' and `state',
and similarly those of `spacetime' and `process', which we argue is to be
expected in any background-free quantum theory. We sketch how
higher-dimensional algebra provides the mathematical tools to make this link
precise. Finally, we comment on attempts to formulate a theory of quantum
gravity in 4-dimensional spacetime using `spin networks' and `spin foams'.
","[{""version"":""v1"",""created"":""Thu, 4 Feb 1999 18:54:52 GMT""}]","2015-02-13"
"hep-ex/9902006","Thomas Junk","Thomas Junk (Carleton University, Ottawa, Canada)","Confidence Level Computation for Combining Searches with Small
  Statistics","17 pages, 2 figures, LaTeX, program available at
  http://home.cern.ch/~thomasj/searchlimits/ecl.html one replacement to fix a
  typo in a URL","Nucl.Instrum.Meth.A434:435-443,1999","10.1016/S0168-9002(99)00498-2","CARLETON/OPAL PHYS 99-01","hep-ex physics.data-an",,"  This article describes an efficient procedure for computing approximate
confidence levels for searches for new particles where the expected signal and
background levels are small enough to require the use of Poisson statistics.
The results of many independent searches for the same particle may be combined
easily, regardless of the discriminating variables which may be measured for
the candidate events. The effects of systematic uncertainty in the signal and
background models are incorporated in the confidence levels. The procedure
described allows efficient computation of expected confidence levels.
","[{""version"":""v1"",""created"":""Fri, 5 Feb 1999 13:24:18 GMT""}]","2008-11-26"
"hep-lat/9902007","Stephan Duerr","Stephan D\""urr, Stephen R. Sharpe (University of Washington, Seattle)","IR-Divergence and Anomalous Temperature Dependence of the Condensate in
  the Quenched Schwinger Model","Revtex, 15pp, 1 figure; two references corrected, to appear in Phys.
  Rev. D","Phys.Rev. D62 (2000) 034506","10.1103/PhysRevD.62.034506","UW-PT/98-19, UTCCP-P-55","hep-lat hep-th",,"  The Schwinger model is used to study the artifacts of quenching in a
controlled way. The model is solved on a finite-temperature cylinder of
circumference $\beta=1/T$ with bag-inspired local boundary conditions at the
two ends $x^1=0$ and $x^1=L$ which break the $\gamma_5$-invariance and thus
play the role of a small quark mass. The quenched chiral condensate is found to
diverge exponentially as $L\to\infty$, and to diverge (rather than melt as for
$N_{\rm f}\geq1$) if the high-temperature limit $\beta\to0$ is taken at finite
box-length $L$. We comment on the generalization of our results to the massive
quenched theory, arguing that the condensate is finite as $L\to\infty$ and
proportional to $1/m$ up to logarithms.
","[{""version"":""v1"",""created"":""Fri, 5 Feb 1999 03:00:55 GMT""},{""version"":""v2"",""created"":""Fri, 19 Mar 1999 22:26:27 GMT""},{""version"":""v3"",""created"":""Mon, 6 Mar 2000 10:52:18 GMT""},{""version"":""v4"",""created"":""Thu, 18 May 2000 08:26:29 GMT""}]","2009-10-31"
"hep-lat/9902008","Yusuke Taniguchi","Sinya Aoki, Taku Izubuchi, Yoshinobu Kuramashi and Yusuke Taniguchi","Perturbative renormalization factors of three- and four-quark operators
  for domain-wall QCD","24 pages, 2 axodraw.sty figures","Phys.Rev. D60 (1999) 114504","10.1103/PhysRevD.60.114504","UTHEP-398","hep-lat",,"  Renormalization factors for three- and four-quark operators, which appear in
the low energy effective Lagrangian of the proton decay and the weak
interactions, are perturbatively calculated in domain-wall QCD. We find that
the operators are multiplicatively renormalizable up to one-loop level without
mixing with any other operators that have different chiral structures. As an
application, we evaluate a renormalization factor for $B_K$ at the parameters
where previous simulations have been performed, and find one-loop corrections
to $B_K$ are 1-5% in these cases.
","[{""version"":""v1"",""created"":""Fri, 5 Feb 1999 08:12:00 GMT""}]","2009-10-31"
"hep-lat/9902009","Hildegard Meyer-Ortmanns","H. Meyer-Ortmanns and T. Reisz","Analytical studies for the critical line and critical endpoint of the
  electroweak phase transition","Talk presented by H. Meyer-Ortmanns at the Strong and Electroweak
  Matter `98 Conference in Copenhagen, December 2-5, 1998, 5 pages, Latex2e,
  sprocl.sty",,,"HD-THEP-99-05 and WUB-99-03","hep-lat",,"  We outline two approaches for studying the electroweak phase transition in
the framework of the four-dimensional SU(2) Higgs model on a lattice. The first
one is based on a combination of variational estimates for the free energy and
a solution of the resulting gap equations by means of dynamical linked cluster
expansions. In the second approach we first indicate the derivation of an
effective scalar field theory upon integration over the gauge fields. The phase
structure of the resulting scalar theory is then investigated by means of
generalized linked cluster expansions. We present results for the critical line
and the critical endpoint.
","[{""version"":""v1"",""created"":""Fri, 5 Feb 1999 10:54:55 GMT""}]","2007-05-23"
"hep-ph/9902243","Gerhard Schuler","F.E. Close and G.A. Schuler","Central production of mesons: Exotic states versus Pomeron structure","15 pages, latex, no figure","Phys.Lett. B458 (1999) 127-136","10.1016/S0370-2693(99)00450-5","CERN-TH/99-28","hep-ph",,"  We demonstrate that the azimuthal dependence of central meson production in
hadronic collisions, when suitably binned, provides unambiguous tests of
whether the Pomeron couples like a conserved vector-current to protons. We
discuss the possibility of discriminating between q-qbar and glueball
production in such processes. Our predictions apply also to meson production in
tagged two-photon events at electron--positron colliders and to vector-meson
production in ep collisions at HERA.
","[{""version"":""v1"",""created"":""Thu, 4 Feb 1999 17:25:42 GMT""}]","2009-10-31"
"hep-ph/9902244","Matthias Neubert","Irinel Caprini (Bucharest) and Matthias Neubert (SLAC)","Borel summation and momentum-plane analyticity in perturbative QCD","22 pages, uses JHEP.cls (included), submitted to JHEP","JHEP 9903 (1999) 007","10.1088/1126-6708/1999/03/007","SLAC-PUB-8059","hep-ph",,"  We derive a compact expression for the Borel sum of a QCD amplitude in terms
of the inverse Mellin transform of the corresponding Borel function. The result
allows us to investigate the momentum-plane analyticity properties of the
Borel-summed Green functions in perturbative QCD. An interesting connection
between the asymptotic behaviour of the Borel transform and the Landau
singularities in the momentum plane is established. We consider for
illustration the polarization function of massless quarks and the resummation
of one-loop renormalon chains in the large-$\beta_0$ limit, but our conclusions
have a more general validity.
","[{""version"":""v1"",""created"":""Fri, 5 Feb 1999 04:00:20 GMT""}]","2009-10-31"
"hep-ph/9902245","G. Baur","Gerhard Baur and Albrecht Leuschner","Bethe-Heitler cross-section for very high photon energies and large muon
  scattering angles","9 pages, 2 figures, to be published in Eur.Phys.J.C","Eur.Phys.J.C8:631-635,1999","10.1007/s100529900028",,"hep-ph",,"  The cross-section for the process $\gamma + A \to \mu^+ + \mu^- + X$ is
studied where the photon energy is of the order of several hundreds of GeV and
where one of the leptons is scattered to large angles. This is of practical
importance for muon shielding calculations at future linear electron colliders.
In addition to the photon pole contribution which was previously considered
especially by Y.S.Tsai, we identify another component due to the muon pole
(equivalent photon and equivalent muon approximation). This is discussed
following the usual Bethe-Heitler formula. Then we give practically useful
formulae for inclusive lepton (muon) production along with some numerical
examples.
","[{""version"":""v1"",""created"":""Fri, 5 Feb 1999 09:47:38 GMT""}]","2011-09-13"
"hep-ph/9902246","Afsar Abbas","Afsar Abbas","Is topological Skyrme Model consistent with the Satandard Model?","Latex file, 8 pages, no figures, revised version with new result due
  to a different condition on proton charge","Phys.Lett. B503 (2001) 81-84","10.1016/S0370-2693(01)00129-0",,"hep-ph",,"  The topological Skyrme model is known to give a successful description of
baryons. As a consistency check, here it is shown that in view of the recent
discovery of charge quantization as an intrinsic and basic property of the
Standard Model and the color dependence arising therein, the Skyrme Model is
indeed completely consistent with the Standard Model.
","[{""version"":""v1"",""created"":""Fri, 5 Feb 1999 11:42:55 GMT""},{""version"":""v2"",""created"":""Thu, 9 Nov 2000 13:45:38 GMT""}]","2009-10-31"
"hep-ph/9902247","Jing Wang","M. Cveti\v{c}, L. Everett, P. Langacker and J. Wang","Physics Implications of a Perturbative Superstring Construction","11 pages, two figures. Proceedings, contribution to the BTMSSM
  subgroup for the Physics at Run II: Supersymmetry/Higgs Summary Meeting,
  Fermilab, November 1998",,,,"hep-ph",,"  We investigate the low energy physics implications of a prototype
quasi-realistic superstring model with an anomalous U(1). First, we present the
techniques utilized to compute the mass spectrum and superpotential couplings
at the string scale, and demonstrate the results for the effective theory along
a particular flat direction/""restabilized vacuum"" of the model. We then analyze
the gauge symmetry breaking patterns and renormalization group equations to
determine the mass spectrum at the electroweak scale for a particular numerical
example with a realistic Z-Z' hierarchy. Although the model considered is not
fully realistic, the results demonstrate general features of quasi-realistic
string models, such as extra matter (e.g. Z' gauge bosons and an extended Higgs
sector) at the electroweak/TeV scale, and noncanonical couplings (such as
R-parity violating terms).
","[{""version"":""v1"",""created"":""Fri, 5 Feb 1999 14:42:11 GMT""}]","2007-05-23"
"hep-ph/9902248","Philipp Haegler","Ph. Hagler, A. Schafer, R. Kirschner, L. Szymanowski","The gluon field of a fast moving nucleus and the effective langrangian
  for QCD at high energy","13 pages, 4 figures. v2: eq. 18 corrected, modified discussion of the
  relation between the standard and the effective lagrangian approach","Phys. Rev. D 60, 054006 (1999)","10.1103/PhysRevD.60.054006","TPR-99-05","hep-ph",,"  Starting from the effective lagrangian for QCD at high energy we calculate
the lowest perturbative contributions to the potential of a relativistic
nucleus and compare our results to those derived by Kovchegov (see Y.V.
Kovchegov, Phys. Rev. {\bf D55}, 5445 (1997)). The results differ already at
order g^3 which can be traced to the fact that the meaning of the underlying
gluon fields is different. (The effective gluon field we use is a gauge
invariant object.) Both approaches should therefore be seen as alternatives,
the relative merits of which have to be judged by their phenomenological
success.
","[{""version"":""v1"",""created"":""Fri, 5 Feb 1999 15:18:18 GMT""},{""version"":""v2"",""created"":""Thu, 25 Feb 1999 16:23:43 GMT""}]","2016-08-25"
"hep-ph/9902249","Petrus Pennanen","A.M. Green, J. Koponen and P. Pennanen","A variational fit to the lattice energy of two heavy-light mesons","17 pages, 2 eps figures. Considerably revised version accepted for
  publication","Phys.Rev. D61 (2000) 014014","10.1103/PhysRevD.61.014014","HIP-1999-04/TH, NORDITA-99/7","hep-ph hep-lat nucl-th",,"  Recent lattice calculations on the interaction energy of two heavy-light
mesons (Q^2\bar{q}^2) are interpreted in terms of the potential of the
corresponding single heavy-light meson (Q\bar{q}). This model leads to a large
overestimate of the binding compared with the lattice data -- unless the basic
Q\bar{q} potential is modified to become a four-quark potential.
","[{""version"":""v1"",""created"":""Fri, 5 Feb 1999 15:19:13 GMT""},{""version"":""v2"",""created"":""Wed, 29 Sep 1999 11:01:46 GMT""}]","2009-10-31"
"hep-th/9902039","Arkady Shanenko","B. P. Kosyakov","Exact solutions in the Yang-Mills-Wong theory","REVTeX, 34 pages, no figures and tables","Phys.Rev. D57 (1998) 5032-5048","10.1103/PhysRevD.57.5032",,"hep-th",,"  This paper discusses in a systematical way exact retarded solutions to the
classical SU(N) Yang-Mills equations with the source composed of several
colored point particles. A new method of finding such solutions is reviewed.
Relying on features of the solutions, a toy model of quark binding is
suggested. According to this model, quarks forming a hadron are influenced by
no confining force in spite of the presence of a linearly rising term of the
potential. The large-N dynamics of quarks conforms well with Witten's
phenomenology. On the semiclassical level, hadrons are color neutral in the
Gauss law sense. Nevertheless, a specific multiplet structure is observable in
the form of the Regge sequences related to infinite-dimensional unitary
representations of SL(4,R) which is shown to be the color gauge group of the
background field generated by any hadron. The simultaneous consideration of
SU(N), SO(N), and Sp(N) as gauge groups offers a plausible explanation of the
fact that clusters containing two or three quarks are more stable than
multiquark clusters.
","[{""version"":""v1"",""created"":""Thu, 4 Feb 1999 16:39:51 GMT""}]","2009-10-31"
"hep-th/9902040","Mariano Cadoni","Mariano Cadoni and Salvatore Mignemi","Asymptotic symmetries of AdS_2 and conformal group in d=1","15 pages, LaTex file","Nucl.Phys. B557 (1999) 165-180","10.1016/S0550-3213(99)00398-3","INFNCA-TH9901","hep-th gr-qc",,"  We present a detailed discussion of the asymptotic symmetries of Anti-de
Sitter space in two dimensions and their relationship with the conformal group
in one dimension. We use this relationship to give a microscopical derivation
of the entropy of 2d black holes that have asymptotically Anti-de Sitter
behaviour. The implications of our results for the conjectured AdS_2/CFT_1
duality are also discussed.
","[{""version"":""v1"",""created"":""Thu, 4 Feb 1999 17:07:55 GMT""}]","2009-10-31"
"hep-th/9902041","Robert Mann","J. Gegenberg and R.B. Mann","Gravity From Topological Field Theory","Latex, 16 pages","Phys.Rev. D60 (1999) 024010","10.1103/PhysRevD.60.024010","WATPHYS-TH99/01; UNB Technical Report 99-02","hep-th gr-qc",,"  We construct a topological field theory which, on the one hand, generalizes
BF theories in that there is non-trivial coupling to `topological matter
fields'; and, on the other, generalizes the three-dimensional model of Carlip
and Gegenberg to arbitrary dimensional manifolds. Like the three dimensional
model, the theory can be considered to describe a gravitational field
interacting with topological matter. In particular, in two dimensions, the
model is that of gravity on a torus. In four dimensions, the model is shown to
admit constant curvature black hole solutions.
","[{""version"":""v1"",""created"":""Thu, 4 Feb 1999 18:12:37 GMT""}]","2009-10-31"
"hep-th/9902042","Alec Matusis","Eric D'Hoker, Daniel Z. Freedman, Samir D. Mathur, Alec Matusis and
  Leonardo Rastelli","Graviton and gauge boson propagators in AdS(d+1)","25 pages, LaTeX","Nucl.Phys.B562:330-352,1999","10.1016/S0550-3213(99)00524-6",,"hep-th gr-qc",,"  We construct the gauge field and graviton propagators in Euclidean AdS(d+1)
space-time by two different methods. In the first method the gauge invariant
Maxwell or linearized Ricci operator is applied directly to bitensor ansatze
for the propagators which reflect their gauge structure. This leads to a rapid
determination of the physical part of the propagators in terms of elementary
functions. The second method is a more traditional approach using covariant
gauge fixing which leads to a solution for both physical and gauge parts of the
propagators. The gauge invariant parts agree in both methods.
","[{""version"":""v1"",""created"":""Thu, 4 Feb 1999 22:57:05 GMT""}]","2009-10-08"
"hep-th/9902043","Avinash Dhar","Avinash Dhar","Probing D0-D6 Black Hole Configuration: 2-Loop Matrix Theory Correction
  to D0-Brane Effective Action","25 pages, latex, epsf, 1 encapsulated figure file","Nucl.Phys. B551 (1999) 155-182","10.1016/S0550-3213(99)00170-4","TIFR/TH/98-49","hep-th",,"  We present a calculation of the matrix theory 2-loop effective action for a
D0-brane in the background of the recently discussed D0-D6 bound state
configuration. The effective DBI action of a D0-brane probe in the background
of the corresponding 4-dimensional non-supersymmetric black hole solution to
low-energy type IIA string theory compactified on a 6-torus is known to agree
with the matrix theory calculation at 1-loop order, in the limit in which the
ratio of the D0-brane to the D6-brane charges carried by the black hole is
large. Agreement at 2-loop between the supergravity description and a
conjectured nonabelian BDI effective superYang-Mills description has also been
recently reported. However, we find uncanceled ultraviolet divergences in our
direct matrix theory calculation of the 2-loop effective action. This is
consistent with the expected nondecoupling of massive open string states from
the 6-brane.
","[{""version"":""v1"",""created"":""Fri, 5 Feb 1999 06:50:54 GMT""}]","2009-10-31"
"math-ph/9902008","Michael Oberguggenberger","H. Grosse, M. Oberguggenberger, I.T. Todorov","Generalized functions for quantum fields obeying quadratic exchange
  relations","15 pages, LATEX",,,"ESI Preprint No. 653","math-ph math.MP",,"  The axiomatic formulation of quantum field theory (QFT) of the 1950's in
terms of fields defined as operator valued Schwartz distributions is
re-examined in the light of subsequent developments. These include, on the
physical side, the construction of a wealth of (2-dimensional) soluble QFT
models with quadratic exchange relations, and, on the mathematical side, the
introduction of the Colombeau algebras of generalized functions. Exploiting the
fact that energy positivity gives rise to a natural regularization of Wightman
distributions as analytic functions in a tube domain, we argue that the
flexible notions of Colombeau theory which can exploit particular
regularizations is better suited (than Schwartz distributions) for a
mathematical formulation of QFT.
","[{""version"":""v1"",""created"":""Fri, 5 Feb 1999 12:41:37 GMT""}]","2007-05-23"
"math-ph/9902009","Veronique Terras","V. Terras","Drinfel'd Twists and Functional Bethe Ansatz","12 pages",,,"LPENSL-TH-01/99","math-ph math.MP",,"  Using Functional Bethe Ansatz technique, factorizing Drinfel'd Twists for any
finite dimensional irreducible representations of the Yangian Y(sl(2)) are
constructed.
","[{""version"":""v1"",""created"":""Fri, 5 Feb 1999 14:40:28 GMT""}]","2007-05-23"
"math/9902034","Won Kyu Park","Won K. Park","Normal forms of real hyepersurfaces with nondegenerate Levi form",,,,,"math.CV math.CA",,"  We present a proof of the existence and uniqueness theorem of a normalizing
biholomorphic mapping to Chern-Moser normal form. The explicit form of the
equation of a chain on a real hyperquadric is obtained. We show a family of
normal forms of nondegenerate real hypersurfaces including Chern-Moser normal
form.
","[{""version"":""v1"",""created"":""Thu, 4 Feb 1999 16:29:22 GMT""}]","2007-05-23"
"math/9902035","Won Kyu Park","Won K. Park","Umbilic points and Real hyperquadrics",,,,,"math.CV math.CA",,"  We show a refined version of the existence and uniqueness theorem to
Chern-Moser normal form. The class of nondegenerate real hypersurfaces in
normal form has a natural group action. Umbilic point is defined via normal
form. Nondegenerate analytic real hypersurfaces are locally biholomorphic to a
real hyperquadric whenever every point is umbilic in this sense.
","[{""version"":""v1"",""created"":""Thu, 4 Feb 1999 16:41:13 GMT""}]","2007-05-23"
"math/9902036","Won Kyu Park","Won K. Park","Analytic continuation of a biholomorphic mapping",,,,,"math.CV math.CA",,"  We present a new proof of Pinchuk's theorem on the analytic continuation of a
biholomorphic mapping from a strongly pseudoconvex analytic real hypersurface
to a compact strongly pseudoconvex analytic real hypersurface in a complex
euclidean space.
","[{""version"":""v1"",""created"":""Thu, 4 Feb 1999 16:50:40 GMT""}]","2007-05-23"
"math/9902037","Steven Dale Cutkosky","Steven Dale Cutkosky","Irrational Asymptotic Behaviour of Castelnuovo-Mumford Regularity","10 pages",,,,"math.AG math.AC",,"  We give examples of nonsingular curves in projective 3 space such that the
regularity of powers of their ideal sheaves are highly nonlinear. This is in
constrast to the case of an ideal I in a polynomial ring, where the regularity
of I^n is a linear polynomial in n for large n.
","[{""version"":""v1"",""created"":""Thu, 4 Feb 1999 20:32:44 GMT""}]","2007-05-23"
