"cond-mat/9902200","Cristopher Moore","Cristopher Moore, Mats G. Nordahl, Nelson Minar, and Cosma Shalizi","Vortex Dynamics and Entropic Coulomb Forces in Ising and Potts
  Antiferromagnets and Ice Models",,,,,"cond-mat.stat-mech",,"  We study the dynamics of topological defects in the triangular Ising
antiferromagnet, a related model on the square lattice equivalent to the
six-vertex ice model, and the three-state antiferromagnetic Potts model on the
square lattice. Since each of these models has a height representation in which
defects are screw dislocations, we expect them to be attracted or repelled with
an entropy-driven Coulomb force. In each case we show explicitly how this force
is felt through local fields. We measure the force numerically, both by
quenching the system to zero temperature and by measuring the motion of vortex
pairs. For the three-state Potts model, we calculate both the force and the
defect mobility, and find reasonable agreement with theory.
","[{""version"":""v1"",""created"":""Mon, 15 Feb 1999 22:26:32 GMT""},{""version"":""v2"",""created"":""Sat, 20 Feb 1999 22:16:51 GMT""}]","2009-09-25"
"cond-mat/9902214","Akira Furusaki","M. Sigrist, D. Agterberg, A. Furusaki, C. Honerkamp, K.K. Ng, T.M.
  Rice and M.E. Zhitomirsky","Phenomenology of the superconducting state in Sr2RuO4","7 pages, 1 figure, to be published in Proc. of the conference
  ""Anomalous Complex Superconductors"" (Crete, 1998)","Physica C 317-318 (1999) 134","10.1016/S0921-4534(99)00053-2",,"cond-mat.supr-con cond-mat.str-el",,"  The symmetry of the superconducting phase of Sr2RuO4 is identified as the
odd-parity pairing state d(k)=\hat{z}(k_x \pm i k_y) based on recent
experiments. The experimental evidence for the so-called orbital dependent
superconductivity leads to a single-band description of superconductivity based
on spin fluctuation mechanism. It is shown that the state \hat{z}(k_x \pm i
k_y) can be stabilized by the spin fluctuation feedback mechanism analogous to
the A-phase in 3He and by spin-orbit coupling effects.
","[{""version"":""v1"",""created"":""Tue, 16 Feb 1999 05:12:08 GMT""}]","2009-10-31"
"cond-mat/9902215","Kishigi Keita","Keita Kishigi, Yasumasa Hasegawa and Mitake Miyazaki","Enhancement of de Haas-van Alphen Oscillation due to Spin in the
  Magnetic Breakdown System","4 pages,4 figures. Submitted to Journal of Physical Society of Japan",,"10.1143/JPSJ.68.1817",,"cond-mat",,"  The effects of the Zeeman term on the de Haas-van Alphen oscillation is
studied in the magnetic breakdown system. We find that the amplitude of the
oscillation with the frequencies of $f_{\beta} + f_{\alpha}$ and $f_{\beta} +
2f_{\alpha}$ are enhanced by the Zeeman term, while they are expected to be
reduced in the semiclassical theory. A possible interpretation of the
experiments in organic conductors is discussed.
","[{""version"":""v1"",""created"":""Tue, 16 Feb 1999 05:22:14 GMT""}]","2009-10-31"
"cond-mat/9902216","Debasis Dan","Debasis Dan, Mangal. C. Mahato and A. M. Jayannavar","Stochastic Resonance in Washboard Potentials","10 pages, 3 figures","Phys. Lett. A 258,217 (1999)","10.1016/S0375-9601(99)00380-1",,"cond-mat.stat-mech",,"  We study the mobility of an overdamped particle in a periodic potential
tilted by a constant force. The mobility exhibits a stochastic resonance in
inhomogeneous systems with space dependent friction coefficient. The result
indicates that the presence of oscillating external field is not essential for
the observability of stochastic resonance, at least in the inhomogenous medium.
","[{""version"":""v1"",""created"":""Tue, 16 Feb 1999 12:27:41 GMT""}]","2009-10-31"
"cond-mat/9902217","Romualdo Pastor-Satorras","Romualdo Pastor-Satorras (ICTP)","Analytic model for the ballistic adsorption of polydisperse mixtures","6 pages, RevTex, includes 2 PS figures. Phys. Rev. E (in press)",,"10.1103/PhysRevE.59.5701",,"cond-mat.soft cond-mat.stat-mech",,"  We study the ballistic adsorption of a polydisperse mixture of spheres onto a
line. Within a mean-field approximation, the problem can be analytically solved
by means of a kinetic equation for the gap distribution. In the mean-field
approach, the adsorbed substrate as approximated as composed by {\em effective}
particles with the {\em same} size, equal to the average diameter of the
spheres in the original mixture. The analytic solution in the case of binary
mixtures agrees quantitatively with direct Monte Carlo simulations of the
model, and qualitatively with previous simulations of a related model in $d=2$.
","[{""version"":""v1"",""created"":""Tue, 16 Feb 1999 11:15:55 GMT""}]","2009-10-31"
"cond-mat/9902218","Xavier Martinez Hidalgo","E. M. Chudnovsky and X. Martinez-Hidalgo","Non-Kramers Freezing and Unfreezing of Tunneling in the Biaxial Spin
  Model","7 pages, minor changes, published in EPL","Europhys. Lett. 50 (3), pp. 395--401 (2000)","10.1209/epl/i2000-00282-0",,"cond-mat.soft cond-mat.mes-hall",,"  The ground state tunnel splitting for the biaxial spin model in the magnetic
field, H = -D S_{x}^2 + E S_{z}^2 - g \mu_B S_z H_z, has been investigated
using an instanton approach. We find a new type of spin instanton and a new
quantum interference phenomenon associated with it: at a certain field, H_2 =
2SE^{1/2}(D+E)^{1/2}/(g \mu_B), the dependence of the tunneling splitting on
the field switches from oscillations to a monotonic growth. The predictions of
the theory can be tested in Fe_8 molecular nanomagnets.
","[{""version"":""v1"",""created"":""Tue, 16 Feb 1999 12:25:17 GMT""},{""version"":""v2"",""created"":""Wed, 3 Mar 1999 11:15:12 GMT""},{""version"":""v3"",""created"":""Tue, 11 Jul 2000 08:56:39 GMT""}]","2009-10-31"
"cond-mat/9902219","Damian Farnell","R.F. Bishop, D.J.J. Farnell, and J.B. Parkinson","Sign Rules for Anisotropic Quantum Spin Systems","4 pages, 1 ps-figure","Phys. Rev. B 61 (2000), 6775-6779","10.1103/PhysRevB.61.6775",,"cond-mat.str-el",,"  We present new and exact ``sign rules'' for various spin-s anisotropic
spin-lattice models. It is shown that, after a simple transformation which
utilizes these sign rules, the ground-state wave function of the transformed
Hamiltonian is positive-definite. Using these results exact statements for
various expectation values of off-diagonal operators are presented, and
transitions in the behavior of these expectation values are observed at
particular values of the anisotropy. Furthermore, the effects of sign rules in
variational calculations and quantum Monte Carlo calculations are considered.
They are illustrated by a simple variational treatment of a one-dimensional
anisotropic spin model.
","[{""version"":""v1"",""created"":""Tue, 16 Feb 1999 14:18:35 GMT""}]","2017-08-24"
"cond-mat/9902220","Henri Orland","Roland R. Netz (MPIKG, Teltow, Germany) and H. Orland (SPhT,
  CEA-Saclay, France)","One and two-component hard core plasmas","8 pages, 6 postscript figures",,,"T99/016","cond-mat.soft cond-mat.stat-mech",,"  A field theory is presented for particles which interact via Coulomb and
hard-core potentials. We apply the method to the one-component plasma (OCP)
with hard cores, consisting of identical particles of fixed charge and diameter
in a neutralizing background, and the symmetric two-component plasma (TCP) with
hard cores, consisting of equal numbers of positively and negatively charged
particles of identical size. We obtain exactly the first few coefficients of a
systematic low-density expansion of the free energy for both models. The OCP
coefficients go over to the classical Abe result in the high-charge (or small
hard-core diameter) limit. The TCP, on the other hand, exhibits diverging
coefficients in the high-charge limit, which is due to the formation of
strongly bound ion-pairs.
","[{""version"":""v1"",""created"":""Tue, 16 Feb 1999 14:25:57 GMT""}]","2007-05-23"
"cond-mat/9902221","Nagao Tatsuya","Jun-ichi Igarashi, Manabu Takahashi and Tatsuya Nagao (Gunma
  University, Japan)","Three-body correlations in the Nagaoka state on the square lattice","13 pages, 8 Postscript figures, submitted to Phys.Rev.B","J. Phys. Soc. Jpn. 68 (1999) 3682.","10.1143/JPSJ.68.3682",,"cond-mat.str-el",,"  A three-body scattering theory previously proposed by one of the present
authors is developed to be applied to the saturated ferromagnetic state in the
two-dimensional Hubbard model. The single-particle Green's function is
calculated by taking account of the multiple scattering between two electrons
and one hole. Several limiting cases are discussed and the relation to the
variational principle is examined. The importance of the three-body correlation
is demonstrated in comparison with the results of the ladder approximation. A
possible phase boundary for the Nagaoka ground state is presented for the
square lattice, which improves the previous variational results.
","[{""version"":""v1"",""created"":""Tue, 16 Feb 1999 15:39:52 GMT""}]","2015-06-25"
"cond-mat/9902222","Dr. Michael Moske","T. Lorenz, A. Kaeufler, Y. Luo, M. Moske, and K. Samwer","Dependence of Magnetic Anisotropy and Magnetoresistance of
  Ni81Fe19-Films on Annealing","14 pages, 4 figures",,,,"cond-mat.mtrl-sci",,"  Permalloy (Py:Ni81Fe19) exhibits an anisotropic magnetoresistance (AMR) which
is very often used to read magnetic signals from storage devices. Py-films of
thickness 20nm were prepared by dc-magnetron sputtering in a magnetic field
onto thermally oxidized Si-wafers and annealed ex situ at temperatures up to
1000K in order to investigate the dependence of the magnetic anisotropy and the
AMR on heat treatments. The films exhibit an uniaxial anisotropy after
preparation which changes during annealing above 520K. The AMR along the former
magnetically easy axis as well as the corresponding field sensitivity are
increased by a heat treatment around 700K reaching maxima of about 8% and a
maximum sensitivity of 1.5%/Oe, respectively. We discuss possible sources for
the change in anisotropy, i.e. strain effects, inhomogeneities, and changes of
the local atomic order.
","[{""version"":""v1"",""created"":""Tue, 16 Feb 1999 15:51:22 GMT""}]","2007-05-23"
"cs/9902027","Mark D. Roberts","Mark D. Roberts","Autocatalytic Theory of Meaning","4 pages, no diagrams, LaTex2e","PSYCHOLOQUY.99.10.014",,,"cs.CL adap-org nlin.AO",,"  Recently it has been argued that autocatalytic theory could be applied to the
origin of culture. Here possible application to a theory of meaning in the
philosophy of language, called radical interpretation, is commented upon and
compared to previous applications.
","[{""version"":""v1"",""created"":""Tue, 16 Feb 1999 15:34:02 GMT""}]","2007-05-23"
"hep-ex/9902022","Preprints Libr/pam","D. Asner, et al. (CLEO Collaboration)","Hadronic Structure in the Decay $\tau^{-}\to
  \nu_{\tau}\pi^{-}\pi^{0}\pi^{0}$ and the Sign of the Tau Neutrino Helicity","44 pages, postscript file also available through
  http://w4.lns.cornell.edu/public/CLNS","Phys.Rev.D61:012002,2000","10.1103/PhysRevD.61.012002","CLNS 99/1601, CLEO 99-1","hep-ex",,"  Based on a sample corresponding to 4.3 million produced tau-pair events, we
have studied hadronic dynamics in the decay tau- --> nu_tau pi- pi0 pi0 in data
recorded by the CLEO II detector operating at the CESR e+e- collider. The decay
is dominated by the process tau --> nu_tau a_1(1260), with the a_1 meson
decaying to three pions predominantly via the lowest dimensional (mainly
S-wave) a_1 --> rho pi Born amplitude. From fits to the Dalitz plot and angular
observables, we find significant additional contributions from amplitudes for
a_1 decay to sigma pi, f_0(1370) pi and f_2(1270) pi, as well as higher
dimensional a_1 --> rho pi and rho' pi amplitudes. The squared sigma pi
amplitude accounts for ~15% of the total tau- --> nu_tau pi- pi0 pi0 rate in
the models considered. We have searched for additional contributions from tau
--> nu_tau pi'(1300). We place 90% confidence level upper limits on the
branching fraction for this channel of between 1.0*10^{-4} and 1.9*10^{-4},
depending on the pi' decay mode. The pi- pi0 pi0 mass spectrum is parametrized
by a Breit-Wigner form with a mass-dependent width which is specified according
to the results of the Dalitz plot fits plus a coupling to an a_1 --> K* K
amplitude. From a chi^2 fit, we extract the pole mass and width of the a_1, as
well as the magnitude of the K* K coupling. We have also investigated the
impact of a possible contribution from the a_1'(1700) meson on this spectrum.
Finally, exploiting the parity-violating angular asymmetry in a_1 --> 3pi
decay, we determine the signed value of the tau neutrino helicity to be
h_{\nu_\tau} = -1.02 +- 0.13(stat.) +- 0.03(syst.+model), confirming the
left-handedness of the tau neutrino.
","[{""version"":""v1"",""created"":""Mon, 15 Feb 1999 17:53:32 GMT""}]","2010-04-08"
"hep-ex/9902023","Sheldon Stone","R.J. Mountain, M. Artuso, R. Ayad, F. Azfar, A. Efimov, S. Kopp, G.
  Majumder, S. Schuh, T. Skwarnicki, S. Stone, G. Viehhauser, S. Anderson, A.
  Smith, Y. Kubota, E. Lipeles, T. Coan, J. Staeck, V. Fadeyev, I. Volobouev,
  J.Ye","The CLEO-III Ring Imaging Cherenkov Detector","Invited talk by R.J. Mountain at ``The 3rd International Workshop on
  Ring Imaging Cherenkov Detectors,"" a research workshop of the Israel Science
  Foundation, Ein-Gedi, Dead-Sea, Israel, Nov. 15-20, 1998, 14 pages, 9 figures","Nucl.Instrum.Meth.A433:77-86,1999","10.1016/S0168-9002(99)00466-0","HEPSY 99-2","hep-ex",,"  The CLEO-III Detector upgrade for charged particle identification is
discussed. The RICH design uses solid LiF crystal radiators coupled with
multi-wire chamber photon detectors, using TEA as the photosensor, and
low-noise Viking readout electronics. Results from our beam test at Fermilab
are presented.
","[{""version"":""v1"",""created"":""Mon, 15 Feb 1999 20:45:17 GMT""}]","2009-09-02"
"hep-ex/9902024","Richard J. Hemingway","The OPAL Collaboration, G. Abbiendi et al","Measurements of the QED Structure of the Photon","39 pages, LaTeX, 14 eps figs included, submitted to European Physical
  Journal C","Eur.Phys.J.C11:409-425,1999","10.1007/s100520050644","CERN-EP/99-010","hep-ex",,"  The structure of both quasi-real and highly virtual photons is investigated
using the reaction e+e- -> e+e-mu+mu-, proceeding via the exchange of two
photons.
  The results are based on the complete OPAL dataset taken at e+e-
centre-of-mass energies close to the mass of the Z boson.
  The QED structure function F_2^gamma and the differential cross-section
dsigdx for quasi-real photons are obtained as functions of the fractional
momentum x from the muon momentum which is carried by the struck muon in the
quasi-real photon for values of Q**2 ranging from 1.5 to 400 GeV**2.
  The differential cross-section dsigdx for highly virtual photons is measured
for 1.5< Q**2 < 30 GeV**2 and 1.5< P**2 < 20 GeV**2, where Q**2 and P**2 are
the negative values of the four-momentum squared of the two photons such that
Q**2 > P**2.
  Based on azimuthal correlations the QED structure functions F_A^gamma and
F_B^gamma for quasi-real photons are determined for an average Q**2 of 5.4
GeV**2.
","[{""version"":""v1"",""created"":""Tue, 16 Feb 1999 08:06:18 GMT""}]","2008-11-26"
"hep-ph/9902345","F. Cano","F. Cano (U. of Trento), P. Faccioli (ECT*, Trento) and M. Traini (U.
  of Trento and INFN)","Probing Relativistic Spin Effects in the Nucleon by Means of Drell-Yan
  Processes","15 pages, 5 figures. Expanded version: additional results, analysis
  of expected experimental errorbars and kinematics of HERA-N added","Phys.Rev. D62 (2000) 094018","10.1103/PhysRevD.62.094018","UTF/99-430, ECT*/01-99","hep-ph",,"  Significant differences between transverse and longitudinal polarized parton
distributions are found at low energies within a light-front covariant quark
model of the nucleon. These differences are due to relativistic spin effects
introduced by the Melosh rotations and survive evolution to higher $Q^2$
scales. A specific observable related to double-spin asymmetries in lepton pair
production in polarized hadron-hadron collisions is defined. The possibility of
assessing the relevance of these relativistic spin effects in future
experiments at RHIC and HERA--$\vec{N}$ is discussed.
","[{""version"":""v1"",""created"":""Mon, 15 Feb 1999 16:30:36 GMT""},{""version"":""v2"",""created"":""Sun, 12 Nov 2000 14:18:01 GMT""}]","2009-10-31"
"hep-ph/9902346","Baldicchi Massimiliano","M. Baldicchi and G.M. Prosperi","BS and DS equations in a Wilson loop context in QCD, effective mass
  operator, q-qbar spectrum","10 pages, 9 figures","Fizika B8:251-260,1999",,,"hep-ph",,"  We briefly discuss the quark-antiquark Bethe-Salpeter equation and the quark
Dyson-Schwinger equation derived in preceding papers. We also consider the
q-qbar quadratic mass operator M^{2} = (w_{1} + w_{2})^{2} + U obtained by
three-dimensional reduction of the BS equation and the related approximate
center of mass Hamiltonian or linear mass operator H_{CM} = M = w_{1} + w_{2} +
V + ... We revue previous results on the spectrum and the Regge trajectories
obtained by an approximate diagonalization of H_{CM} and report new results
similarly obtained by an approximate diagonalization of H_{CM} and report new
results similarly obtained for the original M^{2}. We show that in both cases
we succeed to reproduce fairly well the entire meson spectrum in the cases in
which the numerical calculations were actually practicable and with the
exception of the light pseudoscalar states (related to the chiral symmetry
problematic). A small rearrangement of the parameters and the use of a running
coupling constant is necessary in the M^{2} case.
","[{""version"":""v1"",""created"":""Mon, 15 Feb 1999 17:07:29 GMT""}]","2011-04-15"
"hep-ph/9902347","Herbi Dreiner","Herbi Dreiner (Rutherford Laboratory)","Hide and Seek with Supersymmetry","26 pages Latex, 12 figures, requires axodraw.sty, to be published in
  the school proceedings",,,,"hep-ph",,"  This is the summary of a 90 minute introductory lecture on Supersymmetry
presented at the Swiss Summer School on ``Hidden Symmetries and Higgs
Phenomena'' at Zuoz, Engadin, in August 1998. I first review the hierarchy
problem, and then discuss why we expect supersymmetry just around the corner,
i.e. at or below $1\tev$. I focus on the specific example of the anomalous
magnetic moment of the muon to show how supersymmetry can indeed hide just
around the corner without already having been detected. An essential part of
supersymmetry's disguise is the fact that it is broken. I end by briefly
outlining how the disguise itself is also hidden.
","[{""version"":""v1"",""created"":""Mon, 15 Feb 1999 18:30:59 GMT""}]","2007-05-23"
"hep-ph/9902348",,"L. Lavoura and Joao P. Silva","Disentangling violations of CPT from other new-physics effects","21 pages, latex, no figures","Phys.Rev. D60 (1999) 056003","10.1103/PhysRevD.60.056003",,"hep-ph",,"  We analyze the prospects for observing CPT violation using neutral-meson
P0-P0bar systems. Before one can claim a measurement of CPT violation, one must
be able to rule out the possibility that its result is due to simpler
new-physics effects. In particular, one must be able to separate the
CPT-violating quantities from parameters violating the Delta P = \Delta Q rule
of semileptonic decays, and from new-physics contributions to the production
mechanism of the neutral mesons. One can isolate CPT violation using the
semileptonic decays of single, tagged neutral mesons; unfortunately, this
situation cannot be implemented at the Upsilon(4S). For P0-P0bar pairs produced
in a correlated parity-odd state we show that, by combining the di-lepton with
the single-lepton decays, it is in principle possible to extract unambiguously
one CPT-violating parameter. Finally, we develop the formalism necessary for
describing new-physics effects in the production mechanism; this includes both
cascade decays and violations of the rule of associated production.
","[{""version"":""v1"",""created"":""Mon, 15 Feb 1999 18:40:21 GMT""}]","2009-10-31"
"hep-ph/9902349","Victor Manuel Villanueva Sandoval","J. L Lucio, M. Napsuciale, M. D. Scadron and V. M. Villanueva","The omega to rho pi transition and omega to rho 3 pi decay","12 pages, LaTeX, 3 eps figures, uses epsf.sty",,,"IFUG HEP-9901","hep-ph",,"  We evaluate the omega to rho pi transition and the omega to 3 pi decay using
a Quark Level Linear Sigma Model ($QL\sigma M$). We obtain $g^{QL\sigma
M}_{\omega\rho\pi}= (10.33 - 14.75) GeV^{-1}$ to be compared with other model
dependent estimates averaging to $g_{\omega\rho\pi} = 16 GeV^{-1}$. We show
that in the $QL\sigma M$ a contact term is generated for the $\omega \to 3 \pi$
decay. Although the contact contribution by itself is small, the interference
effects turn out to be important.
","[{""version"":""v1"",""created"":""Mon, 15 Feb 1999 19:33:29 GMT""}]","2007-05-23"
"hep-ph/9902350",,"Edmond L. Berger (Argonne), Michael Klasen (Argonne), Tim Tait
  (Argonne & Michigan State University)","Associated Production of Gauginos and Gluinos at Hadron Colliders in
  Next-to-Leading Order SUSY-QCD","11 pages, LaTeX, includes two figures, version to appear in Phys.
  Lett. B","Phys.Lett.B459:165-170,1999","10.1016/S0370-2693(99)00617-6","ANL-HEP-PR-99-03; MSUHEP-90215","hep-ph",,"  We report a next-to-leading order (NLO) calculation of the production of
gaugino-like charginos ($\chargino$) and neutralinos ($\neutralino$) in
association with gluinos ($\gluino$) at hadron colliders, including the strong
corrections from colored particles and sparticles. We predict inclusive cross
sections at the Fermilab Tevatron and CERN LHC. The NLO cross sections are more
stable against variations in the hard-scattering scale parameter and are
greater than the LO values.
","[{""version"":""v1"",""created"":""Mon, 15 Feb 1999 21:56:09 GMT""},{""version"":""v2"",""created"":""Thu, 24 Jun 1999 15:08:20 GMT""}]","2008-11-26"
"hep-ph/9902351","Bugra Borasoy","B. Borasoy, B. R. Holstein","The role of resonances in non-leptonic hyperon decays","16 pages, 2 figures","Phys.Rev. D59 (1999) 094025","10.1103/PhysRevD.59.094025",,"hep-ph",,"  We examine the importance of resonances for the non-leptonic hyperon decays
in the framework of chiral perturbation theory. Lower lying resonances are
included into the effective theory. Integrating out the heavy degrees of
freedom in the resonance saturation scheme generates higher order counterterms
in the effective Lagrangian, providing an estimate of the pertinent coupling
constants. A fit to the eight independent decay amplitudes that are not related
by isospin symmetry is performed and reasonable agreement for both s- and p-
waves is achieved.
","[{""version"":""v1"",""created"":""Mon, 15 Feb 1999 23:26:21 GMT""}]","2009-10-31"
"hep-ph/9902352","Toby Falk","Toby Falk","Higgsinos in SUSY Models with Gaugino Mass Unification","10 pages in LaTeX with 4 encapsulated postscript figures; uses
  epsf.sty. Version to appear in Physics Letters B","Phys.Lett. B456 (1999) 171-178","10.1016/S0370-2693(99)00501-8","MADPH-99-1104","hep-ph",,"  In the MSSM, the assumptions of a common sfermion mass parameter m_0 and a
common gaugino mass parameter m_1/2, along with the requirements from radiative
electroweak symmetry breaking, lead to relatively large values of the Higgs
mixing parameter mu, and consequently to a gaugino-like lightest neutralino.
Lifting the requirement that the Higgs mass parameters unify with the sfermion
masses is known to allow for smaller mu. We show that a mu parameter
sufficiently small to yield a Higgsino-like neutralino requires a precise
adjustment of the Higgs mass parameter m_Hu. Consequently a gaugino-type
neutralino is still preferred in SUSY models with gaugino mass unification.
","[{""version"":""v1"",""created"":""Tue, 16 Feb 1999 01:10:56 GMT""},{""version"":""v2"",""created"":""Tue, 20 Apr 1999 14:39:44 GMT""}]","2009-10-31"
"hep-ph/9902353","A. I. Sanda","A. I. Sanda","Comments on CPT tests","Talk presented at KEK-Tanash workshop on K decays",,,,"hep-ph",,"  What do we know about CPT symmetry? We conclude that the direcrt measurement
of CPT violation leads to a result that CPT violation force is limited to about
30% of CP violating forces. The best test of CPT symmetry is to see if
theoretical prediction for the phase of eta_{+-} and eta_{00} agree with
experiments. We discuss uncertainties associated with this prediction, and how
to improve it. A new test of CPT is also discussed.
","[{""version"":""v1"",""created"":""Tue, 16 Feb 1999 03:48:59 GMT""}]","2007-05-23"
"hep-ph/9902355","Naveen Gaur","S. Rai Choudhury, Naveen Gaur, Abhinav Gupta","\tau Polarization asymmetry in $B \to X_s \tau^+ \tau^-$ in SUSY models
  with large $tan\beta$","RevTex file, 15 pages (including 6 ps figures). accepted version in
  Phys. Rev. D","Phys.Rev. D60 (1999) 115004","10.1103/PhysRevD.60.115004",,"hep-ph",,"  Rare B decays provides an opportunity to probe for new physics beyond the
standard model. the effective Hamiltonian for the decay $b \to s l^+ l^-$
predicts the characteristic polarization for the final state lepton. Lepton
polarization has, in addition to a longitudinal component $P_L$, two orthogonal
components $P_T$ and $P_N$ lying in and perpendicular to the decay plane. In
this article we perform a study of the $\tau$-polarisation asymmetry in the
case of SUSY models with large $\tan\beta$ in the inclusive decay $B \to X_s
\tau^+ \tau^-$.
","[{""version"":""v1"",""created"":""Tue, 16 Feb 1999 06:15:51 GMT""},{""version"":""v2"",""created"":""Wed, 3 Nov 1999 02:17:48 GMT""}]","2009-10-31"
