"nucl-th/9902035","Souichi Ishikawa","S. Ishikawa (Hosei University)","Analyzing power in nucleon-deuteron scattering and three-nucleon forces","11 pages including 2 eps figures, use epsfig.sty, to appear in Phys.
  Rev. C","Phys.Rev. C59 (1999) 1247-1251","10.1103/PhysRevC.59.R1247",,"nucl-th",,"  Three-nucleon forces have been considered to be one possibility to resolve
the well known discrepancy between experimental values and theoretical
calculations of the nucleon analyzing power in low energy nucleon-deuteron
scattering. In this paper, we investigate possible effects of two-pion exchange
three-nucleon forces on the analyzing power and the differential cross section.
We found that the reason for different effects on the analyzing power by
different three-nucleon forces found in previous calculations is related to the
existence of the contact term. Effects of some variations of two-pion exchange
three-nucleon forces are investigated. Also, an expression for the measure of
the nucleon analyzing power with quartet P-wave phase shifts is presented.
","[{""version"":""v1"",""created"":""Tue, 16 Feb 1999 09:15:53 GMT""},{""version"":""v2"",""created"":""Wed, 17 Feb 1999 01:18:11 GMT""}]","2009-10-31"
"nucl-th/9902036","Eli Friedman","E. Friedman and A. Gal (Hebrew U. Jerusalem)","Narrow deeply bound $K^-$ atomic states","Revised, Phys. Lett B. in press","Phys.Lett. B459 (1999) 43-48","10.1016/S0370-2693(99)00651-6",,"nucl-th",,"  Using optical potentials fitted to a comprehensive set of strong interaction
level shifts and widths in $K^-$ atoms, we predict that the $K^-$ atomic levels
which are inaccessible in the atomic cascade process are generally narrow,
spanning a range of widths about 50 - 1500 keV over the entire periodic table.
The mechanism for this narrowing is different from the mechanism for narrowing
of pionic atom levels. Examples of such `deeply bound' $K^-$ atomic states are
given, showing that in many cases these states should be reasonably well
resolved. Several reactions which could be used to form these `deeply bound'
states are mentioned. Narrow deeply bound states are expected also in $\bar{p}$
atoms.
","[{""version"":""v1"",""created"":""Tue, 16 Feb 1999 10:42:29 GMT""},{""version"":""v2"",""created"":""Sun, 30 May 1999 06:23:27 GMT""}]","2009-10-31"
"patt-sol/9902004","Ulrich Behn","Thomas John, Ralf Stannarius, and Ulrich Behn","On-off Intermittency in Stochastically Driven Electrohydrodynamic
  Convection in Nematics","4 pages, 6 figures, minor changes to improve readability for a
  general audience, to appear in Phys. Rev. Letters",,"10.1103/PhysRevLett.83.749",,"patt-sol nlin.PS",,"  We report on-off intermittency in electroconvection of nematic liquid
crystals driven by a dichotomous stochastic electric voltage. With increasing
voltage amplitude we observe laminar phases of undistorted director state
interrupted by shorter bursts of spatially regular stripes. Near a critical
value of the amplitude the distribution of the duration of laminar phases is
governed over several decades by a power law with exponent -3/2. The
experimental findings agree with simulations of the linearized
electrohydrodynamic equations near the sample stability threshold.
","[{""version"":""v1"",""created"":""Mon, 15 Feb 1999 16:07:04 GMT""},{""version"":""v2"",""created"":""Thu, 10 Jun 1999 13:51:39 GMT""}]","2009-10-31"
"physics/9902037","Jyotipratim Ray Chaudhuri","Jyotipratim Ray Chaudhuri, Bimalendu Deb, Gautam Gangopadhyay Deb
  Shankar Ray","Quantum theory of dissipation of a harmonic oscillator coupled to a
  nonequilibrium bath; Wigner-Weisskopf decay and physical spectra","Plain Latex, 28 pages, 2 PS figures","Journal of Physics B, vol.31, page 3859 (1998)","10.1088/0953-4075/31/17/011",,"physics.optics cond-mat.stat-mech quant-ph",,"  We extend the quantum theory of dissipation in the context of
system-reservoir model, where the reservoir in question is kept in a
nonequilibrium condition. Based on a systematic separation of time scales
involved in the dynamics, appropriate generalizations of the
fluctuation-dissipation and Einstein's relations have been pointed out. We show
that the Wigner-Weisskopf decay of the system mode results in a rate constant
which depending on the relaxation of nonequilibrium bath is dynamically
modified. We also calculate the time-dependent spectra of a cavity mode with a
suitable gain when the cavity is kept in contact with a nonequilibrium bath.
","[{""version"":""v1"",""created"":""Mon, 15 Feb 1999 16:02:19 GMT""}]","2009-10-31"
"physics/9902038","Nadejda Cherkas","Nadejda L. Cherkas (Belarussian State University of informatics and
  radioelectronics, Minsk)","The dispersion equation for a wave number of the electromagnetic wave in
  a random medium of the parallel dielectric cylinders","10 pages with 3 figures","SPIE Proc. Vol. 4748 P.211, ICONO 2001 - Fundamental Aspects of
  Laser-Matter Interaction and Physics of Nanostructures, Minsk, Belarus;
  condensed version: Differential Equations v.35 n.8 p.1160-1163",,,"physics.optics",,"  In a frame of quasi-crystal approximation the dispersion equations are
obtained for the wave vector of a coherent electromagnetic wave propagating in
a media which contains a random set of parallel dielectric cylinders with
possible overlapping. The results are compared with that for the case when a
regularity at the cylinder placement exists.
","[{""version"":""v1"",""created"":""Tue, 16 Feb 1999 09:27:28 GMT""}]","2007-05-23"
"physics/9902039","Gov Shahar","S. Gov (1), S. Shtrikamn (1+2) and H. Matzner (1) ((1) Dept. of
  Electronics, Weizmann Institute of Science, Rehovot, Israel (2) Dept. of
  Physics, University of California, San-Diego, La Jolla, CA, USA)","On the Discontinuity of Electrostatic Fields Across a Planar Surface
  With Multipolar Surface Charge Density","15 pages",,,,"physics.class-ph",,"  We use covariance and dimensional analysis to find expressions for the
discontinuity of the potential and normal electric field across a flat surface
with multipolar charge surface density in vacuum.
","[{""version"":""v1"",""created"":""Tue, 16 Feb 1999 12:23:23 GMT""}]","2007-05-23"
"quant-ph/9902055","Igor Volovich","I.V. Volovich","Models of Quantum Computers and Decoherence Problem","14 pages, Latex, Invited talk at the International Conference on
  Quantum Information, Meijo University, Nagoya, 4-8 Nov.1997, To be published
  in Proc. of the Conference",,,"SMI-2-02-1999","quant-ph",,"  Mathematical models of quantum computers such as a multidimensional quantum
Turing machine and quantum circuits are described and its relations with
lattice spin models are discussed. One of the main open problems one has to
solve if one wants to build a quantum computer is the decoherence due to the
coupling with the environment. We propose a possible solution of this problem
by using a control of parameters of the system. This proposal is based on the
analysis of the spin-boson Hamiltonian performed in the stochastic limit
approximation.
","[{""version"":""v1"",""created"":""Mon, 15 Feb 1999 18:26:11 GMT""}]","2007-05-23"
"quant-ph/9902056","Adan Cabello","Adan Cabello and Jose L. Cereceda","Nonlocality without inequalities using unambiguous discrimination
  between non-orthogonal states","REVTeX, 4 pages, 1 figure",,,,"quant-ph",,"  This paper has been withdrawn.
","[{""version"":""v1"",""created"":""Mon, 15 Feb 1999 23:12:58 GMT""},{""version"":""v2"",""created"":""Tue, 10 Aug 1999 22:14:43 GMT""}]","2009-09-25"
"quant-ph/9902057","Alexandr Andrianov","A. Andrianov, F. Cannata, M. Ioffe, D. Nishnianidze","Systems with Higher-Order Shape Invariance: Spectral and Algebraic
  Properties","18 pages, LaTeX, editorial page is removed","Phys.Lett. A266 (2000) 341-349","10.1016/S0375-9601(00)00031-1",,"quant-ph math-ph math.MP nlin.SI solv-int",,"  We study a complex intertwining relation of second order for Schroedinger
operators and construct third order symmetry operators for them. A modification
of this approach leads to a higher order shape invariance. We analyze with
particular attention irreducible second order Darboux transformations which
together with the first order act as building blocks. For the third order
shape-invariance irreducible Darboux transformations entail only one sequence
of equidistant levels while for the reducible case the structure consists of up
to three infinite sequences of equidistant levels and, in some cases, singlets
or doublets of isolated levels.
","[{""version"":""v1"",""created"":""Tue, 16 Feb 1999 15:13:29 GMT""},{""version"":""v2"",""created"":""Wed, 24 Feb 1999 11:20:08 GMT""}]","2009-10-31"
