"hep-ph/9902356","Sergey Goloskokov","S.V.Goloskokov","Spin Effects in Diffractive $J/\Psi$ Leptoproduction and Structure of
  Pomeron Coupling","20 pages, latex, 4 PS figures, revised version","Eur.Phys.J.C11:309-316,1999","10.1007/s100520050635",,"hep-ph",,"  We calculate the cross section and the $A_{ll}$ asymmetry of the diffractive
vector meson leptoproduction for a simple model of the pomeron coupling with
the proton. It is found that the sensitivity of the spin--dependent cross
section of the diffractive $J/\Psi$ production to the pomeron coupling
structure is rather weak. The conclusion is made that it will be difficult to
study the structure of the pomeron coupling with the proton in future polarized
diffractive experiments on the $J/\Psi$ production.
","[{""version"":""v1"",""created"":""Tue, 16 Feb 1999 12:35:54 GMT""},{""version"":""v2"",""created"":""Tue, 27 Apr 1999 12:04:21 GMT""}]","2011-09-13"
"hep-ph/9902357",,"S. Esposito (University of Naples and I.N.F.N.)","The action of neutrino ponderomotive force on supernova dynamics","latex, 14 pages; numerical error corrected, conclusions changed; to
  be published in Mod. Phys. Lett. A","Mod.Phys.Lett. A14 (1999) 1763-1774","10.1142/S0217732399001863","DSF-98/39, INFN-NA-IV-98/39","hep-ph astro-ph",,"  Collective interactions of a beam of neutrinos/antineutrinos traversing a
dense magnetized plasma of electrons/positrons, protons and neutrons are
studied with particular reference to the case of a Supernova. We find that the
ponderomotive force exerted by neutrinos gives, contrary to expectations, a
negligible contribution to the revival of the shock for a successful Supernova
explosion, although new types of convection and plasma cooling processes
induced by the ponderomotive force could be, in principle, relevant for the
dynamics itself.
","[{""version"":""v1"",""created"":""Tue, 16 Feb 1999 08:39:17 GMT""},{""version"":""v2"",""created"":""Thu, 2 Sep 1999 08:39:01 GMT""}]","2009-10-31"
"hep-ph/9902358","Akira Takamura","K. Kimura and A. Takamura","Exact Parametrization of Majorana Neutrino Mass Matrix with Large Mixing","11 pages, LaTeX, no figures","Mod.Phys.Lett.A14:1625-1636,1999","10.1142/S0217732399001711","DPNU-99-04","hep-ph",,"  Under the assumption that the neutrinos are Majorana particles we study how
the lepton mass matrices can be transformed into the simple form which has the
same physical quantities by removing redundant parameters. We propose the exact
parametrization of the lepton mass matrices which reflects the small nu_e-nu_mu
mixing and the large nu_mu-nu_tau mixing. The relations between the twelve
parameters and the physical quantities are shown. Furthermore we calculate the
MNS matrix by applying the assumptions used in the quark sector. Finally we
also check the validity of these assumptions from the experimental values.
","[{""version"":""v1"",""created"":""Tue, 16 Feb 1999 08:46:24 GMT""}]","2014-11-17"
"hep-ph/9902359","Victor Nikonov","V. V. Anisovich, L. G. Dakhno, D. I. Melikhov, V. A. Nikonov, and M.
  G. Ryskin","Pomeron in diffractive processes $\gamma^*(Q^2)p\to\rho^0 p$ and
  $\gamma^*(Q^2)p\to\gamma^*(Q^2) p$ at large Q^2: the onset of pQCD","20 pages, LaTeX, epsfig.sty","Phys. Rev. D 60, 074011 (1999)","10.1103/PhysRevD.60.074011",,"hep-ph",,"  We study the reactions $\gamma^*(Q^2)p\to\rho^0 p$ and
$\gamma^*(Q^2)p\to\gamma^*(Q^2) p$ at large Q^2 and $W^2/Q^2$ and small
momentum transfer, $\kappa^2_\perp$, to the nucleon where the pomeron exchange
dominates. At large Q^2 the virtual photon selects a hard $q\bar q$ pair, thus
selecting the hard pomeron component (the BFKL pomeron). The amplitudes for
both transverse and longitudinal polarizations of the initial photon and
outgoing $\rho$-meson (photon) are calculated in the framework of the BFKL
pomeron exchange. Our calculations show that one cannot expect the early onset
of the pure perturbative regime in the discussed diffractive processes: the
small interquark distances, $\rho_{q\bar q} <0.2$ fm, start to dominate not
earlier than at $Q^2 \simeq 100 GeV^2, W^2/Q^2 \simeq 10^7$ in
$\gamma^*(Q^2)p\to\rho^0 p$ and $Q^2 \simeq 50 GeV^2, W^2/Q^2 \simeq 10^6$ in
$\gamma^*(Q^2)p\to\gamma^*(Q^2) p$.
","[{""version"":""v1"",""created"":""Tue, 16 Feb 1999 09:50:23 GMT""}]","2016-08-25"
"hep-ph/9902360","Nora Brambilla","N. Brambilla (U. Vienna) and A. Vairo (HEPHY, Vienna)","Quarkonium in the Wilson loop formalism: new perspectives","Plenary talk presented at ``Particle and Nuclear physics with CEBAF
  at Jefferson Lab'', Dubrovnik, November 3-10, 1998; 10 pages, latex file","Fizika B8:261-270,1999",,"UWThPh-1999-8","hep-ph",,"  We review the present knowledge on the heavy quark interaction. The framework
is the NRQCD effective theory and the interaction is expressed in terms of
Wilson loop chromoelectric and chromomagnetic insertions.
","[{""version"":""v1"",""created"":""Tue, 16 Feb 1999 10:23:35 GMT""}]","2011-04-15"
"hep-ph/9902361","Andrei Belitsky","A.V. Belitsky","Fine structure of spectrum of twist-three operators in QCD","16 pages, LaTeX, 5 figures","Phys.Lett. B453 (1999) 59-72","10.1016/S0370-2693(99)00326-3",,"hep-ph",,"  We unravel the structure of the spectrum of the anomalous dimensions of the
quark-gluon twist-3 operators which are responsible for the multiparton
correlations in hadrons and enter as a leading contribution to several physical
cross sections. The method of analysis is bases on the recent finding of a
non-trivial integral of motion for the corresponding Hamiltonian problem in
multicolour limit which results into exact integrability of the three-particle
system. Quasiclassical expansion is used for solving the problem. We address
the chiral-odd sector as a case of study.
","[{""version"":""v1"",""created"":""Tue, 16 Feb 1999 11:42:09 GMT""},{""version"":""v2"",""created"":""Sat, 20 Feb 1999 08:37:53 GMT""}]","2009-10-31"
"hep-ph/9902362","Emidio Gabrielli","E. Gabrielli, V.A. Ilyin and B. Mele","Looking for anomalous gamma-gamma-H and Z-gamma-H couplings at future
  linear collider","LaTeX, 33 pages, 16 eps figures, extended section 5","Phys.Rev.D60:113005,1999","10.1103/PhysRevD.60.113005","ROME1-1235/99","hep-ph",,"  We consider the possibility of studying anomalous contributions to the
gamma-gamma-H and Z-gamma-H vertices through the process e-gamma--> e-H at
future e-gamma linear colliders, with Sqrt(S)=500-1500 GeV. We make a model
independent analysis based on SU(2)xU(1) invariant effective operators of dim=6
added to the standard model lagrangian. We consider a light Higgs boson (mostly
decaying in bar(b)-b pairs), and include all the relevant backgrounds. Initial
e-beam polarization effects are also analyzed. We find that the process
e-gamma--> e-H provides an excellent opportunity to strongly constrain both the
CP-even and the CP-odd anomalous contributions to the gamma-gamma-H and
Z-gamma-H vertices.
","[{""version"":""v1"",""created"":""Tue, 16 Feb 1999 15:06:00 GMT""},{""version"":""v2"",""created"":""Wed, 1 Dec 1999 12:35:47 GMT""}]","2011-07-19"
"hep-ph/9902363","Massimo Pietroni","Massimo Pietroni","Critical Slowing Down and Defect Formation","5 pages, Proceedings of ""Strong and Electroweak Matter 98"", Nordita
  (Copenhagen) 2-5 Dec.1998",,,,"hep-ph",,"  The formation of topological defects in a second order phase transition in
the early universe is an out-of-equilibrium process. Condensed matter
experiments seem to support Zurek's mechanism, in which the freezing of thermal
fluctuations close to the critical point (critical slowing down) plays a
crucial role. We discuss how this picture can be extrapolated to the early
universe, pointing out that new scaling laws may emerge at very high
temperatures and showing how critical slowing down emerges in the context of a
relativistic quantum field theory.
","[{""version"":""v1"",""created"":""Tue, 16 Feb 1999 12:33:55 GMT""}]","2007-05-23"
"hep-ph/9902364","Smaragda Lola","John Ellis (CERN), S. Lola (CERN) and D.V. Nanopoulos (Texas A-M &
  HARC, Woodlands & Athens Academy)","Leptogenesis in the Light of Super-Kamiokande Data and a Realistic
  String Model","18 pages, 1 figure","Phys.Lett.B452:87-97,1999","10.1016/S0370-2693(99)00268-3","ACT-1/99, CERN-TH/99-16, CTP-TAMU-04/99","hep-ph",,"  We discuss leptogenesis in the light of indications of neutrino masses and
mixings from Super-Kamiokande and other data on atmospheric neutrinos, as well
as the solar neutrino deficit. Neutrino masses and mixings consistent with
these data may produce in a natural and generic way a lepton asymmetry that is
suffient to provide the observed baryon asymmetry, after processing via
non-perturbative electroweak effects. We illustrate this discussion in the
framework of the string-derived flipped SU(5) model, using particle assignments
and choices of vacuum parameters that are known to give realistic masses to
quarks and charged leptons. We display one scenario for neutrino masses that
also accommodates leptogenesis.
","[{""version"":""v1"",""created"":""Tue, 16 Feb 1999 14:19:24 GMT""}]","2009-09-11"
"hep-th/9902102","Kentaro Hori","Kentaro Hori","D-branes, T-duality, and Index Theory","50 pages, LaTeX, minor corrections, references added","Adv.Theor.Math.Phys.3:281-342,1999",,"LBNL-42658, UCB-PTH-99/02","hep-th",,"  We show that the transformation of D-branes under T-duality on four-torus is
represented by Nahm transform of instantons. The argument for this allows us to
generalize Nahm transform to the case of orthogonal and symplectic gauge groups
as well as to instantons on Z_2 orbifold of four-torus. In addition, we
identify the isomorphism of K-theory groups that realizes the transformation of
D-brane charges under T-duality on torus of arbitrary dimensions. By the
isomorphism we are lead to identify the correct K-theory group that classifies
D-brane charges in Type II orientifold.
","[{""version"":""v1"",""created"":""Tue, 16 Feb 1999 00:01:11 GMT""},{""version"":""v2"",""created"":""Sat, 27 Feb 1999 00:33:36 GMT""}]","2014-11-18"
"hep-th/9902103","Elena Gubankova","Elena Gubankova","Flow equations for the quantum electrodynamics on the light-front","Ph.D. Thesis at the Ruprecht-Karls-Universit\""at, Heidelberg, 100
  pages (LaTeX2e)",,,,"hep-th",,"  The method of flow equations is applied to QED on the light front. Requiring
that the particle number conserving terms in the Hamiltonian are considered to
be diagonal and the other terms off-diagonal an effective Hamiltonian is
obtained which reduces the positronium problem to a two-particle problem, since
the particle number violating contributions are eliminated.
  Using an effective electron-positron Hamiltonian, obtained in the second
order in coupling, we analyze the positronium bound state problem analytically
and numerically. The results obtained for Bohr spectrum and hyperfine splitting
coincide to a high accuracy with experimental values. The rotational
invariance, that is not manifest symmetry on the light-front, is recovered for
positronium mass spectrum.
  Except for the longitudinal infrared divergences, that are special for the
light-front gauge calculations, no infrared divergences appear. The ultraviolet
renormalization in the second order in coupling constant is performed
simultaneously. To preserve boost invariance we take into account the diagrams
arising from the normal ordering of instantaneous interactions. Using flow
equations and coupling coherence we obtain the counterterms for electron and
photon masses, which are free from longitudinal infrared divergences.
","[{""version"":""v1"",""created"":""Tue, 16 Feb 1999 00:24:48 GMT""},{""version"":""v2"",""created"":""Wed, 17 Feb 1999 01:28:22 GMT""}]","2007-05-23"
"hep-th/9902109","Zbigniew Jaskolski","Marcin Daszkiewicz, Zbigniew Hasiewicz, Zbigniew Jaskolski","Light-cone formulation and spin spectrum of non-critical fermionic
  string","13 pages","Phys.Lett. B454 (1999) 249-258","10.1016/S0370-2693(99)00338-X","Preprint IFT UWr 933/99","hep-th",,"  A free fermionic string quantum model is constructed directly in the
light-cone variables in the range of dimensions $1<d<10$. It is shown that
after the GSO projection this model is equivalent to the fermionic massive
string and to the non-critical Rammond-Neveu-Schwarz string. The spin spectrum
of the model is analysed. For $d=4$ the character generating functions is
obtained and the particle content of first few levels is numerically
calculated.
","[{""version"":""v1"",""created"":""Mon, 15 Feb 1999 17:11:58 GMT""}]","2016-09-06"
"hep-th/9902110","Nikita Nekrassov","Nikita Nekrasov and Samson L. Shatashvili","On Non-Supersymmetric CFT in Four Dimensions","harvmac, 4 pp; v2. Z_4 field content corrected, references reworked","Phys.Rept. 320 (1999) 127-129","10.1016/S0370-1573(99)00059-9","ITEP-TH-06/99, HUTP-99/A007","hep-th",,"  We show that the $\mathcal{N}=0$ theories on the self-dual D3-branes of Type
0 string theory are in the class of the previously considered tadpole-free
orbifolds of $\mathcal{N} = 4$ theory (although they have SO(6) global
symmetry) and hence have vanishing beta function in the planar limit to all
orders in 't Hooft coupling. Also, all planar amplitudes in this theory are
equal to those of $\mathcal{N} = 4$ theory, up to a rescaling of the coupling.
","[{""version"":""v1"",""created"":""Mon, 15 Feb 1999 23:16:32 GMT""},{""version"":""v2"",""created"":""Wed, 7 Apr 1999 23:37:21 GMT""}]","2017-09-07"
"hep-th/9902111","Arthur J. Mountain","Conor Houghton, Patrick Irwin and A. J. Mountain","Two monopoles of one type and one of another","48 pages, LaTeX, 2 figures. Typos corrected. Version in JHEP","JHEP 9904 (1999) 029","10.1088/1126-6708/1999/04/029","DAMTP 98-5, UDEM-GPP-TH 99-55, Imperial/TP/98-99/022","hep-th",,"  The metric on the moduli space of charge (2,1) SU(3)
Bogomolny-Prasad-Sommerfield monopoles is calculated and investigated. The
hyperKahler quotient construction is used to provide an alternative derivation
of the metric. Various properties of the metric are derived using the
hyperKahler quotient construction and the correspondence between BPS monopoles
and rational maps. Several interesting limits of the metric are also
considered.
","[{""version"":""v1"",""created"":""Tue, 16 Feb 1999 08:31:04 GMT""},{""version"":""v2"",""created"":""Mon, 5 Jul 1999 15:25:46 GMT""}]","2009-10-31"
"hep-th/9902112","Jose A. Magpantay","Jose A. Magpantay (National Institute of Physics,University of the
  Philippines)","The Confinement Mechanism in Yang-Mills Theory?","9 pages, HTML+GIF","Mod.Phys.Lett. A14 (1999) 447-458","10.1142/S021773239900050X","NIP99-01","hep-th",,"  Using the recently proposed non-linear gauge condition, we show the area law
behavior of the Wilson loop and the linear dependence of the instantaneous
gluon propagator. The field configurations responsible for confinement are
those in the non-linear sector of the gauge-fixing condition (the linear sector
being the Coulomb gauge). The non-linear sector is actually composed of ""Gribov
horizons"" on the surfaces parallel to the Coulomb surface. In this sector, the
gauge field can be expressed in terms of a scalar field and a new vector field.
The effective dynamics of the scalar field suggests non-perturbative effects.
This was confirmed by showing that all spherically symmetric (in 4-D Euclidean)
scalar fields are classical solutions and averaging these solutions using a
qaussian distribution (thereby treating these fields as random) lead to
confinement. In essence the confinement mechanism is not quantum mechanical in
nature but simply a statistical treatment of classical spherically symmetric
fields on the ""horizons"" of the surfaces parallel to the Coulomb surface.
","[{""version"":""v1"",""created"":""Tue, 16 Feb 1999 11:03:52 GMT""}]","2009-10-31"
"hep-th/9902114","Christoph Kopper","Ch. Kopper (Ecole Polytechnique), V.F. Mueller (Universitaet
  Kaiserslautern)","Renormalization Proof for Spontaneously broken Yang-Mills Theory with
  Flow Equations","The paper has been withdrawn","Commun.Math.Phys.209:477-516,2000","10.1007/s002200050028",,"hep-th","http://arxiv.org/licenses/nonexclusive-distrib/1.0/","  The proof given in the paper was incomplete due to an omission in the proof
of Lemma 2. A corrected and improved version of the paper is in
arXiv:0902.2486.
","[{""version"":""v1"",""created"":""Tue, 16 Feb 1999 12:12:08 GMT""},{""version"":""v2"",""created"":""Thu, 5 Aug 1999 15:23:33 GMT""},{""version"":""v3"",""created"":""Wed, 3 Mar 2010 18:47:07 GMT""}]","2014-11-18"
"hep-th/9902115","Gerald V. Dunne","Gerald V. Dunne","Aspects of Chern-Simons Theory","76 pages, Latex, 9 figures (epsfig); Les Houches Lectures 1998",,,,"hep-th cond-mat hep-ph",,"  Lectures at the 1998 Les Houches Summer School: Topological Aspects of Low
Dimensional Systems. These lectures contain an introduction to various aspects
of Chern-Simons gauge theory: (i) basics of planar field theory, (ii) canonical
quantization of Chern-Simons theory, (iii) Chern-Simons vortices, and (iv)
radiatively induced Chern-Simons terms.
","[{""version"":""v1"",""created"":""Tue, 16 Feb 1999 13:56:51 GMT""}]","2007-05-23"
"math-ph/9902019","Andrey K. Pogrebkov","M. Boiti, F. Pempinelli, A. Pogrebkov, and B. Prinari (University of
  Lecce, Italy)","B\""{a}cklund and Darboux transformations for the nonstationary
  Schr\""{o}dinger equation","to be published in Proc. of the Steklov Inst. of Mathematics, Moscow,
  Russia",,,,"math-ph math.MP nlin.SI solv-int",,"  Potentials of the nonstationary Schr\""{o}dinger operator constructed by means
of $n$ recursive B\""{a}cklund transformations are studied in detail.
Corresponding Darboux transformations of the Jost solutions are introduced. We
show that these solutions obey modified integral equations and present their
analyticity properties. Generated transformations of the spectral data are
derived.
","[{""version"":""v1"",""created"":""Tue, 16 Feb 1999 12:41:07 GMT""}]","2007-05-23"
"math/9902090","Giovanni Felder","Alberto S. Cattaneo and Giovanni Felder","A path integral approach to the Kontsevich quantization formula","22 pages, 2 figures, references added. Conjecture on the center made
  more precise","Commun.Math.Phys. 212 (2000) 591-611","10.1007/s002200000229",,"math.QA hep-th math-ph math.MP",,"  We give a quantum field theory interpretation of Kontsevich's deformation
quantization formula for Poisson manifolds. We show that it is given by the
perturbative expansion of the path integral of a simple topological bosonic
open string theory. Its Batalin-Vilkovisky quantization yields a superconformal
field theory. The associativity of the star product, and more generally the
formality conjecture can then be understood by field theory methods. As an
application, we compute the center of the deformed algebra in terms of the
center of the Poisson algebra.
","[{""version"":""v1"",""created"":""Mon, 15 Feb 1999 17:31:08 GMT""},{""version"":""v2"",""created"":""Tue, 2 Mar 1999 12:30:14 GMT""},{""version"":""v3"",""created"":""Mon, 19 Apr 1999 13:45:43 GMT""}]","2009-10-31"
"math/9902092","Yuri Tschinkel","Fedor Bogomolov and Yuri Tschinkel","Density of rational points on elliptic K3 surfaces","27 pages, LaTeX",,,,"math.AG math.NT",,"  Let $X$ be a K3 surface defined over a number field $K$. Assume that $X$
admits a structure of an elliptic fibration or an infinite group of
automorphisms. Then there exists a finite extension $K'/K$ such that the set of
$K'$-rational points is Zariski dense in $X$.
","[{""version"":""v1"",""created"":""Mon, 15 Feb 1999 16:06:52 GMT""}]","2007-05-23"
"math/9902093","Ostrik Viktor","Viktor Ostrik","Dimensions of quantized tilting modules","6 pages, LaTex2e, submitted to Moscow Math. Journal",,,,"math.QA",,"  Let $U$ be the quantum group with divided powers in $p-$th root of unity for
prime $p$. For any two-sided cell $A$ in the corresponding affine Weyl group
one associates tensor ideal in the category of tilting modules over $U$. In
this note we show that for any cell $A$ there exists tilting module $T$ from
the corresponding tensor ideal such that biggest power of $p$ which divides
$dim T$ is $p^{a(A)}$ where $a(A)$ is Lusztig's $a-$function. In new version
some typos are corrected and exposition is improved following suggestions of
the referee.
","[{""version"":""v1"",""created"":""Mon, 15 Feb 1999 17:04:54 GMT""},{""version"":""v2"",""created"":""Thu, 14 Dec 2000 17:32:50 GMT""}]","2007-05-23"
"math/9902094","Ostrik Viktor","Viktor Ostrik","Cohomology of subregular tilting modules for small quantum groups","5 pages, LaTex2e",,,,"math.QA",,"  Let $U$ be the quantum group with divided powers in $l-$th root of unity and
let $u\subset U$ be the Frobenius kernel. V.Ginzburg and S.Kumar proved that
the cohomology algebra of $u$ with trivial coefficients is isomorphic to the
functions algebra of the nilpotent cone of the corresponding Lie algebra. In
this note we show that there exists tilting module $T$ such that the cohomology
of $u$ with coefficients in $T$ is isomorphic to the functions algebra of the
closure of the subregular nilpotent orbit.
","[{""version"":""v1"",""created"":""Mon, 15 Feb 1999 17:26:17 GMT""}]","2007-05-23"
"math/9902095","Stefan Haller","Stefan Haller and Tomasz Rybicki","On the Perfectness of Nontransitive Groups of Diffeomorphisms","16 pages",,,,"math.DG",,"  It is proven that the identity component of the group preserving the leaves
of a generalized foliation is perfect. This shows that a well-known simplicity
theorem on the diffeomorphism group extends to the nontransitive case.
","[{""version"":""v1"",""created"":""Mon, 15 Feb 1999 17:40:36 GMT""}]","2007-05-23"
"math/9902096","Richard Green","R.M. Green","Completions of Cellular Algebras","19 pages, AMSTeX",,,,"math.QA math.RT",,"  We introduce procellular algebras, so called because they are inverse limits
of finite dimensional cellular algebras as defined by Graham and Lehrer. A
procellular algebra is defined as a certain completion of an infinite
dimensional cellular algebra whose cell datum is of ``profinite type''. We show
how these notions overcome some known obstructions to the theory of cellular
algebras in infinite dimensions.
","[{""version"":""v1"",""created"":""Mon, 15 Feb 1999 17:43:04 GMT""}]","2007-05-23"
"math/9902097","Vershynin","R. Vershynin","Subsequences of frames","16 pages, LaTeX",,,,"math.FA",,"  Every frame in Hilbert space contains a subsequence equivalent to an
orthogonal basis. If a frame is n-dimensional then this subsequence has length
(1 - \epsilon) n. On the other hand, there is a frame which does not contain
bases with brackets.
","[{""version"":""v1"",""created"":""Mon, 15 Feb 1999 18:16:24 GMT""}]","2007-05-23"
"math/9902098","George W. Patrick","G. W. Patrick (University of Saskatchewan), R. M. Roberts (University
  of Warwick)","The Transversal Relative Equilibria of a Hamiltonian System with
  Symmetry","18 pages",,"10.1088/0951-7715/13/6/311",,"math.SG math-ph math.DS math.MP",,"  We show that, given a certain transversality condition, the set of relative
equilibria $\mcl E$ near $p_e\in\mcl E$ of a Hamiltonian system with symmetry
is locally Whitney-stratified by the conjugacy classes of the isotropy
subgroups (under the product of the coadjoint and adjoint actions) of the
momentum-generator pairs $(\mu,\xi)$ of the relative equilibria. The dimension
of the stratum of the conjugacy class (K) is $\dim G+2\dim Z(K)-\dim K$, where
Z(K) is the center of K, and transverse to this stratum $\mcl E$ is locally
diffeomorphic to the commuting pairs of the Lie algebra of $K/Z(K)$. The
stratum $\mcl E_{(K)}$ is a symplectic submanifold of P near $p_e\in\mcl E$ if
and only if $p_e$ is nondegenerate and K is a maximal torus of G. We also show
that there is a dense subset of G-invariant Hamiltonians on P for which all the
relative equilibria are transversal. Thus, generically, the types of
singularities that can be found in the set of relative equilibria of a
Hamiltonian system with symmetry are those types found amongst the
singularities at zero of the sets of commuting pairs of certain Lie subalgebras
of the symmetry group.
","[{""version"":""v1"",""created"":""Tue, 16 Feb 1999 15:54:18 GMT""}]","2009-10-31"
"nucl-th/9902034","Jorge Piekarewicz","L. Zhou and J. Piekarewicz","Relativistic Treatment of Hypernuclear Decay","Revtex: 18 pages and 4 postscript figures","Phys.Rev.C60:024306,1999","10.1103/PhysRevC.60.024306","FSU-SCRI-99-07","nucl-th",,"  We compute for the first time the decay width of lambda-hypernuclei in a
relativistic mean-field approximation to the Walecka model. Due to the small
mass difference between the lambda-hyperon and its decay products---a nucleon
and a pion---the mesonic component of the decay is strongly Pauli blocked in
the nuclear medium. Thus, the in-medium decay becomes dominated by the
non-mesonic, or two-body, component of the decay. For this mode, the
lambda-hyperon decays into a nucleon and a spacelike nuclear excitation. In
this work we concentrate exclusively on the pion-like modes. By relying on the
analytic structure of the nucleon and pion propagators, we express the
non-mesonic component of the decay in terms of the spin-longitudinal response
function. This response has been constrained from precise quasielastic (p,n)
measurements done at LAMPF. We compute the spin-longitudinal response in a
relativistic random-phase-approximation model that reproduces accurately the
quasielastic data. By doing so, we obtain hypernuclear decay widths that are
considerably smaller---by factors of two or three---relative to existing
nonrelativistic calculations.
","[{""version"":""v1"",""created"":""Mon, 15 Feb 1999 17:10:25 GMT""}]","2008-11-26"
