"gr-qc/9902049","Jose Luis Rosales","Jose-Luis Rosales","Spacetime foam and the electroweak coupling constant",,,,,"gr-qc",,"  We compute the regularized temperature for a spacetime foam model, consisting
on S^4 instantons, in quantum gravity. Assuming that thermal equilibrium takes
place with some amount of radiation - with thermal fields in the SU(2)xU(1)
gauge theory - we obtain the remarkable result that the squared value of this
temperature exactly coincides with the electroweak coupling constant at the
energy scale of the gauge bosons W. This is consistent with the classical ADM
result that the electrical charge should be equal to its finite gravitational
self energy.
","[{""version"":""v1"",""created"":""Wed, 17 Feb 1999 12:47:20 GMT""},{""version"":""v2"",""created"":""Mon, 24 May 1999 17:42:57 GMT""}]","2007-05-23"
"hep-ex/9902025","Eugenio Scapparone","E. Scapparone (for the NOE Collaboration)","NOE: a neutrino experiment for the CERN-Gran Sasso Long Base line
  project","7 pages, 9 figures, Talk at 5th International Workshop on Tau Lepton
  Physics (TAU98), To be published in Nucl. Phys. B, Proc. Suppl","Nucl.Phys.Proc.Suppl. 76 (1999) :471-476","10.1016/S0920-5632(99)00509-5",,"hep-ex",,"  The project of a large underground experiment (NOE) devoted to long baseline
neutrino oscillation measurement is presented
","[{""version"":""v1"",""created"":""Tue, 16 Feb 1999 21:49:43 GMT""}]","2019-08-14"
"hep-lat/9902021","Urs M. Heller","Robert G. Edwards, Urs M. Heller and Rajamani Narayanan","Small eigenvalues of the staggered Dirac operator in the adjoint
  representation and Random Matrix Theory","3 pages, revtex, 2 postscript figures","Phys.Rev. D60 (1999) 077502","10.1103/PhysRevD.60.077502","FSU-SCRI-99-09","hep-lat",,"  The low-lying spectrum of the Dirac operator is predicted to be universal,
within three classes, depending on symmetry properties specified according to
random matrix theory. The three universal classes are the orthogonal, unitary
and symplectic ensemble. Lattice gauge theory with staggered fermions has
verified two of the cases so far, unitary and symplectic, with staggered
fermions in the fundamental representation of SU(3) and SU(2). We verify the
missing case here, namely orthogonal, with staggered fermions in the adjoint
representation of SU(N_c), N_c=2, 3.
","[{""version"":""v1"",""created"":""Tue, 16 Feb 1999 23:00:39 GMT""}]","2009-10-31"
"hep-lat/9902022","Tatsuya Noguchi","Y. Kikukawa and T. Noguchi (Kyoto Univ.)","Low energy effective action of domain-wall fermion and the
  Ginsparg-Wilson relation","35 pages, LaTeX2e, references added and updated, minor corrections",,"10.1016/S0920-5632(00)91758-4","KUNS-1560","hep-lat",,"  We derive the effective action of the light fermion field of the domain-wall
fermion, which is referred as $q(x)$ by Furman and Shamir. The inverse of the
effective Dirac operator turns out to be identical to the inverse of the
truncated overlap Dirac operator, except a local contact term which would give
the chiral symmetry breaking in the Ginsparg-Wilson relation. This result
allows us to relate the light fermion field and the fermion field described by
the truncated overlap Dirac operator and to understand the chiral property of
the light fermion through the exact chiral symmetry based on the
Ginsparg-Wilson relation.
","[{""version"":""v1"",""created"":""Wed, 17 Feb 1999 04:18:36 GMT""},{""version"":""v2"",""created"":""Sat, 20 Feb 1999 09:34:04 GMT""}]","2015-06-25"
"hep-lat/9902023","Attilio Cucchieri","Attilio Cucchieri (Universitaet Bielefeld)","Infrared behavior of the gluon propagator in lattice Landau gauge: the
  three-dimensional case","14 pages, BI-TP 99/03 preprint, correction in the Acknowledgments
  section. To appear in Phys.Rev.D","Phys.Rev. D60 (1999) 034508","10.1103/PhysRevD.60.034508",,"hep-lat",,"  We evaluate numerically the three-momentum-space gluon propagator in the
lattice Landau gauge, for three-dimensional pure-SU(2) lattice gauge theory
with periodic boundary conditions. Simulations are done for nine different
values of the coupling $\beta$, from $\beta = 0$ (strong coupling) to $\beta =
6.0$ (in the scaling region), and for lattice sizes up to $V = 64^3$. In the
limit of large lattice volume we observe, in all cases, a gluon propagator
decreasing for momenta smaller than a constant value $p_{dec}$. From our data
we estimate $p_{dec} \approx 350$ MeV. The result of a gluon propagator
decreasing in the infrared limit has a straightforward interpretation as
resulting from the proximity of the so-called first Gribov horizon in the
infrared directions.
","[{""version"":""v1"",""created"":""Wed, 17 Feb 1999 13:24:11 GMT""},{""version"":""v2"",""created"":""Tue, 4 May 1999 07:33:50 GMT""}]","2009-10-31"
"hep-lat/9902024","Attilio Cucchieri","Attilio Cucchieri and Tereza Mendes (Universitaet Bielefeld)","Gauge fixing and gluon propagator in lambda-gauges","5 pages, Poster presented by A. Cucchieri at the Strong and
  Electroweak Matter `98 Conference in Copenhagen, December 2-5, 1998",,,,"hep-lat",,"  We discuss critical slowing-down of several gauge-fixing algorithms for the
so-called lambda-gauges in the SU(2) case at zero temperature. For these gauges
we also evaluate the gluon propagator using different definitions of the
lattice gluon field, corresponding to discretization errors of different
orders.
","[{""version"":""v1"",""created"":""Wed, 17 Feb 1999 15:15:46 GMT""}]","2007-05-23"
"hep-ph/9902354","Alexander Kusenko","Graciela Gelmini and Alexander Kusenko (UCLA)","Highest-energy cosmic rays from Fermi-degenerate relic neutrinos
  consistent with Super-Kamiokande results","3 pages, revtex; final version (minor changes in wording and
  references)","Phys.Rev.Lett. 82 (1999) 5202","10.1103/PhysRevLett.82.5202","UCLA/99/TEP/6","hep-ph astro-ph",,"  Relic neutrinos with mass 0.07 (+0.02/-0.04) eV, in the range consistent with
Super-Kamiokande data, can explain the cosmic rays with energies in excess of
the Greisen-Zatsepin-Kuzmin cutoff. The spectrum of ultra-high energy cosmic
rays produced in this fashion has some distinctive features that may help
identify their origin. Our mechanism does not require but is consistent with a
neutrino density high enough to be a new kind of hot dark matter.
","[{""version"":""v1"",""created"":""Tue, 16 Feb 1999 23:29:10 GMT""},{""version"":""v2"",""created"":""Mon, 17 May 1999 18:48:02 GMT""}]","2009-10-31"
"hep-ph/9902365","Johann Rafelski","Johann Rafelski and Jean Letessier (Department of Physics, University
  of Arizona, Tucson, AZ and LPTHE-Universite Paris 7, France)","Hadron Freeze-out and QGP Hadronization","10 pages including 7 tables. Presented at the 15th Winter Workshop on
  Nuclear Dynamics, Park City, UT, January 1999, proceedings to be published by
  Kluwer Academic Press (1999) W. Bauer and G. Westfall, Eds",,,,"hep-ph",,"  Abundances and $m_\bot$-spectra of strange and other hadronic particles
emanating from central 158-200 A GeV reactions between nuclei are found to
originate from a thermally equilibrated, deconfined source in chemical
non-equilibrium. Physical freeze-out parameters and physical conditions
(pressure, specific energy, entropy, and strangeness) are evaluated. Five
properties of the source we obtain are as expected for direct hadron emission
(hadronization) from a deconfined quark-gluon plasma phase.
","[{""version"":""v1"",""created"":""Tue, 16 Feb 1999 20:11:50 GMT""}]","2007-05-23"
"hep-ph/9902366","V. Dmitrasinovic","V. Dmitra\v{s}inovi\'c","Bound state in the vector channel of the extended Nambu--Jona-Lasinio
  model at fixed f_\pi","9 pages, 2 (eps) figures, to appear in PLB","Phys.Lett.B451:170-174,1999","10.1016/S0370-2693(99)00195-1","USC-PHYS-NT-99-01","hep-ph",,"  We show that, as a consequence of fixing f_\pi = 93 MeV: (1) a bound state
pole in the J^P = 1^- scattering amplitude of the ENJL model exists for
arbitrarily weak (positive) vector coupling G_2 so long as the constituent
quark mass is sufficiently large; (2) there is a bound state for any quark mass
when G_2 \geq 0.6/(8 f_\pi^2); (3) this bound state becomes massless at G_2 =
1/(8 f_\pi^2) and a tachyon for G_2 exceeding it. We show by way of an example
that the model has no trouble fitting the \rho meson mass simultaneously with
other observables.
","[{""version"":""v1"",""created"":""Tue, 16 Feb 1999 17:16:49 GMT""}]","2008-11-26"
"hep-ph/9902367","Edoardo Di Napoli","Edoardo Di Napoli","The Nambu-Jona Lasinio mechanism and the electroweak symmetry breaking
  in the Standard Model","18 Pages, no figures, LaTex, corrected typos, references removed",,,,"hep-ph",,"  This is a short report of the entire work developed during the study of the
possible realizations of the ""Top Mode"" Standard Model. Here it is examined the
breaking of internal symmetries from another point of view showing that is
possible to reproduce the gauged electroweak panorama of the traditional
Standard Model in a exhaustive and selfconsistent way. The result is reached
applying the main futures of the Nambu-Jona Lasinio (NJL) mechanism to an
electroweak invariant Lagrangian. In this context the use of functional
formalism for composite operators naturally leads to a different dynamical
approach. Meanwhile the Higgs mechanism acts on the Lagrangian form, a NJL like
model looks directly at the physics of the system showing the real dynamical
content hidden in the Green functions of the theory.
","[{""version"":""v1"",""created"":""Tue, 16 Feb 1999 18:35:46 GMT""},{""version"":""v2"",""created"":""Fri, 7 May 1999 12:05:10 GMT""}]","2007-05-23"
"hep-ph/9902368","Tracas Nicholas","G.K. Leontaris and N.D. Tracas","String Unification at Intermediate Energies: Phenomenological Viability
  and Implications","11 pages, 2 figure included in the ps file, uses psfig.sty","Phys.Lett. B454 (1999) 53-58","10.1016/S0370-2693(99)00384-6","IOA-TH/99-10, NTUA-05/99","hep-ph",,"  Motivated by the fact that the string scale can be many orders of magnitude
lower than the Planck mass, we investigate the required modifications in the
MSSM $\beta$--functions in order to achieve intermediate ($10^{10-13}$GeV)
scale unification, keeping the traditional logarithmic running of the gauge
couplings. We present examples of string unified models with the required extra
matter for such a unification while we also check whether other MSSM properties
(such as radiative symmetry breaking) are still applicable.
","[{""version"":""v1"",""created"":""Tue, 16 Feb 1999 19:20:52 GMT""}]","2009-10-31"
"hep-ph/9902369","Richard F. Lebed","Benjamin Grinstein and Richard F. Lebed","B^+ --> D^{*+}_s gamma and B^+ --> D^{*+} gamma as Probes of V_{ub}","10 pages, latex (revtex), 2 eps figures. Corrects numerical errors in
  branching fraction calculation","Phys.Rev.D60:031302,1999","10.1103/PhysRevD.60.031302","UCSD/PTH 99-02 and JLAB-THY-99-05","hep-ph",,"  The decays B^+ --> D^{*+}_s gamma and B^+ --> D^{*+} gamma can be used for an
extraction of |V_{ub}|. When the b and c quarks are nearly degenerate the rate
for these modes can be determined in terms of other observed rates, namely
B\bar{B} mixing and D^* --> D gamma decay. To this end we introduce a novel
application of heavy quark and flavor symmetries. Although somewhat
unrealistic, this limit provides us with a first estimate of these rates.
","[{""version"":""v1"",""created"":""Tue, 16 Feb 1999 19:26:30 GMT""},{""version"":""v2"",""created"":""Sat, 20 Mar 1999 19:21:54 GMT""}]","2009-12-30"
"hep-ph/9902370","Iain Stewart","Thomas Mehen, Iain W. Stewart, and Mark B. Wise (Caltech)","Wigner symmetry in the limit of large scattering lengths","4 pages, 2 figs, minor typos and discussion regarding the number of
  three body operators corrected","Phys.Rev.Lett. 83 (1999) 931-934","10.1103/PhysRevLett.83.931","CALT-68-2213","hep-ph nucl-th",,"  We note that in the limit where the NN 1S0 and 3S1 scattering lengths,
a^(1S0) and a^(3S1), go to infinity, the leading terms in the effective field
theory for strong NN interactions are invariant under Wigner's SU(4)
spin-isospin symmetry. This explains why the leading effects of radiation pions
on the S-wave NN scattering amplitudes vanish as a^(1S0) and a^(3S1) go to
infinity. The implications of Wigner symmetry for NN to NN axion and gamma d to
n p are also considered.
","[{""version"":""v1"",""created"":""Tue, 16 Feb 1999 19:47:30 GMT""},{""version"":""v2"",""created"":""Mon, 1 Mar 1999 21:41:57 GMT""}]","2009-10-31"
"hep-ph/9902371","Apostolos Pilaftsis","Apostolos Pilaftsis and Carlos E.M. Wagner","Higgs Bosons in the Minimal Supersymmetric Standard Model with Explicit
  CP Violation",,"Nucl.Phys.B553:3-42,1999","10.1016/S0550-3213(99)00261-8",,"hep-ph astro-ph hep-ex",,"  We study the Higgs-boson mass spectrum of the minimal supersymmetric standard
model, in which the tree-level CP invariance of the Higgs potential is broken
explicitly by loop effects of soft-CP-violating Yukawa interactions related to
scalar quarks of the third generation. The analysis is performed by considering
the CP-non-invariant renormalization-group improved effective potential through
next-to-leading order that includes leading logarithms due to two-loop Yukawa
and QCD corrections. We find that the three neutral Higgs particles predicted
by the theory may strongly mix with one another, thereby significantly
modifying their tree-level couplings to fermions and to the $W^\pm$ and Z
bosons. We analyze the phenomenological consequences of such a minimal
supersymmetric scenario of explicit CP violation on the production rates of the
lightest Higgs particle, and discuss strategies for its potential discovery at
high-energy colliders.
","[{""version"":""v1"",""created"":""Tue, 16 Feb 1999 20:08:51 GMT""},{""version"":""v2"",""created"":""Fri, 19 Feb 1999 17:52:46 GMT""},{""version"":""v3"",""created"":""Fri, 16 Apr 1999 19:35:52 GMT""},{""version"":""v4"",""created"":""Wed, 18 Aug 1999 11:48:06 GMT""}]","2009-10-07"
"hep-ph/9902372","Csaba Boros","C. Boros and A. W. Thomas","Parton Distributions for the Octet and Decuplet Baryons","29 pages, 15 figures","Phys.Rev.D60:074017,1999","10.1103/PhysRevD.60.074017","ADP-99-9/T354","hep-ph",,"  We calculate the parton distributions for both polarized and unpolarized
octet and decuplet baryons, using the MIT bag, dressed by mesons. We show that
the hyperfine interaction responsible for the $\Delta - N$ and $\Sigma^0 -
\Lambda$ splittings leads to large deviations from SU(3) and SU(6) predictions.
For the $\Lambda$ we find significant polarized, non-strange parton
distributions which lead to a sizable $\Lambda$ polarization in polarized,
semi-inclusive $ep$ scattering. We also discuss the flavour symmetry violation
arising from the meson-cloud associated with the chiral structure of baryons.
","[{""version"":""v1"",""created"":""Wed, 17 Feb 1999 05:15:49 GMT""}]","2010-02-17"
"hep-ph/9902373","Peter Petreczky","F. Karsch, M. Oevers and P. Petreczky","Screening Masses of Hot SU(2) Gauge Theory from the 3D Adjoint Higgs
  Model","Talk given at SEWM98 Conference, Copenhagen, December 1998",,,"ITP Budapest Rep. 549","hep-ph",,"  We study the Landau gauge propagators of the lattice SU(2) 3d adjoint Higgs
model, considered as an effective theory of high temperature 4d SU(2) gauge
theory. From the long distance behaviour of the propagators we extract the
screening masses. It is shown that the pole masses extracted from the
propagators agree well with the screening masses obtained recently in finite
temperature SU(2) theory. The relation of the propagator masses to the masses
extracted from gauge invariant correlators is also discussed. In so-called
lambda gauges non-perturbative evidence is given for the gauge independence of
pole masses within this class of gauges.
","[{""version"":""v1"",""created"":""Wed, 17 Feb 1999 13:51:54 GMT""}]","2007-05-23"
"hep-ph/9902374","Parida Mina K.","M.K.Parida (ICTP) and B.Purkayastha (NEHU,Shillong,India)","New Formulas and Predictions for Running Masses at Higher Scales in MSSM","9 pages Latex.Typos corrected","Eur.Phys.J.C14:159-164,2000","10.1007/s100520050742","IC/99/10","hep-ph",,"  Including contributions of scale-dependent vacuum expectation values of Higgs
scalars, we derive new one-loop formulas analytically for running quark-lepton
masses at higher scales in MSSM. Apart from the gauge-coupling dependence being
different from earlier formulas, the third-generation- Yukawa-coupling effects
are absent in the masses of the first two generations. While predicting the
masses and $\tan\beta$ numerically, we also include two-loop effects.
","[{""version"":""v1"",""created"":""Wed, 17 Feb 1999 14:25:13 GMT""},{""version"":""v2"",""created"":""Fri, 19 Feb 1999 16:56:05 GMT""}]","2008-11-26"
"hep-ph/9902375","Gregory Korchemsky","V.M. Braun, S.E. Derkachov, G.P. Korchemsky and A.N. Manashov","Baryon Distribution Amplitudes in QCD","75 pages, LaTeX style, 18 figures embedded with epsf.sty","Nucl.Phys. B553 (1999) 355-426","10.1016/S0550-3213(99)00265-5","LPT-Orsay-98-83, NORDITA-99-11-HE, SPbU-IP-99-04","hep-ph nlin.SI solv-int",,"  We develop a new theoretical framework for the description of leading twist
light-cone baryon distribution amplitudes which is based on integrability of
the helicity $\lambda=3/2$ evolution equation to leading logarithmic accuracy.
A physical interpretation is that one can identify a new `hidden' quantum
number which distinguishes components in the $\lambda=3/2$ distribution
amplitudes with different scale dependence. The solution of the corresponding
evolution equation is reduced to a simple three-term recurrence relation. The
exact analytic solution is found for the component with the lowest anomalous
dimension for all moments $N$, and the WKB-type expansion is constructed for
other levels, which becomes asymptotically exact at large $N$. Evolution
equations for the $\lambda=1/2$ distribution amplitudes (e.g. for the nucleon)
are studied as well. We find that the two lowest anomalous dimensions for the
$\lambda=1/2$ operators (one for each parity) are separated from the rest of
the spectrum by a finite `mass gap'. These special states can be interpreted as
scalar diquarks.
","[{""version"":""v1"",""created"":""Wed, 17 Feb 1999 14:31:27 GMT""}]","2009-10-31"
"hep-th/9902113","Matthias Staudacher","Werner Krauth and Matthias Staudacher","Eigenvalue Distributions in Yang-Mills Integrals","8 pages, 6 figures, some corrections","Phys.Lett. B453 (1999) 253-257","10.1016/S0370-2693(99)00395-0","AEI-099","hep-th",,"  We investigate one-matrix correlation functions for finite SU(N) Yang-Mills
integrals with and without supersymmetry. We propose novel convergence
conditions for these correlators which we determine from the one-loop
perturbative effective action. These conditions are found to agree with
non-perturbative Monte Carlo calculations for various gauge groups and
dimensions. Our results yield important insights into the eigenvalue
distributions rho(lambda) of these random matrix models. For the bosonic
models, we find that the spectral densities rho(lambda) possess moments of all
orders as N -> Infinity. In the supersymmetric case, rho(lambda) is a wide
distribution with an N-independent asymptotic behavior rho(lambda) ~
lambda^(-3), lambda^(-7), lambda^(-15) for dimensions D=4,6,10, respectively.
","[{""version"":""v1"",""created"":""Tue, 16 Feb 1999 22:33:50 GMT""},{""version"":""v2"",""created"":""Thu, 4 Mar 1999 17:22:14 GMT""}]","2009-10-31"
"hep-th/9902116","Eric R. Sharpe","Eric R. Sharpe","D-Branes, Derived Categories, and Grothendieck Groups","LaTeX, 21 pages","Nucl.Phys.B561:433-450,1999","10.1016/S0550-3213(99)00535-0","DUKE-CGTP-99-03","hep-th",,"  In this paper we describe how Grothendieck groups of coherent sheaves and
locally free sheaves can be used to describe type II D-branes, in the case that
all D-branes are wrapped on complex varieties and all connections are
holomorphic. Our proposal is in the same spirit as recent discussions of
K-theory and D-branes; within the restricted class mentioned, Grothendieck
groups encode a choice of connection on each D-brane worldvolume, in addition
to information about the smooth bundles. We also point out that derived
categories can also be used to give insight into D-brane constructions, and
analyze how a Z_2 subset of the T-duality group acting on D-branes on tori can
be understood in terms of a Fourier-Mukai transformation.
","[{""version"":""v1"",""created"":""Tue, 16 Feb 1999 20:20:18 GMT""}]","2008-11-26"
"hep-th/9902117","Robert Edwards","Robert G. Edwards, Urs M. Heller, Joe Kiskis and Rajamani Narayanan","Quark spectra, topology and random matrix theory","4 pages, revtex, 2 postscript figures. Added a reference","Phys.Rev.Lett. 82 (1999) 4188-4191","10.1103/PhysRevLett.82.4188","FSU-SCRI-99-08, UCD 1999-3","hep-th hep-lat",,"  Quark spectra in QCD are linked to fundamental properties of the theory
including the identification of pions as the Goldstone bosons of spontaneously
broken chiral symmetry. The lattice Overlap-Dirac operator provides a
nonperturbative, ultraviolet-regularized description of quarks with the correct
chiral symmetry. Properties of the spectrum of this operator and their relation
to random matrix theory are studied here. In particular, the predictions from
chiral random matrix theory in topologically non-trivial gauge field sectors
are tested for the first time.
","[{""version"":""v1"",""created"":""Tue, 16 Feb 1999 22:47:19 GMT""},{""version"":""v2"",""created"":""Mon, 22 Feb 1999 17:59:45 GMT""}]","2009-10-31"
"hep-th/9902118","Joshua Erlich","Joshua Erlich, Amihay Hanany, Asad Naqvi","Marginal Deformations from Branes","42 pages, minor changes, references added","JHEP 9903 (1999) 008","10.1088/1126-6708/1999/03/008","MIT-CTP-2826","hep-th",,"  We study brane configurations for four dimensional N=1 supersymmetric gauge
theories with quartic superpotentials which flow in the infrared to manifolds
of interacting superconformal fixed points. We enumerate finite N=2 theories,
from which a large class of marginal N=1 theories descend. We give the brane
descriptions of these theories in Type IIA and Type IIB string theory. The Type
IIB descriptions are in terms of D3 branes in orientifold and generalized
conifold backgrounds. We calculate the Weyl and Euler anomalies in these
theories, and find that they are equal in elliptic models and unequal in a
large class of finite N=2 and marginal N=1 non-elliptic theories.
","[{""version"":""v1"",""created"":""Tue, 16 Feb 1999 23:20:49 GMT""},{""version"":""v2"",""created"":""Wed, 10 Mar 1999 20:37:23 GMT""}]","2009-10-31"
"hep-th/9902119","Radu Tatar","Kyungho Oh, Radu Tatar","Comments on Brane Configurations with Semi-infinite D4 Branes","10 pages, Latex",,,"BROWN-HET-1169","hep-th",,"  We consider four dimensional supersymmetric gauge field theories from brane
configurations with the matter content given by semi-infinite D4 branes ending
on both sides of NS branes. In M theory configuration, we discuss the splitting
of the M5 brane into infinite cylindrical M5 branes (which decouple) and
transversal M5 brane. The splitting condition appears naturally from the
consistency of the different projections of the Seiberg-Witten curve.
","[{""version"":""v1"",""created"":""Tue, 16 Feb 1999 23:42:23 GMT""}]","2007-05-23"
"hep-th/9902120","Yuji Satoh","Michael Gutperle and Yuji Satoh","D0-branes in Gepner models and N=2 black holes","28 pages, uses harvmac; typos corrected","Nucl.Phys.B555:477-503,1999","10.1016/S0550-3213(99)00379-X","PUPT-1838","hep-th",,"  In this paper D-brane boundary states constructed in Gepner models are used
to analyze some aspects of the dynamics of D0-branes in Calabi-Yau
compactifications of type II theories to four dimensions. It is shown that the
boundary states correspond to BPS objects carrying dyonic charges. By analyzing
the couplings to closed string fields a correspondence between the D0-branes
and extremal charged black holes in N=2 supergravity is found.
","[{""version"":""v1"",""created"":""Tue, 16 Feb 1999 23:57:49 GMT""},{""version"":""v2"",""created"":""Thu, 4 Mar 1999 20:44:16 GMT""}]","2014-11-18"
"hep-th/9902121","Per Kraus","Vijay Balasubramanian and Per Kraus","A Stress Tensor for Anti-de Sitter Gravity","19 pages. added footnote, reference","Commun.Math.Phys. 208 (1999) 413-428","10.1007/s002200050764","HUTP-99/A002, EFI-99-6, NSFITP-98-132","hep-th gr-qc",,"  We propose a procedure for computing the boundary stress tensor associated
with a gravitating system in asymptotically anti-de Sitter space. Our
definition is free of ambiguities encountered by previous attempts, and
correctly reproduces the masses and angular momenta of various spacetimes. Via
the AdS/CFT correspondence, our classical result is interpretable as the
expectation value of the stress tensor in a quantum conformal field theory. We
demonstrate that the conformal anomalies in two and four dimensions are
recovered. The two dimensional stress tensor transforms with a Schwarzian
derivative and the expected central charge. We also find a nonzero ground state
energy for global AdS_5, and show that it exactly matches the Casimir energy of
the dual N=4 super Yang-Mills theory on S^3 x R.
","[{""version"":""v1"",""created"":""Wed, 17 Feb 1999 00:48:44 GMT""},{""version"":""v2"",""created"":""Wed, 24 Mar 1999 01:14:39 GMT""},{""version"":""v3"",""created"":""Mon, 12 Apr 1999 17:14:18 GMT""},{""version"":""v4"",""created"":""Mon, 19 Apr 1999 20:07:14 GMT""},{""version"":""v5"",""created"":""Tue, 28 Dec 1999 23:45:33 GMT""}]","2009-10-31"
