"hep-th/9902122","Nobuyoshi Ohta","Kazuyuki Furuuchi, Nobuyoshi Ohta and Jian-Ge Zhou","Spacetime Superalgebra in AdS_4 \times S^7 via Supermembrane Probe","8 pages, Latex, minor corrections, final version to appear in Phys.
  Rev.D","Phys. Rev. D 60, 047901 (1999)","10.1103/PhysRevD.60.047901","OU-HET 313","hep-th",,"  The spacetime superalgebra via the supermembrane probe in the background of
AdS_4 \times S^7 is discussed to the lowest order in the spinor coordinate
$\t$. To obtain the correct spacetime superalgebras, all $\t^2$ order
corrections for supervielbein and super 3-form gauge potential have to be
included. The central extension of the superalgebra OSp(8|4) of the super
isometries for AdS_4 \times S^7 is found.
","[{""version"":""v1"",""created"":""Wed, 17 Feb 1999 07:15:38 GMT""},{""version"":""v2"",""created"":""Fri, 19 Feb 1999 04:55:10 GMT""},{""version"":""v3"",""created"":""Wed, 21 Apr 1999 06:24:19 GMT""}]","2016-08-25"
"hep-th/9902124","Massimo Blasone","Massimo Blasone, Peter A. Henning, Giuseppe Vitiello","Berry phase for oscillating neutrinos","7 pages, Revtex","Phys.Lett. B466 (1999) 262-266","10.1016/S0370-2693(99)01137-5",,"hep-th hep-ph",,"  We show the presence of a topological (Berry) phase in the time evolution of
a mixed state. For the case of mixed neutrinos, the Berry phase is a function
of the mixing angle only.
","[{""version"":""v1"",""created"":""Wed, 17 Feb 1999 14:00:24 GMT""},{""version"":""v2"",""created"":""Thu, 18 Feb 1999 08:44:34 GMT""},{""version"":""v3"",""created"":""Mon, 22 Mar 1999 17:30:18 GMT""}]","2009-10-31"
"hep-th/9902126",,"G. Veneziano","Pre-bangian origin of our entropy and time arrow","Latex file, 8 pages, 1 Figure","Phys.Lett. B454 (1999) 22-26","10.1016/S0370-2693(99)00267-1","CERN-TH/99-32","hep-th",,"  I argue that, in the chaotic version of string cosmology proposed recently,
classical and quantum effects generate, at the time of exit to radiation, the
correct amount of entropy to saturate a Hubble (or holography) entropy bound
(HEB) and to identify, within our own Universe, the arrow of time. Demanding
that the HEB be fulfilled at all times forces a crucial ""branch change"" to
occur, and the so-called string phase to end at a critical value of the
effective Planck mass, in agreement with previous conjectures.
","[{""version"":""v1"",""created"":""Wed, 17 Feb 1999 15:19:11 GMT""}]","2009-10-31"
"math-ph/9902020","Christoph Kopper","Ch. Kopper (CPHT, Ecole Polytechnique)","Mass Generation in the Large N nonlinear sigma-Model","44 pages","Commun.Math.Phys. 202 (1999) 89-126","10.1007/s002200050576","CPHT 219 0399","math-ph math.MP",,"  We study the infrared behaviour of the two-dimensional Euclidean O(N)
nonlinear sigma-Model with a suitable ultraviolet cutoff. It is proven that for
a sufficiently large (but finite!) number N of field components the model is
massive and thus has exponentially decaying correlation functions. We use a
representation of the model with an interpolating bosonic field. This permits
to analyse the infrared behaviour without any intermediate breaking of
O(N)-symmetry. The proof is simpler than that of the corresponding result for
the Gross-Neveu-Model.
","[{""version"":""v1"",""created"":""Tue, 16 Feb 1999 16:38:24 GMT""}]","2009-10-31"
"math-ph/9902021","Alexander Y. Vlasov","Alexander Yu. Vlasov (FCR/IRH)","Comment on ``Quantization of Diffeomorphism-Invariant Theories with
  Fermions''","5 pages LaTeX",,,,"math-ph gr-qc hep-th math.MP quant-ph",,"  In the comment to the article by J.Baez and K.Krasnov (hep-th/9703112) are
discussed some topics related with application of certain constructions to
non-trivial principal bundles.
","[{""version"":""v1"",""created"":""Tue, 16 Feb 1999 19:16:05 GMT""}]","2010-05-11"
"math/9902099","Tetsuji Miwa","Tetsuji Miwa and Yoshihiro Takeyama","The integral formula for the solutions of the quantum
  Knizhnik-Zamolodchikov equation associated with $U_q(\hat{sl}_n)$ for |q|=1","submitted to the proceedings for SIDE III meeting at Sabaudia near
  Rome",,,"RIMS-1226","math.QA",,"  We write the integral formula of Tarasov-Varchenko type for the solutions to
the quantum Knizhnik-Zamolodchikov associated with a tensor product the of
vector representations of sl_n. We consider the case where the deformation
parameter q satisfies |q|=1. We use the bosonization of the type II vertex
operators in order to find the hypergeometric pairing in this setting.
","[{""version"":""v1"",""created"":""Wed, 17 Feb 1999 05:39:00 GMT""},{""version"":""v2"",""created"":""Thu, 18 Feb 1999 01:18:55 GMT""}]","2007-05-23"
"math/9902100","Matthias Lesch","Jochen Br\""uning (Humboldt-University at Berlin) and Matthias Lesch
  (University of Bonn)","Spectral theory of boundary value problems for Dirac type operators","LaTeX2e, 14 pages. 06 April 1999 final version with minor
  corrections. To appear in B. Booss--Bavnbek, K.P. Wojciechowski (eds.):
  Geometric Aspects of PDE - Spectral Invariants (Roskilde Conf. Sept 1998),
  Contemp. Math","In: B. Booss-Bavnbek, K. Wojciechowski (eds): Geometric Aspects of
  Partial Differential Equations. Proceedings of a Minisymposium on Spectral
  Invariants, Heat Equation Approach, September 18-19, 1998, Roskilde, Denmark.
  Contemporary Mathematics Vol 242, Amer. Math. Soc., Providence, R.I., 1999,
  pp. 203-216",,,"math.DG math.FA",,"  The purpose of this note is to describe a unified approach to the fundamental
results in the spectral theory of boundary value problems, restricted to the
case of Dirac type operators. Even though many facts are known and well
presented in the literature (cf. the monograph of Booss-Wojciechowski), we
simplify and extend or sharpen most results by using systematically the simple
structure which Dirac type operators display near the boundary. Thus our
approach is basically functional analytic, and consequently we achieve results
which apply to more general situations than compact manifolds with boundary.
  The details of the material presented here will be published elsewhere.
","[{""version"":""v1"",""created"":""Wed, 17 Feb 1999 10:57:18 GMT""},{""version"":""v2"",""created"":""Tue, 6 Apr 1999 15:31:28 GMT""}]","2007-05-23"
"math/9902101","Heike Pahlisch","Felipe Leitner","Twistorial constructions of spacelike surfaces in Lorentzian 4-manifolds","Latex2.09, 26 pages",,,,"math.DG",,"  We investigate the twistor space and the Grassmannian fibre bundle of a
Lorentzian 4-space with natural almost optical structures and its induced
CR-structures. The twistor spaces of the Lorentzian space forms $\R^4_1,
\Di{S}^4_1$ and $\Di{H}^4_1$ are explicitly discussed. The given twistor
construction is applied to surface theory in Lorentzian 4-spaces. Immersed
spacelike surfaces in a Lorentzian 4-space with special geometric properties
like semi-umbilic surfaces and surfaces that have mean curvature of vanishing
lengths correspond to holomorphic curves in the Lorentzian twistor space. For
the Lorentzian space forms $\R^4_1, \Di{S}^4_1$ and $\Di{H}^4_1$ those surfaces
are explicitly constructed and classified.
","[{""version"":""v1"",""created"":""Wed, 17 Feb 1999 13:58:20 GMT""}]","2007-05-23"
"math/9902102","Manivel Laurent","J.M. Landsberg and Laurent Manivel","Classification of complex simple Lie algebras via projective geometry
  geometry","slightly revised, to appear in Selecta Mathematica",,,,"math.AG math.DG math.RT",,"  We present a new proof of the classification of complex simple Lie algebras
via the projective geometry of homogeneous varieties. Our proof proceeds by
constructing homogeneous varieties using the ideals of the secant and
tangential varieties of homogeneous varieties already constructed.
  Our algorithms make no reference to root systems. Our proofs use properties
of root systems, but not their classification.
","[{""version"":""v1"",""created"":""Wed, 17 Feb 1999 15:37:01 GMT""},{""version"":""v2"",""created"":""Fri, 19 Oct 2001 12:03:23 GMT""}]","2016-09-07"
"nucl-ex/9902008","Jeff Templon","J. A. Templon (University of Georgia)","Studying Short-Range Dynamics in Few-Body Systems","8 pages, six figures, LaTeX, uses wrapfig.sty, Invited Talk at
  Dubrovnik Conference on Nuclear and Particle Physics with CEBAF at Jefferson
  Lab, November 1998, submitted to Fizika B","Fizika B8:117-126,1999",,,"nucl-ex",,"  I present the case for studying the nature of short-range internucleon
interactions with electron-scattering experiments on few-body nuclear targets.
I first review what electron-scattering studies have unearthed about the nature
of the interactions between nucleons in nuclei at small separation. Special
consideration is given to a couple of recent experiments. The results
essentially serve to construct a roadmap for future studies in this area. The
related experimental program at Jefferson Lab is presented, along with
suggestions for future theoretical work.
","[{""version"":""v1"",""created"":""Tue, 16 Feb 1999 18:17:47 GMT""}]","2011-04-15"
"nucl-th/9902037","Leszek Prochniak","K. Zajac (1), L. Prochniak (1), K. Pomorski (1), S. G. Rohozinski (2),
  J. Srebrny (2) ((1) UMCS Lublin, (2) Warsaw University)","The low-lying quadrupole collective excitations of Ru and Pd isotopes","11 pages, 18 figures in EPS format","Nucl.Phys. A653 (1999) 71-87","10.1016/S0375-9474(99)00161-X",,"nucl-th",,"  Quadrupole excitations of even-even Ru and Pd isotopes are described within
microscopic approach based on the general collective Bohr model which includes
the effect of coupling with the pairing vibrations. The excitation energies and
E2 transition probabilities observed in 104-114Ru and 106-110Pd are reproduced
in the frame of the calculation containing no free parameters.
","[{""version"":""v1"",""created"":""Tue, 16 Feb 1999 16:33:21 GMT""}]","2009-10-31"
"patt-sol/9902005","Martin van Hecke","Martin van Hecke, Cornelis Storm and Wim van Saarloos","Sources, sinks and wavenumber selection in coupled CGL equations and
  experimental implications for counter-propagating wave systems","69 pages, 14 jpeg figures. Quality postscript figures available upon
  request",,"10.1016/S0167-2789(99)00068-8",,"patt-sol nlin.PS",,"  We study the coupled complex Ginzburg-Landau (CGL) equations for traveling
wave systems in the regime where sources and sinks separate patches of left and
right-traveling waves. We show that sources and sinks are the important
coherent structures that organize much of the dynamical properties of traveling
wave systems. We present in detail the framework to analyze these coherent
structures. Our counting arguments for the multiplicities of these structures
show that independently of the coefficients of the CGL, there exists a
symmetric stationary source solution, which sends out waves with a unique
frequency and wave number. Sinks, on the other hand, occur in two-parameter
families, and play an essentially passive role. Simulations show that sources
can send out stable waves, convectively unstable waves, or absolutely unstable
waves. We show that there exists an additional dynamical regime where both
single- and bimodal states are unstable; the ensuing chaotic states have no
counterpart in single amplitude equations. A third dynamical mechanism is
associated with the fact that the width of the sources does not show simple
scaling with the growth rate epsilon. In particular, when the group velocity
term dominates over the linear growth term, no stationary source can exist, but
sources displaying nontrivial dynamics can survive here. Our results are easily
accessible by experiments, and we advocate a study of the sources and sinks as
a means to probe traveling wave systems and compare theory and experiment.
","[{""version"":""v1"",""created"":""Tue, 16 Feb 1999 17:05:29 GMT""}]","2009-10-31"
"physics/9902040","Eugenio Scapparone","E. Scapparone","Review of Cosmic Ray experiments with underground detectors","Invited talk at 6th International Conference on advanced Technology
  and Particle Physics, Villa Olmo, Como, Italy, October 5-9, 1998, To be
  published in Nucl. Phys. B, Proc. Suppl","Nucl.Phys.Proc.Suppl.78:20-25,1999","10.1016/S0920-5632(99)00517-4",,"physics.ins-det",,"  The most important underground detectors addressing Cosmic Ray physics are
described, with a special emphasis on the description of the used technology.
","[{""version"":""v1"",""created"":""Tue, 16 Feb 1999 19:14:14 GMT""}]","2011-07-19"
"physics/9902041","David K. Lubensky","David K. Lubensky and David R. Nelson (Harvard University)","Driven Polymer Translocation Through a Narrow Pore","16 pages, 8 figures, RevTex and harvard citation style, submitted to
  Biophysical Journal",,"10.1016/S0006-3495(99)77027-X",,"physics.bio-ph cond-mat.soft q-bio.BM",,"  Motivated by experiments in which a polynucleotide is driven through a
proteinaceous pore by an electric field, we study the diffusive motion of a
polymer threaded through a narrow channel with which it may have strong
interactions. We show that there is a range of polymer lengths in which the
system is approximately translationally invariant, and we develop a
coarse-grained description of this regime. From this description, general
features of the distribution of times for the polymer to pass through the pore
may be deduced. We also introduce a more microscopic model. This model provides
a physically reasonable scenario in which, as in experiments, the polymer's
speed depends sensitively on its chemical composition, and even on its
orientation in the channel. Finally, we point out that the experimental
distribution of times for the polymer to pass through the pore is much broader
than expected from simple estimates, and speculate on why this might be.
","[{""version"":""v1"",""created"":""Wed, 17 Feb 1999 00:03:09 GMT""}]","2009-10-31"
"physics/9902042","Dominique Yvon","D. Yvon, V. Sushkov, R. Bernard, J.L. Bret, B. Cahan, O. Cloue, O.
  Maillard, B. Mazeau, J.P. Passerieux, B. Paul and C. Veyssiere (CEA-CE
  Saclay, France)","Lock-in detection using a cryogenic low noise looped current
  preamplifier for the readout of resistive bolometers","18 pages, 7 figures, Accepted in NIM A","Nucl.Instrum.Meth. A481 (2002) 306-316","10.1016/S0168-9002(01)01332-8",,"physics.ins-det physics.space-ph",,"  We implemented a low noise current preamplifier for the readout of resistive
bolometers. We tested the apparatus on thermometer resistances ranging from 10
Ohm to 500 Mohm. The use of current preamplifier overcomes constraints
introduced by the readout time constant due to the thermometer resistance and
the input capacitance. Using cold JFETs, this preamplifier board is shown to
have very low noise: the Johnson noise of the source resistor (1 fA/Hz1/2)
dominated in our noise measurements. We also implemented a lock-in chain using
this preamplifier. Because of fast risetime, compensation of the phase shift
may be unnecessary. If implemented, no tuning is necessary when the sensor
impedance changes. Transients are very short, and thus low-passing or sampling
of the signal is simplified. In case of spurious noise, the modulation
frequency can be chosen in a much wider frequency range, without requiring a
new calibration of the apparatus.
","[{""version"":""v1"",""created"":""Wed, 17 Feb 1999 11:21:35 GMT""},{""version"":""v2"",""created"":""Wed, 20 Jun 2001 13:53:25 GMT""}]","2009-10-31"
"physics/9902043","Scapparone Eugenio","E. Scapparone","HEMAS: a Monte Carlo code for hadronic, electromagnetic and TeV muon
  components in air shower","10 pages, 6 figures, Invited Talk at ''International Workshop on
  Simulation and analysis methods for large neutrino detectors'', Desy Zeuthen,
  Berlino (Germany), July 6-9, 1998",,,,"physics.data-an",,"  The features of the HEMAS code are presented. The results of the comparison
between the Monte Carlo expectation and the experimental data are shown.
","[{""version"":""v1"",""created"":""Wed, 17 Feb 1999 12:26:03 GMT""}]","2007-05-23"
"quant-ph/9902058","O. B. Zaslavskii","V. V. Ulyanov and O.B.Zaslavskii (Department of Physics, Kharkov State
  University)","Spin systems, spin coherent states and quasi-exactly solvable models","7 pages, RevTex 3.0. Talk given at the 22nd International Colloqium
  for Group Theoretical Methods in Physics","`Group22: Proceedings of the XXII International Colloquium on
  Group Theoretical Methods in Physics', Eds S P Corney, R Delbourgo and P D
  Jarvis (Cambridge, MA: International Press) 1998, pp. 213-217",,,"quant-ph cond-mat hep-th math-ph math.MP math.RT math.SP",,"  Spin coherent states play a crucial role in defining QESM (quasi-exactly
solvable models) establishing a strict correspondence between energy spectra of
spin systems and low-lying quantum states for a particle moving in a potential
field of a certain form. Spin coherent states are also used for finding the
Wigner-Kirkwood expansion and quantum corrections to energy quantization rules.
The closed equation which governs dynamics of a quantum system is obtained in
the spin coherent representation directly for observable quantities.
","[{""version"":""v1"",""created"":""Tue, 16 Feb 1999 16:25:12 GMT""}]","2007-05-23"
"quant-ph/9902059","Robert B. Griffiths","Robert B. Griffiths (Carnegie-Mellon)","Bohmian mechanics and consistent histories","Minor revision of earlier version. Latex, 10 pages, 1 figure","Phys.Lett. A261 (1999) 227-234","10.1016/S0375-9601(99)00542-3",,"quant-ph",,"  The interpretations of a particular quantum gedanken experiment provided by
Bohmian mechanics and consistent histories are shown to contradict each other,
both in the absence and in the presence of a measuring device. The consistent
history result seems closer to standard quantum mechanics, and shows no
evidence of the mysterious nonlocal influences present in the Bohmian
description.
","[{""version"":""v1"",""created"":""Wed, 17 Feb 1999 14:03:04 GMT""},{""version"":""v2"",""created"":""Wed, 28 Apr 1999 21:06:29 GMT""}]","2009-10-31"
"quant-ph/9902060","O. Yaremchuk","O. Yaremchuk","Quantum phenomenology and the Continuum Problem","4 pages, no figures",,,"LPI45(1998)","quant-ph math.LO",,"  A new approach to quantum mechanics based on independence of the Continuum
Hypothesis is proposed. In one-dimensional case, it is shown that the
properties of the set of intermediate cardinality coincide with quantum
phenomenology.
","[{""version"":""v1"",""created"":""Wed, 17 Feb 1999 15:56:26 GMT""},{""version"":""v2"",""created"":""Wed, 26 Jan 2000 13:53:54 GMT""}]","2007-05-23"
