"cond-mat/9902224","Marcus Mueller","Marcus Mueller (Joh. Gutenberg Universitaet, Mainz, Germany)","Miscibility behavior and single chain properties in polymer blends: a
  bond fluctuation model study","to appear as Feature Article in Macromolecular Theory and Simulations",,,,"cond-mat.stat-mech cond-mat.soft",,"  Computer simulation studies on the miscibility behavior and single chain
properties in binary polymer blends are reviewed. We consider blends of various
architectures in order to identify important architectural parameters on a
coarse grained level and study their qualitative consequences for the
miscibility behavior. The phase diagram, the relation between the exchange
chemical potential and the composition, and the intermolecular paircorrelation
functions for symmetric blends of linear chains, blends of cyclic polymers,
blends with an asymmetry in cohesive energies, blends with different chain
lengths, blends with distinct monomer shapes, and blends with a stiffness
disparity between the components are discussed. We investiagte the temperature
and composition dependence of the single chain conformations in symmetric and
asymmetric blends and compare our findings to scaling arguments and detailed
SCF calculations.
  Two aspects of the single chain dynamics in blends are discussed: the
dynamics of short non--entangled chains in a binary blend and irreversible
reactions of a small fraction of reactive polymers at a strongly segregated
interface. Pertinent off-lattice simulations and analytical theories are
briefly discussed.
","[{""version"":""v1"",""created"":""Tue, 16 Feb 1999 16:37:43 GMT""}]","2007-05-23"
"cond-mat/9902225","G. Sergeeva","G.G.Sergeeva (Kharkov Institute of Physics and Technology, Kharkov,
  Ukraine)","Magnetic Ordering in Layered High Temperature Superconductors","3 pages, LaTex 2.09",,,"KIPT-99-02","cond-mat.supr-con",,"  We discuss the scenario of two-step magnetic ordering in layered high
temperature superconductors after charge ordering. As the temperature
decreases, the transition from 3D Heisenberg spin behavior to 2D XY coupling of
the Cu spins occurs at Berezinskii-Kosterlitz-Thouless temperature in
dielectric stripes. Further temperature decreasing leads to the 3D spin glass
transition.
","[{""version"":""v1"",""created"":""Tue, 16 Feb 1999 18:12:06 GMT""}]","2007-05-23"
"cond-mat/9902226","Anders W. Sandvik","Anders W. Sandvik","Stochastic series expansion method with operator-loop update","5 pages, 4 figures","Phys.Rev. B59 (1999) 14157","10.1103/PhysRevB.59.R14157",,"cond-mat.str-el cond-mat.stat-mech hep-lat",,"  A cluster update (the ``operator-loop'') is developed within the framework of
a numerically exact quantum Monte Carlo method based on the power series
expansion of exp(-BH) (stochastic series expansion). The method is generally
applicable to a wide class of lattice Hamiltonians for which the expansion is
positive definite. For some important models the operator-loop algorithm is
more efficient than loop updates previously developed for ``worldline''
simulations. The method is here tested on a two-dimensional anisotropic
Heisenberg antiferromagnet in a magnetic field.
","[{""version"":""v1"",""created"":""Tue, 16 Feb 1999 18:41:05 GMT""}]","2009-10-31"
"cond-mat/9902227","Cecilia Clementi","Cecilia Clementi, Paolo Carloni and Amos Maritan (International School
  for Advanced Studies (SISSA-ISAS), Trieste, Italy)","Protein Design is a Key Factor for Subunit-subunit Association","submitted to ""Proceedings of the National Academy of Sciences, USA""",,,,"cond-mat.stat-mech q-bio",,"  Fundamental questions about the role of the quaternary structures are
addressed using a statistical mechanics off-lattice model of a dimer protein.
The model, in spite of its simplicity, captures key features of the
monomer-monomer interactions revealed by atomic force experiments. Force curves
during association and dissociation are characterized by sudden jumps followed
by smooth behavior and form hysteresis loops. Furthermore, the process is
reversible in a finite range of temperature stabilizing the dimer. It is shown
that in the interface between the two monomeric subunits the design procedure
naturally favors those amino acids whose mutual interaction is stronger.
Furthermore it is shown that the width of the hysteresis loop increases as the
design procedure improves, i.e. stabilizes more the dimer.
","[{""version"":""v1"",""created"":""Tue, 16 Feb 1999 18:47:22 GMT""}]","2007-05-23"
"cond-mat/9902228","Cecilia Clementi","Cecilia Clementi (1), Michele Vendruscolo (2), Amos Maritan (1) and
  Eytan Domany (2) ((1) International School for Advanced Studies (SISSA-ISAS),
  Trieste, Italy, (2) Department of Physics of Complex Systems, Weizmann
  Institute of Science, Rehovot, Israel)","Folding Lennard-Jones proteins by a contact potential","submitted to ""Proteins: Structure, Function, and Genetics""",,,,"cond-mat.stat-mech q-bio",,"  We studied the possibility to approximate a Lennard Jones interaction by a
pairwise contact potential. First we used a Lennard-Jones potential to design
off-lattice, protein-like heteropolymer sequences, whose lowest energy (native)
conformations were then identified by Molecular Dynamics. Then we turned to
investigate whether one can find a pairwise contact potential, whose ground
states are the contact maps associated with these native conformations. We show
that such a requirement cannot be satisfied exactly - i.e. no such contact
parameters exist. Nevertheless, we found that one can find contact energy
parameters for which an energy minimization procedure, acting in the space of
contact maps, yields maps whose corresponding structures are close to the
native ones. Finally we show that when these structures are used as the initial
point of a Molecular Dynamics energy minimization process, the correct native
folds are recovered with high probability.
","[{""version"":""v1"",""created"":""Tue, 16 Feb 1999 18:48:03 GMT""}]","2007-05-23"
"cond-mat/9902229","Debashish Chowdhury","Debashish Chowdhury (1), Dietrich Stauffer (1) and Reinhard Strey (2);
  ((1) Institute for Theoretical Physics, University of Cologne, (2) Institute
  for Physical Chemistry, University of Cologne)","Periodicity-dependent stiffness of periodic hydrophilic-hydrophobic
  hetero-polymers","Accepted for publication as a Rapid Communication in Physical Review
  E (Minor changes have been made in three of the five eps figures and the
  references have been updated)",,"10.1103/PhysRevE.60.R1158",,"cond-mat.stat-mech",,"  From extensive Monte Carlo simulations of a Larson model of perfectly
periodic heteropolymers (PHP) in water a striking stiffening is observed as the
period of the alternating hydrophobic and hydrophilic blocks is shortened. At
short period and low temperature needle-like conformations are the stable
conformation. As temperature is increased thermal fluctuations induce kinks and
bends. At large periods compact oligomeric globules are observed. From the
generalized Larson prescription, originally developed for modelling surfactant
molecules in aqueous solutions, we find that the shorter is the period the more
stretched is the PHP. This novel effect is expected to stimulate polymer
synthesis and trigger research on the rheology of aqueous periodic
heteropolymer solutions.
","[{""version"":""v1"",""created"":""Tue, 16 Feb 1999 18:56:35 GMT""},{""version"":""v2"",""created"":""Mon, 12 Jul 1999 16:45:05 GMT""}]","2009-10-31"
"cond-mat/9902230","Anders W. Sandvik","Anders W. Sandvik and David K. Campbell","Spin-Peierls transition in the Heisenberg chain with finite-frequency
  phonons","5 pages, 4 figures","Phys. Rev. Lett. 83, 195 (1999)","10.1103/PhysRevLett.83.195",,"cond-mat.str-el",,"  We study the spin-Peierls transition in a Heisenberg spin chain coupled to
optical bond-phonons. Quantum Monte Carlo results for systems with up to N=256
spins show unambiguously that the transition occurs only when the spin-phonon
coupling alpha exceeds a critical value alpha_c. Using sum rules, we show that
the phonon spectral function has divergent (for infinite N) weight extending to
zero frequency for alpha < alpha_c. The equal-time phonon-phonon correlations
decay with distance r as 1/r. This behavior is characteristic for all 0 < alpha
< alpha_c and the q=pi phonon does not soften (to zero frequency) at the
transition.
","[{""version"":""v1"",""created"":""Tue, 16 Feb 1999 19:03:40 GMT""}]","2009-10-31"
"cond-mat/9902231","Zhengyu Weng","D.N. Sheng and Z.Y. Weng","Universal scaling, beta function, and metal-insulator transitions","4 pages, REVTEX, 4 embedded figures; minor corrections to figures and
  text",,"10.1103/PhysRevLett.83.144",,"cond-mat.dis-nn cond-mat.mes-hall",,"  We demonstrate a universal scaling form of longitudinal resistance in the
quantum critical region of metal-insulator transitions, based on numerical
results of three-dimensional Anderson transitions (with and without magnetic
field), two-dimensional quantum Hall plateau to insulator transition, as well
as experimental data of the recently discovered two-dimensional metal-insulator
transition. The associated reflection symmetry and a peculiar logarithmic form
of the beta function exist over a wide range in which the resistance can change
by more than one order of magnitude. Interesting implications for the
two-dimensional metal-insulator transition are discussed.
","[{""version"":""v1"",""created"":""Tue, 16 Feb 1999 20:59:15 GMT""},{""version"":""v2"",""created"":""Wed, 17 Feb 1999 19:27:04 GMT""}]","2009-10-31"
"cond-mat/9902232","Kulic Miodrag","Miodrag L. Kulic, and Oleg V. Dolgov","Forward Electron-Phonon Scattering and HTS","6 pages, 5 figures","Proc. of HTS99 Conference, Miami, January 1999","10.1063/1.59646",,"cond-mat.supr-con",,"  Tunneling and point contact spectroscopy show clear phonon features and
together with optic measurements give strong support that the electron-phonon
interaction (EPI) is large in HTS oxides. Strong correlations in HTS oxides
renormalize the EPI (and interaction with impurities) so that the forward
scattering peak (FSP) develops for small hole doping \delta<<1. The FSP
mechanism explains important properties of the normal and superconducting
state.
","[{""version"":""v1"",""created"":""Tue, 16 Feb 1999 21:57:21 GMT""}]","2009-10-31"
"cond-mat/9902233","Ralf Bundschuh","Ralf Bundschuh and Michael Lassig","Delocalization transitions of semi-flexible manifolds","4 pages including 2 figures; some corrections of the perturbation
  theory",,,,"cond-mat.soft cond-mat.stat-mech",,"  Semi-flexible manifolds such as fluid membranes or semi-flexible polymers
undergo delocalization transitions if they are subject to attractive
interactions. We study manifolds with short-ranged interactions by
field-theoretic methods based on the operator product expansion of local
interaction fields. We apply this approach to manifolds in a random potential.
Randomness is always relevant for fluid membranes, while for semi-flexible
polymers there is a first order transition to the strong coupling regime at a
finite temperature.
","[{""version"":""v1"",""created"":""Tue, 16 Feb 1999 23:46:34 GMT""},{""version"":""v2"",""created"":""Fri, 19 Mar 1999 19:50:06 GMT""}]","2007-05-23"
"cond-mat/9902234","Jose Manuel Gomez Vilar","J.M.G. Vilar","Comment on ``Mechanisms of synchronization and pattern formation in a
  lattice of pulse-coupled oscillators'' by Diaz-Guilera et al., Phys. Rev. E
  57, 3820 (1998)","4 pages, 3 figures, Revtex",,,,"cond-mat",,"  In a recent paper, Diaz-Guilera et al. [Phys. Rev. E 57, 3820 (1998)] analyze
the mechanisms of synchronization and pattern formation in a lattice of
pulse-coupled oscillators. In essence, their analysis consists in the study of
the stability of the fixed points of several linear return maps which are
obtained from the original system by means of matrix manipulations. We show
that although the model they consider is very specific and actually unable to
account even for a linear phase response curve, their method does not give
correct information on the original system since many of the assumptions
involved are in general not correct. To clarify these aspects, several issues
concerning the real dynamics are also discussed.
","[{""version"":""v1"",""created"":""Wed, 17 Feb 1999 02:25:13 GMT""}]","2007-05-23"
"cond-mat/9902235","Nakano Hiroki","Hiroki Nakano and Masatoshi Imada (ISSP, Univ. Tokyo)","Optical Conductivity of the Two-Dimensional Hubbard Model","4 pages LaTeX including 2 PS figures, to appear in J. Phys. Soc. Jpn",,"10.1143/JPSJ.68.1458",,"cond-mat",,"  Charge dynamics of the two-dimensional Hubbard model is investigated.
Lancz$\ddot{\rm o}$s-diagonalization results for the optical conductivity and
the Drude weight of this model are presented. Near the Mott transition, large
incoherence below the upper-Hubbard band is obtained together with a remarkably
suppressed Drude weight in two dimensions while the clearly coherent character
is shown in one dimension. The two-dimensional results are consistent with
previous results from quantum Monte Carlo calculations indicating that the Mott
transition in this two-dimensional model belongs to the universality class
characterized by the dynamical exponent of $z=4$.
","[{""version"":""v1"",""created"":""Wed, 17 Feb 1999 07:11:31 GMT""}]","2009-10-31"
"cond-mat/9902236","Christian Manwart","A. Lucian and R. Hilfer","Trapping and Mobilization of Residual Fluid During Capillary
  Desaturation in Porous Media","13 pages",,,,"cond-mat.mtrl-sci",,"  We discuss the problem of trapping and mobilization of nonwetting fluids
during immiscible two phase displacement processes in porous media. Capillary
desaturation curves give residual saturations as a function of capillary
number. Interpreting capillary numbers as the ratio of viscous to capillary
forces the breakpoint in experimental curves contradicts the theoretically
predicted force balance. We show that replotting the data against a novel
macroscopic capillary number resolves the problem for discontinuous mode
displacement.
","[{""version"":""v1"",""created"":""Wed, 17 Feb 1999 09:03:36 GMT""}]","2007-05-23"
"cond-mat/9902237","Michel Pleimling","M. Pleimling","Spin-ordering in S = 1 anisotropic Heisenberg models with nondiagonal
  spin exchange","9 pages, 15 figures included, to appear in European Physical Journal
  B","Eur. Phys. J. B 10, 465 (1999)","10.1007/s100510050875",,"cond-mat",,"  The properties of S = 1 anisotropic Heisenberg models with nondiagonal
exchange between axial and planar spin components are investigated using Monte
Carlo techniques. The quantum nature is taken into account in a semi-classical
approximation. The ordering of the spins when applying an external field with
axial and planar components is discussed. It is argued that the quantum nature
of the spins and the nondiagonal exchange may explain the peculiar shape of the
magnetic specific heat of FeBr2 as well as the weakly first-order phase
transition observed in the same compound when a tilted field is applied.
","[{""version"":""v1"",""created"":""Wed, 17 Feb 1999 10:46:02 GMT""}]","2009-10-31"
"cond-mat/9902238",,"Kazuhito Itoh","Exact Ground States in Spin Systems with Orbital Degeneracy","4 pages(JPSJ.sty), 2 figures(EPS), to appear in J. Phys. Soc. Jpn.
  68, No.2 (1999) 322",,"10.1143/JPSJ.68.322",,"cond-mat.str-el cond-mat.stat-mech",,"  We present exact ground states in spin models with orbital generacy in one
and higher dimensions. A method to obtain the exact ground states of the models
when the Hamiltonians are composed of the products of two commutable operators
is proposed. For the case of the spin-1/2 model with two-fold degeneracy some
exact ground states are given, such as the Valence-Bond (VB), the magnetically
ordered, and the orbitally ordered states under particular parameter regimes.
We also find the models with the higher spin and degeneracy which have the new
types of VB ground states in the spin and the orbital sectors.
","[{""version"":""v1"",""created"":""Wed, 17 Feb 1999 14:20:50 GMT""}]","2009-10-31"
"cond-mat/9902239","Miguel Angel Munoz","G. Bianconi, M.A. Munoz, A. Gabrielli, and L. Pietronero","Renormalization group study of one-dimensional systems with roughening
  transitions","Submitted to Phys. Rev. E",,"10.1103/PhysRevE.60.3719",,"cond-mat",,"  A recently introduced real space renormalization group technique, developed
for the analysis of processes in the Kardar-Parisi-Zhang universality class, is
generalized and tested by applying it to a different family of surface growth
processes.
  In particular, we consider a growth model exhibiting a rich phenomenology
even in one dimension. It has four different phases and a directed percolation
related roughening transition. The renormalization method reproduces extremely
well all the phase diagram, the roughness exponents in all the phases and the
separatrix among them. This proves the versatility of the method and elucidates
interesting physical mechanisms.
","[{""version"":""v1"",""created"":""Wed, 17 Feb 1999 12:21:30 GMT""}]","2016-08-31"
"cond-mat/9902240","Bart Partoens","B. Partoens, A. Matulis, and F. M. Peeters","Interplay between tunneling and exchange effects in the two electron
  double quantum dot molecule","paper withdrawn",,,,"cond-mat.str-el",,"  The electronic structure of two vertically coupled quantum dots containing
two electrons is investigated in the presence of interdot tunneling. Our
approach also includes the interdot exchange and we find that the tunneling is
affected by the Coulomb interaction. There is an interplay between direct
tunneling, the interdot exchange and the Coulomb interaction influence on the
tunneling, which can lead to a zero angular momentum spin-singlet -
spin-triplet transition of the ground state, even in the absence of a magnetic
field.
","[{""version"":""v1"",""created"":""Wed, 17 Feb 1999 12:42:17 GMT""},{""version"":""v2"",""created"":""Mon, 24 May 1999 11:07:29 GMT""}]","2007-05-23"
"cond-mat/9902241","Erik Koch","Erik Koch, Olle Gunnarsson, and Richard M. Martin","Screening, Coulomb pseudopotential, and superconductivity in
  alkali-doped Fullerenes","4 pages RevTeX with 2 eps figures, additional material available at
  http://www.mpi-stuttgart.mpg.de/docs/ANDERSEN/fullerene/","Phys.Rev.Lett. 83, 620 (1999)","10.1103/PhysRevLett.83.620",,"cond-mat.str-el cond-mat.mtrl-sci",,"  We study the static screening in a Hubbard-like model using quantum Monte
Carlo. We find that the random phase approximation is surprisingly accurate
almost up to the Mott transition. We argue that in alkali-doped Fullerenes the
Coulomb pseudopotential $\mu^\ast$ is not very much reduced by retardation
effects. Therefore efficient screening is important in reducing $\mu^{\ast}$
sufficiently to allow for an electron-phonon driven superconductivity. In this
way the Fullerides differ from the conventional picture, where retardation
effects play a major role in reducing the electron-electron repulsion.
","[{""version"":""v1"",""created"":""Wed, 17 Feb 1999 12:51:55 GMT""}]","2009-10-31"
"cond-mat/9902242","Philippe Monthoux","P. Monthoux (University of Cambridge)","Non-perturbative approach to nearly antiferromagnetic Fermi liquids","11 pages, 4 figures","Phil Mag. B, Vol 79, No. 1, pp15-23 (1999)","10.1080/13642819908206778",,"cond-mat.str-el",,"  We present a non-perturbative approach to the problem of quasiparticles
coupled to spin-fluctuations. If the fully dressed spin-fluctuation propagator
is used in the Feynman graph expansion of the single-particle Green's function,
the problem of summing all spin-fluctuation exchange graphs (i.e without
virtual fermion loops) can be cast as a functional integral over gaussian
distributed random vector fields. A Monte Carlo sampling of this functional
integral does not suffer from the 'fermion sign problem' and offers an
attractive alternative to perturbative calculations. We compare the results of
our computer simulations with perturbation theory and self-consistent one-loop
calculations.
","[{""version"":""v1"",""created"":""Wed, 17 Feb 1999 14:30:40 GMT""}]","2017-02-08"
"cond-mat/9902243","Jure Demsar","D. Mihailovic and J. Demsar","Time-Resolved Optical Studies of Quasiparticle Dynamics in
  High-Temperature Superconductors: Experiments and theory","15 pages, to be published in ""Spectroscopy of Superconducting
  Materials"", ACS Symposium Series Volume 730, 1999, Ed. E. Faulques",,,,"cond-mat.supr-con",,"  Ultrafast time-resolved optical spectroscopy in high-temperature
superconductors enables the direct real-time measurement of non-equilibrium
quasiparticle recombination dynamics. In addition, it also gives detailed
information about the symmetry of the superconducting gap and the ""pseudogap"",
their doping dependence and their temperature dependence. Experimental data,
together with theoretical models on the photoinduced transmission amplitude and
relaxation time as a function of temperature and doping in YBa2Cu3O7-d gives a
consistent picture of the evolution of low-energy structure, where a
temperature-independent gap is shown to exist in the underdoped state which
evolves with doping into a two-component state near optimum doping, where the
dominant response is from a T-dependent BCS-like superconducting gap.
","[{""version"":""v1"",""created"":""Wed, 17 Feb 1999 15:57:14 GMT""},{""version"":""v2"",""created"":""Fri, 19 Feb 1999 10:16:09 GMT""}]","2007-05-23"
"cond-mat/9902244","Matthew Dodgson","Matthew J. W. Dodgson, Vadim B. Geshkenbein, and Gianni Blatter (ETH
  Zurich)","Defect-Unbinding Transition in Layered Superconductors","4 pages, RevTeX, one postscript figure incorporated using epsf","Phys. Rev. Lett. 83, 5358 (1999)","10.1103/PhysRevLett.83.5358",,"cond-mat.supr-con",,"  We establish a new interstitial-vacancy unbinding transition of the
Berezinskii-Kosterlitz-Thouless type, transforming the three dimensional
pancake vortex lattice of a decoupled layered superconductor into a defected
solid. This transition is the natural finite-field extension of the
vortex-anti-vortex unbinding transition establishing the zero-field superfluid
stiffness. At finite Josephson coupling, the defect unbinding transition turns
into a topological decoupling transition.
","[{""version"":""v1"",""created"":""Wed, 17 Feb 1999 15:58:11 GMT""}]","2009-10-31"
"gr-qc/9902046","Scott M. Hitchcock","Scott Hitchcock","Quantum Clocks and the Origin of Time in Complex Systems","17 pages, LaTeX file, Revised and updated",,,"MSUCL-1123","gr-qc",,"  The origin and nature of time in complex systems is explored using quantum
(or 'Feynman') clocks and the signals produced by them. Networks of these
clocks provide the basis for the evolution of complex systems. The general
concept of 'time' is translated into the 'lifetimes' of these unstable
configurations of matter. 'Temporal phase transitions' mark the emergence of
classical properties such as irreversibility, entropy, and thermodynamic arrows
of time. It is proposed that the creation of the universe can be modeled as a
quantum clock. Keywords: the problem of time, the arrow of time, time
asymmetry, the many-body problem, cellular networks, complexity, the
Wheeler-DeWitt equation, quantum cosmology, and instantons.
","[{""version"":""v1"",""created"":""Tue, 16 Feb 1999 18:05:30 GMT""},{""version"":""v2"",""created"":""Sat, 20 Feb 1999 21:06:51 GMT""}]","2007-05-23"
"gr-qc/9902047","Jeongwon Ho","Jeongwon Ho, Won T. Kim, Young-Jai Park","Spacetime Duality of BTZ Black Hole","9 pages, no figures, 1 reference added, talk given at 5th
  Italian-Korean Symposium on Relativistic Astrophysics, Seoul and Suanbo,
  Korea, 1-7 Sept. 1997","J.KoreanPhys.Soc.33:S541-S544,1998",,"J. Korean Phys. Soc. 33 (1998) S541-S544","gr-qc hep-th",,"  We consider the duality of the quasilocal black hole thermodynamics,
explicitly the quasilocal black hole thermodynamic first law, in BTZ black hole
solution as a special one of the three-dimensional low energy effective string
theory.
","[{""version"":""v1"",""created"":""Wed, 17 Feb 1999 03:13:19 GMT""},{""version"":""v2"",""created"":""Sun, 21 Feb 1999 06:56:30 GMT""}]","2008-11-26"
"gr-qc/9902048","Arne Lykke Larsen","R.N. Hansen, M. Christensen and A.L. Larsen","Cosmic String Loops Collapsing to Black Holes","Conclusion revised. Final version to appear in IJMPA","Int.J.Mod.Phys. A15 (2000) 4433-4446","10.1142/S0217751X00001452",,"gr-qc hep-th",,"  We examine the question of collapse of Turok's two-parameter family of cosmic
strings. We first perform a classification of the strings according to the
specific time(s) at which the minimal string size is reached during one period.
We then obtain an exact analytical expression for the probability of collapse
to black holes for the Turok strings. Our result has the same general behavior
as previously obtained in the literature but we find, in addition, a numerical
prefactor that changes the result by three orders of magnitude. Finally we show
that our careful computation of the prefactor helps to understand the
discrepancy between previously obtained results and, in particular, that for
""large"" values of $G\mu$, there may not even be a discrepancy. We also give a
simple physical argument that can immediately rule out some of the previously
obtained results.
","[{""version"":""v1"",""created"":""Wed, 17 Feb 1999 10:31:57 GMT""},{""version"":""v2"",""created"":""Fri, 5 May 2000 11:50:01 GMT""}]","2016-12-28"
