"cond-mat/9904047","Ulrich Welp","U. Welp, A. Berger, D. J. Miller, V. K. Vlasko-Vlasov, K. E. Gray, J.
  F. Mitchell","Direct Imaging of the First Order Spin Flop Transition in the Layered
  Manganite La1.4Sr1.6Mn2O7","includes 4 figures, submitted to PRL",,"10.1103/PhysRevLett.83.4180",,"cond-mat",,"  Magnetic field induced transitions in the antiferromagnetic layered manganite
La1.4Sr1.6Mn2O7 were studied using magnetization measurements and a
high-resolution magneto-optical imaging technique. We report the first direct
observation of the formation of ferromagnetic domains appearing at the first
order spin-flop transition. The magnetization process proceeds through
nucleation of polarized domains at crystal defect sites and not by domain wall
motion. A small magnetic hysteresis is caused by the nucleation and
annihilation of domains in the mixed state. These results establish a direct
link betweeen the magnetic structure on the atomic scale as seen in neutron
scattering and the macroscopic properties of the sample as seen in
magnetization and conductivity measurements.
","[{""version"":""v1"",""created"":""Fri, 2 Apr 1999 18:04:32 GMT""}]","2009-10-31"
"cond-mat/9904048","Mike Norman","M. R. Norman","Fermi Surfaces, Fermi Patches, and Fermi Arcs in High Tc Superconductors","6 pages, AIP Proceedings of the Univ. of Miami HTS99 conference","CP483, High Temperature Superconductivity, ed. S. E. Barnes et al
  (AIP, New York, 1999), p. 298","10.1063/1.59631",,"cond-mat.supr-con cond-mat.str-el",,"  A defining property of metals is the existence of a Fermi surface: for two
dimensions, a continuous contour in momentum space which separates occupied
from unoccupied states. In this paper, I discuss angle resolved photoemission
data on the cuprate superconductor BSCCO and argue that it is not best thought
of in this conventional picture. Rather, the data are consistent with
``patches'' of finite area connected by more conventional ``arcs''. Novel
physics is associated with the patches, in that the states contained in a patch
are dispersionless and thus interaction dominated. In the pseudogap phase, the
patches are gapped out, leaving the Fermi arcs disconnected. This unusual
situation may be the key to understanding the microscopic physics of the high
temperature superconductors, in that the pairing correlations are strongest in
the patches, yet the superfluid density lives only on the arcs.
","[{""version"":""v1"",""created"":""Fri, 2 Apr 1999 19:20:13 GMT""},{""version"":""v2"",""created"":""Sat, 3 Apr 1999 16:50:36 GMT""}]","2009-10-31"
"cond-mat/9904049","Xiao Gang Wen","Xiao-Gang Wen","withdrawn","withdrawn",,,,"cond-mat.str-el",,"  This paper has been withdrawn by the author.
","[{""version"":""v1"",""created"":""Fri, 2 Apr 1999 21:01:42 GMT""},{""version"":""v2"",""created"":""Fri, 9 Apr 1999 17:59:33 GMT""}]","2007-05-23"
"cond-mat/9904050","Leo Radzihovsky","Y. D. Chuang, A. D. Gromko, D. S. Dessau (University of Colorado) Y.
  Aiura, Y. Yamaguchi, K. Oka (Electrotechnical Laboratory (ETL)), A. J. Arko,
  J. Joyce (Los Alamos National Laboratory), H. Eisaki, S.I. Uchida (University
  of Tokyo), K. Nakamura, Yoichi Ando (Central Research Institute of Electric
  Power Industry)","A re-examination of the electronic structure of Bi_2Sr_2CaCu_2O_{8+d}
  and Bi_2Sr_2Cu_1O_{6+d} - An electron-like Fermi Surface and the absence of
  flat bands at $E_F$","4 RevTeX pgs, 4 eps figures, submitted to Phys. Rev. Lett",,,"University of Colorado preprint","cond-mat.str-el cond-mat.supr-con",,"  We present a re-examination of the electronic structure and Fermi Surface
(FS) of Bi-Sr-Ca-Cu-O (BSCCO) as obtained from angle-resolved photoemission
experiments. By applying a stricter set of FS crossing criteria as well as by
varying the incident photon energy outside the usual range, we have found very
different behavior from that previously observed. In particular we have found
an electron-like FS centered around the Gamma point, and the flat bands at E_F
near the M point of the zone are absent. These results are robust over a large
range of dopings and from single to double layer samples.
","[{""version"":""v1"",""created"":""Sat, 3 Apr 1999 01:03:00 GMT""}]","2007-05-23"
"cond-mat/9904051","J. G. E. Harris","J. G. E. Harris, J. E. Grimaldi, D. D. Awschalom, A. Chiolero, D. Loss","Excess Spin and the Dynamics of Antiferromagnetic Ferritin","4 pages, 3 Postsript figures, 1 table. Submitted to PRB",,"10.1103/PhysRevB.60.3453",,"cond-mat.mes-hall cond-mat.str-el",,"  Temperature-dependent magnetization measurements on a series of synthetic
ferritin proteins containing from 100 to 3000 Fe(III) ions are used to
determine the uncompensated moment of these antiferromagnetic particles. The
results are compared with recent theories of macroscopic quantum coherence
which explicitly include the effect of this excess moment. The scaling of the
excess moment with protein size is consistent with a simple model of finite
size effects and sublattice noncompensation.
","[{""version"":""v1"",""created"":""Sat, 3 Apr 1999 05:48:55 GMT""}]","2009-10-31"
"cond-mat/9904052","Yasushi Ishikawa","Y. Ishikawa and H. Fukuyama","Orbital Magnetism and Current Distribution of Two-Dimensional Electrons
  under Confining Potential","15 pages, 11 figures",,"10.1143/JPSJ.68.2405",,"cond-mat.mes-hall",,"  The spatial distribution of electric current under magnetic field and the
resultant orbital magnetism have been studied for two-dimensional electrons
under a harmonic confining potential $V(\vecvar{r})=m \omega_0^2 r^2/2$ in
various regimes of temperature and magnetic field, and the microscopic
conditions for the validity of Landau diamagnetism are clarified. Under a weak
magnetic field $(\omega_c\lsim\omega_0, \omega_c$ being a cyclotron frequency)
and at low temperature $(T\lsim\hbar\omega_0)$, where the orbital magnetic
moment fluctuates as a function of the field, the currents are irregularly
distributed paramagnetically or diamagnetically inside the bulk region. As the
temperature is raised under such a weak field, however, the currents in the
bulk region are immediately reduced and finally there only remains the
diamagnetic current flowing along the edge. At the same time, the usual Landau
diamagnetism results for the total magnetic moment. The origin of this dramatic
temperature dependence is seen to be in the multiple reflection of electron
waves by the boundary confining potential, which becomes important once the
coherence length of electrons gets longer than the system length. Under a
stronger field $(\omega_c\gsim\omega_0)$, on the other hand, the currents in
the bulk region cause de Haas-van Alphen effect at low temperature as
$T\lsim\hbar\omega_c$. As the temperature gets higher $(T\gsim\hbar\omega_c)$
under such a strong field, the bulk currents are reduced and the Landau
diamagnetism by the edge current is recovered.
","[{""version"":""v1"",""created"":""Sat, 3 Apr 1999 08:03:52 GMT""}]","2009-10-31"
"cond-mat/9904053","Ivan Yurievich Smirnov","I.L.Drichko, A.M.Diakonov, V.D.Kagan, I.Yu.Smirnov, A.I.Toropov","High-Frequency Hopping conductivity of Disordered 2D-system in the IQHE
  Regime","RevTeX 2 pages, 3 eps-figures; some corrections in cites",,,,"cond-mat.mes-hall",,"  High frequency (hf) conductivity in the form $\sigma^{hf} = \sigma_1^{hf} -
i\sigma_2^{hf}$ was obtained from the measurement of Surface Acoustic Waves
(SAW) attenuation and velocity (f=30 MHz) in GaAs/AlGaAs heterostructures
($n=1.3-7\cdot 10^{11}cm^{-2}$). It has been shown that in the Integer Quantum
Hall Effect (IQHE) regime for all the samples at magnetic fields corresponding
to the middle of the Hall plateaus and T=1.5 K, $\sigma_1 / \sigma_2 =0.14 \pm
0.03$. The ratio $\sigma_1 / \sigma_2=0.15$ points the case when the
high-frequency hopping conductivity mechanism (electronic transition between
the localized states formed by ""tight"" pairs) is valid \cite{1}. Dependencies
of $\sigma_1$ and $\sigma_2$ on temperature and magnetic field is analyzed
width of the Landau band broadened by the impurity random potential is
determined.
","[{""version"":""v1"",""created"":""Sat, 3 Apr 1999 13:48:03 GMT""},{""version"":""v2"",""created"":""Tue, 6 Apr 1999 16:15:44 GMT""}]","2007-05-23"
"hep-lat/9904002","Yannick Meurice","Y. Meurice and S. Niermann","Non-Universal Quantities from Dual RG Transformations","4 pages, 1 figure, uses revtex","Phys.Rev. E60 (1999) 2612-2615","10.1103/PhysRevE.60.2612","U.of Iowa 98-2504","hep-lat chao-dyn cond-mat.stat-mech hep-th math-ph math.MP nlin.CD",,"  Using a simplified version of the RG transformation of Dyson's hierarchical
model, we show that one can calculate all the non-universal quantities entering
into the scaling laws by combining an expansion about the high-temperature
fixed point with a dual expansion about the critical point. The magnetic
susceptibility is expressed in terms of two dual quantities transforming
covariantly under the RG transformation and has a smooth limit in the
high-temperature limit. Using the analogy with hamiltonian systems, the
simplified example discussed here is similar to the anharmonic oscillator,
while more realistic examples can be tought of as coupled oscillators allowing
resonance phenomena.
","[{""version"":""v1"",""created"":""Sat, 3 Apr 1999 14:08:51 GMT""}]","2009-10-31"
"hep-ph/9904218","Ronald Bryan","Ronald Bryan","Are the Dirac particles of the Standard Model dynamically confined
  states in a higher-dimensional flat space?","22 pages, 2 figures, sequel to Nuclear Pnysics B 523 (1998) 232-242","Can.J.Phys. 77 (1999) 197-210","10.1139/cjp-77-3-197","CTP-TAMU-53/98","hep-ph",,"  Some time ago Rubakov and Shaposhnikov (RS) suggested that elementary
particles might be excitations trapped on a soliton in a flat higher
dimensional space. They gave as an example phi-4 theory in five dimensions with
a bosonic excitation on a domain wall in the fifth dimension. They also trapped
a chiral Dirac particle on the domain wall. We extend the RS field equation for
the Dirac particle to eight flat dimensions (M4 X R4) and replace the
one-dimensional domain-wall potential with a harmonic- oscillator ""potential""
in the four higher dimensions. This generates bound states in approximate SU(4)
X SU(2) representations. These representations have corresponding ""orbital""
times ""spin"" quantum numbers and bear some resemblance to the quarks and
leptons of the Standard Model. Soliton-theory suggests that the
harmonic-oscillator potential should rise only a finite amount. This will then
limit the number of generations in a natural way. It will also mean that
particles with sufficient energy might escape the well altogether and propagate
freely in the higher dimensions. It may be worth- while to search for a soliton
(instanton?) which can confine Dirac particles in the manner of the
harmonic-oscillator potential.
","[{""version"":""v1"",""created"":""Fri, 2 Apr 1999 16:04:54 GMT""}]","2009-10-31"
"hep-ph/9904219","D. Delepine","W. Buchmuller, D. Delepine, F. Vissani","Neutrino Mixing and the Pattern of Supersymmetry Breaking","12 pages, 2 figures, used axodraw.sty, to be published in Physics
  Letters B","Phys.Lett.B459:171-178,1999","10.1016/S0370-2693(99)00634-6","DESY 99-021","hep-ph",,"  We study the implications of a large $\nu_\mu - \nu_\tau$ mixing angle on
lepton flavour violating radiative transitions in supersymmetric extensions of
the standard model. The transition rates are calculated to leading order in
$\epsilon$, the parameter which characterizes the flavour mixing. The
uncertainty of the predicted rates is discussed in detail. For models with
modular invariance the branching ratio $BR(\mu \to e \gamma)$ mostly exceeds
the experimental upper limit. In models with radiatively induced flavour mixing
the predicted range includes the upper limit, if the Yukawa couplings in the
lepton sector are large, as favoured by Yukawa coupling unification.
","[{""version"":""v1"",""created"":""Fri, 2 Apr 1999 17:19:47 GMT""},{""version"":""v2"",""created"":""Thu, 27 May 1999 10:23:58 GMT""}]","2014-11-17"
"hep-ph/9904220","Wayne W. Repko","C. Balazs, D.A. Dicus, H.-J. He, W.W. Repko, and C.-P. Yuan","Collider Tests of Compact Space Dimensions Using Weak Gauge Bosons","4 pages, 1 postscript figure included","Phys.Rev.Lett. 83 (1999) 2112-2115","10.1103/PhysRevLett.83.2112",,"hep-ph",,"  We present collider tests of the recent proposal for weak-scale quantum
gravity due to new large compact space dimensions in which only the graviton
($\G$) propagates. We show that the existing high precision LEP-I $Z$-pole data
can impose non-trivial constraints on the scale of the new dimensions, via the
decay mode $Z\to f\bar{f}+\G$ ($f=q,\ell$). These bounds are comparable to
those obtained at high energy colliders and provide the first sensitive probe
of the scalar graviton. We also study $W(Z)+\G$ production and the anomalous
$WW(ZZ)$ signal from virtual $\G$-states at the Fermilab Tevatron, and compare
them with the LEP-I bound and those from LEP-II and future linear colliders.
","[{""version"":""v1"",""created"":""Fri, 2 Apr 1999 21:15:36 GMT""},{""version"":""v2"",""created"":""Sat, 3 Apr 1999 20:52:42 GMT""}]","2009-10-31"
"hep-ph/9904221","Gregory Gabadadze","Gia Dvali, Gregory Gabadadze","Non-conservation of Global Charges in the Brane Universe and
  Baryogenesis","19 pages, some discussions and references added","Phys.Lett. B460 (1999) 47-57","10.1016/S0370-2693(99)00766-2","NYU-TH/99/3/02","hep-ph hep-th",,"  We argue that global charges, such as baryon or lepton number, are not
conserved in theories with the Standard Model fields localized on the brane
which propagates in higher-dimensional space-time. The global-charge
non-conservation is due to quantum fluctuations of the brane surface. These
fluctuations create ""baby branes"" that can capture some global charges and
carry them away into the bulk of higher-dimensional space. Such processes are
exponentially suppressed at low-energies, but can be significant at high enough
temperatures or energies. These effects can lead to a new, intrinsically
high-dimensional mechanism of baryogenesis. Baryon asymmetry might be produced
due either to ""evaporation"" into the baby branes, or creation of the baryon
number excess in collisions of two Brane Universes. As an example we discuss a
possible cosmological scenario within the recently proposed ""Brane Inflation""
framework. Inflation is driven by displaced branes which slowly fall on top of
each other. When the branes collide inflation stops and the Brane Universe
reheats. During this non-equilibrium collision baryon number can be transported
from one brane to another one. This results in the baryon number excess in our
Universe which exactly equals to the hidden ""baryon number"" deficit in the
other Brane Universe.
","[{""version"":""v1"",""created"":""Fri, 2 Apr 1999 21:34:37 GMT""},{""version"":""v2"",""created"":""Sat, 3 Apr 1999 22:32:48 GMT""},{""version"":""v3"",""created"":""Tue, 6 Apr 1999 21:25:57 GMT""}]","2016-09-06"
"hep-ph/9904222","Misak Sargsian","Leonid L. Frankfurt (Tel Aviv U.), Gerald A. Miller (UW, Seattle)
  Misak M. Sargsian (FIU, Miami) and Mark I. Strikman (Penn. State U.)","QCD Rescattering and High Energy Two-Body Photodisintegration of the
  Deuteron","4 pages, revised version to be published in Phys. Rev. Lett","Phys.Rev.Lett. 84 (2000) 3045-3048","10.1103/PhysRevLett.84.3045","NT@UW-99-10","hep-ph nucl-th",,"  Photon absorption by a quark in one nucleon followed by its high momentum
transfer interaction with a quark in the other may produce two final-state
nucleons with high relative momentum. We sum the relevant quark rescattering
diagrams, to show that the scattering amplitude depends on a convolution
between the large angle $pn$ scattering amplitude, the hard photon-quark
interaction vertex and the low-momentum deuteron wave function. The computed
absolute values of the cross section are in reasonable agreement with the data.
","[{""version"":""v1"",""created"":""Sat, 3 Apr 1999 06:56:52 GMT""},{""version"":""v2"",""created"":""Wed, 26 Jan 2000 02:04:03 GMT""}]","2009-10-31"
"hep-th/9904014","Christian Brouder","Christian Brouder","Runge-Kutta methods and renormalization","LaTeX file with FeynMF package. 21 pages, no figure","Eur.Phys.J.C12:521-534,2000","10.1007/s100529900235",,"hep-th",,"  A connection between the algebra of rooted trees used in renormalization
theory and Runge-Kutta methods is pointed out. Butcher's group and B-series are
shown to provide a suitable framework for renormalizing a toy model of field
the ory, following Kreimer's approach. Finally B-series are used to solve a
class of non-linear partial differential equations.
","[{""version"":""v1"",""created"":""Fri, 2 Apr 1999 16:06:38 GMT""}]","2011-09-13"
"hep-th/9904015",,"M. Ram'on Medrano and N. S'anchez","QFT, String Temperature and the String Phase of De Sitter Space-time","LaTex, 24 pages, no figures","Phys.Rev. D60 (1999) 125014","10.1103/PhysRevD.60.125014",,"hep-th astro-ph gr-qc hep-ph",,"  The density of mass levels \rho(m) and the critical temperature for strings
in de Sitter space-time are found. QFT and string theory in de Sitter space are
compared. A `Dual'-transform is introduced which relates classical to quantum
string lengths, and more generally, QFT and string domains. Interestingly, the
string temperature in De Sitter space turns out to be the Dual transform of the
QFT-Hawking-Gibbons temperature. The back reaction problem for strings in de
Sitter space is addressed selfconsistently in the framework of the `string
analogue' model (or thermodynamical approach), which is well suited to combine
QFT and string study.We find de Sitter space-time is a self-consistent solution
of the semiclassical Einstein equations in this framework. Two branches for the
scalar curvature R(\pm) show up: a classical, low curvature solution (-), and a
quantum high curvature solution (+), enterely sustained by the strings. There
is a maximal value for the curvature R_{\max} due to the string back reaction.
Interestingly, our Dual relation manifests itself in the back reaction
solutions: the (-) branch is a classical phase for the geometry with intrinsic
temperature given by the QFT-Hawking-Gibbons temperature.The (+) is a stringy
phase for the geometry with temperature given by the intrinsic string de Sitter
temperature. 2 + 1 dimensions are considered, but conclusions hold generically
in D dimensions.
","[{""version"":""v1"",""created"":""Fri, 2 Apr 1999 17:07:43 GMT""}]","2009-10-31"
"hep-th/9904016","Yi Ling","Yi Ling and Lee Smolin","Supersymmetric Spin Networks and Quantum Supergravity","21 pages, LaTex, 22 figures, typos corrected and references completed","Phys.Rev. D61 (2000) 044008","10.1103/PhysRevD.61.044008",,"hep-th gr-qc",,"  We define supersymmetric spin networks, which provide a complete set of gauge
invariant states for supergravity and supersymmetric gauge theories. The
particular case of Osp(1/2) is studied in detail and applied to the
non-perturbative quantization of supergravity. The supersymmetric extension of
the area operator is defined and partly diagonalized. The spectrum is discrete
as in quantum general relativity, and the two cases could be distinguished by
measurements of quantum geometry.
","[{""version"":""v1"",""created"":""Fri, 2 Apr 1999 20:48:06 GMT""},{""version"":""v2"",""created"":""Fri, 16 Apr 1999 18:05:16 GMT""},{""version"":""v3"",""created"":""Mon, 16 Aug 1999 20:12:29 GMT""}]","2009-10-31"
"hep-th/9904017","Steven Gubser","D.Z. Freedman, S.S. Gubser, K. Pilch, and N.P. Warner","Renormalization Group Flows from Holography--Supersymmetry and a
  c-Theorem","56 pages, three figures, harvmac. v2: improved referencing, corrected
  discussion of energy conditions. v3: one more reference fixed","Adv.Theor.Math.Phys.3:363-417,1999",,"CERN-TH/99-86, HUTP-99/A015, USC-99/1, MIT-CTP-2846","hep-th",,"  We obtain first order equations that determine a supersymmetric kink solution
in five-dimensional N=8 gauged supergravity. The kink interpolates between an
exterior anti-de Sitter region with maximal supersymmetry and an interior
anti-de Sitter region with one quarter of the maximal supersymmetry. One eighth
of supersymmetry is preserved by the kink as a whole. We interpret it as
describing the renormalization group flow in N=4 super-Yang-Mills theory broken
to an N=1 theory by the addition of a mass term for one of the three adjoint
chiral superfields. A detailed correspondence is obtained between fields of
bulk supergravity in the interior anti-de Sitter region and composite operators
of the infrared field theory. We also point out that the truncation used to
find the reduced symmetry critical point can be extended to obtain a new N=4
gauged supergravity theory holographically dual to a sector of N=2 gauge
theories based on quiver diagrams.
  We consider more general kink geometries and construct a c-function that is
positive and monotonic if a weak energy condition holds in the bulk gravity
theory. For even-dimensional boundaries, the c-function coincides with the
trace anomaly coefficients of the holographically related field theory in
limits where conformal invariance is recovered.
","[{""version"":""v1"",""created"":""Sat, 3 Apr 1999 00:44:58 GMT""},{""version"":""v2"",""created"":""Mon, 19 Apr 1999 22:22:35 GMT""},{""version"":""v3"",""created"":""Fri, 7 May 1999 15:01:38 GMT""}]","2009-10-08"
"hep-th/9904018","Hiroshi Itoyama","H. Itoyama and A. Tsuchiya","USp(2k) Matrix Model","32 pages, Latex with PTPTex.sty, 16 epsf figures","Prog.Theor.Phys.Suppl.134:18-46,1999","10.1143/PTPS.134.18","OU-HET-315","hep-th",,"  We review the construction and theoretical implications of the USp(2k) matrix
model in zero dimension introduced in ref. \cite{IT1,IT2}. It is argued that
the model provides a constructive approach to Type I superstrings and is at the
same time dynamical theory of spacetime points. Three subjects are discussed :
semiclassical pictures and series of degenerate perturbative vacua associated
with the worldvolume representation of the model, the formation of extended
(D-)objects from the fermionic integrations via the (non-)abelian Berry phase,
and the Schwinger-Dyson/loop equations which exhibit the joining-splitting
interactions required. Lectures presented at the 13th Nishinomiya-Yukawa
Memorial Symposium ``Dynamics of Fields and Strings'' (November 12-13,1998) and
at the YITP workshop (November 16-18, 1998).
","[{""version"":""v1"",""created"":""Sat, 3 Apr 1999 07:48:35 GMT""}]","2008-11-26"
"hep-th/9904019","Ichiro Oda","Tadahiko Kimura and Ichiro Oda","Duality of Super D-brane Actions in General Type IIB Supergravity
  Background","32 pages, LaTex 2e","Int.J.Mod.Phys. A16 (2001) 503-528","10.1142/S0217751X0100324X","CHIBA-EP-113, EDO-EP-26","hep-th",,"  We examine duality transformations of supersymmetric and $\kappa$-symmetric
Dp-brane actions in a general type II supergravity background where in
particular the dilaton and the axion are supposed to not be zero or a constant
but a general superfield. Due to non-constant dilaton and axion, we can
explicitly show that the dilaton and the axion as well as the two 2-form gauge
potentials transform as doublets under the $SL(2,R)$ transformation from the
point of view of the world-volume field theory.
","[{""version"":""v1"",""created"":""Sat, 3 Apr 1999 08:58:43 GMT""}]","2015-06-26"
"math/9904010","Alexei Borodin","Alexei Borodin and Grigori Olshanski","Distributions on partitions, point processes, and the hypergeometric
  kernel","AMSTeX, 24 pages","Commun. Math. Phys. 211 (2000), no. 2, 335-358.","10.1007/s002200050815",,"math.RT math.PR",,"  We study a 3-parametric family of stochastic point processes on the
one-dimensional lattice originated from a remarkable family of representations
of the infinite symmetric group. We prove that the correlation functions of the
processes are given by determinantal formulas with a certain kernel. The kernel
can be expressed through the Gauss hypergeometric function; we call it the
hypergeometric kernel.
  In a scaling limit our processes approximate the processes describing the
decomposition of representations mentioned above into irreducibles. As we
showed before, see math.RT/9810015, the correlation functions of these limit
processes also have determinantal form with so-called Whittaker kernel. We show
that the scaling limit of the hypergeometric kernel is the Whittaker kernel.
  The integral operator corresponding to the Whittaker kernel is an integrable
operator as defined by Its, Izergin, Korepin, and Slavnov. We argue that the
hypergeometric kernel can be considered as a kernel defining a `discrete
integrable operator'.
  We also show that the hypergeometric kernel degenerates for certain values of
parameters to the Christoffel-Darboux kernel for Meixner orthogonal
polynomials. This fact is parallel to the degeneration of the Whittaker kernel
to the Christoffel-Darboux kernel for Laguerre polynomials.
","[{""version"":""v1"",""created"":""Fri, 2 Apr 1999 17:38:41 GMT""}]","2009-10-31"
