"math/9904011","Douglas B. West","Tao Jiang (Univ. Illinois), Dhruv Mubayi (Georgia Inst. Technology),
  Aditya Shastri (Banasthali Univ.), and Douglas B. West (Univ. Illinois)","Edge-bandwidth of graphs","12 pages",,,,"math.CO",,"  The edge-bandwidth of a graph is the minimum, over all labelings of the edges
with distinct integers, of the maximum difference between labels of two
incident edges. We prove that edge-bandwidth is at least as large as bandwidth
for every graph, with equality for certain caterpillars. We obtain sharp or
nearly-sharp bounds on the change in edge-bandwidth under addition,
subdivision, or contraction of edges. We compute edge-bandwidth for cliques,
bicliques, caterpillars, and some theta graphs.
","[{""version"":""v1"",""created"":""Sat, 3 Apr 1999 03:55:51 GMT""}]","2007-05-23"
"math/9904012","Wei-Dong Ruan","Wei-Dong Ruan","Lagrangian torus fibration of quintic Calabi-Yau hypersurfaces I: Fermat
  quintic case","43 pages, 8 figures. Updated version. Appeared in ""Winter School on
  Mirror Symmetry, Vector Bundles and Lagrangian Submanifolds"", edited by S.-T.
  Yau and C. Vafa, AMS and International Press",,,,"math.DG math.AG math.SG",,"  In this paper we give a construction of Lagrangian torus fibration for Fermat
type quintic \cy hypersurfaces via the method of gradient flow. We also compute
the monodromy of the expected special Lagrangian torus fibration and discuss
structures of singular fibers.
","[{""version"":""v1"",""created"":""Sat, 3 Apr 1999 09:23:28 GMT""},{""version"":""v2"",""created"":""Thu, 11 Nov 2004 17:04:43 GMT""}]","2007-05-23"
"math/9904014","Dmitri Panyushev","D. I. Panyushev","Nilpotent pairs, dual pairs, and sheets","27 pages, LaTeX 2.09","Journal of Algebra, 240 (2001), 635-664","10.1006/jabr.2000.8711",,"math.AG math.RT",,"  Recently, V.Ginzburg introduced the notion of a principal nilpotent pair (=
pn-pair) in a semisimple Lie algebra {\frak g}. It is a double counterpart of
the notion of a regular nilpotent element. A pair (e_1,e_2) of commuting
nilpotent elements is called a pn-pair, if the dimension of their simultaneous
centralizer is equal to the rank of {\frak g} and some bi-homogeneity condition
is satisfied. Ginzburg proved that many familiar results of the `ordinary'
theory have analogues for pn-pairs. The aim of this article is to develop the
theory of nilpotent pairs a bit further and to present some applications of it
to dual pairs and sheets. It is shown that a large portion of Ginzburg's theory
can be extended to the pairs whose simultaneous centraliser is of dimension
rk{\frak g}+1. Such pairs are called almost pn-pairs. It is worth noting that
the very existence of almost pn-pairs is a purely ""double"" phenomenon, because
the dimension of ""ordinary"" orbits is always even. We prove that to any
principal or almost nilpotent pair one naturally associates a dual pair.
Moreover, this dual pair is reductive if and only if e_1 and e_2 can be
included in commuting sl_2-triples. We also study sheets containing members of
pn-pairs. Some cases are described, where these sheets are smooth and admit a
section.
","[{""version"":""v1"",""created"":""Sat, 3 Apr 1999 13:17:56 GMT""}]","2013-01-10"
"math/9904015","Chen Meng","Meng Chen","On pluricanonical maps for threefolds of general type, II","16 pages, Amstex, The final version, Accepted for publication in
  Osaka Journal of Mathematics","Osaka J. Math. 38(2001), no.2, 451-468",,,"math.AG",,"  This note mainly studies the generic finiteness of \phi_m of a complex
projective 3-fold of general type. A new result on the classification to
bicanonical pencil for Gorenstein 3-folds is attached in the last section.
","[{""version"":""v1"",""created"":""Sat, 3 Apr 1999 13:50:16 GMT""},{""version"":""v2"",""created"":""Fri, 21 May 1999 12:40:29 GMT""},{""version"":""v3"",""created"":""Thu, 18 May 2000 20:30:23 GMT""}]","2007-05-23"
"math/9904016","Veit Elser","Veit Elser","Crystallography and Riemann Surfaces","AMS-LaTeX, 43 pages, 3 eps figures",,,,"math.DG math.CV",,"  The level set of an elliptic function is a doubly periodic point set in C. To
obtain a wider spectrum of point sets, we consider, more generally, a Riemann
surface S immersed in C^2 and its sections (``cuts'') by C. We give S a
crystallographic isometry in C^2 by defining a fundamental surface element as a
conformal map of triangular domains and S as its extension by reflections in
the triangle edges. Our main result concerns the special case of maps of right
triangles, with the right angle being a regular point of the map. For this
class of maps we show that only seven Riemann surfaces, when cut, form point
sets that are discrete in C. Their isometry groups all have a rank-four lattice
subgroup, but only three of the corresponding point sets are doubly periodic in
C. The remaining surfaces form quasiperiodic point sets closely related to the
vertex sets of quasiperiodic tilings. In fact, vertex sets of familiar tilings
are recovered in all cases by applying the construction to a piecewise flat
approximation of the corresponding Riemann surface. The geometry of point sets
formed by cuts of Riemann surfaces is no less ``rigid'' than the geometry
determined by a tiling, and has the distinct advantage in having a regular
behavior with respect to the complex parameter which specifies the cut.
","[{""version"":""v1"",""created"":""Sat, 3 Apr 1999 15:39:12 GMT""}]","2007-05-23"
"nucl-ex/9904003","Raimond Snellings","R.J.M. Snellings, A. M. Poskanzer and S. A. Voloshin","Anisotropic Flow at STAR","12 pages",,,"STAR Note 388","nucl-ex nucl-th",,"  We first review previous work on anisotropic flow at the AGS and SPS. Then
the physics related to flow is discussed as well as the interaction of flow
with other non-flow measurements. From 40k RQMD and 100k HIJING events
predictions for anisotropic flow at RHIC are presented. Using the STAR detector
acceptance, estimates for the resolution obtainable with STAR are shown. We
conclude that it should be possible to obtain good measurements for elliptic
flow with either the STAR main TPC or forward TPCs. Anisotropic flow should be
easily one of the first results from STAR.
","[{""version"":""v1"",""created"":""Fri, 2 Apr 1999 20:25:45 GMT""}]","2007-05-23"
"nucl-th/9904007","Su Houng Lee","Su Houng Lee (Yonsei Univ.)","Vector mesons in dense matter","8 pages, invited talk given at the KEK-Tanashi symposium on Physics
  of Hadrons and Nuclei, December 14-17 1998, Tokyo, Japan","Nucl.Phys. A670 (2000) 119-126","10.1016/S0375-9474(00)00081-6",,"nucl-th",,"  We will summarize the progress in understanding the changes in the vector
meson spectral density in nuclear medium using the constraint equations
obtained from the Borel transformed dispersion relation and QCD Operator
Product Expansion. We will discuss the results for the scalar mass shift and
dispersion effects (three momentum dependence) for the light quark system
($\rho, \omega$), the strange quark system ($\phi$) and the heavy quark system
($J/\psi$) in nuclear medium. For the light quark systems, a nontrivial change
in the mass and width are expected, while the dispersion effects are found to
be small. Existing model calculations for the dispersion effects are compared
to the constraint equation in detail. Very small, but accurate mass shift is
obtained for the heavy quark system.
","[{""version"":""v1"",""created"":""Sat, 3 Apr 1999 05:58:17 GMT""}]","2009-10-31"
"quant-ph/9904011","Zanardi Paolo","Paolo Zanardi (1) (2), Mario Rasetti (2) (3) ((1)Unit\`a INFM,
  Politecnico di Torino, (2) ISI Foundation, Torino (3) Dipartimento di Fisica
  Politecnico di Torino)","Holonomic Quantum Computation","Presentation improved, accepted by Phys. Lett. A, 5 pages LaTeX, no
  figures","Phys.Lett. A264 (1999) 94-99","10.1016/S0375-9601(99)00803-8",,"quant-ph hep-th",,"  We show that the notion of generalized Berry phase i.e., non-abelian
holonomy, can be used for enabling quantum computation. The computational space
is realized by a $n$-fold degenerate eigenspace of a family of Hamiltonians
parametrized by a manifold $\cal M$. The point of $\cal M$ represents classical
configuration of control fields and, for multi-partite systems, couplings
between subsystem. Adiabatic loops in the control $\cal M$ induce non trivial
unitary transformations on the computational space. For a generic system it is
shown that this mechanism allows for universal quantum computation by composing
a generic pair of loops in $\cal M.$
","[{""version"":""v1"",""created"":""Fri, 2 Apr 1999 17:24:45 GMT""},{""version"":""v2"",""created"":""Sat, 3 Apr 1999 13:29:19 GMT""},{""version"":""v3"",""created"":""Mon, 15 Nov 1999 18:27:52 GMT""}]","2009-10-31"
