"cond-mat/9903102","Chen Xiaosong","X.S. Chen, V. Dohm","Cutoff and lattice effects in the $\varphy^4$ theory of confined systems","LaTex, 10 pages, Eur. Phys. J. B 7, 183 (1999)","Eur.Phys.J.B7:183,1999","10.1007/s100510050603",,"cond-mat.stat-mech",,"  We study cutoff and lattice effects in the O(n) symmetric $\phi^4$ theory for
a $d$-dimensional cubic geometry of size $L$ with periodic boundary conditions.
In the large-N limit above $T_c$, we show that $\phi^4$ field theory at finite
cutoff $\Lambda$ predicts the nonuniversal deviation $\sim (\Lambda L)^{-2}$
from asymptotic bulk critical behavior that violates finite-size scaling and
disagrees with the deviation $\sim e^{-cL}$ that we find in the $\phi^4$
lattice model. The exponential size dependence requires a non-perturbative
treatment of the $\phi^4$ model. Our arguments indicate that these results
should be valid for general $n$ and $d > 2$.
","[{""version"":""v1"",""created"":""Fri, 5 Mar 1999 18:09:45 GMT""}]","2011-10-11"
"cond-mat/9903103","Chen Xiaosong","X.S. Chen, V. Dohm","Violation of Finite-Size Scaling in Three Dimensions","LaTex, 51 pages",,"10.1007/s100510050901",,"cond-mat.stat-mech",,"  We reexamine the range of validity of finite-size scaling in the $\phi^4$
lattice model and the $\phi^4$ field theory below four dimensions. We show that
general renormalization-group arguments based on the renormalizability of the
$\phi^4$ theory do not rule out the possibility of a violation of finite-size
scaling due to a finite lattice constant and a finite cutoff. For a confined
geometry of linear size $L$ with periodic boundary conditions we analyze the
approach towards bulk critical behavior as $L \to \infty$ at fixed $\xi$ for $T
> T_c$ where $\xi$ is the bulk correlation length. We show that for this
analysis ordinary renormalized perturbation theory is sufficient. On the basis
of one-loop results and of exact results in the spherical limit we find that
finite-size scaling is violated for both the $\phi^4$ lattice model and the
$\phi^4$ field theory in the region $L \gg \xi$. The non-scaling effects in the
field theory and in the lattice model differ significantly from each other.
","[{""version"":""v1"",""created"":""Fri, 5 Mar 1999 18:20:23 GMT""}]","2009-10-31"
"cond-mat/9903104","Theo Costi","T. A. Costi and G. Zarand","Thermodynamics of the dissipative two-state system: a Bethe Ansatz study","24 pages, 32 PS figures. Typos corrected, final version","Phys. Rev. B59, 12398-418 (1999)","10.1103/PhysRevB.59.12398","EKM-TP3/03-99","cond-mat.str-el cond-mat.mes-hall",,"  The thermodynamics of the dissipative two-state system is calculated exactly
for all temperatures and level asymmetries for the case of Ohmic dissipation.
We exploit the equivalence of the two-state system to the anisotropic Kondo
model and extract the thermodynamics of the former by solving the thermodynamic
Bethe Ansatz equations of the latter. The universal scaling functions for the
specific heat $C_{\alpha}(T)$ and static dielectric susceptibility
$\chi_{\alpha}(T)$ are extracted for all dissipation strengths $0<\alpha<1$ for
both symmetric and asymmetric two-state systems. The logarithmic corrections to
these quantities at high temperatures are found in the Kondo limit $\alpha\to
1^{-}$, whereas for $\alpha< 1$ we find the expected power law temperature
dependences with the powers being functions of the dissipative coupling
$\alpha$. The low temperature behaviour is always that of a Fermi liquid.
","[{""version"":""v1"",""created"":""Fri, 5 Mar 1999 19:21:48 GMT""},{""version"":""v2"",""created"":""Mon, 3 May 1999 20:50:41 GMT""}]","2009-10-31"
"cond-mat/9903105","Jamil Tahir-Kheli","Jamil Tahir-Kheli (First Principles Research, Inc.)","The NMR of High Temperature Superconductors without Anti-Ferromagnetic
  Spin Fluctuations","In Press, Journal of Physical Chemistry. See also
  http://www.firstprinciples.com. Minor changes to references and figure
  readability",,"10.1021/jp990815y",,"cond-mat.supr-con cond-mat.mtrl-sci",,"  A microscopic theory for the NMR anomalies of the planar Cu and O sites in
superconducting La_1.85Sr_0.15CuO_4 is presented that quantitatively explains
the observations without the need to invoke anit-ferromagnetic spin
fluctuations on the planar Cu sites and its significant discrepancy with the
observed incommensurate neutron spin fluctuations. The theory is derived from
the recently published ab-initio band structure calculations that correct LDA
computations tendency to overestimate the self-coulomb repulsion for the
half-filled Cu d_x2-y2 orbital for these ionic systems. The new band structure
leads to two bands at the Fermi level with holes in the Cu d_z2 and apical O
p_z orbitals in addition to the standard Cu d_x2-y2 and planar O p_sigma
orbitals. This band structure is part of a new theory for the cuprates that
explains a broad range of experiments and is based upon the formation of Cooper
pairs comprised of a k up spin electron from one band and a -k down spin
electron from another band (Interband Pairing Model).
","[{""version"":""v1"",""created"":""Fri, 5 Mar 1999 20:39:13 GMT""},{""version"":""v2"",""created"":""Sun, 29 Aug 1999 01:36:23 GMT""}]","2016-09-28"
"cond-mat/9903106","Constantino Tsallis","A.K. Rajagopal (Naval Research Laboratory, Washington DC, USA) and
  Constantino Tsallis (Centro Brasileiro de Pesquisas Fisicas, Rio de Janeiro,
  RJ, Brazil)","Generalization of the Lie-Trotter Product Formula for q-Exponential
  Operators","5 pages, no figures","Phys.Lett. A257 (1999) 283","10.1016/S0375-9601(99)00295-9",,"cond-mat.stat-mech",,"  The Lie-Trotter formula $e^{\hat{A}+\hat{B}} = \lim_{N\to \infty}
(e^{\hat{A}/N} e^{\hat{B}/N})^N$ is of great utility in a variety of quantum
problems ranging from the theory of path integrals and Monte Carlo methods in
theoretical chemistry, to many-body and thermostatistical calculations. We
generalize it for the q-exponential function $e_q (x) = [1+ (1-q)
x]^{(1/(1-q))}$ (with $e_1(x)=e^x$), and prove $e_q(\hat{A}+\hat{B}+(1-q)
[\hat{A}\hat{B}+\hat{B}\hat{A}] /2) = \lim_{N\to \infty}
{[e_{1-(1-q)N}(\hat{A}/N)] [e_{1-(1-q)N}(\hat{B}/N)]}^N$. This extended formula
is expected to be similarly useful in the nonextensive situations
","[{""version"":""v1"",""created"":""Fri, 5 Mar 1999 20:59:23 GMT""}]","2009-10-31"
"cond-mat/9903107","Rolf Burghaus","R. Burghaus","Diffusional growth of wetting droplets","5 pages RevTex, 2 figures Postscript included, typo in eq. (11)
  corrected, explanations appended",,,,"cond-mat",,"  The diffusional growth of wetting droplets on the boundary wall of a
semi-infinite system is considered in different regions of a first-order
wetting phase diagram. In a quasistationary approximation of the concentration
field, a general growth equation is established on the basis of a generalized
Gibbs-Thomson relation which includes the van der Waals interaction between the
droplet and the wall. Asymptotic scaling solutions of these equations are found
in the partial-, complete- and pre-wetting regimes.
","[{""version"":""v1"",""created"":""Fri, 5 Mar 1999 21:03:01 GMT""},{""version"":""v2"",""created"":""Tue, 30 Nov 1999 14:25:58 GMT""}]","2007-05-23"
"cond-mat/9903108","Amaral","Marc Barthelemy and Luis A. N. Amaral (Boston University)","Small-world networks: Evidence for a crossover picture","5 pages, 5 postscript figures (1 in color),
  Latex/Revtex/multicols/epsf. Accepted for publication in Physical Review
  Letters",,"10.1103/PhysRevLett.82.3180",,"cond-mat.stat-mech adap-org cond-mat.dis-nn nlin.AO",,"  Watts and Strogatz [Nature 393, 440 (1998)] have recently introduced a model
for disordered networks and reported that, even for very small values of the
disorder $p$ in the links, the network behaves as a small-world. Here, we test
the hypothesis that the appearance of small-world behavior is not a
phase-transition but a crossover phenomenon which depends both on the network
size $n$ and on the degree of disorder $p$. We propose that the average
distance $\ell$ between any two vertices of the network is a scaling function
of $n / n^*$. The crossover size $n^*$ above which the network behaves as a
small-world is shown to scale as $n^*(p \ll 1) \sim p^{-\tau}$ with $\tau
\approx 2/3$.
","[{""version"":""v1"",""created"":""Fri, 5 Mar 1999 21:51:41 GMT""}]","2009-10-31"
"cond-mat/9903109","David S. Hall","Eric A. Cornell, Jason R. Ensher, Carl E. Wieman","Experiments in Dilute Atomic Bose-Einstein Condensation","54 pages, 8 figures; to be published in the proceedings of the
  Varenna conference on Bose-Einstein condensation, July 1998",,,,"cond-mat",,"  Both theoretical and experimental activity in BEC has expanded dramatically
in the three years since the first observation of BEC in a dilute atomic gas.
One is tempted to ask, why? Why is there so much interest in the field? Is this
burst of activity something that could have been foreseen, in, say, 1990?
","[{""version"":""v1"",""created"":""Fri, 5 Mar 1999 23:10:16 GMT""}]","2007-05-23"
"cond-mat/9903110","Amlan Biswas","Amlan Biswas, Anthony Arulraj, A. K. Raychaudhuri, C. N. R. Rao","Collapse of the charge ordering gap of Nd_{0.5}Sr_{0.5}MnO_{3} in an
  applied magnetic field","4 pages REVTeX, 5 postscript figures included, submitted to Phys.
  Rev. Lett","J. Phys: Condens. Matter, volume 12, L101 (2000)","10.1088/0953-8984/12/6/106",,"cond-mat.str-el",,"  We report results of tunneling studies on the charge ordering compound
Nd_{0.5}Sr_{0.5}MnO_{3} in a magnetic field up to 6T and for temperature down
to 25K.We show that a gap (2\Delta_{CO} \approx 0.5eV opens up in the density
of state (DOS) at the Fermilevel (E_F) on charge ordering (T_{CO}=150K) which
collapses in an applied magnetic field when the charge ordered state melts.
There is a clear correspondence between the behavior of the resistivity and the
gap formation and its collapse in an applied magnetic field. We conclude that a
gap in the DOS at E_F is necessary for the stability of the charge ordered
state.
","[{""version"":""v1"",""created"":""Sat, 6 Mar 1999 01:58:20 GMT""},{""version"":""v2"",""created"":""Sat, 27 Mar 1999 22:48:54 GMT""}]","2009-10-31"
"cond-mat/9903111","Reinhold Egger","R. Egger, W. Haeusler, C.H. Mak, H. Grabert","Crossover from Fermi liquid to Wigner molecule behavior in quantum dots","4 pages RevTeX, 3 figures, corrected Table","Phys. Rev. Lett. 82, 3320 (1999); 83, 462(E) (1999)","10.1103/PhysRevLett.82.3320",,"cond-mat.str-el cond-mat.mes-hall",,"  The crossover from weak to strong correlations in parabolic quantum dots at
zero magnetic field is studied by numerically exact path-integral Monte Carlo
simulations for up to eight electrons. By the use of a multilevel blocking
algorithm, the simulations are carried out free of the fermion sign problem. We
obtain a universal crossover only governed by the density parameter $r_s$. For
$r_s>r_c$, the data are consistent with a Wigner molecule description, while
for $r_s<r_c$, Fermi liquid behavior is recovered. The crossover value $r_c
\approx 4$ is surprisingly small.
","[{""version"":""v1"",""created"":""Sat, 6 Mar 1999 09:58:02 GMT""},{""version"":""v2"",""created"":""Thu, 1 Jul 1999 09:51:23 GMT""}]","2009-10-31"
"cond-mat/9903112","Kazumitsu Sakai","Kazumitsu Sakai","Excited state TBA and functional relations in spinless Fermion model","4 pages","J. Phys. Soc. Jpn .68 (1999) 1789-1792","10.1143/JPSJ.68.1789",,"cond-mat.stat-mech hep-th math-ph math.MP math.QA nlin.SI solv-int",,"  The excited state thermodynamic Bethe ansatz (TBA) equations for the spinless
Fermion model are presented by the quantum transfer matrix (QTM) approach. We
introduce a more general family called T-functions and explore functional
relations among them (T-system) and their certain combinations (Y-system).
{}From their analytical property, we derive a closed set of non-linear integral
equations which characterize the correlation length of $<c_j^{\dagger}c_i>$ at
any finite temperatures. Solving these equations numerically, we explicitly
determine the correlation length, which coincides with earlier results with
high accuracy.
","[{""version"":""v1"",""created"":""Sat, 6 Mar 1999 12:03:15 GMT""}]","2012-09-27"
"cs/9903006","Anatoly D. Plotnikov","Anatoly D. Plotnikov (Vinnitsa Institute of Regional Economics and
  Management)","Designing SAT for HCP","7 pages, 1 figures. It has sent to 6th Twente Workshop on Graphs and
  Combinatorial Optimization",,,,"cs.LO",,"  For arbitrary undirected graph $G$, we are designing SATISFIABILITY problem
(SAT) for HCP, using tools of Boolean algebra only. The obtained SAT be the
logic formulation of conditions for Hamiltonian cycle existence, and use $m$
Boolean variables, where $m$ is the number of graph edges. This Boolean
expression is true if and only if an initial graph is Hamiltonian. That is,
each satisfying assignment of the Boolean variables determines a Hamiltonian
cycle of $G$, and each Hamiltonian cycle of $G$ corresponds to a satisfying
assignment of the Boolean variables. In common case, the obtained Boolean
expression may has an exponential length (the number of Boolean literals).
","[{""version"":""v1"",""created"":""Fri, 5 Mar 1999 16:10:41 GMT""}]","2007-05-23"
"cs/9903007","Marc Dymetman","Marc Dymetman","Some Remarks on the Geometry of Grammar","22 pages, 15 figures",,,,"cs.CL cs.LO",,"  This paper, following (Dymetman:1998), presents an approach to grammar
description and processing based on the geometry of cancellation diagrams, a
concept which plays a central role in combinatorial group theory
(Lyndon-Schuppe:1977). The focus here is on the geometric intuitions and on
relating group-theoretical diagrams to the traditional charts associated with
context-free grammars and type-0 rewriting systems. The paper is structured as
follows. We begin in Section 1 by analyzing charts in terms of constructs
called cells, which are a geometrical counterpart to rules. Then we move in
Section 2 to a presentation of cancellation diagrams and show how they can be
used computationally. In Section 3 we give a formal algebraic presentation of
the concept of group computation structure, which is based on the standard
notions of free group and conjugacy. We then relate in Section 4 the geometric
and the algebraic views of computation by using the fundamental theorem of
combinatorial group theory (Rotman:1994). In Section 5 we study in more detail
the relationship between the two views on the basis of a simple grammar stated
as a group computation structure. In section 6 we extend this grammar to handle
non-local constructs such as relative pronouns and quantifiers. We conclude in
Section 7 with some brief notes on the differences between normal submonoids
and normal subgroups, group computation versus rewriting systems, and the use
of group morphisms to study the computational complexity of parsing and
generation.
","[{""version"":""v1"",""created"":""Fri, 5 Mar 1999 18:25:11 GMT""}]","2007-05-23"
"cs/9903008","Diane Litman","Diane J. Litman (AT&T Labs - Research) and Shimei Pan (Columbia
  University)","Empirically Evaluating an Adaptable Spoken Dialogue System","to be published in the Proceedings of the 7th International
  Conference on User Modeling (UM'99); uses llncs.cls,um97.sty",,,,"cs.CL",,"  Recent technological advances have made it possible to build real-time,
interactive spoken dialogue systems for a wide variety of applications.
However, when users do not respect the limitations of such systems, performance
typically degrades. Although users differ with respect to their knowledge of
system limitations, and although different dialogue strategies make system
limitations more apparent to users, most current systems do not try to improve
performance by adapting dialogue behavior to individual users. This paper
presents an empirical evaluation of TOOT, an adaptable spoken dialogue system
for retrieving train schedules on the web. We conduct an experiment in which 20
users carry out 4 tasks with both adaptable and non-adaptable versions of TOOT,
resulting in a corpus of 80 dialogues. The values for a wide range of
evaluation measures are then extracted from this corpus. Our results show that
adaptable TOOT generally outperforms non-adaptable TOOT, and that the utility
of adaptation depends on TOOT's initial dialogue strategies.
","[{""version"":""v1"",""created"":""Fri, 5 Mar 1999 22:03:13 GMT""}]","2007-05-23"
"gr-qc/9903022","Dominic Clancy","Dominic Clancy, Alexander Feinstein, James E. Lidsey and Reza Tavakol","Tilted String Cosmologies","9 pages, Standard Latex Source. To appear in Physics Letters B Minor
  change: Authors now alphabetically listed","Phys.Lett. B451 (1999) 303-308","10.1016/S0370-2693(99)00222-1",,"gr-qc astro-ph hep-th",,"  Global symmetries of the string effective action are employed to generate
tilted, homogeneous Bianchi type VI_h string cosmologies from a previously
known stiff perfect fluid solution to Einstein gravity. The dilaton field is
not constant on the surfaces of homogeneity. The future asymptotic state of the
models is interpreted as a plane wave and is itself an exact solution to the
string equations of motion to all orders in the inverse string tension. An
inhomogeneous generalization of the Bianchi type III model is also found.
","[{""version"":""v1"",""created"":""Fri, 5 Mar 1999 18:35:18 GMT""},{""version"":""v2"",""created"":""Thu, 11 Mar 1999 11:50:31 GMT""}]","2009-10-31"
"gr-qc/9903023","Marco Godina","Marco Godina, Paolo Matteucci, Lorenzo Fatibene, Mauro Francaviglia","Two-spinor Formulation of First Order Gravity coupled to Dirac Fields","16 pages, Plain TEX","Gen.Rel.Grav.32:145-160,2000","10.1023/A:1001804718086",,"gr-qc",,"  Two-spinor formalism for Einstein Lagrangian is developed. The gravitational
field is regarded as a composite object derived from soldering forms. Our
formalism is geometrically and globally well-defined and may be used in
virtually any 4m-dimensional manifold with arbitrary signature as well as
without any stringent topological requirement on space-time, such as
parallelizability. Interactions and feedbacks between gravity and spinor fields
are considered. As is well known, the Hilbert-Einstein Lagrangian is second
order also when expressed in terms of soldering forms. A covariant splitting is
then analysed leading to a first order Lagrangian which is recognized to play a
fundamental role in the theory of conserved quantities. The splitting and
thence the first order Lagrangian depend on a reference spin connection which
is physically interpreted as setting the zero level for conserved quantities. A
complete and detailed treatment of conserved quantities is then presented.
","[{""version"":""v1"",""created"":""Fri, 5 Mar 1999 21:45:00 GMT""}]","2008-11-26"
"gr-qc/9903024","Slava G. Turyshev","Slava G. Turyshev, John D. Anderson, Philip A. Laing, Eunice L. Lau,
  Anthony S. Liu, and Michael Martin Nieto","The Apparent Anomalous, Weak, Long-Range Acceleration of Pioneer 10 and
  11","Latex, 7 pages and 2 figures. Invited talk at the XXXIV-th Rencontres
  de Moriond Meeting on Gravitational Waves and Experimental Gravity. Les Arcs,
  Savoi, France (January 23-30,1999). Corrected typos","""Gravitational Waves and Experimental Gravity"", (2000) 481-486",,"LANL report # LA-UR-99-890","gr-qc astro-ph",,"  Recently we reported that radio Doppler data generated by NASA's Deep Space
Network (DSN) from the Pioneer 10 and 11 spacecraft indicate an apparent
anomalous, constant, spacecraft acceleration with a magnitude $\sim 8.5\times
10^{-8}$ cm s$^{-2}$, directed towards the Sun (gr-qc/9808081). Analysis of
similar Doppler and ranging data from the Galileo and Ulysses spacecraft
yielded ambiguous results for the anomalous acceleration, but it was useful in
that it ruled out the possibility of a systematic error in the DSN Doppler
system that could easily have been mistaken as a spacecraft acceleration. Here
we present some new results, including a critique suggestions that the
anomalous acceleration could be caused by collimated thermal emission. Based
partially on a further data for the Pioneer 10 orbit determination, the data
now spans January 1987 to July 1998, our best estimate of the average Pioneer
10 acceleration directed towards the Sun is $\sim 7.5 \times 10^{-8}$ cm
s$^{-2}$.
","[{""version"":""v1"",""created"":""Sat, 6 Mar 1999 00:26:33 GMT""},{""version"":""v2"",""created"":""Tue, 9 Mar 1999 00:45:14 GMT""}]","2009-09-25"
"hep-ex/9903005","Maria Fidecaro","CPLEAR Collaboration and J. Ellis, N.E. Mavromatos and D.V. Nanopoulos","Tests of the Equivalence Principle with Neutral Kaons","15 pages latex 2e, five figures, one style file (cernart.csl)
  incorporated","Phys.Lett.B452:425-433,1999","10.1016/S0370-2693(99)00271-3","CERN-EP/99-22","hep-ex",,"  We test the Principle of Equivalence for particles and antiparticles, using
CPLEAR data on tagged K0 and K0bar decays into pi^+ pi^-. For the first time,
we search for possible annual, monthly and diurnal modulations of the
observables |eta_{+-}| and phi_{+-}, that could be correlated with variations
in astrophysical potentials. Within the accuracy of CPLEAR, the measured values
of |eta_{+-}| and phi_{+-} are found not to be correlated with changes of the
gravitational potential. We analyze data assuming effective scalar, vector and
tensor interactions, and we conclude that the Principle of Equivalence between
particles and antiparticles holds to a level of 6.5, 4.3 and 1.8 x 10^{-9},
respectively, for scalar, vector and tensor potentials originating from the Sun
with a range much greater than the distance Earth-Sun. We also study
energy-dependent effects that might arise from vector or tensor interactions.
Finally, we compile upper limits on the gravitational coupling difference
between K0 and K0bar as a function of the scalar, vector and tensor interaction
range.
","[{""version"":""v1"",""created"":""Fri, 5 Mar 1999 16:37:58 GMT""}]","2009-09-11"
"hep-lat/9903011","Paolo Provero","M. Caselle, M. Hasenbusch and P. Provero","Non-perturbative states in the 3D phi^4 theory","43 pages, LaTeX with 9 eps figures included, uses axodraw.sty","Nucl.Phys. B556 (1999) 575-600","10.1016/S0550-3213(99)00333-8","DFTT 10/99, HUB-EP-99/13","hep-lat cond-mat.stat-mech hep-th",,"  We show that the spectrum of the three dimensional phi^4 theory in the broken
symmetry phase contains non-perturbative states. We determine the spectrum
using a new variational technique based on the introduction of operators
corresponding to different length scales. The presence of non-perturbative
states accounts for the discrepancy between Monte Carlo and perturbative
results for the universal ratio xi/xi_2nd. We introduce and study some
universal amplitude ratios related to the overlap of the spin operator with the
states of the spectrum. The analysis is performed for the phi^4 theory
regularized on a lattice and for the Ising model. This is a nice verification
of the fact that universality reaches far beyond critical exponents. Finally,
we show that the spectrum of the model, including non-perturbative states,
accurately matches the glueball spectrum in the Z(2) gauge model, which is
related to the Ising model through a duality transformation.
","[{""version"":""v1"",""created"":""Fri, 5 Mar 1999 17:24:52 GMT""}]","2009-10-31"
"hep-ph/9903273","Ernest Ma","Ernest Ma (UC Riverside)","Electron-Neutrino Majorana Mass and Solar Neutrino Oscillations","7 pages including 1 figure, slightly revised version to appear in
  Physics Letters B","Phys.Lett. B456 (1999) 201-203","10.1016/S0370-2693(99)00436-0","UCRHEP-T247 (March 1999)","hep-ph",,"  Assuming the Majorana masses of $\nu_e$ and the linear combination $c
\nu_\tau - s \nu_\mu$ to be equal from their couplings to a heavy scalar
triplet $\xi$, I show that their radiative splitting is given by $\Delta
m^2/m_\nu^2 = (3 c^2/4 \pi^2) (G_F/\sqrt 2) m_\tau^2 \ln (m_\xi^2/m_W^2)$. This
is applicable to the small-angle matter-enhanced oscillation solution of the
solar neutrino deficit and restricts $m_\nu$ to be between 0.20 and 0.36 eV if
$c^2 = 0.7$ and $m_\xi = 10^{14}$ GeV.
","[{""version"":""v1"",""created"":""Fri, 5 Mar 1999 16:56:54 GMT""},{""version"":""v2"",""created"":""Tue, 11 May 1999 20:03:18 GMT""}]","2009-10-31"
"hep-ph/9903274","Marcos Seco","M. Quiros and M. Seco","Electroweak Baryogenesis in the MSSM","Latex2.09, 12 pages, uses sprocl.sty, 10 figures; some references
  added","Nucl.Phys.Proc.Suppl. 81 (2000) 63-70","10.1016/S0920-5632(99)00860-9","IEM-FT-188/99, IFT-UAM/CSIC-99-10","hep-ph",,"  We review the baryogenesis scenario in the MSSM at the perturbative level
and, in particular, the impact of two-loop corrections on the strength of the
phase transition and the amount of generated baryon asymmetry. We confirm the
baryogenesis window, where m_H is less than 115GeV, for m_Q less than a few
GeV, and the right-handed stop mass is constrained in the region between 100GeV
and the top mass. This scenario will be tested at LEP and Tevatron colliders.
","[{""version"":""v1"",""created"":""Fri, 5 Mar 1999 19:58:01 GMT""},{""version"":""v2"",""created"":""Wed, 24 Mar 1999 12:06:13 GMT""}]","2009-10-31"
