"hep-ph/9903275","Hyun-Chul Kim","Mario Franz, Hyun-Chul Kim, and Klaus Goeke","Effective Weak Chiral Lagrangian to ${\cal O} (p^4)$ in the Chiral Quark
  Model","25 pages. RevTex is used. 3 postscript figures. Final version for
  publication in Nucl. Phys. B","Nucl.Phys. B562 (1999) 213-236","10.1016/S0550-3213(99)00488-5","PNU-NTG-01/98, RUB-TPII-10/98","hep-ph",,"  We investigate the $\Delta S = 1,2$ effective weak chiral Lagrangian within
the framework of the chiral quark model. Starting from the effective four-quark
operators, we derive the effective weak chiral action by integrating out the
constituent quark fields. Employing the derivative expansion, we obtain the
effective weak chiral Lagrangian to order ${\cal O} (p^4)$. We examine the
contributions of the order ${\cal O} (N_c)$ to the ratio
$g_{\underline{8}}/g_{\underline{27}}$, considering e.g. the quark axial-vector
constant $g_{\rm A}$ different from unity. The low energy constants of the
counterterms are also presented and discussed.
","[{""version"":""v1"",""created"":""Sat, 6 Mar 1999 08:18:21 GMT""},{""version"":""v2"",""created"":""Wed, 18 Aug 1999 15:15:27 GMT""}]","2009-10-31"
"hep-th/9903052","Albrecht Klemm","Bjorn Andreas, Gottfried Curio and Albrecht Klemm","Towards the Standard Model spectrum from elliptic Calabi-Yau","31 pages, 1 eps-figure, reference added, bundle parameters for dP9
  model changed","Int.J.Mod.Phys.A19:1987,2004","10.1142/S0217751X04018087","IFP-9902-UNC, IASSNS-HEP-99/04","hep-th",,"  We show that it is possible to construct supersymmetric three-generation
models of Standard Model gauge group in the framework of non-simply-connected
elliptically fibered Calabi-Yau, without section but with a bi-section. The
fibrations on a cover Calabi-Yau, where the model has 6 generations of SU(5)
and the bundle is given via the spectral cover description, use a different
description of the elliptic fibre which leads to more than one global section.
We present two examples of a possible cover Calabi-Yau with a free involution:
one is a fibre product of rational elliptic surfaces $dP_9$; another example is
an elliptic fibration over a Hirzebruch surface. There we give the necessary
amount of chiral matter by turning on in the bundles a further parameter,
related to singularities of the fibration and the branching of the spectral
cover.
","[{""version"":""v1"",""created"":""Fri, 5 Mar 1999 20:45:26 GMT""},{""version"":""v2"",""created"":""Sun, 7 Mar 1999 23:04:15 GMT""},{""version"":""v3"",""created"":""Tue, 9 Mar 1999 22:50:02 GMT""},{""version"":""v4"",""created"":""Wed, 15 Dec 2004 11:04:06 GMT""}]","2014-11-18"
"hep-th/9903053","Albrecht Klemm","T.-M. Chiang, A. Klemm, S.-T. Yau and E. Zaslow","Local Mirror Symmetry: Calculations and Interpretations","60 pages, 3 eps-figures, version sent to ATMP","Adv.Theor.Math.Phys. 3 (1999) 495-565",,"IASSNS-HEP-99/26","hep-th math.AG",,"  We describe local mirror symmetry from a mathematical point of view and make
several A-model calculations using the mirror principle (localization). Our
results agree with B-model computations from solutions of Picard-Fuchs
differential equations constructed form the local geometry near a Fano surface
within a Calabi-Yau manifold. We interpret the Gromov-Witten-type numbers from
an enumerative point of view. We also describe the geometry of singular
surfaces and show how the local invariants of singular surfaces agree with the
smooth cases when they occur as complete intersections.
","[{""version"":""v1"",""created"":""Fri, 5 Mar 1999 22:32:09 GMT""},{""version"":""v2"",""created"":""Sun, 7 Mar 1999 22:49:12 GMT""},{""version"":""v3"",""created"":""Tue, 9 Mar 1999 23:30:34 GMT""},{""version"":""v4"",""created"":""Fri, 11 Jun 1999 02:51:45 GMT""}]","2009-09-25"
"hep-th/9903055","Mark Wellmann","G.Scharf, M.Wellmann","Spin-2 gauge theories and perturbative gauge invariance","24 pages, amslatex, introduction enlarged, section 3 and 4 modified,
  section 5 new, appendices added, references updated, some typos corrected",,,"ZU-TH 12/99","hep-th",,"  In the framework of causal perturbation theory we analyze the gauge structure
of a massless self-interacting quantum tensor field. We look at this theory
from a pure field theoretical point of view without assuming any geometrical
aspect from general relativity. To first order in the perturbation expansion of
the $S$-matrix we derive necessary and sufficient conditions for such a theory
to be gauge invariant, by which we mean that the gauge variation of the
self-coupling with respect to the gauge charge operator $Q$ is a divergence in
the sense of vector analysis. The most general trilinear self-coupling of the
graviton field turns out to be the one derived from the Einstein-Hilbert action
plus divergences and coboundaries.
","[{""version"":""v1"",""created"":""Fri, 5 Mar 1999 16:25:16 GMT""},{""version"":""v2"",""created"":""Wed, 10 Nov 1999 09:28:01 GMT""},{""version"":""v3"",""created"":""Tue, 16 Nov 1999 16:48:17 GMT""}]","2007-05-23"
"hep-th/9903056","Yang-Hui Evariste He","Yang-Hui He and Jun S. Song","Of McKay Correspondence, Non-linear Sigma-model and Conformal Field
  Theory","35 pages, 4 figures; minor corrections, comments on toric geometry
  and references added","Adv.Theor.Math.Phys. 4 (2000) 747-790",,,"hep-th",,"  The ubiquitous ADE classification has induced many proposals of often
mysterious correspondences both in mathematics and physics. The mathematics
side includes quiver theory and the McKay Correspondence which relates finite
group representation theory to Lie algebras as well as crepant resolutions of
Gorenstein singularities. On the physics side, we have the graph-theoretic
classification of the modular invariants of WZW models, as well as the relation
between the string theory nonlinear $\sigma$-models and Landau-Ginzburg
orbifolds. We here propose a unification scheme which naturally incorporates
all these correspondences of the ADE type in two complex dimensions. An
intricate web of inter-relations is constructed, providing a possible guideline
to establish new directions of research or alternate pathways to the standing
problems in higher dimensions.
","[{""version"":""v1"",""created"":""Fri, 5 Mar 1999 21:56:46 GMT""},{""version"":""v2"",""created"":""Sat, 27 Mar 1999 22:46:43 GMT""}]","2007-05-23"
"hep-th/9903058","Jin-Ho Cho","Jin-Ho Cho and Soonkeon Nam","AdS_3 Black Hole Entropy and the Spectral Flow on the Horizon","14 pages using REVTeX macro","J.Korean Phys.Soc.43:461-466,2003",,"APCTP-1999006","hep-th",,"  We consider the entropy problem of AdS_3 black holes using the conformal
field theory at the horizon. We observe that the supersymmetry is enhanced at
the horizon of massless AdS_3 black hole. This allows us to determine the
vacuum of the modular invariant conformal field theory to be the NS-ground
state (which corresponds to AdS_3 spacetime). This is smoothly related to the
R-ground state (corresponding to massless black hole) by a spectral flow, which
can be understood as a superconformal transformation.
","[{""version"":""v1"",""created"":""Sat, 6 Mar 1999 13:17:40 GMT""}]","2010-02-05"
"math-ph/9903012","Bernard Shiffman","Pavel Bleher, Bernard Shiffman, Steve Zelditch","Poincare-Lelong approach to universality and scaling of correlations
  between zeros",,"Commun. Math. Phys. 208 (2000), 771-785.","10.1007/s002200050010","MSRI 1999-027","math-ph math.AG math.CV math.MP",,"  This note is concerned with the scaling limit as N approaches infinity of
n-point correlations between zeros of random holomorphic polynomials of degree
N in m variables. More generally we study correlations between zeros of
holomorphic sections of powers L^N of any positive holomorphic line bundle L
over a compact Kahler manifold. Distances are rescaled so that the average
density of zeros is independent of N. Our main result is that the scaling
limits of the correlation functions and, more generally, of the ""correlation
forms"" are universal, i.e. independent of the bundle L, manifold M or point on
M.
","[{""version"":""v1"",""created"":""Fri, 5 Mar 1999 19:24:18 GMT""}]","2009-10-31"
"math/9903033","Anne Heyworth","Anne Heyworth (University Of Wales, Bangor)","One-sided Noncommutative Groebner Bases with Applications to Green's
  Relations","15 pages, LaTeX2e, (submitted to J.Algebra)",,,"UWB Math Preprint 99.10","math.RA",,"  Standard noncommutative Gr\""obner basis procedures are used for computing
ideals of free noncommutative polynomial rings over fields. This paper
describes Gr\""obner basis procedures for one-sided ideals in finitely presented
noncommutative algebras over fields. The polynomials defining a $K$-algebra $A$
as a quotient of a free $K$-algebra are combined with the polynomials defining
a one-sided ideal $I$ of $A$, by using a tagging notation. Standard
noncommutative Gr\""obner basis techniques can then be applied to the mixed set
of polynomials, thus calculating $A/I$ whilst working in a free structure,
avoiding the complication of computing in $A$. The paper concludes by showing
how the results can be applied to completable presentations of semigroups and
so enable calculations of Green's relations.
","[{""version"":""v1"",""created"":""Fri, 5 Mar 1999 19:30:35 GMT""}]","2007-05-23"
"math/9903034","R. P. Thomas","R. P. Thomas","An obstructed bundle on a Calabi-Yau 3-fold","Corrected mistake pointed out by Yukinobu Toda","Adv. Theor. Math. Phys. 3, 567-576, 1999","10.4310/ATMP.1999.v3.n3.a4",,"math.AG hep-th","http://arxiv.org/licenses/nonexclusive-distrib/1.0/","  Mirror symmetry suggests that on a Calabi-Yau 3-fold moduli spaces of stable
bundles, especially those with degree zero and indivisible Chern class, might
be smooth (i.e. unobstructed, though perhaps of too high a dimension). This is
because smoothly embedded special lagrangian cycles in the mirror have
unobstructed deformations. As there does not seem to be a counterexample in the
literature we provide one here, showing that such a Tian-Todorov-McLean-type
result cannot hold.
","[{""version"":""v1"",""created"":""Fri, 5 Mar 1999 21:44:31 GMT""},{""version"":""v2"",""created"":""Mon, 9 May 2016 14:18:42 GMT""}]","2016-05-10"
"math/9903035","Philip Gibbs","Philip Gibbs","A Generalised Stern-Brocot Tree from Regular Diophantine Quadruples",,,,,"math.NT",,"  Diophantine quadruples are sets of four distinct positive integers such that
the product of any two is one less than a square. All known examples belong to
an infinite set which can be constructed recursively. Some observations on
these regular solutions are presented. In particular we see how factors of the
four numbers satisfy relations which generalise the Stern-Brocot Tree. There is
also an update on the search for rational Diophantine sextuples with five new
examples.
","[{""version"":""v1"",""created"":""Sat, 6 Mar 1999 09:52:13 GMT""}]","2007-05-23"
"nucl-ex/9903002","Alejandro Garcia","E. G. Adelberger, C. Ortiz, A. Garcia, H. E. Swanson, M. Beck, O.
  Tengblad, M. J. G. Borge, I. Martel, H. Bichsel, and the ISOLDE Collaboration","Positron-neutrino correlation in the 0^+ \to 0^+ decay of ^{32}Ar",,"Phys.Rev.Lett. 83 (1999) 1299-1302; Erratum-ibid. 83 (1999) 3101","10.1103/PhysRevLett.83.1299",,"nucl-ex",,"  The positron-neutrino correlation in the $0^+ \to 0^+ \beta$ decay of
$^{32}$Ar was measured at ISOLDE by analyzing the effect of lepton recoil on
the shape of the narrow proton group following the superallowed decay. Our
result is consistent with the Standard Model prediction. For vanishing Fierz
interference we find $a=0.9989 \pm 0.0052 \pm 0.0036$, which yields improved
constraints on scalar weak interactions.
","[{""version"":""v1"",""created"":""Fri, 5 Mar 1999 23:17:43 GMT""}]","2009-10-31"
"nucl-th/9903017","M. Belkacem","M. Belkacem, Z. Aouissat, M. Bleicher, H. St\""ocker and W. Greiner","Moments of event observable distributions and many-body correlations","Latex, 7 pages. Minor modifications with few comments added",,,,"nucl-th hep-ph",,"  We investigate event-by-event fluctuations for ensembles with non-fixed
multiplicity. Moments of event observable distributions, like total energy
distribution, total transverse momentum distribution, etc, are shown to be
related to the multi-body correlations present in the system. For classical
systems, these moments reduce in the absence of any correlations to the moments
of particle inclusive momentum distribution. As a consequence, a zero value for
the recently introduced $\Phi$-variable is shown to indicate the vanishing of
two-body correlations from one part, and of correlations between multiplicity
and momentum distributions from the other part. It is often misunderstood as a
measure of the degree of equilibration in the system.
","[{""version"":""v1"",""created"":""Fri, 5 Mar 1999 17:19:33 GMT""},{""version"":""v2"",""created"":""Thu, 22 Apr 1999 09:09:26 GMT""}]","2016-08-15"
"quant-ph/9903022","M. Rosenau da Costa","M. Rosenau da Costa, A. O. Caldeira, S. M. Dutra, H. Westfahl Jr","Exact Diagonalization of Two Quantum Models for the Damped Harmonic
  Oscillator","19 pages, 2 figures, ReVTeX","Phys. Rev. A 61, 022107, 2000","10.1103/PhysRevA.61.022107",,"quant-ph",,"  The damped harmonic oscillator is a workhorse for the study of dissipation in
quantum mechanics. However, despite its simplicity, this system has given rise
to some approximations whose validity and relation to more refined descriptions
deserve a thorough investigation. In this work, we apply a method that allows
us to diagonalize exactly the dissipative Hamiltonians that are frequently
adopted in the literature. Using this method we derive the conditions of
validity of the rotating-wave approximation (RWA) and show how this approximate
description relates to more general ones. We also show that the existence of
dissipative coherent states is intimately related to the RWA. Finally, through
the evaluation of the dynamics of the damped oscillator, we notice an important
property of the dissipative model that has not been properly accounted for in
previous works; namely, the necessity of new constraints to the application of
the factorizable initial conditions.
","[{""version"":""v1"",""created"":""Fri, 5 Mar 1999 19:57:07 GMT""},{""version"":""v2"",""created"":""Tue, 1 Aug 2000 15:09:28 GMT""}]","2009-10-31"
"quant-ph/9903026","A. A. Stanislavsky","S.S.Sannikov, A.A.Stanislavsky, M.J.T.F.Cabbolet","Elementary Particles in a New Quantum Scheme","LaTeX, 45 pages",,,,"quant-ph",,"  Proceeding from the main principles of the non-unitary quantum theory of
relativistic bi-Hamiltonian systems, a system of Lagrangian fields
characterized by a certain dispersion law (mass spectrum of particles),
interactions between them and their coupling constants are constructed. In this
article the mass spectrum formula for ``bare'' fundamental hadrons is
introduced, and an a priori normalization of particle fields is found as well.
Numerical values of some parameters of the present theory are determined.
","[{""version"":""v1"",""created"":""Sat, 6 Mar 1999 13:09:05 GMT""}]","2007-05-23"
