"adap-org/9903003","Chris Adami","Charles Ofria and Christoph Adami (California Institute of Technology)","Evolution of genetic organization in digital organisms","18 pages with 5 embedded figures. Proc. of DIMACS workshop on
  ""Evolution as Computation"", Jan. 11-12, Princeton, NJ. L. Landweber and E.
  Winfree, eds. (Springer, 1999)",,,,"adap-org cs.NE nlin.AO q-bio.PE",,"  We examine the evolution of expression patterns and the organization of
genetic information in populations of self-replicating digital organisms.
Seeding the experiments with a linearly expressed ancestor, we witness the
development of complex, parallel secondary expression patterns. Using
principles from information theory, we demonstrate an evolutionary pressure
towards overlapping expressions causing variation (and hence further evolution)
to sharply drop. Finally, we compare the overlapping sections of dominant
genomes to those portions which are singly expressed and observe a significant
difference in the entropy of their encoding.
","[{""version"":""v1"",""created"":""Sat, 6 Mar 1999 00:39:40 GMT""}]","2007-05-23"
"astro-ph/9903089","Sergei A. Grebenev","S. V. Molkov, S. A. Grebenev, M. N. Pavlinsky, R. A. Sunyaev","GRANAT/ART-P observations of GX3+1: type I X-ray burst and persistent
  emission","4 pages, 4 figures, to appear in Proc. of the 3rd INTEGRAL Workshop
  ""The Extreme Universe"" (Sept. 14-18, 1998, Taormina, Italy)",,,,"astro-ph",,"  We present results of observations of the known LMXB source GX3+1 with the
telescope ART-P on board GRANAT in the fall of 1990. A strong X-ray burst was
detected from the source on Oct. 14 when it was in the low X-ray state with a
luminosity ~30% smaller than the normal one. That was only the second case for
the whole history of its study when it exhibited such type of activity. We
describe results of the source spectroscopy during the burst and persistent
state and discuss formation of its X-ray emission in the accretion disk
boundary layer. It is noted that scattering on electrons plays the dominant
role in the emission processes.
","[{""version"":""v1"",""created"":""Fri, 5 Mar 1999 17:56:10 GMT""}]","2007-05-23"
"astro-ph/9903090","G. S. Bisnovatyi-Kogan","G.S. Bisnovatyi-Kogan","Origin of GRB Afterglows in the Model of Galactic Neutron Stars","Talk at the Workshop ""Gamma-Ray Bursts in the Afterglow Era"", Rome,
  November 3-6. To appear in A&A Suppl",,,,"astro-ph",,"  The launch of the Beppo-Sax satellite gave a unique opportunity to
investigate gamma ray bursts (GRB) in different spectral regions. The large
diversity of the afterglow behavior creates additional problems for the
cosmological model with a fireball. Formation of the afterglow giving the
observed diversity of properties is suggested in the Galactic neutron star
model of GRBs. It is based on the transient accretion disc formation around the
neutron star with a low-mass brown companion irradiated by the neutron star.
","[{""version"":""v1"",""created"":""Fri, 5 Mar 1999 16:06:07 GMT""}]","2007-05-23"
"astro-ph/9903091","Ramon Khanna","Ramon Khanna (Landessternwarte Heidelberg, Germany)","Generation and evolution of magnetic fields in the gravitomagnetic field
  of a Kerr Black Hole","8 pages, 2 figures, latex uses sprocl.sty, to appear in the
  Proceedings of The Third William Fairbank Meeting on ""The Lense-Thirring
  Effect"", June 1998, R. Ruffini et al. (Eds.), World Scientific, reviews
  astro-ph/9803088 and astro-ph/9803240 and contains new results, see also
  http://www.lsw.uni-heidelberg.de/~rkhanna/",,,,"astro-ph gr-qc",,"  I study the generation and evolution of magnetic fields in the plasma
surrounding a rotating black hole. Attention is focused on effects of the
gravitomagnetic potential. The gravitomagnetic force appears as battery term in
the generalized Ohm's law. The generated magnetic field should be stronger than
fields generated by the classical Biermann battery. The coupling of the
gravitomagnetic potential with electric fields appears as gravitomagnetic
current in Maxwell's equations. In the magnetohydrodynamic induction equation,
this current re-appears as source term for the poloidal magnetic field, which
can produce closed magnetic structures around an accreting black hole. In
principle, even self-excited axisymmetric dynamo action is possible, which
means that Cowling's anti dynamo theorem does not hold in the Kerr metric.
Finally, the structure of a black hole driven current is studied.
","[{""version"":""v1"",""created"":""Fri, 5 Mar 1999 17:23:15 GMT""}]","2007-05-23"
"astro-ph/9903092","Christopher G. De Pree","C. G. De Pree, M. Nysewander (Agnes Scott College), W. M. Goss (NRAO)","NGC 3576 and NGC 3603: Two Luminous Southern HII Regions Observed at
  High Resolution with the Australia Telescope Compact Array","24 pages, 12 Postscript figures",,"10.1086/300892","NRAO-99/030","astro-ph",,"  NGC 3576 (G291.28-0.71; l=291.3o, b=-0.7o) and NGC 3603 (G291.58-0.43;
l=291.6o, b=-0.5o) are optically visible, luminous HII regions located at
distances of 3.0 kpc and 6.1 kpc, respectively. We present 3.4 cm Australian
Telescope Compact Array (ATCA) observations of these two sources in the
continuum and the H90a, He90a, C90a and H113b recombination lines with an
angular resolution of 7"" and a velocity resolution of 2.6 km/s. All four
recombination lines are detected in the integrated profiles of the two sources.
Broad radio recombination lines are detected in both NGC 3576 (DV_{FWHM}>= 50
km/s) and NGC 3603 (DV_{FWHM}>=70 km/s). In NGC 3576 a prominent N-S velocity
gradient (~30 km/s/pc) is observed, and a clear temperature gradient (6000 K to
8000 K) is found from east to west, consistent with a known IR color gradient
in the source. In NGC 3603, the H90a, He90a and the H113b lines are detected
from 13 individual sources. The Y^+ (He/H) ratios in the two sources range from
0.08+/-0.04 to 0.26+/-0.10. We compare the morphology and kinematics of the
ionized gas at 3.4 cm with the distribution of stars, 10 micron emission and
H_2O, OH, and CH_3OH maser emission. These comparisons suggest that both NGC
3576 and NGC 3603 have undergone sequential star formation.
","[{""version"":""v1"",""created"":""Fri, 5 Mar 1999 17:27:25 GMT""}]","2009-10-31"
"astro-ph/9903093","Ken Mighell","Kenneth J. Mighell (1) ((1) National Optical Astronomy Observatories)","Parameter Estimation in Astronomy with Poisson-Distributed Data. I. The
  Chi-Square-Gamma Statistic","22 pages (LaTeX+aaspp4.sty), 6 tables (PostScript format) and 12
  figures (PostScript format). The PostScript version of the paper, tables, and
  full-resolution color figures are available at
  http://www.noao.edu/staff/mighell/chi-square-gamma/ To appear in the
  Astrophysical Journal (accepted 1998 November 20)",,"10.1086/307253",,"astro-ph",,"  Applying the standard weighted mean formula, [sum_i {n_i sigma^{-2}_i}] /
[sum_i {sigma^{-2}_i}], to determine the weighted mean of data, n_i, drawn from
a Poisson distribution, will, on average, underestimate the true mean by ~1 for
all true mean values larger than ~3 when the common assumption is made that the
error of the ith observation is sigma_i = max(sqrt{n_i},1). This small, but
statistically significant offset, explains the long-known observation that
chi-square minimization techniques which use the modified Neyman's chi-square
statistic, chi^2_{N} equiv sum_i (n_i-y_i)^2 / max(n_i,1), to compare
Poisson-distributed data with model values, y_i, will typically predict a total
number of counts that underestimates the true total by about 1 count per bin.
Based on my finding that the weighted mean of data drawn from a Poisson
distribution can be determined using the formula [sum_i [n_i + min(n_i,1)]
(n_i+1)^{-1}] / [sum_i (n_i+1)^{-1}], I propose that a new chi-square
statistic, chi^2_gamma equiv sum_i [n_i + min(n_i,1) - y_i]^2 / [n_i + 1],
should always be used to analyze Poisson-distributed data in preference to the
modified Neyman's chi-square statistic. I demonstrate the power and usefulness
of chi-square-gamma minimization by using two statistical fitting techniques
and five chi-square statistics to analyze simulated X-ray power-law 15-channel
spectra with large and small counts per bin. I show that chi-square-gamma
minimization with the Levenberg-Marquardt or Powell's method can produce
excellent results (mean slope errors <=3%) with spectra having as few as 25
total counts.
","[{""version"":""v1"",""created"":""Fri, 5 Mar 1999 20:07:36 GMT""}]","2009-10-31"
"astro-ph/9903094",,"B.Stern, Ya.Tikhomirova, M.Stepanov, D.Kompaneets, A.Berezhnoy,
  R.Svensson","Search for Non-Triggered Gamma Ray Bursts in the BATSE Continuous
  Records: Preliminary Results","4 pages, LaTeX, to appear in Proceedings ""Gamma Ray Bursts in the
  Afterglow Era"", Rome, November 1998, A&AS, 1999",,"10.1086/312873",,"astro-ph",,"  We present preliminary results of an off-line search for non-triggered
gamma-ray bursts (GRBs) in the BATSE daily records for about 5.7 years of
observations. We found more GRB-like events than the yield of the similar
search of Kommers et al. (1998) and extended the Log N - log P distribution
down to $\sim$ 0.1 ph cm$^{-2}$ s$^{-1}$. The indication of a turnover of the
log N - log P at a small P is not confirmed: the distribution is straight at
1.5 decades with the power law index -.6 and cannot be fitted with a standard
candle cosmological model.
","[{""version"":""v1"",""created"":""Fri, 5 Mar 1999 18:36:21 GMT""}]","2009-10-31"
"astro-ph/9903095","Thomas G. Barnes","T. Barnes, I. Ivans, J. Martin, C. Froning (U. of Texas), T. Moffett
  (Purdue U.)","V(RI)sub(c) Photometry of Cepheids in the Magellanic Clouds","LaTeX file (9 pages), LaTeX table (1 page), 2 figures of 3 panels
  eacs PASP (July)",,"10.1086/316396","Dept of Astronomy preprint #400","astro-ph",,"  We present V(RI)sub data for thirteen Cepheids in the Large Magellanic Cloud
ans fifty-five in each wavelength band. The median uncertainty in the
photometry iy Moffett, Gieren & Barnes (1998) which contained 1000 measures
($\pm 0.01$ mag) in each wavelength band on 22 variables with periods in the
range 8--133 days.
","[{""version"":""v1"",""created"":""Fri, 5 Mar 1999 20:23:54 GMT""},{""version"":""v2"",""created"":""Thu, 8 Apr 1999 16:18:51 GMT""},{""version"":""v3"",""created"":""Mon, 12 Apr 1999 20:51:14 GMT""}]","2009-10-31"
"astro-ph/9903096","Ivanio Puerari","I. Puerari (INAOE, Tonantzintla, Mexico), D. Pfenniger (Observatoire
  de Geneve, Switzerland)","Formation of massive counter-rotating disks: an alternative scenario","7 pages, 3 figures, contribution to ""The Evolution of Galaxies on
  Cosmological Timescales"", Euroconference, Puerto de la Cruz, Tenerife, Spain,
  Nov 30 - Dec 5 1998","Astrophys.Space Sci. 276 (2001) 909-914","10.1023/A:1017581325673",,"astro-ph",,"  In this contribution, we investigate the scenario of major mergers between
galaxies of comparable mass to the formation of massive counter-rotating disks.
Such a scenario can be ruled out in general because they produce rather
ellipticals. Yet for a narrow range of initial conditions, major mergers can
nevertheless produce anyway rare galaxies such as NGC 4550, and so they are
viable alternatives for the formation of these counter-rotating systems. The
scenario is successful in producing a remarkably axisymmetric disk possessing
strongly counter-rotating populations.
","[{""version"":""v1"",""created"":""Sat, 6 Mar 1999 01:57:19 GMT""}]","2009-10-31"
"astro-ph/9903097","Amita Shaw","S.Biswas, A.Shaw and B.Modak","Decoherence in the Starobinsky Model","14 Pages","Gen.Rel.Grav. 31 (1999) 1015-1030","10.1023/A:1026683515379",,"astro-ph",,"  Starobinsky described an inflationary scenario in which quantum corrections
to vacuum Einstein equations drive the inflation. The quantum cosmology of the
model is studied by solving the Wheeler-DeWitt equation. A connection between
uncertainty requirement, randomness in initial states and curvature fluctuation
is studied with a Schr\""{o}dinger-type equation through a time parameter
prescription. The result obtained is applied to understand the decoherence
mechanism in quantum gravity in the Starobinsky description.
","[{""version"":""v1"",""created"":""Sat, 6 Mar 1999 06:00:33 GMT""},{""version"":""v2"",""created"":""Thu, 15 Jul 1999 11:18:58 GMT""}]","2015-06-24"
"astro-ph/9903098","Dima Yakovlev","K.P. Levenfish, Yu.A. Shibanov, D.G. Yakovlev (Ioffe Institute,
  St.-Petersburg)","A simple model of cooling neutron stars with superfluid cores:
  comparison with observations","LaTeX, 14 pages, 10 figures, to appear in Astron. Lett","Astron.Lett. 25 (1999) 417",,,"astro-ph",,"  Cooling of neutron stars (NSs) with superfluid cores is simulated taking into
account neutrino emission produced by Cooper pairing of nucleons. The critical
temperatures of neutron and proton superfluidities, $T_{cn}$ and $T_{cp}$, are
assumed to be constant over the NS core, and treated as free parameters. They
are constrained using the surface temperatures $T_s$ of isolated NSs (RX
J0822-43, PSR 1055-52, 1E 1207-52, Vela, Geminga, PSR 0656+14, RX J0002+62),
obtained by interpretation of observed thermal radiation either with black body
spectrum or with hydrogen atmosphere models.
","[{""version"":""v1"",""created"":""Sat, 6 Mar 1999 10:14:29 GMT""}]","2007-05-23"
"astro-ph/9903099","Tadayuki Takahashi","Tadayuki Takahashi (ISAS), Greg Madejski (NASA/GSFC), Hidetoshi Kubo
  (TIT)","X-ray Observations of TeV Blazars and Multi-Frequency Analysis","18 pages, 10 figures,Invited talk at VERITAS Workshop on TeV
  Astrophysics of Extragalactic Sources, Cambridge, MA, Oct. 23-24, 1998. In
  press, Astroparticle Physics, ed. M. Catanese, J. Quinn, T. Weekes","Astropart.Phys. 11 (1999) 177-187","10.1016/S0927-6505(99)00045-6",,"astro-ph",,"  The non-thermal spectra of blazars, observed from radio to GeV/TeV
gamma-rays, reveal two pronounced components, both produced by radiation by
energetic particles. One peaks in the IR - to soft X-ray band, radiating via
the synchrotron process; the other, peaking in the high-energy gamma-rays, is
produced by the Compton process. These spectra -- and, in particular, the \asca
data -- suggest that the origin of the seed photons for Comptonization is
diverse. In the High-energy peaked BL Lac objects (HBLs), the dominant seed
photons for Comptonization appear to be the synchrotron photons internal to the
jet (SSC process). In the quasar-hosted blazars (QHBs), on the other hand, the
X-ray band emission is still dominated by the SSC process, while the MeV to GeV
range is produced by Comptonization of external photons such as the emission
line light. In the context of this three-component model, we derive the
magnetic field of 0.1 - 1 Gauss for all classes of blazars. Lorentz factors
gamma_{peak} of electrons radiating at each peak of the nuFnu spectra are
estimated to be ~10^{5}$ for HBLs; this is much higher than ~10^{3}$ for QHBs.
This difference is consistent with the fact that the four sources that are
known to emit TeV gamma-rays (TeV blazars) are all classified as HBLs. Among
the TeV blazars, Mkn 421 is one of the brightest and most variable emitters
from ultraviolet (eV) to hard gamma-ray (TeV) energies.The multi-frequency
observations including TeV energy band provide the best opportunity to
understand high-energy emission from blazar jets. In this paper, we discuss
results of multi-frequency analysis and review the results of intensive
campaigns for Mkn 421 from 1994 to 1998
","[{""version"":""v1"",""created"":""Sat, 6 Mar 1999 10:26:12 GMT""}]","2009-10-31"
"astro-ph/9903100","JinLin Han","J.L. Han(1,2,3), W.W. Tian(1,3) ((1) Beijing Astronomical Observatory,
  Chinese Academy of Sciences, Beijing, China (2) Beijing Astronomy Center,
  CAS-PKU, Beijing, China (3) Max-Planck-Institut f\""ur Radioastronomie, Bonn,
  Germany)","Pulsars identified from the NRAO VLA Sky Survey","7 pages; 3 figures; one big table; To appear in A&A Supplements",,"10.1051/aas:1999234",,"astro-ph",,"  We identified 97 strong pulsars from the NRAO VLA Sky Survey (NVSS) at 1.4
GHz north of Dec(J2000) $>-40\degr$. The total flux density, linear
polarization intensity and polarization angle (PA) of all pulsars are extracted
from the NVSS catalog. The well-calibrated PA measurement of 5 pulsars can be
used for absolute PA calibrations in other observations. Comparing the source
positions with those in the pulsar catalog, we got the first measurement of the
proper motion upper limit of PSR B0031-07, which is $\mu_{\alpha}\cos\delta =
-102 \pm 74 mas/yr$ and $\mu_{\delta} = -105 \pm 78 mas/yr$.
","[{""version"":""v1"",""created"":""Sat, 6 Mar 1999 11:18:00 GMT""}]","2015-06-24"
"astro-ph/9903101","JinLin Han","J.L. Han(1,2), R. N. Manchester(3), G. J. Qiao(2,4,5) ((1) Beijing
  Astronomical Observatory, Chinese Academy of Sciences (CAS), Beijing, China
  (2) Beijing Astrophysical Center, CAS-PKU, Beijing, China (3) Australia
  Telescope National Facility, CSIRO, NSW, Australia (4) CCAT (World
  Laboratory), Beijing, China (5) Department of Geophysics, Peking University
  (PKU), Beijing, China)","Pulsar rotation measures and the magnetic structure of our Galaxy","10pages; 8 figures; Accepted by MNRAS",,"10.1046/j.1365-8711.1999.02544.x",,"astro-ph",,"  We have obtained 63 rotation measures (RMs) from polarization observations of
southern pulsars, of which 54 are new measurements and 3 are varied from
previous values. The new pulsar RM data at high Galactic latitudes are mostly
consistent with the antisymmetric RM distribution found previously. For the
Galactic disc, evidence for a field reversal near the Perseus arm, and possibly
another beyond it, is presented. Inside the Solar Circle, in addition to the
two known field reversals in or near the Carina-Sagittartus arm and the
Crux-Scutum arm, a further reversal in the Norma arm is tentatively identified.
These reversals, together with the pitch angle derived from pulsar RM and
stellar polarization distributions, are consistent with bisymmetric spiral
(BSS) models for the large-scale magnetic field structure in the disc of our
Galaxy. However, discrimination between models is complicated by the presence
of smaller-scale irregularities in the magnetic field, as well as uncertainties
in the theoretical modelling.
","[{""version"":""v1"",""created"":""Sat, 6 Mar 1999 11:13:20 GMT""}]","2009-10-31"
"astro-ph/9903102","Tom Abel","Tom Abel (1,2), Martin G. Haehnelt (1) ((1) Max Planck Institut fuer
  Astrophysik, Garching, (2) LCA, NCSA, University of Illinois,
  Urbana/Champaign)","Radiative Transfer Effects during Photoheating of the Intergalactic
  Medium","4 pages, 2 figures, submitted to ApJL","Astrophys.J.520:L13-L16,1999","10.1086/312136",,"astro-ph",,"  The thermal history of the intergalactic medium (IGM) after reionization is
to a large extent determined by photoheating. Here we demonstrate that
calculations of the photoheating rate which neglect radiative transfer effects
substantially underestimate the energy input during and after reionization. The
neglect of radiative transfer effects results in temperatures of the IGM which
are too low by a factor of two after HeII reionization. We briefly discuss
implications for the absorption properties of the IGM and the distribution of
baryons in shallow potential wells.
","[{""version"":""v1"",""created"":""Sat, 6 Mar 1999 14:16:43 GMT""}]","2009-10-26"
"chao-dyn/9903008","John Bowman","John C. Bowman, B. A. Shadwick, and P. J. Morrison","Spectral reduction: a statistical description of turbulence","12 pages, 4 figures, to appear in Physical Review Letters",,"10.1103/PhysRevLett.83.5491",,"chao-dyn nlin.CD",,"  A method is described for predicting statistical properties of turbulence.
Collections of Fourier amplitudes are represented by nonuniformly spaced modes
with enhanced coupling coefficients. The statistics of the full dynamics can be
recovered from the time-averaged predictions of the reduced model. A Liouville
theorem leads to inviscid equipartition solutions. Excellent agreement is
obtained with two-dimensional forced-dissipative pseudospectral simulations.
For the two-dimensional enstrophy cascade, logarithmic corrections to the
high-order structure functions are observed.
","[{""version"":""v1"",""created"":""Fri, 5 Mar 1999 21:23:54 GMT""},{""version"":""v2"",""created"":""Thu, 18 Mar 1999 18:55:59 GMT""},{""version"":""v3"",""created"":""Sun, 12 Sep 1999 18:30:43 GMT""},{""version"":""v4"",""created"":""Fri, 5 Nov 1999 20:40:21 GMT""}]","2009-10-31"
"cond-mat/9903088","Jason K. Perry","Jason K. Perry (First Principles Research Inc., Los Angeles, CA)","The Importance of Static Correlation in the Band Structure of High
  Temperature Superconductors","The Journal of Physical Chemistry, in press. References and figures
  updated. See www.firstprinciples.com for more information related to this
  work",,"10.1021/jp990816q",,"cond-mat.supr-con cond-mat.str-el",,"  Recently we presented a new band structure for La(2-x)Sr(x)CuO(4) and other
high temperature superconductors in which a second narrow band was seen to
cross the primary band at the Fermi level. The existence of this second Fermi
level band is in complete disagreement with the commonly accepted LDA band
structure. Yet it provided a crucial piece of physics which led to an
explanation for superconductivity and other unusual phenomena in these
materials. In this work we present details as to the nature of the failure of
conventional methods in deriving the band structure of the cuprates. In
particular, we use a number of chemical analogues to describe the problem of
static correlation in the band structure calculations and show how this can be
corrected with the predictable outcome of a Fermi level band crossing.
","[{""version"":""v1"",""created"":""Fri, 5 Mar 1999 22:26:12 GMT""},{""version"":""v2"",""created"":""Thu, 2 Sep 1999 20:47:13 GMT""}]","2016-09-28"
"cond-mat/9903099","J. M. Pitarke","I. Campillo, A. Rubio, and J. M. Pitarke","Ab initio calculations of the dynamical response of copper","4 pages, 4 figures, to appear in Phys. Rev. B","Phys. Rev. B 59, 12188 (1999)","10.1103/PhysRevB.59.12188",,"cond-mat.mtrl-sci",,"  The role of localized $d$-bands in the dynamical response of Cu is
investigated, on the basis of {\em ab initio} pseudopotential calculations. The
density-response function is evaluated in both the random-phase approximation
(RPA) and a time-dependent local-density functional approximation (TDLDA). Our
results indicate that in addition to providing a polarizable background which
lowers the free-electron plasma frequency, d-electrons are responsible, at
higher energies and small momenta, for a double-peak structure in the dynamical
structure factor. These results are in agreement with the experimentally
determined optical response of copper. We also analyze the dependence of
dynamical scattering cross sections on the momentum transfer.
","[{""version"":""v1"",""created"":""Fri, 5 Mar 1999 16:03:44 GMT""}]","2009-10-31"
"cond-mat/9903100",,"M.A. Martin-Delgado, G. Sierra and R.M. Noack","The Density Matrix Renormalization Group applied to single-particle
  Quantum Mechanics","REVTEX file, 21 pages, 3 Tables, 4 eps Figures",,"10.1088/0305-4470/32/33/306",,"cond-mat.str-el hep-th",,"  A simplified version of White's Density Matrix Renormalization Group (DMRG)
algorithm has been used to find the ground state of the free particle on a
tight-binding lattice. We generalize this algorithm to treat the tight-binding
particle in an arbitrary potential and to find excited states. We thereby solve
a discretized version of the single-particle Schr\""odinger equation, which we
can then take to the continuum limit. This allows us to obtain very accurate
results for the lowest energy levels of the quantum harmonic oscillator,
anharmonic oscillator and double-well potential. We compare the DMRG results
thus obtained with those achieved by other methods.
","[{""version"":""v1"",""created"":""Fri, 5 Mar 1999 16:04:22 GMT""}]","2009-10-31"
"cond-mat/9903101","Claude Bourbonnais","C. Bourbonnais (Universite de Sherbrooke, Quebec, Canada) and D.
  Jerome (Lab. de Physique des Solides, Orsay, France)","The normal phase of quasi-one-dimensional organic superconductors","Latex, 26 pages, 27 eps figures, ICSM.sty. Review paper to be
  pubished in Proc. of Int. Conf. of Science and Technology of Synthetic Metals
  (ICSM'98), Elsevier 1999","in ""Advances in Synthetic Metals, Twenty years of Progress in
  Science and Technology"", edited by P. Bernier, S. Lefrant, and G. Bidan
  (Elsevier, New York, 1999), pp. 206-301.",,"CRPS 99-03","cond-mat.str-el",,"  We review the properties of quasi-one-dimensional organic superconductors:
the Bechgaard salts and their sulfur analogs in their normal phase precursor
tolong-range order. We go through the main observations made in the normal
state of these systems at low magnetic field and tackle the issue of their
description under the angles of the Fermi and Luttinger liquid pictures.
","[{""version"":""v1"",""created"":""Fri, 5 Mar 1999 17:11:52 GMT""}]","2007-05-23"
