"astro-ph/9903120","Marcio Catelan","F. Grundahl (1,2), M. Catelan (3), W. B. Landsman (3,4), P. B. Stetson
  (1), M. I. Andersen (5) ((1) Dominion Astrophysical Observatory; (2)
  University of Victoria; (3) NASA Goddard Space Flight Center; (4) Raytheon
  ITSS; (5) Nordic Optical Telescope)","Hot Horizontal-Branch Stars: The Ubiquitous Nature of the ""Jump"" in
  Stromgren u, Low Gravities, and the Role of Radiative Levitation of Metals","ApJ, Main Journal, accepted. Contains several changes and updates","Astrophys.J.524:242-261,1999","10.1086/307807",,"astro-ph",,"  A ""jump"" in the BHB distribution in the V, u-y CMD was recently detected in
the GC M13. It is morphologically best characterized as a discontinuity in u,
u-y, with stars in the range 11,500<Teff(K)<20,000 deviating systematically
from (in the sense of appearing brighter and/or hotter than) canonical ZAHBs.
We present u, y photometry of 14 GCs obtained with 3 different telescopes
(Danish, NOT, HST) and demonstrate that the u-jump is present in every GC whose
HB extends beyond 11,500K, irrespective of [Fe/H], mixing history on the RGB,
and other GC parameters. We suggest that the u-jump is a ubiquitous feature,
intrinsic to all HB stars hotter than 11,500K. We draw a parallel between the
ubiquitous nature of the u-jump and the problem of low measured gravities among
BHB stars. We note that the ""logg-jump"" occurs over the same temperature range
as the u-jump, and that it occurs in every metal-poor GC for which gravities
have been determined--irrespective of [Fe/H], mixing history on the RGB, or any
other GC parameters. Furthermore, the u-jump and the logg-jump are connected on
a star-by-star basis. The two are likely different manifestations of the same
physical phenomenon. We present a framework which may simultaneously account
for the u-jump and the logg-jump. Reviewing spectroscopic data for several
field BHB stars, as well as two BHB stars in the GC NGC 6752, we find evidence
that radiative levitation of heavy elements takes place at Teff>11,500 K,
dramatically enhancing their abundances in the atmospheres of BHB stars in the
""critical"" temperature region. Model atmospheres taking diffusion effects into
account are badly needed, and will likely lead to better overall agreement
between canonical evolutionary theory and observations for BHB stars.
","[{""version"":""v1"",""created"":""Tue, 9 Mar 1999 20:04:16 GMT""},{""version"":""v2"",""created"":""Fri, 7 May 1999 22:38:40 GMT""}]","2009-10-05"
"astro-ph/9903124","Guenter Sigl","Martin Lemoine (DARC, Meudon, France), Guenter Sigl (DARC, Meudon,
  France and Univ. of Chicago, USA), Peter Biermann (MPI fuer Radioastronomie,
  Bonn, Germany)","Supercluster Magnetic Fields and Anisotropy of Cosmic Rays above
  10**(19) eV","4 latex pages, 4 postscript figures included, uses revtex.sty in two
  column format and epsf.sty, submitted to Physical Review Letters. Links and
  further material at http://astro.uchicago.edu/home/web/sigl/r2e.html",,,,"astro-ph",,"  We predict energy spectra and angular distributions of nucleons above
10**(19) eV that originate from sources distributed in the Local Supercluster,
which is also supposed to contain a large scale magnetic field of strength
between 0.05 and 0.5 micro Gauss. We show that this model can explain all
present-day features of ultra-high energy cosmic rays, at least for field
strengths close to 0.5 micro Gauss. The large-scale anisotropy and the
clustering predicted by this scenario will allow strong discrimination against
other models with next generation experiments.
","[{""version"":""v1"",""created"":""Tue, 9 Mar 1999 19:08:30 GMT""}]","2007-05-23"
"astro-ph/9903132","Istvan Szapudi","Istvan Szapudi and Alexander S. Szalay","The Variance of a New Class of N-point Correlation Estimators in Poisson
  and Binomial Point Processes","11 pages, submitted to Journal of Applied Probability",,,,"astro-ph",,"  We describe a set of new estimators for the N-point correlation functions of
point processes. The variance of these estimators is calculated for the Poisson
and binomial cases. It is shown that the variance of the unbiased estimator
converges to the continuum value much faster than with any previously used
alternative, all terms with slower convergence exactly cancel. We compare our
estimators with Ripley's $\tK_0$ and $\tK_2$.
","[{""version"":""v1"",""created"":""Tue, 9 Mar 1999 16:12:56 GMT""}]","2007-05-23"
"astro-ph/9903133","A. J. Young","A. J. Young, C. S. Crawford, A. C. Fabian, W. N. Brandt and P. T.
  O'Brien","The optical variability of the narrow line Seyfert 1 galaxy IRAS
  13224-3809","5 pages with 8 postscript figures. Accepted for publication in MNRAS",,"10.1046/j.1365-8711.1999.02599.x",,"astro-ph",,"  We report on a short optical monitoring programme of the narrow-line Seyfert
1 Galaxy IRAS 13224-3809. Previous X-ray observations of this object have shown
persistent giant variability. The degree of variability at other wavelengths
may then be used to constrain the conditions and emission processes within the
nucleus. Optical variability is expected if the electron population responsible
for the soft X-ray emission is changing rapidly and Compton-upscattering
infrared photons in the nucleus, or if the mechanism responsible for X-ray
emission causes all the emission processes to vary together. We find that there
is no significant optical variability with a firm upper limit of 2 per cent and
conclude that the primary soft X-ray emission region produces little of the
observed optical emission. The X-ray and optical emission regions must be
physically distinct and any reprocessing of X-rays into the optical waveband
occurs some distance from the nucleus. The lack of optical variability
indicates that the energy density of infrared radiation in the nucleus is at
most equal to that of the ultraviolet radiation since little is upscattered
into the optical waveband. The extremely large X-ray variability of IRAS
13224-3809 may be explained by relativistic boosting of more modest variations.
Although such boosting enhances X-ray variability over optical variability,
this only partially explains the lack of optical variability.
","[{""version"":""v1"",""created"":""Tue, 9 Mar 1999 16:25:35 GMT""}]","2009-10-31"
"astro-ph/9903134","Dmitri Khokhlov","D.L. Khokhlov","Internal structure of the star in the fractal universe and solar
  neutrino puzzle","This paper has been withdrawn",,,,"astro-ph",,"  This paper has been withdrawn by the author due to the presented idea is
wrong.
","[{""version"":""v1"",""created"":""Tue, 9 Mar 1999 16:37:05 GMT""},{""version"":""v2"",""created"":""Fri, 5 Dec 2003 17:05:14 GMT""}]","2007-05-23"
"astro-ph/9903135","Mouhcine Mustapha","A. Lancon, M. Mouhcine, M. Fioc, D. Silva","How to search for AGB stars in the near-IR post-starburst spectra","4 pages, 3figures, accepted for publication in A&A Letters",,,,"astro-ph",,"  Based on evolutionary spectral synthesis models explicitly including the
spectra of variable AGB stars, we select near-IR features that dentify the
strong O-rich or C-rich AGB contributions to the near-IR light of
post-starburst populations. AGB temperature scales and lifetimes remain major
sources of uncertainties. We discuss applications and suggest massive
post-starburst clusters as prime targets for observational tests.
","[{""version"":""v1"",""created"":""Tue, 9 Mar 1999 17:47:19 GMT""}]","2007-05-23"
"astro-ph/9903136","Bruce Elmegreen","B. G. Elmegreen (1), Y.N. Efremov (2), R.E. Pudritz (3), H. Zinnecker
  (4) ((1) IBM Watson, NY (2) MSU, Moscow (3) McMaster U, Hamilton Ontario (4)
  Astrophysikalisches Institut Potsdam)","Observations and Theory of Star Cluster Formation","36 pages, 5 figures, To be published in Protostars and Planets IV,
  eds. V. G. Mannings, A. P. Boss, and S. S. Russell, from the conference at
  Santa Barbara, CA, July 6-11, 1998",,,"IBM Log 96271","astro-ph",,"  Young stars form on a wide range of scales, producing aggregates and clusters
with various degrees of gravitational self-binding. The loose aggregates have a
hierarchical structure in both space and time that resembles interstellar
turbulence, suggesting that these stars form in only a few turbulent crossing
times with positions that map out the previous gas distribution. Dense
clusters, on the other hand, are often well mixed, as if self-gravitational
motion has erased the initial fine structure. Nevertheless, some of the
youngest dense clusters also show sub-clumping, so it may be that all stellar
clustering is related to turbulence. Some of the densest clusters may also be
triggered. The evidence for mass segregation of the stars inside clusters is
reviewed, along with various explanations for this effect. Other aspects of the
theory of cluster formation are reviewed as well, including many specific
proposals for cluster formation mechanisms. The conditions for the formation of
bound clusters are discussed. Critical star formation efficiencies can be as
low as 10% if the gas removal process is slow and the stars are born at
sub-virial speeds. Environmental conditions, particularly pressure, may affect
the fraction and masses of clusters that end up bound. Globular clusters may
form like normal open clusters but in conditions that prevailed during the
formation of the halo and bulge, or in interacting and starburst galaxies
today. Various theories for the formation of globular clusters are summarized.
","[{""version"":""v1"",""created"":""Tue, 9 Mar 1999 18:33:53 GMT""}]","2007-05-23"
"astro-ph/9903137","Luigi Toffolatti","C.Burigana (1), D.Maino (2), N.Mandolesi (1), F.Villa (1),
  L.Valenziano (1), M.Bersanelli (3), L.Danese (2), L.Toffolatti (4,5) and
  F.Arg\""ueso (6) ((1) Istituto TeSRE, CNR, Bologna, Italy; (2) SISSA --
  International School for Advanced Studies, Trieste, Italy; (3) IFC, CNR,
  Milano, Italy; (4) Osservatorio Astronomico di Padova, Italy; (5)
  Departamento de Fisica, Universidad de Oviedo, Spain; (6) Departamento de
  Matematicas, Universidad de Oviedo, Spain)","On Planck simulations: towards `2-nd order' analyses","6 pages, Latex (use epsfig.sty); Astrophys. Lett & Comm, in press.
  Proc. of the Conference: ""The Cosmic Microwave Background and the Planck
  Mission"", Santander, Spain, 22-25 June 1998",,,,"astro-ph",,"  We simulate Planck observations by adopting a detailed model of the microwave
sky including monopole, dipole, anisotropies of the cosmic microwave background
(CMB) and galactic and extragalactic foregrounds. We estimate the impact of
main beam optical aberrations on CMB anisotropy measurements in presence of
extragalactic source fluctuations and we discuss the main implications for the
Planck telescope design. By analysing the dipole pattern, we quantify the
Planck performance in the determination of CMB spectral distortion parameters
in presence of foreground contaminations.
","[{""version"":""v1"",""created"":""Tue, 9 Mar 1999 19:03:41 GMT""}]","2007-05-23"
"astro-ph/9903138","Laszlo L. Kiss","J. Vinko, L.L. Kiss, J. Thomson, G. Furesz, W. Lu, G. Kaszas, Z. Balog","Early-time spectroscopic observations of SN 1998aq in NGC 3982","5 pages, 5 figures, accepted for publication in Astronomy &
  Astrophysics",,,,"astro-ph",,"  Medium resolution spectroscopic observations of SN 1998aq made in April-May,
1998, are presented. We confirm its Type Ia classification based on the
prominent Si II 6355 A line and other features similar to SNe Ia. No
significant sign of hydrogen Balmer-alpha line was seen in high-resolution
spectra taken at 8 days before maximum. Preliminary estimate of reddening and
distance modulus, based on the correlation between the line depth ratio of two
Si II features around 6000 A and BVRI light curves of Type Ia SNe, is
presented. Moreover, H-alpha emission from the core of the Seyfert 2 type host
galaxy NGC 3982 has also been detected.
","[{""version"":""v1"",""created"":""Tue, 9 Mar 1999 19:36:58 GMT""}]","2009-09-25"
"astro-ph/9903139","Piero Madau","Paolo Tozzi, Piero Madau, Avery Meiksin, and Martin J. Rees","Radio Signatures of HI at High Redshift: Mapping the End of the ``Dark
  Ages''","LateX, 19 pages, 5 figures, significantly revised version to be
  published in the ApJ",,"10.1086/308196",,"astro-ph",,"  The emission of 21-cm radiation from a neutral intergalactic medium (IGM) at
high redshift is discussed in connection with the thermal and ionization
history of the universe. The physical mechanisms that make such radiation
detectable against the cosmic microwave background include Ly_alpha coupling of
the hydrogen spin temperature to the kinetic temperature of the gas and
preheating of the IGM by the first generation of stars and quasars. Three
different signatures are investigated in detail: (a) the fluctuations in the
redshifted 21-cm emission induced by the gas density inhomogeneities that
develop at early times in cold dark matter (CDM) dominated cosmologies; (b) the
sharp absorption feature in the radio sky due to the rapid rise of the Ly_alpha
continuum background that marks the birth of the first UV sources in the
universe; and (c) the 21-cm emission and absorption shells that are generated
on several Mpc scales around the first bright quasars. Future radio
observations with projected facilities like the Giant Metrewave Radio Telescope
and the Square Kilometer Array may shed light on the power spectrum of density
fluctuations at z>5, and map the end of the ""dark ages"", i.e. the transition
from the post-recombination universe to one populated with radiation sources.
","[{""version"":""v1"",""created"":""Tue, 9 Mar 1999 22:26:34 GMT""},{""version"":""v2"",""created"":""Fri, 16 Jul 1999 18:15:31 GMT""}]","2009-10-31"
"astro-ph/9903140","Nahum Arav","Nahum Arav, Robert H. Becker, Sally A. Laurent-Muehleisen, Michael D.
  Gregg, Richard L. White, Martijn de Kool","What Determines the Depth of BALs? Keck HIRES Observations of BALQSO
  1603+300","13 pages, 2 figures, accepted for publication in ApJ","Astrophys.J.524:566-571,1999","10.1086/307841",,"astro-ph",,"  We find that the depth and shape of the broad absorption lines (BALs) in
BALQSO 1603+3002 are determined largely by the fraction of the emitting source
which is covered by the BAL flow. In addition, the observed depth of the BALs
is poorly correlated with their real optical depth. The implication of this
result is that abundance studies based on direct extraction of column densities
from the depth of the absorption troughs are unreliable. Our conclusion is
based on analysis of unblended absorption features of two lines from the same
ion (in this case the Si IV doublet), which allows unambiguous separation of
covering factor and optical depth effects. The complex morphology of the
covering factor as a function of velocity suggests that the BALs are produced
by several physically separated outflows. The covering factor is ion dependent
in both depth and velocity width. We also find evidence that in BALQSO
1603+3002 the flow does not cover the broad emission line region.
","[{""version"":""v1"",""created"":""Tue, 9 Mar 1999 23:17:55 GMT""}]","2010-10-28"
"astro-ph/9903141","Greg Madejski, NASA/Goddard","Greg M. Madejski (NASA/Goddard)","Black holes in Active Galactic Nuclei: observations","To appear in ``Theory of Black Hole Accretion Disks'' (Cambridge
  University Press), 21 pages, 9 figures",,,,"astro-ph",,"  This paper summarizes the observations which provide the best evidence for
the presence of black holes in active galactic nuclei. This includes: X-ray
variability; kinematical studies using optical emission lines as well as the
distribution of megamaser spots; and the shape of the Fe K$\alpha$ X-ray
emission line. It also presents the current status of our understanding of
jet-dominated active galaxies (blazars), and briefly reviews the currently
popular AGN ``Unification Schemes.''
","[{""version"":""v1"",""created"":""Wed, 10 Mar 1999 00:21:26 GMT""}]","2007-05-23"
"astro-ph/9903142","Amy Barger","A.J. Barger, L.L. Cowie, I. Smail, R.J. Ivison, A.W. Blain, J.-P.
  Kneib","Redshift Distribution of the Faint Submillimeter Galaxy Population","10 pages, accepted by The Astronomical Journal for the June 1999
  issue",,"10.1086/300890",,"astro-ph",,"  We present a Keck II LRIS spectroscopic follow-up study of the possible
optical counterparts to a flux-limited sample of galaxies selected from an
850-micron survey of massive lensing clusters using the SCUBA bolometer array
on the JCMT. These sources represent a population of luminous dusty galaxies
responsible for the bulk of the 850-micron background detected by COBE and thus
for a substantial fraction of the total far-infrared emission in the Universe.
We present reliable redshifts for 20 galaxies and redshift limits for a further
4 galaxies selected from the error-boxes of 14 submm sources. Two other submm
detections in the sample have no obvious optical counterparts, and the final
submm source was only identified from imaging data after the completion of our
spectroscopic observations. The optical identifications for 4 of the submm
sources have been confirmed through either their detection in CO at
mm-wavelengths (two pairs of galaxies at z=2.55 and z=2.80) or from the
characteristics of their spectral energy distributions (two of the central cD
galaxies in the lensing clusters). Plausible arguments based on the optical
spectral properties (starburst or AGN signatures) of the counterparts allow us
to identify a further two likely counterparts at z=1.06 and 1.16. For the
remaining 8 cases, it is not always clear which, if any, of the optical sources
identified are the true counterparts. Possible counterparts for these have
redshifts ranging from z=0.18 to z=2.11. Working with the current
identifications, we suggest that the majority of the extragalactic background
light in the submm is emitted by sources at z<3 and hence that the peak
activity in highly-obscured sources (both AGN and starbursts) lies at
relatively modest redshifts. (Abridged)
","[{""version"":""v1"",""created"":""Wed, 10 Mar 1999 01:30:55 GMT""}]","2016-08-30"
"astro-ph/9903143","Daniel Friedli","D. Friedli (Geneva Observatory)","Birth, Aging, and Death of Galactic Bars","12 pages with 3 figures. To be published in the proceedings of ""The
  Evolution of Galaxies on Cosmological Timescales"" ed. J.E. Beckman, & T.J.
  Mahoney, ASP Conf. Ser",,,,"astro-ph",,"  The life of disk galaxies is likely punctuated with the birth (spontaneous or
induced), the aging (quick or slow), and the death (sudden or progressive) of
bars. These events are responsible for various major changes of the galaxy
which occur both on dynamical ($\sim$0.1 Gyr) and cosmological ($\sim$10 Gyr)
time-scales, as well as both on large- ($\ga$10 kpc) and small-scales ($\la$1
kpc). These modifications affect the morphology, the orbital structure, the
dynamics, the star formation and central fueling rates, the abundance profiles,
etc. As a consequence, remarkable galaxy metamorphoses within the Hubble
sequence can be observed. The formation and the fate of gaseous bars are also
briefly examined.
","[{""version"":""v1"",""created"":""Wed, 10 Mar 1999 11:03:54 GMT""}]","2007-05-23"
"astro-ph/9903144","Mercedes Molla","Mercedes Molla, Jean-Rene Roy","Chemical evolution of low mass disc galaxies","5 pages,5 figures, to be published in the proceedings of the ESO
  ""Chemical Evolution from Zero to High Redshift"" workshop, Eds. M.Rosa and
  J.R. Walsh (Springer-Verlag)","ESP Astrphysics Simposia ""Chemical Evolution from Zero to High
  Redshift"", Eds. J. R. Walsh, M. R. Rosa, pg. 154",,,"astro-ph",,"  We show that the multiphase chemical evolution model reproduces the
correlations obtained along the spiral sequence, dwarf galaxies included.
However the apparent spatial chemical uniformity observed in some irregular
galaxies cannot be reproduced with it. An evolutionary model has been developed
and tested to explain flat gradients. Preliminary results, obtained with a new
code including supernova winds and radial flows, suggest that radial flows are
probably responsably for this uniformity
","[{""version"":""v1"",""created"":""Wed, 10 Mar 1999 11:16:12 GMT""}]","2007-05-23"
"astro-ph/9903145","Luis Anchordoqui","L. A. Anchordoqui, G. E. Romero, J. A. Combi","Heavy nuclei at the end of the cosmic ray spectrum?","Revised version, to appear in Physical Review D","Phys.Rev.D60:103001,1999","10.1103/PhysRevD.60.103001",,"astro-ph",,"  We provide an account of the possible acceleration of iron nuclei up to
energies $\sim300$ EeV in the nearby, metally-rich starburst galaxy NGC 253. It
is suggested that particles can escape from the nuclear region with energies of
$\sim10^{15}$ eV and then could be reaccelerated at the terminal shock of the
galactic superwind generated by the starburst, avoiding in this way the
photodisintegration expected if the nuclei were accelerated in the central
region of high photon density. We have also made estimates of the expected
arrival spectrum, which displays a strong dependency with the energy cutoff at
the source.
","[{""version"":""v1"",""created"":""Wed, 10 Mar 1999 11:53:15 GMT""},{""version"":""v2"",""created"":""Thu, 11 Mar 1999 21:47:14 GMT""},{""version"":""v3"",""created"":""Mon, 6 Sep 1999 14:57:54 GMT""}]","2009-12-30"
"astro-ph/9903146","Youichi Ohyama","Youichi Ohyama (1), Yoshiaki Taniguchi (1), J. E. Hibbard (2), &
  William D. Vacca (3) ((1) Astronomical Institute, Tohoku University, (2)
  National Radio Astronomy Observatory, (3) Institute for Astronomy, University
  of Hawaii)","Redshifts of Galaxies Around Arp 220 and Serendipitous Discovery of
  Three Star-Forming Dwarf Galaxies at Redshift $z \sim$ 0.5","12 pages including 6 tables and 5 figures. Accepted for publication
  in AJ",,"10.1086/300903",,"astro-ph",,"  We present redshift measurements of four faint galaxies around the archetypal
ultraluminous infrared galaxy Arp 220. These galaxies have significantly higher
redshifts ($z \sim$ 0.036 -- 0.091) than that of Arp 220 ($z \simeq 0.018$).
Therefore, we conclude that they are background objects not physically related
to Arp 220. Three of these faint galaxies located to the south of Arp 220 are a
group of galaxies (or the brightest members in a cluster of galaxies) at $z
\simeq 0.09$, as suggested by Heckman et al. [1996, ApJ, 457, 616] on the basis
of their associated soft X-ray emission.
  We also report the serendipitous discovery of three additional galaxies at
redshift $z \sim 0.5$, found along one of the slit positions. All three
galaxies exhibit an [O ii] \lambda 3727 emission line. The spectrum of the
brightest galaxy ($m_R \simeq 24.4$) shows other strong emission lines: Mg ii
\lambda 2798, H \beta, [O iii] \lambda 4959, and [O iii] \lambda 5007. The
emission-line properties of these galaxies as well as their intrinsically low
luminosities ($M_R \geq -18.4$) indicate that they are star-forming dwarf
galaxies.
","[{""version"":""v1"",""created"":""Wed, 10 Mar 1999 12:54:12 GMT""},{""version"":""v2"",""created"":""Thu, 11 Mar 1999 08:08:09 GMT""}]","2009-10-31"
"astro-ph/9903147","Harald Krueger","H. Kr\""uger, E. Gr\""un, A. Heck, S. Lammers","Analysis of the sensor characteristics of the Galileo dust detector with
  collimated Jovian dust stream particles","Planetary and Space Science, accepted, 11 figures, 3 tables",,"10.1016/S0032-0633(99)00027-6",,"astro-ph",,"  The Dust Detector System onboard Galileo records dust impacts in the Jupiter
system. Impact events are classified into four quality classes. Class 3 -- our
highest quality class -- has always been noise-free and, therefore, contains
only true dust impacts. Depending on the noise environment, class 2 are dust
impacts or noise. Within $20 R_J$ from Jupiter (Jupiter radius, $R_J = 71,492
km$) class 2 shows clear indications for contamination by noise. We analyse the
dust data from Galileo's prime Jupiter mission (1996 and 1997), separate dust
impacts from noise events and derive a complete denoised set of Galileo dust
data (class 2 and class 3). Collimated streams of nanometer-sized dust
particles which have been detected throughout the Jovian system (Gr\""un et al.
1998, JGR, 103, 20011-20022) are used to analyse the sensitive area and the
field of view of the dust detector itself. The sensitive area for stream
particles which trigger class 3 events is $110 \pm 37 cm^2$. This is almost a
factor of ten smaller than the total sensitive area for class 2 impacts (1,000
cm^2). Correspondingly, the field of view of the detector for class 3 stream
particles is reduced from $140^{\circ}$ to $96^{\circ}$. The magnetometer boom
and other instruments on board Galileo cause a significant shadowing of the
field of view of the dust sensor. Our analysis is supplementary to ground
calibrations of the dust instrument because the low masses and high speeds of
the stream particles could not be achieved in the laboratory. Our new results
have important consequences for the analysis of dust in the Jupiter system.
","[{""version"":""v1"",""created"":""Wed, 10 Mar 1999 12:46:53 GMT""}]","2009-10-31"
