"hep-ph/9903307","Francois Gelis","Patrick Aurenche (LAPTH, Annecy), Francois Gelis (LAPTH, Annecy),
  Randy Kobes (Winnipeg Univ), Haitham Zaraket (LAPTH, Annecy)","Two-loop Compton and annihilation processes in thermal QCD","Latex, 24 pages, postscript figures included with the package
  graphics","Phys.Rev. D60 (1999) 076002","10.1103/PhysRevD.60.076002","LAPTH-719/99, WIN-99/02","hep-ph",,"  We calculate the Compton and annihilation production of a soft static lepton
pair in a quark-gluon plasma in the two-loop approximation. We work in the
context of the effective perturbative expansion based on the resummation of
hard thermal loops. Double counting is avoided by subtracting appropriate
counterterms. It is found that the two-loop diagrams give contributions of the
same order as the one-loop diagram. Furthermore, these contributions are
necessary to obtain agreement with the naive perturbative expansion in the
limit of vanishing thermal masses.
","[{""version"":""v1"",""created"":""Wed, 10 Mar 1999 10:40:46 GMT""}]","2009-10-31"
"hep-ph/9903308","Manfred Lindner","K. Dick, M. Freund, M. Lindner and A. Romanino","CP-violation in neutrino oscillations","30 pages, 6 figures. Final version to appear in Nuclear Physics B","Nucl.Phys. B562 (1999) 29-56","10.1016/S0550-3213(99)00486-1","TUM-HEP-345/99, MPI-PhT/9907, OUTP-99-15P","hep-ph hep-ex",,"  We study in a quantitative way CP-violating effects in neutrino oscillation
experiments in the light of current and future data. Different scenarios with
three and four neutrinos are worked out in detail including matter effects in
long baseline experiments and it is shown that in some cases CP-violating
effects could affect the analysis of a possible measurement. In particular in
the three neutrino case we find that the effects can be larger than expected,
at least in long-baseline $\nu_\mu\to\nu_e$. Moreover, measuring these effects
could give useful information on the solar oscillation frequency. In four
neutrino scenarios large effects are possible both in the $\nu_\mu\to\nu_\tau$
and $\nu_\mu\to\nu_e$ channels of long-baseline experiments, whereas
short-baseline experiments are affected only marginally.
","[{""version"":""v1"",""created"":""Wed, 10 Mar 1999 13:06:47 GMT""},{""version"":""v2"",""created"":""Tue, 20 Apr 1999 14:25:28 GMT""},{""version"":""v3"",""created"":""Fri, 17 Sep 1999 13:31:04 GMT""}]","2009-10-31"
"hep-ph/9903309","Charanjit S. Aulakh","Charanjit Singh Aulakh","Supersymmetric Unification in the Light of Neutrino Mass","16 pages, REVTEX. Invited talk presented at XIII DAE Symposium on
  High Energy Physics, Chandigarh, December 1998","Pramana 54:639-659,2000","10.1007/s12043-000-0157-3","PANPHYS-PTH-9922","hep-ph",,"  We argue that with the discovery of neutrino mass effects at Super-Kamiokande
there is a clear logical chain leading from the Standard Model through the MSSM
and the recently developed Minimal Left Right Supersymmetric models with a
renormalizable see-saw mechanism for neutrino mass to Left Right symmetric SUSY
GUTS : in particular, SO(10) and $SU(2)_L \times SU(2)_R\times SU(4)_c$. The
progress in constructing such GUTS explicitly is reviewed and their
testability/falsifiability by proton decay measurements emphasized.
","[{""version"":""v1"",""created"":""Wed, 10 Mar 1999 14:14:46 GMT""}]","2011-02-09"
"hep-ph/9903310","John LoSecco","J.M. LoSecco (University of Notre Dame)","Possible Sources of a Transient Natural Neutrino Flux","6 pages including 2 tables",,,"UNDPDK-99-01","hep-ph astro-ph hep-ex",,"  Recent observations of variability in the ``atmospheric neutrino'' rate place
constraints on possible explanations of the atmospheric neutrino anomaly. Many
proposed solutions to the problem are static and can not be adapted to the
temporal dependence observed. Nonatmospheric sources may be needed to explain
the variations.
","[{""version"":""v1"",""created"":""Wed, 10 Mar 1999 14:46:55 GMT""}]","2007-05-23"
"hep-ph/9903311","Stephan Paul","Stephan Paul","Heavy Baryons - Different Facets of Experimental results","16 pages, tex and eps-pictures","Proceedings of Baryon98",,,"hep-ph",,"  This paper reviews the experimental status of heavy baryons. It covers the
aspec ts of production, spectroscopy and decay presenting recent results
obtained in this fi eld. It closes with an outlook on further work on and with
heavy baryons and their po ssible role for other measurements.
","[{""version"":""v1"",""created"":""Wed, 10 Mar 1999 15:54:50 GMT""}]","2007-05-23"
"hep-ph/9903312","Loretta Robinette","Pervez Hoodbhoy","Nucleon-Quarkonium Elastic Scattering and the Gluon Contribution to
  Nucleon Spin","4 pages, no figures. Author's e-mail: hoodbhoy@isb.pol.com.pk","Phys.Rev.Lett. 82 (1999) 4985-4987","10.1103/PhysRevLett.82.4985",,"hep-ph",,"  It is shown that the amplitude for the scattering of a heavy quarkonium
system from a nucleon near threshold is completely determined by the fraction
of angular momentum, as well as linear momentum, carried by gluons in the
nucleon. A form for the quarkonium-nucleon non-relativistic potential is
derived.
","[{""version"":""v1"",""created"":""Wed, 10 Mar 1999 15:57:19 GMT""}]","2009-10-31"
"hep-th/9903077","Carmelo Perez Martin","C.P. Martin and D. Sanchez-Ruiz (Departamento de Fisica Teorica I,
  Universidad Complutense de Madrid, Spain)","The One-loop UV Divergent Structure of U(1) Yang-Mills Theory on
  Noncommutative R^4","8 pages. A missing complex ""i"" is included in the field strength and
  the divergent contributions corrected accordingly. As a result the model
  turns out to be asymptotically free","Phys.Rev.Lett. 83 (1999) 476-479","10.1103/PhysRevLett.83.476","FT/UCM-15-99","hep-th",,"  We show that U(1) Yang-Mills theory on noncommutative R^4 can be renormalized
at the one-loop level by multiplicative dimensional renormalization of the
coupling constant and fields of the theory. We compute the beta function of the
theory and conclude that the theory is asymptotically free. We also show that
the Weyl-Moyal matrix defining the deformed product over the space of functions
on R^4 is not renormalized at the one-loop level.
","[{""version"":""v1"",""created"":""Tue, 9 Mar 1999 17:57:02 GMT""},{""version"":""v2"",""created"":""Wed, 10 Mar 1999 16:11:17 GMT""}]","2009-10-31"
"hep-th/9903078","Marco M. Caldarelli","Marco M. Caldarelli and Dietmar Klemm","M-Theory and Stringy Corrections to Anti-de Sitter Black Holes and
  Conformal Field Theories","29 pages, revtex, 6 figures using epsfig, typos corrected, 1
  reference added, final version to appear in Nucl. Phys. B","Nucl.Phys. B555 (1999) 157-182","10.1016/S0550-3213(99)00342-9","UTF 431","hep-th",,"  We consider black holes in anti-de Sitter space AdS_{p+2} (p = 2,3,5), which
have hyperbolic, flat or spherical event horizons. The $O(\alpha'^3)$
corrections (or the leading corrections in powers of the eleven-dimensional
Planck length) to the black hole metrics are computed for the various
topologies and dimensions. We investigate the consequences of the stringy or
M-theory corrections for the black hole thermodynamics. In particular, we show
the emergence of a stable branch of small spherical black holes. We obtain the
corrected Hawking-Page transition temperature for black holes with spherical
horizons, and show that for p=3 this phase transition disappears at a value of
$\alpha'$ considerably smaller than that estimated previously by Gao and Li.
Using the AdS/CFT correspondence, we determine the $S^1 x S^3$ N=4 SYM phase
diagram for sufficiently large `t Hooft coupling, and show that the critical
point at which the Hawking-Page transition disappears (the correspondence point
of Horowitz-Polchinski), occurs at $g_{YM}^2N \approx 20.5$. The d=4 and d=7
black hole phase diagrams are also determined, and connection is made with the
corresponding boundary CFTs. Finally, for flat and hyperbolic horizons, we show
that the leading stringy or M-theory corrections do not give rise to any phase
transition. For horizons compactified to a torus $T^p$ or to a quotient of
hyperbolic space, $H^p/\Gamma$, we comment on the effects of light winding
modes.
","[{""version"":""v1"",""created"":""Tue, 9 Mar 1999 20:43:15 GMT""},{""version"":""v2"",""created"":""Wed, 10 Mar 1999 18:29:51 GMT""},{""version"":""v3"",""created"":""Wed, 7 Jul 1999 17:14:50 GMT""}]","2009-10-31"
"hep-th/9903079","Minic","D. Minic (USC)","Kinematics of $AdS_{5}/CFT_{4}$ Duality","7 pages, RevTeX. Talk given at DPF '99; UCLA, Jan. 7, 1999",,,,"hep-th",,"  We review the construction of the unitary supermultiplets of the
${\cal{N}}=8$ d=5 anti-de Sitter (AdS_5) superalgebra SU(2,2|4), which is the
symmetry group of the type IIB superstring theory on $AdS_5 \times S^5$, using
the oscillator method.
","[{""version"":""v1"",""created"":""Wed, 10 Mar 1999 06:52:44 GMT""}]","2007-05-23"
"hep-th/9903080","Gao Yi-hong","Yi-hong Gao","AdS/CFT Correspondence and Quotient Space Geometry","28 pages, Latex, no figures. Minor changes, version to appear in JHEP","JHEP 9904 (1999) 005","10.1088/1126-6708/1999/04/005",,"hep-th",,"  We consider a version of the $AdS_{d+1}/CFT_{d}$ correspondence, in which the
bulk space is taken to be the quotient manifold $AdS_{d+1} /\Gamma$ with a
fairly generic discrete group $\Gamma$ acting isometrically on $AdS_{d+1}$. We
address some geometrical issues concerning the holographic principle and the
UV/IR relations. It is shown that certain singular structures on the quotient
boundary ${\bf S}^{d}/\Gamma$ can affect the underlying physical spectrum. In
particular, the conformal dimension of the most relevant operators in the
boundary CFT can increase as $\Gamma$ becomes ``large''. This phenomenon also
has a natural explanation in terms of the bulk supergravity theory. The scalar
two-point function is computed using this quotient version of the AdS/CFT
correspondence, which agrees with the expected result derived from conformal
invariance of the boundary theory.
","[{""version"":""v1"",""created"":""Wed, 10 Mar 1999 08:16:25 GMT""},{""version"":""v2"",""created"":""Sun, 14 Mar 1999 08:33:32 GMT""},{""version"":""v3"",""created"":""Thu, 8 Apr 1999 01:55:02 GMT""}]","2009-10-31"
"hep-th/9903081","Takashi Yokono","Toshihiro Matsuo and Takashi Yokono","String creation in D6-brane background","11 pages, 1 figure, typos corrected","Mod.Phys.Lett.A14:1175-1182,1999","10.1142/S0217732399001267","OU-HET 314","hep-th",,"  The production of string charge during a crossing of certain oriented
D-branes is studied. We compute the string charge in the system of a probe
D2-brane and a background D6-brane by use of the equations of motion in the
ten-dimensions. We confirm the creation of string charge as inflow from the
background D6-brane.
","[{""version"":""v1"",""created"":""Wed, 10 Mar 1999 12:05:51 GMT""},{""version"":""v2"",""created"":""Tue, 13 Apr 1999 12:56:07 GMT""}]","2008-11-26"
"hep-th/9903082","Gesualdo Delfino","G. Delfino","First order phase transitions and integrable field theory. The dilute
  q-state Potts model","21 pages, latex","Nucl.Phys. B554 (1999) 537-551","10.1016/S0550-3213(99)00329-6",,"hep-th cond-mat",,"  We consider the two-dimensional dilute q-state Potts model on its first order
phase transition surface for 0<q\leq 4. After determining the exact scattering
theory which describes the scaling limit, we compute the two-kink form factors
of the dilution, thermal and spin operators. They provide an approximation for
the correlation functions whose accuracy is illustrated by evaluating the
central charge and the scaling dimensions along the tricritical line.
","[{""version"":""v1"",""created"":""Wed, 10 Mar 1999 12:21:45 GMT""}]","2009-10-31"
"hep-th/9903083","Vladimir Ritus","V.I.Ritus, (Lebedev Physical Institute)","Symmetries and causes of the coincidence of the radiation spectra of
  mirrors and charges in 1+1 and 3+1 spaces","18 pages, LaTeX","J.Exp.Theor.Phys. 87 (1998) 25-34; Zh.Eksp.Teor.Fiz. 114 (1998)
  46-62","10.1134/1.558784",,"hep-th",,"  This paper discusses the symmetry of the wave field that lies to the right
and left of a two-sided accelerated mirror in 1 + 1 space and satisfies a
single condition on it. The symmetry is accumulated in the Bogolyubov matrix
coefficients $\alpha$ and $\beta$ that connect the two complete sets of
solutions of the wave equations. The amplitudes of the quantum processes in the
right and left half-spaces are expressed in terms of $\alpha$ and $\beta$ and
are related to each other by transformation (12). Coefficient
$\beta_{\omega'\omega}^*$ plays the role of the source amplitude of a pair of
particles that are directed to opposite sides with frequencies $\omega$ and
$\omega'$ but that are in either the left or the right half-space as a
consequence of the reflection of one of them. Such an interpretation makes
$\beta_{\omega'\omega}^*$ observable and explains the equalities, given by Eq.
(1) and found earlier by Nikishov and author [Zh. Eksp. Teor. Fiz. 108, 1121
(1995)] and by author [Zh. Eksp. Teor. Fiz. 110, 526 (1996)] that the radiation
spectra of a mirror in 1+1 space coincide with those of charges in 3 + 1 space
by the fact that the moment of the pair emitted by the mirror coincide with the
spin of the single particle emitted by the charge.
","[{""version"":""v1"",""created"":""Wed, 10 Mar 1999 13:06:36 GMT""}]","2009-10-31"
"hep-th/9903084","Ferrari Franco","F. Ferrari (U. of Trento) and I. Lazzizzera (U. of Trento)","Toward a Field Theoretical Description of Topologically Linked Polymers","15 pages, 4 eps figures, revtex + psfig",,,,"hep-th cond-mat",,"  In this work a field theoretical model is constructed to describe the
statistical mechanics of an arbitrary number of topologically linked polymers
in the context of the analytical approach of Edwards. As an application, the
effects of the topological interactions are studied in the one loop
approximation. A natural way to include in the treatment also more
sophisticated link invariants than the Gauss linking number is outlined.
","[{""version"":""v1"",""created"":""Wed, 10 Mar 1999 13:53:30 GMT""}]","2007-05-23"
"hep-th/9903085","Massimo Porrati","M. Porrati and A. Starinets","RG Fixed Points in Supergravity Duals of 4-d Field Theory and
  Asymptotically AdS Spaces","9 pages, latex2e","Phys.Lett. B454 (1999) 77-83","10.1016/S0370-2693(99)00394-9","CERN-TH/99-49 NYU-TH/99/2/04","hep-th",,"  Recently, it has been conjectured that supergravity solutions with two
asymptotically AdS regions describe the RG flow of a 4-d field theory from a UV
fixed point to an interacting IR fixed point. In this paper we lend support to
this conjecture by showing that, in the UV (IR) limit, the two-point function
of a minimally-coupled scalar field depends only on the UV (IR) region of the
metric, asymptotic to AdS_5. This result is consistent with the interpretation
of the radial coordinate of Anti de Sitter space as an energy scale, and it may
provide an analog of the Callan-Symanzik equation for supergravity duals of
strongly coupled field theories.
","[{""version"":""v1"",""created"":""Wed, 10 Mar 1999 15:22:04 GMT""}]","2009-10-31"
"math-ph/9903019","Alexander Veselov","O.A.Chalykh, M.V.Feigin, A.P.Veselov","Multidimensional Baker-Akhiezer functions and Huygens' Principle","35 pages, LATEX, 2 figures included in graphicx. Submitted to
  Comm.Math.Phys. (Dec. 1998)",,"10.1007/s002200050836",,"math-ph math.AG math.MP",,"  A notion of rational Baker-Akhiezer (BA) function related to a configuration
of hyperplanes in C^n is introduced. It is proved that BA function exists only
for very special configurations (locus configurations), which satisfy certain
overdetermined algebraic system. The BA functions satisfy some algebraically
integrable Schrodinger equations, so any locus configuration determines such an
equation. Some results towards the classification of all locus configurations
are presented. This theory is applied to the famous Hadamard's problem of
description of all hyperbolic equations satisfying Huygens' Principle. We show
that in a certain class all such equations are related to locus configurations
and the corresponding fundamental solutions can be constructed explicitly from
the BA functions.
","[{""version"":""v1"",""created"":""Tue, 9 Mar 1999 17:38:33 GMT""}]","2015-06-26"
"math-ph/9903020","Sheng Li","Sheng Li and Yishi Duan","Decomposition Theory of Spin Connection and Topological Structure of
  Gauss-Bonnet-Chern Theorem on Manifold With Boundary","Revtex, 13 pages, no figure",,,,"math-ph hep-th math.MP",,"  The index theorem of Euler-Poincar\'e characteristic of manifold with
boundary is given by making use of the general decomposition theory of spin
connection. We shows the sum of the total index of a vector field $\phi $ and
half the total of the projective vector field of $\phi $ on the boundary equals
the Euler-Poincar\'e characteristic of the manifold. Detailed discussion on the
topological structure of the Gauss-Bonnet-Chern theorem on manifold with
boundary is given. The Hopf indices and Brouwer degrees label the local
structure of the Euler density.
","[{""version"":""v1"",""created"":""Wed, 10 Mar 1999 05:34:09 GMT""}]","2007-05-23"
"math/9903050","Charles Frohman","Charles Frohman, Joanna Kania-Bartoszynska","Quantum Obstruction Theory","17 pages, 15 figures",,,,"math.GT math.QA",,"  We use topological quantum field theory to derive an invariant of a
three-manifold with boundary. We then show how to use this invariant as an
obstruction to embedding one three-manifold in another.
","[{""version"":""v1"",""created"":""Tue, 9 Mar 1999 18:01:42 GMT""}]","2007-05-23"
"math/9903051","Catalin Zara","Victor Guillemin and Catalin Zara","One-skeleta, Betti numbers and equivariant cohomology","Revised and added content, AMSLaTex, 51 pages, 8 figures",,,,"math.DG",,"  The one-skeleton of a G-manifold M is the set of points p in M where $\dim
G_p \geq \dim G -1$; and M is a GKM manifold if the dimension of this
one-skeleton is 2. Goresky, Kottwitz and MacPherson show that for such a
manifold this one-skeleton has the structure of a ``labeled"" graph, $(\Gamma,
\alpha)$, and that the equivariant cohomology ring of M is isomorphic to the
``cohomology ring'' of this graph. Hence, if M is symplectic, one can show that
this ring is a free module over the symmetric algebra $\SS(\fg^*)$, with
$b_{2i}(\Gamma)$ generators in dimension 2i, $b_{2i}(\Gamma)$ being the
``combinatorial'' 2i-th Betti number of $\Gamma$. In this article we show that
this ``topological'' result is , in fact, a combinatorial result about graphs.
","[{""version"":""v1"",""created"":""Tue, 9 Mar 1999 19:27:15 GMT""},{""version"":""v2"",""created"":""Wed, 26 Jul 2000 16:50:35 GMT""}]","2007-05-23"
"math/9903052","Eckhard Meinrenken","Anton Alekseev, Eckhard Meinrenken","The non-commutative Weil algebra","34 pages","Invent. Math. 139 (2000), no. 1, 135--172","10.1007/s002229900025",,"math.DG",,"  Let G be a connected Lie group with Lie algebra g. The Duflo map is a vector
space isomorphism between the symmetric algebra S(g) and the universal
enveloping algebra U(g) which, as proved by Duflo, restricts to a ring
isomorphism from invariant polynomials onto the center of the universal
enveloping algebra. The Duflo map extends to a linear map from compactly
supported distributions on the Lie algebra g to compactly supported
distributions on the Lie group G, which is a ring homomorphism for G-invariant
distributions. In this paper we obtain analogues of the Duflo map and of
Duflo's theorem in the context of equivariant cohomology of G-manifolds. Our
result involves a non-commutative version of the Weil algebra and of the de
Rham model of equivariant cohomology.
","[{""version"":""v1"",""created"":""Tue, 9 Mar 1999 20:23:43 GMT""}]","2015-06-26"
"math/9903053","Stefan Waldmann","Stefan Waldmann","Locality in GNS Representations of Deformation Quantization","LaTeX2e, 29 pages",,"10.1007/s002200050788","FR-THEP-99/2","math.QA math-ph math.MP math.SG",,"  In the framework of deformation quantization we apply the formal GNS
construction to find representations of the deformed algebras in pre-Hilbert
spaces over $\mathbb C[[\lambda]]$ and establish the notion of local operators
in these pre-Hilbert spaces. The commutant within the local operators is used
to distinguish `thermal' from `pure' representations. The computation of the
local commutant is exemplified in various situations leading to the physically
reasonable distinction between thermal representations and pure ones. Moreover,
an analogue of von Neumann's double commutant theorem is proved in the
particular situation of a GNS representation with respect to a KMS functional
and for the Schr\""odinger representation on cotangent bundles. Finally we prove
a formal version of the Tomita-Takesaki theorem.
","[{""version"":""v1"",""created"":""Tue, 9 Mar 1999 21:46:42 GMT""}]","2009-10-31"
"math/9903054","Scott Crass","Scott Crass","Solving the quintic by iteration in three dimensions","40 pages, 15 figures",,,,"math.DS",,"  The requirement for solving a polynomial is a means of breaking its symmetry,
which in the case of the quintic, is that of the symmetric group S_5. Induced
by its five-dimensional linear permutation representation is a
three-dimensional projective action. A mapping of complex projective 3-space
with this S_5 symmetry can provide the requisite symmetry-breaking tool.
  The article describes some of the S_5 geometry in CP^3 as well as several
maps with particularly elegant geometric and dynamical properties. Using a
rational map in degree six, it culminates with an explicit algorithm for
solving a general quintic. In contrast to the Doyle-McMullen procedure - three
1-dimensional iterations, the present solution employs one 3-dimensional
iteration.
","[{""version"":""v1"",""created"":""Tue, 9 Mar 1999 22:58:36 GMT""},{""version"":""v2"",""created"":""Wed, 6 Oct 1999 14:59:42 GMT""}]","2007-05-23"
"math/9903055","Ted Stanford","Mark E. Kidwell and Theodore B. Stanford","On the z-degree of the Kauffman polynomial of a tangle decomposition","9 Pages, 9 eps figures",,,,"math.GT math.QA",,"  We give an upper bound on the z-degree of the Kauffman polynomial of a link,
using bridges of length greater than one which are separated in some tangle
decomposition of a link diagram. We construct some examples by wiring together
rational tangles.
","[{""version"":""v1"",""created"":""Wed, 10 Mar 1999 00:56:14 GMT""}]","2007-05-23"
"math/9903056","Robion C. Kirby","Rob Kirby and Paul Melvin","Canonical framings for 3-manifolds","29 pages. To appear in Turkish J. Math, 1999, Proc. Gokova 1998",,,,"math.GT",,"  Canonical framings and stable framings for the tangent bundle of a spin
3-manifold are introduced, and illustrated by a number of familiar examples.
Methods for constructing canonical framings, and for comparing them with other
naturally defined framings, are discussed.
","[{""version"":""v1"",""created"":""Wed, 10 Mar 1999 01:12:53 GMT""}]","2007-05-23"
"math/9903057","Ted Stanford","Theodore Stanford and Rolland Trapp","On knot invariants which are not of finite type","6 pages, no figures",,,,"math.GT math.QA",,"  We observe that most known results of the form ""v is not a finite-type
invariant"" follow from two basic theorems. Among those invariants which are not
of finite type, we discuss examples which are ""ft-independent"" and examples
which are not. We introduce (n,q)-finite invariants, which are generalizations
of finite-type invariants based on Fox's (n,q) congruence classes of knots.
","[{""version"":""v1"",""created"":""Wed, 10 Mar 1999 01:24:15 GMT""}]","2007-05-23"
"math/9903058","Trond Stolen Gustavsen","Jan Arthur Christophersen, Trond Stoelen Gustavsen","On infinitesimal deformations and obstructions for rational surface
  singularities","15 pages",,,,"math.AG",,"  The purpose of this paper is to prove dimension formulas for $T^1$ and $T^2$
for rational surface singularities. These modules play an important role in the
deformation theory of isolated singularities in analytic and algebraic
geometry. The first may be identified as the Zariski tangent space of the
versal deformation of the singularity; i.e. it is the space of infinitesimal
deformations. The second contains the obstruction space -- in all known cases
it is the whole obstruction space for rational surface singularities.
","[{""version"":""v1"",""created"":""Wed, 10 Mar 1999 12:15:28 GMT""}]","2007-05-23"
"nucl-ex/9903003","Colin Wilkin","F. Hibou, O. Bing, M. Boivin, P. Courtat, R. Gacougnolle, Y. Le
  Bornec, J.M. Martin, F. Plouin, B. Tatischeff, C. Wilkin, N. Willis, R.
  Wurzinger","Near-Threshold Production of omega Mesons in the pp -> pp omega Reaction","Report in LaTeX2e. 12 pages with 2 eps figures","Phys.Rev.Lett.83:492-495,1999","10.1103/PhysRevLett.83.492","IReS 99-07","nucl-ex",,"  The total cross section for omega production in the pp -> pp omega reaction
has been measured at five c.m. excess energies from 3.8 to 30 MeV. The energy
dependence is easily understood in terms of a strong proton-proton final state
interaction combined with a smearing over the width of the state. The ratio of
near-threshold phi and omega production is consistent with the predictions of a
one-pion-exchange model and the degree of violation of the OZI rule is similar
to that found in the pi-p -> n omega/phi reactions.
","[{""version"":""v1"",""created"":""Tue, 9 Mar 1999 17:40:51 GMT""}]","2008-11-26"
