"astro-ph/9903148","Jeroen Homan","Jeroen Homan, Peter G. Jonker, Rudy Wijnands, Michiel van der Klis,
  and Jan van Paradijs","A variable 0.58--2.44 Hz quasi-periodic oscillation in the eclipsing and
  dipping low-mass X-ray binary EXO 0748-676","9 pages including 4 figures. Accepted for publication in ApJ Letters",,"10.1086/312000",,"astro-ph",,"  We report the discovery of a quasi-periodic oscillation (QPO) in data
obtained with the Rossi X-ray Timing Explorer of the dipping and eclipsing
low-mass X-ray binary EXO 0748-676. The QPO had a frequency between 0.58 and
2.44 Hz changing on time scales of a few days, an rms amplitude between 8% and
12%, and was detected in the persistent emission, during dips and during type I
X-ray bursts. During one observation, when the count rate was a factor 2 to 3
higher than otherwise, the QPO was not detected. The strength of the QPO did
not significantly depend on photon energy, and is consistent with being the
same in the persistent emission, both during and outside the dips, and during
type I X-ray bursts. Frequency shifts were observed during three of the four
X-ray bursts. We argue that the QPO is produced by the same mechanism as the
QPO recently found by Jonker et al. (1999) in 4U 1323-62. Although the exact
mechanism is not clear, it is most likely related to the high inclination of
both systems. An orbiting structure in the accretion disc that modulates the
radiation from the central source seems the most promising mechanism.
","[{""version"":""v1"",""created"":""Wed, 10 Mar 1999 13:24:12 GMT""}]","2009-10-31"
"astro-ph/9903149","Laurent Cambresy","L. Cambresy (Observatoire de Paris, DESPA)","Mapping of the extinction in Giant Molecular Clouds using optical star
  counts","8 pages, 1 Postscript figure, 12 Gif figures, accepted in A&A","Astron.Astrophys. 345 (1999) 965-976",,,"astro-ph",,"  This paper presents large scale extinction maps of most nearby Giant
Molecular Clouds of the Galaxy (Lupus, rho-Ophiuchus, Scorpius, Coalsack,
Taurus, Chamaeleon, Musca, Corona Australis, Serpens, IC 5146, Vela, Orion,
Monoceros R1 and R2, Rosette, Carina) derived from a star count method using an
adaptive grid and a wavelet decomposition applied to the optical data provided
by the USNO-Precision Measuring Machine. The distribution of the extinction in
the clouds leads to estimate their total individual masses M and their maximum
of extinction. I show that the relation between the mass contained within an
iso-extinction contour and the extinction is similar from cloud to cloud and
allows the extrapolation of the maximum of extinction in the range 5.7 to 25.5
magnitudes. I found that about half of the mass is contained in regions where
the visual extinction is smaller than 1 magnitude. The star count method used
on large scale (about 250 square degrees) is a powerful and relatively
straightforward method to estimate the mass of molecular complexes. A
systematic study of the all sky would lead to discover new clouds as I did in
the Lupus complex for which I found a sixth cloud of about 10^4 solar masses.
","[{""version"":""v1"",""created"":""Wed, 10 Mar 1999 14:02:27 GMT""}]","2007-05-23"
"astro-ph/9903150","Mercedes Molla","Mercedes Molla, Angeles Diaz, Federico Ferrini (Universite Laval,
  Canada; Universidad Autonoma de Madrid, Spain; Universita di Pisa, Italy)","Elemental abundances at early times: the nature of Damped Lyman-alpha
  systems","2 pages, 1 figure, proceedings of X Rencontres de Blois, ""The Birth
  of Galaxies""",,,,"astro-ph",,"  The distribution of element abundances with redshift in Damped Ly-alpha (DLA)
systems can be adequately reproduced by the same model reproducing the halo and
disk components of the Milky Way Galaxy at different galactocentric distances:
DLA systems are well represented by normal spiral galaxies in their early
evolutionary stages.
","[{""version"":""v1"",""created"":""Wed, 10 Mar 1999 15:40:58 GMT""}]","2007-05-23"
"astro-ph/9903152","Dieter Lutz","D. Lutz, S. Veilleux, R. Genzel","Mid-infrared and optical spectroscopy of ultraluminous infrared
  galaxies: A comparison","aastex, 1 eps figure. Accepted by ApJ (Letters)",,"10.1086/312014",,"astro-ph",,"  New tools from Infrared Space Observatory (ISO) mid-infrared spectroscopy
have recently become available to determine the power sources of dust-obscured
ultraluminous infrared galaxies (ULIRGs). We compare ISO classifications -
starburst or active galactic nucleus (AGN) - with classifications from optical
spectroscopy, and with optical/near-infrared searches for hidden broad-line
regions. The agreement between mid-infrared and optical classification is
excellent if optical LINER spectra are assigned to the starburst group. The
starburst nature of ULIRG LINERs strongly supports the suggestion that LINER
spectra in infrared-selected galaxies, rather than being an expression of the
AGN phenomenon, are due to shocks that are probably related to galactic
superwinds. Differences between ISO and optical classification provide clues on
the evolution of ULIRGs and on the configuration of obscuring dust. We find few
ISO AGN with optical HII or LINER identification, suggesting that highly
obscured AGN exist but are not typical for the ULIRG phenomenon in general.
Rather, our results indicate that strong AGN activity, once triggered, quickly
breaks the obscuring screen at least in certain directions, thus becoming
detectable over a wide wavelength range.
","[{""version"":""v1"",""created"":""Wed, 10 Mar 1999 15:52:49 GMT""}]","2009-10-31"
"cond-mat/9903145","Arkadiusz Wojs","Arkadiusz Wojs and John J. Quinn","Composite Fermions and quantum Hall systems: Role of the Coulomb
  pseudopotential","27 pages, 23 figures, revised version (significant changes in text
  and figures), submitted to Phil. Mag. B","Phil. Mag. B 80, 1405 (2000)","10.1080/13642810008209796",,"cond-mat.mes-hall",,"  The mean field composite Fermion (CF) picture successfully predicts angular
momenta of multiplets forming the lowest energy band in fractional quantum Hall
(FQH) systems. This success cannot be attributed to a cancellation between
Coulomb and Chern-Simons interactions beyond the mean field, because these
interactions have totally different energy scales. Rather, it results from the
behavior of the Coulomb pseudopotential V(L) (pair energy as a function of pair
angular momentum) in the lowest Landau level (LL). The class of short range
repulsive pseudopotentials is defined that lead to short range Laughlin like
correlations in many body systems and to which the CF model can be applied.
These Laughlin correlations are described quantitatively using the formalism of
fractional parentage. The discussion is illustrated with an analysis of the
energy spectra obtained in numerical diagonalization of up to eleven electrons
in the lowest and excited LL's. The qualitative difference in the behavior of
V(L) is shown to sometimes invalidate the mean field CF picture when applied to
higher LL's. For example, the nu=7/3 state is not a Laughlin nu=1/3 state in
the first excited LL. The analysis of the involved pseudopotentials also
explains the success or failure of the CF picture when applied to other systems
of charged Fermions with Coulomb repulsion, such as the Laughlin quasiparticles
in the FQH hierarchy or charged excitons in an electron-hole plasma.
","[{""version"":""v1"",""created"":""Tue, 9 Mar 1999 18:23:11 GMT""},{""version"":""v2"",""created"":""Tue, 18 May 1999 17:57:37 GMT""},{""version"":""v3"",""created"":""Mon, 7 Feb 2000 19:24:52 GMT""}]","2017-02-08"
"cond-mat/9903146","Peter Schwab","R. Raimondi, P. Schwab, and C. Castellani","Non-linear effects and dephasing in disordered electron systems","28 pages, 6 figures (14ps-files)","PRB 60, 5818 (1999)","10.1103/PhysRevB.60.5818",,"cond-mat.mes-hall",,"  The calculation of the dephasing time in electron systems is presented. By
means of the Keldysh formalism we discuss in a unifying way both weak
localization and interaction effects in disordered systems. This allows us to
show how dephasing arises both in the particle-particle channel (weak
localization) and in the particle-hole channel (interaction effect). First we
discuss dephasing by an external field. Besides reviewing previous work on how
an external oscillating field suppresses the weak localization correction, we
derive a new expression for the effect of a field on the interaction
correction. We find that the latter may be suppressed by a static electric
field, in contrast to weak localization. We then consider dephasing due to
inelastic scattering. The ambiguities involved in the definition of the
dephasing time are clarified by directly comparing the diagrammatic approach
with the path-integral approach. We show that different dephasing times appear
in the particle-particle and particle-hole channels. Finally we comment on
recent experiments.
","[{""version"":""v1"",""created"":""Tue, 9 Mar 1999 18:44:53 GMT""}]","2009-10-31"
"cond-mat/9903147","Nicola Marzari","Nicola Marzari (1), David Vanderbilt (1), Alessandro De Vita (2), and
  M.C. Payne (3) ((1) Department of Physics and Astronomy, Rutgers University,
  (2) INFM and Department of Material Engineering and Applied Chemistry,
  University of Trieste, (3) Cavendish Laboratory (TCM), University of
  Cambridge)","Thermal Contraction and Disordering of the Al(110) Surface","4 pages, two-column style with 5 PostScript figures embedded. Uses
  RevTeX and epsf macros. To appear in Phys. Rev. Lett. Also available at
  http://www.physics.rutgers.edu/~marzari/preprints/index.html#al110",,"10.1103/PhysRevLett.82.3296",,"cond-mat.mtrl-sci",,"  Al(110) has been studied for temperatures up to 900 K via ensemble
density-functional molecular dynamics. The strong anharmonicity displayed by
this surface results in a negative coefficient of thermal expansion, where the
first interlayer distance decreases with increasing temperature. Very shallow
channels of oscillation for the second-layer atoms in the direction
perpendicular to the surface support this anomalous contraction, and provide a
novel mechanism for the formation of adatom-vacancy pairs, preliminary to the
disordering and premelting transition. Such characteristic behavior originates
in the free-electron-gas bonding at a loosely packed surface.
","[{""version"":""v1"",""created"":""Tue, 9 Mar 1999 19:40:40 GMT""}]","2009-10-31"
"cond-mat/9903148","Patrik Henelius","Patrik Henelius, Anders W. Sandvik, Carsten Timm and S. M. Girvin","Monte Carlo study of a two-dimensional quantum ferromagnet","13 pages, 11 figures",,"10.1103/PhysRevB.61.364",,"cond-mat.mes-hall",,"  We present quantum Monte Carlo results for the field and temperature
dependence of the magnetization and the spin-lattice relaxation rate $1/T_1$ of
a two-dimensional $S=1/2$ quantum Heisenberg ferromagnet. The Monte Carlo
method, which yields results free of systematic errors, is described in detail.
The high accuracy of the calculated magnetization allows for stringent tests of
recent approximate analytical calculations. We also compare our results with
recent experimental data for a $\nu=1$ quantum Hall ferromagnet, which is
expected to be well described by the Heisenberg model. The dynamic response
function needed to extract $1/T_1$ is obtained using maximum-entropy analytic
continuation of the corresponding imaginary-time dependent correlation
function. We discuss the reliability of this approach.
","[{""version"":""v1"",""created"":""Tue, 9 Mar 1999 20:14:42 GMT""}]","2009-10-31"
"cond-mat/9903149","Eric Jeckelmann","Eric Jeckelmann, Chunli Zhang, and Steven R. White (University of
  California at Irvine)","Metal-insulator transition in the one-dimensional Holstein model at half
  filling","6 pages (LaTex), 10 eps figures","Physical Review B 60, 7950-7955 (1999)","10.1103/PhysRevB.60.7950",,"cond-mat",,"  We study the one-dimensional Holstein model with spin-1/2 electrons at
half-filling. Ground state properties are calculated for long chains with great
accuracy using the density matrix renormalization group method and extrapolated
to the thermodynamic limit. We show that for small electron-phonon coupling or
large phonon frequency, the insulating Peierls ground state predicted by
mean-field theory is destroyed by quantum lattice fluctuations and that the
system remains in a metallic phase with a non-degenerate ground state and
power-law electronic and phononic correlations. When the electron-phonon
coupling becomes large or the phonon frequency small, the system undergoes a
transition to an insulating Peierls phase with a two-fold degenerate ground
state, long-range charge-density-wave order, a dimerized lattice structure, and
a gap in the electronic excitation spectrum.
","[{""version"":""v1"",""created"":""Tue, 9 Mar 1999 19:48:11 GMT""}]","2009-10-31"
"cond-mat/9903150","Yang Sun","Mike Guidry (University of Tennessee), Lian-Ao Wu (Jilin University),
  Yang Sun (University of Tennessee), Cheng-Li Wu (Chung-Yuan Christian
  University)","An SU(4) Approach of High-Temperature Superconductivity and
  Antiferromagnetism","4 pages, 2 figures, submitted to Phys. Rev. Lett",,,,"cond-mat.supr-con cond-mat.str-el nucl-th",,"  We present an SU(4) model of high-$T_c$ superconductivity. One dynamical
symmetry of this model corresponds to the previously proposed SO(5) model for
unification of superconductivity and antiferromagnetism, but there are two
additional dynamical symmetries: SO(4), associated with antiferromagnetic order
and SU(2), associated with a D-wave pairing condensate. These provide a 3-phase
microscopic model of high-$T_c$ superconductivity and permit a clear
understanding of the role played by the SO(5) symmetry.
","[{""version"":""v1"",""created"":""Tue, 9 Mar 1999 19:53:09 GMT""},{""version"":""v2"",""created"":""Wed, 11 Aug 1999 20:17:57 GMT""}]","2007-05-23"
"cond-mat/9903151","Filip Ronning","F. Ronning, C. Kim, D.L. Feng, D.S. Marshall, A.G. Loeser, L.L.
  Miller, J.N. Eckstein, I. Bozovic, Z.-X. Shen","Photoemission Evidence for a Remnant Fermi Surface and d-Wave-Like
  Dispersion in Insulating Ca2CuO2Cl2","9 pages, including 7 figures. Published in Science, one figure
  corrected","Science, 282, 2067 (1998)","10.1126/science.282.5396.2067",,"cond-mat.supr-con",,"  An angle resolved photoemission study on Ca2CuO2Cl2, a parent compound of
high Tc superconductors is reported. Analysis of the electron occupation
probability, n(k) from the spectra shows a steep drop in spectral intensity
across a contour that is close to the Fermi surface predicted by the band
calculation. This analysis reveals a Fermi surface remnant even though
Ca2CuO2Cl2 is a Mott insulator. The lowest energy peak exhibits a dispersion
with approximately the |cos(kxa)-cos(kya)| form along this remnant Fermi
surface. Together with the data from Dy doped Bi2Sr2CaCu2O(8 + delta) these
results suggest that this d-wave like dispersion of the insulator is the
underlying reason for the pseudo gap in the underdoped regime.
","[{""version"":""v1"",""created"":""Tue, 9 Mar 1999 19:57:04 GMT""}]","2009-10-31"
"cond-mat/9903152","Marcel Franz","M. Franz and Z. Tesanovic (Johns Hopkins)","Quasiparticles in the vortex lattice of unconventional superconductors:
  Bloch waves or Landau levels?","4 pages REVTeX, 3 PostScript figures. For related work and info visit
  http://www.pha.jhu.edu/~franz [Final version to appear in PRL; minor
  computational error corrected.]","PRL 84, 554 (2000).","10.1103/PhysRevLett.84.554",,"cond-mat.supr-con cond-mat.str-el",,"  A novel singular gauge transformation is developed for quasiparticles in the
mixed state of a strongly type-II superconductor which permits a full solution
of the problem at low and intermediate fields. For a periodic vortex lattice
the natural low-energy quasiparticle states are Bloch waves rather than Landau
levels discussed in the recent literature. The new representation elucidates
the physics considerably and provides fresh insights into the spectral
properties of such systems.
","[{""version"":""v1"",""created"":""Tue, 9 Mar 1999 21:31:02 GMT""},{""version"":""v2"",""created"":""Wed, 16 Jun 1999 20:18:55 GMT""},{""version"":""v3"",""created"":""Tue, 30 Nov 1999 20:09:27 GMT""}]","2007-05-23"
"cond-mat/9903153","Michael P. Lilly","M. P. Lilly (1), K. B. Cooper (1), J. P. Eisenstein (1), L. N.
  Pfeiffer (2), K. W. West (2) ((1) Caltech, (2) Bell Labs, Lucent
  Technologies)","Reply to Simon's Comment on ""Evidence for an Anisotropic State of
  Two-Dimensional Electrons in High Landau Levels""","1 page, 1 figure",,,,"cond-mat.mes-hall cond-mat.str-el",,"  We recently reported [PRL 82, 394 (1999)] large transport anisotropies in a
two-dimensional electron gas in high Landau levels. These observations were
made utilizing both square and Hall bar sample geometries. Simon recently
commented [cond-mat/9903086] that a classical calculation of the current flow
in the sample shows a magnification of an underlying anisotropy when using a
square sample. In this reply we present more recent data obtained with a very
high mobility sample, and reiterate that, with or without magnification, an
anisotropic state develops in high Landau levels at very low temperatures.
","[{""version"":""v1"",""created"":""Tue, 9 Mar 1999 21:51:50 GMT""}]","2007-05-23"
"cond-mat/9903154","Valeri Kotov","Valeri N. Kotov (University of Florida), J. Oitmaa, Oleg P. Sushkov,
  Zheng Weihong (UNSW Sydney)","Low-energy singlet and triplet excitations in the spin-liquid phase of
  the two-dimensional J1-J2 model","4 pages, 4 figures, small changes, published version","Phys. Rev. B 60, 14613 (1999)","10.1103/PhysRevB.60.14613",,"cond-mat.str-el",,"  We analyze the stability of the spontaneously dimerized spin-liquid phase of
the frustrated Heisenberg antiferromagnet - the J1-J2 model. The lowest triplet
excitation, corresponding to breaking of a singlet bond, is found to be stable
in the region 0.38 < J2/J1 < 0.62. In addition we find a stable low-energy
collective singlet mode, which is closely related to the spontaneous violation
of the discrete symmetry. Both modes are gapped in the quantum disordered phase
and become gapless at the transition point to the Neel ordered phase
(J2/J1=0.38). The spontaneous dimerization vanishes at the transition and we
argue that the disappearance of dimer order is related to the vanishing of the
singlet gap. We also present exact diagonalization data on a small (4x4)
cluster which indeed show a structure of the spectrum, consistent with that of
a system with a four-fold degenerate (spontaneously dimerized) ground state.
","[{""version"":""v1"",""created"":""Tue, 9 Mar 1999 23:18:31 GMT""},{""version"":""v2"",""created"":""Wed, 8 Mar 2000 22:42:53 GMT""}]","2009-10-31"
"cond-mat/9903155","Andrea Cavagna","Andrea Cavagna, Irene Giardina and Giorgio Parisi","Analytic computation of the Instantaneous Normal Modes spectrum in low
  density liquids","4 RevTeX pages, 4 EPS figures. Revised version to appear on Phys.
  Rev. Lett","Phys. Rev. Lett. 83 (1999) 108","10.1103/PhysRevLett.83.108",,"cond-mat.stat-mech cond-mat.dis-nn",,"  We analytically compute the spectrum of the Hessian of the Hamiltonian for a
system of N particles interacting via a purely repulsive potential in one
dimension. Our approach is valid in the low density regime, where we compute
the exact spectrum also in the localized sector. We finally perform a numerical
analysis of the localization properties of the eigenfunctions.
","[{""version"":""v1"",""created"":""Wed, 10 Mar 1999 00:03:40 GMT""},{""version"":""v2"",""created"":""Tue, 25 May 1999 11:22:56 GMT""}]","2009-10-31"
"cond-mat/9903156","Ruslan L. Davidchack","Ruslan L. Davidchack and Brian. B. Laird","Molecular dynamics simulation of binary hard-sphere crystal/melt
  interfaces","7 pages, 7 figures, to appear in Molecular Physics",,"10.1080/002689799163244",,"cond-mat.stat-mech cond-mat.mtrl-sci",,"  We examine, using molecular dynamics simulation, the structure and
thermodynamics of the (100) and (111) disordered face-centered cubic (FCC)
crystal/melt interfaces for a binary hard-sphere system. This study is an
extension of our previous work, [Phys. Rev. E 54, R5905 (1996)], in which
preliminary data for the (100) interface were reported. Density and diffusion
profiles on both fine- and course-grained scales are calculated and analyzed
leading to the conclusion that equilibrium interfacial segregation is minimal
in this system.
","[{""version"":""v1"",""created"":""Wed, 10 Mar 1999 00:13:06 GMT""}]","2009-10-31"
"cond-mat/9903158","Ruslan L. Davidchack","Ruslan L. Davidchack and Brian. B. Laird","Weighted-density approximation for general nonuniform fluid mixtures","4 pages, 4 figures, to appear in Phys. Rev. E as Brief Report",,"10.1103/PhysRevE.60.3417",,"cond-mat.stat-mech",,"  In order to construct a general density-functional theory for nonuniform
fluid mixtures, we propose an extension to multicomponent systems of the
weighted-density approximation (WDA) of Curtin and Ashcroft [Phys. Rev. A 32,
2909 (1985)]. This extension corrects a deficiency in a similar extension
proposed earlier by Denton and Ashcroft [Phys. Rev. A 42, 7312 (1990)], in that
that functional cannot be applied to the multi-component nonuniform fluid
systems with spatially varying composition, such as solid-fluid interfaces. As
a test of the accuracy of our new functional, we apply it to the calculation of
the freezing phase diagram of a binary hard-sphere fluid, and compare the
results to simulation and the Denton-Ashcroft extension.
","[{""version"":""v1"",""created"":""Wed, 10 Mar 1999 01:33:45 GMT""}]","2009-10-31"
"cond-mat/9903159","Sul-Ah Ahn","Sul-Ah Ahn, Kwangyl Park and Sung-Ho Suck Salk (Pohang University of
  Science and Technology, Pohang, Korea)","Functional Schr\""odinger Representations of Holstein-Primakoff Boson and
  Slave-Boson Theories for Heisenberg Antiferromagnets","28 pages, ReVTeX, no figures",,,,"cond-mat.str-el",,"  We present functional Schr\""odinger representations of Holstein-Primakoff
boson and slave-boson theories for the Heisenberg Hamiltonian and the $t-J$
Hamiltonian respectively. Based on these representations we obtain the
dispersion relations of magnons for two dimensional antiferromagnets. By
applying the functional Schr\""odinger representation of the Holstein-Primakoff
boson theory to the Heisenberg Hamiltonian, the exchange energy is correctly
predicted and the self-energy of quasi-hole is obtained. From the use of the
functional Schr\""odinger representation of the $t-J$ Hamiltonian it is shown
that at half-filling the dispersion relation obtained from the slave-boson
theory leads to that obtained from the Holstein-Primakoff boson approach.
","[{""version"":""v1"",""created"":""Wed, 10 Mar 1999 02:12:30 GMT""}]","2007-05-23"
"cond-mat/9903160","Wei Pan","W. Pan, R.R. Du, H.L. Stormer, D.C. Tsui, L.N. Pfeiffer, K.W. Baldwin,
  and K.W. West","Strongly Anisotropic Electronic Transport at Landau Level Filling Factor
  $\nu = 9/2$ and $\nu = 5/2$ Under Tilted Magnetic Field","6 page, 3 figues",,"10.1103/PhysRevLett.83.820",,"cond-mat.mes-hall",,"  We have investigated the influence of an increasing in-plane magnetic field
on the states at half-filling of Landau levels ($\nu$ = 11/2, 9/2, 7/2, and
5/2) of a two-dimensional electron system. In the electrically anisotropic
phase at $\nu$ = 9/2 and 11/2 an in-plane magnetic field of $\sim$ 1-2 T
overcomes its initial pinning to the crystal lattice and {\it reorient} this
phase. In the initially isotropic phases at $\nu$ = 5/2 and 7/2 an in-plane
magnetic field {\it induces} a strong electrical anisotropy. In all cases, for
high in-plane fields, the high resistance axis is parallel to the direction of
the in-plane field.
","[{""version"":""v1"",""created"":""Wed, 10 Mar 1999 06:54:47 GMT""}]","2009-10-31"
"cond-mat/9903161","Carlo Vanderzande","J. Hooyberghs, C. Vanderzande","Real space renormalisation for reaction-diffusion systems","15 pages, 3 Postscript figures. submitted to J. Phys. A",,,,"cond-mat.stat-mech",,"  The stationary state of stochastic processes such as reaction-diffusion
systems can be related to the ground state of a suitably defined quantum
Hamiltonian. Using this analogy, we investigate the applicability of a real
space renormalisation group approach, originally developped for quantum spin
systems, to interacting particle systems. We apply the technique to an exactly
solvable reaction-diffusion system and to the contact process (both in $d=1$).
In the former case, several exact results are recovered. For the contact
process, surprisingly good estimates of critical parameters are obtained from a
small-cell renormalisation.
","[{""version"":""v1"",""created"":""Wed, 10 Mar 1999 09:25:27 GMT""}]","2007-05-23"
"cond-mat/9903162","Ichiro Terasaki","I. Terasaki, Y. Sasago, and K. Uchinokura","Large Thermopower in a Layered Oxide NaCo_2O_4","3 pages (LaTeX), 4 EPS figures","Proc. of 17th International Conference on Thermoelectrics (1998)
  p.567",,,"cond-mat.mtrl-sci cond-mat.str-el",,"  A transition-metal oxide NaCo_2O_4 is a layered oxide in which CoO_2 and Na
alternately stack along the c axis. Recently we have found that this compound
shows unusually large thermopower with low resistivity, which is comparable to
those of Bi_2Te_3. The negative transverse magnetoresistance and the strongly
temperature-dependent Hall coefficient suggest that electron correlation
dominates the conduction mechanism in NaCo_2O_4.
","[{""version"":""v1"",""created"":""Wed, 10 Mar 1999 10:01:00 GMT""}]","2007-05-23"
