"cond-mat/9903163","Jacek Miekisz","Janusz Jedrzejewski, Jacek Miekisz","Ground states of lattice gases with ``almost'' convex repulsive
  interactions","25 pages, Latex",,,,"cond-mat.stat-mech",,"  To our best knowledge there is only one example of a lattice system with
long-range two-body interactions whose ground states have been determined
exactly: the one-dimensional lattice gas with purely repulsive and strictly
convex interactions. Its ground-state particle configurations do not depend on
the rate of decay of the interactions and are known as the generalized Wigner
lattices or the most homogenenous particle configurations. The question of
stability of this beautiful and universal result against certain perturbations
of the repulsive and convex interactions seems to be interesting by itself.
Additional motivations for studying such perturbations come from surface
physics (adsorbtion on crystal surfaces) and theories of correlated fermion
systems (recent results on ground-state particle configurations of the
one-dimensional spinless Falicov-Kimball model).
  As a first step we have studied a one-dimensional lattice gas whose two-body
interactions are repulsive and strictly convex only from distance 2 on while
its value at distance 1 is fixed near its value at infinity. We show that such
a modification makes the ground-state particle configurations sensitive to the
decay rate of the interactions: if it is fast enough, then particles form
2-particle lattice-connected aggregates that are distributed in the most
homogeneous way. Consequently, despite breaking of the convexity property, the
ground state exibits the feature known as the complete devil's staircase.
","[{""version"":""v1"",""created"":""Wed, 10 Mar 1999 12:20:36 GMT""}]","2007-05-23"
"cond-mat/9903165","E. G. Mishchenko","E.G. Mishchenko","Raman scattering in a two-dimensional electron gas: Boltzmann equation
  approach","4 pages, 3 figures. to appear in Phys. Rev. B 59 (1999)","Phys. Rev. B 59, 14892 (1999).","10.1103/PhysRevB.59.14892",,"cond-mat.mes-hall cond-mat.mtrl-sci",,"  The inelastic light scattering in a 2-d electron gas is studied theoretically
using the Boltzmann equation techniques. Electron-hole excitations produce the
Raman spectrum essentially different from the one predicted for the 3-d case.
In the clean limit it has the form of a strong non-symmetric resonance due to
the square root singularity at the electron-hole frequency $\omega = vk$ while
in the opposite dirty limit the usual Lorentzian shape of the cross section is
reestablished. The effects of electromagnetic field are considered
self-consistently and the contribution from collective plasmon modes is found.
It is shown that unlike 3-d metals where plasmon excitations are unobservable
(because of very large required transfered frequencies), the two-dimensional
electron system gives rise to a low-frequency ($\omega \propto k^{1/2}$)
plasmon peak. A measurement of the width of this peak can provide data on the
magnitude of the electron scattering rate.
","[{""version"":""v1"",""created"":""Wed, 10 Mar 1999 12:41:55 GMT""}]","2007-05-23"
"cond-mat/9903166","Yupeng Wang","Yupeng Wang, Jian-Hui Dai, Fu-Cho Pu and Ulrich Eckern","Enhancement of pair correlation in a one-dimensional hybridization model","11 page revtex, no figure","PRB 59, 7393(1999)","10.1103/PhysRevB.59.7393",,"cond-mat.str-el",,"  We propose an integrable model of one-dimensional (1D) interacting electrons
coupled with the local orbitals arrayed periodically in the chain. Since the
local orbitals are introduced in a way that double occupation is forbidden, the
model keeps the main feature of the periodic Anderson model with an interacting
host. For the attractive interaction, it is found that the local orbitals
enhance the effective mass of the Cooper-pair-like singlets and also the pair
correlation in the ground state. However, the persistent current is depressed
in this case. For the repulsive interaction case, the Hamiltonian is
non-Hermitian but allows Cooper pair solutions with small momenta, which are
induced by the hybridization between the extended state and the local orbitals.
","[{""version"":""v1"",""created"":""Wed, 10 Mar 1999 15:57:26 GMT""}]","2009-10-31"
"gr-qc/9903036","Alejandro Jakubi","Luis P. Chimento, Alejandro S. Jakubi and Diego Pavon","Stability of inflationary solutions driven by a changing dissipative
  fluid","17 pages, LaTeX 2.09, 2 figures. To be published in Classical and
  Quantum Gravity","Class.Quant.Grav. 16 (1999) 1625-1635","10.1088/0264-9381/16/5/312",,"gr-qc",,"  In this paper the second Lyapunov method is used to study the stability of
the de Sitter phase of cosmic expansion when the source of the gravitational
field is a viscous fluid. Different inflationary scenarios related with
reheating and decay of mini-blackholes into radiation are investigated using an
effective fluid described by time--varying thermodynamical quantities.
","[{""version"":""v1"",""created"":""Tue, 9 Mar 1999 19:38:45 GMT""},{""version"":""v2"",""created"":""Fri, 12 Mar 1999 01:10:08 GMT""}]","2009-10-31"
"gr-qc/9903037","Marcelo J. Reboucas","G.I. Gomero, M.J. Reboucas, A.F.F. Teixeira, A. Bernui","Topological Reverberations in Flat Space-times","16 pages, 4 figures, REVTEX; Added five references and inserted
  clarifying details. Version to appear in Int. J. Mod. Phys. A (2000)","Int.J.Mod.Phys. A15 (2000) 4141-4162","10.1142/S0217751X00002081","CBPF-NF-051/98","gr-qc astro-ph hep-th math-ph math.MP",,"  We study the role played by multiply-connectedness in the time evolution of
the energy E(t) of a radiating system that lies in static flat space-time
manifolds M_4 whose t=const spacelike sections M_3 are compact in at least one
spatial direction. The radiation reaction equation of the radiating source is
derived for the case where M_3 has any non-trivial flat topology, and an exact
solution is obtained. We also show that when the spacelike sections are
multiply-connected flat 3-manifolds the energy E(t) exhibits a reverberation
pattern with discontinuities in the derivative of E(t) and a set of relative
minima and maxima, followed by a growth of E(t). It emerges from this result
that the compactness in at least one spatial direction of Minkowski space-time
is sufficient to induce this type of topological reverberation, making clear
that our radiating system is topologically fragile. An explicit solution of the
radiation reaction equation for the case where M_3 = R^2 x S^1 is discussed,
and graphs which reveal how the energy varies with the time are presented and
analyzed.
","[{""version"":""v1"",""created"":""Tue, 9 Mar 1999 22:36:46 GMT""},{""version"":""v2"",""created"":""Thu, 14 Sep 2000 00:35:26 GMT""}]","2016-12-21"
"hep-ex/9903007","E. D. Zimmerman","E799-II / KTeV Collaboration","Measurement of the branching ratio of pi^0 -> e^+e^- using K_L -> 3 pi^0
  decays in flight","New version shortened to PRL length limit. 5 pages, 4 figures.
  Published in Phys. Rev. Lett","Phys.Rev.Lett.83:922-925,1999","10.1103/PhysRevLett.83.922","FERMILAB-Pub-99/040-E","hep-ex",,"  The branching ratio of the rare decay pi^0 -> e^+e^- has been measured in
E799-II, a rare kaon decay experiment using the KTeV detector at Fermilab. The
pi^0's were produced in fully-reconstructed K_L -> 3 pi^0 decays in flight. We
observed 275 candidate pi^0 -> e^+e^- events, with an expected background of
21.4 +- 6.2 events which includes the contribution from Dalitz decays. We
measured BR(pi^0 -> e^+e^-, x>0.95) = (6.09 +- 0.40 +- 0.24) times 10^{-8},
where the first error is statistical and the second systematic. This result is
the first significant observation of the excess rate for this decay above the
unitarity lower bound.
","[{""version"":""v1"",""created"":""Tue, 9 Mar 1999 17:08:22 GMT""},{""version"":""v2"",""created"":""Wed, 4 Aug 1999 15:04:45 GMT""}]","2008-11-26"
"hep-ex/9903008","John Dainton","C. Adloff, et al. (H1 Collaboration)","Charmonium Production in Deep Inelastic Scattering at HERA","38 pages, 17 figures, submitted to Eur. Phys. J","Eur.Phys.J.C10:373-393,1999","10.1007/s100520050762","DESY 99-026","hep-ex",,"  The electroproduction of J/psi and psi(2S) mesons is studied in elastic,
quasi-elastic and inclusive reactions for four momentum transfers 2 < Q^2 < 80
GeV^2 and photon-proton centre of mass energies 25 < W < 180 GeV. The data were
taken with the H1 detector at the electron proton collider HERA in the years
1995 to 1997. The total virtual photon-proton cross section for elastic J/psi
production is measured as a function of Q^2 and W. The dependence of the
production rates on the square of the momentum transfer from the proton (t) is
extracted. Decay angular distributions are analysed and the ratio of the
longitudinal and transverse cross sections is derived. The ratio of the cross
sections for quasi-elastic psi(2S) and J/psi meson production is measured as a
function of Q^2. The results are discussed in terms of theoretical models based
upon perturbative QCD. Differential cross sections for inclusive and inelastic
production of J/psi mesons are determined and predictions within two
theoretical frameworks are compared with the data, the non-relativistic QCD
factorization approach including colour octet and colour singlet contributions,
and the model of Soft Colour Interactions.
","[{""version"":""v1"",""created"":""Tue, 9 Mar 1999 21:45:00 GMT""}]","2008-11-26"
"hep-ex/9903009","Otmar Biebel","O. Biebel (RWTH-Aachen), P.A. Movilla Fern\'andez (RWTH-Aachen), S.
  Bethke (RWTH-Aachen), and the JADE Collaboration","C-Parameter and Jet Broadening at PETRA Energies","14 pages, LaTeX2e, 9 .eps-files included, abbreviated version of the
  paper contributed to the ICHEP'98 conference in Vancouver, submitted to Phys.
  Lett. B","Phys.Lett.B459:326-334,1999","10.1016/S0370-2693(99)00733-9","PITHA 98/21 (July 2, 1998)","hep-ex hep-ph",,"  e^+e^- annihilation data recorded by the JADE detector at PETRA were used to
measure the C-parameter for the first time at \sqrt{s}= 35 and 44 GeV. The
distributions were compared to a resummed QCD calculation.
  In addition, we applied extended resummed calculations to the total and wide
jet broadening variables, B_T and B_W. We combined the results on \alpha_s with
those of our previous study of differential 2-jet rate, thrust, and heavy jet
mass, obtaining
  \alpha_s(35 GeV) = 0.1448 +0.0117 -0.0070 and \alpha_s(44 GeV) = 0.1392
+0.0105 -0.0074.
  Moreover power corrections to the mean values of the observables mentioned
above were investigated considering the Milan factor and the improved
prediction for the jet broadening observables.
  Our study, which considered e^+e^- data of five event shape observables
between \sqrt{s}= 14 and 183 GeV, yielded \alpha_s(M_{Z^0})=0.1177 +0.0035
-0.0034.
","[{""version"":""v1"",""created"":""Tue, 9 Mar 1999 22:43:51 GMT""}]","2011-04-20"
"hep-lat/9903014","Istvan Montvay","I. Campos, A. Feo, R. Kirchner, S. Luckmann, I. Montvay, G. M\""unster,
  K. Spanderen, J. Westphalen","Monte Carlo simulation of SU(2) Yang-Mills theory with light gluinos","latex, 48 pages, 16 figures with epsfig","Eur.Phys.J.C11:507-527,1999","10.1007/s100520050651","DESY 99-029, MS-TPI-99-02","hep-lat hep-th",,"  In a numerical Monte Carlo simulation of SU(2) Yang-Mills theory with light
dynamical gluinos the low energy features of the dynamics as confinement and
bound state mass spectrum are investigated. The motivation is supersymmetry at
vanishing gluino mass. The performance of the applied two-step multi-bosonic
dynamical fermion algorithm is discussed.
","[{""version"":""v1"",""created"":""Wed, 10 Mar 1999 10:08:30 GMT""}]","2010-12-23"
"hep-lat/9903015","Valentin Mitrjushkin","I. L. Bogolubsky (JINR, Dubna), L. Del Debbio (Univ. of Southampton)
  and V.K. Mitrjushkin (JINR, Dubna)","Gribov copies and gauge variant correlators in U(1) lattice gauge theory","11 pages and 4 Postscript figures","Phys.Lett. B463 (1999) 109-116","10.1016/S0370-2693(99)00968-5","JINR E2-99-43 and SHEP/99/01","hep-lat",,"  We discuss the influence of Dirac sheets and zero-momentum modes on the gauge
variant photon correlators $\Gamma(\tau;\vp)$ with $\vp\ne 0$ and $\vp =0$ in
the pure gauge U(1) theory. A special attention has been paid to the $\beta$-
and volume-dependence of this influence. Numerical simulations are performed on
$12\times 6^3$ and $24\times 12^3$ lattices at different $y\beta$'s in the
Coulomb phase.
","[{""version"":""v1"",""created"":""Wed, 10 Mar 1999 13:34:57 GMT""}]","2009-10-31"
"hep-lat/9903016","Jochen Heitger","Jochen Heitger (DESY Zeuthen)","Scaling investigation of renormalized correlation functions in O(a)
  improved quenched lattice QCD","20 pages, latex2e, 6 Postscript figures, uses packages epsfig and
  amssymb","Nucl.Phys. B557 (1999) 309-326","10.1016/S0550-3213(99)00354-5","DESY 99-024","hep-lat",,"  We present a scaling investigation of some correlation functions in $\Or(a)$
improved quenched lattice QCD. In particular, as one observable the
renormalized PCAC quark mass is considered. Others are constructed such that
they become the vector meson mass and the pseudoscalar meson decay constant
when the volume is large. For the present discussion we remain in intermediate
volume, $(0.75^3\times1.5) {fm}^4$ with Schr\""odinger functional boundary
conditions. By fixing the `pion mass' and the spatial lattice size in units of
the hadronic scale $r_0$, we simulated four lattices with resolutions ranging
from 0.1 fm to 0.05 fm and performed the extrapolation to the continuum limit.
The maximal scaling violation found in the improved theory is a $\sim$ 6 %
effect at $a\simeq 0.1 fm$.
","[{""version"":""v1"",""created"":""Wed, 10 Mar 1999 13:53:15 GMT""}]","2015-06-25"
"hep-lat/9903017","Peter Boyle","Peter Boyle","The heavy quarkonium spectrum from quenched lattice QCD","12 pages, 17 figures",,,,"hep-lat",,"  We present results of simulations of the quenched quarkonium spectrum at two
values of the lattice spacing and for quark masses around $m_c$ using the
tadpole improved clover action. Attention is focussed on the lowest lying S and
P states, and the triplet fine structure is obtained for the first time using a
relativistic action.
","[{""version"":""v1"",""created"":""Wed, 10 Mar 1999 15:31:22 GMT""}]","2007-05-23"
"hep-ph/9903292","Misha Stephanov","M. Stephanov, K. Rajagopal and E. Shuryak","Event-by-Event Fluctuations in Heavy Ion Collisions and the QCD Critical
  Point","58 pages, 2 figures; to appear in Phys. Rev. D","Phys. Rev. D 60, 114028 (1999)","10.1103/PhysRevD.60.114028","ITP-SB-99-4, MIT-CTP-2834, SUNY-NTG-99-3","hep-ph nucl-ex nucl-th",,"  The event-by-event fluctuations of suitably chosen observables in heavy ion
collisions at SPS, RHIC and LHC can tell us about the thermodynamic properties
of the hadronic system at freeze-out. By studying these fluctuations as a
function of varying control parameters, it is possible to learn much about the
phase diagram of QCD. As a timely example, we stress the methods by which
present experiments at the CERN SPS can locate the second-order critical
endpoint of the first-order transition between quark-gluon plasma and hadron
matter. Those event-by-event signatures which are characteristic of freeze-out
in the vicinity of the critical point will exhibit nonmonotonic dependence on
control parameters. We focus on observables constructed from the multiplicity
and transverse momenta of charged pions. We first consider how the
event-by-event fluctuations of such observables are affected by Bose-Einstein
correlations, by resonances which decay after freeze-out and by fluctuations in
the transverse flow velocity. We compare our thermodynamic predictions for such
noncritical event-by-event fluctuations with NA49 data, finding broad
agreement. We then focus on effects due to thermal contact between the observed
pions and a heat bath with a given (possibly singular) specific heat, and due
to the direct coupling between the critical fluctuations of the sigma field and
the observed pions. We also discuss the effect of the pions produced in the
decay of sigma particles just above threshold after freeze-out on the inclusive
pion spectrum and on multiplicity fluctuations. We estimate the size of these
nonmonotonic effects which appear near the critical point, including
restrictions imposed by finite size and finite time, and conclude that they
should be easily observable.
","[{""version"":""v1"",""created"":""Tue, 9 Mar 1999 23:37:01 GMT""},{""version"":""v2"",""created"":""Fri, 6 Aug 1999 00:30:36 GMT""}]","2016-08-25"
"hep-ph/9903299","Gilberto Tavares-Velasco","J. L. Diaz-Cruz, M. A. Perez, G. Tavares-Velasco, and J . J. Toscano","Testing flavor-changing neutral currents in the rare decays t->cViVj","RevTeX, 2 epsi figures, 10 pgs. Comments and references added.
  Submitted to Physical Review D","Phys.Rev.D60:115014,1999","10.1103/PhysRevD.60.115014",,"hep-ph",,"  We discuss the Flavor-Changing Neutral Current (FCNC) decays of the top quark
t -> c Vi Vj (Vi=gamma, Z, g) in the framework of the Standard Model (SM) and
in a two-higgs doublet model (2HDM) with tree-level FCNC couplings. While in
the SM the expected branching ratios are extremelly small, in the 2HDM they may
be sizable, of order 10^(-5) - 10^(-5), and thus accesible at the CERN LHC. We
conclude with the interesting observation that the FCNC decay modes may not be
equally suppressed as their corresponding decays t ->c Vi in this 2HDM.
","[{""version"":""v1"",""created"":""Tue, 9 Mar 1999 22:15:31 GMT""},{""version"":""v2"",""created"":""Fri, 30 Jul 1999 00:00:57 GMT""}]","2014-11-17"
"hep-ph/9903300","Fu-Sin Ling","S. Carlier, J.-M. Fr\`ere, F.-S. Ling","Gauge dilution and leptogenesis","5 pages","Phys.Rev. D60 (1999) 096003","10.1103/PhysRevD.60.096003",,"hep-ph",,"  In this paper, we examine how gauge interactions can dilute the lepton
asymmetry in lepton induced baryogenesis. Constraints imposed on Majorana
masses keep this dilution at an acceptable level.
","[{""version"":""v1"",""created"":""Tue, 9 Mar 1999 17:22:18 GMT""}]","2009-10-31"
"hep-ph/9903301","Per Osland","P. Osland (Bergen)","Higgs boson production in e^+e^- and e^-e^- collisions","18 pages, LaTeX, including 13 figures. Invited paper, Epiphany
  Conference on Electron-Positron Colliders, Cracow, January 1999, to appear in
  the proceedings","Acta Phys.Polon.B30:1967-1984,1999",,"Bergen 1999-02","hep-ph",,"  When Higgs boson candidates will be found at future colliders, it becomes
imperative to determine their properties, beyond the mass, production cross
section and decay rates. Other crucial properties are those related to the
behaviour under CP transformations, and the self-couplings. This paper
addresses the question of measurability of some of the trilinear couplings of
MSSM neutral Higgs bosons at a high-energy e^+e^- collider, and the
possibilities of exploring the Higgs boson CP properties at e^+e^- and e^-e^-
colliders.
","[{""version"":""v1"",""created"":""Tue, 9 Mar 1999 19:30:00 GMT""}]","2014-11-17"
"hep-ph/9903302","Evgeny Akhmedov","E. Kh. Akhmedov (IST, Lisbon/Kurchatov Inst., Moscow)","Remarks on parametric resonance of neutrino oscillations in the earth","LaTex, 22 pages, 8 eps figures",,"10.1007/s12043-000-0006-4","FISIST/1-99/CFIF","hep-ph astro-ph hep-ex",,"  Neutrino oscillations in matter can exhibit a specific resonance enhancement
-- parametric resonance, which is different from the MSW resonance. Recently it
has been shown that the oscillations of atmospheric and solar neutrinos inside
the earth can undergo parametric enhancement when neutrino trajectories cross
the core of the earth. In this paper we continue the study of the parametric
resonance of neutrino oscillations in the earth. The following issues are
discussed: stability of the resonance with respect to the variations of the
zenith angle of the neutrino source; higher-order resonances; prospects of the
experimental observation of the parametric resonance of neutrino oscillations.
We also comment on a recent controversy regarding the physical nature of the
resonance enhancement of the oscillations of the core crossing neutrinos in the
earth.
","[{""version"":""v1"",""created"":""Tue, 9 Mar 1999 19:33:30 GMT""}]","2017-08-02"
"hep-ph/9903303","Serguey Petcov","M. Maris and S. T. Petcov","Enhancing the Seasonal Variation Effect in the Case of the Vacuum
  Oscillation Solution of the Solar Neutrino Problem","18 pages latex; the text includes 3 postscript figures and 3 tables","Phys.Lett. B457 (1999) 319-333","10.1016/S0370-2693(99)00543-2","SISSA 13/99/EP, February 1999","hep-ph astro-ph",,"  We study in detail the threshold energy dependence of the seasonal variation
effect in the energy integrated solar neutrino signal of the Super-Kamiokande
detector in the case of the $\nu_{e}\leftrightarrow \nu_{\mu,\tau}$ vacuum
oscillation (VO) solution of the solar neutrino problem. We show, in
particular, that for the values of $\Delta m^2$ and $\sin^22\theta$ from the VO
solution region, the predicted time and threshold e^- energy ($T_{e,Th}$)
dependence of the event rate factorize to a high degree of accuracy. As a
consequence, the VO generated seasonal variation asymmetry is given by the
product of an time-independent function of $T_{e,Th}$ and the standard
geometrical asymmetry. For any given $\Delta m^2$ and $\sin^22\theta$ from the
VO solution region there exists at least one value of $T_{e,Th}$ from the
interval (5 - 11) MeV, for which the seasonal variation effect in the solar
neutrino sample of events, formed by recoil electrons with kinetic energy
$T_{e} \geq T_{e,Th}$, is either maximal or very close to the maximal; it can
vary dramatically with $T_{e,Th}$. Measuring the seasonal effect in each one of
a large number of samples corresponding to different values of $T_{e,Th}$ from
the indicated interval, say, to $T_{e,Th} = 5; 6; 7;...; 11 MeV$, provides a
very effective test of the VO solution. Predictions for the magnitude of the
seasonal effect in such samples are given for a large set of representative
values of $\Delta m^2$ and $\sin^22\theta$ from the VO solution region.
","[{""version"":""v1"",""created"":""Wed, 10 Mar 1999 03:48:18 GMT""}]","2009-10-31"
"hep-ph/9903304","Huang Mei","Mei Huang, Pengfei Zhuang, and Weiqin Chao","Massive Meson Fluctuation in NJL Model","1 REVTeX file, 19 pages including 3 eps figures","Commun.Theor.Phys. 34 (2000) 91","10.1088/0253-6102/34/1/91",,"hep-ph nucl-th",,"  Based on the self-consistent scheme beyond mean-field approximation in the
large $N_c$ expansion, including current quark mass explicitly, a general
scheme of SU(2) NJL model is developed. To ensure the quark self-energy
expanded in the proper order of $N_c$, an approximate internal meson propagator
is deduced, which is in order of $O(1/N_c)$. In our scheme, adopting the method
of external momentum expansion, all the Feynman diagrams are calculated in a
unified way by only expanding the quark propagator. Our numerical results show,
that different from the mean field approximation in which the explicitly chiral
symmetry breaking is invisible, the effect of finite pion mass can be seen
clearly when beyond mean-field approximation.
","[{""version"":""v1"",""created"":""Wed, 10 Mar 1999 07:21:03 GMT""}]","2018-01-17"
"hep-ph/9903305",,"Zoltan Ligeti, Michael Luke, Aneesh V. Manohar, Mark B. Wise","The B -> X_s gamma Photon Spectrum","16 pages, RevTeX","Phys.Rev.D60:034019,1999","10.1103/PhysRevD.60.034019","FERMILAB-Pub-99/025-T, UTPT-99-03, UCSD/PTH 99-03, CALT-68-2211","hep-ph",,"  The photon energy spectrum in inclusive weak radiative B -> X_s gamma decay
is computed to order alpha_s^2 beta_0. This result is used to extract a value
for the HQET parameter $\bar\Lambda$ from the average <1-2E_\gamma/m_B>, and a
value of the parameter $\lambda_1$ from <(1-2E_\gamma/m_B)^2>. An accurate
measurement of <1-2E_\gamma/m_B> can determine the size of the nonperturbative
contributions to the Upsilon(1S) mass which cannot be absorbed into the b quark
pole mass.
","[{""version"":""v1"",""created"":""Wed, 10 Mar 1999 07:37:01 GMT""}]","2011-05-05"
"hep-ph/9903306","Hannes Jung","H. Jung, L. J\""onsson, H. K\""uster (Lund)","The role of resolved virtual photons in the production of forward jets
  at HERA","11 pages (Latex), 4 figures (Postscript) replaced for adding
  reference","Eur.Phys.J.C9:383-388,1999","10.1007/s100529900080","DESY 99-028, LUNFD6/(NFFL-7167) 1999","hep-ph",,"  The measurement of forward jet cross sections has been suggested as a
promising probe of new small x parton dynamics and the question is whether the
new HERA data provide an indication of this. In this paper the influence of
resolved photon processes has been investigated and it has been studied to what
extent the inclusion of such processes in addition to normal deep inelastic
scattering leads to agreement with data. It is shown that two DGLAP evolution
chains from the hard scattering process towards the proton and the photon
respectively, are sufficient to describe effects observed in the HERA data,
which have been attributed to BFKL dynamics.
","[{""version"":""v1"",""created"":""Wed, 10 Mar 1999 10:03:00 GMT""},{""version"":""v2"",""created"":""Thu, 11 Mar 1999 17:03:02 GMT""}]","2014-11-17"
