"hep-ph/9903404","Georg Weiglein","S. Heinemeyer, W. Hollik, G. Weiglein","The Mass of the Lightest MSSM Higgs Boson: A Compact Analytical
  Expression at the Two-Loop Level","14 pages, 4 figures","Phys.Lett. B455 (1999) 179-191","10.1016/S0370-2693(99)00417-7","CERN-TH/99-74, DESY 99-012, KA-TP-1-1999","hep-ph",,"  A compact approximation formula for the mass of the lightest neutral CP-even
Higgs boson, m_h, in the Minimal Supersymmetric Standard Model (MSSM) is
derived from the diagrammatic two-loop result for m_h up to O(alpha alpha_s).
By analytically expanding the diagrammatic result the leading logarithmic and
non-logarithmic as well as the dominant subleading contributions are obtained.
The approximation formula is valid for general mixing in the scalar top sector
and arbitrary choices of the parameters in the Higgs sector of the model. Its
quality is analyzed by comparing it with the full diagrammatic result. We find
agreement with the full result better than 2 GeV for most parts of the MSSM
parameter space.
","[{""version"":""v1"",""created"":""Thu, 18 Mar 1999 20:06:00 GMT""}]","2009-10-31"
"hep-ph/9903405","Manayenkov Serguei","S. I. Manayenkov","Regge description of spin-spin asymmetry in photon diffractive
  dissociation","44 pages, LaTeX, 12 figures",,"10.1007/s10582-000-0014-0","DESY 99--016","hep-ph",,"  We explore the possibility whether the gluon helicity distribution $\Delta
G(x)$ can be extracted from a comparison of experimental data on the
longitudinal spin-spin asymmetry $A_{LL}$ in $\gamma p$ diffractive deep
inelastic scattering with calculations performed within the framework of
perturbative QCD (pQCD). The data could be obtained at the future HERA collider
in scattering of polarized electrons/positrons off polarized protons. In this
paper we look for such kinematical regions where contributions to $A_{LL}$ from
soft processes (reggeon exchanges) are suppressed to guarantee an applicability
of pQCD. It is shown that for the square of the center-of-mass energy
$s_{\gamma p} \geq 10^3 GeV^2$, the hadronic diffractive mass $M_X \leq 10
GeV/c^2$, the momentum transferred to the proton $\Delta_T\leq 0.5 GeV/c$, and
$Q^2\geq4 (GeV/c)^2$ the longitudinal spin-spin asymmetry due to reggeon
exchanges is less than 10^{-4}. This value is presumably lower than the
asymmetry which can be measured with modern experimental technique. This means
that the pQCD prediction can be reliably compared with data in this kinematical
region.
","[{""version"":""v1"",""created"":""Thu, 18 Mar 1999 21:00:48 GMT""},{""version"":""v2"",""created"":""Fri, 19 Mar 1999 16:28:02 GMT""}]","2009-10-31"
"hep-ph/9903406",,"Micheal S. Berger and Biswajoy Brahmachari (Indiana U)","Leptogenesis and Yukawa textures","Revised version, to appear in Phys. ReV. D","Phys.Rev.D60:073009,1999","10.1103/PhysRevD.60.073009",,"hep-ph",,"  We study a set of textures giving rise to correct masses and mixings of the
charged fermions in the context of leptogenesis. The Dirac neutrino texture
pattern is assumed to be identical with the up quark texture. The heavy
Majonana neutrino mass matrix is obtained by inverting the type-I see-saw
formula and using the neutrino masses and mixings required by the solar and
atmospheric neutrino oscillation experiments as input. After making the
feasibility study of the generated lepton asymmetry via the decay of the heavy
right handed neutrino, we compute the generated baryon asymmetry by numerically
solving the supersymmetric Boltzmann equations. We find for these models that
both the hierarchy of the texture as well as the placement of the texture zeros
are important to the viability of leptogenesis as the source of the observed
baryon asymmetry of the universe.
","[{""version"":""v1"",""created"":""Thu, 18 Mar 1999 21:34:12 GMT""},{""version"":""v2"",""created"":""Sat, 17 Jul 1999 19:31:13 GMT""}]","2011-07-19"
"hep-ph/9903407","Bogdan A. Dobrescu","Bogdan A. Dobrescu","Higgs Compositeness from Top Dynamics and Extra Dimensions","7 pages, revtex",,,"FERMILAB-Conf-99/051-T","hep-ph hep-th",,"  The fundamental Higgs doublet may be replaced in the Standard Model by
certain non-perturbative four-quark interactions, whose effect is to induce a
composite Higgs sector responsible for electroweak symmetry breaking. A simple
composite two-Higgs-doublet model is presented. The four-quark interactions
arise naturally if there are either extra spatial dimensions or larger gauge
symmetries at a multi-TeV scale. Some theoretical and phenomenological
implications of these scenarios are discussed.
","[{""version"":""v1"",""created"":""Fri, 19 Mar 1999 02:07:36 GMT""}]","2007-05-23"
"hep-ph/9903408","D. V. Ahluwalia","I. Stancu, D. V. Ahluwalia","L/E-Flatness of the Electron-Like Event Ratio in Super-Kamiokande and a
  Degeneracy in Neutrino Masses","Journal version","Phys.Lett.B460:431-436,1999","10.1016/S0370-2693(99)00811-4",,"hep-ph",,"  We show that the L/E-flatness of the electron-like event ratio in the
Super-Kamiokande atmospheric neutrino data implies the equality of the
expectation values for the muon and tau neutrino masses. We establish this
result by obtaining a set of three constraints on the neutrino-oscillation
mixing matrix as contained in the indicated flatness. The resulting 3x3
neutrino-oscillation matrix depends only on one angle. A remarkable result that
follows directly from this matrix is the consistency between the mixing angles
observed by LSND and Super-Kamiokande.
","[{""version"":""v1"",""created"":""Fri, 19 Mar 1999 04:06:26 GMT""},{""version"":""v2"",""created"":""Thu, 19 Aug 1999 14:12:58 GMT""}]","2008-11-26"
"hep-th/9903160","Lavignac","Zygmunt Lalak, St\'ephane Lavignac and Hans Peter Nilles (Bonn U.)","String Dualities in the Presence of Anomalous U(1) Symmetries","23 pages, LaTeX2e","Nucl.Phys.B559:48-70,1999","10.1016/S0550-3213(99)00400-9","BONN-TH-99-06","hep-th hep-ph",,"  Anomalous U(1) gauge symmetries in type II orientifold theories show some
unexpected properties. In contrast to the heterotic case, the masses of the
gauge bosons are in general of order of the string scale even in the absence of
large Fayet-Iliopoulos terms. Despite this fact, the notion of heterotic-type
II orientifold duality remains a useful concept, although this symmetry does
not seem to hold in all cases considered. We analyse the status of this duality
symmetry, clarify the properties of anomalous U(1) gauge symmetry in the
orientifold picture and comment on the consequences for phenomenological
applications of such anomalous gauge symmetries.
","[{""version"":""v1"",""created"":""Thu, 18 Mar 1999 16:17:42 GMT""}]","2014-11-18"
"hep-th/9903161","Roberto Zucchini","Fiorenzo Bastianelli, Roberto Zucchini","Bosonic Quadratic Actions for 11D Supergravity on AdS_7/4 x S_4/7","16 pages, Plain TeX, no figures, requires AMS font files amssym.def
  and amssym.tex, a few typos corrected","Class.Quant.Grav. 16 (1999) 3673-3684","10.1088/0264-9381/16/11/313","DFUB 99 - 5","hep-th",,"  We determine from 11D supergravity the quadratic bulk action for the physical
bosonic fields relevant for the computation of correlation functions of
normalized chiral operators in D=6, N=(0,2) and D=3, N=8 supersymmetric CFT in
the large N limit, as dictated by the AdS/CFT duality conjecture.
","[{""version"":""v1"",""created"":""Thu, 18 Mar 1999 17:47:18 GMT""},{""version"":""v2"",""created"":""Thu, 1 Apr 1999 12:51:09 GMT""}]","2009-10-31"
"hep-th/9903162","Dr Ian Kogan","Ian I. Kogan","Singletons and Logarithmic CFT in ADS/CFT correspondence","13 pages, LaTex file, corrected typos","Phys.Lett. B458 (1999) 66-72","10.1016/S0370-2693(99)00576-6","OUPT-99-16-P","hep-th",,"  We discuss a possible relation between singletons in $AdS$ space and
logarithmic conformal field theories at the boundary of $AdS$. It is shown that
the bulk Lagrangian for singleton field (singleton dipole) induces on the
boundary the two-point correlation function for logarithmic pair. Bulk
interpretation of mixing between logarithmic operator $D$ and zero mode
operator $C$ under the scale transformation is discussed as well as some other
issues.
","[{""version"":""v1"",""created"":""Thu, 18 Mar 1999 17:50:51 GMT""},{""version"":""v2"",""created"":""Sun, 11 Apr 1999 12:01:55 GMT""}]","2009-10-31"
"hep-th/9903163","Andrew Strominger","Juan Maldacena, Gregory Moore and Andrew Strominger","Counting BPS Blackholes in Toroidal Type II String Theory","23 pages, harvmac. References added",,,,"hep-th",,"  We derive a $U$-duality invariant formula for the degeneracies of BPS
multiplets in a D1-D5 system for toroidal compactification of the type II
string. The elliptic genus for this system vanishes, but it is found that BPS
states can nevertheless be counted using a certain topological partition
function involving two insertions of the fermion number operator. This is
possible due to four extra toroidal U(1) symmetries arising from a Wigner
contraction of a large $\mathcal{N}=4$ algebra $\mathcal{A}_{\kappa,\kappa'}$
for $\kappa' \to \infty$. We also compare the answer with a counting formula
derived from supergravity on $AdS_3\times S^3 \times T^4$ and find agreement
within the expected range of validity.
","[{""version"":""v1"",""created"":""Thu, 18 Mar 1999 22:52:14 GMT""},{""version"":""v2"",""created"":""Fri, 14 May 1999 21:20:59 GMT""}]","2017-09-07"
"hep-th/9903164","Christophe Grojean","C. Grojean and J. Mourad","Super Fivebranes near the boundary of $AdS_7\times S^4$","22 pages, LaTex","Nucl.Phys. B567 (2000) 133-150","10.1016/S0550-3213(99)00335-1","LPTM 99/77, Saclay T99/028","hep-th",,"  We determine, to the first order in the radius of Anti-de-Sitter, the
realisation of the $OSp(6,2|2)$ superconformal algebra on vector fields. We
then calculate, to this order, the superspace metric describing the background
of $AdS_7\times S^4$. The coordinates we work with are adapted to a 6+5
splitting of the eleven dimensional superspace. Finally, we deduce in a
manifestly supersymmetric form the equations governing the dynamics of the
fivebrane near the boundary of $AdS_7$.
","[{""version"":""v1"",""created"":""Thu, 18 Mar 1999 21:06:39 GMT""}]","2015-06-26"
"hep-th/9903165","Joe Polchinski","Joseph Polchinski","M-Theory and the Light Cone","13 pages, LaTex with PTPTeX.sty, 3 epsf figures. Minor corrections
  and clarifications. References revised","Prog.Theor.Phys.Suppl.134:158-170,1999","10.1143/PTPS.134.158","NSF-ITP-99-17","hep-th",,"  I discuss D0-brane quantum mechanics as a nonperturbative formulation of
string theory, in particular the relation between the
Banks-Fischler-Shenker-Susskind matrix model, the Maldacena conjecture for
D0-branes, and type IIA/M-theory duality. Some features of the quantum
mechanics of D0-branes are also discussed. Lecture presented at the
Nishinomiya-Yukawa Memorial Symposium, Nov. 1998.
","[{""version"":""v1"",""created"":""Fri, 19 Mar 1999 00:44:32 GMT""},{""version"":""v2"",""created"":""Mon, 14 Jun 1999 22:08:53 GMT""}]","2008-11-26"
"math-ph/9903036","Mireille Boutin","Mireille Boutin","Numerically Invariant Signature Curves","21 pages, amsart, uses verbatim, amsmath, latexsym, amssymb, epsf 55
  pictures",,,,"math-ph cs.CV math.MP",,"  Corrected versions of the numerically invariant expressions for the affine
and Euclidean signature of a planar curve proposed by E.Calabi et. al are
presented. The new formulas are valid for fine but otherwise arbitrary
partitions of the curve. We also give numerically invariant expressions for the
four differential invariants parametrizing the three dimensional version of the
Euclidean signature curve, namely the curvature, the torsion and their
derivatives with respect to arc length.
","[{""version"":""v1"",""created"":""Thu, 18 Mar 1999 22:41:39 GMT""},{""version"":""v2"",""created"":""Fri, 19 Mar 1999 16:25:54 GMT""}]","2007-05-23"
"math/9903111","Scott Crass","Scott Crass","Solving the sextic by iteration: A study in complex geometry and
  dynamics","71 pages, 14 figures",,,,"math.DS",,"  Recently, Peter Doyle and Curt McMullen devised an iterative solution to the
fifth degree polynomial. At the method's core is a rational mapping of the
Riemann sphere with the icosahedral symmetry of a general quintic. Moreover,
this map posseses ""reliable"" dynamics: for almost any initial point, its
trajectory converges to one of the periodic cycles that comprise an icosahedral
orbit. This symmetry-breaking provides for a reliable or ""generally-convergent""
quintic-solving algorithm: with almost any fifth-degree equation, associate a
rational map that has reliable dynamics and whose attractor consists of points
from which one computes a root.
  An algorithm that solves the sixth-degree equation requires a dynamical
system with the symmetry of the alternating group on six things. This group
does not act on the Riemmann sphere, but does act on the complex projective
plane--this is the Valentiner group. The present work exploits the resulting
2-dimensional geometry in finding a Valentiner-symmetric rational map whose
elegant dynamics experimentally appear to be reliable in the above
sense--transferred to the 2-dimensional setting. This map provides the central
feature of a conjecturally-reliable sextic-solving procedure analogous to that
employed in the quintic case. The paper culminates in an explicit description
of the algorithm.
","[{""version"":""v1"",""created"":""Thu, 18 Mar 1999 16:43:39 GMT""}]","2016-09-07"
"math/9903112","Sergey Finashin","Sergey Finashin","A Rokhlin Conjecture and Smooth Quotients by the Complex Conjugation of
  Singular Real Algebraic Surfaces","AMS-TeX,11 pages,2 figures",,,"Math 99/181","math.GT",,"  The topology of the orbit space, $Y$, for the action of the complex
conjugation on a complex surface, $X$, defined over reals, is studied. I give a
criterion for blow-up stable triviality of $Y$ (which implies vanishing of its
Seiberg-Witten invariants). The main result concerns the double planes branched
along the complexification of reducible real curves with 2 non-singular
components. In connection with it, I analize the real singularities of $X$
which become smooth in $Y$ (after taking quotient).
","[{""version"":""v1"",""created"":""Thu, 18 Mar 1999 20:07:35 GMT""}]","2007-05-23"
"math/9903113","Timothy J. Hodges","Timothy J. Hodges","Generating functions for the coefficients of the Cremmer-Gervais
  R-matrices",,,,,"math.QA",,"  The coefficients of certain operators on $V\otimes V$ can be constructed
using generating functions. Necessary and sufficient conditions are given for
some such operators to satisfy the Yang-Baxter equation. As a corollary we
obtain a simple, direct proof that the Cremmer-Gervais R-matrices satisfy the
Yang-Baxter equation. This approach also clarifies Cremmer and Gervais's
original proof via the dynamical Yang-Baxter equation.
","[{""version"":""v1"",""created"":""Thu, 18 Mar 1999 20:46:32 GMT""}]","2007-05-23"
"math/9903114","Shelah Office","Sakae Fuchino, Heike Mildenberger, Saharon Shelah and Peter Vojtas","On absolutely divergent series",,,,"Shelah [FMShV:593]","math.LO",,"  We show that in the aleph_2-stage countable support iteration of Mathias
forcing over a model of CH the complete Boolean algebra generated by absolutely
divergent series under eventual dominance is not isomorphic to the completion
of P(omega)/fin. This complements Vojtas' result, that under cf(c)=p the two
algebras are isomorphic
","[{""version"":""v1"",""created"":""Thu, 18 Mar 1999 22:38:58 GMT""}]","2007-05-23"
"math/9903115","Chongying Dong","Chongying Dong, Ching Hung Lam and Hiromichi Yamada","Decomposition of the vertex operator algebra V_{\sqrt{2}A_3}","10 pages, LaTex",,,,"math.QA",,"  For vertex operator algebra V_{\sqrt{2}A_l} associated to the even lattice
\sqrt{2}A_l which is \sqrt{2} times root lattice of type A_l, it was shown by
Dong-Li-Maosn-Norton that the Virasoro vector is a sum of l+1 mutually
orthogonal conformal vectors with central charges c_i=1-6/(i+2)(i+3) for
i=1,...,l and c_{l+1}=2l/(l+3) and the subalgebra T generated by these vectors
is a tensor product of Virasoro vertex operator algebras L(c_i,0). In this
paper we determine the decomposition of V_{\sqrt{2}A_3} into the sum of
irreducible T-modules completely.
","[{""version"":""v1"",""created"":""Thu, 18 Mar 1999 22:56:30 GMT""}]","2007-05-23"
"math/9903116","Shelah Office","Saharon Shelah and Otmar Spinas","On incomparability and related cardinal functions on ultraproducts of
  Boolean algebras",,,,"Shelah [ShSi:677]","math.LO math.GN",,"  Let C denote any of the following cardinal characteristics of Boolean
algebras: incomparability, spread, character, pi-character, hereditary Lindelof
number, hereditary density. It is shown to be consistent that there exists a
sequence <B_i:i<kappa> of Boolean algebras and an ultrafilter D on kappa such
that C(prod_{i<kappa}B_i/D)<|prod_{i<kappa}C(B_i)/D|. This answers a number of
problems posed by Monk.
","[{""version"":""v1"",""created"":""Thu, 18 Mar 1999 23:29:10 GMT""}]","2007-05-23"
"physics/9903032","Vladimir Balandin","V. V. Balandin and N.I. Golubeva (Institute for Nuclear Research of
  RAS, Moscow, Russia.)","Hamiltonian Methods for the Study of Polarized Proton Beam Dynamics in
  Accelerators and Storage Rings","103 pages. Latex. No figures","AIP Conf.Proc.391:282-290,2004","10.1063/1.52352","DESY 98-016","physics.acc-ph",,"  The equations of classical spin-orbit motion can be extended to a Hamiltonian
system in 9-dimensional phase space by introducing a coupled spin-orbit Poisson
bracket and a Hamiltonian function. After this extension and by establishing
connections between initial and extended systems it becomes possible to apply
the methods of the theory of Hamiltonian systems to the study of polarized
particle beam dynamics in circular accelerators and storage rings. Some of
those methods have been implemented in the computer code FORGET-ME-NOT.
","[{""version"":""v1"",""created"":""Thu, 18 Mar 1999 18:54:50 GMT""}]","2015-06-26"
"quant-ph/9903063","Daniel F. V. James","G.P. Berman, D.F.V. James, R.J. Hughes, M.S. Gulley, M.H. Holzscheiter
  and G.V. Lopez","Dynamical Stability and Quantum Chaos of Ions in a Linear Trap","24 pages, 17 figures, submitted to Phys. Rev A",,"10.1103/PhysRevA.61.023403","LAUR-99-1217","quant-ph",,"  The realization of a paradigm chaotic system, namely the harmonically driven
oscillator, in the quantum domain using cold trapped ions driven by lasers is
theoretically investigated. The simplest characteristics of regular and chaotic
dynamics are calculated. The possibilities of experimental realization are
discussed.
","[{""version"":""v1"",""created"":""Thu, 18 Mar 1999 23:43:58 GMT""}]","2009-10-31"
"quant-ph/9903066","Caroline H. Thompson","Caroline H. Thompson (Department of Computer Science, University of
  Wales Aberystwyth)","Subtraction of ``accidentals'' and the validity of Bell tests","Section on Clauser and Horne's 1974 Bell test derivations corrected
  and extended. One ref added, and other minor improvements. Submitted to Phys
  Rev A. See also quant-ph/9611037, quant-ph/9711044 and other documents at
  <http://www.aber.ac.uk/~cat>. Material expands that of 9711044 and includes
  derivation of Clauser and Horne's experimentally useful 1974 Bell test",,,,"quant-ph",,"  In some key Bell experiments, including two of the well-known ones by Alain
Aspect, 1981-2, it is only after the subtraction of ``accidentals'' from the
coincidence counts that we get violations of Bell tests. The data adjustment,
producing increases of up to 60% in the test statistics, has never been
adequately justified. Few published experiments give sufficient information for
the reader to make a fair assessment. There is a straightforward and well known
realist model that fits the unadjusted data very well. In this paper, the logic
of this realist model and the reasoning used by experimenters in justification
of the data adjustment are discussed. It is concluded that the evidence from
all Bell experiments is in urgent need of re-assessment, in the light of all
the known ``loopholes''. Invalid Bell tests have frequently been used,
neglecting improved ones derived by Clauser and Horne in 1974. ``Local causal''
explanations for the observations have been wrongfully neglected.
","[{""version"":""v1"",""created"":""Thu, 18 Mar 1999 16:59:31 GMT""},{""version"":""v2"",""created"":""Wed, 21 Apr 1999 17:43:15 GMT""}]","2007-05-23"
"solv-int/9903013","Takayuki Tsuchida","T. Tsuchida, H. Ujino, M. Wadati (University of Tokyo)","Integrable semi-discretization of the coupled nonlinear Schr\""{o}dinger
  equations","27 pages, LaTeX2e (IOP style)","J. Phys. A: Math. Gen. 32 (1999) 2239-2262","10.1088/0305-4470/32/11/016",,"solv-int nlin.SI",,"  A system of semi-discrete coupled nonlinear Schr\""{o}dinger equations is
studied. To show the complete integrability of the model with multiple
components, we extend the discrete version of the inverse scattering method for
the single-component discrete nonlinear Schr\""{o}dinger equation proposed by
Ablowitz and Ladik. By means of the extension, the initial-value problem of the
model is solved. Further, the integrals of motion and the soliton solutions are
constructed within the framework of the extension of the inverse scattering
method.
","[{""version"":""v1"",""created"":""Thu, 18 Mar 1999 16:39:08 GMT""}]","2007-05-23"
