"astro-ph/9903300","Kenneth M. Nollett","Scott Burles, Kenneth M. Nollett, and Michael S. Turner","Big-Bang Nucleosynthesis: Linking Inner Space and Outer Space","Text and 7 color eps figures from poster for the DAP ""Great
  Discoveries in Astronomy in the Last 100 Years"" exhibit at APS centennial
  meeting; gif of 36""x36"" poster available at
  http://gamma.nrl.navy.mil/dap-aps/dapaps/indexp2.htm",,,,"astro-ph",,"  We summarize the history, theory, observational status, and implications of
big-bang nucleosynthesis.
","[{""version"":""v1"",""created"":""Fri, 19 Mar 1999 00:12:40 GMT""}]","2007-05-23"
"astro-ph/9903301","Rosa M. Gonzalez Delgado","Rosa M. Gonzalez Delgado","The massive Stellar Content in Starburst Galaxies and its Impact on
  Galaxy Evolution","Invited talk to the conference ""The Evolution of Glaxies on
  Cosmological Timescales"" 13 pages+8 figures",,,,"astro-ph",,"  Starburst galaxies are powered by massive stars. These stars dominate the
heating and enrichment with heavy elements of the interstellar medium, gas out
of which new stars form. Thus, high-mass stars, and in consequence starburst
galaxies, are an important (in some cases the dominant) energy source for the
evolution of galaxies and the universe. In this contribution I review
techniques to derive the massive stellar content in starburst galaxies and
their evolutionary state. They are based on the analysis of their integrated
light with evolutionary synthesis models. The massive stellar population is
derived in a self-consistent way using the continuum and stellar wind resonance
lines in the ultraviolet, the photospheric H Balmer and HeI lines and the
nebular emission lines at optical wavelengths. Comparison with observations
provides constraints on the most recent star formation history in starburst
galaxies and their evolutionary state.
","[{""version"":""v1"",""created"":""Fri, 19 Mar 1999 06:26:34 GMT""}]","2007-05-23"
"chao-dyn/9903025","Per Dahlquist","Per Dahlqvist","Escape from intermittent repellers- Periodic orbit theory for crossover
  from exponential to algebraic decay","12 pages, 5 postscript figures. Major revisions",,"10.1103/PhysRevE.60.6639",,"chao-dyn cond-mat.mes-hall nlin.CD",,"  We apply periodic orbit theory to study the asymptotic distribution of escape
times from an intermittent map. The dynamical zeta function exhibits a branch
point which is associated with an asymptotic power law escape. By an analytic
continuation technique we compute a zero of the zeta function beyond its radius
of convergence leading to a pre-asymptotic exponential decay. The time of
crossover from an exponential to a power law is also predicted. The theoretical
predictions are confirmed by numerical simulation. Applications to conductance
fluctuations in quantum dots are discussed.
","[{""version"":""v1"",""created"":""Thu, 18 Mar 1999 16:24:58 GMT""},{""version"":""v2"",""created"":""Tue, 18 May 1999 10:56:52 GMT""}]","2009-10-31"
"cond-mat/9903289","Tim Newman","Wannapong Triampo and T. J. Newman","Binary data corruption due to a Brownian agent II: two dimensions,
  competing agents, and generalized couplings","46 pages, 10 figures, RevTeX",,"10.1103/PhysRevE.60.1450",,"cond-mat.stat-mech",,"  This work is a continuation of our previous investigation of binary data
corruption due to a Brownian agent [T. J. Newman and W. Triampo, preprint
cond-mat/9811237]. We extend our study in three main directions which allow us
to make closer contact with real bistable systems. These are i) a detailed
analysis of two dimensions, ii) the case of competing agents, and iii) the
cases of asymmetric and quenched random couplings. Most of our results are
obtained by extending our original phenomenological model, and are supported by
extensive numerical simulations.
","[{""version"":""v1"",""created"":""Thu, 18 Mar 1999 17:18:03 GMT""}]","2009-10-31"
"cond-mat/9903290","Leo Radzihovsky","Brad Jacobsen (1), Karl Saunders (2), Leo Radzihovsky (1), John Toner
  (2) ((1) University of Colorado at Boulder (2) University of Oregon)","Two new topologically ordered glass phases of smectics confined in
  anisotropic random media","4 RevTeX pgs, 2 eps figures, submitted to Phys. Rev. Lett","Phys. Rev. Lett, 83, 1363 (1999)","10.1103/PhysRevLett.83.1363","University of Colorado preprint","cond-mat.soft cond-mat.dis-nn cond-mat.stat-mech",,"  We show that smectic liquid crystals confined in_anisotropic_ porous
structures such as e.g.,_strained_ aerogel or aerosil exhibit two new glassy
phases. The strain both ensures the stability of these phases and determines
their nature. One type of strain induces an ``XY Bragg glass'', while the other
creates a novel, triaxially anisotropic ``m=1 Bragg glass''. The latter
exhibits anomalous elasticity, characterized by exponents that we calculate to
high precision. We predict the phase diagram for the system, and numerous other
experimental observables.
","[{""version"":""v1"",""created"":""Thu, 18 Mar 1999 17:37:33 GMT""}]","2009-10-31"
"cond-mat/9903291","Andrzej Golnik","D.Munzar, C.Bernhard, A.Golnik, J.Humlicek, and M.Cardona","Anomalies of the infrared-active phonons in underdoped YBCO as an
  evidence for the intra-bilayer Josephson effect","Revtex, epsf, 6 pages, 3 figures encapsulated in text",,"10.1016/S0038-1098(99)00377-4",,"cond-mat.supr-con",,"  The spectra of the far-infrared c-axis conductivity of underdoped YBCO
crystals exhibit dramatic changes of some of the phonon peaks when going from
the normal to the superconducting state. We show that the most striking of
these anomalies can be naturally explained by changes of the local fields
acting on the ions arising from the onset of inter- and intra-bilayer Josephson
effects.
","[{""version"":""v1"",""created"":""Thu, 18 Mar 1999 18:25:24 GMT""}]","2009-10-31"
"cond-mat/9903292","Sergey Kravchenko","M. P. Sarachik and S. V. Kravchenko","Novel Phenomena in Dilute Electron Systems in Two Dimensions","To appear as a Perspective in the Proceedings of the National Academy
  of Sciences. Reference to Chakravarty, Kivelson, Nayak, and Voelker's paper
  added (Phil. Mag., in press)","Proc. Natl. Acad. Sci. USA 96, 5900 (1999)","10.1073/pnas.96.11.5900",,"cond-mat.str-el",,"  We review recent experiments that provide evidence for a transition to a
conducting phase in two dimensions at very low electron densities. The nature
of this phase is not understood, and is currently the focus of intense
theoretical and experimental attention.
","[{""version"":""v1"",""created"":""Thu, 18 Mar 1999 23:09:46 GMT""},{""version"":""v2"",""created"":""Fri, 26 Mar 1999 21:32:22 GMT""}]","2007-05-23"
"cond-mat/9903293","Patrick Warren","A. J. Masters, P. B. Warren","Kinetic theory for dissipative particle dynamics: the importance of
  collisions","7 pages, 2 figures",,"10.1209/epl/i1999-00105-4",,"cond-mat.stat-mech cond-mat.soft",,"  Kinetic theory of dissipative particle dynamics is developed in terms of a
Boltzmann pair collision theory. The kinetic transport coefficients are
computed from explicit collision integrals and compared favourably with
detailed simulations. Previous theory is found to correspond to a weak
scattering limit, or Vlasov theory, and previously reported discrepancies with
simulations are thereby resolved. In the large dissipation limit, we find
qualitatively new scaling properties for the transport coefficients.
","[{""version"":""v1"",""created"":""Thu, 18 Mar 1999 23:13:31 GMT""}]","2009-10-31"
"cond-mat/9903294","Chetan Nayak","Leon Balents, Matthew P. A. Fisher, Chetan Nayak","Dual Vortex Theory of Strongly Interacting Electrons: Non-Fermi Liquid
  to the (Hard) Core","Modified dicussion of the hard-core model, correcting several
  mistakes",,"10.1103/PhysRevB.61.6307",,"cond-mat.str-el cond-mat.supr-con",,"  As discovered in the quantum Hall effect, a very effective way for
strongly-repulsive electrons to minimize their potential energy is to aquire
non-zero relative angular momentum. We pursue this mechanism for interacting
two-dimensional electrons in zero magnetic field, by employing a representation
of the electrons as composite bosons interacting with a Chern-Simons gauge
field. This enables us to construct a dual description in which the fundamental
constituents are vortices in the auxiliary boson fields. The resulting
formalism embraces a cornucopia of possible phases. Remarkably,
superconductivity is a generic feature, while the Fermi liquid is not --
prompting us to conjecture that such a state may not be possible when the
interactions are sufficiently strong. Many aspects of our earlier discussions
of the nodal liquid and spin-charge separation find surprising incarnations in
this new framework.
","[{""version"":""v1"",""created"":""Thu, 18 Mar 1999 22:32:28 GMT""},{""version"":""v2"",""created"":""Fri, 2 Apr 1999 23:36:34 GMT""}]","2009-10-31"
"cond-mat/9903295","Takao Morinari","Takao Morinari","The role of imaginary vector potential in composite fermion pairing
  theory","3 pages",,,,"cond-mat.mes-hall",,"  We show that the imaginary vector potential causes a pair-breaking effect in
the composite fermion theory, and discuss its irrelevance in the pairing state.
The Hamiltonian for pairing states of composite fermions is proposed. The
advantage of non-unitary transformations and the meaning of the non-Hermitian
term are discussed.
","[{""version"":""v1"",""created"":""Fri, 19 Mar 1999 01:33:29 GMT""}]","2007-05-23"
"cond-mat/9903296","Miguel Angel Ojeda Lopez","Miguel A. Ojeda and J. Dorantes-Davila (Instituto de Fisica,
  Universidad Aut\'onoma de San Luis Potosi, San Luis Potosi, Mexico), G. M.
  Pastor (Laboratoire de Physique Quantique, Unite Mixte de Recherche 5626 du
  CNRS, Universite Paul Sabatier, Toulouse, France)","Noncollinear cluster magnetism in the framework of the Hubbard model","Latex, two-colums 13 pages, 9 figures",,"10.1103/PhysRevB.60.6121",,"cond-mat.str-el",,"  Noncollinear magnetic states in clusters are studied by using the single-band
Hubbard Hamiltonian. The unrestricted Hartree-Fock (UHF) approximation is
considered without imposing any symmetry constraints neither to the size or
orientation of the local magnetic moments $<\vec S_l>$ nor to the local charge
densities $<n_l>$. A variety of qualitatively different selfconsistent
solutions is obtained as a function of cluster size, structure, number of
valence electrons $\nu$ and Coulomb interaction strength $U/t$. This includes
inhomogeneous density distributions, paramagnetic solutions, magnetic solutions
with collinear moments and noncollinear spin arrangements that show complex
antiferromagnetic and ferromagnetic-like orders. The environment dependence of
the magnetic properties is analyzed giving emphasis to the effects of
antiferromagnetic frustrations in compact structures close to half-band
filling. Electron correlation effects are quantified by comparing UHF and exact
results for the local magnetic moments, total spin, spin-correlation functions
and structural stability of 13-atom clusters. Goals and limitations of the
present noncollinear approach are discussed.
","[{""version"":""v1"",""created"":""Fri, 19 Mar 1999 03:16:23 GMT""},{""version"":""v2"",""created"":""Sun, 21 Mar 1999 02:25:11 GMT""}]","2009-10-31"
"cs/9903013","Tapas K. Das","Tapas Kumar Das","The Impact of Net Culture on Mainstream Societies: a Global Analysis","8 pages, no figure, Submitted to The Economic and Political Weekly",,,,"cs.CY",,"  In this work the impact of the Internet culture on standard mainstream
societies has been analyzed. After analytically establishing the fact that the
Net can be viewed as a pan-societal superstructure which supports its own
distinct culture, an ethnographic analysis is provided to find out the key
aspects of this culture. The elements of this culture which have an empowering
impacts on the standard mainstream societies, as well as the elements in it
which can cause discouraging social effects are then discussed by a global
investigation of the present status of various fundamental aspects (e,g,
education, economics, politics, entertainment etc) of the mainstream societies
as well as their links with the Net culture. Though immensely potential for
providing various prominent positive impacts, the key findings of this work
indicate that misuse of Internet can create tremendous harm to the members of
the mainstream societies by generating a set of morally crippled people as well
as a future generation completely void of principles and ethics. This
structured diagnostic approach to the social problems caused by the manhandling
of Internet leads to a concrete effort of providing the measures that can be
taken to enhance or to overcome the supporting and limiting effects of the Net
culture respectively with the intent to benefit our society and to protect the
teratoidation of certain ethical values.
","[{""version"":""v1"",""created"":""Thu, 18 Mar 1999 17:01:27 GMT""}]","2007-05-23"
"gr-qc/9903070","S. M. Kopeikin","Sergei M. Kopeikin","Timing Effects of Gravitational Waves from Localized Sources","6 pages, 2 figures, a talk given at the XXXIVth Rencontres de Moriond
  on ""Gravitational Waves and Experimental Gravity"", Les Arcs, 23-30 January
  1999",,,,"gr-qc astro-ph",,"  Localized astronomical sources like a double stellar system, rotating neutron
star, or a massive black hole at the center of the Milky Way emit periodic
gravitational waves. For a long time only a far-zone contribution of
gravitational fields of the localized sources (plane-wave-front approximation)
were a matter of theoretical analysis. We demonstrate how this analysis can be
extended to take into account near-zone and intermediate-zone contributions as
well. The formalism is used to calculate gravitational-wave corrections to the
Shapiro time delay in binary pulsars and low-frequency (LF) pulsar timing noise
produced by an ensemble of double stars in our galaxy.
","[{""version"":""v1"",""created"":""Thu, 18 Mar 1999 22:38:37 GMT""}]","2007-05-23"
"gr-qc/9903071","Manoelito M. de Souza","Manoelito M. de Souza, Robson N. Silveira","Gauss vs Coulomb and the Cosmological Mass-deficit Problem","7 pages 1 ps figure",,,,"gr-qc astro-ph hep-th",,"  In a previous work General Relativity has been presented as a microscopic
theory of finite and discrete point-like fields that we associate to a
classical description of gravitons. The standard macroscopic continuous field
is retrieved as an average-valued field through an integration over these
gravitons. Here we discuss extreme alternative (the Gauss's and the Coulomb's)
ways of obtaining and interpreting the averaged fields, how they depend on the
kind of measurements involved, and how do they fit with the experimental data.
The field measurements in the classical tests of general relativity correspond
to the Coulomb's mode whereas the determination of the overall spacetime
curvature in a cosmological scale is clearly a Gauss's mode. As a natural
consequence there is no missing mass and, therefore, no such a need of dark
mass as the value predicted by General Relativity, in the context of the
Gauss's mode, agrees with the observed one.
","[{""version"":""v1"",""created"":""Thu, 18 Mar 1999 20:40:12 GMT""}]","2007-05-23"
"gr-qc/9903072","Chris Isham","J.Butterfield and C.J.Isham","Spacetime and the Philosophical Challenge of Quantum Gravity","To appear in ``Physics meets Philosophy at the Planck Scale'', ed. C.
  Callender and N. Huggett, Cambridge University Press (2000)",,,"Imperial/TP/98--99/45","gr-qc",,"  We survey some philosophical aspects of the search for a quantum theory of
gravity, emphasising how quantum gravity throws into doubt the treatment of
spacetime common to the two `ingredient theories' (quantum theory and general
relativity), as a 4-dimensional manifold equipped with a Lorentzian metric.
After an introduction, we briefly review the conceptual problems of the
ingredient theories and introduce the enterprise of quantum gravity We then
describe how three main research programmes in quantum gravity treat four
topics of particular importance: the scope of standard quantum theory; the
nature of spacetime; spacetime diffeomorphisms, and the so-called problem of
time. By and large, these programmes accept most of the ingredient theories'
treatment of spacetime, albeit with a metric with some type of quantum nature;
but they also suggest that the treatment has fundamental limitations. This
prompts the idea of going further: either by quantizing structures other than
the metric, such as the topology; or by regarding such structures as
phenomenological. We discuss this in Section \ref{Sec:TowardsQuST}.
","[{""version"":""v1"",""created"":""Thu, 18 Mar 1999 21:24:11 GMT""}]","2007-05-23"
"gr-qc/9903073","R. Michael Jones","R. Michael Jones (CIRES, University of Colorado, Boulder, Colorado,
  U.S.A.)","The classical action for a Bianchi VI_h model","Latex, 31 pages",,,,"gr-qc",,"  An estimate for the classical action for a Bianchi VI_h homogeneous spatially
closed cosmology is presented as a function of b, a parameter of the model that
is proportional to the relative rotation of the average inertial frame and the
bulk of matter in the universe. It is assumed (through the equation of state)
that a relativistic early universe is followed by a matter-dominated late
universe. The action is used in a saddlepoint approximation to a semiclassical
estimate for the wave function in quantum cosmology to explain why our inertial
frame seems not to rotate relative to the stars. The saddlepoint is at b=0, as
would be expected. Application of the saddlepoint approximation leads to the
result that only those classical geometries whose action differs from the
saddlepoint value for the action by an amount less than Planck's constant
contribute significantly to the integration to give the present value of the
wave function. Using estimates for our universe implies that only those
classical geometries for which the present relative rotation rate of inertial
frames and matter are less than about 10^(-130) radians per year contribute
significantly to the integration. This is well below the limit set by
experiment. The result depends on the ratio of the Hubble distance to the
Planck length, but does not depend on the details of the theory of quantum
gravity.
","[{""version"":""v1"",""created"":""Thu, 18 Mar 1999 22:37:50 GMT""}]","2007-05-23"
"gr-qc/9903074","D. V. Ahluwalia","D. V. Ahluwalia (Zacatecas)","Quantum Gravity - Testing Time for Theories",,"Nature 398:199,1999","10.1038/18325",,"gr-qc astro-ph hep-ph hep-th",,"  The extreme smallness of both the Planck length, on the one side, and the
ratio of the gravitational to the electrical forces between, say, two
electrons, on the other side has led to a widespread belief that the realm of
quantum gravity is beyond terrestrial experiments. A series of classical and
quantum arguments are put forward to dispel this view. It is concluded that
whereas the smallness of the Planck length and the ratio of gravitational to
electrical forces, does play its own essential role in nature, it does not make
quantum gravity a science where humans cannot venture to probe her secrets. In
particular attention is drawn to the latest neutron and atomic interferometry
experiments, and to gravity wave interferometers. The latter, as Giovanni
Amelino-Camelia argues [Nature 398, 216 (1999)], can be treated as probes of
space-time fuzziness down to Planck length for certain quantum-gravity models.
","[{""version"":""v1"",""created"":""Thu, 18 Mar 1999 23:20:19 GMT""}]","2011-06-16"
"gr-qc/9903075","Douglas Singleton","Vladimir Dzhunushaliev and Douglas Singleton","Wormholes and Flux Tubes in Kaluza-Klein Theory","6 pgs. Revtex, 1 Figure, Talk given at DPF 99",,,,"gr-qc",,"  In this work spherically symmetric solutions to 5D Kaluza-Klein theory, with
""electric"" and/or ""magnetic"" fields are examined. Different relative strengths
of the ""electric"" and ""magnetic"" charges of the solutions are studied by
varying certain parameters in our metric ansatz. As the strengths of these two
charges are varied the resultant spacetime exhibits an interesting ""evolution"".
","[{""version"":""v1"",""created"":""Fri, 19 Mar 1999 00:54:23 GMT""}]","2007-05-23"
"hep-ex/9903045","Asish Satpathy","Asish Satpathy (University of Cincinnati)","Particle Identification with BELLE","5 page, 10 figures, Will apprear in DPF conference proceedings",,,"UC-99-3","hep-ex",,"  The working principle and performance of the BELLE particle identification
device (PID), based on a hybrid system consisting of an array of high precision
scintillator Time of Flight and silica Aerogel Counters, is discussed. The
performances achieved in the beam tests are satisfactory and Monte Carlo tests
of meeting physics objectives of BELLE are promising. Prior to the real
experiment which is expected to commence in spring 1999, the BELLE PID is
taking cosmic ray data for calibration and fine tuning.
","[{""version"":""v1"",""created"":""Thu, 18 Mar 1999 16:05:49 GMT""}]","2007-05-23"
"hep-ex/9903046","Richard Cross","Richard Cross(University of Wisconsin-Madison)","Structure Functions, the Gluon Density, and PQCD Tests","7 pages, LateX",,,,"hep-ex",,"  Measurements of the proton structure function F_2 for 0.11 < Q^2 < 20000
GeV^2 and 1.2 X 10^-5 < x < 0.65 from ZEUS 1994-1997 measurements are
presented. From ZEUS 1994 and 1995 F_2 data the slopes d(F_2)/d(ln Q^2) at
fixed x and d(ln F_2)/d(ln(1/x)) for x < 0.01 at fixed Q^2 are derived. For the
latter E665 data are also used. The transition region in Q^2 is explored using
the simplest non-perturbative models and NLO QCD. The data at very low Q^2 <=
0.65 GeV^2 are described successfully by Regge theory. From a NLO QCD fit to
ZEUS data the gluon density in the proton is extracted in the range 3 X 10^-5 <
x < 0.7. Data from NMC and BCDMS constrain the fit at large x. Assuming the NLO
QCD description to be valid down to Q^2 of 1 GeV^2, it is found that the qqbar
sea distribution is still rising at small x and the lowest Q^2 values whereas
the gluon distribution is strongly suppressed. Preliminary ZEUS 1996-1997 $F_2$
measurements are also presented.
","[{""version"":""v1"",""created"":""Fri, 19 Mar 1999 00:02:10 GMT""}]","2007-05-23"
"hep-ph/9903392","Stefan Scherer","S. Scherer, S. A. Bass, M. Belkacem, M. Bleicher, J. Brachmann, A.
  Dumitru, C. Ernst, L. Gerland, N. Hammon, M. Hofmann, J. Konopka, L. Neise,
  M. Reiter, S. Schramm, S. Soff, C. Spieles, H. Weber, D. Zschiesche, J.A.
  Maruhn, H. St\""ocker, W. Greiner (J. W. Goethe-Universit\""at, Frankfurt am
  Main, Germany, Duke University, Durham, USA, Yale University, New Haven, USA,
  Lawrence Berkeley Laboratory, Berkeley, USA)","Physics opportunities at RHIC and LHC","Proceedings of the Klaus Kinder-Geiger Day",,"10.1063/1.59576",,"hep-ph",,"  Nonequilibrium models (three-fluid hydrodynamics, UrQMD, and quark molecular
dynamics) are used to discuss the uniqueness of often proposed experimental
signatures for quark matter formation in relativistic heavy ion collisions from
the SPS via RHIC to LHC. It is demonstrated that these models -- although they
do treat the most interesting early phase of the collisions quite differently
(thermalizing QGP vs. coherent color fields with virtual particles) -- all
yield a reasonable agreement with a large variety of the available heavy ion
data. Hadron/hyperon yields, including $J/\Psi$ meson production/suppression,
strange matter formation, dileptons, and directed flow (bounce-off and
squeeze-out) are investigated. Observations of interesting phenomena in dense
matter are reported. However, we emphasize the need for systematic future
measurements to search for simultaneous irregularities in the excitation
functions of several observables in order to come close to pinning the
properties of hot, dense QCD matter from data. The role of future experiments
with the STAR and ALICE detectors is pointed out.
","[{""version"":""v1"",""created"":""Thu, 18 Mar 1999 18:03:32 GMT""}]","2009-10-31"
"hep-ph/9903399","Serguey Petcov","M. V. Chizhov and S. T. Petcov","New Conditions for a Total Neutrino Conversion in a Medium","4 pages latex, two eps-files, the text includes 2 figures; except for
  ref. [10], version published in Phys. Rev. Lett. 83 (1999) 1096","Phys.Rev.Lett. 83 (1999) 1096-1099","10.1103/PhysRevLett.83.1096","SISSA 29/99/EP, March 1999","hep-ph astro-ph",,"  A new effect of total neutrino conversion is possible when neutrino
propagates through multi-layer medium of nonperiodic constant density layers.
The effect can take place in the oscillations in the Earth of the
Earth-core-crossing solar and atmospheric neutrinos.
","[{""version"":""v1"",""created"":""Thu, 18 Mar 1999 18:47:58 GMT""},{""version"":""v2"",""created"":""Sun, 12 Sep 1999 09:47:42 GMT""}]","2009-10-31"
"hep-ph/9903403","Robin Stuart","Paresh Malde and Robin G. Stuart","Complete O(N_f alpha^2) Weak Contributions to the Muon Lifetime","30 pages LaTeX. 4 figures. Uses amsmath.sty, axodraw.sty and cite.sty","Nucl.Phys.B552:41-66,1999","10.1016/S0550-3213(99)00245-X","MPI-PhT/98-91","hep-ph",,"  The complete O(N_f alpha^2) weak contributions to the muon lifetime, denoted
as Delta r^(2), are calculated in the MS-bar renormalization scheme. These come
from 2-loop Feynman diagrams containing a loop formed by complete generations
of massless fermions. They form an independent, gauge-invariant set of
corrections that, because of the large number of light fermions in the Standard
Model, is expected to make a significant contribution. In the MS-bar
renormalization scheme with mu'= (pi e^gamma)^(1/2) mu = M_Z and for a Higgs
mass, M_H, in the range 100-1000 GeV the contribution varies from -0.55x10^-4
to -1.54x10^-4 for each massless generation of fermions.
","[{""version"":""v1"",""created"":""Thu, 18 Mar 1999 17:48:22 GMT""}]","2011-03-23"
