"cond-mat/9903329","Jon Magne Leinaas","Jon Magne Leinaas","Spin and Statistics for Quantum Hall Quasi-Particles","14 pages",,,"OSLO-TP 2-99","cond-mat",,"  In two space dimensions the possibilities of fractional spin as well as
fractional statistics exist. I examine the relation between fractional spin and
statistics for Laughlin quasi-particles in a two-dimensional electron system
with spherical geometry. The relevance of this for quasi-particles in a planar
system is discussed.
","[{""version"":""v1"",""created"":""Mon, 22 Mar 1999 14:14:04 GMT""}]","2007-05-23"
"cond-mat/9903330","Valeria Ferrari","Valeria Ferrari(1), Guillermo Chiappe (1), Enrique V. Anda (2), and
  Maria A. Davidovich (2) ((1) Departamento de Fisica, Facultad de Ciencias
  Exactas y Naturales, Universidad de Buenos Aires, Buenos Aires, Argentina.
  (2)Departamento de Fisica, Pontificia Universidade Catolica do Rio de Janeiro
  Rio de Janeiro, Brasil)","Kondo resonance effect on persistent currents through a quantum dot in a
  mesoscopic ring","11 pages, 3 Postscript figures",,"10.1103/PhysRevLett.82.5088",,"cond-mat.mes-hall cond-mat.str-el",,"  The persistent current through a quantum dot inserted in a mesoscopic ring of
length L is studied. A cluster representing the dot and its vicinity is exactly
diagonalized and embedded into the rest of the ring. The Kondo resonance
provides a new channel for the current to flow. It is shown that due to scaling
properties, the persistent current at the Kondo regime is enhanced relative to
the current flowing either when the dot is at resonance or along a perfect ring
of same length. In the Kondo regime the current scales as $L^{-1/2}$, unlike
the $L^{-1}$ scaling of a perfect ring. We discuss the possibility of detection
of the Kondo effect by means of a persistent current measurement.
","[{""version"":""v1"",""created"":""Mon, 22 Mar 1999 14:33:13 GMT""}]","2009-10-31"
"cond-mat/9903331","Anton Surda","A. Surda","Effective-field approximations, including DMRG method, for classical
  inhomogeneous 2D spin lattice models","13 pages, 1 figure in text; plainTex, submitted to Acta Physica
  Slovaca, presented at MECO'24-1999, Wittenberg Abstract changed, discussion
  and references added",,,,"cond-mat.stat-mech",,"  A new approach to derivation of various effective-field approximation for
lattice spin models is presented. It is shown that it can give a number of
methods, including the DMRG method, that can be used to find generally
inhomogeneous solutions of 2D classical lattice problems. A method, closely
related the DMRG method but without necessity to perform any renormalization,
is derived, yielding results practically not different from the DMRG ones. The
matrix-product wave function of Rommer and \""Ostlund can be constructed from
the output of the method. The computational costs of all the derived methods
are smaller than those of the DMRG. Most of the results are applicable to the
1D quantum systems, as well.
","[{""version"":""v1"",""created"":""Mon, 22 Mar 1999 14:58:45 GMT""},{""version"":""v2"",""created"":""Mon, 19 Apr 1999 14:50:09 GMT""}]","2007-05-23"
"cond-mat/9903332","German Sierra","J. Dukelsky (CSIC-Spain), G. Sierra (CSIC-Spain)","A Density Matrix Renormalization Group Study of Ultrasmall
  Superconducting Grains","4 pages, 2 eps figs, RevTex, final version to appear in PRL","Phys.Rev.Lett. 83 (1999) 172","10.1103/PhysRevLett.83.172",,"cond-mat.supr-con nucl-th",,"  We apply the DMRG method to the BCS pairing Hamiltonian which describes
ultrasmall superconducting grains. Our version of the DMRG uses the particle
(hole) states around the Fermi level as the system block (environment). We
observe a smooth logarithmic-like crossover between the few electron regime and
the BCS-bulk regime.
","[{""version"":""v1"",""created"":""Mon, 22 Mar 1999 15:02:23 GMT""},{""version"":""v2"",""created"":""Thu, 27 May 1999 14:05:02 GMT""}]","2009-10-31"
"cond-mat/9903333","Ronald J. Keizer","R.J. Keizer, A. de Visser, M.J. Graf, A.A. Menovsky and J.J.M. Franse","Superconductivity in heavy-fermion U(Pt,Pd)3 and its interplay with
  magnetism","25 pages text (PS), 8 pages with 14 figures (PS), submitted to
  Phys.Rev.B","Phys. Rev. B60 (1999) 10527-10538","10.1103/PhysRevB.60.10527",,"cond-mat.supr-con cond-mat.str-el",,"  The effect of Pd doping on the superconducting phase diagram of the
unconventional superconductor UPt3 has been measured by (magneto)resistance,
specific heat, thermal expansion and magnetostriction. Experiments on single-
and polycrystalline U(Pt1-xPdx)3 for x<= 0.006 show that the superconducting
transition temperatures of the A phase, Tc+, and of the B phase, Tc-, both
decrease, while the splitting DTc increases at a rate of 0.30(2)K/at.%Pd. We
find that DTc(x) correlates with an increase of the weak magnetic moment m(x)
upon Pd doping. This provides further evidence for Ginzburg-Landau scenarios
with magnetism as the symmetry breaking field, i.e. the 2D E representation and
the 1D odd parity model. Only for small splittings DTc is proportional to
m^2(Tc+) (DTc<= 0.05 K) as predicted. The results at larger splittings call for
Ginzburg-Landau expansions beyond 4th order. The tetracritical point in the B-T
plane persists till at least x= 0.002 for B perpendicular to c, while it is
rapidly suppressed for B||c. Upon alloying the A and B phases gain stability at
the expense of the C phase.
","[{""version"":""v1"",""created"":""Mon, 22 Mar 1999 15:10:24 GMT""}]","2009-10-31"
"cond-mat/9903334","Michele Pasquini","Michele Pasquini, Maurizio Serva (Dip. di Matematica and I.N.F.M.,
  Universit\`a dell'Aquila, Italy)","Clustering of volatility as a multiscale phenomenon","6 pages, RevTeX, 6 eps figures, submitted to Econometrica, added
  references",,"10.1007/s100510070265",,"cond-mat.stat-mech cond-mat.dis-nn q-fin.ST",,"  The dynamics of prices in financial markets has been studied intensively both
experimentally (data analysis) and theoretically (models). Nevertheless, a
complete stochastic characterization of volatility is still lacking. What it is
well known is that absolute returns have memory on a long time range, this
phenomenon is known as clustering of volatility. In this paper we show that
volatility correlations are power-laws with a non-unique scaling exponent. This
kind of multiscale phenomenology, which is well known to physicists since it is
relevant in fully developed turbulence and in disordered systems, is recently
pointed out for financial series. Starting from historical returns series, we
have also derived the volatility distribution, and the results are in agreement
with a log-normal shape. In our study we consider the New York Stock Exchange
(NYSE) daily composite index closes (January 1966 to June 1998) and the US
Dollar/Deutsch Mark (USD-DM) noon buying rates certified by the Federal Reserve
Bank of New York (October 1989 to September 1998).
","[{""version"":""v1"",""created"":""Mon, 22 Mar 1999 15:12:37 GMT""},{""version"":""v2"",""created"":""Wed, 7 Apr 1999 15:35:49 GMT""}]","2009-10-31"
"cond-mat/9903335","Jose Ricardo G. de Mendonca","J. Ricardo G. de Mendonca (UFSCar, Brazil)","Roughening Transition of a Restricted Solid-on-Solid Model in the
  Directed Percolation Universality Class","RevTeX, 10 pages, 4 figures, uses 'epsfig' and 'amssymb'","Phys. Rev E 60, 1329-1336 (1999)","10.1103/PhysRevE.60.1329",,"cond-mat.stat-mech",,"  We carried out a finite-size scaling analysis of the restricted
solid-on-solid version of a recently introduced growth model that exhibits a
roughening transition accompanied by spontaneous symmetry breaking. The dynamic
critical exponent of the model was calculated and found to be consistent with
the universality class of the directed percolation process in a symmetry-broken
phase with a crossover to Kardar-Parisi-Zhang behavior in a rough phase. The
order parameter of the roughening transition together with the string order
parameter was calculated, and we found that the flat, gapped phase is
disordered with an antiferromagnetic spin-fluid structure of kinks, although
strongly dominated by the completely flat configuration without kinks. A
possible interesting extension of the model is mentioned.
","[{""version"":""v1"",""created"":""Mon, 22 Mar 1999 15:55:09 GMT""},{""version"":""v2"",""created"":""Mon, 9 Aug 1999 14:36:24 GMT""}]","2009-10-31"
"gr-qc/9903083","Sanjay Moreshwar Wagh","S. M. Wagh and S. D. Maharaj","Naked Singularity of the Vaidya-deSitter Spacetime and Cosmic Censorship
  Hypothesis","submitted Oct. 1997, Revised Version, to be published Gen. Rel.
  Grav., Latex file, 9 pages","Gen.Rel.Grav. 31 (1999) 975-982","10.1023/A:1026675313562",,"gr-qc",,"  We investigate the formation of a locally naked singularity in the collapse
of radiation shells in an expanding Vaidya-deSitter background. This is
achieved by considering the behaviour of non-spacelike and radial geodesics
originating at the singularity. A specific condition is determined for the
existence of radially outgoing, null geodesics originating at the singularity
which, when this condition is satisfied, becomes locally naked. This condition
turns out to be the same as that in the collapse of radiation shells in an
asymptotically flat background. Therefore, we have, at least for the case
considered here, established that the asymptotic flatness of the spacetime is
not essential for the development of a locally naked singularity. Our result
then unequivocally supports the view that no special role be given to
asymptotic observers (or, for that matter, any set of observers) in the
formulation of the Cosmic Censorship Hypothesis.
","[{""version"":""v1"",""created"":""Mon, 22 Mar 1999 13:25:06 GMT""}]","2015-06-25"
"hep-ex/9903049","Juan Terron","J. Terron (on behalf of the H1 and ZEUS Collaborations)","Jet shapes in ep collisions at HERA","7 pages, 3 figures; plenary talk given at the 3rd UK Phenomenology
  Workshop on HERA Physics, Durham, UK, September 1998","J.Phys.G25:1365-1369,1999","10.1088/0954-3899/25/7/313","FTUAM-99/07","hep-ex",,"  New measurements of the jet shape in ep collisions at HERA using the
k_T-cluster jet algorithm are presented.
","[{""version"":""v1"",""created"":""Sun, 21 Mar 1999 19:13:32 GMT""}]","2008-11-26"
"hep-ex/9903050","Yuri Kulchitsky","Y.A. Kulchitsky, et. al","Electron Response and e/h Ratio of Iron-Scintillator Hadron Prototype
  Calorimeter with Longitudinal Tile Configuration","34 pages, 18 figures",,,"JINR-E1-95-513","hep-ex",,"  The detailed information about electron response, electron energy resolution
and e/h ratio as a function of incident energy E, impact point Z and incidence
angle $\Theta$ of iron-scintillator hadron prototype calorimeter with
longitudinal tile configuration is presented. These results are based on
electron and pion beams data of E = 20, 50, 100, 150, 300 GeV at $\Theta =
10^o, 20^o, 30^o$, which were obtained during test beam period in July 1995.
The obtained calibration constant is used for muon response converting from pC
to GeV. The results are compared with existing experimental data and with some
Monte Carlo calculations.
","[{""version"":""v1"",""created"":""Mon, 22 Mar 1999 11:38:59 GMT""}]","2007-05-23"
"hep-ex/9903051","Yuri Kulchitsky","Y. A. Kulchitsky, et. al","Effect on a Hadron Shower Leakage on the Energy Response and Resolution
  of Hadron TILE Calorimeter","24 pages, 13 figures",,,"JINR-E1-96-180","hep-ex",,"  The hadronic shower longitudinal and lateral leakages and its effect on the
pion response and energy resolution of iron-scintillator barrel hadron
prototype calorimeter with longitudinal tile configuration with a thickness of
9.4 nuclear interaction lengths have been investigated. The results are based
on 100 GeV pion beam data at incidence angle $\Theta = 10^o$ at impact point Z
in the range from - 36 to 20 cm which were obtained during test beam period in
May 1995 with setup equipped scintillator detector planes placed behind and
back of the calorimeter. The fraction of the energy of 100 GeV pions at $\Theta
= 10^o$ leaking out at the back of this calorimeter amounts to 1.8 % and agrees
with the one for a conventional iron-scintillator calorimeter. Unexpected
behaviour of the energy resolution as a function of leakage is observed: 6 %
lateral leakage lead to 18 % improving of energy resolution in compare with the
showers without leakage. The measured values of longitudinal punchthrough
probability $(18 \pm 1) %$ and $(20 \pm 1) %$ for two different hit definitions
of leaking events agree with the earlier measurement for our calorimeter and
with the one for a conventional iron-scintillator calorimeter with the same
nuclear interaction length thickness respectively. Due to more soft cut for hit
definition in the leakage detectors the measured value of longitudinal
punchthrough probability more corresponds to the calculated iron equivalent
length $L_{Fe} = 158 cm$.
","[{""version"":""v1"",""created"":""Mon, 22 Mar 1999 13:45:58 GMT""}]","2007-05-23"
"hep-ex/9903052","Yuri Kulchitsky","Y.A. Kulchitsky, et. al","Study of the Hadron Shower Profiles with the Tile Hadron Calorimeter","28 pages, 11 figures",,,"JINR-E1-97-318","hep-ex",,"  The lateral and longitudinal profiles of the hadronic showers detected by
iron-scintillator tile hadron calorimeter with longitudinal tile configuration
have been investigated. The results are based on 100 GeV pion beam data. Due to
the beam scan provided many different beam impact locations with cells it is
succeeded to obtain detailed picture of transverse shower behavior. The
underlying radial energy densities for four depths and for overall calorimeter
have been reconstructed. The three-dimensional hadronic shower parametrisation
have been suggested.
","[{""version"":""v1"",""created"":""Mon, 22 Mar 1999 14:00:37 GMT""}]","2007-05-23"
"hep-ex/9903053","Brunner","ALEPH Collaboration","Measurement of W-pair production in e+e- collisions at 183 GeV","14 pages, 4 figures","Phys.Lett.B453:107-120,1999","10.1016/S0370-2693(99)00304-4","CERN-EP/99-035","hep-ex",,"  The production of W+W- pairs is analysed in a data sample collected by ALEPH
at a mean centre-of-mass energy of 182.7 GeV, corresponding to an integrated
luminosity of 57 pb-1. Cross sections are given for different topologies of W
decays into leptons or hadrons. Under Standard Model assumptions for the W-pair
production and decay, the W-pair cross section is measured to be
15.57+-0.62(stat.)+-0.29(syst.) pb. Using also the W-pair data samples
collected by ALEPH at lower centre-of-mass energies, the decay branching ratio
of the W boson into hadrons is measured to be B(W->hadrons)=
68.93+-1.21(stat.)+-0.51(syst.)%, allowing a determination of the CKM matrix
element |Vcs|= 1.043 +- 0.058(stat.) +- 0.026(syst.). The agreement of the
cross sections with the Standard Model prediction allows a limit to be set on
the W decay rate to undetectable final states.
","[{""version"":""v1"",""created"":""Mon, 22 Mar 1999 14:19:45 GMT""}]","2012-08-27"
"hep-ex/9903054","Yuri Kulchitsky","Y.A. Kulchitsky, V.B. Vinogradov","Non-Compensation of the Barrel Tile Hadron Module-0 Calorimeter","33 pages, 20 figures",,,"JINR-E1-99-12","hep-ex",,"  The detailed experimental information about the electron and pion responses,
the electron energy resolution and the e/h ratio as a function of incident
energy E, impact point Z and incidence angle $\Theta$ of the Module-0 of the
iron-scintillator barrel hadron calorimeter with the longitudinal tile
configuration is presented. The results are based on the electron and pion
beams data for E = 10, 20, 60, 80, 100 and 180 GeV at $\eta$ = -0.25 and -0.55,
which have been obtained during the test beam period in 1996. The results are
compared with the existing experimental data of TILECAL 1m prototype modules,
various iron-scintillator calorimeters and with some Monte Carlo calculations.
","[{""version"":""v1"",""created"":""Mon, 22 Mar 1999 14:20:03 GMT""}]","2007-05-23"
"hep-lat/9903033","Peter Boyle","P Boyle","A novel gauge invariant multi-state smearing technique","18 Pages, 17 figures","J.Comput.Phys. 179 (2002) 349-370",,,"hep-lat",,"  We present an investigation of a gauge invariant smearing technique that
allows the construction of smearing functions with arbitrary radial behaviour,
by foresaking the space filling nature of traditional smearing techniques. This
is applied to both heavy-heavy, heavy-light, and light-light systems with one
particular choice of radial ``wavefunction'' - the hydrogenic solutions - and
we find good stability for both fitted masses and amplitudes of the radially
excited states. The dependence of the amplitudes on the smearing radius is
demonstrated to be well understood, while near optimal smearing radii may be
found with extremely low statistics using a property of the smeared-local
correlator. The smearing technique is inexpensive since it is non-iterative,
achieves a good signal to noise ratio, and can be altered to use wavefunctions
from, say, potential models or the Bethe-Salpether equations in future
simulations.
","[{""version"":""v1"",""created"":""Mon, 22 Mar 1999 12:01:56 GMT""}]","2007-05-23"
"hep-ph/9903424","Serguey Petcov","M. V. Chizhov and S. T. Petcov","Enhancing Mechanisms of Neutrino Transitions in a Medium of Nonperiodic
  Constant - Density Layers and in the Earth","43 pages, latex, 17 (12 colored) figures, 6 tables; results and
  conclusions unchanged, typos corrected, 8 colored figures prepared for the
  1999 publication but not included in it, illustrating the Earth mantle-core
  resonance enhancement of the $\nu_{\mu} (\nu_e) \to \nu_e (\nu_{\mu})$,
  $\bar{\nu}_{\mu} \to \bar{\nu}_s$, $\nu_e \to \nu_s$, etc. transitions, added","Phys.Rev. D63 (2001) 073003","10.1103/PhysRevD.63.073003","SISSA 28/99/EP, March 1999","hep-ph astro-ph","http://arxiv.org/licenses/nonexclusive-distrib/1.0/","  The extrema of the probabilities of the transitions $\nu_{\mu} (\nu_e) \to
\nu_e (\nu_{\mu;\tau})$, $\nu_{2} \to \nu_e$, etc. of neutrinos passing through
a medium consisting of i) two layers of different constant densities or ii)
three layers of constant density, of which the first and the third are
identical but differ in density from the second (e.g., mantle-core-mantle in
the Earth), are analyzed. We show that in addition to the MSW and neutrino
oscillation length resonance (NOLR) local maxima previously discussed, there
exist new resonance-like absolute maxima of interference nature. The latter
correspond to a new effect of total neutrino conversion. The conditions for
existence of the new maxima are fulfilled, in particular, for the
Earth-core-crossing solar and atmospheric neutrinos. We prove that the NOLR and
the new resonance-like enhancement are caused by a maximal constructive
interference between the amplitudes of the neutrino transitions in the
different density layers. The strong resonance-like enhancement of the
transitions in the Earth of the Earth-core-crossing solar and atmospheric
neutrinos is due to the new effect of total neutrino conversion.
","[{""version"":""v1"",""created"":""Sun, 21 Mar 1999 18:39:20 GMT""},{""version"":""v2"",""created"":""Sat, 7 Aug 1999 19:00:17 GMT""},{""version"":""v3"",""created"":""Thu, 4 May 2000 17:25:00 GMT""},{""version"":""v4"",""created"":""Sun, 18 Sep 2016 14:40:02 GMT""}]","2016-09-20"
"hep-ph/9903425","Shaaban Khalil","S.M.Barr and Shaaban Khalil","Examining the cancellation mechanism of neutron EDM in a model with
  dilaton-dominated susy breaking",,"Phys.Rev.D61:035005,2000","10.1103/PhysRevD.61.035005",,"hep-ph",,"  We examine the cancellation mechanism between the different contributions to
the electric dipole moment of the neutron in a model with dilaton-dominated
SUSY breaking. We find these accidental cancellations occur at few points in
parameter space. For a wide region of this space we must constrain the phase of
$\mu$ to be of order $10^{-1}$ and have the phases of $A$ and $\mu$ strongly
correlated in order to have small neutron EDM. Moreover, we consider the
indirect CP violation parameter $\epsilon$ in this region where the electric
dipole moment is less than the experimental limit and find that we can generate
$\epsilon$ of order $10^{-6}$.
","[{""version"":""v1"",""created"":""Sun, 21 Mar 1999 19:46:14 GMT""},{""version"":""v2"",""created"":""Fri, 24 Sep 1999 15:50:50 GMT""},{""version"":""v3"",""created"":""Tue, 12 Oct 1999 16:39:31 GMT""}]","2011-05-12"
"hep-ph/9903426","Kornelija Passek","B. Melic, B. Nizic and K. Passek","On the complete next-to-leading order pQCD prediction for the pion form
  factor","8 pages, 2 figures included; talk presented by K. Passek at Nuclear
  and Particle Physics with CEBAF at Jefferson Lab Conference, Dubrovnik, 3-10
  November 1998","Fizika B8:327-334,1999",,"IRB-TH-2/99","hep-ph",,"  We comment on the results of a complete leading-twist next-to-leading order
QCD analysis of the spacelike pion electromagnetic form factor at
large-momentum transfer Q. For the asymptotic distribution amplitude, we have
examined the sensitivity of the predictions to the choice of the
renormalization scale. The results show that reliable perturbative predictions
for the pion electromagnetic form factor can already be made at a momentum
transfer Q below 10 GeV.
","[{""version"":""v1"",""created"":""Sun, 21 Mar 1999 21:46:05 GMT""}]","2009-08-25"
"hep-ph/9903427","Jure Zupan","S. Fajfer, J. Zupan","The role of K^*_0(1430) in D->PK and \tau->KP\nu_\tau decays","17 pages, 2 figures, version as it appears in journal","Int.J.Mod.Phys. A14 (1999) 4161-4176","10.1142/S0217751X99001950","IJS-TP-99/08","hep-ph",,"  We consider the scalar form factor in the weak current matrix element <P K|
j_\mu |0>, P =\pi,\eta,\eta'. It obtains the contributions from the scalar
meson resonance K^*_0(1430) and from the scalar projection of the vector meson
K^*(892) resonance. We analyze decay amplitudes of the Cabibbo suppressed
decays D->K P, P =\pi,\eta,\eta' using the factorization approach. The form
factors of the relevant matrix elements are described by assuming the dominance
of nearby resonances. The annihilation contribution in these decays arises from
the matrix element <P K| j_\mu |0>. All the required parameters are
experimentally known except the scalar meson K^*_0(1430) decay constant. We fit
the decay amplitudes and we find that final state interaction improves the
agreement with the experimental data. Then we extract bounds on scalar form
factor parameters and compare them with the experimental data obtained in the
analyses of K->\pi e\nu_e and K->\pi\mu\nu_\mu. The same scalar form factor is
present in the \tau-> K P \nu_\tau decay, with P =\pi,\eta,\eta'. Using the
obtained bounds we investigate the significance of the scalar meson form factor
in the \tau-> K P \nu_\tau, P = \pi, \eta, \eta' decay rates and spectra. We
find that the K^*_0(1430) scalar meson dominates in the \tau-> K \eta'\nu_\tau
decay spectrum.
","[{""version"":""v1"",""created"":""Mon, 22 Mar 1999 15:13:15 GMT""},{""version"":""v2"",""created"":""Thu, 14 Oct 1999 07:10:01 GMT""}]","2009-10-31"
"hep-ph/9903428","Manmohan Gupta","Monika Randhawa, V. Bhatnagar, P.S. Gill and M. Gupta","Unique Mass Texture for Quarks and Leptons","12 pages, LaTeX,some changes in the references,minor changes in the
  text,to appear in Phys Rev D(Rapid communications)","Phys.Rev.D60:051301,1999","10.1103/PhysRevD.60.051301",,"hep-ph",,"  Texture specific quark mass matrices which are hermitian and hierarchical are
examined in detail . In the case of texture 6 zeros matrices, out of sixteen
possibilities examined by us, none is able to fit the low energy data (LED),
for example, $V_{us} = 0.2196 \pm 0.0023$, $V_{cb} = 0.0395 \pm 0.0017$,
$\frac{V_{ub}}{V_{cb}} = 0.08 \pm 0.02$, $V_{td}$ lies in the range $0.004 -
0.013$ (PDG). Similarly none of the 32 texture 5 zeros mass matrices considered
is able to reproduce LED. In particular, the latest data from LEP regarding
$|V_{ub}|/|V_{cb}|(=0.093\pm0.016)$ rules out all of them. In the texture 4
zeros case, we find that there is a unique texture structure for $U$ and $D$
mass matrices which is able to fit the data.
","[{""version"":""v1"",""created"":""Mon, 22 Mar 1999 11:47:44 GMT""},{""version"":""v2"",""created"":""Wed, 30 Jun 1999 06:14:41 GMT""}]","2009-12-30"
"hep-ph/9903429","German Sharov","G. S. Sharov, V. P. Petrov","Initial-Boundary Value Problem and Stability of Solutions for String
  Baryon Model ""Triangle""","11 pages, 4 figures, LaTeX",,,"TSU-99-02","hep-ph",,"  For the string baryon model ""triangle"" the initial-boundary value problem is
stated and solved in general. This problem implies defining a classical motion
of the system on the base of given initial position and initial velocities of
string points. The presented solution reduces the initial-boundary value
problem for the considered model to the system of ordinary differential
equations that can be integrated numerically in general. Using this approach we
ascertain the stability of the rotational motions (flat uniform rotations) for
the ""triangle"" string configuration.
","[{""version"":""v1"",""created"":""Mon, 22 Mar 1999 06:31:58 GMT""}]","2007-05-23"
