"quant-ph/9903072","Leo Stodolsky","L. Stodolsky","Decoherence - Fluctuation Relation and Measurement Noise","6 pages, no figures, for Okun Festschrift, Physics Reports","Phys.Rept.320:51,1999","10.1016/S0370-1573(99)00065-4","MPI-PTh/99-11","quant-ph",,"  We discuss fluctuations in the measurement process and how these fluctuations
are related to the dissipational parameter characterising quantum damping or
decoherence. On the example of the measuring current of the variable-barrier or
QPC problem we show there is an extra noise or fluctuation connected with the
possible different outcomes of a measurement. This noise has an enhanced short
time component which could be interpreted as due to ``telegraph noise'' or
``wavefunction collapses''. Furthermore the parameter giving the the strength
of this noise is related to the parameter giving the rate of damping or
decoherence.
","[{""version"":""v1"",""created"":""Mon, 22 Mar 1999 15:35:13 GMT""}]","2008-11-26"
"quant-ph/9903073","Rozmej","P. Rozmej (University MCS, Lublin, Poland) and R. Arvieu (ISN,
  Grenoble, France)","The Dirac Oscillator. A relativistic version of the Jaynes--Cummings
  model","LaTeX2e, uses IOP style files (included), 14 pages, 9 separate
  postscript figures","J.Phys.A32:5367-5382,1999","10.1088/0305-4470/32/28/314",,"quant-ph math-ph math.MP physics.atom-ph",,"  The dynamics of wave packets in a relativistic Dirac oscillator is compared
to that of the Jaynes-Cummings model. The strong spin-orbit coupling of the
Dirac oscillator produces the entanglement of the spin with the orbital motion
similar to what is observed in the model of quantum optics. The collapses and
revivals of the spin which result extend to a relativistic theory our previous
findings on nonrelativistic oscillator where they were known under the name of
`spin-orbit pendulum'. There are important relativistic effects (lack of
periodicity, zitterbewegung, negative energy states). Many of them disappear
after a Foldy-Wouthuysen transformation.
","[{""version"":""v1"",""created"":""Mon, 22 Mar 1999 13:30:56 GMT""}]","2008-11-26"
"quant-ph/9903074","Pieter Kok","Pieter Kok, Samuel L. Braunstein","Postselected versus nonpostselected quantum teleportation using
  parametric down-conversion","11 pages, 4 figures (REVTeX) Phys Rev A, 61, 42304 (2000)","Phys.Rev.A61:42304,2000","10.1103/PhysRevA.61.042304",,"quant-ph",,"  We study the experimental realisation of quantum teleportation as performed
by Bouwmeester {\em et al}. [Nature {\bf 390}, 575 (1997)] and the adjustments
to it suggested by Braunstein and Kimble [Nature {\bf 394}, 841 (1998)]. These
suggestions include the employment of a detector cascade and a relative
slow-down of one of the two down-converters. We show that coincidences between
photon-pairs from parametric down-conversion automatically probe the
non-Poissonian structure of these sources. Furthermore, we find that detector
cascading is of limited use, and that modifying the relative strengths of the
down-conversion efficiencies will increase the time of the experiment to the
order of weeks. Our analysis therefore points to the benefits of single-photon
detectors in non-post-selected type experiments, a technology currently
requiring roughly $6^{\circ}$K operating conditions.
","[{""version"":""v1"",""created"":""Mon, 22 Mar 1999 15:21:17 GMT""},{""version"":""v2"",""created"":""Tue, 7 Mar 2000 12:08:16 GMT""}]","2014-11-18"
