"hep-ph/9903430","Lucas Taylor","Maria Teresa Dova (Universidad Nacional de La Plata), John Swain
  (Northeastern University) and Lucas Taylor (Northeastern University)","Sensitivities of one-prong tau branching fractions to tau neutrino mass,
  mixing, and anomalous charged current couplings","Invited talk at the Tau-Charm Workshop, 6-9 March 1999, SLAC, USA",,,,"hep-ph",,"  We analyse the sensitivities of exclusive one-prong tau branching fractions
to: the tau neutrino mass; its mixing with a fourth generation neutrino; the
weak charged current magnetic and electric dipole moments of the tau; and the
Michel parameter $\eta$. Quantitative constraints are derived from current
experimental data and the future constraints derivable from tau-charm factory
measurements are estimated. The anomalous coupling constraints are used to
constrain the tau compositeness scale and the allowed parameter space for Higgs
doublet models.
","[{""version"":""v1"",""created"":""Mon, 22 Mar 1999 08:10:46 GMT""}]","2007-05-23"
"hep-ph/9903431","Dmitrij Shirkov","D.V. Shirkov","The Unitary Mechanism of Infrared Freezing in QCD with massive gluons","7 pages, LaTeX2e","Phys.Atom.Nucl.62:1928-1931,1999; Yad.Fiz.62:2082-2086,1999",,"JINR E2-99-54","hep-ph",,"  A ""natural"" model for the QCD invariant (running) coupling, free of the IR
singularity, is proposed. It is based upon the hypothesis of finite gluon mass
$ m_{gl}$ existence and, technically, uses an accurate treating of threshold
behavior of Feynman diagram contribution. The model correlates with the
unitarity condition.
  Quantitative estimate, performed in the one-loop approximation yields a
reasonable lower bound for this mass $m_{gl} > 150$ MeV and a smooth IR
freezing at the level $\alpha_s(Q^2)\lesssim 1$.
","[{""version"":""v1"",""created"":""Mon, 22 Mar 1999 08:15:01 GMT""}]","2014-11-17"
"hep-ph/9903432","9520964 P K Das Pg Phy","Prasanta Das and Pankaj Jain (IIT, Kanpur)","Dynamical Gauge Symmetry Breaking in $SU(3)_L\otimes U(1)_X$ Extension
  of the Standard Model","4 pages, revtex, no figures; revised version predicting realistic
  mass spectrum","Phys.Rev. D62 (2000) 075001","10.1103/PhysRevD.62.075001",,"hep-ph",,"  We study the $SU(3)_L\otimes U(1)_X$ extension of the Standard model with a
strong U(1) coupling. We argue that current experiments limit this coupling to
be relatively large. The model is dynamically broken to the Standard $SU(2)_L
\otimes U(1)$ model at the scale of a few TeV with all the extra gauge bosons
and the exotic quarks acquiring masses much larger than the scale of
electroweak symmetry breaking. Furthermore we find that the model leads to
large dynamical mass of the top quark and hence also breaks the electroweak
gauge symmetry. It therefore leads to large dynamical effects within the
Standard model and can partially replace the Higgs interactions.
","[{""version"":""v1"",""created"":""Mon, 22 Mar 1999 08:56:16 GMT""},{""version"":""v2"",""created"":""Wed, 24 Mar 1999 08:46:44 GMT""},{""version"":""v3"",""created"":""Wed, 2 Jun 1999 07:07:03 GMT""}]","2009-10-31"
"hep-ph/9903433","Erhan Iltan","E. O. Iltan (METU,Ankara)","b quark Electric Dipole moment in the general two Higgs Doublet and
  three Higgs Doublet models","8 pages, 8 figures","J.Phys.G27:1723-1734,2001","10.1088/0954-3899/27/8/302",,"hep-ph",,"  We study the Electric Dipole moment of b quark in the general two Higgs
Doublet model (model III) and three Higgs Doublet model with O(2) symmetry in
the Higgs sector. We analyse the dependency of this quantity to the new phase
coming from the complex Yukawa couplings and masses of charged and neutral
Higgs bosons. We see that the Electric Dipole moment of b quark is at the order
of 10^{-20} e cm, which is an extremely large value compared to one calculated
in the SM and also two Higgs Doublet model (model II) with real Yukawa
couplings.
","[{""version"":""v1"",""created"":""Mon, 22 Mar 1999 09:55:58 GMT""},{""version"":""v2"",""created"":""Thu, 21 Sep 2000 10:10:16 GMT""},{""version"":""v3"",""created"":""Thu, 17 May 2001 09:32:38 GMT""}]","2008-11-26"
"hep-ph/9903434","Gashi","A. Gashi, E. Matsinos, G. C. Oades, G. Rasche, W. S. Woolcock","Electromagnetic corrections for the analysis of low energy $\pi^- p$
  scattering data","This work is superseded by later papers, see Nucl. Phys. A 686 (2001)
  463",,,,"hep-ph",,"  We calculate the electromagnetic corrections to the isospin invariant mixing
angle and to the two eigenphases for the $s$-, $p_{1/2}$- and $p_{3/2}$-partial
waves for $\pi^- p$ elastic and charge exchange scattering. These corrections
have to be applied to the nuclear quantities in order to obtain the two
hadronic phase shifts for each partial wave. The calculation uses relativised
Schr\""{o}dinger equations containing the sum of an electromagnetic potential
and an effective hadronic potential. The mass differences between $\pi^-$ and
$\pi^0$ as well as between $p$ and $n$ are taken into account. We compare our
results with those of previous calculations and qualitatively estimate the
uncertainties in the corrections.
","[{""version"":""v1"",""created"":""Mon, 22 Mar 1999 10:26:04 GMT""},{""version"":""v2"",""created"":""Tue, 4 Sep 2007 07:02:17 GMT""},{""version"":""v3"",""created"":""Thu, 18 Oct 2007 07:52:02 GMT""}]","2007-10-18"
"hep-ph/9903435","Anjan Joshipura","Anjan S. Joshipura and Sudhir K. Vempati","Sneutrino Vacuum Expectation Values and Neutrino Anomalies Through
  Trilinear R-parity Violation","References added and typos corrected","Phys.Rev.D60:111303,1999","10.1103/PhysRevD.60.111303","PRL-TH-99/001","hep-ph",,"  Neutrino mass spectrum is reanalyzed in supersymmetric models with explicit
trilinear $R$ violation. Models in this category are argued to provide
simultaneous solution to the solar and atmospheric neutrino anomalies. It is
shown specifically that large mixing and hierarchical masses needed for the
vacuum solution of neutrino anomalies arise naturally in these models without
requiring any additional symmetries or hierarchies among the trilinear
couplings.
","[{""version"":""v1"",""created"":""Mon, 22 Mar 1999 11:15:24 GMT""},{""version"":""v2"",""created"":""Thu, 8 Apr 1999 11:55:34 GMT""}]","2009-12-30"
"hep-ph/9903436","Red Hat Linux User","S. Catani, M.L. Mangano, P. Nason, C. Oleari and W. Vogelsang","Sudakov Resummation Effects in Prompt-Photon Hadroproduction","30 pages, Latex, epsfig, amssymb, 17 figures. Submitted to JHEP","JHEP 9903:025,1999","10.1088/1126-6708/1999/03/025","CERN-TH/99-75, Bicocca-FT-99-06, DTP/99/34, ITP-SB-99-7","hep-ph",,"  We compute the effects of soft-gluon resummation, at the
next-to-leading-logarithmic level, in the fixed-target hadroproduction cross
section for prompt photons. We find in general that the corrections to the
fixed next-to-leading-order results are large for large renormalization scales,
and small for small scales. This leads to a significant reduction of the scale
dependence of the results for most experimental configurations of interest. We
compare our results to the recent measurements by the E706 and UA6
collaborations.
","[{""version"":""v1"",""created"":""Mon, 22 Mar 1999 11:42:32 GMT""}]","2010-02-03"
"hep-ph/9903437","Mariana Kirchbach","M. Kirchbach","Comment on ``Mixing and Decay Constants of Pseudoscalar Mesons''","RevTex, 2 pages",,,"MKPH-T-99-5","hep-ph nucl-th",,"  The key assumption used recently by Feldmann, Kroll and Stich [Phys.Rev. D58,
114006 (1998)] that the decay constants f_\eta, and f_\eta ' of the respective
eta and eta ' mesons in the quark flavor basis follow the pattern of strange
and non--strange quarkonia mixing in their wave functions, is reproduced in
identifying the non-isotriplet part of the strong neutral axial current with
the genuine axial hypercharge current J_{\mu, 5}^Y =\bar q \gamma_\mu\gamma_5
Y/2 q, where Y=C+S+B is defined by the Gell-Mann-Nakano-Nishijima relation as
the sum of charm (C), strangeness (S), and baryon (B) quark quantum numbers.
The inequivalence between octet and hypercharge axial currents is pointed out.
","[{""version"":""v1"",""created"":""Mon, 22 Mar 1999 13:33:02 GMT""}]","2007-05-23"
"hep-ph/9903438","Claude Bourrely","C. Bourrely, J. Soffer and Tai Tsun Wu","Impact-picture predictions for the $\gamma\gamma$ total cross section at
  LEP","5 pages, Latex, 1 figure. Revised version","Mod.Phys.Lett.A15:9-13,2000","10.1016/S0217-7323(00)00003-7","CPT-99/P.3793, CERN-TH/99-76","hep-ph",,"  We show that the rising total cross section $\sigma(\gamma\gamma \to
hadrons)$ recently observed by the L3 and OPAL Collaborations at LEP are fully
consistent with the impact-picture for high-energy scattering. The impact
picture is then used to predict this total cross section at higher energies.
These experimental results confirm once more the success of the theoretical
approach, which predicted for the first time, nearly thirty years ago, the
universal increase of total cross sections at high energies.
","[{""version"":""v1"",""created"":""Mon, 22 Mar 1999 11:49:32 GMT""},{""version"":""v2"",""created"":""Wed, 16 Jun 1999 12:19:13 GMT""}]","2009-12-15"
"hep-ph/9903440","Javier Magnin","J. Magnin and H.R. Christiansen","The $bar{d} - \bar{u}$ asymmetry of the proton in a Pion Cloud Model
  approach","Final version. To appear in Phys. Rev. D","Phys.Rev. D61 (2000) 054006","10.1103/PhysRevD.61.054006","CBPF-NF-009/99","hep-ph",,"  We study the $bar{d} - \bar{u}$ asymmetry of the proton in a model approach
in which hadronic fluctuations of the nucleon are generated through gluon
splitting and recombination mechanisms. Within this framework, it is shown that
the \ud asymmetry of the proton is consistently described by including only
nucleon fluctuations to $|\pi N>$ and $|\pi \Delta>$ bound states. Predictions
of the model closely agree with the recent experimental data of the E866/NuSea
Collaboration.
","[{""version"":""v1"",""created"":""Mon, 22 Mar 1999 13:58:26 GMT""},{""version"":""v2"",""created"":""Wed, 31 Mar 1999 21:14:40 GMT""},{""version"":""v3"",""created"":""Thu, 4 Nov 1999 00:04:53 GMT""}]","2009-10-31"
"hep-ph/9903441","Wally Melnitchouk","F.M. Steffens, W. Melnitchouk and A.W. Thomas","Charm in the Nucleon","23 pages, 9 figures","Eur.Phys.J.C11:673-683,1999","10.1007/s100520050663","ADP-99-14/T357","hep-ph hep-ex nucl-th",,"  A next-to-leading order analysis of inelastic electroproduction of charm is
performed using an interpolating scheme which maps smoothly onto massless QCD
evolution at large Q^2 and photon-gluon fusion at small Q^2. In contrast with
earlier analyses, this scheme allows the inclusion of quark and target mass
effects and heavy quark thresholds, as well as possible non-perturbative, or
intrinsic, charm contributions. We find no conclusive evidence in favor of an
intrinsic charm component in the nucleon, although several data points which
disagree with perturbative QCD expectations will need to be checked by future
experiments.
","[{""version"":""v1"",""created"":""Mon, 22 Mar 1999 14:03:59 GMT""}]","2010-03-26"
"hep-ph/9903443","Juerg Gasser","J. Gasser and G. Wanders","One-channel Roy equations revisited","36 pages (LaTex), 9 figures embedded with epsfig.sty","Eur.Phys.J.C10:159-173,1999","10.1007/s100529900086","BUTP-99/2","hep-ph",,"  The Roy equation in the single channel case is a nonlinear, singular integral
equation for the phase shift in the low-energy region. We first investigate the
infinitesimal neighborhood of a given solution, and then present explicit
expressions for amplitudes that satisfy the nonlinear equation exactly. These
amplitudes contain free parameters that render the non-uniqueness of the
solution manifest. They display, however, an unphysical singularity at the
upper end of the interval considered. This singularity disappears and
uniqueness is achieved if one uses analyticity properties of the amplitudes
that are not encoded in the Roy equation.
","[{""version"":""v1"",""created"":""Mon, 22 Mar 1999 14:45:32 GMT""}]","2011-09-13"
"hep-ph/9903444","Beata Ziaja","B. Ziaja","Recovering corrections in the analysis of intermittent data","21 pages, latex, 4 figures; minor corrections, references added; to
  appear in Eur.Phys.J.C","Eur.Phys.J.C9:633-642,1999","10.1007/s100529900090",,"hep-ph",,"  The analysis of intermittent data is improved. The standard method of
recovering the history of a particle cascade is proved in general not to
reproduce the structure of the true cascade. The recovering corrections to the
standard method are proposed and tested in the framework of multiplicative
cascading models.
","[{""version"":""v1"",""created"":""Mon, 22 Mar 1999 14:50:02 GMT""},{""version"":""v2"",""created"":""Tue, 13 Apr 1999 13:35:11 GMT""}]","2011-09-13"
"hep-ph/9903445",,"S.V. Molodtsov, A.M. Snigirev, G.M. Zinovjev","Towards Phonon-Like Excitations of Instanton Liquid","6 pages Rep. no:","Phys.Rev. D60 (1999) 056006","10.1103/PhysRevD.60.056006",,"hep-ph hep-lat hep-th nucl-th",,"  The phonon-like excitations of (anti)-instanton ($\bar II$) liquid due to
adiabatic variations of vacuum wave functions are studied in this paper. The
kinetic energy term is found and the proper effective Lagrangian for such
excitations is evaluated. The properties of their spectrum, while corresponding
masses are defined by $\Lambda_{QCD}$, are investigated.
","[{""version"":""v1"",""created"":""Mon, 22 Mar 1999 15:02:38 GMT""}]","2009-10-31"
"hep-th/9903179","Ramchander R. Sastry","Ramchander R. Sastry","Quantum Electrodynamics with the Pauli Term","Latex, 7 pages, 1 eps figure, minor changes",,,,"hep-th gr-qc math-ph math.MP",,"  The quantum field theory of extended objects is employed to address the
hitherto nonrenormalizable Pauli interaction. This is achieved by quantizing
the Dirac field using the infinite dimensional generalization of the extended
object formulation. The order $\alpha$ contribution to the anomalous magnetic
moment of the electron (and of the muon) arising from the Pauli term is
calculated.
","[{""version"":""v1"",""created"":""Mon, 22 Mar 1999 01:36:00 GMT""},{""version"":""v2"",""created"":""Sun, 28 Mar 1999 19:00:09 GMT""},{""version"":""v3"",""created"":""Thu, 6 May 1999 20:35:42 GMT""},{""version"":""v4"",""created"":""Sun, 9 May 1999 19:48:03 GMT""},{""version"":""v5"",""created"":""Mon, 17 May 1999 21:25:57 GMT""}]","2009-09-25"
"hep-th/9903180","Robert Delbourgo","R Delbourgo","A critique of the gauge technique","18 pages, Latex. To appear in Aust. J. Phys","Austral.J.Phys.52:681-695,1999","10.1071/PH99018","UTAS-PHYS-99-01","hep-th",,"  A summary of the successes of and obstacles to the gauge technique (a
non-perturbative method of solving Dyson-Schwinger equations in gauge theories)
is given, as well as an outline of how progress may be achieved in this field.
","[{""version"":""v1"",""created"":""Mon, 22 Mar 1999 05:38:19 GMT""}]","2015-06-26"
"hep-th/9903181","Changhyun Ahn","Changhyun Ahn and Hoil Kim","Branes at $\C^4/\Ga$ Singularity from Toric Geometry","1 figure, 4 tables, latex file and 26 pages:v1 added mathematical
  results on projective crepant resolutions by Dais et al and refs added:v2
  typos corrected and the beginning paragrphs in section 3 clarified","JHEP 9904 (1999) 012","10.1088/1126-6708/1999/04/012","SNUTP-99-011","hep-th",,"  We study toric singularities of the form of $\C^4/\Ga$ for finite abelian
groups $\Ga \subset SU(4)$. In particular, we consider the simplest case
$\Ga=\Z_2 \times \Z_2 \times \Z_2$ and find explicitly charge matrices for
partial resolutions of this orbifold by extending the method by Morrison and
Plesser. We obtain three kinds of algebraic equations, $z_1 z_2 z_3 z_4=z_5^2,
z_1 z_2 z_3=z_4^2 z_5 $ and $z_1 z_2 z_5 = z_3 z_4$ where $z_i$'s parametrize
$\C^5$. When we put $N$ D1 branes at this singularity, it is known that the
field theory on the worldvolume of $N$ D1 branes is T-dual to $2 \times 2
\times 2 $ brane cub model. We analyze geometric interpretation for field
theory parameters and moduli space.
","[{""version"":""v1"",""created"":""Mon, 22 Mar 1999 08:06:49 GMT""},{""version"":""v2"",""created"":""Tue, 30 Mar 1999 06:19:51 GMT""},{""version"":""v3"",""created"":""Fri, 9 Apr 1999 12:07:15 GMT""}]","2009-10-31"
"hep-th/9903182","Yuji Ohta","Yuji Ohta (Res. Inst. Math. Sci., Kyoto Univ.)","Non-perturbative Solutions to N=2 Supersymmetric Yang-Mills Theories
  -Progress and Perspective-","\documentstyle[12pt,a4,eclepsf]{article}, 2 figures, Note based on
  the talk presented in the colloquia in mathematics at RIMS, February 24
  (Wed), 1999",,,,"hep-th",,"  This note reviews the progress on the low energy dynamics of N=2
supersymmetric Yang-Mills theories after the works of Seiberg and Witten.
Specifically, the theory of prepotential for non-specialists is reviewed.
","[{""version"":""v1"",""created"":""Mon, 22 Mar 1999 09:50:33 GMT""}]","2007-05-23"
"hep-th/9903183",,"Theodora Ioannidou and Paul Sutcliffe","Monopoles and Harmonic Maps","Version to appear in J. Math. Phys","J.Math.Phys.40:5440-5455,1999","10.1063/1.533038",,"hep-th",,"  Recently Jarvis has proved a correspondence between SU(N) monopoles and
rational maps of the Riemann sphere into flag manifolds. Furthermore, he has
outlined a construction to obtain the monopole fields from the rational map. In
this paper we examine this construction in some detail and provide explicit
examples for spherically symmetric SU(N) monopoles with various symmetry
breakings. In particular we show how to obtain these monopoles from harmonic
maps into complex projective spaces. The approach extends in a natural way to
monopoles in hyperbolic space and we use it to construct new spherically
symmetric SU(N) hyperbolic monopoles.
","[{""version"":""v1"",""created"":""Mon, 22 Mar 1999 10:13:15 GMT""},{""version"":""v2"",""created"":""Tue, 7 Sep 1999 08:56:53 GMT""}]","2010-11-19"
"hep-th/9903184","Shyamoli Chaudhuri","Shyamoli Chaudhuri","Path integral evaluation of Dbrane amplitudes","Replaced by extended version including discussion of nonabelian
  limit, hep-th/9907179","Phys. Rev. D 60, 106007 (1999)","10.1103/PhysRevD.60.106007",,"hep-th",,"  See hep-th/9907179.
","[{""version"":""v1"",""created"":""Mon, 22 Mar 1999 14:49:33 GMT""},{""version"":""v2"",""created"":""Thu, 25 Mar 1999 21:35:46 GMT""},{""version"":""v3"",""created"":""Sat, 24 Jul 1999 12:47:49 GMT""}]","2016-08-25"
"hep-th/9903185","Maciej Slusarczyk","Maciej Slusarczyk","Dynamics of a planar domain wall with oscillating thickness in \lambda
  \Phi^{4} model","20 pages, 10 figures","Acta Phys.Polon. B31 (2000) 617-635",,,"hep-th",,"  Domain wall - type solution with oscillating thickness in a real, scalar
field model is investigated with the help of a polynomial approximation. We
propose a simple extension of the polynomial approximation method. In this
approach we calculate higher order corrections to the planar domain wall
solution, find that the domain wall with oscillating thickness radiates, and
compute dumping of oscillations of the domain wall.
","[{""version"":""v1"",""created"":""Mon, 22 Mar 1999 11:11:20 GMT""}]","2007-05-23"
"hep-th/9903186","Andreas Brandhuber","Mohsen Alishahiha, Andreas Brandhuber and Yaron Oz","Branes at Singularities in Type 0 String Theory","18 pages, uses BibTeX, ssg.bst","JHEP 9905:024,1999","10.1088/1126-6708/1999/05/024","CERN-TH/99-72","hep-th",,"  We consider Type 0B D3-branes placed at conical singularities and analyze in
detail the conifold singularity. We study the non supersymmetric gauge theories
on their worldvolume and their conjectured dual gravity descriptions. In the
ultraviolet the solutions exhibit a logarithmic running of the gauge coupling.
In the infrared we find confining solutions and IR fixed points.
","[{""version"":""v1"",""created"":""Mon, 22 Mar 1999 11:33:32 GMT""}]","2009-10-31"
"math/9903122","Man Chun Leung","Ka-Luen Cheung and Man-Chun Leung","Asymptotic Behavior of Positive Solutions of the Equation $\Delta u + K
  u^{(n + 2)/(n - 2)} = 0$ in R^n and Positive Scalar Curvature",,,,,"math.DG math.AP",,"  We study asymptotic behavior of positive smooth solutions of the conformal
scalar curvature equation in ${\bf R}^n$. We consider the case when the scalar
curvature of the conformal metric is bounded between two positive numbers
outside a compact set. It is shown that the solution has slow decay if the
radial change is controlled. For a positive solution with slow decay, the
corresponding conformal metric is found to be complete if and only if the total
volume is infinite. We also determine the sign of the Pohozaev number in some
situations and show that if the Pohozaev is equal to zero, then either the
solution has fast decay, or the conformal metric corresponding to the solution
is complete and the corresponding solution in ${\bf R} \times S^{n - 1}$ has a
sequence of local maxima that approach the standard spherical solution.
","[{""version"":""v1"",""created"":""Sun, 21 Mar 1999 22:40:38 GMT""},{""version"":""v2"",""created"":""Sun, 25 Apr 1999 23:01:07 GMT""}]","2007-05-23"
"math/9903123","Toshiyuki Tanisaki","Masaki Kashiwara and Toshiyuki Tanisaki","Characters of irreducible modules with non-critical highest weights over
  affine Lie algebras","21 pages",,,,"math.RT math.QA",,"  We shall derive Kazhdan-Lusztig type character formula for the irreducible
modules with arbitrary non-critical highest weights over affine Lie algebras
from the rational case by using the translation functor, the Enright functor
and Jantzen's deformation argument.
","[{""version"":""v1"",""created"":""Mon, 22 Mar 1999 04:23:27 GMT""},{""version"":""v2"",""created"":""Wed, 23 Jun 1999 01:50:15 GMT""}]","2007-05-23"
"math/9903124","Sergey Barannikov","Sergey Barannikov","Generalized periods and mirror symmetry in dimensions n>3","51 pages, LaTeX","Communications in Mathematical Physics, Volume 228, Issue 2, 2002,
  Pages 281-325","10.1007/s002200200656",,"math.AG math.AC math.QA",,"  The predictions of the Mirror Symmetry are extended in dimensions n>3 and are
proven for projective complete intersections Calabi-Yau varieties. Precisely,
we prove that the total collection of rational Gromov-Witten invariants of such
variety can be expressed in terms of certain invariants of a new generalization
of variation of Hodge structures attached to the dual variety. To formulate the
general principles of Mirror Symmetry in arbitrary dimension it is necessary to
introduce the ``extended moduli space of complex structures'' M. An analog M\to
H*(X,C)[n] of the classical period map is described and is shown to be a local
isomorphism. The invariants of the generalized variations of Hodge structures
are introduced. It is proven that their generating function satisfies the
system of WDVV-equations exactly as in the case of Gromov-Witten invariants.
The basic technical tool utilized is the Deformation theory.
","[{""version"":""v1"",""created"":""Mon, 22 Mar 1999 11:41:34 GMT""}]","2019-06-04"
"math/9903125","Nicolae Vulpe","A.M.Voldman, N.I.Vulpe","T-comitants and the Problem of a Center for Quadratic Differential
  Systems","38 pages, no figures",,,"Preprint No.9, 1997, Academy of Sciences of Moldova, Institute of
  Mathematics","math.DS math.AC",,"  The new necessary and sufficient affine invariant conditions for the
existence and for determining the number of centers for general quadratic
system are pointed out. These conditions correspond to the partition of
12-dimensional coefficient space of indicated system with respect to the number
and the multiplicity of its finite critical points.
","[{""version"":""v1"",""created"":""Mon, 22 Mar 1999 12:22:16 GMT""}]","2007-05-23"
"math/9903126","Margaret Combs","William Beckner","On the Grushin operator and hyperbolic symmetry","11 pages, AMSTeX",,,"ut-ma/99003","math.AP",,"  Complexity of geometric symmetry for differential operators with mixed
homogeniety is examined here. Sharp Sobolev estimates are calculated for the
Grushin operator in low dimensions using hyperbolic symmetry and conformal
geometry.
","[{""version"":""v1"",""created"":""Mon, 22 Mar 1999 14:47:51 GMT""}]","2007-05-23"
"physics/9903033","D. S. Ray","Deb Shankar Ray","Notes on Brownian motion and related phenomena","35 pages, RevTex, misprints are corrected and figures are added",,,,"physics.ed-ph",,"  In this article we explore the phenomena of nonequilibrium stochastic process
starting from the phenomenological Brownian motion. The essential points are
described in terms of Einstein's theory of Brownian motion and then the theory
extended to Langevin and Fokker-Planck formalism. Then the theory is applied to
barrier crossing dynamics, popularly known as Kramers' theory of activated rate
processes. The various regimes are discussed extensively and Smoluchowski
equation is derived as a special case. Then we discuss some of the aspects of
Master equation and two of its applications.
","[{""version"":""v1"",""created"":""Mon, 22 Mar 1999 10:38:13 GMT""},{""version"":""v2"",""created"":""Fri, 7 May 1999 05:45:39 GMT""}]","2007-05-23"
