"astro-ph/9903312","Susan M. Simkin","B. I. Grimberg, E. M. Sadler and S. M. Simkin","Extended Emission Line Gas in Radio Galaxies - PKS0349-27","12 pages, 3 fig pages, to appear in the Astrophys. J",,"10.1086/307547",,"astro-ph",,"  PKS0349-27 is a classical FRII radio galaxy with an AGN host which has a
spectacular, spiral-like structure in its extended emission line gas (EELG). We
have measured the velocity field in this gas and find that it splits into 2
cloud groups separated by radial velocities which at some points approach 400
km/s Measurements of the diagnostic emission line ratios [OIII]5007/H-beta,
[SII]6716+6731/H-alpha, and [NII]6583/H-alpha in these clouds show no evidence
for the type of HII region emission associated with starburst activity in
either velocity system. The measured emission line ratios are similar to those
found in the nuclei of narrow-line radio galaxies, but the extended
ionization/excitation cannot be produced by continuum emission from the active
nucleus alone. We present arguments which suggest that the velocity
disturbances seen in the EELG are most likely the result of a galaxy-galaxy
collision or merger but cannot completely rule out the possibility that the gas
has been disrupted by the passage of a radio jet.
","[{""version"":""v1"",""created"":""Sun, 21 Mar 1999 16:57:01 GMT""}]","2009-10-31"
"astro-ph/9903313","Susan M. Simkin","S. M. Simkin, E. M. Sadler, R. Sault, S. J. Tingay and J. Callcut","Pictor A (PKS 0518-45) - From Nucleus to Lobes","19 pages, 6 ps.gz fig pages, to appear in the Ap.J. Suppl","Astrophys.J.Suppl. 123 (1999) 447-466","10.1086/313243",,"astro-ph",,"  We present radio and optical imaging and kinematic data for the radio galaxy
Pictor A, including HST continuum and [OIII], emission-line images (at a
resolution of 25 - 100 mas) and ground-based imaging and spectroscopy (at a
resolution of ~ 1.5"". The radio data include 3 cm Australia Telescope images of
the core, at a resolution comparable to that of the optical, ground-based
images, and a VLBI image of a jet in the compact core (at a resolution of 2 -
25 mas), which seems to align with a continuum ``jet'' found in the HST images.
The core radio jet, the HST optical continuum ``jet'', and the NW H-alpha
filaments all appear to point toward the optical-synchrotron hot-spot in the NW
lobe of this object and are associated with a disrupted velocity field in the
extended ionized gas. The ground-based spectra which cover this trajectory also
yield line ratios for the ionized gas which have anomalously low [NII] (6564),
suggesting either a complex, clumpy structure in the gas with a higher
cloud-covering factor at larger radii and with denser clouds than is found in
the nuclear regions of most NLRG and Seyfert 2 galaxies, or some other,
unmodeled, mechanism for the emergent spectrum from this region. The H-alpha
emission-line filaments to the N appear to be associated with a 3 cm radio
continuum knot which lies in a gap in the filaments ~ 4"" from the nucleus.
Altogether, the data in this paper provide good circumstantial evidence for
non-disruptive redirection of a radio jet by interstellar gas clouds in the
host galaxy.
","[{""version"":""v1"",""created"":""Sun, 21 Mar 1999 17:33:37 GMT""}]","2009-10-31"
"astro-ph/9903314","Mark Lacy","Mark Lacy, Susan E. Ridgway, Margrethe Wold, Per B. Lilje & Steve
  Rawlings","Radio-optical alignments in a low radio luminosity sample","16 pages, 8 figures. Accepted by MNRAS",,"10.1046/j.1365-8711.1999.02640.x",,"astro-ph",,"  We present an optically-based study of the alignment between the radio axes
and the optical major axes of eight z~0.7 radio galaxies in a 7C sample. The
radio galaxies in this sample are ~20-times less radio luminous than 3C
galaxies at the same redshift, and are significantly less radio-luminous than
any other well-defined samples studied to date. Using Nordic Optical Telescope
images taken in good seeing conditions at rest-frame wavelengths just longward
of the 4000A break, we find a statistically significant alignment effect in the
7C sample. Furthermore, in two cases where the aligned components are well
separated from the host we have been able to confirm spectroscopically that
they are indeed at the same redshift as the radio galaxy. However, a
quantitative analysis of the alignment in this sample and in a corresponding 3C
sample from HST archival data indicates that the percentage of aligned flux may
be lower and of smaller spatial scale in the 7C sample. Our study suggests that
alignments on the 50-kpc scale are probably closely related to the radio
luminosity, whereas those on the 15 kpc scale are not. We discuss these results
in the context of popular models for the alignment effect.
","[{""version"":""v1"",""created"":""Sun, 21 Mar 1999 18:39:59 GMT""}]","2009-10-31"
"astro-ph/9903315","Longhetti Marcella","M. Longhetti, A. Bressan, C. Chiosi, R. Rampazzo","Star Formation History of Early-Type Galaxies in Low Density
  Environments V. Blue line-strength indices for the nuclear region","12 pages, including 7 figures - Accepted for publication in A&A",,,,"astro-ph",,"  We analyze the star formation properties of a sample of 21 shell galaxies and
30 early-type galaxies members of interacting pairs, located in low density
environments (Longhetti et al 1998a, 1998b).
  The study is based on new models developed to interpret the information
coming from `blue' H$\delta$/FeI, H+K(CaII) and \D4000 line-strength indices
proposed by Rose (1984; 1985) and Hamilton (1985).
  We find that the last star forming event that occurred in the nuclear region
of shell galaxies is statistically old (from 0.1 up to several Gyr) with
respect to the corresponding one in the sub-sample of pair galaxies (<0.1 Gyr
or even ongoing star formation).
  If the stellar activity is somehow related to the formation of shells, as
predicted by several dynamical models of galaxy interaction, shells have to be
considered long lasting structures.
  Since pair members show evidence of very recent star formation, we suggest
that either large reservoirs of gas have to be present to maintain active star
formation, if these galaxies are on periodic orbits, or most of the pair
members in the present sample are experiencing unbound encounters.
","[{""version"":""v1"",""created"":""Mon, 22 Mar 1999 08:43:33 GMT""}]","2007-05-23"
"astro-ph/9903316","Hiroyuki Hirashita","H. Hirashita(1) ((1)Department of Astronomy, Kyoto University)","Dust-to-Gas Ratio and Metallicity in Dwarf Galaxies","14 pages LaTeX, 4 figures, to appear in ApJ",,"10.1086/307621",,"astro-ph",,"  We examine the dust-to-gas ratio as a function of metallicity for dwarf
galaxies [dwarf irregular galaxies (dIrrs) and blue compact dwarf galaxies
(BCDGs)]. Using a one-zone model and adopting the instantaneous recycling
approximation, we prepare a set of basic equations which describes processes of
dust formation and destruction in a galaxy. Four terms are included for the
processes: dust formation from heavy elements ejected by stellar mass loss,
dust destruction in supernova remnants, dust destruction in star-forming
regions, and accretion of heavy elements onto preexisting dust grains. Solving
the equations, we compare the result with observational data of nearby dIrrs
and BCDGs. The solution is consistent with the data within the reasonable
ranges of model parameters constrained by the previous examinations. This means
that the model is successful in understanding the dust amount of nearby
galaxies. We also show that the accretion rate of heavy element onto
preexisting dust grains is less effective than the condensation of heavy
elements in dwarf galaxies.
","[{""version"":""v1"",""created"":""Mon, 22 Mar 1999 11:20:08 GMT""}]","2009-10-31"
"astro-ph/9903317","Ruixiang Chang","R.X. Chang, J.L. Hou, C.G. Shu and C.Q. Fu","Two-component model for the chemical evolution of the Galactic disk","23 pages, 7 figures",,,,"astro-ph",,"  In the present paper, we introduce a two-component model of the Galactic disk
to investigate its chemical evolution. The formation of the thick and thin
disks occur in two main accretion episodes with both infall rates to be
Gaussian. Both the pre-thin and post-thin scenarios for the formation of the
Galactic disk are considered. The best-fitting is obtained through
$\chi^2$-test between the models and the new observed metallicity distribution
function of G dwarfs in the solar neighbourhood (Hou et al 1998). Our results
show that post-thin disk scenario for the formation of the Galactic disk should
be preferred. Still, other comparison between model predictions and
observations are given.
","[{""version"":""v1"",""created"":""Mon, 22 Mar 1999 13:23:11 GMT""}]","2007-05-23"
"astro-ph/9903318","Andrew Lobanov","A.P.Lobanov & J.A.Zensus","Spectral Evolution of The Parsec-Scale Jet in The Quasar 3C345","50 pages, 15 figures, 7 tables: accepted to The Astrophysical
  Journal; AASMS4 macro style files",,"10.1086/307555",,"astro-ph",,"  The long-term evolution of the synchrotron emission from the parsec-scale jet
in the quasar 3C345 is analysed, on the basis of multi-frequency monitoring
with very long baseline interferometry (VLBI) and covering the period
1979-1994. We combine the model fits from 44 VLBI observations of 3C345 made at
8 different frequencies between 2.3 and 100GHz. We calculate the turnover
frequency, turnover flux density, integrated 4-25GHz flux and 4-25GHz
luminosity of the core and the moving features. The core has an estimated mean
luminosity of 7.1+/-3.5 * 10^42 erg/s; the estimated total luminosity of 3C345
on parsec scales is ~3*10^43 erg/s (about 1% of the observed luminosity of the
source between the radio to infrared regimes). The spectral changes in the core
can be reconciled with a shock or dense plasma condensation traveling through
the region where the jet becomes optically thin. We are able to describe the
evolution of the core spectrum by a sequence of 5 flare-like events
characterized by an exponential rise and decay of the particle number density
of the material injected into the jet. The same model is also capable of
predicting the changes in the flux density observed in the core. The flares
occur approximately every 3.5-4 years, roughly correlating with appearances of
new moving features in the jet.
","[{""version"":""v1"",""created"":""Mon, 22 Mar 1999 13:46:26 GMT""}]","2009-10-31"
"astro-ph/9903319","Dominik Schwarz","Dominik J. Schwarz, Christoph Schmid, and Peter Widerin","Clumping of CDM from the cosmological QCD transition","5 pages, LaTeX. To appear in the electronic proceedings of the '19th
  Texas symposium', Paris",,,,"astro-ph hep-ph",,"  The cosmological QCD transition affects primordial density perturbations. If
the QCD transition is first order, the sound speed vanishes during the
transition and density perturbations fall freely. For scales below the Hubble
radius at the transition the primordial Harrison-Zel'dovich spectrum of density
fluctuations develops large peaks and dips. These peaks grow with wave number
for both the radiation fluid and for cold dark matter (CDM). The peaks in the
radiation fluid are wiped out during neutrino decoupling. For cold dark matter
that is kinetically decoupled at the QCD transition (e.g. axions) these peaks
lead to the formation of CDM clumps of masses $10^{-20} M_\odot< M < 10^{-10}
M_\odot$.
","[{""version"":""v1"",""created"":""Mon, 22 Mar 1999 14:48:01 GMT""}]","2007-05-23"
"astro-ph/9903320","Roger Hutchings","Roger M. Hutchings, Peter A. Thomas","In-shock Cooling in Numerical Simulations","8 pages, LaTeX, 7 figures","Mon.Not.Roy.Astron.Soc. 319 (2000) 721","10.1046/j.1365-8711.2000.03723.x","RMH99001","astro-ph",,"  We model a one-dimensional shock-tube using smoothed particle hydrodynamics
and investigate the consequences of having finite shock-width in numerical
simulations. We investigate the cooling of gas during passage through the shock
for different cooling regimes. For a shock temperature of 10^5K, the maximum
temperature of the gas is much reduced and the cooling time was reduced by a
factor of 2. At lower temperatures, we are especially interested in the
production of molecular Hydrogen and so we follow the ionization level and H_2
abundance across the shock. This regime is particularly relevent to simulations
of primordial galaxy formation for halos in which the virial temperature of the
galaxy is sufficiently high to partially re-ionize the gas. The effect of
in-shock cooling is substantial: the maximum temperature the gas reaches
compared to the theoretical temperature was found to vary between 0.15 and 0.81
for the simulations performed. The downstream ionization level is reduced from
the theoretical level by a factor of between 2.4 and 12.5, and the resulting
H_2 abundance was found to be reduced to a fraction of 0.45 to 0.74 of its
theoretical value. At temperatures above 10^5K, radiative shocks are unstable
and will oscillate. We reproduce these oscillations and find good agreement
with the previous work of Chevalier and Imamura (1982), and Imamura, Wolff and
Durisen (1984). The effect of in-shock cooling in such shocks is difficult to
quantify, but is undoubtedly present.
","[{""version"":""v1"",""created"":""Mon, 22 Mar 1999 15:35:34 GMT""}]","2009-10-31"
"astro-ph/9903321","Lucio Chiappetti","L.Chiappetti, L.Maraschi, F.Tavecchio, A.Celotti, G.Fossati,
  G.Ghisellini, P.Giommi, E.Pian, G.Tagliaferri, A.Treves, C.M. Urry, Y.H.
  Zhang","Spectral Evolution of PKS 2155-304 observed with BeppoSAX during an
  Active Gamma-ray Phase","36 pages (8 figures), Latex with AAS macros, etc), accepted for
  publication on Astrophysical Journal",,"10.1086/307577",,"astro-ph",,"  We present the results of BeppoSAX observations of PKS 2155-304 during an
intense gamma-ray flare. The source was in a high X-ray state. A temporal
analysis of the data reveals a tendency of the amplitude of variations to
increase with energy, and the presence of a soft lag with a timescale of the
order 10^3 s. A curved continuum spectrum, with no evidence of spectral
features, extends up to ~50 keV, while there is indication of a flatter
component emerging at higher energies, consistent with the interpretation of
the broad band spectral energy distribution (SED) as due to synchrotron
self-Compton (SSC) emission from a single region. Notably, the fitting of the
SED with such a model is consistent with an interpretation of the detected soft
lag as due to radiative cooling, supporting the idea that radiation losses play
an important role in variability. The observed shifts of the SED peaks between
the lowest and highest flux levels can be accounted for by an increase of the
break energy in the relativistic particle spectrum. The model predicts emission
at TeV energies in good agreement with the recently reported detection.
","[{""version"":""v1"",""created"":""Mon, 22 Mar 1999 15:58:16 GMT""}]","2009-10-31"
"cond-mat/9903310","Michael W. Deem","Leonard D. Bogarad and Michael W. Deem (UCLA)","A Hierarchical Approach to Protein Molecular Evolution","15 pages. 2 figures. LaTeX style","Proc. Natl. Acad. Sci. USA 96 (1999) 2591-2595. Copyright PNAS","10.1073/pnas.96.6.2591",,"cond-mat.stat-mech cond-mat.soft physics.bio-ph q-bio",,"  Biological diversity has evolved despite the essentially infinite complexity
of protein sequence space. We present a hierarchical approach to the efficient
searching of this space and quantify the evolutionary potential of our approach
with Monte Carlo simulations. These simulations demonstrate that non-homologous
juxtaposition of encoded structure is the rate-limiting step in the production
of new tertiary protein folds. Non-homologous ``swapping'' of low energy
secondary structures increased the binding constant of a simulated protein by
$\approx10^7$ relative to base substitution alone. Applications of our approach
include the generation of new protein folds and modeling the molecular
evolution of disease.
","[{""version"":""v1"",""created"":""Sun, 21 Mar 1999 16:37:42 GMT""}]","2009-10-31"
"cond-mat/9903320","Herve Ness","H. Ness and A.J. Fisher","Quantum inelastic conductance through molecular wires","4 pages, 4 figures, accepted for publication in Physical Review
  Letters",,"10.1103/PhysRevLett.83.452",,"cond-mat.mtrl-sci",,"  We calculate non-perturbatively the inelastic effects on the conductance
through a conjugated molecular wire-metal heterojunction, including realistic
electron-phonon coupling. We show that at sub-band-gap energies the current is
dominated by quantum coherent transport of virtual polarons through the
molecule. In this regime, the tunneling current is strongly increased relative
to the case of elastic scattering. It is essential to describe the full quantum
coherence of the polaron formation and transport in order to obtain correct
physics. Our results are generally applicable to one-dimensional atomic or
molecular wires.
","[{""version"":""v1"",""created"":""Sun, 21 Mar 1999 16:12:01 GMT""},{""version"":""v2"",""created"":""Thu, 10 Jun 1999 13:57:18 GMT""}]","2009-10-31"
"cond-mat/9903321","Anders Johansen","Anders Johansen (IGPP, UCLA), Didier Sornette (UCLA and CNRS, France)
  and Olivier Ledoit (Anderson Graduate School of Management, UCLA)","Predicting Financial Crashes Using Discrete Scale Invariance","25 pages, 13 figures. Replaced with version accepted in J. of Risk.
  Title changed, 2 new figures as well as new text","Journal of Risk, Vol 1, No. 4 (1999) 5-32",,,"cond-mat",,"  We present a synthesis of all the available empirical evidence in the light
of recent theoretical developments for the existence of characteristic
log-periodic signatures of growing bubbles in a variety of markets including 8
unrelated crashes from 1929 to 1998 on stock markets as diverse as the US,
Hong-Kong or the Russian market and on currencies. To our knowledge, no major
financial crash preceded by an extended bubble has occurred in the past 2
decades without exhibiting such log-periodic signatures.
","[{""version"":""v1"",""created"":""Sun, 21 Mar 1999 23:56:18 GMT""},{""version"":""v2"",""created"":""Mon, 7 Jun 1999 17:56:38 GMT""},{""version"":""v3"",""created"":""Tue, 8 Jun 1999 04:26:15 GMT""}]","2007-05-23"
"cond-mat/9903322","Jong Hoon Jung","J. H. Jung, J. S. Ahn, T. W. Noh, Jinhyoung Lee, Jaejun Yu, Y.
  Moritomo, I. Solovyev, and K. Terakura","Optical Investigations of Charge Gap in Orbital Ordered La1/2Sr3/2MnO4","10 pages, 4 figures",,"10.1103/PhysRevB.61.6902",,"cond-mat.str-el",,"  Temperature and polarization dependent electronic structure of La1/2Sr3/2MnO4
were investigated by optical conductivity analyses. With decreasing
temperature, for E//ab, a broad mid-infrared (MIR) peak of La1/2Sr3/2MnO4
becomes narrower and moves to the higher frequency, while that of
Nd1/2Sr3/2MnO4 nearly temperature independent. We showed that the MIR peak in
La1/2Sr3/2MnO4 originates from orbital ordering associated with CE-type
magnetic ordering and that the Jahn-Teller distortion has a significant
influence on the width and the position of the MIR peak.
","[{""version"":""v1"",""created"":""Mon, 22 Mar 1999 05:30:17 GMT""}]","2009-10-31"
"cond-mat/9903323","Alain Barrat","A. Barrat","Comment on ``Small-world networks: Evidence for a crossover picture''","2 pages, latex, 2 postscript figures",,,,"cond-mat.stat-mech cond-mat.dis-nn",,"  In a recent letter (cond-mat/9903108), Barthelemy and Nunes Amaral discuss
the crossover phenomenon between regular and ``small-world'' networks, as a
function of the network size $n$ and of the disorder $p$. They claim that the
average distance $\ell$ between vertices of the network scales with $n / n^*$,
with $n^*(p \ll 1) sim p^{-\tau}$ and $\tau \approx 2/3$. We show analytically
that $\tau$ cannot be lower than 1 and perform numerical simulations showing
that $\tau = 1$.
","[{""version"":""v1"",""created"":""Mon, 22 Mar 1999 09:14:53 GMT""}]","2007-05-23"
"cond-mat/9903324","Ronald Blaak","Ronald Blaak, Daan Frenkel and Bela M. Mulder","Do cylinders exhibit a cubatic phase?","24 pages, 12 figures, RevTex (Submitted to J. Chem. Phys.)","Journal of Chemical Physics 110, 11652 (1999)","10.1063/1.479104",,"cond-mat.soft",,"  We investigate the possibility that freely rotating cylinders with an aspect
ratio $L/D=0.9$ exhibit a cubatic phase similar to the one found for a system
of cut-spheres. We present theoretical arguments why a cubatic phase might
occur in this particular system. Monte Carlo simulations do not confirm the
existence of a cubatic phase for cylinders. However, they do reveal an
unexpected phase behavior between the isotropic and crystalline phase.
","[{""version"":""v1"",""created"":""Mon, 22 Mar 1999 09:27:03 GMT""}]","2009-10-31"
"cond-mat/9903325","Christofer Cronstrom","Christofer Cronstrom and Milan Noga","New Magnetically Ordered State in the Electron Plasma of Metals",,,,"HIP-1999-09/TH","cond-mat.str-el",,"  Within the simplest model of metals, namely a gas of electrons with Coulomb
interactions, in the presence of a uniform background of positive charge to
enforce electric neutrality of the system, we have derived a mechanism, by
which the Coulomb interaction between the electrons generates a new kind of
magnetism. The ground state of the metal is represented by a magnetically
ordered state described by a non-local magnetic field. This non-local magnetic
field does not produce spin polarisation of electrons, but induces a special
long range correlation between electrons of opposite spin. This mechanism
results in a theoretical value for the binding energy per electron, which is
more than twice the corresponding value for the unmagnetised state of the
metal. The new magnetic order proposed and analysed theoretically here, can in
principle be experimentally tested.
","[{""version"":""v1"",""created"":""Mon, 22 Mar 1999 09:50:21 GMT""}]","2007-05-23"
"cond-mat/9903326","Antonio Siber","A. Siber and B. Gumhalter","Debye-Waller factor in He => Cu(001) collisions revisited: the role of
  the interaction potentials",,"A. Siber and B. Gumhalter, Surf. Sci. 385, 270 (1997)",,,"cond-mat",,"  Following the recently accumulated information on the vibrational properties
of the Cu(001) surface acquired through single- and multiphonon He atom
scattering experiments and the concomitant theoretical investigations, we have
reexamined the properties of the Debye-Waller factor (DWF) characteristic of
the He \to Cu(001) collisions using the recently developed fully quantal and
three-dimensional model of inelastic He atom scattering from surfaces. We have
focused our attention on the role which the various He-surface model potentials
with their characteristic interaction parameters (range of the interaction,
momentum and energy transfer cut-offs etc.) employed in the interpretation of
the scattering data may play in determining the magnitude of the DWF. By
combining the He-Cu(001) potential whose repulsive and attractive components
are both allowed to vibrate with the substrate phonon density of states
encompassing anharmonic effects, we obtain the values of the DWF which agree
nicely with the experimental data without invoking additional fitting
parameters. On the other hand, by taking the phonon momentum transfer cut-off
Q_c as an adjustable parameter, as has been frequently exploited in the
literature, all the considered potentials can produce agreement with
experiments by varying Q_c. The magnitudes of such best fit Q_c values are
compared with those available in the literature and their physical significance
is discussed.
","[{""version"":""v1"",""created"":""Mon, 22 Mar 1999 11:36:36 GMT""}]","2007-05-23"
"cond-mat/9903327","Andreas Jaster","Andreas Jaster","Short-time behaviour of the two-dimensional hard-disk model","11 pages, 4 figures","Physica A 277 (2000) 106","10.1016/S0378-4371(99)00483-5",,"cond-mat.stat-mech cond-mat.soft",,"  Starting from the ordered state, we investigate the short-time behaviour of
the hard-disk model. For the positional order, we determine the critical
exponents eta and z from the dynamic relaxation of the order parameter and the
cumulant with molecular dynamics simulations. The results are compared with
previous Monte Carlo (MC) simulations. The bond orientational order is studied
with MC dynamics.
","[{""version"":""v1"",""created"":""Mon, 22 Mar 1999 11:51:50 GMT""},{""version"":""v2"",""created"":""Tue, 21 Sep 1999 19:05:46 GMT""},{""version"":""v3"",""created"":""Sun, 3 Oct 1999 10:30:41 GMT""}]","2009-10-31"
"cond-mat/9903328","Ronald J. Keizer","R.J. Keizer, A. de Visser, A.A. Menovsky, J.J.M. Franse, B. Fak and
  J.-M. Mignot","Neutron-diffraction study of the evolution of antiferromagnetic order in
  UPt3 doped with Pd","21 pages text (PS), 6 pages with 11 Figs. (PS), submitted to
  Phys.Rev.B","Phys. Rev. B60 (1999) 6668-6677.","10.1103/PhysRevB.60.6668",,"cond-mat.str-el cond-mat.supr-con",,"  Neutron-diffraction experiments have been carried out on U(Pt1-xPdx)3 single
crystals (x<= 0.05). The small-moment antiferromagnetic order (SMAF) reported
for pure UPt3 is robust upon doping and persists till at least x= 0.005. The
ordered moment grows from 0.018(2) mB/U-atom for pure UPt3 to 0.048(8)
mB/U-atom for x= 0.005. The Neel temperature, TN, is approximately 6 K and does
not vary with Pd contents. The order parameter for the SMAF has an unusual
quasi-linear temperature variation. For x>= 0.01 a large moment
antiferromagnetic phase (LMAF) is found. For this phase at optimum doping (x=
0.05) TN attains a maximum value of 5.8 K and the ordered moment equals 0.63(5)
mB/U-atom. TN(x) for the LMAF follows a Doniach-type phase diagram. We infer
that the antiferromagnetic instability in U(Pt1-xPdx)3 is located in the range
0.5-1 at.% Pd.
","[{""version"":""v1"",""created"":""Mon, 22 Mar 1999 14:35:04 GMT""}]","2009-10-31"
