"gr-qc/9903093","Juan A. Valiente","J.A. Valiente-Kroon","On Killing vector fields and Newman-Penrose constants","23 pages, 8 eps figures. Submitted to J. Math. Phys","J.Math.Phys. 41 (2000) 898-923",,,"gr-qc",,"  Asymptotically flat spacetimes with one Killing vector field are considered.
The Killing equations are solved asymptotically using polyhomogeneous
expansions (i.e. series in powers of 1/r an ln r), and solved order by order.
The solution to the leading terms of these expansions yield the asymptotic form
of the Killing vector field. The possible classes of Killing fields are
discussed by analysing their orbits on null infinity. The integrability
conditions of the Killing equations are used to obtain constraints on the
components of the Weyl tensor (\Psi_0, \Psi_1, \Psi_2) and on the shear
(\sigma). The behaviour of the solutions to the constraint equations is
studied. It is shown that for Killing fields that are non-supertranslational
the characteristics of the constraint equations are the orbits of the
restriction of the Killing field to null infinity. As an application,
boost-rotation symmetric spacetimes are considered. The constraints on \Psi_0
are used to study the behaviour of the coefficients that give rise to the
Newman-Penrose constants, if the spacetime is non-polyhomogeneous, or the
logarithmic Newman-Penrose constants if the spacetime is polyhomogeneous.
","[{""version"":""v1"",""created"":""Thu, 25 Mar 1999 19:32:45 GMT""}]","2007-05-23"
"gr-qc/9903094","Takeshi Chiba","Takeshi Chiba","Quintessence, the Gravitational Constant, and Gravity","9 pages, a version to be published in Phys.Rev.D","Phys.Rev.D60:083508,1999","10.1103/PhysRevD.60.083508","UTAP-321","gr-qc astro-ph hep-ph",,"  Dynamical vacuum energy or quintessence, a slowly varying and spatially
inhomogeneous component of the energy density with negative pressure, is
currently consistent with the observational data. One potential difficulty with
the idea of quintessence is that couplings to ordinary matter should be
strongly suppressed so as not to lead to observable time variations of the
constants of nature. We further explore the possibility of an explicit coupling
between the quintessence field and the curvature. Since such a scalar field
gives rise to another gravity force of long range ($\simg H^{-1}_0$), the solar
system experiments put a constraint on the non-minimal coupling: $|\xi| \siml
10^{-2}$.
","[{""version"":""v1"",""created"":""Thu, 25 Mar 1999 23:30:50 GMT""},{""version"":""v2"",""created"":""Fri, 4 Jun 1999 11:38:21 GMT""},{""version"":""v3"",""created"":""Sun, 1 Aug 1999 08:11:21 GMT""}]","2014-11-17"
"gr-qc/9903095","Andrew P. Billyard","Andrew P. Billyard (Dalhousie University), Alan A. Coley (Dalhousie
  University), James E. Lidsey (University of Sussex)","Qualitative Analysis of String Cosmologies","13 pages, 4 postscript figures, accepted to Physical Review D","Phys.Rev. D59 (1999) 123505","10.1103/PhysRevD.59.123505","DH-99-03","gr-qc astro-ph hep-th",,"  A qualitative analysis is presented for spatially flat, isotropic and
homogeneous cosmologies derived from the string effective action when the
combined effects of a dilaton, modulus, two-form potential and central charge
deficit are included. The latter has significant effects on the qualitative
dynamics. The analysis is also directly applicable to the anisotropic Bianchi
type I cosmology.
","[{""version"":""v1"",""created"":""Fri, 26 Mar 1999 00:43:46 GMT""}]","2009-10-31"
"gr-qc/9903096","Pelykh Volodymyr","Volodymyr Pelykh","Squared Weyl and Dirac fields with Sommers-Sen connection, associated
  with $V^4_3$ distribution","9 pages, LaTex","Condensed Matter Phys. 1 (1998) 521-528",,,"gr-qc",,"  The generalization of Sommers--Sen spinor connection for spinor fields,
associated with a distribution $V_4^3$ and on this basis the equations for Weyl
and Dirac null vector fields on complexificated $V_4^3$ are obtained.
  We interpret the obtained results by examining the interaction of spinor
fields with the inertial forces.
","[{""version"":""v1"",""created"":""Fri, 26 Mar 1999 13:43:48 GMT""}]","2016-08-31"
"hep-ex/9903061","Mark R. Convery","Mark R. Convery (SLAC), Representing the SLD Collaboration","B Decay Studies at SLD","12 Pages, 4 Figures. Contribution to DPF '99",,,"SLAC-PUB-8076","hep-ex",,"  We present three preliminary results from SLD on B decays: an inclusive
search for the process b-> s gluon, a measurement of the branching ratio for
the process B -> D D-bar X, and measurements of the charged and neutral B
lifetimes. All three measurements make use of the excellent vertexing
efficiency and resolution of the CCD Vertex Detector and the first two make use
of the excellent particle identification capability of the Cherenkov Ring
Imaging Detector. The b->sg analysis searches for an enhancement of high
momentum charged kaons produced in B decays. Within the context of a simple,
Jetset-inspired model of b->sg, a limit of BR(b->sg) < 7.6% is obtained. The B
-> D D-bar X analysis reconstructs two secondary vertices and uses identified
charged kaons to determine which of these came from charm decays. The result of
the analysis is BR(B -> D D-bar X) = (16.2 +/- 1.9 +/- 4.2)%. The results of
lifetime analysis are: \tau_{B^+} = 1.686 +/-0.025 +/- 0.042 ps, \tau_{B^0} =
1.589 +/- 0.026 +/- 0.055 ps and $\tau_{B^+}/\tau_{B^0} = 1.061 +/-
^{0.031}_{0.029} +/- 0.027.
","[{""version"":""v1"",""created"":""Thu, 25 Mar 1999 23:35:12 GMT""}]","2007-05-23"
"hep-ex/9903062","Brunner","F. Cerutti, ALEPH Collaboration","Determination of the upper limit on m_nu_tau from LE","7 pages, 4 figures, submitted to DPF'99",,,,"hep-ex",,"  A review of the direct determinations of the upper limit on the tau-neutrino
mass from the LEP experiments is given. The experimental methods, the results
and the comparison with non LEP measurements are also discussed. The study of
the systematic errors shows that the LEP results are statistically limited so
that their combination will improve the sensitivity to a massive tau-neutrino.
An unofficial combination of the ALEPH and OPAL measurements gives a 95%
confidence level upper limit of 15 MeV on the tau-neutrino mass.
","[{""version"":""v1"",""created"":""Fri, 26 Mar 1999 10:02:19 GMT""},{""version"":""v2"",""created"":""Tue, 30 Mar 1999 11:55:32 GMT""}]","2007-05-23"
"hep-ex/9903063","Catherine Bourge","F. Parodi, P. Roudeau and A. Stocchi","Constraints on the parameters of the CKM matrix by End 1998","26 pages","Nuovo Cim.A112:833-854,1999",,"LAL 99-03","hep-ex hep-ph",,"  A review of the current status of the Cabibbo-Kobayashi-Maskawa matrix (CKM)
is presented. This paper is an update of the results published in [1]. The
experimental constraints imposed by the measurements of \epsilon_K,
V_{ub}/V_{cb}, \Delta m_d and from the limit on \Delta m_d are used. Values of
the constraints and of the parameters entering into the constraints, which
restrict the range of the \bar{\rho} and \bar{\eta} parameters, include recent
measurements presented at 1998 Summer Conferences and progress obtained by
lattice QCD collaborations. The results are: \bar{\rho}=0.202
^{+0.053}_{-0.059},\bar{\eta}=0.340 \pm 0.035, from which the angles \alpha,
\beta and \gamma of the unitarity triangle are inferred : \sin 2 \alpha = -0.26
^{+ 0.29}_{-0.28} ,\sin 2 \beta = 0.725 ^{+0.050}_{-0.060} ,\gamma=
(59.5^{+8.5}_{-7.5})^{\circ}. Without using the constraint from \epsilon_K,
\sin 2 \beta has been obtained: \sin 2 \beta = 0.72 ^{+0.07}_{-0.11}. Several
external measurements or theoretical inputs have been removed, in turn, from
the constraints and their respective probability density functions have been
obtained. Central values and uncertainties on these quantities have been
compared with actual measurements or theoretical evaluations. In this way it is
possible to quantify the importance of the different measurements and the
coherence of the Standard Model scenario for CP violation. An important result
is that \Delta m_s is expected to be between [12.0-17.6] ps^{-1} with 68% C.L.
and <20 ps^{-1} at 95% C.L. Finally relations between the CKM parameters and
the quark masses are examined within a given model.
","[{""version"":""v1"",""created"":""Fri, 26 Mar 1999 10:44:07 GMT""}]","2010-11-23"
"hep-ph/9903494","John D. Hobbs","John D. hobbs","Higgs Prospects at the Upgraded Tevatron: Fermilab Study Results","Reference to working group main web page added. Trilepton symbol
  fixed",,,,"hep-ph",,"  Preliminary results from a Fermilab study of the sensitivity for higgs
production at the Tevatron in run II and beyond are presented. The study
extends existing results by systematically combining all decay channels,
considering the production of higher mass higgs bosons and interpreting the
results in the context of supersymmetric higgs production as well as standard
model production. In addition new analysis methods which significantly improve
sensisity are used.
","[{""version"":""v1"",""created"":""Thu, 25 Mar 1999 19:54:23 GMT""},{""version"":""v2"",""created"":""Tue, 18 May 1999 14:02:59 GMT""}]","2016-09-06"
"hep-ph/9903495","Hirotsugu Fujii","H.Fujii and D.Kharzeev","Long-Range Forces of QCD","16pages, 9 eps figures; discussion extended, 2 new references added,
  to appear in Phys.Rev.D","Phys.Rev. D60 (1999) 114039","10.1103/PhysRevD.60.114039",,"hep-ph nucl-th",,"  We consider the scattering of two color dipoles (e.g., heavy quarkonium
states) at low energy - a QCD analog of Van der Waals interaction. Even though
the couplings of the dipoles to the gluon field can be described in
perturbation theory, which leads to the potential proportional to
(N_c^2-1)/R^{7}, at large distances R the interaction becomes totally
non-perturbative. Low-energy QCD theorems are used to evaluate the leading
long-distance contribution \sim (N_f^2-1)/(11N_c - 2N_f)^2 R^{-5/2} exp(-2 \mu
R) (\mu is the Goldstone boson mass), which is shown to arise from the
correlated two-boson exchange. The sum rule which relates the overall strength
of the interaction to the energy density of QCD vacuum is derived.
Surprisingly, we find that when the size of the dipoles shrinks to zero (the
heavy quark limit in the case of quarkonia), the non-perturbative part of the
interaction vanishes more slowly than the perturbative part as a consequence of
scale anomaly. As an application, we evaluate elastic \pi J/\psi and \pi J/\psi
\to \pi \psi' cross sections.
","[{""version"":""v1"",""created"":""Thu, 25 Mar 1999 23:44:11 GMT""},{""version"":""v2"",""created"":""Tue, 24 Aug 1999 01:59:33 GMT""}]","2009-10-31"
"hep-ph/9903496",,"Ho-Meoyng Choi and Chueng-Ryong Ji","Light-Front Quark Model Analysis of Exclusive $0^{-}$$\to$$0^{-}$
  Semileptonic Heavy Meson Decays","16 pages including 5 figures; version to be published in Phys. Lett.
  B","Phys.Lett. B460 (1999) 461-466","10.1016/S0370-2693(99)00817-5",,"hep-ph",,"  We present the analysis of exclusive $0^{-}$$\to$$0^{-}$ semileptonic heavy
meson decays using the constituent quark model based on the light-front
quantization. Our model is constrained by the variational principle for the
well-known linear plus Coulomb interaction motivated by QCD. Our method of
analytic continuation to obtain the weak form factors avoids the difficulty
associated with the contribution from the nonvalence quark-antiquark pair
creation. Our numerical results for the heavy-to-heavy and heavy-to-light meson
decays are in a good agreement with the available experimental data and the
lattice QCD results. In addition, our model predicts the two unmeasured mass
spectra of $^{1}S_{0}(b\bar{b})$ and $^{3}S_{1}(b\bar{s})$ systems as
$M_{b\bar{b}}$=9657 MeV and $M_{b\bar{s}}$= 5424 MeV.
","[{""version"":""v1"",""created"":""Fri, 26 Mar 1999 01:56:39 GMT""},{""version"":""v2"",""created"":""Wed, 7 Jul 1999 19:34:04 GMT""}]","2009-10-31"
"hep-ph/9903497","Dr. Ambar Ghosal","Ambar Ghosal","Light Dirac Neutrinos In An $SU(2)_L\times U(1)_Y$ Model","Latex, 13 pages, no figures",,,"SINP/TNP/99-07","hep-ph",,"  Light Dirac neutrino of mass of mass of the order of few eV is obtained in an
$SU(2)_L\times U(1)_Y$ model with an extended Higgs sector and right-handed
neutrinos. Small neutrino mass is generated at the tree level through small
effective coupling of the Dirac neutrino mass term due to soft discrete
symmetry breaking. In order to remove the exact degeneracy in mass between the
second and the third generation of neutrinos, one loop corrected mass terms are
incorporated. The model can accommodate bi-maximal mixing scenario of neutrino
which has been favoured by recent Solar and atmospheric neutrino experiments.
","[{""version"":""v1"",""created"":""Fri, 26 Mar 1999 08:06:29 GMT""}]","2007-05-23"
"hep-ph/9903498","Takaaki Nagano","T. Nagano, A. Ota and Y. Sumino (Tohoku Univ.)","O(alpha_s^2) Corrections to e+e- to ttbar Total and Differential Cross
  Sections Near Threshold","23 pages, LaTeX2e, 16 PostScript figures, uses graphicx.sty;
  Descriptions on the momentum distribution are enlarged; A derivation of the
  momentum distribution formula is added as an appendix; Other minor changes;
  In ver.4, comparison with O(alfs) final-state interaction corrections to
  momentum distribution added; two figures added","Phys. Rev. D 60, 114014 (1999)","10.1103/PhysRevD.60.114014","TU-562","hep-ph",,"  Recently full O(alpha_s^2, alpha_s*beta, beta^2) corrections to the threshold
total cross section for e+e- to ttbar have been calculated, and the reported
corrections turned out to be unexpectedly large. We study how to reduce
theoretical uncertainties of the cross section. We adopt a new mass definition
proposed by Beneke, which incorporates a renormalon-pole cancellation in the
total energy of a static quark-antiquark pair. This improves the convergence of
the 1S resonance mass, while the normalization of the cross section scarcely
changes. We argue that resummations of logarithms are indispensable, since two
largely separated scales dictate the shape of the cross section. As a first
step, we resum logarithms in the Coulombic part of the t-tbar potential and
observe a considerable improvement in the convergence of corresponding
corrections. There still remain, however, large corrections, which arise from a
1/r^2 term in the ttbar potential. We also calculate full O(alpha_s^2,
alpha_s*beta, beta^2) corrections to the momentum distributions of top quarks
in the threshold region. Corrections to the distribution shape are small on the
1S resonance. At higher energies, corrections become larger.
","[{""version"":""v1"",""created"":""Fri, 26 Mar 1999 08:31:44 GMT""},{""version"":""v2"",""created"":""Sun, 28 Mar 1999 09:27:25 GMT""},{""version"":""v3"",""created"":""Mon, 24 May 1999 07:50:45 GMT""},{""version"":""v4"",""created"":""Thu, 1 Jul 1999 10:49:54 GMT""}]","2016-08-25"
"hep-ph/9903499","Bodenmueller","Harald Fritzsch and Zhi-zhong Xing","Nearly Degenerate Neutrino Masses and Nearly Decoupled Neutrino
  Oscillations","Latex 6 pages. Talk given at the 17th International Workshop on Weak
  Interactions and Neutrinos, Cape Town, South Africa, January 1999",,,"LMU 04/99","hep-ph",,"  We introduce a simple flavor symmetry breaking scheme, in which charged
lepton masses have a strong hierarchy and neutrino masses are almost
degenerate. It is possible to obtain a natural suppression of lepton flavor
mixing between the 1st and 3rd families as well as the approximate decoupling
of atmospheric and solar neutrino oscillations with nearly bi-maximal mixing
factors. The similarity and difference between lepton and quark flavor mixing
schemes are briefly discussed.
","[{""version"":""v1"",""created"":""Fri, 26 Mar 1999 08:28:08 GMT""}]","2007-05-23"
"hep-th/9903214","Chris Pope","M. Cvetic, M.J. Duff, P. Hoxha, James T. Liu, H. Lu, J.X. Lu, R.
  Martinez-Acosta, C.N. Pope, H. Sati and T.A. Tran","Embedding AdS Black Holes in Ten and Eleven Dimensions","Latex, 35 pages; minor typos corrected","Nucl.Phys.B558:96-126,1999","10.1016/S0550-3213(99)00419-8","UPR/0840-T, CTP-TAMU-11/99, RU99-4-B","hep-th",,"  We construct the non-linear Kaluza-Klein ans\""atze describing the embeddings
of the U(1)^3, U(1)^4 and U(1)^2 truncations of D=5, D=4 and D=7 gauged
supergravities into the type IIB string and M-theory. These enable one to
oxidise any associated lower dimensional solutions to D=10 or D=11. In
particular, we use these general ans\""atze to embed the charged AdS_5, AdS_4
and AdS_7 black hole solutions in ten and eleven dimensions. The charges for
the black holes with toroidal horizons may be interpreted as the angular
momenta of D3-branes, M2-branes and M5-branes spinning in the tranverse
dimensions, in their near-horizon decoupling limits. The horizons of the black
holes coincide with the worldvolumes of the branes. The Kaluza-Klein ans\""atze
also allow the black holes with spherical or hyperbolic horizons to be
reinterpreted in D=10 or D=11.
","[{""version"":""v1"",""created"":""Fri, 26 Mar 1999 00:38:14 GMT""},{""version"":""v2"",""created"":""Fri, 7 May 1999 18:52:17 GMT""}]","2009-09-17"
"hep-th/9903221","Freydoon Mansouri","R.L. Karp, F. Mansouri, J.S. Rno","Product Integral Representations of Wilson Lines and Wilson Loops, and
  Non-Abelian Stokes Theorem","20 pages, LaTex","Turk.J.Phys. 24 (2000) 365-384",,"uctp101.99","hep-th",,"  We make use of product integrals to provide an unambiguous mathematical
representation of Wilson line and Wilson loop operators. Then, drawing upon
various properties of product integrals, we discuss such properties of these
operators as approximating them with partial sums, their convergence, and their
behavior under gauge transformations. We also obtain a surface product integral
representation for the Wilson loop operator. The result can be interpreted as
the non-abelian version of Stokes theorem.
","[{""version"":""v1"",""created"":""Thu, 25 Mar 1999 16:15:59 GMT""}]","2007-05-23"
"hep-th/9903222","Adam Ritz","T. Brotz, M. Ortiz, and A. Ritz","On Modular Invariance and 3D Gravitational Instantons","14 pages, RevTeX, typos corrected, to appear in Phys. Rev. D","Phys.Rev. D60 (1999) 064012","10.1103/PhysRevD.60.064012","TPI-MINN-99/17, UMN-TH-1755-99","hep-th",,"  We study the modular transformation properties of Euclidean solutions of 3D
gravity whose asymptotic geometry has the topology of a torus. These solutions
represent saddle points of the grand canonical partition function with an
important example being the BTZ black hole, and their properties under modular
transformations are inherited from the boundary conformal field theory encoding
the asymptotic dynamics. Within the Chern Simons formulation, classical
solutions are characterised by specific holonomies describing the wrapping of
the gauge field around cycles of the torus. We find that provided these
holonomies transform in an appropriate manner, there exists an associated
modular invariant grand canonical partition function and that the spectrum of
saddle points naturally includes a thermal bath in $AdS_3$ as discussed by
Maldacena and Strominger. Indeed, certain modular transformations can naturally
be described within classical bulk dynamics as mapping between different
foliations with a ""time"" coordinate along different cycles of the asymptotic
torus.
","[{""version"":""v1"",""created"":""Thu, 25 Mar 1999 16:58:17 GMT""},{""version"":""v2"",""created"":""Wed, 30 Jun 1999 16:55:47 GMT""}]","2009-10-31"
"hep-th/9903223","Sergei Shabanov","Sergei V. Shabanov (Univ. of Florida)","An effective action for monopoles and knot solitons in Yang-Mills theory","plain Latex, 12 pages, no figures, a few references and comments are
  added, a final version for Phys. Lett. B","Phys.Lett. B458 (1999) 322-330","10.1016/S0370-2693(99)00612-7",,"hep-th hep-lat",,"  By comparision with numerical results in the maximal Abelian projection of
lattice Yang-Mills theory, it is argued that the nonperturbative dynamics of
Yang Mills theory can be described by a set of fields that take their values in
the coset space SU(2)/U(1). The Yang-Mills connection is parameterized in a
special way to separate the dependence on the coset field. The coset field is
then regarded as a collective variable, and a method to obtain its effective
action is developed. It is argued that the physical excitations of the
effective action may be knot solitons. A procedure to calculate the mass scale
of knot solitons is discussed for lattice gauge theories in the maximal Abelian
projection. The approach is extended to the SU(N) Yang-Mills theory. A relation
between the large N limit and the monopole dominance is pointed out.
","[{""version"":""v1"",""created"":""Thu, 25 Mar 1999 23:43:15 GMT""},{""version"":""v2"",""created"":""Thu, 13 May 1999 18:23:11 GMT""}]","2009-10-31"
"hep-th/9903224","Edward Witten","Nathan Seiberg and Edward Witten","The D1/D5 System And Singular CFT","39 pp, added reference","JHEP 9904:017,1999","10.1088/1126-6708/1999/04/017",,"hep-th",,"  We study the conformal field theory of the D1/D5 system compactified on X (X
is T^4 or K3). It is described by a sigma model whose target space is the
moduli space of instantons on X. For values of the parameters where the branes
can separate, the spectrum of dimensions in the conformal field theory exhibits
a continuum above a gap. This continuum leads to a pathology of the conformal
field theory, which explains a variety of problems in various systems. In
particular, we explain the apparent discrepancy between different methods of
finding the spectrum of chiral fields at certain points in the moduli space of
the system.
","[{""version"":""v1"",""created"":""Thu, 25 Mar 1999 21:03:40 GMT""},{""version"":""v2"",""created"":""Sun, 18 Apr 1999 19:24:31 GMT""},{""version"":""v3"",""created"":""Wed, 26 May 1999 19:22:49 GMT""}]","2010-04-07"
"hep-th/9903225","Andrew Chamblin","H.A. Chamblin and H.S. Reall (Cambridge)","Dynamic Dilatonic Domain Walls","32 pages LaTeX, 5 .eps figures, corrected some typos","Nucl.Phys.B562:133-157,1999","10.1016/S0550-3213(99)00520-9","DAMTP-1999-35","hep-th gr-qc hep-ph",,"  Motivated by the ``universe as a brane'' idea, we investigate the motion of a
$(D-2)$-brane (or domain wall) that couples to bulk matter. Usually one would
expect the spacetime outside such a wall to be time dependent however we show
that in certain cases it can be static, with consistency of the Israel
equations yielding relationships between the bulk metric and matter that can be
used as ans\""atze to solve the Einstein equations. As a concrete model we study
a domain wall coupled to a bulk dilaton with Liouville potentials for the
dilaton both in the bulk and on the wall. The bulk solutions we find are all
singular but some have black hole or cosmological horizons, beyond which our
solutions describe domain walls moving in time dependent bulks. A significant
period of world volume inflation occurs if the potential on the wall is not too
steep; in some cases the bulk also inflates (with the wall comoving) while in
others the wall moves relative to a non-inflating bulk. We apply our method to
obtain cosmological solutions of Ho\v{r}ava-Witten theory compactified on a
Calabi-Yau space. tive to a non-inflating bulk. We apply our method to obtain
cosmological solutions of Ho\v{r}ava-Witten theory compactified on a Calabi-Yau
space.
","[{""version"":""v1"",""created"":""Thu, 25 Mar 1999 21:48:16 GMT""},{""version"":""v2"",""created"":""Thu, 8 Apr 1999 21:16:23 GMT""},{""version"":""v3"",""created"":""Sun, 2 May 1999 18:53:51 GMT""}]","2009-07-09"
"hep-th/9903226","Cumrun Vafa","P.H. Frampton and C. Vafa","Conformal Approach to Particle Phenomenology","17 pages, 3 figures",,,"HUTP-99/A018","hep-th hep-ph",,"  We propose the existence of a non-supersymmetric conformal field theory
softly broken at the TeV scale as a new mechanism for solving the hierarchy
problem. We find the imposition of conformal invariance to be very restrictive
with many predictive consequences, including severe restrictions on the field
content, the number of families as well as on the structure of inter-family
Yukawa couplings. A large class of potentially conformal non-supersymmetric
theories are considered and some general predictions are made about the
existence of a rich spectrum of color and weak multiplets in the TeV range.
","[{""version"":""v1"",""created"":""Thu, 25 Mar 1999 22:26:09 GMT""}]","2007-05-23"
"hep-th/9903227","Akikazu Hashimoto","Akikazu Hashimoto","Holographic description of D3-branes in flat space","8 pages, 1 eps figure","Phys. Rev. D 60, 127902 (1999)","10.1103/PhysRevD.60.127902","NSF-ITP-99-020","hep-th",,"  We describe a scheme for constructing the holographic dual of the full
D3-brane geometry with charge $K$ by embedding it into a large anti-de Sitter
space of size $N$. Such a geometry is realized in a multi-center anti-de Sitter
geometry which admits a simple field theory interpretation as $SU(N+K)$ gauge
theory broken to $SU(N) \times SU(K)$. We find that the characteristic size of
the D3-brane geometry is of order $(K/N)^{1/4} U^0$ where $U^0$ is the scale of
the Higgs. By choosing $N$ to be much larger than $K$, the scale of the
D3-brane metric can be well separated from the Higgs scale in the radial
coordinate. We generalize the holographic energy-distance relation and estimate
the characteristic energy scale associated with these radial scales, and find
that the $E/U$ relation becomes effectively $U$ independent in the range
$(K/N)^{1/2} U^0 < U < U^0$. This implies that all detailed structure of the
D3-brane geometry is encoded in the fine structure of the boundary gauge theory
at around the Higgs scale.
","[{""version"":""v1"",""created"":""Fri, 26 Mar 1999 00:20:33 GMT""}]","2016-08-25"
