"hep-th/9903228","Leonard Susskind","Joseph Polchinski, Leonard Susskind and Nicolaos Toumbas","Negative Energy, Superluminosity and Holography","Expanded version replacing earlier hep-th/9902182","Phys.Rev.D60:084006,1999","10.1103/PhysRevD.60.084006",,"hep-th",,"  The holographic connection between large $N$ Super Yang Mills theory and
gravity in anti deSitter space requires unfamiliar behavior of the SYM theory
in the limit that the curvature of the AdS geometry becomes small. The
paradoxical behavior includes superluminal oscillations and negative energy
density. These effects typically occur in the SYM description of events which
take place far from the boundary of AdS when the signal from the event arrives
at the boundary. The paradoxes can be resolved by assuming a very rich
collection of hidden degrees of freedom of the SYM theory which store
information but give rise to no local energy density. These degrees of freedom,
called precursors, are needed to make possible sudden apparently acausal energy
momentum flows. Such behavior would be impossible in classical field theory as
a consequence of the positivity of the energy density. However we show that
these effects are not only allowed in quantum field theory but that we can
model them in free quantum field theory.
","[{""version"":""v1"",""created"":""Fri, 26 Mar 1999 00:37:59 GMT""},{""version"":""v2"",""created"":""Thu, 1 Apr 1999 22:44:47 GMT""},{""version"":""v3"",""created"":""Mon, 5 Apr 1999 18:11:36 GMT""},{""version"":""v4"",""created"":""Fri, 18 Jun 1999 18:29:57 GMT""}]","2009-10-07"
"hep-th/9903229","Robert Mann","R.B. Mann","Misner String Entropy","revtex, 5 pages, references added, typo corrected","Phys.Rev. D60 (1999) 104047","10.1103/PhysRevD.60.104047","WATPHYS-TH99/01, NSF-ITP-99-21","hep-th gr-qc",,"  I show that gravitational entropy can be ascribed to spacetimes containing
Misner strings (the gravitational analogues of Dirac strings), even in the
absence of any other event horizon (or bolt) structures. This result follows
from an extension of proposals for evaluating the stress-energy of a
gravitational system which are motivated by the AdS/CFT correspondence.
","[{""version"":""v1"",""created"":""Fri, 26 Mar 1999 01:38:21 GMT""},{""version"":""v2"",""created"":""Wed, 31 Mar 1999 00:55:09 GMT""}]","2009-10-31"
"hep-th/9903230","Jeong-Hyuck Park","Jeong-Hyuck Park","Superconformal Symmetry and Correlation Functions","1+56 pages, No figure, LaTeX. Reference Added, Selection Rule
  Generalized, Typos. To be published in Nucl. Phys. B 559: 455, 1999","Nucl.Phys. B559 (1999) 455-501","10.1016/S0550-3213(99)00432-0","KIAS-99019","hep-th",,"  Four-dimensional N-extended superconformal symmetry and correlation functions
of quasi-primary superfields are studied within the superspace formalism. A
superconformal Killing equation is derived and its solutions are classified in
terms of supertranslations, dilations, Lorentz transformations, R-symmetry
transformations and special superconformal transformations. In general, due to
the invariance under supertranslations and special superconformal
transformations, superconformally invariant n-point functions reduce to one
unspecified (n-2)-point function which must transform homogeneously under the
remaining rigid transformations, i.e. dilations, Lorentz transformations and
R-symmetry transformations. Based on this result, we are able to identify all
the superconformal invariants and obtain the general form of n-point functions
for scalar superfields. In particular, as a byproduct, a selection rule for
correlation functions is derived, the existence of which in N=4 super
Yang-Mills theory was previously predicted in the context of AdS/CFT
correspondence. Superconformally covariant differential operators are also
discussed.
","[{""version"":""v1"",""created"":""Fri, 26 Mar 1999 03:12:02 GMT""},{""version"":""v2"",""created"":""Fri, 2 Apr 1999 10:33:31 GMT""},{""version"":""v3"",""created"":""Tue, 26 Oct 1999 07:21:59 GMT""}]","2016-09-06"
"hep-th/9903231","Ryuji Kemmoku","Akira Fujii, Ryuji Kemmoku (KEK-Tanashi)","D=5 Simple Supergravity on AdS_2 \times S^3","14 pages, Latex, 4 figures; some description improved","Phys.Lett. B459 (1999) 137-144","10.1016/S0370-2693(99)00675-9",,"hep-th",,"  The Kaluza-Klein spectrum of D=5 simple supergravity compactified on S^3 is
studied. A classical background solution which preserves maximal supersymmetry
is fulfilled by the geometry of AdS_2\times S^3. The physical spectrum of the
fluctuations is classified according to SU(1,1|2)\times SU(2) symmetry, which
has a very similar structure to that in the case of compactification on
AdS_3\times S^2.
","[{""version"":""v1"",""created"":""Fri, 26 Mar 1999 11:49:02 GMT""},{""version"":""v2"",""created"":""Thu, 3 Jun 1999 09:27:55 GMT""}]","2009-10-31"
"hep-th/9903232","Wolfgang Lerche","W. Lerche and S. Stieberger","On the Anomalous and Global Interactions of Kodaira 7-Planes","7p, 3 figs, latex","Fortsch.Phys.48:155-161,2000","10.1002/(SICI)1521-3978(20001)48:1/3<155::AID-PROP155>3.0.CO;2-#","CERN-TH/99-85","hep-th",,"  We review interactions between certain 7-planes which are composed out of
mutually non-local (p,q) 7-branes and which correspond to specific Kodaira
singularities. We discuss in particular how to compute certain moduli-dependent
terms in the effective action. These do not only probe the local Chern-Simons
terms on the world-volumina, but also certain global aspects of plane
interactions that can be attributed to ``torsion'' (or \ZZ_N-valued) D-brane
charges.
","[{""version"":""v1"",""created"":""Fri, 26 Mar 1999 13:16:47 GMT""}]","2015-06-26"
"hep-th/9903233","Akishi Kato","Hiroshige Kajiura, Akishi Kato, Sachiko Ogushi","Comments on Large N Matrix Model","32 pages, 9 figures","Prog.Theor.Phys. 103 (2000) 197-223","10.1143/PTP.103.197","UTMS 99-16, OCHA-PP135","hep-th",,"  The large N Matrix model is studied with attention to the quantum
fluctuations around a given diagonal background. Feynman rules are explicitly
derived and their relation to those in usual Yang-Mills theory is discussed.
Background D-instanton configuration is naturally identified as a
discretization of momentum space of a corresponding QFT. The structure of large
N divergence is also studied on the analogy of UV divergences in QFT.
","[{""version"":""v1"",""created"":""Fri, 26 Mar 1999 13:14:04 GMT""}]","2009-10-31"
"hep-th/9903234","Hatuda","Mitsuko Abe, Machiko Hatsuda, Kiyoshi Kamimura and Takashi Tokunaga","SO(2,1) Covariant IIB Superalgebra","12 pages, Latex; <mabe@th.phys.titech.ac.jp,
  mhatsuda@ccthmail.kek.jp, kamimura@ph.sci.toho-u.ac.jp>","Nucl.Phys. B553 (1999) 305-316","10.1016/S0550-3213(99)00306-5",,"hep-th",,"  We propose a type IIB super-Poincare algebra with SO(2,1) covariant central
extension. Together with SO(2,1) and SO(9,1) generators, a SO(2,1) triplet
(momenta), a Majorana-spinor doublet (supercharges) and a Rarita-Schwinger
central charge generate a group, G. We consider a coset G/H where H=(SO(2) x
Lorentz), and the SL(2,R) 2-form doublet is obtained by the coset construction.
It is shown that U(1) connections, whose strengths are associated with 2-forms,
are recognized as coordinates of the enlarged space. We suggest that this is
the fundamental algebra governing the superstring theories which explains the
IIB SL(2,R) duality and geometrical origin of U(1) fields.
","[{""version"":""v1"",""created"":""Fri, 26 Mar 1999 14:23:32 GMT""}]","2009-10-31"
"hep-th/9903235","Dr. Burkhard Kleihaus","B. Kleihaus (1) and J. Kunz (2) ((1) Nat. U. of Ireland Maynooth,
  Ireland, (2) University Oldenburg, Germany)","Comment on ``Singularities in axially symmetric solutions of
  Einstein-Yang Mills and related theories, by Ludger Hannibal,
  [hep-th/9903063]''","2 pages, no figures, LaTex format using RevTex",,,,"hep-th",,"  We point out that the statements in [hep-th/9903063] concerning the
regularity of static axially symmetric solutions in Yang-Mills-dilaton (YMD)
[1] and Einstein-Yang-Mills(-dilaton) (EYMD) theory [2,3] are incorrect, and
that the non-singular local gauge potential of the YMD solutions [4] is twice
differentiable.
","[{""version"":""v1"",""created"":""Fri, 26 Mar 1999 15:36:54 GMT""}]","2007-05-23"
"math-ph/9903044","Hanno Hammer","Hanno Hammer","Spacetime Topology, Conserved Charges, and the Splitting of Classical
  Multiplets","PhD. Thesis, University of Cambridge, DAMTP. 147 pages. Requires
  amsthm,amsxtra,amsfonts,amssymb,latexsym",,,"R99/3","math-ph math.MP",,"  We examine consequences of non-trivial topology in background spacetimes and
super-spacetimes: It is shown how the semi-invariance of a brane Lagrangian
under supertranslations gives rise to topological extensions of the Noether
charge algebra carried by D-branes. We investigate how isometry groups of
lightlike compactified spacetimes admit an extension to a semigroup. It is
shown how the splitting of classical multiplets caused by
multiply-connectedness of a phase space can be described in the framework of
Symplectic Geometry, based on the concept of symplectic covering spaces and
local moment maps.
","[{""version"":""v1"",""created"":""Thu, 25 Mar 1999 18:17:50 GMT""}]","2007-05-23"
"math/9903152","Xianzhe Dai","Xianzhe Dai and Weiping Zhang","Real embeddings and the Atiyah-Patodi-Singer index theorem for Dirac
  operators",,,,,"math.DG math.AP",,"  We present the details of our embedding proof of the Atiyah-Patodi-Singer
index theorem for Dirac operators on manifolds with boundary.
","[{""version"":""v1"",""created"":""Thu, 25 Mar 1999 20:58:14 GMT""}]","2007-05-23"
"math/9903153","James Propp","James Propp","Three-player impartial games","8 pages, 10 tables; to appear in Theoretical Computer Science","Theoretical Computer Science, volume 233 (2000), 263--278.",,,"math.CO",,"  Past efforts to classify impartial three-player combinatorial games (the
theories of Li and Straffin) have made various restrictive assumptions about
the rationality of one's opponents and the formation and behavior of
coalitions. One may instead adopt an agnostic attitude towards such issues, and
seek only to understand in what circumstances one player has a winning strategy
against the combined forces of the other two. By limiting ourselves to this
more modest theoretical objective, and by regarding two games as being
equivalent if they are interchangeable in all disjunctive sums,as far as
single-player winnability is concerned, we can obtain an interesting analogue
of Grundy values for three-player impartial games.
","[{""version"":""v1"",""created"":""Fri, 26 Mar 1999 00:04:10 GMT""},{""version"":""v2"",""created"":""Sun, 20 Jun 1999 23:45:02 GMT""}]","2007-05-23"
"math/9903154","Jian Zhou","Jian Zhou","Hodge theory and $A_{\infty}$ structures on cohomology",,,,,"math.DG math.AT",,"  We use Hodge theory and a construction of Merkulov to construct $A_{\infty}$
structures on de Rham cohomology and Dolbeault cohomology.
","[{""version"":""v1"",""created"":""Fri, 26 Mar 1999 00:27:26 GMT""}]","2007-05-23"
"nucl-th/9903059","Ulrich Heinz","U. Heinz and U.A. Wiedemann","Testing the Space-Time Structure of Event Generators","16 pages LaTeX, including 5 postscript figures. To appear in the
  Proceedings of ``RHIC Physics and Beyond - Kay Kay Gee Day'' (Brookhaven
  National Laboratory, 23 Oct 1998), ed. by B. Muller and R.D. Pisarski, AIP
  Conference Proceedings",,"10.1063/1.59573","CERN-TH/99-55","nucl-th",,"  We report on work done in collaboration with Klaus Kinder-Geiger and John
Ellis which aims at connecting the space-time structure of event generator
simulations with observable output.
","[{""version"":""v1"",""created"":""Thu, 25 Mar 1999 16:27:29 GMT""}]","2009-10-31"
"nucl-th/9903060","Sergei A. Voloshin","S.A. Voloshin, V. Koch, H.G. Ritter","Event-by-event fluctuations in collective quantities","LaTex, 14 pages and 5 figures. 2 references added","Phys.Rev. C60 (1999) 024901","10.1103/PhysRevC.60.024901","LBNL-42992A","nucl-th",,"  We discuss an event-by-event fluctuation analysis of particle production in
heavy ion collisions. We compare different approaches to the evaluation of the
event-by-event dynamical fluctuations in quantities defined on groups of
particles, such quantities as mean transverse momentum, transverse momentum
spectra slope, strength of anisotropic flow, etc.. The direct computation of
the dynamical fluctuations and the sub-event method are discussed in more
detail. We also show how the fluctuation in different variables can be related
to each other.
","[{""version"":""v1"",""created"":""Thu, 25 Mar 1999 19:19:11 GMT""},{""version"":""v2"",""created"":""Wed, 31 Mar 1999 23:39:31 GMT""}]","2009-10-31"
"nucl-th/9903061","Sven Soff","Sven Soff, Steffen A. Bass, Marcus Bleicher, Horst Stoecker and Walter
  Greiner (Inst. f. Theor. Physik, Goethe-Universitaet Frankfurt, Germany, and
  Duke University, USA)","Directed and Elliptic Flow","Latex, 4 pages, 3 eps-figures",,,,"nucl-th hep-ph nucl-ex",,"  We compare microscopic transport model calculations to recent data on the
directed and elliptic flow of various hadrons in 2 - 10 A GeV Au+Au and Pb (158
A GeV) Pb collisions. For the Au+Au excitation function a transition from the
squeeze-out to an in-plane enhanced emission is consistently described with
mean field potentials corresponding to one incompressibility. For the Pb (158 A
GeV) Pb system the elliptic flow prefers in-plane emission both for protons and
pions, the directed flow of protons is opposite to that of the pions, which
exhibit anti-flow. Strong directed transverse flow is present for protons and
Lambdas in Au (6 A GeV) Au collisions as well. Both for the SPS and the AGS
energies the agreement between data and calculations is remarkable.
","[{""version"":""v1"",""created"":""Thu, 25 Mar 1999 21:54:06 GMT""}]","2007-05-23"
"physics/9903038","Robert A. Herrmann","Robert A. Herrmann","The Wondrous Design and Non-random Character of ""Chance"" Events","Plain Tex, 19 pages. For the theory of ultralogics see
  http://www.arXiv.org/abs/math.GM/9903081 and
  http://www.arXiv.org/abs/math.GM/9903082 In this version, theorem 1 is
  extended to include finitary consequence operators",,,,"physics.gen-ph",,"  In this article, it is shown specifically that natural system chance events
as represented by theory predicted (a priori) probabilistic statements used in
such realms as modern particle physics, among others, are only random relative
to the restricted language of the theory that predicts such behavior. It is
shown that all such ""chance"" natural events are related one to another by a
remarkably designed, systematic and wondrous collection of equations that model
how the natural laws and processes specifically yield such natural events. A
second result shows theoretically that all such ""chance"" behavior is caused by
application of well-defined ultralogics. These results show specifically that
the fundamental underlying behavior associated with all natural systems that
comprise our universe is controlled internally by processes that cannot be
differentiated from those that mirror the behavior of an infinitely powerful
mind.
","[{""version"":""v1"",""created"":""Thu, 25 Mar 1999 19:11:49 GMT""},{""version"":""v10"",""created"":""Thu, 13 Mar 2003 12:17:45 GMT""},{""version"":""v2"",""created"":""Wed, 8 Dec 1999 11:49:27 GMT""},{""version"":""v3"",""created"":""Sun, 19 Dec 1999 11:59:02 GMT""},{""version"":""v4"",""created"":""Fri, 2 Jun 2000 16:50:47 GMT""},{""version"":""v5"",""created"":""Thu, 29 Jun 2000 10:18:00 GMT""},{""version"":""v6"",""created"":""Fri, 17 Nov 2000 16:48:25 GMT""},{""version"":""v7"",""created"":""Tue, 12 Dec 2000 16:45:13 GMT""},{""version"":""v8"",""created"":""Tue, 16 Jan 2001 22:46:00 GMT""},{""version"":""v9"",""created"":""Thu, 25 Jan 2001 11:43:47 GMT""}]","2007-05-23"
"physics/9903039","Dr. Thomas Bornath","Th. Bornath and D. Kremp (Rostock University), M. Schlanges
  (Greifswald University)","The two-particle problem in a many-particle system: I. Dynamically
  screened ladder approximation","24 pages, 5 figures",,,,"physics.plasm-ph",,"  The two-particle problem within a nonequilibrium many-particle system is
investigated in the framework of real-time Green's functions. Starting from the
dynamically screened ladder approximation of the nonequlibrium Bethe-Salpeter
equation, a nonequilibrium Dyson equation is given for two-time two-particle
Green's functions. Thereby the well-known Kadanoff-Baym equations are
generalized to the case of two-particle functions. The two-time structure of
the equations is achieved in an exact way avoiding the so-called Shindo
approximation. For the case of thermodynamic equilibrium, the differences to
former results obtained for the effective two-particle hamiltonian are
discussed.
","[{""version"":""v1"",""created"":""Thu, 25 Mar 1999 17:11:22 GMT""}]","2007-05-23"
"physics/9903040","Tom Ostoma","Tom Ostoma, Mike Trushyk","The Problem of the Cosmological Constant","20 pages, no figures, the original Document is in MS Word format,
  Comments welcome, E-Mail: emqg@rogerswave.ca",,,,"physics.gen-ph",,"  ElectroMagnetic Quantum Gravity (EMQG) is applied to the problem of the
Cosmological Constant. EMQG is a quantum gravity theory (ref. 1) in which the
virtual particles of the quantum vacuum play a very important role in all
gravitational interactions, and also in accelerated motion. According to EMQG
theory (and quantum field theory in general), empty space is populated by vast
numbers of virtual particles, consisting of virtual fermion and virtual
anti-fermion particles, which posses mass, and also virtual boson particles of
all the various force particle species. Therefore the problem of the
cosmological constant is essentially equivalent to a determination of the mass
contributed by all the virtual particles of the vacuum to the overall curvature
and dynamics of the entire universe. Our original analysis was based on the
assumption of perfect symmetry in the creation and destruction of virtual
fermion and virtual anti-fermion particle pairs in the quantum vacuum, which is
in accordance with the existing laws of conservation of both electric charge,
and also of the new law of conservation of gravitational 'mass charge'. We now
believe that this may not be necessarily true, and that EMQG can allow the
possibility of a very tiny value for the cosmological constant. Furthermore, it
turns out that this question can only be resolved when a solution to the
problem of baryon asymmetry in the universe is resolved. In other words an
answer must be found as to why our universe seems to contain only real matter,
and very little, if any anti-matter.
","[{""version"":""v1"",""created"":""Thu, 25 Mar 1999 20:36:51 GMT""}]","2007-05-23"
"physics/9903041","George Bertsch","K. Yabana and G.F. Bertsch","Optical response of small silver clusters","13 pages RevTex and 9 Postscript figures","Phys. Rev. A, 60 (1999) 3809","10.1103/PhysRevA.60.3809",,"physics.atm-clus",,"  The time-dependent local density approximation is applied to the optical
response of the silver clusters, Ag_2, Ag_3, Ag_8 and Ag_9^+. The calculation
includes all the electrons beyond the closed-shell Ag^{+11} ionic core, thus
including for the first time explicitly the filled d-shell in the response. The
excitation energy of the strong surface plasmon near 4 eV agrees well with
experiment. The theoretical transition strength is quenched by a factor of 4
with respect to the pure s-electron sum rule in Ag_8 due to the d-electrons. A
comparable amount of strength lies in complex states below 6 eV excitation. The
total below 6 eV, about 50% of the s sum rule, is consistent with published
experiments.
","[{""version"":""v1"",""created"":""Thu, 25 Mar 1999 23:09:24 GMT""}]","2009-10-31"
"physics/9903042","Alex Moroz","Alexander Moroz and Adriaan Tip (FOM AMOLF, Amsterdam)","Resonance-Induced Effects in Photonic Crystals","14 pages, 3 figs., RevTex. For more info look at
  http://www.amolf.nl/external/wwwlab/atoms/theory/index.html","J. Phys.: Condens. Matter 11, 2503 - 2512 (1999)","10.1088/0953-8984/11/12/005",,"physics.class-ph cond-mat physics.optics",,"  For the case of a simple face-centered-cubic photonic crystal of homogeneous
dielectric spheres, we examine to what extent single-sphere Mie resonance
frequencies are related to band gaps and whether the width of a gap can be
enlarged due to nearby resonances. Contrary to some suggestions, no spectacular
effects may be expected. When the dielectric constant of the spheres
$\epsilon_s$ is greater than the dielectric constant $\epsilon_b$ of the
background medium, then for any filling fraction $f$ there exists a critical
$\epsilon_c$ above which the lowest lying Mie resonance frequency falls inside
the lowest stop gap in the (111) crystal direction, close to its midgap
frequency. If $\epsilon_s <\epsilon_b$, the correspondence between Mie
resonances and both the (111) stop gap and a full gap does not follow such a
regular pattern. If the Mie resonance frequency is close to a gap edge, one can
observe a resonance-induced widening of a relative gap width by $\approx 5%$.
","[{""version"":""v1"",""created"":""Fri, 26 Mar 1999 11:07:39 GMT""}]","2009-10-31"
"quant-ph/9903083","A. K. Rajagopal","A. K. Rajagopal","Quantum Entanglement and the Maximum Entropy States from the Jaynes
  Principle","5 pages","Phys.Rev.A60:4338,1999","10.1103/PhysRevA.60.4338",,"quant-ph cond-mat.stat-mech",,"  We show that the Jaynes principle is indeed a proper inference scheme when
applied to compound systems and will correctly produce the entangled maximum
entropy states compatible with appropriate data. This is accomplished by
including the dispersion of the entanglement along with its mean value as
constraints and an application of the uncertainty principle. We also construct
a ""thermodynamic-like"" description of the entanglement arising out of the
maximum entropy principle.
","[{""version"":""v1"",""created"":""Fri, 26 Mar 1999 14:14:19 GMT""}]","2008-12-18"
