"astro-ph/9903410","Dr Paul A. Crowther","Paul A. Crowther and Linda J. Smith (UCL)","NaSt1: A Wolf-Rayet star cloaked by an eta Car--like nebula?","16 pages, 12 figures, accepted for MNRAS, uses mn.sty",,"10.1046/j.1365-8711.1999.02707.x",,"astro-ph",,"  We present a study of the peculiar Galactic emission line object NaSt1
(WR122, IRAS 18497+0056) which has previously been classified as a Wolf-Rayet
(WR) star. Our spectroscopic dataset comprises Keck I-HIRES, WHT-ISIS and
UKIRT-CGS4 observations which show that NaSt1 has a highly reddened nebular
spectrum with extremely strong permitted and forbidden lines covering a wide
range in excitation. [OII-III] is unusually weak, with HeI-II and [NII] very
strong, and carbon absent, suggestive of chemical peculiarities. Narrow-band
WHT imaging reveals an elliptical nebula with an average diameter of 6.8arcsec.
We measure an interstellar extinction of E(B-V)=2.1mag and estimate a distance
of 1-3kpc, suggesting that NaSt1 is a luminous object, with 4<log(L/Lo)<6.5. We
determine the physical parameters and abundances from the nebular forbidden
lines. For Te=13,000K and Ne=3x10^6 cm^3, we obtain He/H>0.64, N enhanced by a
factor of 20, O deficient by a factor of 140, while Ne, Ar and S are normal
compared to average HII region abundances. This unusual abundance pattern
suggests that the nebula consists of fully CNO-processed material. We compare
the spectral appearance of NaSt1 with other luminous emission objects, and
conclude that it is not an Ofpe/WN9, B[e] star or symbiotic nova although it
does share several characteristics of these systems. We suggest instead that
NaSt1 contains a massive evolved star that ejected its heavily CNO-processed
outer layers a few thousand years ago. Although the stellar remnant is
completely hidden from view by the dense nebula, we argue that the star must be
an early-type WR star. The only object that shares some of the peculiarities of
NaSt1 is eta Carinae. Whatever its true nature, NaSt1 should no longer be
considered as a late-WN classification standard in the near-IR.
","[{""version"":""v1"",""created"":""Fri, 26 Mar 1999 13:15:15 GMT""}]","2009-10-31"
"chao-dyn/9903033","Shiyi Chen","S. Chen, C. Foias, D.D. Holm, E. Olson, E.S. Titi and S. Wynne","A connection between the Camassa-Holm equations and turbulent flows in
  channels and pipes","tex file, 29 pages, 4 figures, Physics of Fluids (in press)",,"10.1063/1.870096",,"chao-dyn nlin.CD",,"  In this paper we discuss recent progress in using the Camassa-Holm equations
to model turbulent flows. The Camassa-Holm equations, given their special
geometric and physical properties, appear particularly well suited for studying
turbulent flows. We identify the steady solution of the Camassa-Holm equation
with the mean flow of the Reynolds equation and compare the results with
empirical data for turbulent flows in channels and pipes. The data suggests
that the constant $\alpha$ version of the Camassa-Holm equations, derived under
the assumptions that the fluctuation statistics are isotropic and homogeneous,
holds to order $\alpha$ distance from the boundaries. Near a boundary, these
assumptions are no longer valid and the length scale $\alpha$ is seen to depend
on the distance to the nearest wall. Thus, a turbulent flow is divided into two
regions: the constant $\alpha$ region away from boundaries, and the near wall
region. In the near wall region, Reynolds number scaling conditions imply that
$\alpha$ decreases as Reynolds number increases. Away from boundaries, these
scaling conditions imply $\alpha$ is independent of Reynolds number. Given the
agreement with empirical and numerical data, our current work indicates that
the Camassa-Holm equations provide a promising theoretical framework from which
to understand some turbulent flows.
","[{""version"":""v1"",""created"":""Thu, 25 Mar 1999 17:44:19 GMT""}]","2009-10-31"
"chao-dyn/9903034","Darryl D. holm","Darryl D. Holm","Fluctuation effects on 3D Lagrangian mean and Eulerian mean fluid motion","71 pages, no figures, LATeX file, Physica D (in press)",,"10.1016/S0167-2789(99)00093-7",,"chao-dyn nlin.CD",,"  We formulate equations for the slow time dynamics of fluid motion that self
consistently account for the effects of the variability upon the mean. The
time-average effects of the fluctuations introduce nonlinear dispersion that
acts to spatially smooth the transport velocity of the mean flow relative to
its circulation or momentum velocity, by the inversion of a Helmholtz operator
whose length scale corresponds to the covariance of the fluctuations.
","[{""version"":""v1"",""created"":""Thu, 25 Mar 1999 19:52:28 GMT""}]","2009-10-31"
"chao-dyn/9903035","Darryl D. holm","Darryl D. Holm (1), Jerrold E. Marsden (2), Tudor S. Ratiu (3) ((1)
  Los Alamos, (2) Caltech, (3) EPFL Laussanne)","The Euler-Poincare Equations in Geophysical Fluid Dynamics","42 pages, no figures, Isaac Newton Institute Proceedings (to appear)",,,,"chao-dyn nlin.CD",,"  Recent theoretical work has developed the Hamilton's-principle analog of
Lie-Poisson Hamiltonian systems defined on semidirect products. The main
theoretical results are twofold:
  (1) Euler-Poincar\'e equations (the Lagrangian analog of Lie-Poisson
Hamiltonian equations) are derived for a parameter dependent Lagrangian from a
general variational principle of Lagrange d'Alembert type in which variations
are constrained;
  (2) an abstract Kelvin-Noether theorem is derived for such systems.
  By imposing suitable constraints on the variations and by using invariance
properties of the Lagrangian, as one does for the Euler equations for the rigid
body and ideal fluids, we cast several standard Eulerian models of geophysical
fluid dynamics (GFD) at various levels of approximation into Euler-Poincar\'{e}
form and discuss their corresponding Kelvin-Noether theorems and potential
vorticity conservation laws.
","[{""version"":""v1"",""created"":""Thu, 25 Mar 1999 21:45:23 GMT""}]","2007-05-23"
"chao-dyn/9903036","Darryl D. holm","Darryl D. Holm (1), Shinar Kouranbaeva (2), Jerrold E. Marsden (3),
  Tudor Ratiu (4) and Steve Shkoller (1) ((1) Los Alamos, (2) UC Santa Cruz,
  (3) Caltech, (4) EPFL Lausanne)","A Nonlinear Analysis of the Averaged Euler Equations","25 pages, no figures, Dedicated to Vladimir Arnold on the occasion of
  his 60th birthday, Arnold Festschrift Volume 2 (in press)",,,,"chao-dyn nlin.CD",,"  This paper develops the geometry and analysis of the averaged Euler equations
for ideal incompressible flow in domains in Euclidean space and on Riemannian
manifolds, possibly with boundary. The averaged Euler equations involve a
parameter $\alpha$; one interpretation is that they are obtained by ensemble
averaging the Euler equations in Lagrangian representation over rapid
fluctuations whose amplitudes are of order $\alpha$. The particle flows
associated with these equations are shown to be geodesics on a suitable group
of volume preserving diffeomorphisms, just as with the Euler equations
themselves (according to Arnold's theorem), but with respect to a right
invariant $H^1$ metric instead of the $L^2$ metric. The equations are also
equivalent to those for a certain second grade fluid. Additional properties of
the Euler equations, such as smoothness of the geodesic spray (the Ebin-Marsden
theorem) are also shown to hold. Using this nonlinear analysis framework, the
limit of zero viscosity for the corresponding viscous equations is shown to be
a regular limit, {\it even in the presence of boundaries}.
","[{""version"":""v1"",""created"":""Thu, 25 Mar 1999 22:01:43 GMT""}]","2007-05-23"
"chao-dyn/9904001",,"G. Cicogna and M. Santoprete","Nonhyperbolic homoclinic chaos","PlainTeX",,"10.1016/S0375-9601(99)00203-0",,"chao-dyn nlin.CD",,"  Homoclinic chaos is usually examined with the hypothesis of hyperbolicity of
the critical point. We consider here, following a (suitably adjusted) classical
analytic method, the case of non-hyperbolic points and show that, under a
Melnikov-type condition plus an additional assumption, the negatively and
positively asymptotic sets persist under periodic perturbations, together with
their infinitely many intersections on the Poincar\'e section. We also examine,
by means of essentially the same procedure, the case of (heteroclinic) orbits
tending to the infinity; this case includes in particular the classical
Sitnikov 3--body problem.
","[{""version"":""v1"",""created"":""Fri, 26 Mar 1999 08:43:37 GMT""}]","2009-10-31"
"cond-mat/9903381","Stefano Sanvito","S. Sanvito, C.J. Lambert, J.H. Jefferson","Crossover between ballistic and diffusive regime of the spin-conductance
  and CPP-GMR in magnetic multilayered nanostructures","16 pages, 10 figures",,"10.1103/PhysRevB.60.7385",,"cond-mat.mes-hall cond-mat.mtrl-sci",,"  We analyze the interplay between disorder and band structure in current
perpendicular to the planes (CPP) giant magnetoresistance (GMR). We consider
finite magnetic multilayers attached to pure crystalline leads, described by a
tight-binding simple cubic two-band model (s-d). Several models of disorder are
considered, including random on-site potentials, lattice distortions,
impurities, vacancies, and cross-section fluctuations. Magneto-transport
properties are calculated in the zero-temperature zero-bias limit, within the
Landauer-Buttiker formalism. Using a very efficient numerical scattering
technique, we are able to perform simulations, over large length scales, and to
investigate spin-transport in the ballistic, diffusive and localized regimes,
as well as the crossover between them. The competition between disorder-induced
mean free path reduction and disorder-induced spin asymmetry enhancement of the
conductance highlights several different regimes of GMR.
","[{""version"":""v1"",""created"":""Thu, 25 Mar 1999 16:07:47 GMT""}]","2009-10-31"
"cond-mat/9903382","Inon Cohen","Eshel Ben-Jacob, Inon Cohen, Ido Golding and Yonathan Kozlovsky","Modeling branching and chiral colonial patterning of lubricating
  bacteria","50 pages, 24 images in 44 GIF/JPEG files, Proceedings of IMA
  workshop: Pattern Formation and Morphogenesis (1998)",,,"icohen-99-1","cond-mat physics.bio-ph q-bio.CB q-bio.QM",,"  In nature, microorganisms must often cope with hostile environmental
conditions. To do so they have developed sophisticated cooperative behavior and
intricate communication capabilities, such as: direct cell-cell physical
interactions via extra-membrane polymers, collective production of
extracellular ""wetting"" fluid for movement on hard surfaces, long range
chemical signaling such as quorum sensing and chemotactic (bias of movement
according to gradient of chemical agent) signaling, collective activation and
deactivation of genes and even exchange of genetic material. Utilizing these
capabilities, the colonies develop complex spatio-temporal patterns in response
to adverse growth conditions. We present a wealth of branching and chiral
patterns formed during colonial development of lubricating bacteria (bacteria
which produce a wetting layer of fluid for their movement). Invoking ideas from
pattern formation in non-living systems and using ``generic'' modeling we are
able to reveal novel survival strategies which account for the salient features
of the evolved patterns. Using the models, we demonstrate how communication
leads to self-organization via cooperative behavior of the cells. In this
regard, pattern formation in microorganisms can be viewed as the result of the
exchange of information between the micro-level (the individual cells) and the
macro-level (the colony). We mainly review known results, but include a new
model of chiral growth, which enables us to study the effect of chemotactic
signaling on the chiral growth. We also introduce a measure for weak chirality
and use this measure to compare the results of model simulations with
experimental observations.
","[{""version"":""v1"",""created"":""Thu, 25 Mar 1999 17:01:45 GMT""}]","2007-05-23"
"cond-mat/9903383","Richard T. Giles","Richard T Giles and Feodor V Kusmartsev","Critical fields and devil's staircase in superconducting ladders","4 pages (Revtex), 3 postscript figures",,"10.1016/S0921-4526(99)02869-0",,"cond-mat.supr-con",,"  We have determined the ground state for both a ladder array of Josephson
junctions and a ladder of thin superconducting wires. We find that the
repulsive interaction between vortices falls off exponentially with separation.
The fact that the interaction is short-range leads to novel phenomena. The
ground state vortex density exhibits a complete devil's staircase as the
applied magnetic field is increased, each step producing a pair of
metal-insulator transitions. The critical fields in the staircase are all
calculated analytically and depend only on the connectivity of the ladder and
the area of the elementary plaquette. In particular the normal square ladder
contains no vortices at all until the flux per plaquette reaches 0.5/sqrt{3}
flux quanta.
","[{""version"":""v1"",""created"":""Thu, 25 Mar 1999 18:12:41 GMT""}]","2009-10-31"
"cond-mat/9903384","Pedro Orellana D.","E. S. Rodrigues (UFF), E. V. Anda (PUC-Rio), P.Orellana(UCN)","Non Linear Effects in Resonant Tunneling Throught a Quantum Dot","To appear in Sol. Stat. Comm",,,,"cond-mat.mes-hall",,"  We study non-linear phenomena in quantum dots. Non linearities are reflected
in the I-V characteristic curve as bistabilities, instabilities and time
dependent oscillations of the currents. The nature of the non-linear behavior
depends upon the parameters that define the system.
","[{""version"":""v1"",""created"":""Thu, 25 Mar 1999 19:51:12 GMT""}]","2007-05-23"
"cond-mat/9903385","Paul Zinn-Justin","P. Zinn-Justin","The dilute Potts model on random surfaces","18 pages, 5 EPS figures, lanlmac","J.Statist.Phys. 98 (2001) 245-264",,"RU-99-13","cond-mat.stat-mech",,"  We present a new solution of the asymmetric two-matrix model in the large $N$
limit which only involves a saddle point analysis. The model can be interpreted
as Ising in the presence of a magnetic field, on random dynamical lattices with
the topology of the sphere (resp. the disk) for closed (resp. open) surfaces;
we elaborate on the resulting phase diagram. The method can be equally well
applied to a more general $(Q+1)$-matrix model which represents the dilute
Potts model on random dynamical lattices. We discuss in particular duality of
boundary conditions for open random surfaces.
","[{""version"":""v1"",""created"":""Thu, 25 Mar 1999 21:12:57 GMT""},{""version"":""v2"",""created"":""Tue, 27 Apr 1999 20:05:54 GMT""}]","2007-05-23"
"cond-mat/9903386","Boris Spivak","B.Spivak and A.Zyuzin","Mesoscopic sensitivity of speckles in disordered nonlinear media to
  changes of disordered potential","2 eps figures included",,"10.1103/PhysRevLett.84.1970",,"cond-mat.mes-hall",,"  We show that the sensitivity of wave speckle patterns in disordered nonlinear
media to changes of scattering potential increases with sample size. For large
enough sample size this quantity diverges, which implies that at given coherent
wave incident on a sample there are multiple solutions for the spatial
distribution of the wave's density. The number of solutions increases
exponentially with the sample size.
","[{""version"":""v1"",""created"":""Fri, 26 Mar 1999 02:36:51 GMT""}]","2009-10-31"
"cond-mat/9903387","Atsushi Kaneko","Atsushi Kaneko and Tomi Ohtsuki","Three-Dimensional Quantum Percolation Studied by Level Statistics","to appear in the May issue of J. Phys. Soc. Jpn",,"10.1143/JPSJ.68.1488",,"cond-mat.dis-nn",,"  Three-dimensional quantum percolation problems are studied by analyzing
energy level statistics of electrons on maximally connected percolating
clusters. The quantum percolation threshold $\pq$, which is larger than the
classical percolation threshold $\pc$, becomes smaller when magnetic fields are
applied, i.e., $\pq(B=0)>\pq(B\ne 0)>\pc$. The critical exponents are found to
be consistent with the recently obtained values of the Anderson model,
supporting the conjecture that the quantum percolation is classified onto the
same universality classes of the Anderson transition. Novel critical level
statistics at the percolation threshold is also reported.
","[{""version"":""v1"",""created"":""Fri, 26 Mar 1999 05:24:32 GMT""}]","2009-10-31"
"cond-mat/9903388","Dragi Karevski","Dragi Karevski, R\'obert Juh\'asz, Lo\""ic Turban and Ferenc Igl\'oi","Transverse-field Ising spin chain with inhomogeneous disorder","11 pages (Revtex), 11 figures","Phys. Rev. B, 60 (1999) 4195","10.1103/PhysRevB.60.4195",,"cond-mat.stat-mech",,"  We consider the critical and off-critical properties at the boundary of the
random transverse-field Ising spin chain when the distribution of the couplings
and/or transverse fields, at a distance $l$ from the surface, deviates from its
uniform bulk value by terms of order $l^{-\kappa}$ with an amplitude $A$. Exact
results are obtained using a correspondence between the surface magnetization
of the model and the surviving probability of a random walk with time-dependent
absorbing boundary conditions. For slow enough decay, $\kappa<1/2$, the
inhomogeneity is relevant: Either the surface stays ordered at the bulk
critical point or the average surface magnetization displays an essential
singularity, depending on the sign of $A$. In the marginal situation,
$\kappa=1/2$, the average surface magnetization decays as a power law with a
continuously varying, $A$-dependent, critical exponent which is obtained
analytically. The behavior of the critical and off-critical autocorrelation
functions as well as the scaling form of the probability distributions for the
surface magnetization and the first gaps are determined through a
phenomenological scaling theory. In the Griffiths phase, the properties of the
Griffiths-McCoy singularities are not affected by the inhomogeneity. The
various results are checked using numerical methods based on a mapping to free
fermions.
","[{""version"":""v1"",""created"":""Fri, 26 Mar 1999 10:15:35 GMT""}]","2016-08-15"
"cond-mat/9903390","Fumiko Takagi","Fumiko Takagi, Tsuyoshi Hondou","Thermal Noise Can Facilitate Energy Conversion by Ratchet System?","10 pages, 8 figures, References and acknowledgment are updated",,"10.1103/PhysRevE.60.4954",,"cond-mat.stat-mech q-bio",,"  Molecular motors in biological systems are expected to use ambient
fluctuation. In a recent Letter [Phys. Rev. Lett. {\bf 80}, 5251 (1998)], it
was showed that the following question was unsolved, ``Can thermal noise
facilitate energy conversion by ratchet system?'' We consider it using
stochastic energetics, and show that there exist systems where thermal noise
helps the energy conversion.
","[{""version"":""v1"",""created"":""Fri, 26 Mar 1999 11:05:27 GMT""},{""version"":""v2"",""created"":""Fri, 25 Jun 1999 09:41:28 GMT""}]","2009-10-31"
"cond-mat/9903391","Koji Hukushima","Koji Hukushima","Domain-Wall Free-Energy of Spin Glass Models:Numerical Method and
  Boundary Conditions","9 pages Latex(Revtex), 8 eps figures",,"10.1103/PhysRevE.60.3606",,"cond-mat.dis-nn",,"  An efficient Monte Carlo method is extended to evaluate directly domain-wall
free-energy for randomly frustrated spin systems. Using the method, critical
phenomena of spin-glass phase transition is investigated in 4d +/-J Ising model
under the replica boundary condition. Our values of the critical temperature
and exponent, obtained by finite-size scaling, are in good agreement with those
of the standard MC and the series expansion studies. In addition, two
exponents, the stiffness exponent and the fractal dimension of the domain wall,
which characterize the ordered phase, are obtained. The latter value is larger
than d-1, indicating that the domain wall is really rough in the 4d Ising spin
glass phase.
","[{""version"":""v1"",""created"":""Fri, 26 Mar 1999 13:36:26 GMT""}]","2009-10-31"
"cond-mat/9903392","Barak Galanti","Barak Galanti and Zeev Olami (Department of Chemical Physics, The
  Weizmann Institute of Science, Rehovot, Israel)","Extended and localized phonons, free electrons, and diffusive states in
  disordered lattice models","4 pages, 4 figures, Corrected typos, Changed content",,,,"cond-mat.dis-nn",,"  In this paper we propose that phonons, free diffusive electrons, and
diffusion in two-and three--dimensional disordered lattice problems belong to a
different class of localization than bonded electrons. This is manifested by
three effects that can be observed numerically. First, there are extended
states even at two dimensions, whereas there are no extended states in the
usual electronic models. Second, the correlation length does not diverge at the
mobility edges in three dimensions, and finally, the participation ratio of the
extended states, decays to zero at this edge. This indicates zero electronic
conductivity, in the extended region near the mobility edge. We show that low
energy modes for these models can either have diverging localization lengths or
are extended.
","[{""version"":""v1"",""created"":""Fri, 26 Mar 1999 13:54:33 GMT""},{""version"":""v2"",""created"":""Sun, 20 Jun 1999 09:24:17 GMT""}]","2007-05-23"
"cond-mat/9903393","Sergei Sergeenkov","Sergei A. Sergeenkov (ETH-Zurich and JINR-Dubna)","Piezomagnetism and Stress Induced Paramagnetic Meissner Effect in
  Mechanically Loaded High-T_c Granular Superconductors","4 pages (REVTEX, epsf.sty), 2 PS figures","JETP Lett. 70, 36 (1999)","10.1134/1.568126",,"cond-mat.supr-con cond-mat.mtrl-sci",,"  Two novel phenomena in a weakly coupled granular superconductor under an
applied stress are predicted which are based on recently suggested piezophase
effect (a macroscopic quantum analog of the piezoelectric effect) in
mechanically loaded grain boundary Josephson junctions. Namely, we consider the
existence of stress induced paramagnetic moment in zero applied magnetic field
(piezomagnetism) and its influence on a low-field magnetization (leading to a
mechanically induced paramagnetic Meissner effect). The conditions under which
these two effects can be experimentally measured in high-T_$ granular
superconductors are discussed.
","[{""version"":""v1"",""created"":""Fri, 26 Mar 1999 14:34:59 GMT""}]","2009-10-31"
"cond-mat/9903394","Paolo De Los Rios","Paolo De Los Rios, Guido Caldarelli","Cold and Warm Denaturation of Hydrophobic Polymers","LateX, 4 .eps figures",,,,"cond-mat.stat-mech cond-mat.soft q-bio",,"  We introduce a polymer model where the transition from swollen to compact
configurations is due to interactions between the monomers and the solvent.
These interactions are the origin of the effective attractive interactions
between hydrophobic amminoacids in proteins. We find that in the low and high
temperature phases polymers are swollen, and there is an intermediate phase
where the most favorable configurations are compact. We argue that such a model
captures in a single framework both the cold and the warm denaturation
experimentally detected for proteins. Some consequences for protein folding are
discussed.
","[{""version"":""v1"",""created"":""Fri, 26 Mar 1999 14:48:22 GMT""},{""version"":""v2"",""created"":""Fri, 3 Dec 1999 10:15:43 GMT""},{""version"":""v3"",""created"":""Sat, 18 Dec 1999 15:53:50 GMT""}]","2007-05-23"
"gr-qc/9903092","Diego A. R. Dalvit","Diego A. R. Dalvit and Francisco D. Mazzitelli","Quantum corrections to the geodesic equation","Revtex file, 6 pages, no figures. Talk presented at the meeting
  ""Trends in Theoretical Physics II"", Buenos Aires, Argentina, December 1998",,"10.1063/1.59666",,"gr-qc",,"  In this talk we will argue that, when gravitons are taken into account, the
solution to the semiclassical Einstein equations (SEE) is not physical. The
reason is simple: any classical device used to measure the spacetime geometry
will also feel the graviton fluctuations. As the coupling between the classical
device and the metric is non linear, the device will not measure the
`background geometry' (i.e. the geometry that solves the SEE). As a particular
example we will show that a classical particle does not follow a geodesic of
the background metric. Instead its motion is determined by a quantum corrected
geodesic equation that takes into account its coupling to the gravitons. This
analysis will also lead us to find a solution to the so-called gauge fixing
problem: the quantum corrected geodesic equation is explicitly independent of
any gauge fixing parameter.
","[{""version"":""v1"",""created"":""Thu, 25 Mar 1999 18:52:46 GMT""}]","2009-10-31"
