"hep-th/9911040","Jacques Distler","Jacques Distler and Frederic Zamora","Chiral Symmetry Breaking in the AdS/CFT Correspondence","21 pages, 1 figure. LaTeX2e, using utarticle.cls (included). Several
  clarifications and added references. This is the published version, to appear
  in JHEP","JHEP 0005:005,2000","10.1088/1126-6708/2000/05/005","UTTG--07--99","hep-th",,"  We study the SU(3)-invariant relevant deformation of D=4 N=4 SU(N) gauge
theory at large N using the AdS/CFT correspondence. At low energies, we obtain
a nonsupersymmetric gauge theory with three left-handed quarks in the adjoint
of SU(N). In terms of the five dimensional gauged supergravity, there is an
unstable critical point in the scalar potential for fluctuations of some fields
in a nontrivial representation of the symmetry group SU(3). On the field theory
side, this corresponds to dynamical breaking of the SU(3) chiral symmetry down
to SO(3). We compute the condensate of the quark bilinear and the two-point
correlation function of the spontaneously broken currents from supergravity and
find a nonzero `pion' decay constant, f_pi.
","[{""version"":""v1"",""created"":""Fri, 5 Nov 1999 22:44:44 GMT""},{""version"":""v2"",""created"":""Fri, 5 May 2000 16:12:33 GMT""}]","2014-11-18"
"hep-th/9911041","Yuri Makeenko","J. Ambjorn, Y.M. Makeenko, J. Nishimura, R.J. Szabo (NBI)","Finite N Matrix Models of Noncommutative Gauge Theory","17 pp, Latex2e; Typos corrected, references added","JHEP 9911 (1999) 029","10.1088/1126-6708/1999/11/029","NBI-HE-99-44, ITEP-TH-58/99","hep-th hep-lat",,"  We describe a unitary matrix model which is constructed from discrete analogs
of the usual projective modules over the noncommutative torus and use it to
construct a lattice version of noncommutative gauge theory. The model is a
discretization of the noncommutative gauge theories that arise from toroidal
compactification of Matrix theory and it includes a recent proposal for a
non-perturbative definition of noncommutative Yang-Mills theory in terms of
twisted reduced models. The model is interpreted as a manifestly star-gauge
invariant lattice formulation of noncommutative gauge theory, which reduces to
ordinary Wilson lattice gauge theory for particular choices of parameters. It
possesses a continuum limit which maintains both finite spacetime volume and
finite noncommutativity scale. We show how the matrix model may be used for
studying the properties of noncommutative gauge theory.
","[{""version"":""v1"",""created"":""Fri, 5 Nov 1999 22:41:50 GMT""},{""version"":""v2"",""created"":""Sun, 7 Nov 1999 22:18:15 GMT""},{""version"":""v3"",""created"":""Tue, 16 Nov 1999 09:48:50 GMT""}]","2009-10-31"
"hep-th/9911042","Dimitrios Tsimpis","Ruben Minasian and Dimitrios Tsimpis","On the geometry of non-trivially embedded branes","18 pages, harvmac. Eq. 4.35 and errors propagating from it corrected","Nucl.Phys. B572 (2000) 499-513","10.1016/S0550-3213(00)00035-3","YCTP-P31-99","hep-th",,"  We present a formal supersymmetric solution of type IIB supergravity
generalizing previously known solutions corresponding to D3 branes to
geometries without an orthogonal split between parallel and transverse
directions. The metric is given implicitly as one with respect to which a
certain connection is compatible. The case of the deformed conifold is
discussed in detail.
","[{""version"":""v1"",""created"":""Fri, 5 Nov 1999 23:18:15 GMT""},{""version"":""v2"",""created"":""Wed, 2 Aug 2000 16:28:45 GMT""},{""version"":""v3"",""created"":""Sun, 20 Aug 2000 21:46:37 GMT""}]","2009-10-31"
"hep-th/9911043","Gary T. Horowitz","Roberto Emparan, Gary T. Horowitz and Robert C. Myers","Exact Description of Black Holes on Branes","25 pages; few references added and typos corrected","JHEP 0001 (2000) 007","10.1088/1126-6708/2000/01/007",,"hep-th gr-qc",,"  To test recent ideas about lower dimensional gravity bound to a brane, we
construct exact solutions describing black holes on two-branes in four
dimensions. We find that 2+1 gravity is indeed recovered at large distances
along the brane, although there are significant deviations at smaller scales.
Large black holes appear as flattened ""pancakes"", with a relatively small
extent off the brane. Black hole thermodynamics is discussed from both the
standpoint of the brane and the bulk. We comment on the analogous black holes
bound to higher dimensional branes.
","[{""version"":""v1"",""created"":""Sat, 6 Nov 1999 00:56:32 GMT""},{""version"":""v2"",""created"":""Mon, 22 Nov 1999 22:04:36 GMT""}]","2009-10-31"
"hep-th/9911044",,"N. Mebarki, A.Maireche","Quantum Nonsymmetric Gravity and The Superfiber Bundle Formalism","WITHDRAWN by arXiv administration","Bulg.J.Phys.28:1-14,2001",,,"hep-th",,"  Withdrawn by arXiv administration because authors have forged affiliations
and acknowledgements, and have not adequately responded to charges
[hep-th/9912039] of unattributed use of verbatim material.
","[{""version"":""v1"",""created"":""Sat, 6 Nov 1999 15:53:52 GMT""},{""version"":""v2"",""created"":""Sun, 12 Dec 1999 18:56:33 GMT""}]","2010-02-01"
"math/9911031","Yi Ouyang","Yi Ouyang","Spectral sequences of universal distribution and Sinnott's index formula","23 pages",,,,"math.NT",,"  We prove an abstract index formula about Sinnott's symbol between two
different lattices. We also develop the theory of the universal distribution
and predistribution in a double complex point of view. The theory of spectral
sequence is used to interpret the index formula and to analyze the cohomology
of the universal distribution. Combing these results, we successfully prove
Sinnott's index formula about the Stickelberger ideal. In addition, the {1,
-1}-cohomology groups of the universal distribution and the universal
predistribution are obtained.
","[{""version"":""v1"",""created"":""Fri, 5 Nov 1999 22:58:23 GMT""}]","2007-05-23"
"math/9911032","Yi Ouyang","Yi Ouyang","Group cohomology of universal ordinary distribution","30 pages, 1 figure, 1 appendix by Prof. Greg Anderson","J. reine. angew. Math. 537(2001), 1-32",,,"math.NT math.AT",,"  For any odd squarefree integer r, we get complete description of the
G_r=Gal(Q(mu_r)/Q) group cohomology of the universal ordinary distribution U_r
in this paper. Moreover, if M is a fixed integer which divides l-1 for all
prime factors l of r, we study the cohomology group H^{*}(G_r, U_r/MU_r). In
particular, we explain the mysterious construction of the elements kappa_{r'}
for r'|r in Rubin's construction of Kolyvagin elements, which come exactly from
a certain Z/M Z-basis of the cohomology group H^{0}(G_r, U_r/MU_r) through an
evaluation map.
","[{""version"":""v1"",""created"":""Fri, 5 Nov 1999 22:46:19 GMT""}]","2007-05-23"
"math/9911035","Xiaonan Ma","Kefeng LIU and Xiaonan MA","On Family Rigidity Theorems II","20 pages",,,,"math.DG",,"  In LM, we proved a family version of the famous Witten rigidity theorems and
several family vanishing theorems for elliptic genera. In this paper, we
gerenalize our theorems LM in two directions. First we establish a family
rigidity theorem for the Dirac operator on loop space twisted by general
positive energy loop group representations. Second we prove a family rigidity
theorem for spin^c-manifolds. Several vanishing theorems on both cases are also
obtained.
","[{""version"":""v1"",""created"":""Fri, 5 Nov 1999 17:20:39 GMT""}]","2007-05-23"
"math/9911036","Hector Sanchez-Morgado","R. Iturriaga (CIMAT-Mex), H. Sanchez-Morgado (UNAM-Mex)","A minimax selector for a class of hamiltonians on cotangent bundles","Corrected version. 17 pages",,,,"math.SG math.DS",,"  We construct a minimax selector for eventually quadratic hamiltonians on
cotangent bundles. We use it to give a relation between Hofer's energy and
Mather's action minimizing function. We also study the local flatness of the
set of twist maps.
","[{""version"":""v1"",""created"":""Fri, 5 Nov 1999 17:55:05 GMT""},{""version"":""v2"",""created"":""Thu, 2 Dec 1999 21:05:49 GMT""},{""version"":""v3"",""created"":""Mon, 24 Jan 2000 23:05:46 GMT""},{""version"":""v4"",""created"":""Thu, 21 Sep 2000 17:03:26 GMT""}]","2007-05-23"
"math/9911037","Denny H. Leung","Denka Kutzarova and Denny H. Leung","An asymptotic property of Schachermayer's space under renorming",,,,,"math.FA",,"  A Banach space X with closed unit ball B is said to have property 2-beta,
repsectively 2-NUC if for every \ep > 0, there exists \delta > 0 such that for
every \ep-separated sequence (x_n) in the unit ball B, and every x in B, there
are distinct indices m and n such that ||x + x_m + x_n|| < 3(1 - \delta),
respectively, ||x_m + x_n|| < 2(1 - \delta). It is shown that a Banach space
constructed by Schachermayer has property 2-beta but cannot be renormed to have
property 2-NUC.
","[{""version"":""v1"",""created"":""Sat, 6 Nov 1999 05:25:42 GMT""}]","2007-05-23"
"math/9911038","Izu Vaisman","Izu Vaisman","Transversal Twistor Spaces of Foliations","LaTex, 33 pg",,,,"math.DG",,"  The transversal twistor space of a foliation F of an even codimension is the
bundle ZF of the complex structures of the fibers of the transversal bundle of
F. On ZF, there exists a foliation F' by covering spaces of the leaves of F,
and any Bott connection of F produces an ordered pair (I,J) of transversal
almost complex structures of F'. The existence of a Bott connection which
yields a structure I that is projectable to the space of leaves is equivalent
to the fact that F is a transversally projective foliation. A Bott connection
which yields a projectable structure J exists iff F is a transversally
projective foliation which satisfies a supplementary cohomological condition,
and, in this case, I is projectable as well. J is never integrable. The
essential integrability condition of I is the flatness of the transversal
projective structure of F.
","[{""version"":""v1"",""created"":""Sat, 6 Nov 1999 06:52:45 GMT""}]","2007-05-23"
"nucl-th/9911023","C. Hanhart","C. Hanhart","Meson exchange models for Meson production","Invited talk at the 4th International Conference on Physics at
  Storage Rings (STORI99), Bloomington, IN USA, Sept. 12-16, 1999; 15 pages, 6
  figures","AIP Conf.Proc.512:81-95,2000","10.1063/1.1291427","NT@UW-99-60, DOE/ER/40561-78-INT99","nucl-th",,"  The production of mesons in nucleon-nucleon collisions is reviewed from the
viewpoint of the meson-exchange picture. In the first part various possible
production mechanisms and their relative importance are discussed. In addition,
general features of meson production are described.
  In the second part special emphasis is put on pion production. Implications
of chiral perturbation theory are discussed. Results based on a specific
meson-exchange model for pion production in nucleon-nucleon collisions are
presented. The model is utilized to calculate several spin-dependent
observables of the reactions $pp \to pp\pi^0$ and $pp \to pn\pi^+$ such as
spin-correlation parameters. This allows us to study the role of the Delta
resonance at close to threshold energies.
  The talk closes with a brief discussion of the production of $\phi$ mesons as
an example for the production of heavier mesons. A strategy is outlined that
allows to extract information on the structure of the nucleon from the reaction
$NN \to NN \phi$.
","[{""version"":""v1"",""created"":""Fri, 5 Nov 1999 21:58:55 GMT""}]","2010-12-13"
"physics/9911008","Allahyaroff","A.G.Zagorodny, P.P.J.M. Schram, S.A.Trigger","Stationary Velocity and Charge Distributions of Grains in Dusty Plasmas","8 pages, no figures",,"10.1103/PhysRevLett.84.3594",,"physics.plasm-ph physics.space-ph",,"  Within the kinetic approach velocity and charge distributions of grains in
stationary dusty plasmas are calculated and the relations between the effective
temperatures of such distributions and plasma parameters are established. It is
found that the effective temperature which determines the velocity grain
distribution could be anomalously large due to the action of accelerating ionic
bombarding force. The possibility to apply the results obtained to the
explanation of the increasing grain temperature in the course of the
Coulomb-crystal melting by reduction of the gas pressure is discussed. This
paper was received by Phys.Rev.Lett. on 11 August 1999. As potential referees
the authors offered to Editor the following persons: V.N.Tsytovich, Russia;
R.Bingham, UK; D.Resendes, Portugal; G.Morfill, P.Shukla, Y.M.Yu., Germany.
","[{""version"":""v1"",""created"":""Fri, 5 Nov 1999 19:24:38 GMT""}]","2009-10-31"
"quant-ph/9911019","Fumiaki Morikoshi","Fumiaki Morikoshi","Recovery of entanglement lost in entanglement manipulation","4 pages, 2 figures, REVTeX; minor corrections","Phys. Rev. Lett. 84, 3189 (2000)","10.1103/PhysRevLett.84.3189","EPHOU-99-013","quant-ph",,"  When an entangled state is transformed into another one with probability one
by local operations and classical communication, the quantity of entanglement
decreases. This letter shows that entanglement lost in the manipulation can be
partially recovered by an auxiliary entangled pair. As an application, a
maximally entangled pair can be obtained from two partially entangled pairs
with probability one. Finally, this recovery scheme reveals a fundamental
property of entanglement relevant to the existence of incomparable states.
","[{""version"":""v1"",""created"":""Fri, 5 Nov 1999 16:49:04 GMT""},{""version"":""v2"",""created"":""Mon, 27 Mar 2000 06:59:53 GMT""}]","2009-10-31"
"quant-ph/9911020","Chris Isham","J. Hamilton, C.J. Isham and J. Butterfield","A Topos Perspective on the Kochen-Specker Theorem: III. Von Neumann
  Algebras as the Base Category","Latex2e",,,"Imperial/TP/99-0/5","quant-ph",,"  We extend the topos-theoretic treatment given in previous papers of assigning
values to quantities in quantum theory, and of related issues such as the
Kochen-Specker theorem. This extension has two main parts: the use of von
Neumann algebras as a base category (Section 2); and the relation of our
generalized valuations to (i) the assignment to quantities of intervals of real
numbers, and (ii) the idea of a subobject of the coarse-graining presheaf
(Section 3).
","[{""version"":""v1"",""created"":""Fri, 5 Nov 1999 18:06:33 GMT""}]","2007-05-23"
"quant-ph/9911021","David Marcus Appleby","D.M. Appleby","Optimal Measurements of Spin Direction","16 pages, AMS-latex. A few typographical errors corrected","Int. J. Theor. Phys. 39, 2231 (2000)",,"QMW-PH-99-18","quant-ph",,"  The accuracy of a measurement of the spin direction of a spin-s particle is
characterised, for arbitrary half-integral s. The disturbance caused by the
measurement is also characterised. The approach is based on that taken in
several previous papers concerning joint measurements of position and momentum.
As in those papers, a distinction is made between the errors of retrodiction
and prediction. Retrodictive and predictive error relationships are derived.
The POVM describing the outcome of a maximally accurate measurement process is
investigated. It is shown that, if the measurement is retrodictively optimal,
then the distribution of measured values is given by the initial state SU(2)
Q-function. If the measurement is predictively optimal, then the distribution
of measured values is related to the final state SU(2) P-function. The general
form of the unitary evolution operator producing an optimal measurement is
characterised.
","[{""version"":""v1"",""created"":""Fri, 5 Nov 1999 23:01:49 GMT""},{""version"":""v2"",""created"":""Sun, 23 Jan 2000 21:07:45 GMT""}]","2007-05-23"
"quant-ph/9911022","Adan Cabello","Adan Cabello","Kochen-Specker theorem and experimental test on hidden variables","4 pages, 1 figure. To appear in Int. J. Mod. Phys. A","Int. J. Mod. Phys. A 15 (2000) 2813","10.1142/S0217751X00002020",,"quant-ph",,"  A recent proposal to experimentally test quantum mechanics against
noncontextual hidden-variable theories [Phys. Rev. Lett. 80, 1797 (1998)] is
shown to be related with the smallest proof of the Kochen-Specker theorem
currently known [Phys. Lett. A 212, 183 (1996)]. This proof contains eighteen
yes-no questions about a four-dimensional physical system, combined in nine
mutually incompatible tests. When these tests are considered as tests about a
two-part two-state system, then quantum mechanics and non-contextual hidden
variables make the same predictions for eight of them, but make different
predictions for the ninth. Therefore, this ninth test would allow us to
discriminate between quantum mechanics and noncontextual hidden-variable
theories in a (gedanken) single run experiment.
","[{""version"":""v1"",""created"":""Sat, 6 Nov 1999 15:58:09 GMT""}]","2016-12-21"
