"cond-mat/9911087","Studart","O. G. Balev, Nelson Studart, and P. Vasilopoulos","Edge magnetoplasmons in periodically modulated structures","8 pages, 4 figures",,"10.1103/PhysRevB.62.15834",,"cond-mat.str-el",,"  We present a microscopic treatment of edge magnetoplasmons (EMP's) within the
random-phase approximation for strong magnetic fields, low temperatures, and
filling factor $\nu =1(2)$, when a weak short-period superlattice potential is
imposed along the Hall bar. The modulation potential modifies both the spatial
structure and the dispersion relation of the fundamental EMP and leads to the
appearance of a novel gapless mode of the fundamental EMP. For sufficiently
weak modulation strengths the phase velocity of this novel mode is almost the
same as the group velocity of the edge states but it should be quite smaller
for stronger modulation. We discuss in detail the spatial structure of the
charge density of the renormalized and the novel fundamental EMP's.
","[{""version"":""v1"",""created"":""Fri, 5 Nov 1999 20:09:28 GMT""}]","2009-10-31"
"cond-mat/9911088","Studart","Sviatoslav S. Sokolov, Antonio Carlos A. Ramos, and Nelson Studart","Polaron states of electrons over the anisotropic surface of liquid
  helium","11 pages, 5 figures",,,,"cond-mat.str-el",,"  The energetics and transport properties of the polaron in the anisotropic
surface over liquid helium are investigated. The localization radii and the
energy of the ground and excited states are calculated using the variational
method within the hydrodynamic model of the polaron. In particular, we have
considered maximal anisotropy which corresponds to the system of electrons in
quasi-one-dimensional channels over liquid helium. The polaron binding energy
is found and the temperature for the polaron formation is estimated below 0.1
K. Solving the hydrodynamic equations for fluid velocities, the polaron
mobilities along and across the channel are determined. The possibility of
experimental observation of polarons by measuring the frequency of
spectroscopic transitions as well the mobility as functions of the holding
electric field is addressed.
","[{""version"":""v1"",""created"":""Fri, 5 Nov 1999 20:18:57 GMT""}]","2016-08-31"
"cond-mat/9911089","Lauro Tomio","A. Gammal, T. Frederico, Lauro Tomio, and Ph. Chomaz","Atomic Bose-Einstein Condensation with Three-Body Interactions and
  Collective Excitations","7 eps-figures","Journal of Physics B - At. Mol. Opt. 33, 4053-4067 (2000)","10.1088/0953-4075/33/19/316",,"cond-mat.soft cond-mat.mes-hall",,"  The stability of a Bose-Einstein condensed state of trapped ultra-cold atoms
is investigated under the assumption of an attractive two-body and a repulsive
three-body interaction. The Ginzburg-Pitaevskii-Gross (GPG) nonlinear
Schr\""odinger equation is extended to include an effective potential dependent
on the square of the density and solved numerically for the s-wave. The lowest
frequency of the collective mode is determined and its dependences on the
number of atoms and on the strength of the three-body force are studied. We
show that the addition of three-body dynamics can allow the number of condensed
atoms to increase considerably, even when the strength of the three-body force
is very small compared with the strength of the two-body force. We also observe
a first-order liquid-gas phase transition for the condensed state up to a
critical strength of the effective three-body force.
","[{""version"":""v1"",""created"":""Fri, 5 Nov 1999 20:51:33 GMT""}]","2009-10-31"
"cond-mat/9911090","Robert M. Ziff","Dietrich Stauffer and Robert M. Ziff","Re-examination of seven-dimensional site percolation thresholds","3 pages, 3 figures, submitted",,"10.1142/S0129183100000183",,"cond-mat.dis-nn",,"  Monte Carlo simulations alone could not clarify the corrections to scaling
for the size-dependent p_c(L) above the upper critical dimension. Including the
previous series estimate for the bulk threshold $p_c(\infty)$ gives preference
for the complicated corrections predicted by renormalization group and against
the simple 1/L extrapolation. Additional Monte-Carlo simulations using the
Leath method corroborate the series result for p_c.
","[{""version"":""v1"",""created"":""Fri, 5 Nov 1999 21:22:26 GMT""}]","2015-06-25"
"cond-mat/9911091","Tsutomu Momoi","Kentaro Nagai (1), Tsutomu Momoi (1,2), and Kenn Kubo (3) ((1)
  University of Tsukuba, (2) Harvard University, (3) Aoyama Gakuin University)","Magnetic Order in the Double Exchange Model in Infinite Dimensions","11 pages, LaTeX, 9 eps-figures","J. Phys. Soc. Jpn. 69, 1837 (2000)","10.1143/JPSJ.69.1837",,"cond-mat.str-el",,"  We studied magnetic properties of the double exchange (DE) model with S=1/2
localized spins at T=0, using exact diagonalization in the framework of the
dynamical mean field theory. Obtained phase diagram contains ferromagnetic,
antiferromagnetic and paramagnetic phases. Comparing the phase diagram with
that of the DE model with classical localized spins, we found that the quantum
fluctuations of localized spins partly destabilize the ferromagnetism and
expand the paramagnetic phase region. We found that phase separations occur
between the antiferromagnetic and paramagnetic phases as well as the
paramagnetic and ferromagnetic ones.
","[{""version"":""v1"",""created"":""Fri, 5 Nov 1999 23:14:32 GMT""},{""version"":""v2"",""created"":""Fri, 3 Mar 2000 21:23:10 GMT""}]","2009-10-31"
"cond-mat/9911092","Antonio Castro-Neto","A. H. Castro Neto","Non-Fermi liquid behavior in U and Ce intermetallics","Minor typos corrected",,,,"cond-mat.str-el",,"  In this paper we review the current experimental and theoretical situation of
the description of non-Fermi liquid behavior (NFL) in U and Ce intermetallics.
We focus on the magnetic and thermodynamic properties. We also discuss a recent
theoretical interpretation of this behavior in terms of Griffiths-McCoy
singularities close to the magnetic quantum critical point (QCP). We show how
an effective Hamiltonian which contains both the RKKY coupling and the Kondo
interaction can be written after high energy degrees of freedom away from the
Fermi surface are traced out. We argue that dissipation due to particle-hole
excitations close to the Fermi surface is a relevant perturbation at low
temperatures and we estimate the crossover temperature T^* above which power
law behavior in specific heat and magnetic response occurs ($C_V/T \sim \chi(T)
\propto T^{-1+\lambda}$ with $\lambda<1$). Below T^* a new regime dominated by
dissipation is found and deviations from power law behavior are expected.
","[{""version"":""v1"",""created"":""Sat, 6 Nov 1999 00:36:18 GMT""},{""version"":""v2"",""created"":""Mon, 6 Dec 1999 17:18:18 GMT""}]","2007-05-23"
"cond-mat/9911093","Horacio E. Camblong","Horacio E. Camblong and Peter M. Levy","Electrical Resistivity of a Thin Metallic Film","20 pages. To be published in Physical Review B, December 15, 1999","Phys. Rev. B 60, 15782 (1999)","10.1103/PhysRevB.60.15782",,"cond-mat.mes-hall",,"  The electrical resistivity of a pure sample of a thin metallic film is found
to depend on the boundary conditions. This conclusion is supported by a
free-electron model calculation and confirmed by an ab initio relativistic
Korringa-Kohn-Rostoker computation. The low-temperature resistivity is found to
be zero for a free-standing film (reflecting boundary conditions) but nonzero
when the film is sandwiched between two semi-infinite samples of the same
material (outgoing boundary conditions). In the latter case, this resistivity
scales inversely with the number of monolayers and is due to the background
diffusive scattering by a finite lattice.
","[{""version"":""v1"",""created"":""Sat, 6 Nov 1999 10:05:06 GMT""}]","2007-05-23"
"gr-qc/9911019","Ulrich H. Gerlach","Ulrich H. Gerlach","Quantum Mechanical Carrier of the Imprints of Gravitation","8 pages, RevTex. Html version of this and related papers on
  accelerated frames available at http://www.math.ohio-state.edu/~gerlach","Phys.Rev. D57 (1998) 4718-4723","10.1103/PhysRevD.57.4718",,"gr-qc",,"  We exhibit a purely quantum mechanical carrier of the imprints of gravitation
by identifying for a relativistic system a property which (i) is independent of
its mass and (ii) expresses the Poincare invariance of spacetime in the absence
of gravitation. This carrier consists of the phase and amplitude correlations
of waves in oppositely accelerating frames. These correlations are expressed as
a Klein-Gordon-equation-determined vector field whose components are the
``Planckian power'' and the ``r.m.s. thermal fluctuation'' spectra. The
imprints themselves are deviations away from this vector field.
","[{""version"":""v1"",""created"":""Fri, 5 Nov 1999 17:09:56 GMT""}]","2009-10-31"
"gr-qc/9911020","Sergio M. C. V. Goncalves","Sergio M. C. V. Goncalves","Integrability of the Minimal Strain Equations for the Lapse and Shift in
  3+1 Numerical Relativity","6 pages; RevTeX; submitted to Phys. Rev. D15. Technical issue of the
  uniqueness of the solution to the Dirichlet problem clarified. New subsection
  on the nature of the boundary data","Phys.Rev. D62 (2000) 024009","10.1103/PhysRevD.62.024009",,"gr-qc",,"  Brady, Creighton and Thorne have argued that, in numerical relativity
simulations of the inspiral of binary black holes, if one uses lapse and shift
functions satisfying the ``minimal strain equations'' (MSE), then the
coordinates might be kept co-rotating, the metric components would then evolve
on the very slow inspiral timescale, and the computational demands would thus
be far smaller than for more conventional slicing choices. In this paper, we
derive simple, testable criteria for the MSE to be strongly elliptic, thereby
guaranteeing the existence and uniqueness of the solution to the Dirichlet
boundary value problem. We show that these criteria are satisfied in a test-bed
metric for inspiraling binaries, and we argue that they should be satisfied
quite generally for inspiraling binaries. If the local existence and uniqueness
that we have proved holds globally, then, for appropriate boundary values, the
solution of the MSE exhibited by Brady et. al. (which tracks the inspiral and
keeps the metric evolving slowly) will be the unique solution and thus should
be reproduced by (sufficiently accurate and stable) numerical integrations.
","[{""version"":""v1"",""created"":""Sat, 6 Nov 1999 07:55:37 GMT""},{""version"":""v2"",""created"":""Wed, 23 Feb 2000 19:40:14 GMT""}]","2009-10-31"
"gr-qc/9911021","Simon Davis","Simon Davis","Higher-Derivative Quantum Cosmology","11 pages TeX. A term has been removed from equation (13)","Gen.Rel.Grav.32:541-551,2000","10.1023/A:1001936603047","Report 99-12","gr-qc",,"  The quantum cosmology of a higher-derivative derivative gravity theory
arising from the heterotic string effective action is reviewed. A new type of
Wheeler-DeWitt equation is obtained when the dilaton is coupled to the
quadratic curvature terms. Techniques for solving the Wheeler-DeWitt equation
with appropriate boundary conditions shall be described, and implications for
semiclassical theories of inflationary cosmology will be outlined.
","[{""version"":""v1"",""created"":""Sat, 6 Nov 1999 09:26:49 GMT""},{""version"":""v2"",""created"":""Wed, 10 Nov 1999 21:31:54 GMT""}]","2011-04-15"
"hep-ex/9911008","Bruce J. King","Bruce J. King","High Rate Physics at Neutrino Factories","19 pages, 1 figure. Submitted to Proc. 23rd Johns Hopkins Workshop on
  Current Problems in Particle Theory, ""Neutrinos in the Next Millenium"", Johns
  Hopkins University, Baltimore MD, June 10-12, 1999",,,,"hep-ex",,"  Both muon colliders and non-colliding muon storage rings using muon collider
technology have the potential to become the first true ``neutrino factories'',
with uniquely intense and precisely characterized neutrino beams that could
usher in a new era of high rate and long baseline neutrino physics studies at
accelerators. This paper gives an overview of the predicted capabilities of
neutrino factories for high rate neutrino physics analyses that will use huge
event samples collected with novel, high performance neutrino detectors.
","[{""version"":""v1"",""created"":""Sat, 6 Nov 1999 00:49:01 GMT""}]","2007-05-23"
"hep-ex/9911009","Horst Fischer","G.Braun, H.Fischer, J.Franz, A.Grunemaier, F.H.Heinsius, L.Hennig,
  K.Konigsmann, M.Niebuhr, M.Schierloh, T.Schmidt, H.Schmitt, H.J.Urban","F1 - An Eight Channel Time-to-Digital Converter Chip for High Rate
  Experiments","5 pages, 5 figures",,,,"hep-ex",,"  A new TDC chip has been developed for the COMPASS experiment at CERN. The
resulting ASIC offers an unprecedented degree of flexibility and functionality.
Its capability to handle highest hit and trigger input rates as well as its low
power consumption makes it an ideal tool for future collider and fixed target
experiments. First front-end boards equipped with the F1 chip have been used
recently at testbeam experiments at CERN. A functional description and
specification for this new TDC chip is presented.
","[{""version"":""v1"",""created"":""Sat, 6 Nov 1999 12:08:35 GMT""}]","2007-05-23"
"hep-ph/9911253","Carsten Vogt","C. Vogt","$\gamma\gamma\to\pi^+\pi^-$ in the Modified Perturbative Approach","6 pages, 3 figures, Talk given at the XVII Autumn School, ``QCD:
  Perturbative or Nonperturbative'', Lisbon, Portugal, 29. Sept. - 4. Oct.
  1999, to appear in the proceedings. Missing figure added",,,"WU B 99-28","hep-ph",,"  We investigate the transverse momentum effects in $\gamma\gamma\to\pi^+\pi^-$
at moderately large total center of mass energy $\sqrt{s}$ in the modified
perturbative approach. The calculation of the differential cross section using
different approximations shows that the inclusion of $k_\perp$ in the quark and
gluon propagators cannot lead to a considerable improvement of the theoretical
prediction.
","[{""version"":""v1"",""created"":""Fri, 5 Nov 1999 16:39:29 GMT""},{""version"":""v2"",""created"":""Mon, 8 Nov 1999 09:38:26 GMT""}]","2007-05-23"
"hep-ph/9911254","Nikita Agasyan","N.O. Agasian, I.A. Shushpanov (ITEP, Moscow)","The Quark and Gluon Condensates and Low-Energy QCD Theorems in a
  Magnetic Field","LaTeX, 9 pages, 2 figures; minor corrections","Phys.Lett. B472 (2000) 143-149","10.1016/S0370-2693(99)01414-8","ITEP-PH-11/99","hep-ph",,"  The low-energy QCD theorems are generalized in the presence of a constant
magnetic field H. Two-loop approximation for the vacuum energy density in the
framework of the chiral perturbation theory was obtained and the quark and
gluon condensates were found as the functions of H.
","[{""version"":""v1"",""created"":""Fri, 5 Nov 1999 16:01:31 GMT""},{""version"":""v2"",""created"":""Tue, 16 Nov 1999 15:47:34 GMT""}]","2009-10-31"
"hep-ph/9911255","Jonathan Feng","Jonathan A. Bagger (Johns Hopkins), Jonathan L. Feng (IAS, Princeton),
  Nir Polonsky (MIT), Ren-Jie Zhang (Wisconsin)","Superheavy Supersymmetry from Scalar Mass--A Parameter Fixed Points","12 pages, 3 figures","Phys.Lett. B473 (2000) 264-271","10.1016/S0370-2693(99)01501-4","IASSNS-HEP-99-95, MIT-CTP-2907, MADPH-99-1139","hep-ph",,"  In supersymmetric models, the well-known tension between naturalness and
experimental constraints is relieved if the squarks and sleptons of the first
two generations are superheavy, with masses of order 10 TeV, and all other
superpartners are light, with masses of order 1 TeV. We show that even if all
scalar masses and trilinear A parameters are of order 10 TeV at some high
scale, a mass-squared hierarchy of order 400 may be generated dynamically
through renormalization group evolution. The required high energy relations are
consistent with grand unification, or, alternatively, may be realized in
moduli-dominated supersymmetry-breaking scenarios.
","[{""version"":""v1"",""created"":""Fri, 5 Nov 1999 19:43:27 GMT""}]","2009-10-31"
"hep-ph/9911256","Michelangelo Mangano","M.L. Mangano","Hard scattering in high-energy QCD","22 pages, Latex, 24 figures. Rapporteur talk presented at the 1999
  International Europhysics Conference on High Energy Physics Tampere, Finland,
  15-21 July 1999",,,"CERN-TH/99-337","hep-ph hep-ex",,"  I review the recent results in the field of QCD at high energy presented to
this Conference. In particular, I will concentrate on measurements of $\as$
from studies of event structures and jet rates, jet production in hadronic
collisions, and heavy quark production.
","[{""version"":""v1"",""created"":""Fri, 5 Nov 1999 17:17:56 GMT""}]","2007-05-23"
"hep-ph/9911257",,"David H Lyth (Lancaster)","The gravitino abundance in supersymmetric `new' inflation models","9 pages latex. Same results but argument for late-time creation now
  appears in hep-ph/9912313","Phys.Lett. B488 (2000) 417-422","10.1016/S0370-2693(00)00878-9","LANCS-TH/9922","hep-ph astro-ph hep-th",,"  We consider the abundance of gravitinos created from the vacuum fluctuation,
in a class of `new' inflation models for which global supersymmetry is a good
approximation. Immediately after inflation, gravitinos are produced, with
number density determined by equations recently presented by Kallosh et. al.
(hep-th/9907124) and Giudice et. al. (hep-ph/9907510). Unless reheating
intervenes, creation may continue, maintaining about the same number density,
until the Hubble parameter falls below the gravitino mass. In any case, the
abundance of gravitinos created from the vacuum fluctuation exceeds the
abundance from thermal collisions in a significant regime of parameter space,
leading to tighter cosmological constraints.
","[{""version"":""v1"",""created"":""Fri, 5 Nov 1999 17:23:45 GMT""},{""version"":""v2"",""created"":""Sun, 12 Dec 1999 10:25:27 GMT""}]","2009-10-31"
"hep-ph/9911258","Masafumi Koike","Masafumi Koike and Joe Sato","T-violation search with very long baseline neutrino oscillation
  experiments","15 pages, including 6 eps figures; LaTeX","Phys.Rev. D62 (2000) 073006","10.1103/PhysRevD.62.073006",,"hep-ph",,"  We consider possibilities of observing T-violation effects in neutrino
oscillation experiments with very long baseline (~ 10000 km) using low energy
neutrino (~ several hundreds MeV). We show that the matter effect effectively
changes only the first-second generation mixing angle, respecting solar
neutrino deficits and atmospheric neutrino anomalies. The effective mixing of
the first-second generation in the Earth grows up to maximum by resonance. This
effect enables one to search T violation in case the first-second mixing angle
is small. We discuss its implications to the observations of T-violation
effects in long baseline experiments.
","[{""version"":""v1"",""created"":""Fri, 5 Nov 1999 18:49:11 GMT""}]","2009-10-31"
"hep-ph/9911259",,"Harry J. Lipkin (Weizmann Institute of Science, Tel Aviv University,
  University of Connecticut)","The New $\sigma_{tot}(\Sigma p)$ Data, the new PDG fit to hadron total
  cross sections and the TCP alternative","13 pages",,,"TAUP 2600-99, WIS-99/34/Nov-DPP","hep-ph",,"  The new SELEX measurement $\sigma_{tot}(\Sigma p) = 36.96 \pm 0.65$ at P =
609 GeV/c and the new 1998 Particle-Data-Group Regge (PDG) analysis of hadron
total cross sections with an additional even-signature-exchange contribution
recall the 1975 two-component-Pomeron model (TCP), which introduced such an
additional term and predicted $\sigma_{tot}(\Sigma p) = 37.07$ mb. in 1975 as
well as fitting all the same data now fit by PDG with fewer free parameters.and
predicting $\sigma_{tot}(\Sigma p)$, (not predicted by PDG) at lower energies.
The additional contribution confuses the extraction of the Pomeron intercept
from data in the 600 GeV range and its dynamical origin is still unclear. But
its surprising systematics suggests an interesting origin.
","[{""version"":""v1"",""created"":""Fri, 5 Nov 1999 19:05:12 GMT""}]","2007-05-23"
"hep-ph/9911260","Akaki Rusetsky","J. Gasser (Bern University), V. E. Lyubovitskij (Tubingen University,
  JINR, Dubna and Tomsk University), A. Rusetsky (Bern University, JINR, Dubna
  and HEPI, Tbilisi University)","Spectrum and Decays of Hadronic Atoms","8 pages. Talk given at ``8th International Symposium on Meson-Nucleon
  Physics and the Structure of the Nucleon (MENU99)'', Zuoz, Switzerland,
  August 16-20, 1999","PiN Newslett.15:197-200,1999",,"BUTP-99/25","hep-ph",,"  Using non relativistic effective Lagrangian techniques, we analyze the
hadronic decay of the pi+pi- atom and the strong energy-level shift of pionic
hydrogen in the ground state. We derive general formulae for the width and
level shift, valid at next-to-leading order in isospin breaking. The result is
expressed in terms of hadronic threshold amplitudes that include
isospin-breaking effects. In order to extract isospin symmetric scattering
lengths from the data, we invoke chiral perturbation theory, that allows one to
relate the scattering lengths to the threshold amplitudes.
","[{""version"":""v1"",""created"":""Fri, 5 Nov 1999 20:36:54 GMT""}]","2011-04-15"
"hep-ph/9911261",,"Harry J. Lipkin (Weizmann Institute of Science, Tel Aviv University,
  University of Connecticut)","Theoretical Analysis of Static Hyperon Data for HYPERON99","16 pages",,,"TAUP 2601-99. WIS-99/35/Nov-DPP","hep-ph",,"  We consider all hyperon data relevant to spin and flavor structure of
hyperons. In addition to masses and magnetic moments considered as static
properties in Hyperon99 we include also relevant data from hyperon decays and
spin structure determined from deep inelastic scattering. Any theoretical model
for the hyperons with parameters to be determined from experiment should use
input from all these data. Of particular interest are new data from $\Xi^o$
decay and the polarixation of $\Lambda's$ produced in Z^o decays and deep
inelastic scattering.
","[{""version"":""v1"",""created"":""Fri, 5 Nov 1999 21:19:07 GMT""}]","2007-05-23"
"hep-ph/9911262",,"H. Davoudiasl, J.L. Hewett and T.G. Rizzo","Bulk Gauge Fields in the Randall-Sundrum Model","Improved results, 14 pages, Latex file","Phys.Lett. B473 (2000) 43-49","10.1016/S0370-2693(99)01430-6","SLAC-PUB-8298","hep-ph hep-th",,"  We explore the consequences of placing the Standard Model gauge fields in the
bulk of the recently proposed localized gravity model of Randall and Sundrum.
We find that the Kaluza Klein excitations of these fields are necessarily
strongly coupled and we demonstrate that current precision electroweak data
constrain the lowest states to lie above $\simeq 23$ TeV. Taking the weak scale
to be $\sim 1$ TeV, the resulting implications on the model parameters force
the bulk curvature, $R_5$, to be larger than the higher dimensional Planck
scale, $M$, violating the consistency of the theory. In turn, to preserve
$|R_5|\lsim M^2$, the weak scale must be pushed to $\gsim 100$ TeV. Hence we
conclude that it is disfavored to place the Standard Model gauge fields in the
bulk of this model as it is presently formulated.
","[{""version"":""v1"",""created"":""Fri, 5 Nov 1999 22:51:44 GMT""},{""version"":""v2"",""created"":""Thu, 11 Nov 1999 23:40:09 GMT""}]","2009-10-31"
"hep-ph/9911263","Sechul Oh","B. Dutta and Sechul Oh","Charmless hadronic B decays and the recent CLEO data","24 pages, 11 figures, LaTex; Version to appear in Phys. Rev. D","Phys.Rev. D63 (2001) 054016","10.1103/PhysRevD.63.054016","CTP-TAMU-43-99, COLO-HEP-439","hep-ph",,"  In the light of recent experimental data from the CLEO Collaboration we
study, the decays of B mesons to a pair of pseudoscalar (P) mesons, and a
vector (V) meson and a pseudoscalar meson, in the framework of factorization.
In order to obtain the best fit for the recent CLEO data, we critically examine
the values of several input parameters to which the predictions are sensitive.
These input parameters are the form factors, the strange quark mass, $\xi
\equiv 1/ N_c$ (N_c is the effective number of color), the CKM matrix elements
and in particular, the weak phase $\gamma$. It is possible to give a
satisfactory account of the recent experimental results in $B \to PP$ and VP
decays, with constrained values of a \emph{single} $\xi$. We identify the decay
modes in which CP asymmetries are expected to be large.
","[{""version"":""v1"",""created"":""Fri, 5 Nov 1999 23:46:22 GMT""},{""version"":""v2"",""created"":""Fri, 26 Jan 2001 07:55:01 GMT""}]","2009-10-31"
"hep-th/9911035","Sebastian Silva","B. Julia and S. Silva","On first order formulations of supergravities","LaTex, 30 Pages. Expanded introduction and added references","JHEP 0001 (2000) 026","10.1088/1126-6708/2000/01/026",,"hep-th",,"  Supergravities are usually presented in a so-called 1.5 order formulation.
Here we present a general scheme to derive pure 1^{st} order formulations of
supergravities from the 1.5 order ones. The example of N_4=1 supergravity will
be rederived and new results for N_4=2 and N_11=1 will be presented. It seems
that beyond four dimensions the auxiliary fields introduced to obtain first
order formulations of SUGRA theories do not admit supergeometrical
transformation laws at least before a full superfield treatment. On the other
hand first order formalisms simplify eventually symmetry analysis and the study
of dimensional reductions.
","[{""version"":""v1"",""created"":""Fri, 5 Nov 1999 16:49:29 GMT""},{""version"":""v2"",""created"":""Sat, 18 Dec 1999 14:16:04 GMT""}]","2009-10-31"
"hep-th/9911039","David Kutasov","A. Giveon, D. Kutasov","Comments on Double Scaled Little String Theory","22 pages, harvmac; minor changes","JHEP 0001:023,2000","10.1088/1126-6708/2000/01/023","NSF-ITP-99-123, RI-10-99, EFI-99-45","hep-th",,"  We study little string theory in a weak coupling limit defined in \gk.
","[{""version"":""v1"",""created"":""Fri, 5 Nov 1999 17:25:45 GMT""},{""version"":""v2"",""created"":""Fri, 17 Dec 1999 18:23:38 GMT""}]","2010-04-06"
