"cond-mat/9911132","John L. Bohn","John L. Bohn","Cooper Pairing in Ultracold K-40 Using Feshbach Resonances","4 pages, 2 figs, submitted to Phys. Rev. A",,"10.1103/PhysRevA.61.053409","JILA #6393","cond-mat",,"  We point out that the fermionic isotope K-40 is a likely candidate for the
formation of Cooper pairs in an ultracold atomic gas. Specifically, in an
optical trap that simultaneously traps the spin states |9/2,-9/2> and
|9/2,-7/2>, there exists a broad magnetic field Feshbach resonance at B = 196
gauss that can provide the required strong attractive interaction between
atoms. An additional resonance, at B = 191 gauss, could generate p-wave pairing
between identical |9/2,-7/2> atoms. A Cooper-paired degenerate Fermi gas could
thus be constructed with existing ultracold atom technology.
","[{""version"":""v1"",""created"":""Tue, 9 Nov 1999 18:02:14 GMT""}]","2009-10-31"
"cond-mat/9911133","S. J. C. H. Theeuwen","S.J.C.H. Theeuwen, J. Caro, K.P. Wellock, S. Radelaar, C.H. Marrows,
  B.J. Hickey, and V.I. Kozub","Nanoconstriction Microscopy of the Giant Magnetoresistance in
  Cobalt/Copper Spin Valves","13 pages [pre-print style], 3 figures, accepted APL",,"10.1063/1.125426",,"cond-mat.mes-hall",,"  We use nanometer-sized point contacts to a Co/Cu spin valve to study the
giant magnetoresistance (GMR) of only a few Co domains. The measured data show
strong device-to-device differences of the GMR curve, which we attribute to the
absence of averaging over many domains. The GMR ratio decreases with increasing
bias current. For one particular device, this is accompanied by the development
of two distinct GMR plateaus, the plateau level depending on bias polarity and
sweep direction of the magnetic field. We attribute the observed behavior to
current-induced changes of the magnetization, involving spin transfer due to
incoherent emission of magnons and self-field effects.
","[{""version"":""v1"",""created"":""Tue, 9 Nov 1999 18:02:38 GMT""}]","2009-10-31"
"cond-mat/9911134","Luca Salasnic","B. Pozzi, L. Salasnich, A. Parola, L. Reatto","Thermodynamics of a trapped Bose condensate with negative scattering
  length","RevTex, 7 postscript figures, to be published in Journal of Low
  Temperature Phsyics","J. Low Temp. Phys. 119 (2000) 57-77",,,"cond-mat",,"  We study the Bose-Einstein condensation (BEC) for a system of $^7Li$ atoms,
which have negative scattering length (attractive interaction), confined in a
harmonic potential. Within the Bogoliubov and Popov approximations, we
numerically calculate the density profile for both condensate and
non-condensate fractions and the spectrum of elementary excitations. In
particular, we analyze the temperature and number-of-boson dependence of these
quantities and evaluate the BEC transition temperature $T_{BEC}$. We calculate
the loss rate for inelastic two- and three-body collisions. We find that the
total loss rate is strongly dependent on the density profile of the condensate,
but this density profile does not appreciably change by increasing the thermal
fraction. Moreover, we study, using the quasi-classical Popov approximation,
the temperature dependence of the critical number $N_c$ of condensed bosons,
for which there is the collapse of the condensate. There are different regimes
as a function of the total number $N$ of atoms. For $N<N_c$ the condensate is
always metastable but for $N>N_c$ the condensate is metastable only for
temperatures that exceed a critical value $T_c$.
","[{""version"":""v1"",""created"":""Tue, 9 Nov 1999 18:23:05 GMT""}]","2007-05-23"
"cond-mat/9911135","Jeff Tallon","J. L. Tallon, J. W. Loram, G. V. M. Williams and C. Bernhard","Heat capacity and transport studies of the ferromagnetic superconductor
  RuSr2GdCu2O8","9 pages, 6 figures, submitted to Phys. Rev. Lett 1 June 1999",,,,"cond-mat.supr-con",,"  Resistivity, thermoelectric power and heat capacity are investigated in the
ferromagnetic superconductor RuSr2GdCu2O8 with and without Zn substitution. The
thermodynamic signatures of the ordering of the Ru moments and the paramagnetic
Gd moments as well as the onset of superconductivity are all clearly seen and
quantified. The materials are shown to exhibit bulk superconductivity which
coexists with spatially-uniform ferromagnetism. They appear to be typical
underdoped superconducting cuprates in which the pseudogap dominates
normal-state transport, thermodynamic and substitutional properties. However, a
field-induced increase in Tc could suggest some degree of triplet pairing.
","[{""version"":""v1"",""created"":""Tue, 9 Nov 1999 20:58:57 GMT""}]","2007-05-23"
"cond-mat/9911136","Gunnar Palsson","Gunnar Palsson and Gabriel Kotliar","Thermoelectric Response Near the Density Driven Mott Transition","4 pages, 2 embedded figures","Phys. Rev. Lett. vol. 80, page 4775 (1998)","10.1103/PhysRevLett.80.4775",,"cond-mat.str-el",,"  We investigate the thermoelectric response of correlated electron systems
near the density driven Mott transition using the dynamical mean field theory.
","[{""version"":""v1"",""created"":""Wed, 10 Nov 1999 01:48:37 GMT""}]","2009-10-31"
"cond-mat/9911137","Masaki Oshikawa","Masaki Oshikawa (Tokyo Inst. Tech.)","Commensurability, excitation gap and topology in quantum many-particle
  systems on a periodic lattice","4 pages in REVTEX","Phys. Rev. Lett. 84, 1535 (2000).","10.1103/PhysRevLett.84.1535",,"cond-mat.str-el cond-mat.stat-mech",,"  Combined with Laughlin's argument on the quantized Hall conductivity,
Lieb-Schultz-Mattis argument is extended to quantum many-particle systems
(including quantum spin systems) with a conserved particle number, on a
periodic lattice in arbitrary dimensions. Regardless of dimensionality,
interaction strength and particle statistics (bose/fermi), a finite excitation
gap is possible only when the particle number per unit cell of the groundstate
is an integer.
","[{""version"":""v1"",""created"":""Wed, 10 Nov 1999 01:41:10 GMT""}]","2009-10-31"
"cond-mat/9911138","H. J. Hilhorst","H.J. Hilhorst","Persistence exponent of the diffusion equation in epsilon dimensions","4 pages, latex, no figures","Physica A 277 (2000) 124","10.1016/S0378-4371(99)00509-9","LPT ORSAY 99/71","cond-mat.stat-mech",,"  We consider the d-dimensional diffusion equation for a field phi(x,t) with
random initial condition, and observe that, when appropriately scaled, phi(0,t)
is Gaussian and Markovian in the limit d->0. This leads via the Majumdar-Sire
perturbation theory to a small-d expansion for the persistence exponent
theta(d). We find theta(d) = d/4 - 0.12065...d^{3/2} + ...
","[{""version"":""v1"",""created"":""Wed, 10 Nov 1999 10:33:13 GMT""}]","2010-08-26"
"cond-mat/9911139","M. Steinberg","M.Steinberg, J.Ortner","Ground-state energy of a high-density electron gas in a strong magnetic
  field","4 pages, 2 figures, to appear in the proceedings of the 1999
  International Conference on Strongly Coupled Coulomb Systems (St.Malo)",,,,"cond-mat",,"  The high-density electron gas in a strong magnetic field B and at zero
temperature is investigated. The quantum strong-field limit is considered in
which only the lowest Landau level is occupied. It is shown that the
perturbation series of the ground-state energy can be represented in analogy to
the Gell-Mann Brueckner expression of the ground-state energy of the field-free
electron gas. The role of the expansion parameter is taken by $r_B= (2/3 \pi^2)
(B/m^2) (\hbar r_S/e)^3$ instead of the field-free Gell-Mann Brueckner
parameter r_s.
","[{""version"":""v1"",""created"":""Wed, 10 Nov 1999 11:06:17 GMT""}]","2007-05-23"
"cond-mat/9911140","Bruno Bassetti","B.Bassetti, M.Cosentino Lagomarsino, P.Jona","A Model for the Self-Organization of Microtubules Driven by Molecular
  Motors","23 pages, 10 figures, LaTeX, eps",,"10.1007/s100510051150",,"cond-mat.stat-mech",,"  We propose a two-dimensional model for the organization of stabilized
microtubules driven by molecular motors in an unconfined geometry. In this
model two kinds of dynamics are competing. The first one is purely diffusive,
with an interaction between the rotational degrees of freedom, the second one
is a local drive, dependent on microtubule polarity. As a result, there is a
configuration dependent driving field. Applying a molecular field
approximation, we are able to derive continuum equations. A study on the
solutions shows nonequilibrium steady states. The presence and stability of
such self-organized states are investigated in terms of entropy production.
Numerical simulations confirm analytical results.
","[{""version"":""v1"",""created"":""Wed, 10 Nov 1999 14:26:44 GMT""}]","2019-08-17"
"cond-mat/9911141","Yue Yu","Yue Yu (ITP, Beijing), Huan-Xiong Yang (Zhejiang Univ.),Yong-Shi Wu
  (univ. of Utah)","Bosonization Based on Bethe Ansatz Equations and Spin-Charge Separation
  in the Hubbard Model with Finite U","41 pages, Revtex, no figure",,,,"cond-mat.str-el cond-mat.stat-mech hep-th",,"  We develop a bosonization approach for one-dimensional models based on Bethe
ansatz equations. The operator formalism of the exact soluble models in the low
energy limit provides a systematic method to calculate the asymptotic
correlation functions. As examples with and without internal degrees of
freedom, the Calogero-Sutherland (C-S) model and the repulsive Hubbard model
are considered respectively. We verify that the low energy behavior of the C-S
model is controlled by two classes of c=1 conformal field theories, depending
on whether the C-S interactions are among bosons or among fermions. For the
Hubbard model, we show the explicit charge-spin separation at low energy for
arbitrary U>0. The low energy behavior of the system is described by the
(semi-) direct product of two independent Virasoro algebras with c=1.
","[{""version"":""v1"",""created"":""Wed, 10 Nov 1999 12:29:12 GMT""}]","2007-05-23"
"cond-mat/9911142","Naoki Kawashima","Naoki Kawashima","Optimization Algorithms Based on Renormalization Group","7 pages, 2 figures","Prog. Theor. Phys. Supple. 138, 448 (2000)","10.1143/PTPS.138.448",,"cond-mat.dis-nn",,"  Global changes of states are of crucial importance in optimization
algorithms. We review some heuristic algorithms in which global updates are
realized by a sort of real-space renormalization group transformation. Emphasis
is on the relationship between the structure of low-energy excitations and
``block-spins'' appearing in the algorithms. We also discuss the implication of
existence of a finite-temperature phase transition on the computational
complexity of the ground-state problem.
","[{""version"":""v1"",""created"":""Wed, 10 Nov 1999 12:31:09 GMT""},{""version"":""v2"",""created"":""Thu, 18 Nov 1999 11:48:54 GMT""}]","2009-10-31"
"cond-mat/9911143","Serguei Brazovskii","S.Brazovski and N. Kirova","Topological coupling of dislocations and magnetization vorticity in Spin
  Density Waves","To be published in Proceedings of ECRYS-99, J. de Physique, Coll.,
  December 1999. http://ipnweb.in2p3.fr/~lptms/membres/brazov/",,,,"cond-mat.str-el",,"  The rich order parameter of Spin Density Waves allows for an unusual object
of a complex topological nature: a half-integer dislocation combined with a
semi-vortex of the staggered magnetization. It becomes energetically preferable
to ordinary dislocation due to enhanced Coulomb interactions in the
semiconducting regime. Generation of these objects changes the narrow band
noise frequency.
","[{""version"":""v1"",""created"":""Wed, 10 Nov 1999 13:16:19 GMT""}]","2007-05-23"
"cond-mat/9911144","Felix Ritort","Felix Ritort (Univ. of Barcelona)","Dynamical phase transitions in glasses induced by the ruggedness of the
  free energy landscape","Invited Talk at Workshop Trieste ICTP September 1999 ""Unifying
  Concepts in Glass Physics"", 10 pages, 3 figures and styles",,"10.1088/0953-8984/12/29/317",,"cond-mat.dis-nn",,"  We propose damage spreading (DS) as a tool to investigate the topological
features related to the ruggedness of the free energy landscape. We argue that
DS measures the positiveness of the largest Lyapunov exponent associated to the
basins of attraction visited by the system during its dynamical evolution. We
discuss recent results obtained in the framework of mode-coupling theory and
comment how to extend them to the study of realistic glasses. Preliminary
results are presented for purely repulsive soft-sphere glasses.
","[{""version"":""v1"",""created"":""Wed, 10 Nov 1999 15:18:46 GMT""}]","2009-10-31"
"cs/9911003","David Eppstein","David Eppstein","Subgraph Isomorphism in Planar Graphs and Related Problems","27 pages, 6 figures. A preliminary version of this paper appeared at
  the 6th ACM-SIAM Symp. Discrete Algorithms, 1995","J. Graph Algorithms & Applications 3(3):1-27, 1999",,,"cs.DS",,"  We solve the subgraph isomorphism problem in planar graphs in linear time,
for any pattern of constant size. Our results are based on a technique of
partitioning the planar graph into pieces of small tree-width, and applying
dynamic programming within each piece. The same methods can be used to solve
other planar graph problems including connectivity, diameter, girth, induced
subgraph isomorphism, and shortest paths.
","[{""version"":""v1"",""created"":""Tue, 9 Nov 1999 18:58:58 GMT""}]","2007-05-23"
"cs/9911004","Wolfgang Slany","Wolfgang Slany","Graph Ramsey games","47 pages; To actually play small but nontrivial game instances, go to
  http://www.dbai.tuwien.ac.at/proj/ramsey/",,,"DBAI-TR-99-34","cs.CC cs.DM math.CO",,"  We consider combinatorial avoidance and achievement games based on graph
Ramsey theory: The players take turns in coloring still uncolored edges of a
graph G, each player being assigned a distinct color, choosing one edge per
move. In avoidance games, completing a monochromatic subgraph isomorphic to
another graph A leads to immediate defeat or is forbidden and the first player
that cannot move loses. In the avoidance+ variants, both players are free to
choose more than one edge per move. In achievement games, the first player that
completes a monochromatic subgraph isomorphic to A wins. Erdos & Selfridge
(1973) were the first to identify some tractable subcases of these games,
followed by a large number of further studies. We complete these investigations
by settling the complexity of all unrestricted cases: We prove that general
graph Ramsey avoidance, avoidance+, and achievement games and several variants
thereof are PSPACE-complete. We ultra-strongly solve some nontrivial instances
of graph Ramsey avoidance games that are based on symmetric binary Ramsey
numbers and provide strong evidence that all other cases based on symmetric
binary Ramsey numbers are effectively intractable.
  Keywords: combinatorial games, graph Ramsey theory, Ramsey game,
PSPACE-completeness, complexity, edge coloring, winning strategy, achievement
game, avoidance game, the game of Sim, Polya's enumeration formula,
probabilistic counting, machine learning, heuristics, Java applet
","[{""version"":""v1"",""created"":""Wed, 10 Nov 1999 11:28:11 GMT""}]","2007-05-23"
"gr-qc/9911033","Luis Lehner","Luis Lehner","Matching characteristic codes: exploiting two directions","10 pages, 9 postscript figures. To appear in Int. Journ. of Mod.
  Phys. D","Int.J.Mod.Phys.D9:459-474,2000","10.1142/S0218271800000451",,"gr-qc",,"  Combining incoming and outgoing characteristic formulations can provide
numerical relativists with a natural implementation of Einstein's equations
that better exploits the causal properties of the spacetime and gives access to
both null infinity and the interior region simultaneously (assuming the
foliation is free of caustics and crossovers). We discuss how this combination
can be performed and illustrate its behavior in the Einstein-Klein-Gordon field
in 1D.
","[{""version"":""v1"",""created"":""Tue, 9 Nov 1999 17:58:27 GMT""}]","2014-11-17"
"gr-qc/9911034","Bernard F. Schutz","Bernard F Schutz","Gravitational wave astronomy","29 pages, 2 figures, as submitted for special millenium issue of
  Classical and Quantum Gravity","Class.Quant.Grav.16:A131-A156,1999","10.1088/0264-9381/16/12A/307","AEI-1999-34","gr-qc",,"  The first decade of the new millenium should see the first direct detections
of gravitational waves. This will be a milestone for fundamental physics and it
will open the new observational science of gravitational wave astronomy. But
gravitational waves already play an important role in the modeling of
astrophysical systems. I review here the present state of gravitational
radiation theory in relativity and astrophysics, and I then look at the
development of detector sensitivity over the next decade, both on the ground
(such as LIGO) and in space (LISA). I review the sources of gravitational waves
that are likely to play an important role in observations by first- and
second-generation interferometers, including the astrophysical information that
will come from these observations. The review covers some 10 decades of
gravitational wave frequency, from the high-frequency normal modes of neutron
stars down to the lowest frequencies observable from space. The discussion of
sources includes recent developments regarding binary black holes, spinning
neutron stars, and the stochastic background.
","[{""version"":""v1"",""created"":""Tue, 9 Nov 1999 19:32:52 GMT""}]","2010-04-06"
"gr-qc/9911035","G. R. Filewood","G Filewood","The Principle of Equivalence and Electromagnetism","39 page revtex document. No figures. Revised version with corrected
  equations for the uncertainty principle (previous expressions on page 24
  completely wrong)",,,,"gr-qc",,"  The problem of unification of Gravitation and Electromagnetism in four
dimensions; some new ideas involving mixtures of commuting and anti-commuting
co-ordinates. Maxwell's equations are extracted in terms of the curvature of
the anti-commuting component of space-time. The profound difference in the size
of the coupling constants of the two forces is interpreted in terms of the
degree of expansion of the two kinds of space-time with evolution of the
universe. Uncertainty in the quantum realm is interpreted in terms of an
unmeasurable component of anti-commuting space-time.
","[{""version"":""v1"",""created"":""Wed, 10 Nov 1999 04:31:36 GMT""},{""version"":""v2"",""created"":""Mon, 15 Nov 1999 11:24:04 GMT""},{""version"":""v3"",""created"":""Mon, 22 Nov 1999 06:07:27 GMT""}]","2007-05-23"
"gr-qc/9911036","Stanislav Alexeyev","S.O. Alexeyev, M.V. Sazhin and M.V. Pomazanov (Moscow State
  University)","Black Holes of a Minimal Size in String Gravity","6 LaTeX pages, 1 PostScript figure (epsfig.sty), minor changes in the
  text and references, submitted to Int.J.Mod.Phys","Int.J.Mod.Phys. D10 (2001) 225-230","10.1142/S0218271801000780",,"gr-qc",,"  A lower limit for a neutral black hole size is obtained in the frames of the
string gravity model with the second order curvature correction. It is shown
that this effect remains when the third order curvature correction is also
taken into account and argued that such restriction does exist in all
perturbative orders of curvature expansions.
","[{""version"":""v1"",""created"":""Wed, 10 Nov 1999 07:35:15 GMT""},{""version"":""v2"",""created"":""Tue, 30 Nov 1999 06:46:45 GMT""}]","2009-10-31"
"gr-qc/9911037","Plamen Fiziev","P. P. Fiziev","A Minimal Model for Dilatonic Gravity","10 pages, LaTeX, no figures. A new Appendex added, new references,
  comments and acknowledgments added, typos corrected. Final version: to appear
  in Modern Physics Letters A",,"10.1142/S0217732300002553","SU-FzF: 4/99","gr-qc astro-ph hep-ph hep-th",,"  We study a new minimal scalar-tensor model of gravity with Brans-Dicke factor
$\omega(\Phi)\equiv 0$ and cosmological factor $\Pi(\Phi)$. The constraints on
$\Pi(\Phi)$ from known gravitational experiments are derived. We show that
almost any time evolution of the scale factor in a homogeneous isotropic
Universe can be obtained via properly chosen $\Pi(\Phi)$ and discuss the
general properties of models of this type.
","[{""version"":""v1"",""created"":""Wed, 10 Nov 1999 07:40:10 GMT""},{""version"":""v2"",""created"":""Thu, 13 Jan 2000 12:58:54 GMT""},{""version"":""v3"",""created"":""Sat, 2 Dec 2000 15:50:59 GMT""}]","2009-10-31"
"gr-qc/9911038","Diego F. Torres","Franz E. Schunck and Diego F. Torres","Boson stars with generic self-interactions","Revtex, 11 figures","Int.J.Mod.Phys. D9 (2000) 601-618","10.1142/S0218271800000608",,"gr-qc",,"  We study boson star configurations with generic, but not non-topological,
self-interaction terms, i.e. we do not restrict ourselves just to consider the
standard $\lambda |\psi|^4$ interaction but more general
U(1)-symmetry-preserving profiles. We find that when compared with the usual
potential, similar results for masses and number of particles appear. However,
changes are of order of few percent of the star masses. We explore the
stability properties of the configurations, that we analyze using catastrophe
theory. We also study possible observational outputs: gravitational redshifts,
rotation curves of accreted particles, and lensing phenomena, and compare with
the usual case.
","[{""version"":""v1"",""created"":""Wed, 10 Nov 1999 13:26:21 GMT""}]","2009-10-31"
"gr-qc/9911039","Toporenskij A. V.","S.A.Pavluchenko and A.V.Toporensky","Chaos in FRW cosmology with gently sloping scalar field potentials","13 pages with 5 eps figures","Grav.Cosmol. 6 (2000) 241-245",,,"gr-qc",,"  The chaotic behavior in FRW cosmology with a scalar field is studied for
scalar field potentials less steep than quadratic. We describe a transition to
much stronger chaos for appropriate parameters of such potentials. The range of
parameters which allows this transition is specified. The influence of ordinary
matter on the chaotic properties of this model is also discussed.
","[{""version"":""v1"",""created"":""Wed, 10 Nov 1999 14:52:36 GMT""}]","2007-05-23"
"hep-ex/9911011","J. William GARY","J. William Gary","Determination of the QCD color factor ratio CA/CF from the scale
  dependence of multiplicity in three jet events","20 pages including 6 figures Version 2 corrects typographical error
  in equation (2)","Phys.Rev. D61 (2000) 114007","10.1103/PhysRevD.61.114007","UCRHEP-E265","hep-ex",,"  I examine the determination of the QCD color factor ratio CA/CF from the
scale evolution of particle multiplicity in e+e- three jet events. I fit an
analytic expression for the multiplicity in three jet events to event samples
generated with QCD multihadronic event generators. I demonstrate that a one
parameter fit of CA/CF yields the expected result CA/CF=2.25 in the limit of
asymptotically large energies if energy conservation is included in the
calculation. In contrast, a two parameter fit of CA/CF and a constant offset to
the gluon jet multiplicity, proposed in a recent study, does not yield
CA/CF=2.25 in this limit. I apply the one parameter fit method to recently
published data of the DELPHI experiment at LEP and determine the effective
value of CA/CF from this technique, at the finite energy of the Z0 boson, to be
1.74+-0.03+-0.10, where the first uncertainty is statistical and the second is
systematic.
","[{""version"":""v1"",""created"":""Tue, 9 Nov 1999 17:35:59 GMT""},{""version"":""v2"",""created"":""Sun, 14 Nov 1999 22:03:08 GMT""}]","2009-10-31"
"hep-lat/9911011","Chris Maynard","UKQCD Collaboration, K.C. Bowler, L. Del Debbio, J.M. Flynn, L.
  Lellouch, V. Lesk, C.M. Maynard, J. Nieves, D.G. Richards","Improved B -> pi l nu_l form factors from the lattice","8 Pages, 4 colour figures, Accepted for Publication in Phys.Lett.B.
  Typset in REVTeX 3.1 added figure and table with minor text modification","Phys.Lett.B486:111-117,2000","10.1016/S0370-2693(00)00754-1","Edinburgh-1999/10, HEP-99/12, CERN/TH-99-265, CPT-99/P.3885
  LAPTH-757/99, JLAB-THY-99-25","hep-lat hep-ph",,"  We present the results of a lattice computation of the form factors for B^0
->pi^- l^+nu_l decays near zero-recoil. These results will allow a
determination of the CKM matrix element |Vub| when measurements of the
differential decay rate become available. We also provide models for
extrapolation of the form factors and rate to the full recoil range. Our
computation is performed in the quenched approximation to QCD on a 24^3x48
lattice at beta=6.2, using a non-perturbatively O(a)-improved action. The
masses of all light valence quarks involved are extrapolated to their physical
values.
","[{""version"":""v1"",""created"":""Tue, 9 Nov 1999 16:02:29 GMT""},{""version"":""v2"",""created"":""Wed, 10 Nov 1999 09:30:40 GMT""},{""version"":""v3"",""created"":""Wed, 21 Jun 2000 11:25:34 GMT""}]","2014-11-17"
"hep-ph/9911284","Levan Baboukhadia","L. Babukhadia, Ya. A. Berdnikov, A. N. Ivanov, and M. D. Scadron","Chiral Shielding","Accepted for publication in Physical Review D. LaTeX2e, 14 pages, 4
  figures","Phys.Rev.D62:037901,2000","10.1103/PhysRevD.62.037901",,"hep-ph",,"  We demonstrate how a chiral soft pion theorem (SPT) shields the scalar meson
ground state isoscalar $\sigma(600-700)$ and isospinor $\kappa(800-900)$ from
detection in $a_{1}\to\pi(\pi\pi)_{\mathrm{swave}}$,
$\gamma\gamma\to2\pi^{\circ}$, $\pi^{-}p\to\pi^{-}\pi^{+}n$ and $K^{-}p\to
K^{-}\pi^{+}n$ processes. While pseudoscalar meson PVV transitions are known to
be determined by (only) quark loop diagrams, the above SPT also constrains
scalar meson SVV transitions to be governed (only) by meson loop diagrams. We
apply this latter SVV theorem to $a_{0}\to\gamma\gamma$ and
$f_{0}\to\gamma\gamma$ decays.
","[{""version"":""v1"",""created"":""Tue, 9 Nov 1999 16:58:35 GMT""},{""version"":""v2"",""created"":""Mon, 24 Jan 2000 21:09:30 GMT""},{""version"":""v3"",""created"":""Tue, 11 Apr 2000 22:45:39 GMT""}]","2010-11-15"
