"astro-ph/9911161","Walter Dehnen","Walter Dehnen (Oxford & MPIA Heidelberg)","The Effect of the Outer Lindblad Resonance of the Galactic Bar on the
  Local Stellar Velocity Distribution","14 pages, 10 figures (Fig.2 in full resolution available upon
  request), accepted for publication in AJ","Astron.J.119:800-812,2000","10.1086/301226",,"astro-ph",,"  Hydro-dynamical modeling of the inner Galaxy suggest that the radius of the
outer Lindblad resonance (OLR) of the Galactic bar lies in the vicinity of the
Sun. How does this resonance affect the distribution function in the outer
parts of a barred disk, and can we identify any effect of the resonance in the
velocity distribution f(v) actually observed in the solar neighborhood? To
answer these questions, detailed simulations of f(v) in the outer parts of an
exponential stellar disks with nearly flat rotation curves and a rotating
central bar have been performed. For a model resembling the old stellar disk,
the OLR causes a distinct feature in f(v) over a significant fraction of the
outer disk. For positions <2kpc outside the OLR radius and at bar angles of
\~10-70 degrees, f(v) inhibits a bi-modality between the low-velocity stars
moving like the local standard of rest (LSR) and a secondary mode of stars
predominantly moving outward and rotating more slowly than the LSR.
  Such a bi-modality is indeed present in f(v) inferred from the Hipparcos data
for late-type stars in the solar neighborhood. If one interpretes this observed
bi-modality as induced by the OLR -- and there are hardly any viable
alternatives -- then one is forced to deduce that the OLR radius is slightly
smaller than Ro. Moreover, by a quantitative comparison of the observed with
the simulated distributions one finds that the pattern speed of the bar is
1.85+/-0.15 times the local circular frequency, where the error is dominated by
the uncertainty in bar angle and local circular speed.
  Also other, less prominent but still significant, features in the observed
f(v) resemble properties of the simulated velocity distributions, in particular
a ripple caused by orbits trapped in the outer 1:1 resonance.
","[{""version"":""v1"",""created"":""Wed, 10 Nov 1999 10:33:18 GMT""}]","2009-05-29"
"astro-ph/9911162","Bruno Guiderdoni","B. Guiderdoni (IAP), J.E.G. Devriendt (IAP)","The spectral appearance of primeval galaxies","10 pages, Latex, 8 postscript figures, to be published in the
  Proceedings of the meeting ``Clustering at High Redshift'', ASP Conference
  Series",,,,"astro-ph",,"  The current and forthcoming observations of large samples of high-redshift
galaxies selected according to various photometric and spectroscopic criteria
can be interpreted in the context of galaxy formation, by means of models of
evolving spectral energy distributions (SEDs). We hereafter present STARDUST
which gives synthetic SEDs from the far UV to the submm wavelength range. These
SEDs are designed to be implemented into semi-analytic models of galaxy
formation.
","[{""version"":""v1"",""created"":""Wed, 10 Nov 1999 10:52:40 GMT""}]","2007-05-23"
"astro-ph/9911163","Elena Amato","E. Amato, M. Salvati, R. Bandiera, F. Pacini, L. Woltjer","A model for the spatial distribution of relativistic electrons in the
  Crab Nebula","7 pages, 7 figures, submitted to A&A",,,,"astro-ph",,"  We extend Pacini & Salvati's model for the synchrotron emission from plerions
to allow more realistic predictions of the surface brightness profiles of the
Crab Nebula at radio, optical and X-ray frequencies. Abandoning the assumption
of a uniform particle distribution, we assume that particles are injected into
the synchrotron nebula only in the vicinity of the pulsar. Their distribution
is then determined, to zeroth order, by MHD propagation in an azimuthal
magnetic field of spatially constant but time-dependent intensity. A good
agreement with observations across the electromagnetic spectrum is obtained if
the finite extension of the particle injection region and particle diffusion
with respect to the azimuthal field lines are taken into account.
","[{""version"":""v1"",""created"":""Wed, 10 Nov 1999 11:33:48 GMT""},{""version"":""v2"",""created"":""Tue, 23 May 2000 15:53:49 GMT""}]","2007-05-23"
"astro-ph/9911164","Kaori Otsuki","Kaori Otsuki, Hideyuki Tagoshi, Toshitaka Kajino, and Shin-ya Wanajo","General relativistic effects on neutrino-driven wind from young, hot
  neutron star and the r-process nucleosynthesis","Accepted for publication in ApJ",,"10.1086/308632",,"astro-ph",,"  Neutrino-driven wind from young hot neutron star, which is formed by
supernova explosion, is the most promising candidate site for r-process
nucleosynthesis. We study general relativistic effects on this wind in
Schwarzschild geometry in order to look for suitable conditions for a
successful r-process nucleosynthesis. It is quantitatively discussed that the
general relativistic effects play a significant role in increasing entropy and
decreasing dynamic time scale of the neutrino-driven wind. Exploring wide
parameter region which determines the expansion dynamics of the wind, we find
interesting physical conditions which lead to successful r-process
nucleosynthesis. The conditions which we found realize in the neutrino-driven
wind with very short dynamic time scale $\tau_{\rm dyn} \sim 6$ ms and
relatively low entropy $S \sim 140$. We carry out the $\alpha$-process and
r-process nucleosynthesis calculation on these conditions by the use of our
single network code including over 3000 isotopes, and confirm quantitatively
that the second and third r-process abundance peaks are produced in the
neutrino-driven wind.
","[{""version"":""v1"",""created"":""Wed, 10 Nov 1999 12:13:00 GMT""},{""version"":""v2"",""created"":""Thu, 11 Nov 1999 04:53:05 GMT""}]","2019-08-17"
"astro-ph/9911165","Ulrich R. M. E. Geppert","K.-H. Raedler, U. Geppert (Astrophysikalisches Institut Potsdam)","Turbulent dynamo action in the high-conductivity limit: a hidden dynamo","13 pages, 3 figures","ASP Conference Series, Vol. 178, 199, p. 151",,,"astro-ph",,"  The paper deals with a simple spherical mean-field dynamo model of
$\alpha^2$-type in the case of high electrical conductivity. A spherically
symmetric distribution of turbulent motions is assumed inside a spherical fluid
body surrounded by free space, and some complete form of the corresponding mean
electromotive force is taken into account. For a turbulence lacking
reflectional symmetry finite growth rates of magnetic fields prove to be
possible even in the limit of perfect conductivity, that is, the model
corresponds to a fast dynamo. In accordance with the theorem by Bondi and Gold
the dynamo-generated field is completely confined in the fluid body.
","[{""version"":""v1"",""created"":""Wed, 10 Nov 1999 11:42:08 GMT""}]","2007-05-23"
"astro-ph/9911166","Kohji Tomisaka","Kohji Tomisaka","Evolution of Angular Momentum Distribution during Star Formation","15 pages, 2 figures, Astrophysical Journal Letters in press",,"10.1086/312417",,"astro-ph",,"  If the angular momentum of the molecular cloud core were conserved during the
star formation process, a new-born star would rotate much faster than its
fission speed. This constitutes the angular momentum problem of new-born stars.
In this paper, the angular momentum transfer in the contraction of a rotating
magnetized cloud is studied with axisymmetric MHD simulations. Owing to the
large dynamic range covered by the nested-grid method, the structure of the
cloud in the range from 10 AU to 0.1 pc is explored. First, the cloud
experiences a run-away collapse, and a disk forms perpendicularly to the
magnetic field, in which the central density increases greatly in a finite
time-scale. In this phase, the specific angular momentum j of the disk
decreases to $\simeq 1/3$ of the initial cloud. After the central density of
the disk exceeds $\sim 10^{10}{\rm cm}^{-3}$, the infall on to the central
object develops. In this accretion stage, the rotation motion and thus the
toroidal magnetic field drive the outflow. The angular momentum of the central
object is transferred efficiently by the outflow as well as the effect of the
magnetic stress. In 7000 yr from the core formation, the specific angular
momentum of the central $0.17M_\odot$ decreases a factor of 10^{-4} from the
initial value (i.e. from $10^{20}{\rm cm^2 s^{-1}}$ to $10^{16}{\rm cm^2
s^{-1}}$).
","[{""version"":""v1"",""created"":""Wed, 10 Nov 1999 11:42:46 GMT""}]","2009-10-31"
"astro-ph/9911167","Leo Stodolsky","Leo Stodolsky","Neutrino Flight Times in Cosmology","Three pages, no figures","Phys.Lett. B473 (2000) 61-64","10.1016/S0370-2693(99)01466-5","MPI-Pth/99-55","astro-ph gr-qc hep-ex hep-ph",,"  If neutrinos have a small but non-zero mass, time-of-flight effects for
neutrino bursts from distant sources can yield information on the large-scale
geometry of the universe, the effects being proportional to the integral over
time of the cosmological expansion parameter. In principle absolute physical
determinations of the Hubble constant and the acceleration parameter are
possible. Practical realization of these possibilities would depend on neutrino
masses being in a favorable range and the future development of very large
detectors.
","[{""version"":""v1"",""created"":""Wed, 10 Nov 1999 11:54:29 GMT""}]","2009-10-31"
"astro-ph/9911168","Pellegrini Silvia","S. Pellegrini (1), M. Cappi (2), L. Bassani (2), G. Malaguti (2),
  G.G.C. Palumbo (1), M. Persic (3) ((1) Dipartimento di Astronomia,
  Universita' di Bologna; (2) Istituto TeSRE/CNR, Bologna; (3) Osservatorio
  Astronomico di Trieste)","The low luminosity AGN in the LINER galaxy M81: BeppoSAX discovery of
  highly ionized gas","11 pages, 8 figures included in the text. To be published in
  Astronomy and Astrophysics",,,"BAP11-1999-29-DDA","astro-ph",,"  The LINER nucleus of the nearby spiral galaxy M81 was pointed by BeppoSAX,
which caught it at the highest (2-10) keV flux level observed so far. The LECS,
MECS and PDS data, extending over (0.1-100) keV, are used to investigate the
physical similarities and differences between LINERs and AGNs. The continuum is
well fitted by a power law of photon index \sim 1.84, modified by little
absorption due to cold material. Superimposed on the continuum BeppoSAX detects
a 6.7 keV emission line (confirming an ASCA result) and an absorption edge at
8.6 keV. Both spectral features are consistent with being produced by iron at
the same high ionization level, and probably also with the same column density.
So, we suggest that they originate from transmission through highly ionized
thin material. Concerning the origin of the continuum emission, we do not
observe signs of reflection from the optically thick material of an accretion
disk, as usually found in Seyfert 1's (a 6.4 keV emission line and a broad bump
peaking at 10-20 keV). The low bolometric luminosity of the nucleus of M81 is
consistent with being produced by advection dominated accretion; in this case
the X-ray emission should be dominated by Comptonization, rather than by
bremsstrahlung, in order to reproduce the steep spectrum observed over the
(0.1-100) keV band.
","[{""version"":""v1"",""created"":""Wed, 10 Nov 1999 13:15:44 GMT""}]","2007-05-23"
"astro-ph/9911169","Douglas Clowe","D. Clowe, G. Luppino, N. Kaiser and I. Gioia","Weak Lensing Observations of High-Redshift Clusters of Galaxies","5 pages, 1 figure, to be published in ASP Conference Series:
  Proceedings of Clustering at High Redshift, Les Rencontres Internationales de
  l'IGRAP",,,,"astro-ph",,"  We present results of a weak gravitational lensing survey of six X-ray
selected high-redshift clusters of galaxies. We find that the masses of the
clusters derived from weak lensing are comparable to those derived from the
X-ray observations. We show that many of the clusters have significant
substructure not observed in the X-ray observations and that for the more
massive clusters a singular isothermal sphere does not provide a good fit to
the radial mass profile.
","[{""version"":""v1"",""created"":""Wed, 10 Nov 1999 13:17:31 GMT""}]","2007-05-23"
"astro-ph/9911170","David Crampton","E.H. Richardson, A. Moore, T. Tilleman, David Crampton","Focussing Image Slicers: Refractive and Reflective","4 pages, 1 figure, to be published in ""Imaging the Universe in Three
  Dimensions"", ASP Conf. Series, in press, van Breugel & Bland-Hawthorn (eds.).
  Requires pasp3D.sty",,,,"astro-ph",,"  A number of design options for image slicers for NGST and Gemini are being
investigated. These image slicers are all of the focussing type and both
refractive and reflective solutions are being explored. One such device, an
image slicer that focuses 10 slices on a spectrograph slit is now in operation
at the McMath Solar telescope. It consists of three lenslet arrays, and
additionally acts as a focal reducer and provides correction for astigmatism of
the telescope. A combined refractive and reflective slicer designed for use on
NGST delivers near-diffraction limited images for up to 40 slices.
","[{""version"":""v1"",""created"":""Wed, 10 Nov 1999 13:38:31 GMT""}]","2007-05-23"
"astro-ph/9911171","Timothy C. Beers","Timothy C. Beers (Michigan State University)","Population III by Popular Demand - Progress and Previews","12 pages, 0 figures, to appear in proceedings of THE FIRST STARS
  meeting, held in Garching, Germany, August 1999",,"10.1007/10719504_1",,"astro-ph",,"  I discuss the ongoing search for stars of the Milky Way which have been
referred to as members of Population III. Following a discussion of possible
definitions for these stars, I consider the reasons why astronomers have
undertaken this search, and list some of the numerous astrophysical uses of the
extremely metal-poor stars found along the way. I then review survey techniques
which have been used in the past, and provide an update on plans for future
investigations. Finally, the question of when one might consider the search for
Population III Finished is addressed.
","[{""version"":""v1"",""created"":""Wed, 10 Nov 1999 13:49:16 GMT""}]","2009-10-31"
"astro-ph/9911172","Bruce Elmegreen","Bruce G. Elmegreen (IBM Watson Research Center, NY)","Star Formation in a Crossing Time","10 pages, 1 figure, to appear in Astrophysical Journal, 530, Feb 10,
  2000","Astrophys.J. 530 (2000) 277-281","10.1086/308361",,"astro-ph",,"  Observations suggest that star formation occurs in only one or two crossing
times for a range of scales spanning a factor of 1000. These observations
include (1) measurements of embedded cluster ages in comparison with the cloud
core dynamical times, (2) measurements of the age difference versus separation
for clusters in the Large Magellanic Clouds in comparison with the crossing
time versus size correlation for molecular clouds, (3) hierarchical structure
of embedded young clusters, and (4) the high fraction of dense clouds that
contain star formation. Such a short overall time scale for star formation
implies that sources of turbulent energy or internal feedback are not required
to explain or extend cloud lifetimes, and that star and protostar interactions
cannot be important for the stellar initial mass function. Stars appear in a
cloud as if they freeze out of the gas, preserving the turbulent-driven gas
structure in their birth locations. The galaxy-wide star formation rate avoids
the Zuckerman-Evans catastrophe, which has long been a concern for molecular
clouds that evolve this quickly, because the multifractal structure of
interstellar gas ensures that only a small fraction of the mass is able to form
stars. Star formation on large scales operates slower than on small scales, but
in most cases the whole process is over in only a few dynamical times.
","[{""version"":""v1"",""created"":""Wed, 10 Nov 1999 13:54:36 GMT""}]","2009-10-31"
"astro-ph/9911173","Alan M. Levine","Alan M. Levine, Saul A. Rappaport, and Goce Zojcheski","Orbital Decay in LMC X-4","Revised in response to the referee's comments; 15 pages including 1
  table and 9 figures (aas2pp4); accepted for publication in the Astrophysical
  Journal",,"10.1086/309398","CSR-99-18","astro-ph",,"  We report on the results of observations of the binary X-ray pulsar LMC X-4
with the Rossi X-ray Timing Explorer. Our analysis of the Doppler delays of the
13.5-s X-ray pulsations yields the most accurate determination of the LMC X-4
orbital parameters available to date. The epoch of orbital phase zero for the
1.4 day orbit is determined with an uncertainty of about 20 s, and is combined
with 5 earlier determinations of the epoch of phase zero to obtain the first
high significance measurement of the rate of change in the orbital period. We
find that the orbital decay timescale is close to 1,000,000 years.
  We present data on one of three strong X-ray flares as well as
energy-dependent pulse profiles for both non-flaring and flaring time
intervals. The pulse profiles during the non-flaring time intervals are
typically strikingly different from the flare profiles, but at other times can
be similar.
  We reconsider the orbital decay of LMC X-4 in the context of tidal evolution.
We find that, while the orbital decay is most likely driven by tidal
interactions, the asynchronism between the orbit and the rotation of the
companion star is probably maintained by the evolutionary expansion of the
companion star, and that the evidence favors the companion star being in a late
stage of its life on the main sequence.
","[{""version"":""v1"",""created"":""Wed, 10 Nov 1999 14:45:13 GMT""},{""version"":""v2"",""created"":""Thu, 4 May 2000 15:46:53 GMT""}]","2009-10-31"
"astro-ph/9911174","Alain Jorissen","C. Cerf, A. Jorissen","Is Amino-Acid Homochirality Due To Asymmetric Photolysis In Space?","To appear in Space Science Reviews, 11 pages, 1 figure (LaTeX)",,,,"astro-ph",,"  Amino acids occurring in proteins are, with rare exceptions, exclusively of
the L-configuration. Among the many scenarios put forward to explain the origin
of this chiral homogeneity (i.e., homochirality), one involves the asymmetric
photolysis of amino acids present in space, triggered by circularly polarized
UV radiation. The recent observation of circularly polarized light (CPL) in the
Orion OMC-1 star-forming region (Bailey et al. 1998, Science 281, 672) has been
presented as providing a strong validation of this scenario. The present paper
reviews the situation. It is stressed for example that one important condition
for the asymmetric photolysis by CPL to be at the origin of the terrestrial
homochirality of natural amino acids is generally overlooked, namely, the
asymmetric photolysis should favour the L-enantiomer for ALL the primordial
amino acids involved in the genesis of life (i.e., biogenic amino acids).
Although this condition is probably satisfied for aliphatic amino acids, some
non-aliphatic amino acids like tryptophan and proline may violate the condition
and thus invalidate the asymmetric photolysis scenario, assuming they were
among the primordial amino acids. Alternatively, if CPL photolysis in space is
indeed the source of homochirality of amino acids, then tryptophan and proline
may be crossed out from the list of biogenic amino acids.
","[{""version"":""v1"",""created"":""Wed, 10 Nov 1999 15:38:11 GMT""}]","2007-05-23"
"cond-mat/9911127","Marti Pi","Agusti Emperador, Marti Pi, Manuel Barranco and Axel Lorke","Far-infrared spectroscopy of nanoscopic InAs rings","Typeset using Revtex, 7 pages and 8 Postscript figures","Phys. Rev. B, 62 (2000) 4573","10.1103/PhysRevB.62.4573",,"cond-mat",,"  We have employed time-dependent local-spin density theory to analyze the
far-infrared transmission spectrum of InAs self-assembled nano-rings recently
reported [A. Lorke et al, cond-mat/9908263 (1999)]. The overall agreement
between theory and experiment is good, which on the one hand confirms that the
experimental peaks indeed reflect the ring-like structure of the sample, and on
the other hand, asseses the suitability of the theoretical method to describe
such small nanostructures. The addition energies of one- and two-electron rings
are also reported and compared with the corresponding capacitance spectra.
","[{""version"":""v1"",""created"":""Tue, 9 Nov 1999 16:26:05 GMT""}]","2009-10-31"
"cond-mat/9911128","Alexander Dzyubenko","A.B. Dzyubenko and A.Yu. Sivachenko","Theory of internal transitions of charged excitons in quantum wells in
  magnetic fields","Latex, 3 pages, 2 eps figures; Contribution to Int. Conf. ""Optics of
  Excitons in Confined Systems""(OECS-VI, Aug.30-Sept.2, Ascona, Switzerland),
  to be published in Physica Status Solidi",,"10.1002/1521-396X(200003)178:1<519::AID-PSSA519>3.0.CO;2-E",,"cond-mat.mes-hall cond-mat.str-el",,"  For charged semiconductor complexes in magnetic fields B, we discuss an exact
classification of states, which is based on magnetic translations. In this
scheme, in addition to the total orbital angular momentum projection $M_z$ and
electron and hole spins $S_e$, $S_h$, a new exact quantum number appears. This
oscillator quantum number, k, is related physically to the center of the
cyclotron motion of the complex as a whole. In the dipole approximation k is
strictly conserved in magneto-optical transitions. We discuss implications of
this new exact selection rule for internal intraband magneto-optical
transitions of charged excitons $X^-$ in quantum wells in B.
","[{""version"":""v1"",""created"":""Tue, 9 Nov 1999 16:52:47 GMT""}]","2015-06-25"
"cond-mat/9911129","Hui Yin","Hui Yin, Bulbul Chakraborty, Nicholas Gross","Effective Field Theory of the Zero-Temperature Triangular-Lattice
  Antiferromagnet: A Monte Carlo Study","26 pages, 9 figures",,"10.1103/PhysRevE.61.6426",,"cond-mat.stat-mech",,"  Using a Monte Carlo coarse-graining technique introduced by Binder et al., we
have explicitly constructed the continuum field theory for the zero-temperature
triangular Ising antiferromagnet. We verify the conjecture that this is a
gaussian theory of the height variable in the interface representation of the
spin model. We also measure the height-height correlation function and deduce
the stiffness constant. In addition, we investigate the nature of defect-defect
interactions at finite temperatures, and find that the two-dimensional Coulomb
gas scenario applies at low temperatures.
","[{""version"":""v1"",""created"":""Tue, 9 Nov 1999 17:26:12 GMT""},{""version"":""v2"",""created"":""Tue, 4 Jan 2000 16:07:57 GMT""}]","2009-10-31"
"cond-mat/9911130","Vladimir Konotop","Vladimir V. Konotop (University of Lisbon) and Boris A. Malomed (Tel
  Aviv University)","""Quadratic solitons"" in nonlinear dynamiical latticess","8 pages, revtex, no figures, submitted to Phys. Rev. B",,"10.1103/PhysRevB.61.8618",,"cond-mat.stat-mech cond-mat.dis-nn",,"  We propose a lattice model, in both one- and multidimensional versions, which
may give rise to matching conditions necessary for the generation of solitons
through the second-harmonic generation. The model describes an array of
linearly coupled two-component dipoles in an anisotropic nonlinear host medium.
Unlike this discrete system, its continuum counterpart gives rise to the
matching conditions only in a trivial degenerate situation. A system of
nonlinear evolution equations for slowly varying envelope functions of the
resonantly coupled fundamental- and second-harmonic waves is derived. In the
one-dimensional case, it coincides with the standard system known in nonlinear
optics, which gives rise to stable solitons. In the multidimensional case, the
system prove to be more general than its counterpart in optics, because of the
anisotropy of the underlying lattice model.
","[{""version"":""v1"",""created"":""Tue, 9 Nov 1999 17:41:49 GMT""}]","2009-10-31"
"cond-mat/9911131","Hae-Young Kee","Hae-Young Kee, Yong Baek Kim, Kazumi Maki","Collective modes and sound propagation in a p-wave superconductor:
  Sr$_2$RuO$_4$","RevTex, 12 pages, 2 figures, Replaced by the published version","Phys. Rev. B 62, 5877 (2000)","10.1103/PhysRevB.62.5877",,"cond-mat.supr-con cond-mat.str-el",,"  There are five distinct collective modes in the recently discovered p-wave
superconductor Sr$_2$RuO$_4$; phase and amplitude modes of the order parameter,
clapping mode (real and imaginary), and spin wave. The first two modes also
exist in the ordinary s-wave superconductors, while the clapping mode with the
energy $\sqrt{2} \Delta(T)$ is unique to Sr$_2$RuO$_4$ and couples to the sound
wave. Here we report a theoretical study of the sound propagation in a two
dimensional p-wave superconductor. We identified the clapping mode and study
its effects on the longitudinal and transverse sound velocities in the
superconducting state. In contrast to the case of $^3$He, there is no resonance
absorption associated with the collective mode, since in metals $\omega/(v_F
|{\bf q}|) \ll 1$, where $v_F$ is the Fermi velocity, {\bf q} is the wave
vector, and $\omega$ is the frequency of the sound wave. However, the velocity
change in the collisionless limit gets modified by the contribution from the
coupling to the clapping mode. We compute this contribution and comment on the
visibility of the effect. In the diffusive limit, the contribution from the
collective mode turns out to be negligible. The behaviors of the sound velocity
change and the attenuation coefficient near $T_c$ in the diffusive limit are
calculated and compared with the existing experimental data wherever it is
possible. We also present the results for the attenuation coefficients in both
of the collisionless and diffusive limits at finite temperatures.
","[{""version"":""v1"",""created"":""Tue, 9 Nov 1999 17:57:16 GMT""},{""version"":""v2"",""created"":""Mon, 11 Sep 2000 04:50:50 GMT""}]","2009-10-31"
