"math/9911096","Paul Lupascu","Siegmund Kosarew, Paul Lupascu","Moduli of simple holomorphic pairs and effective divisors","10 pages",,,,"math.AG math.DG",,"  In this note we identify two complex structures (one is given by algebraic
geometry, the other by gauge theory) on the set of isomorphism classes of
holomorphic bundles with section on a given compact complex manifold. In the
case of line bundles, these complex spaces are shown to be isomorphic to a
space of effective divisors on the manifold.
","[{""version"":""v1"",""created"":""Sun, 14 Nov 1999 10:02:12 GMT""}]","2007-05-23"
"math/9911097","Alexei N. Parshin","A. N. Parshin","Krichever Correspondence for Algebraic Surfaces","Preprint TU Braunschweig, Bericht 99/17, 15 pages LaTeX2e",,,,"math.AG",,"  In 70's there was discovered a construction how to attach to some
algebraic-geometric data an infinite-dimensional subspace in the space k((z))
of the Laurent power series. The construction was successfully used in the
theory of integrable systems, particularly, for the KP and KdV equations. There
were also found some applications to the moduli of algebraic curves. But there
remained a hard restriction by the case of curves, so by dimension 1. Recently,
it was pointed out by the author that there are some connections between the
theory of the KP-equations and the theory of n-dimensional local fields. From
this point of view it becomes clear that the Krichever construction should have
a generalization to the case of higher dimensions. This generalization is
suggested in the paper for the case of algebraic surfaces.
","[{""version"":""v1"",""created"":""Sun, 14 Nov 1999 10:23:24 GMT""}]","2007-05-23"
"math/9911098","Alexei N. Parshin","A. N. Parshin","On a Ring of Formal Pseudo-differential Operators","LaTeX","Proc. Steklov Math. Inst., 224(1999), 266-280",,,"math.AG",,"  We study the notion of non-commumative higher dimensional local fields. A
simplest example is the ring P of formal pseudo- differential operators. As an
application we extend the KP hierarchy to the space $P^n$.
","[{""version"":""v1"",""created"":""Sun, 14 Nov 1999 10:23:31 GMT""}]","2007-05-23"
"math/9911099","Anna Dioubina","Anna Dioubina","Instability of the virtual solvability and the property of being
  virtually torsion-free for quasi-isometric groups",,,,,"math.GR",,"  We construct examples of groups showing that virtual solvability and the
property of being virtually torsion-free are not preserved by bi-Lipschitz maps
and hence by quasi-isometries.
","[{""version"":""v1"",""created"":""Sun, 14 Nov 1999 12:30:14 GMT""}]","2007-05-23"
"math/9911100","M. V. Movshev","M.V. Movshev (SUNY at Stony Brook)","The structure of a symplectic manifold on the space of loops of
  7-manifold","10 pages, Latex",,,,"math.SG",,"  We define a symplectic structure on the space of non parametrized loops in
$G_2$ manifold. We also develop some basics of intersection theory of
Lagrangian submanifolds.
","[{""version"":""v1"",""created"":""Sun, 14 Nov 1999 15:40:17 GMT""}]","2007-05-23"
"quant-ph/9911062","Igor V. Volovich","I.V. Volovich","Atomic Quantum Computer","5 pages, Latex",,,,"quant-ph cond-mat.mes-hall physics.atom-ph",,"  The current proposals for the realization of quantum computer such as NMR,
quantum dots and trapped ions are based on the using of an atom or an ion as
one qubit. In these proposals a quantum computer consists from several atoms
and the coupling between them provides the coupling between qubits necessary
for a quantum gate. We discuss whether a {\it single} atom can be used as a
quantum computer. Internal states of the atom serve to hold the quantum
information and the spin-orbit and spin-spin interaction provides the coupling
between qubits in the atomic quantum computer. In particular one can use the
electron spin resonance (ESR) to process the information encoded in the
hyperfine splitting of atomic energy levels. By using quantum state engineering
one can manipulate the internal states of the natural or artificial (quantum
dot) atom to make quantum computations.
","[{""version"":""v1"",""created"":""Sun, 14 Nov 1999 04:23:53 GMT""}]","2007-05-23"
"quant-ph/9911063","LiXiang Li","Zheng-Wei Zhou and Guang-Can Guo (University of Science and Technology
  of China)","Disentanglement and Inseparability correlation : in two-qubit system","10 Pages, 2 Figures, REVTeX; to appear in PRA",,"10.1103/PhysRevA.61.032108",,"quant-ph",,"  Started from local universal isotropic disentanglement, a threshold
inequality on reduction factors is proposed, which is necessary and sufficient
for this type of disentanglement processes. Furthermore, we give the conditions
realizing ideal disentanglement processes provided that some information on
quantum states is known. In addition, based on fully entangled fraction, a
concept called inseparability correlation is presented. Some properties on
inseparability correlation coefficient are studied.
","[{""version"":""v1"",""created"":""Sun, 14 Nov 1999 13:07:58 GMT""}]","2009-10-31"
"quant-ph/9911064","C. Y. Chen","C.Y. Chen","Time-dependent Perturbation Theory in Quantum Mechanics","13 pages, No figures",,,,"quant-ph",,"  After revealing difficulties of the standard time-dependent perturbation
theory in quantum mechanics mainly from the viewpoint of practical calculation,
we propose a new quasi-canonical perturbation theory. In the new theory, the
dynamics of physical observables, instead of that of coefficients of
wave-function expansion, is formulated so that the gauge-invariance and
correspondence principles are observed naturally.
","[{""version"":""v1"",""created"":""Sun, 14 Nov 1999 14:29:15 GMT""}]","2007-05-23"
