"astro-ph/9911241","Roberto Battiston","R. Battiston","The Capabilities of the Alpha Magnetic Spectrometer as GeV Gamma-rays
  Detector","12 pages, 5 figures. Invited talk at the Workshop on ""GeV-TeV
  Gamma-Ray Astrophysics"", 13-16 August 1999, Snowbird, Utah",,"10.1063/1.1291413",,"astro-ph",,"  The modeled performance of the Alpha Magnetic Spectrometer (AMS) as a
high-energy (0.3 to 100 GeV) gamma-ray detector is described, and its gamma-ray
astrophysics objectives are discussed.
","[{""version"":""v1"",""created"":""Sat, 13 Nov 1999 16:00:26 GMT""}]","2009-10-31"
"astro-ph/9911242","Karsten Jedamzik","K. Jedamzik (MPA Garching, Germany)","Did the Universe start at Zero Metallicity?","4 pages, to appear in proceedings of The First Stars meeting, held in
  Garching, Germany, August 1999",,"10.1007/10719504_2",,"astro-ph hep-ph",,"  Standard Big Bang nucleosynthesis predicts an essentially zero primordial
metallicity. I speculate on possible metal (i.e. nucleon number A\geq 12)
production in scenarios of inhomogeneous Big Bang nucleosynthesis. It is
conceivable, though not necessarily probable, that some primordial metallicity
is synthesized if a small fraction of all cosmic baryons reside in very
high-density regions. Such conditions could possibly result from the
evaporation of some baryon-number carrying soliton prior to the epoch of Big
Bang nucleosynthesis.
","[{""version"":""v1"",""created"":""Sat, 13 Nov 1999 18:39:22 GMT""}]","2009-10-31"
"astro-ph/9911243","Simon Prunet","S. Prunet, S. K. Sethi, F. R. Bouchet","CMB Polarization Data and Galactic Foregrounds: Estimation of
  Cosmological Parameters","6 pages, submitted to MNRAS",,"10.1046/j.1365-8711.2000.03364.x","CITA-99-40","astro-ph",,"  We estimate the accuracy with which various cosmological parameters can be
determined from the CMB temperature and polarization data when various galactic
unpolarized and polarized foregrounds are included and marginalized using the
multi-frequency Wiener filtering technique. We use the specifications of the
future CMB missions MAP and PLANCK for our study. Our results are in
qualitative agreement with earlier results obtained without foregrounds, though
the errors in most parameters are higher because of degradation of the
extraction of polarization signal in the presence of foregrounds.
","[{""version"":""v1"",""created"":""Sat, 13 Nov 1999 23:55:41 GMT""}]","2009-10-31"
"astro-ph/9911244","Thomas J. Hearty III","T. Hearty, R. Neuhauser, B. Stelzer, M. Fernandez, J.M. Alcala, E.
  Covino, V. Hambaryan","ROSAT PSPC observations of T Tauri stars in MBM12","12 pages, 8 figures",,,,"astro-ph",,"  We present the ROSAT PSPC pointed and ROSAT All-Sky Survey (RASS)
observations and the results of our low and high spectral resolution optical
follow-up observations of the T Tauri stars (TTS) and X-ray selected T Tauri
star candidates in the region of the high galactic latitude dark cloud MBM12
(L1453-L1454, L1457, L1458). Previous observations have revealed 3 ""classical""
T Tauri stars and 1 ""weak-line"" T Tauri star along the line of sight to the
cloud. Because of the proximity of the cloud to the sun, all of the previously
known TTS along this line of sight were detected in the 25 ks ROSAT PSPC
pointed observation of the cloud. We conducted follow-up optical spectroscopy
at the 2.2-meter telescope at Calar Alto to look for signatures of youth in
additional X-ray selected T Tauri star candidates. These observations allowed
us to confirm the existence of 4 additional TTS associated with the cloud and
at least 2 young main sequence stars that are not associated with the cloud and
place an upper limit on the age of the TTS in MBM12 ~ 10 Myr.
  The distance to MBM12 has been revised from the previous estimate of 65+-5 pc
to 65+-35 pc based on results of the Hipparcos satellite. At this distance
MBM12 is the nearest known molecular cloud to the sun with recent star
formation. We estimate a star-formation efficiency for the cloud of 2-24%.
  We have also identified a reddened G9 star behind the cloud with Av ~ 8.4-8.9
mag. Therefore, there are at least two lines of sight through the cloud that
show larger extinctions (Av > 5 mag) than previously thought for this cloud.
This higher extinction explains why MBM12 is capable of star-formation while
most other high-latitude clouds are not.
","[{""version"":""v1"",""created"":""Sun, 14 Nov 1999 06:00:06 GMT""}]","2007-05-23"
"astro-ph/9911246","Murat Ozer sci","Murat \""Ozer","Fate of the Universe, Age of the Universe, Dark Matter, and the Decaying
  Vacuum Energy","AAS LaTex, 29 pages, published in the Astrophysical Journal, 520, 45,
  1999","Astrophys.J. 520 (1999) 45","10.1086/307418",,"astro-ph",,"  It is shown that in the cosmological models based on a vacuum energy decaying
as a^{-2}, where a is the scale factor of the universe, the fate of the
universe in regard to whether it will collapse in future or expand forever is
determined not by the curvature constant k but by an effective curvature
constant k_{eff}. It is argued that a closed universe with k=1 may expand
forever, in other words simulate the expansion dynamics of a flat or an open
universe because of the possibility that k_{eff}=0 or -1, respectively. Two
such models, in one of which the vacuum does not interact with matter and in
another of which it does, are studied. It is shown that the vacuum equation of
state p_{vac}= -\rho_{vac} may be realized in a decaying vacuum cosmology
provided the vacuum interacts wuth matter. The optical depths for gravitational
lensing as a function of the matter density and other parameters in the models
are calculated at a source redshift of 2. The age of the universe is discussed
and shown to be compatible with the new Hipparcos lower limit of 11Gyr. The
possibility that a time-varying vacuum energy may serve as dark matter is
suggested.
","[{""version"":""v1"",""created"":""Sun, 14 Nov 1999 14:30:45 GMT""}]","2009-10-31"
"astro-ph/9911247","Murat Ozer sci","Murat \""Ozer","Is There an Age of the Universe Problem After the Hipparcos Data?","AAS LaTex, 13 pages, 3 figures",,,,"astro-ph",,"  We have reanalyzed the age of the universe problem under the assumption that
the lower limit on the age of the globular clusters is 11Gyr, as predicted by
the recent Hipparcos data. We find that the globular cluster and the expansion
ages in a \lambda=0 universe are consistent only if the present value H_0 of
the Hubble constant is \le 60kms^{-1}Mpc^{-1}. If H_0\ge 60kms^{-1}Mpc^{-1}
some kind of modification of the standard \lambda=0 model is required. Invoking
a (time-independent) cosmological term \lambda in the Einstein field equations,
as has been done frequently before, we have found that due to the gravitational
lensing restrictions a fla universe with the present matter density parameter
\Omega_M <0.5 is not problem free. A nonflat universe with \Omega_M\le 1 does
not suffer from the age problem if H_0\le 75kms^{-1}Mpc^{-1}.
","[{""version"":""v1"",""created"":""Sun, 14 Nov 1999 15:25:10 GMT""}]","2007-05-23"
"cond-mat/9911207","Matthew Kuntz","Matthew C. Kuntz, James P. Sethna","Noise in disordered systems: The power spectrum and dynamic exponents in
  avalanche models","16 pages, 12 figures","Physical Review B 62, 11699 (2000)","10.1103/PhysRevB.62.11699",,"cond-mat.dis-nn cond-mat.mtrl-sci cond-mat.stat-mech",,"  For a long time, it has been known that the power spectrum of Barkhausen
noise had a power-law decay at high frequencies. Up to now, the theoretical
predictions for this decay have been incorrect, or have only applied to a small
set of models. In this paper, we describe a careful derivation of the power
spectrum exponent in avalanche models, and in particular, in variations of the
zero-temperature random-field Ising model. We find that the naive exponent,
(3-tau)/(sigma nu z), which has been derived in several other papers, is in
general incorrect for small tau, when large avalanches are common. (tau is the
exponent describing the distribution of avalanche sizes, and (sigma nu z) is
the exponent describing the relationship between avalanche size and avalanche
duration.) We find that for a large class of avalanche models, including
several models of Barkhausen noise, the correct exponent for tau<2 is 1/(sigma
nu z). We explicitly derive the mean-field exponent of 2. In the process, we
calculate the average avalanche shape for avalanches of fixed duration and
scaling forms for a number of physical properties.
","[{""version"":""v1"",""created"":""Sat, 13 Nov 1999 19:01:52 GMT""},{""version"":""v2"",""created"":""Tue, 7 Aug 2001 20:56:27 GMT""}]","2009-10-31"
"cond-mat/9911208","Vladan Celebonovic","V.Celebonovic (Inst.of Physics,Beograd,Yugoslavia)","Predicting phase transition pressure in solids:a semiclasical
  possibility","somewhat changed paper presented at the NSHP-II International Seminar
  in Dubna (Russia),September 29.-October 2,1999.plain LaTeX",,,,"cond-mat.mtrl-sci",,"  This is a short review of the physical ideas,algorithm for the calculation of
the phase transition pressure and some results of a semi-classical theory of
the behaviour of materials under high pressure proposed by P.Savic and
R.Kasanin.It is base on the Coulomb interaction,supplemented by a microscopic
selection rule and a set of experimentally founded postulates,and it has found
applications from DAC experiments to planetary structure modelling.
","[{""version"":""v1"",""created"":""Sat, 13 Nov 1999 23:03:32 GMT""}]","2007-05-23"
"cond-mat/9911209","Tulika Maitra","Tulika Maitra, A. Taraphder","Gap anisotropy in the angle-resolved photoemission spectroscopy of
  Bi_2Sr_2CaCu_2O_{8+\delta}","8 pages, 7 figures (akw.eps and edc.eps in one panel)","Physica C, Vol. 325, Nos. 1,2 (1999) pp. 61","10.1016/S0921-4534(99)00506-7",,"cond-mat.supr-con cond-mat.str-el",,"  The gap anisotropy in Bi$_2$Sr$_2$CaCu$_2$O$_{8+\delta}$ is revisited in the
framework of a d-wave scenario in view of the recent angle-resolved
photoemission experiment. Based on a tight-binding fit to the normal state
dispersion, a detail analysis on the effects of the inclusion of the next
harmonic in the d-wave has been presented. Significant effect has been observed
in the superconducting T$_c$. The density of states is linear at the nodes with
enhanced weight, caused by a marked increase in the low energy excitaions which
affect the thermodynamics considerably. The slope of the $\rho_s - T$ curve in
the low temperature regime increases and the specific heat reflects the
enhanced entropy at low temperatures. The leading edge of the ARPES energy
distribution curves have been calculated and found to shift towards higher
energy. The effect of scattering by non-magnetic impurities in this context is
also outlined.
","[{""version"":""v1"",""created"":""Sun, 14 Nov 1999 06:06:29 GMT""}]","2009-10-31"
"cond-mat/9911210","Jacques Tempere","J. Tempere, F. Brosens, L. F. Lemmens, J. T. Devreese","Condensation and interaction range in harmonic boson traps: a
  variational approach","14 pages+4 figures, submitted to phys.rev.A","Phys. Rev. A 61, 043605 (2000)","10.1103/PhysRevA.61.043605",,"cond-mat",,"  For a gas of N bosons interacting through a two-body Morse potential a
variational bound of the free energy of a confined system is obtained. The
calculation method is based on the Feynman-Kac functional projected on the
symmetric representation. Within the harmonic approximation a variational
estimate of the effect of the interaction range on the existence of
many-particle bound states, and on the N-T phase diagram is obtained.
","[{""version"":""v1"",""created"":""Sun, 14 Nov 1999 15:30:06 GMT""}]","2009-10-31"
"gr-qc/9911049","Marcelo J. Reboucas","G.I. Gomero, M.J. Reboucas, A.F.F. Teixeira","A Topological Signature in Cosmic Topology","27 pages, 7 figures, LaTeX2e. Inserted: clarifying details, a
  connection with CCP method, new references. To appear in Class. Quantum Grav.
  (2001) in the present form","Class.Quant.Grav. 18 (2001) 1885-1906","10.1088/0264-9381/18/10/306","CBPF-NF-056/99","gr-qc astro-ph hep-th",,"  Two procedures for obtaining (extracting and constructing) the topological
signature of any multiply connected Robertson-Walker (RW) universe are
presented. It is shown through computer-aided simulations that both approaches
give rise to the same topological signature for a multiply connected flat RW
universe. The strength of these approaches is illustrated by extracting the
topological signatures of a flat ($k=0$), an elliptic ($k=1$), and a hyperbolic
($k=-1$) multiply connected RW universes. We also show how separated
contributions of the covering isometries add up to form the topological
signature of a RW flat universe. There emerges from our theoretical results and
simulations that the topological signature arises (in the mean) even when there
are just a few images for each object. It is also shown that the mean pair
separation histogram technique works, and that it is a suitable approach for
studying the topological signatures of RW universes as well as the role of
non-translational isometries.
","[{""version"":""v1"",""created"":""Sat, 13 Nov 1999 17:24:00 GMT""},{""version"":""v2"",""created"":""Fri, 30 Mar 2001 19:17:19 GMT""}]","2009-10-31"
"gr-qc/9911050","Yakov Itin","Yakov Itin","Test compatible metrics and 2-branes","3 pages, 3 figures",,,,"gr-qc",,"  We propose a sufficient condition for a general spherical symmetric static
metric to be compatible with classical tests of gravity. A 1-parametric class
of such metrics are constructed.
  The Schwarzschild metric as well as the Yilmaz-Rosen metric are in this
class.
  By computing the scalar curvature we show that the non-Schwarzschild metrics
can be interpreted as close 2-branes.
  All the manifolds endowed the described metrics contain in a class of
pseudo-Riemannian manifolds with a scalar curvature of a fixed sign.
","[{""version"":""v1"",""created"":""Sun, 14 Nov 1999 13:58:36 GMT""}]","2007-05-23"
"hep-ex/9911017","Edward R. Kinney","HERMES Collaboration: A. Airapetian, et al","Measurement of Longitudinal Spin Transfer to Lambda Hyperons in
  Deep-Inelastic Lepton Scattering","8 pages, 3 figures; new version has an expanded discussion and small
  format changes","Phys.Rev.D64:112005,2001","10.1103/PhysRevD.64.112005","DESY 99-151","hep-ex",,"  Spin transfer in deep-inelastic Lambda electroproduction has been studied
with the HERMES detector using the 27.6 GeV polarized positron beam in the HERA
storage ring. For an average fractional energy transfer <z> = 0.45, the
longitudinal spin transfer from the virtual photon to the Lambda has been
extracted. The spin transfer along the Lambda momentum direction is found to be
0.11 +/- 0.17 (stat) +/- 0.03 (sys); similar values are found for other
possible choices for the longitudinal spin direction of the Lambda. This result
is the most precise value obtained to date from deep-inelastic scattering with
charged lepton beams, and is sensitive to polarized up quark fragmentation to
hyperon states. The experimental result is found to be in general agreement
with various models of the Lambda spin content, and is consistent with the
assumption of helicity conservation in the fragmentation process.
","[{""version"":""v1"",""created"":""Sat, 13 Nov 1999 19:34:04 GMT""},{""version"":""v2"",""created"":""Sun, 28 Nov 1999 23:51:50 GMT""},{""version"":""v3"",""created"":""Mon, 11 Jun 2001 12:51:37 GMT""}]","2009-04-15"
"hep-ph/9911347","Marina Artuso","Marina Artuso","Flavour Physics: the questions, the clues and the challenges","22 pages, 16 figures, Plenary talk at EPS HEP '99, Tampere, Finland,
  July 1999 2nd version: references added",,,,"hep-ph",,"  Flavour physics addresses some of the questions for which the Standard Model
does not provide a satisfactory and complete answer: the origin of the
replication of the fundamental constituents and of their mass hierarchy. This
paper reviews some of the theoretical approaches and the experimental
strategies that can lead us to a more complete picture. Results included in
this review are |V_{cb}|= 0.0382 +/- 0.0032, |V_{ub}/V_{cb}|=0.085 +/- 0.023
and a preliminary measurement of the branching fraction of B -> pi^+ pi ^- =
(0.47 ({+0.18}-{-0.15}) +/- 0.06) x 10^{-5}.}
","[{""version"":""v1"",""created"":""Sat, 13 Nov 1999 16:58:19 GMT""},{""version"":""v2"",""created"":""Wed, 24 Nov 1999 17:00:23 GMT""}]","2007-05-23"
"hep-ph/9911348","Christoph Greub","C. Greub (Bern)","Theory of rare B meson decays","14 pages including 8 postscript figures",,,"BUTP-99/22","hep-ph",,"  I review the NLO QCD calculations of the branching ratio for B--> X_s gamma
in the SM. Including the leading electromagnetic corrections, one obtaines
BR(B-> X_s gamma)=(3.32 +- 0.30)*10^{-4}. Confronting theory with the newest
data, an updated value for |V_{ts}| is obtained: |V_{ts}|=0.037 +- 0.007.
Theoretical progress on the photon energy spectrum is also discussed. The
inclusive FCNC semileptonic decays in the SM are briefly summarized.
Furthermore, B--> X_s gamma is considered in 2HDMs and in different SUSY
scenarios. QCD corrections are shown to be crucial.
","[{""version"":""v1"",""created"":""Sat, 13 Nov 1999 20:53:48 GMT""}]","2007-05-23"
"hep-th/9911100","Schroer","Bert Schroer (CBPF, Rio de Janeiro)","Facts and Fictions about Anti deSitter Spacetimes with Local Qantum
  Matter","this final version is identical to the one which appeared in Commun.
  Math. Phys. 219, (2001) 57-76, an issue of CMP dedicated to the memory of
  Harry Lehmannn","Commun.Math.Phys. 219 (2001) 57-76","10.1007/s002200100419",,"hep-th gr-qc hep-ph math-ph math.MP quant-ph",,"  It is natural to analyse the AdS$_{d+1}$-CQFT$_{d}$ correspondence in the
context of the conformal- compactification and covering formalism. In this way
one obtains additional inside about Rehren's rigorous algebraic holography in
connection with the degree of freedom issue which in turn allows to illustrates
the subtle but important differences beween the original string theory-based
Maldacena conjecture and Rehren's theorem in the setting of an intrinsic
field-coordinatization-free formulation of algebraic QFT. I also discuss
another more generic type of holography related to light fronts which seems to
be closer to 't Hooft's original ideas on holography. This in turn is naturally
connected with the generic concept of ``Localization Entropy'', a quantum
pre-form of Bekenstein's classical black-hole surface entropy.
","[{""version"":""v1"",""created"":""Sun, 14 Nov 1999 15:49:04 GMT""},{""version"":""v2"",""created"":""Thu, 2 Dec 1999 18:36:16 GMT""},{""version"":""v3"",""created"":""Mon, 4 Dec 2000 17:21:39 GMT""},{""version"":""v4"",""created"":""Thu, 7 Jun 2001 13:11:09 GMT""}]","2009-10-31"
"hep-th/9911102","Jack Ng","Y. Jack Ng and H. van Dam (University of North Carolina)","A small but nonzero cosmological constant","A discussion on the form of the cosmological constant (inversely
  proportional to the square of the cosmic scale factor) after the epoch
  corresponding to the redshift $z \sim 1$ is added. Two new references are
  added. This version of the paper will appear in Int. J. Mod. Phys. D","Int.J.Mod.Phys.D10:49-56,2001","10.1142/S0218271801000627",,"hep-th astro-ph gr-qc",,"  Recent astrophysical observations seem to indicate that the cosmological
constant is small but nonzero and positive. The old cosmological constant
problem asks why it is so small; we must now ask, in addition, why it is
nonzero (and is in the range found by recent observations), and why it is
positive. In this essay, we try to kill these three metaphorical birds with one
stone. That stone is the unimodular theory of gravity, which is the ordinary
theory of gravity, except for the way the cosmological constant arises in the
theory. We argue that the cosmological constant becomes dynamical, and
eventually, in terms of the cosmic scale factor $R(t)$, it takes the form
$\Lambda(t) = \Lambda(t_0)(R(t_0)/R(t))^2$, but not before the epoch
corresponding to the redshift parameter $z \sim 1$.
","[{""version"":""v1"",""created"":""Sat, 13 Nov 1999 20:18:09 GMT""},{""version"":""v2"",""created"":""Sun, 28 Nov 1999 20:28:44 GMT""},{""version"":""v3"",""created"":""Fri, 30 Jun 2000 21:08:37 GMT""}]","2011-04-15"
"hep-th/9911103","Jose Tadeu Teles Lunardi","J. T. Lunardi, L. A. Manzoni and B. M. Pimentel","Gauged Thirring Model in the Heisenberg Picture","14 pages, LaTex, no figures","Int.J.Mod.Phys. A15 (2000) 3263","10.1142/S0217751X00001191",,"hep-th",,"  We consider the (2+1)-dimensional gauged Thirring model in the Heisenberg
picture. In this context we evaluate the vacuum polarization tensor as well as
the corrected gauge boson propagator and address the issues of generation of
mass and dynamics for the gauge boson (in the limits of QED$_3$ and Thirring
model as a gauge theory, respectively) due to the radiative corrections.
","[{""version"":""v1"",""created"":""Sat, 13 Nov 1999 21:03:47 GMT""}]","2016-12-21"
"hep-th/9911104","Soonkeon Nam","Soonkeon Nam (Harvard and Kyung Hee Univ.)","Modeling a network of brane worlds","10 pages, TeX, (harvmac, big), corrected typos and added references","JHEP 0003:005,2000","10.1088/1126-6708/2000/03/005","HUTP-99/A062","hep-th hep-ph",,"  We study junctions of supersymmetric domain walls in N=1 supergravity
theories in four dimensions, coupled to a chiral superfield with quartic
superpotential having $Z_3$ symmetry. After deriving a BPS equation of the
domain wall junction, we consider a stable hexagonal configuration of network
of brane junctions, which are only approximately locally BPS. We propose a
model for a mechanism of supersymmetry breaking without loss of stability,
where a messenger for the SUSY breaking comes from the neighboring anti-BPS
junction world, propagating along the domain walls connection them.
","[{""version"":""v1"",""created"":""Sat, 13 Nov 1999 21:58:57 GMT""},{""version"":""v2"",""created"":""Tue, 30 Nov 1999 07:50:07 GMT""}]","2010-02-05"
"math-ph/9911020","Steven L. Liebling","Steven L. Liebling, Eric W. Hirschmann, and James Isenberg","Critical Phenomena in Nonlinear Sigma Models","7 pages, 4 figures; a couple small corrections; a revised discussion
  of the role of the static solution; main conclusions unaltered","J.Math.Phys. 41 (2000) 5691-5700","10.1063/1.533432",,"math-ph gr-qc hep-ph math.AP math.MP",,"  We consider solutions to the nonlinear sigma model (wave maps) with target
space S^3 and base space 3+1 Minkowski space, and we find critical behavior
separating singular solutions from nonsingular solutions. For families of
solutions with localized spatial support a self-similar solution is found at
the boundary. For other families, we find that a static solution appears to sit
at the boundary. This behavior is compared to the black hole critical phenomena
found by Choptuik.
","[{""version"":""v1"",""created"":""Sat, 13 Nov 1999 18:09:50 GMT""},{""version"":""v2"",""created"":""Thu, 1 Jun 2000 18:05:23 GMT""}]","2015-06-26"
"math/9911093","Edward Goldstein","Edward Goldstein","Calibrated Fibrations","28 pages",,,,"math.DG math.AG",,"  In this paper we investigate the geometry of Calibrated submanifolds and
study relations between their moduli-space and geometry of the ambient
manifold. In particular for a Calabi-Yau manifold we define Special Lagrangian
submanifolds for any Kahler metric on it. We show that for a choice of Kahler
metric the Borcea-Voisin threefold has a fibration structure with generic fiber
being a Special Lagrangian torus. Moreover we construct a mirror to this
fibration. Also for any closed G_2 form on a 7-manifold we study coassociative
submanifolds and we show that one example of a G_2 manifold constructed by
Joyce in [10] is a fibration with generic fiber being a coassociative 4-torus.
Similarly we construct a mirror to this fibration.
","[{""version"":""v1"",""created"":""Sat, 13 Nov 1999 20:09:24 GMT""},{""version"":""v2"",""created"":""Thu, 3 Aug 2000 00:53:48 GMT""}]","2007-05-23"
"math/9911094","Martin Sombra","Teresa Krick, Luis Miguel Pardo, Martin Sombra","Sharp estimates for the arithmetic Nullstellensatz","55 pages, LaTeX2e",,,,"math.AG math.AC math.NT",,"  We present sharp estimates for the degree and the height of the polynomials
in the Nullstellensatz over $\Z$. The result improves previous work of
Philippon, Berenstein-Yger and Krick-Pardo.
  We also present degree and height estimates of intrinsic type, which depend
mainly on the degree and the height of the input polynomial system. As an
application, we derive an effective arithmetic Nullstellensatz for sparse
polynomial systems.
  The proof of these results relies heavily on the notion of local height of an
affine variety defined over a number field. We introduce this notion and study
its basic properties.
","[{""version"":""v1"",""created"":""Sun, 14 Nov 1999 03:49:13 GMT""}]","2007-05-23"
"math/9911095","Toshiyuki Tanisaki","Corrado Marastoni, Toshiyuki Tanisaki","Radon transforms for quasi-equivariant D-modules on generalized flag
  manifolds","32 pages",,,,"math.RT math.QA",,"  In this paper we deal with Radon transforms for generalized flag manifolds in
the framework of quasi-equivariant D-modules. We shall follow the method
employed by Baston-Eastwood and analyze the Radon transform using the
Bernstein-Gelfand-Gelfand resolution and the Borel-Weil-Bott theorem. We shall
determine the transform completely on the level of the Grothendieck groups.
Moreover, we point out a vanishing criterion and give a sufficient condition in
order that a D-module associated to an equivariant locally free O-module is
transformed into an object of the same type. The case of maximal parabolic
subgroups of classical simple groups is studied in detail.
","[{""version"":""v1"",""created"":""Sun, 14 Nov 1999 06:51:31 GMT""}]","2007-05-23"
