"astro-ph/9911395","Eli Waxman","E. Waxman (Weizmann Inst.)","High energy cosmic-rays and neutrinos from cosmological gamma-ray burst
  fireballs","Physica Scripta, in press; Talk presented at the Nobel Symposium:
  Particle Physics and The Universe (Sweden, August 1998)","Phys.Scripta T85 (2000) 117-126","10.1238/Physica.Topical.085a00117",,"astro-ph",,"  The recent detection of delayed, low energy emission from Gamma-Ray Burst
(GRB) sources confirmed the cosmological origin of the bursts and provided
support for models where GRBs are produced by the dissipation of the kinetic
energy of relativistic fireballs. In this review, ultra high energy, >10^{19}
eV, cosmic-ray and high energy, 100 TeV, neutrino production in GRBs is
discussed in the light of recent GRB and cosmic-ray observations. Emphasis is
put on model predictions that can be tested with operating and planned
cosmic-ray and neutrino detectors. The predicted neutrino intensity, E^2
dN/dE=3\times 10^{-9} GeV/(cm^2 s sr) for 10^{14} eV<E<10^{16} eV, implies that
a km^2 neutrino detector would observe tens of events per year correlated with
GRBs, and will be able to test for neutrino properties with an accuracy many
orders of magnitude better than is currently possible. The predicted production
rate of high-energy protons, which is consistent with that required to account
for the observed ultra-high-energy cosmic-ray (UHECR) flux, implies that
operating and planned cosmic-ray detectors can test the GRB model for UHECR
production. If the predicted sources are found, cosmic-ray detectors will
provide us with a technique to investigate the inter-galactic magnetic field.
","[{""version"":""v1"",""created"":""Sun, 21 Nov 1999 20:27:59 GMT""}]","2009-10-31"
"astro-ph/9911396","Maurice van Putten","Maurice H. P. M. van Putten (MIT)","Electron-positron outflow from black holes","10 pages LaTex","Phys.Rev.Lett.84:3752-3755,2000","10.1103/PhysRevLett.84.3752",,"astro-ph hep-th",,"  Gamma-ray bursts (GRBs) appear as the brightest transient phenomena in the
Universe. The nature of the central engine in GRBs is a missing link in the
theory of fireballs to their stellar mass progenitors. Here it is shown that
rotating black holes produce electron-positron outflow when brought into
contact with a strong magnetic field. The outflow is produced by a coupling of
the spin of the black hole to the orbit of the particles. For a nearly extreme
Kerr black hole, particle outflow from an initial state of electrostatic
equilibrium has a normalized isotropic emission of $\sim
5\times10^{48}(B/B_c)^2(M/7M_\odot)^2\sin^2\theta$ erg/s, where B is the
external magnetic field strength, B_c=4.4 x 10^{13}G, and M is the mass of the
black hole. This initial outflow has a half-opening angle
$\theta\ge\sqrt{B_c/3B}$. A connection with fireballs in $\gamma$-ray bursts is
given.
","[{""version"":""v1"",""created"":""Sun, 21 Nov 1999 22:53:31 GMT""}]","2008-11-26"
"astro-ph/9911397","Simone Bianchi","Simone Bianchi","Modelling the Far-Infrared emission in spyral galaxies","PhD thesis at Cardiff University, Wales, UK, accepted 16/11/99.
  Supervisor Dr J.I. Davies (Cardiff); Internal examiner Dr A. Whitworth
  (Cardiff); External examiner Dr R. Ivison (University College London). Fig
  4.1, 4.3, Appendix A & B omitted. Full version in
  http://www.arcetri.astro.it/~sbianchi/tesi/thesis.ps.gz",,,,"astro-ph",,"  This thesis presents an original model for the FIR emission in spirals,
developed from an existing radiative transfer code (Bianchi, Ferrara &
Giovanardi, 1996, ApJ, 465, 127). The model's main features are: a complete
treatment of multiple scattering within geometries appropriate for spirals; a
full coverage of spectral range of stellar emission; the use of empirically
determined dust properties (some of which are derived in the present work); the
production of maps of the dust temperature distribution, together with
simulated optical, FIR and sub-millimetre images. The model has been applied to
observations of stellar and dust emission in the galaxy NGC 6946.
  It is found that optically thick models (central face-on optrical depth tau_V
\~ 5) are necessary to explain the observed FIR output. For such models, almost
30-40% of the intrinsic starlight is absorbed. The observed ratio of FIR and
optical scalelengths can be explained if the dust distribution is more extended
than the stellar. However, because of the less steep gradients of optical
emission in optically thick cases, a very extended dust distribution is needed
(alpha_d ~ 3 alpha_s). The distribution of atomic gas in NGC 6946 has a similar
extent.
  I discuss the approximations in the modelling (mainly the use of smooth
distributions against the observed clumpiness of the interstellar medium) and
the implications of the results.
","[{""version"":""v1"",""created"":""Mon, 22 Nov 1999 00:11:41 GMT""}]","2007-05-23"
"astro-ph/9911398","Nicholas Rattenbury","F. Abe, I. Bond, E. Budding, A. Daniel, P. Dobcsanyi, H. Fujii, Z.
  Fujii, N. Hayashida, J. Hearnshaw, K. Hibino, S. Kabe, K. Kasahara, P.
  Kilmartin, S. Laurence, A. Masaike, Y. Matsubara, Y. Muraki, T. Nakamura, G.
  Nankivell, M. Nishizawa, N. Rattenbury, M. Reid, N. Rumsey, M. Sakata, H.
  Sato, M. Sekiguchi, D. Sullivan, M. Teshima, C. Tsai, Y. Yamamoto, T.
  Yanagisawa, P. Yock, T. Yuda, Y. Watase","Test by JANZOS of the Standard Model of Cosmic Ray Acceleration in the
  COMPTEL/ROSAT Supernova Renmant","4 pages, 2 figures","Proceedings of the 26th International Cosmic Ray Conference
  (Utah), Volume 4, page 28, 1999",,,"astro-ph",,"  A search for ultra-high energy gamma-rays emitted by the young, nearby
supernova remnant that was discovered recently by the COMPTEL and ROSAT
satellites was made using the JANZOS database for the period 1987-1993. A 95%
confidence upper limit on the flux above 100 TeV of 3x10^(-13)cm^(-2)sec^(-1)
was obtained. This is an order of magnitude below the expected flux based on
the standard model of cosmic ray acceleration in supernova shocks. An optical
survey of the region that has been commenced is also reported. This uses UK and
ESO Schmidt plates, and CCD images by a NZ/Japan microlensing group.
","[{""version"":""v1"",""created"":""Mon, 22 Nov 1999 01:20:52 GMT""}]","2007-05-23"
"astro-ph/9911399","Schuyler D. Van Dyk","Marcos J. Montes, et al","Radio Observations of SN 1979C: Evidence for Rapid Presupernova
  Evolution","13 pages, 4 figures, to appear in ApJ",,"10.1086/308602",,"astro-ph",,"  We present new radio observations of the supernova SN 1979C made with the VLA
at 20, 6, 3.6, and 2 cm from 1991 July to 1998 October, which extend our
previously published observations (Weiler et al.1986, 1991), beginning 8 days
after optical maximum in 1979 April and continuing through 1990 December. We
find that the radio emission from SN 1979C has stopped declining in flux
density in the manner described by Weiler et al. (1992), and has apparently
entered a new stage of evolution. The observed ``flattening,'' or possible
brightening, of the radio light curves for SN 1979C is interpreted as due to
the SN shock wave entering a denser region of material near the progenitor star
and may be indicative of complex structure in the circumstellar medium
established by the stellar wind from the red supergiant (RSG) progenitor.
","[{""version"":""v1"",""created"":""Mon, 22 Nov 1999 02:15:04 GMT""}]","2016-08-30"
"astro-ph/9911400","Robert J. Smith","R. J. Smith, B. J. Boyle, S. J. Maddox","The environments of intermediate-redshift QSOs: 0.3 < z < 0.7","12 pages, 8 figures, MNRAS TeX macro, to appear to MNRAS",,"10.1046/j.1365-8711.2000.03225.x",,"astro-ph",,"  An angular correlation of low significance (2 sigma) is observed between 0.3
< z < 0.5 QSOs and V < 23 galaxies. Overall, the cross-correlation function
between 82 intermediate-redshift (0.3 < z < 0.7), X-ray selected QSOs and V <
24 galaxies is investigated, but no signal is detected for the z > 0.5 QSOs.
After converting to an excess of galaxies physically associated with the QSO,
this lack of strong correlation is shown to be consistent with the clustering
of normal galaxies at the same moderate redshifts. Combined with previous
observations, these results imply that the environments of radio-quiet QSOs do
not undergo significant evolution with respect to the galaxy population over a
wide range of redshifts (0 < z < 1.5). This is in marked contrast to the rapid
increase in the richness of the environments associated with radio-loud QSOs
over the same redshift range.
","[{""version"":""v1"",""created"":""Mon, 22 Nov 1999 02:31:08 GMT""}]","2009-10-31"
"astro-ph/9911401","Hyun Kyu Lee","Hyun Kyu Lee (1,2), G.E. Brown (2), and R.A.M.J. Wijers (2) ((1)
  Department of Physics, Hanyang University, Seoul Korea (2) Department of
  Physics and Astronomy, State University of New York at Stony Brook, Stony
  Brook, New York, USA)","Issues in the Blandford-Znajek Process for GRB Inner Engine","10 pages, 1 figure, 3 references added, more discussions on the
  magnetic field on the black hole, accepted for publication in ApJ",,"10.1086/308937",,"astro-ph",,"  Several issues regarding the Blandford-Znajek process are discussed to
demonstrate that it can be an effective mechanism for powering the gamma ray
bursts. Using a simple circuit analysis it is argued that the disk power
increases the effective power of the black hole-accretion disk system, although
a part of disk power can be dissipated into black hole entropy. Within the
framework of the force-free magnetosphere with the strong magnetic field, the
magnetically dominated MHD flow is found to support the Blandford-Znajek
process and it is demonstrated that the possible magnetic repulsion by the
rotating black hole will not affect the efficiency substantially.
","[{""version"":""v1"",""created"":""Mon, 22 Nov 1999 09:19:55 GMT""},{""version"":""v2"",""created"":""Wed, 19 Jan 2000 01:24:06 GMT""}]","2009-10-31"
"astro-ph/9911402","Habib Khosroshahi","Habib G. Khosroshahi, Yogesh Wadadekar and Ajit Kembhavi","Correlations among global photometric properties of disk galaxies","14 pages, LaTeX including 14 figures. To appear in the Astrophysical
  Journal",,"10.1086/308654","IUCAA 44/99","astro-ph",,"  Using a two-dimensional galaxy image decomposition technique, we extract
global bulge and disk parameters for a complete sample of early type disk
galaxies in the near infrared K band. We find significant correlation of the
bulge parameter n with the central bulge surface brightness $\mu_b(0)$ and with
effective radius r_e. Using bivar iate analysis techniques, we find that $\log
n$, $\log r_e$ and $\mu_b(0)$ are distributed in a plane with small scatter. We
do not find a strong correlation of n with bulge-to-disk luminosity ratio,
contrary to earlier reports. r_e and the disk scale length r_d are well
correlated for these early type disk galaxies, but with large scatter. We
examine the implications of our results to various bulge formation scenarios in
disk galaxies.
","[{""version"":""v1"",""created"":""Mon, 22 Nov 1999 11:08:21 GMT""}]","2009-10-31"
"astro-ph/9911403","Vladimir Usov","Vladimir V. Usov","Radiating Regions in Pulsar Magnetospheres: From Theory to Observations
  and Back","4 pages, to be published in proceedings of ""Pulsar Astronomy - 2000
  and Beyond"", ASP Conf. Ser",,,,"astro-ph",,"  We discuss plausible locations of radiating regions in the magnetospheres of
pulsars and argue that the mechanisms of pulsar radiation at different
frequencies are closely connected with the locations of the radiating regions,
especially in the radio range. If the region that is responsible for the bulk
of the non-thermal radiation at some frequency is localized in the pulsar
magnetosphere then the nature of this radiation will be either determined or,
at least, restricted significantly.
","[{""version"":""v1"",""created"":""Mon, 22 Nov 1999 11:16:19 GMT""}]","2007-05-23"
"astro-ph/9911404","Bozena Czerny","B. Czerny (Copernicus Astronomical Center), A. Abrassart, S.
  Collin-Souffrin and A.-M. Dumont (Observatoire de Meudon)","Obscuration model of Variability in AGN","to appear in Proc. of 5th Compton Symposium on Gamma-Ray Astronomy
  and Astrophysics",,"10.1063/1.1303243",,"astro-ph",,"  There are strong suggestions that the disk-like accretion flow onto massive
black hole in AGN is disrupted in its innermost part (10-100 Rg), possibly due
to the radiation pressure instability. It may form a hot optically thin quasi
spherical (ADAF) flow surrounded by or containing denser clouds due to the
disruption of the disk. Such clouds might be optically thick, with a Thompson
depth of order of 10 or more. Within the frame of this cloud scenario
(Collin-Souffrin et al. 1996, Czerny & Dumont 1998), obscuration events are
expected and the effect would be seen as a variability. We consider expected
random variability due to statistical dispersion in location of clouds along
the line of sight for a constant covering factor. We discuss a simple
analytical toy model which provides us with the estimates of the mean spectral
properties and variability amplitude of AGN, and we support them with radiative
transfer computations done with the use of TITAN code of Dumont, Abrassart &
Collin (1999) and NOAR code of Abrassart (1999).
","[{""version"":""v1"",""created"":""Mon, 22 Nov 1999 11:41:37 GMT""}]","2009-10-31"
"astro-ph/9911405","Jean-Claude Mermilliod","Jean-Claude Mermilliod, Michel Mayor","Investigation of the Praesepe cluster. III. Radial velocity and binarity
  of the F5-K0 Klein-Wassink stars","10 pages, 3 tables, 7 eps figures. Accepted for A&A. LaTeX",,,"IAUL preprint no 85","astro-ph",,"  Coravel observations of 103 F5-K0 stars in the Praesepe cluster yielded 24
spectroscopic binaries (3 are non-members), and 20 orbits were determined, with
periods from 4 to 7400 days. Based on a complete sample in the colour range
0.40 < B-V < 0.80 (80 stars, including KW 244 = TX Cnc), the companion star
fraction CSF = 0.45. The percentage of spectroscopic binaries with P < 1000d is
20% (16/80). The combined photometric and spectroscopic analysis showed that 12
among 18 single-lined spectroscopic binaries are located within the ""single""
star sequence in the (V,B-V) diagram and cannot be detected by the photometric
analysis in the UBV system. In addition, seven photometrically analysed
binaries were not detected with the radial velocity observations, but are
confirmed members. The number of single:binary:triple stars is 47:30:3.
","[{""version"":""v1"",""created"":""Mon, 22 Nov 1999 14:07:03 GMT""}]","2007-05-23"
"astro-ph/9911406","Paolo Franzetti","A. Boselli, G. Gavazzi, P. Franzetti, D. Pierini, M. Scodeggio","1.65 micrometers (H-band) surface photometry of galaxies.
  IV:observations of 170 galaxies with the Calar Alto 2.2m telescope","11 pages, 6 figures. Accepted for publication in A&AS",,"10.1051/aas:2000325",,"astro-ph",,"  We present near-infrared (H band) surface photometry of 170 galaxies,
obtained in 1997 using the Calar Alto 2.2m telescope equipped with the NICMOS3
camera MAGIC. The majority of our targets are selected among bright members of
the Virgo cluster, however galaxies in the A262 and Cancer clusters and in the
Coma/A1367 supercluster are also included. This data set is aimed at
complementing the NIR survey in the Virgo cluster discussed in Boselli et al.
(1997) and in the Coma Supercluster, presented in Papers I, II and III of this
series. Magnitudes at the optical radius, total magnitudes, isophotal radii and
light concentration indices are derived. (Tables 1 and 2 are only available in
electronic form upon request to gavazzi@uni.mi.astro.it)
","[{""version"":""v1"",""created"":""Mon, 22 Nov 1999 14:19:57 GMT""}]","2009-10-31"
"astro-ph/9911407","Konstantinos Kifonidis","K. Kifonidis (1), T. Plewa (2 and 1), H.-Th. Janka (1), E. Mueller (1)
  ((1) MPA, Garching, Germany, (2) Copernicus Astronomical Center, Warsaw,
  Poland)","The First Five Minutes of a Core Collapse Supernova: Multidimensional
  Hydrodynamic Models","8 pages, LaTeX, 4 postscript figures, to appear in R. Diehl, ed.,
  Proceedings of the Workshop on ""Astronomy with Radioactivities"" held at
  Ringberg Castle, Tegernsee, Germany, Sep. 29th - Oct. 2nd, 1999",,,,"astro-ph",,"  We present results of high-resolution two-dimensional simulations which
follow the first five minutes of a core collapse supernova explosion in a 15
solar mass blue supergiant progenitor. The computations start shortly after
core bounce and include neutrino-matter interactions by using a light-bulb
approximation for the neutrinos, and a treatment of the nucleosynthesis due to
explosive silicon and oxygen burning. We find that newly formed iron-group
elements are distributed throughout a significant fraction of the stellar
helium core by the concerted action of convective and Rayleigh-Taylor
instabilities. Fast moving nickel mushrooms with velocities up to 4000 km/s are
observed. A continuation of the calculations to later times, however,
indicates, that the iron velocities observed in SN 1987 A cannot be reproduced
due to a strong deceleration of the clumps during their interaction with the
dense shell left behind by the shock at the He/H interface. Therefore, we
cannot confirm the claim that convective ""premixing"" of the nickel in the early
phases of the explosion solves the problem of the high iron velocities.
","[{""version"":""v1"",""created"":""Mon, 22 Nov 1999 14:25:13 GMT""}]","2007-05-23"
"astro-ph/9911408","Julia Kopeikina","Sergei M. Kopeikin (Dept. of Phys. and Astron., Univ.
  Missouri-Columbia) and Vladimir A. Potapov (Astro Space Center of P.N.
  Lebedev Phys. Inst., Moscow)","Binary Pulsar Tests of General Relativity in the Presence of
  Low-Frequency Noise","4 pages, contributed paper to the proceedings of the IAU167
  colloquium on pulsars, Bonn, August-September 1999",,,,"astro-ph",,"  The influence of the low-frequency timing noise on the precision of
measurements of the Keplerian and post-Keplerian orbital parameters in binary
pulsars is studied. Fundamental limits on the accuracy of tests of alternative
theories of gravity in the strong-field regime are established. The
gravitational low-frequency timing noise formed by an ensemble of binary stars
is briefly discussed.
","[{""version"":""v1"",""created"":""Mon, 22 Nov 1999 14:34:43 GMT""}]","2007-05-23"
"astro-ph/9911409","Paolo Franzetti","G. Gavazzi, P. Franzetti, M. Scodeggio, A. Boselli, D. Pierini, C.
  Baffa, F. Lisi, L.K. Hunt","1.65 micrometers (H-band) surface photometry of galaxies. III:
  observations of 558 galaxies with the TIRGO 1.5m telescope","12 pages, 6 figures. Accepted for publication in A&AS",,"10.1051/aas:2000326",,"astro-ph",,"  We present near-infrared H-band (1.65 micron) surface photometry of 558
galaxies in the Coma Supercluster and in the Virgo cluster. This data set,
obtained with the Arcetri NICMOS3 camera ARNICA mounted on the Gornergrat
Infrared Telescope, is aimed at complementing, with observations of mostly
early-type objects, our NIR survey of spiral galaxies in these regions,
presented in previous papers of this series. Magnitudes at the optical radius,
total magnitudes, isophotal radii and light concentration indices are derived.
We confirm the existence of a positive correlation between the near-infrared
concentration index and the galaxy H-band luminosity. (Tables 1 and 2 are only
available in electronic form upon request to gavazzi@uni.mi.astro.it)
","[{""version"":""v1"",""created"":""Mon, 22 Nov 1999 14:50:53 GMT""}]","2009-10-31"
"astro-ph/9911410","Carraro Giovanni","Giovanni Carraro, Antonella Vallenari","A photometric study of the intermediate age open cluster King 5","7 pages, 6 eps figures, accepted for pubblication in Astronomy and
  Astrophysics",,"10.1051/aas:2000137",,"astro-ph",,"  We report on near IR (J and K bands) observations of an $8^{\prime} \times
8^{\prime}$ region centered on the poorly studied open cluster King 5, for
which only optical photometry existed. We found that the cluster is of moderate
age (1.0 Gry old), intermediate in age between the Hyades and NGC 752.
Combining optical and IR photometry we obtain estimates for cluster parameters.
The color excess E(J-K), E(V-I) and E(V-K) are 0.50, 1.10 and 2.45,
respectively. The true distance modulus turns out to be $(m-M)_0) = 11.40\pm
0.15$. As a consequence, King 5 is 1.9 kpc far from the Sun.
","[{""version"":""v1"",""created"":""Mon, 22 Nov 1999 15:07:31 GMT""}]","2009-10-31"
"astro-ph/9911411","Bohdan Novosyadlyj","Yu. Chornij and B. Novosyadlyj (Astron. Observ. of L'viv univ.)","Evolution of a correlation function of QSOs and the initial power
  spectrum of density fluctuations","4 pages, 3 figers (Proceedings of Gamow Memorial International
  Conference ""The Universe of Gamow: Origional Ideas in Astrophysics and
  Cosmology"", Odessa, August 16-22, 1999; to be published in ""Odessa Astron.
  Publ."", v.12, 1999)",,,,"astro-ph",,"  The evolution of two-point space correlation function of QSOs is analyzed in
the framework of the theory of the large scale structure formation. For given
cosmological models the agreement between theoretical predictions and
observational data on correlation function of QSOs is achieved by determination
of scales of structures R(z), in which could be formed quasars at different
redshifts z. It is shown that quasars could be formed in the nucleus of massive
galaxies or groups of galaxies owing to merges at their central region. It
depends on an amplitude of the power spectrum of the initial matter density
fluctuations at galaxy-cluster scales.
","[{""version"":""v1"",""created"":""Mon, 22 Nov 1999 15:16:25 GMT""}]","2007-05-23"
"cond-mat/9911325","Kwai-Kong Ng","Kwai-Kong Ng and Manfred Sigrist (Yukawa Institute for Theoretical
  Physics)","The role of spin-orbit coupling for the superconducting state in
  Sr_2RuO_4","7 pages, 1 figure, accepted by Europhys. Lett",,"10.1209/epl/i2000-00173-x",,"cond-mat.supr-con cond-mat.str-el",,"  The odd-parity spin-triplet Cooper pairing states show a six-fold degeneracy
for a quasi-two-dimensional electron system. In this article we show how
spin-orbit coupling can lift this degeneracy for Sr_2RuO_4 taking the band
structure based on the three relevant t_{2g}-orbitals of the Ru-ions into
account. The stabilized state depends on the relative strength of the pairing
interaction. We show that under reasonable assumptions the chiral pairing state
d(k) = z(k_x +/- i k_y) is favored against the others.
","[{""version"":""v1"",""created"":""Mon, 22 Nov 1999 02:48:35 GMT""}]","2009-10-31"
"cond-mat/9911331","J. K. Jain","Xiaomin Zu, Kwon Park, and Jainendra K. Jain","Masses of composite fermions carrying two and four flux quanta:
  Differences and similarities","5 pages, 2 figures",,"10.1103/PhysRevB.61.R7850",,"cond-mat.mes-hall",,"  This study provides a theoretical rationalization for the intriguing
experimental observation regarding the equality of the normalized masses of
composite fermions carrying two and four flux quanta, and also demonstrates
that the mass of the latter type of composite fermion has a substantial filling
factor dependence in the filling factor range $4/17 > \nu > 1/5$, in agreement
with experiment, originating from the relatively strong inter-composite fermion
interactions here.
","[{""version"":""v1"",""created"":""Sun, 21 Nov 1999 16:45:52 GMT""}]","2009-10-31"
"cond-mat/9911332","Robert Pelcovits","Jeffrey L. Billeter and Robert A. Pelcovits","Defect configurations and dynamical behavior in a Gay-Berne nematic
  emulsion","17 pages, 15 figures","Phys. Rev. E 62, 711 (2000)","10.1103/PhysRevE.62.711",,"cond-mat.soft",,"  To model a nematic emulsion consisting of a surfactant-coated water droplet
dispersed in a nematic host, we performed a molecular dynamics simulation of a
droplet immersed in a system of 2048 Gay-Berne ellipsoids in a nematic phase.
Strong radial anchoring at the surface of the droplet induced a Saturn ring
defect configuration, consistent with theoretical predictions for very small
droplets. A surface ring configuration was observed for lower radial anchoring
strengths, and a pair of point defects was found near the poles of the droplet
for tangential anchoring. We also simulated the falling ball experiment and
measured the drag force anisotropy, in the presence of strong radial anchoring
as well as zero anchoring strength.
","[{""version"":""v1"",""created"":""Sun, 21 Nov 1999 19:52:03 GMT""}]","2009-10-31"
"cond-mat/9911333","Akira Shimizu","Akira Shimizu and Hiroaki Kato (Department of Basic Science, Univ.
  Tokyo, Komaba)","Nonequilibrium Mesoscopic Conductors Driven by Reservoirs","14 pages, 4 figures Proc. 219th Int. WEH Workshop in Hamburg,
  Germany, 1999","Low-Dimensional Systems (ed. T. Brandes, Lecture Notes in Physics,
  54 (2000), Springer 2000) pp. 3-22",,,"cond-mat.mes-hall chao-dyn cond-mat.stat-mech nlin.CD",,"  In order to specify a nonequilibrium steady state of a quantum wire (QWR),
one must connect reservoirs to it. Since reservoirs should be large 2d or 3d
systems, the total system is a large and inhomogeneous 2d or 3d system, in
which e-e interactions have the same strength in all regions. However, most
theories of interacting electrons in QWR considered simplified 1d models, in
which reservoirs are absent or replaced with noninteracting 1d leads. We first
discuss fundamental problems of such theories in view of nonequilibrium
statistical mechanics. We then present formulations which are free from such
difficulties, and discuss what is going on in mesoscopic systems in
nonequilibrium steady state. In particular, we point out important roles of
energy corrections and non-mechanical forces, which are induced by a finite
current.
","[{""version"":""v1"",""created"":""Mon, 22 Nov 1999 03:15:50 GMT""}]","2016-06-21"
