"hep-ph/9911426","Pierre Marage","P. Marage","Hadronic structure, low x physics and diffraction","Plenary report presented at the Int. Europhys. Conf. on HEP,
  EPS-HEP99, Tampere, Finland, July 1999; 21 pages, 45 figures, 110 references",,,,"hep-ph",,"  A review is presented of numerous recent results, particularly those
submitted to the EPS-HEP99 conference: very high Q^2 ep interactions and direct
tests of the Standard Model, new measurements of the structure of the proton
(including high x parton distributions and tests of QCD involving the gluon
distribution), low x physics (tests of the BFKL evolution), diffraction in DIS
at HERA, hard diffraction at the Tevatron and exclusive production of vector
particles at HERA. The focus is on hard QCD features.
","[{""version"":""v1"",""created"":""Sun, 21 Nov 1999 18:01:35 GMT""}]","2007-05-23"
"hep-ph/9911429","Gronau Michael","Michael Gronau","Electroweak penguin amplitudes and constraints on $\gamma$ in charmless
  $B\to VP$ decays","19 pages, additional comments on factorization, to appear in Physical
  Review D",,"10.1103/PhysRevD.62.014031",,"hep-ph",,"  Electroweak penguin (EWP) amplitudes are studied model-independently in $B$
meson decays to charmless final states consisting of a vector meson ($V$) and a
pseudoscalar meson ($P$). A set of SU(3) relations is derived between EWP
contributions and tree amplitudes, in the approximation of retaining only the
dominant EWP operators $Q_9$ and $Q_{10}$ . Two applications are described for
constraining the weak phase $\gamma$, in $B^{\pm}\to \rho^{\pm} K^0$ and
$B^{\pm}\to \rho^0 K^{\pm}$ (or $B^{\pm}\to K^{*\pm}\pi^0$ and $B^{\pm}\to
K^{*0}\pi^{\pm}$), and in $B^0\to K^{*\pm}\pi^{\mp}$ and $B^{\pm}\to\phi
K^{\pm}$. Theoretical uncertainties are discussed.
","[{""version"":""v1"",""created"":""Sun, 21 Nov 1999 17:08:16 GMT""},{""version"":""v2"",""created"":""Tue, 30 Nov 1999 11:26:40 GMT""},{""version"":""v3"",""created"":""Thu, 23 Mar 2000 10:41:43 GMT""}]","2009-10-31"
"hep-ph/9911430","Kenichiro Aoki","Kenichiro Aoki and Dimitri Kusnezov","Classical $\phi^4$ Lattice Field Theory in Strong Thermal Gradients","4pp, 4 figs, Talk given by K.A. at the Thermal Field Theory
  Conference, Kyoto, August 1999",,,,"hep-ph",,"  The dynamics of classical $\phi^4$ theory under weak and strong thermal
gradients is studied. We obtain the thermal conductivity of the theory
including its temperature dependence. Under moderately strong thermal
gradients, the temperature profiles become visibly non-linear, yet the
phenomenon can be understood using the linear response theory. When we move
further away from equilibrium, we find that the linear response theory
eventually breaks down, and the concept of local equilibrium also fails.
","[{""version"":""v1"",""created"":""Mon, 22 Nov 1999 01:43:15 GMT""}]","2007-05-23"
"hep-ph/9911431",,"Y. Nemoto, K. Naito, M. Oka","Effective Potential of O(N) Linear Sigma Model at Finite Temperature","31 pages, LaTeX, 10 eps figures, uses epsf.sty","Eur.Phys.J.A9:245-259,2000","10.1007/s100500070042",,"hep-ph",,"  We study the O(N) symmetric linear sigma model at finite temperature as the
low-energy effective models of quantum chromodynamics(QCD) using the
Cornwall-Jackiw-Tomboulis(CJT) effective action for composite operators. It has
so far been claimed that the Nambu-Goldstone theorem is not satisfied at finite
temperature in this framework unless the large N limit in the O(N) symmetry is
taken. We show that this is not the case. The pion is always massless below the
critical temperature, if one determines the propagator within the form such
that the symmetry of the system is conserved, and defines the pion mass as the
curvature of the effective potential. We use a new renormalization prescription
for the CJT effective potential in the Hartree-Fock approximation. A numerical
study of the Schwinger-Dyson equation and the gap equation is carried out
including the thermal and quantum loops. We point out a problem in the
derivation of the sigma meson mass without quantum correction at finite
temperature. A problem about the order of the phase transition in this approach
is also discussed.
","[{""version"":""v1"",""created"":""Mon, 22 Nov 1999 03:27:23 GMT""}]","2014-11-17"
"hep-ph/9911433","V. Zoller","N.N.Nikolaev, J.Speth and V.R.Zoller","The color dipole BFKL-Regge expansion: from DIS on protons to pions to
  rise of hadronic cross sections","12 pages Latex 2 PS figures, Revised version accepted for publication
  in Physics Letters B","Phys.Lett. B473 (2000) 157-166","10.1016/S0370-2693(99)01474-4","ITEP-PH-5/99, FZ-IKP(TH)-1999-32","hep-ph",,"  As noticed by Fadin, Kuraev and Lipatov in 1975 incorporation of asymptotic
freedom into the BFKL equation splits the QCD pomeron into a series of isolated
poles in complex angular momentum plane. Following our earlier work on the
proton structure function we explore the phenomenological consequences of the
emerging BFKL-Regge factorized expansion for the small-$x$ structure function
of the pion $F_{2\pi}(x,Q^2)$. We calculate $F_{2\pi}$ in a small-$x$ region
and find good agreement with the recent H1 determination of $F_{2\pi}(x,Q^2)$.
We also present the BFKL-Regge factorization based evaluation of the
contribution from hard scattering to the observed rise of the $NN$, $\pi N$ and
real photo-absorption $\gamma N$ and $\gamma \pi$ total cross sections.
","[{""version"":""v1"",""created"":""Mon, 22 Nov 1999 10:10:59 GMT""},{""version"":""v2"",""created"":""Wed, 22 Dec 1999 18:56:51 GMT""}]","2009-10-31"
"hep-ph/9911434","Matthias Steinhauser","K.G. Chetyrkin and M. Steinhauser","The relation between the $\bar{\rm MS}$ and the on-shell quark mass at
  order $\alpha_s^3$","38 pages, misprint in eq.(22) fixed, few references updated and a
  note added about a recent confirmation of our main results by Melnikov and
  van Ritbergen (hep-ph/9912391)","Nucl.Phys.B573:617-651,2000","10.1016/S0550-3213(99)00784-1","DESY 99--174, TTP99--47","hep-ph",,"  The relation between the on-shell and $\bar{\rm MS}$ mass can be expressed
through scalar and vector part of the quark propagator. In principle these
two-point functions have to be evaluated on-shell which is a non-trivial task
at three-loop order. Instead, we evaluate the quark self energy in the limit of
large and small external momentum and use conformal mapping in combination with
Pad\'e improvement in order to construct a numerical approximation for the
relation [1]. The errors of our final result are conservatively estimated to be
below 3%. The numerical implications of the results are discussed in particular
in view of top and bottom quark production near threshold. We show that the
knowledge of new ${\cal O}(\alpha_s^3)$ correction leads to a significant
reduction of the theoretical uncertainty in the determination of the quark
masses.
","[{""version"":""v1"",""created"":""Mon, 22 Nov 1999 12:42:54 GMT""},{""version"":""v2"",""created"":""Thu, 13 Jan 2000 10:10:35 GMT""},{""version"":""v3"",""created"":""Tue, 6 Jun 2000 06:24:14 GMT""}]","2008-11-26"
"hep-th/9911163","Alex Lewis","Alex Lewis","Logarithmic Operators in AdS_3/CFT_2","8 pages, Latex. Minor changes, references added","Phys.Lett. B480 (2000) 348-354","10.1016/S0370-2693(00)00390-7",,"hep-th",,"  We discuss the relation between singletons in AdS_3 and logarithmic operators
in the CFT on the boundary. In 2 dimensions there can be more logarithmic
operators apart from those which correspond to singletons in AdS, because
logarithmic operators can occur when the dimensions of primary fields differ by
an integer instead of being equal. These operators may be needed to account for
the greybody factor for gauge bosons in the bulk.
","[{""version"":""v1"",""created"":""Mon, 22 Nov 1999 15:05:04 GMT""},{""version"":""v2"",""created"":""Tue, 30 Nov 1999 22:23:37 GMT""}]","2009-10-31"
"hep-th/9911164","Robert C. Myers","C.P. Burgess, R.C. Myers and F. Quevedo","A Naturally Small Cosmological Constant on the Brane?","7 pages. Powercounting arguments clarified, and comparison between
  the induced cosmological constant and supersymmetric mass splittings made
  more explicit","Phys.Lett. B495 (2000) 384-393","10.1016/S0370-2693(00)01255-7","McGill-98/37, DAMTP-1998-173","hep-th",,"  There appears to be no natural explanation for the cosmological constant's
small size within the framework of local relativistic field theories. We argue
that the recently-discussed framework for which the observable universe is
identified with a p-brane embedded within a higher-dimensional `bulk'
spacetime, has special properties that may help circumvent the obstacles to
this understanding. This possibility arises partly due to several unique
features of the brane proposal. These are: (1) the potential such models
introduce for partially breaking supersymmetry, (2) the possibility of having
low-energy degrees of freedom which are not observable to us because they are
physically located on a different brane, (3) the fundamental scale may be much
smaller than the Planck scale. Furthermore, although the resulting cosmological
constant in the scenarios we outline is naturally suppressed by weak coupling
constants of gravitational strength, it need not be exactly zero, raising the
possibility it could be in the range favoured by recent cosmological
observations.
","[{""version"":""v1"",""created"":""Sun, 21 Nov 1999 18:05:45 GMT""},{""version"":""v2"",""created"":""Wed, 22 Dec 1999 20:04:34 GMT""},{""version"":""v3"",""created"":""Sat, 1 Jul 2000 23:15:53 GMT""}]","2009-10-31"
"hep-th/9911165","Shinji Mukohyama","Shinji Mukohyama","Brane-world solutions, standard cosmology, and dark radiation","Latex, 5 pages; references are added, accepted for publication in
  Physics Letters B; references are added again","Phys.Lett. B473 (2000) 241-245","10.1016/S0370-2693(99)01505-1",,"hep-th gr-qc",,"  New exact solutions of brane-world cosmology are given. These solutions
include an arbitrary constant C, which is determined by the geometry outside
the brane and which affects the cosmological evolution in the brane-world. If C
is zero, then the standard cosmology governs the brane-world as a low-energy
effective cosmological theory. However, if C is not zero, then even in
low-energy the brane-world cosmology gives predictions different from the
standard one. The difference can be understood as ``dark radiation'', which is
not real radiation but alters cosmological evolutions.
","[{""version"":""v1"",""created"":""Mon, 22 Nov 1999 03:39:01 GMT""},{""version"":""v2"",""created"":""Thu, 16 Dec 1999 16:27:48 GMT""},{""version"":""v3"",""created"":""Fri, 17 Dec 1999 17:05:45 GMT""}]","2009-10-31"
"hep-th/9911166","Zupnik B. M.","B.M. Zupnik","Goldstone-type superfields and partial spontaneous breaking of D=3, N=2
  supersymmetry","LATEX file, 8 pages","Phys.Lett. B461 (1999) 203-208","10.1016/S0370-2693(99)00855-2",,"hep-th",,"  We consider the modified superfield constraints with constant terms for the
D=3, N=2 Goldstone-Maxwell gauge multiplet which contains Goldstone fermions,
real scalar and vector fields. The partial spontaneous breaking N=2 to N=1 is
possible for the non-minimal self-interaction of this modified gauge superfield
including the linear Fayet-Iliopoulos term. The dual description of the partial
breaking in the model of the self-interacting Goldstone chiral superfield is
also discussed.
","[{""version"":""v1"",""created"":""Mon, 22 Nov 1999 10:53:25 GMT""}]","2009-10-31"
"hep-th/9911167","Shoichi Ichinose","G.W.Gibbons and S.Ichinose","The Finiteness Requirement for Six-Dimensional Euclidean Einstein
  Gravity","15 pages, Introduction is improved, many figures(eps)","Class.Quant.Grav.17:2129-2138,2000","10.1088/0264-9381/17/10/307","LPTENS-99.48,AEI-1999-37","hep-th gr-qc",,"  The finiteness requirement for Euclidean Einstein gravity is shown to be so
stringent that only the flat metric is allowed. We examine counterterms in 4D
and 6D Ricci-flat manifolds from general invariance arguments.
","[{""version"":""v1"",""created"":""Mon, 22 Nov 1999 13:05:02 GMT""},{""version"":""v2"",""created"":""Sun, 6 Feb 2000 05:31:05 GMT""}]","2016-09-06"
"hep-th/9911168","Dr. Alexander Kirillov","A.A. Kirillov","Effects related to spacetime foam in particle physics","18 pages, minor corrections added to the published variant","Sov.Phys.JETP 88 (1999) 1051-1057; Zh.Eksp.Teor.Fiz. 115 (1999)
  1921-1934","10.1134/1.558891",,"hep-th gr-qc",,"  It is found that the existence of spacetime foam leads to a situation in
which the number of fundamental quantum bosonic fields is a variable quantity.
The general aspects of an exact theory that allows for a variable number of
fields are discussed, and the simplest observable effects generated by the foam
are estimated. It is shown that in the absence of processes related to
variations in the topology of space, the concept of an effective field can be
reintroduced and standard field theory can be restored. However, in the
complete theory the ground state is characterized by a nonvanishing particle
number density. From the effective-field standpoint, such particles are ""dark"".
It is assumed that they comprise dark matter of the universe. The properties of
this dark matter are discussed, and so is the possibility of measuring the
quantum fluctuation in the field potentials.
","[{""version"":""v1"",""created"":""Mon, 22 Nov 1999 15:02:20 GMT""}]","2009-10-31"
"math/9911160","Eric Todd Quinto","Mark L. Agranovsky (Bar Ilan University), Eric Todd Quinto (Tufts
  University)","Geometry of Stationary Sets for the Wave Equation in R^n, The Case of
  Finitely Supported Initial Data, An Announcement","9 pages, AMSTeX version 2.1",,,,"math.AP",,"  We consider the Cauchy problem for the wave equation in the whole space, R^n,
with initial data which are distributions supported on finite sets. The main
result is a precise description of the geometry of the sets of stationary
points of the solutions to the wave equation.
","[{""version"":""v1"",""created"":""Sun, 21 Nov 1999 18:40:13 GMT""}]","2007-05-23"
"math/9911161","Ziv Ran","Ziv Ran","Beyond a conjecture of Clemens","Statements and proofs have been modified. In some cases the results
  are now stronger. In particular, we prove that a generic sextic 3-fold
  contains no rational or elliptic curves, and no nondegenerate curves of genus
  2, which goes beyond Clemens' original conjecture",,,,"math.AG",,"  We prove some lower bounds on certain twists of the canonical bundle of a
codimension-2 subvariety of a generic hypersurface in projective space. In
particular we prove that the generic sextic threefold contains no rational or
elliptic curves and no nondegenerate curves of genus 2.
","[{""version"":""v1"",""created"":""Sun, 21 Nov 1999 21:23:07 GMT""},{""version"":""v2"",""created"":""Wed, 3 May 2000 17:46:25 GMT""}]","2007-05-23"
"math/9911162","Pablo A. Ferrari","Roberto Fernandez, Pablo A. Ferrari, Nancy Garcia","Perfect simulation for interacting point processes, loss networks and
  Ising models","Revised version after referee of SPA: 39 pages","Stochastic Process. Appl. 102 (2002), no. 1, 63--88","10.1016/S0304-4149(02)00180-1",,"math.PR math-ph math.MP",,"  We present a perfect simulation algorithm for measures that are absolutely
continuous with respect to some Poisson process and can be obtained as
invariant measures of birth-and-death processes. Examples include area- and
perimeter-interacting point processes (with stochastic grains), invariant
measures of loss networks, and the Ising contour and random cluster models. The
algorithm does not involve couplings of the process with different initial
conditions and it is not tied up to monotonicity requirements. Furthermore, it
directly provides perfect samples of finite windows of the infinite-volume
measure, subjected to time and space ``user-impatience bias''. The algorithm is
based on a two-step procedure: (i) a perfect-simulation scheme for a (finite
and random) relevant portion of a (space-time) marked Poisson processes (free
birth-and-death process, free loss networks), and (ii) a ``cleaning'' algorithm
that trims out this process according to the interaction rules of the target
process. The first step involves the perfect generation of ``ancestors'' of a
given object, that is of predecessors that may have an influence on the
birth-rate under the target process. The second step, and hence the whole
procedure, is feasible if these ``ancestors'' form a finite set with
probability one. We present a sufficiency criteria for this condition, based on
the absence of infinite clusters for an associated (backwards) oriented
percolation model.
","[{""version"":""v1"",""created"":""Mon, 22 Nov 1999 07:48:03 GMT""},{""version"":""v2"",""created"":""Tue, 24 Oct 2000 17:58:24 GMT""},{""version"":""v3"",""created"":""Fri, 16 Aug 2002 11:22:27 GMT""}]","2011-11-10"
"math/9911163","Erik Koelink","Erik Koelink, Jasper Stokman and Mizan Rahman","Fourier transforms on the quantum SU(1,1) group","77 pages, 1 figure. Appendix by Mizan Rahman","Publ. Res. Inst. Math. Sci., Kyoto Univ. 37 (2001), 621-715",,,"math.QA math.CA",,"  The main goal is to interpret the Askey-Wilson function and the corresponding
transform pair on the quantum SU(1,1) group. A weight on the C^*-algebra of
continuous functions vanishing at infinity on the quantum SU(1,1) group is
studied, which is left and right invariant in a weak sense with respect to a
product defined using Wall functions. The Haar weight restricted to certain
subalgebras are explicitly determined in terms of an infinitely supported
Jackson integral and in terms of an infinitely supported Askey-Wilson type
measure. For the evaluation the spectral analysis of explicit unbounded doubly
infinite Jacobi matrices and some new summation formulas for basic
hypergeometric series are needed. The spherical functions are calculated in
terms of Askey-Wilson functions and big q-Jacobi functions. The corresponding
spherical Fourier transforms are identified with special cases of the big
q-Jacobi function transform and of the Askey-Wilson function transform.
","[{""version"":""v1"",""created"":""Mon, 22 Nov 1999 11:05:06 GMT""}]","2009-03-10"
"math/9911164","Daisuke Matsushita","Daisuke Matsushita","On singular fibres of complex Lagrangian fibrations","13 pages 2 figures",,,,"math.AG",,"  We classify singular fibres over general points of the discriminant locus of
projective complex Lagrangian fibrations on 4-dimensional holomorphic
symplectic manifolds. The singular fibre F is the following either one: F is
isomorphic to the product of an elliptic curve and a Kodaira singular fibre up
to finite unramified covering or F is a normal crossing variety consisting of
several copies of a minimal elliptic ruled surface of which the dual graph is
Dynkin diagram of type A_n, $\tilde{A_n}$, $\tilde{D_n}$ or D_n.
","[{""version"":""v1"",""created"":""Mon, 22 Nov 1999 12:32:40 GMT""}]","2007-05-23"
"math/9911166","Daisuke Matsushita","Daisuke Matsushita","Equidimensionality of complex Lagrangian fibrations","2 pages",,,,"math.AG",,"  We prove that every irreducible component of a fibre of a complex Lagrangian
fibration is Lagrangian subvariety.
  Especially, complex Lagrangian fibations are equidimensional.
","[{""version"":""v1"",""created"":""Mon, 22 Nov 1999 12:17:39 GMT""},{""version"":""v2"",""created"":""Tue, 23 Nov 1999 09:01:21 GMT""}]","2016-09-07"
"nucl-th/9911070","Shadow J. Q. Robinson","Shadow J.Q. Robinson, L. Zamick, Y.Y. Sharon","Do Rotational Bands Extend Beyond the Shell Model Limit - The Strange
  Case of the J=6^{+}_{1} in ^{8}Be","This paper has been withdrawn by the authors as we await a larger
  model space calculation",,,,"nucl-th",,"  This paper has been withdrawn by the authors as we await a larger model space
calculation.
","[{""version"":""v1"",""created"":""Mon, 22 Nov 1999 15:25:34 GMT""},{""version"":""v2"",""created"":""Thu, 9 Dec 1999 14:16:58 GMT""},{""version"":""v3"",""created"":""Tue, 11 Jan 2000 22:29:14 GMT""}]","2007-05-23"
"nucl-th/9911071","Yuichiro Tanushi","Y. Tanushi, S. Saito and M. Uehara","One-loop calculations of hyperon polarizabilities under the large N_c
  consistency condition","17 pages, REVTeX, no figures","Phys.Rev. C61 (2000) 055204","10.1103/PhysRevC.61.055204","DPNU-99-34","nucl-th hep-ph",,"  The spin-averaged electromagnetic polarizabilities of the hyperons $\Lambda$
and $\Sigma$ are calculated within the one-loop approximation by use of the
dispersion theory. The photon and meson couplings to hyperons are determined so
as to satisfy the large N_c consistency condition. It is shown that in order
for the large N_c consistency condition to hold exotic hyperon states such as
$\Sigma^{**}$ with I=2 and J=3/2 are required in the calculation of the
magnetic polarizability of the $\Sigma$ state.
","[{""version"":""v1"",""created"":""Mon, 22 Nov 1999 12:51:03 GMT""}]","2009-10-31"
"nucl-th/9911072","Hanns L. Harney","C.I. Barbosa, T. Guhr, and H.L. Harney","The Impact of Isospin Breaking on the Distribution of Transition
  Probabilities","16 pages, 8 figures, submitted to PRE","Phys.Rev. E62 (2000) 1936-1949","10.1103/PhysRevE.62.1936",,"nucl-th chao-dyn cond-mat nlin.CD",,"  In the present paper we investigate the effect of symmetry breaking in the
statistical distributions of reduced transition amplitudes and reduced
transition probabilities. These quantities are easier to access experimentally
than the components of the eigenvectors and were measured by Adams et al. for
the electromagnetic transitions in ^{26}Al. We focus on isospin symmetry
breaking described by a matrix model where both, the Hamiltonian and the
electromagnetic operator, break the symmetry. The results show that for partial
isospin conservation, the statistical distribution of the reduced transition
probability can considerably deviate from the Porter-Thomas distribution.
","[{""version"":""v1"",""created"":""Mon, 22 Nov 1999 12:56:14 GMT""}]","2009-10-31"
"quant-ph/9911096","Tuck Choy","T.C. Choy","The Van der Waals interaction of the hydrogen molecule - an exact local
  energy density functional","11 pages, 13 figures and 28 references","Physical Review A vol 62 12506 (2000)","10.1103/PhysRevA.62.012506",,"quant-ph cond-mat.str-el physics.atm-clus physics.chem-ph",,"  We verify that the van der Waals interaction and hence all dispersion
interactions for the hydrogen molecule given by: W""= -{A/R^6}-{B/R^8}-{C/R^10}-
..., in which R is the internuclear separation, are exactly soluble. The
constants A=6.4990267..., B=124.3990835 ... and C=1135.2140398... (in Hartree
units) first obtained approximately by Pauling and Beach (PB) [1] using a
linear variational method, can be shown to be obtainable to any desired
accuracy via our exact solution. In addition we shall show that a local energy
density functional can be obtained, whose variational solution rederives the
exact solution for this problem. This demonstrates explicitly that a static
local density functional theory exists for this system. We conclude with
remarks about generalising the method to other hydrogenic systems and also to
helium.
","[{""version"":""v1"",""created"":""Mon, 22 Nov 1999 08:42:00 GMT""},{""version"":""v2"",""created"":""Fri, 26 Nov 1999 03:40:46 GMT""}]","2011-08-05"
"quant-ph/9911097","A. K. Rajagopal","Sumiyoshi Abe (1) and A. K. Rajagopal (2) ((1)College of Science and
  Technology, Nihon University, Funabashi, Chiba, Japan, (2)Naval Research
  Laboratory, Washington, D.C.)","Nonuniqueness of Canonical Ensemble Theory arising from Microcanonical
  Basis","13 pages; This is a thoroughly revised version of the original
  preprint which has now appearted in print. It also corrects several errors
  and misstatements in the published version. The main conclusions of the paper
  however remain intact","Phys. Lett. A272, 341 (2000)","10.1016/S0375-9601(00)00458-8",,"quant-ph cond-mat.stat-mech",,"  Given physical systems, counting rule for their statistical mechanical
descriptions need not be unique, in general. It is shown that this
nonuniqueness leads to the existence of various canonical ensemble theories
which equally arise from the definite microcanonical basis. Thus, the Gibbs
theorem for canonical ensemble theory is not universal, and the maximum entropy
principle is to be appropriately modefied for each physical context.
","[{""version"":""v1"",""created"":""Mon, 22 Nov 1999 12:46:26 GMT""},{""version"":""v2"",""created"":""Wed, 25 Oct 2000 17:04:22 GMT""}]","2009-10-31"
