"cond-mat/9911334","Ziad Maassarani","Z. Maassarani (University of Virginia)","Comments on ""New representations of the Hecke algebra and algebraic
  Bethe Ansatz for an integrable generalized spin ladder"", by H.-Q. Zhou, H.
  Frahm and M.D. Gould, cond-mat/9911072","3 pages, Latex",,,,"cond-mat",,"  The authors of cond-mat/9911072 claim to introduce ""new representations of
the Hecke algebra."" These representations are shown to be the XXC models
introduced two years ago in solv-int/9712008, and repeatedly studied and
referred to in subsequent papers. They are in fact representations of the
Temperley-Lieb algebra. Several other remarks are made and mistakes are pointed
out.
","[{""version"":""v1"",""created"":""Mon, 22 Nov 1999 03:57:47 GMT""}]","2007-05-23"
"cond-mat/9911335","Erik Koch","Erik Koch and Olle Gunnarsson","One-electron bands, quantum Monte Carlo, and real superconductors","9 pages LaTeX with 2 eps figures; Proceedings of the International
  Conference on Statistical Mechanics and Strongly Correlated Electrons in
  honor of Giovanni Paladin, Sept 27-29, 1999, Universita di Roma ""La
  Sapienza""; additional material available at
  http://www.mpi-stuttgart.mpg.de/docs/ANDERSEN/fullerene/","Physica A 280, 166 (2000)","10.1016/S0378-4371(99)00634-2",,"cond-mat.supr-con cond-mat.mtrl-sci cond-mat.str-el",,"  We use the doped Fullerenes as an example of how realistic systems can be
described by simple models. Starting from the band structure we set up a
tight-binding model that describes the t_{1u} conduction band. Adding
correlation terms we arrive at a generalized Hubbard Hamiltonian that we treat
using quantum Monte Carlo. To address the problem of superconductivity in the
doped Fullerenes, we study the screening of a point charge. We find
surprisingly efficient metallic screening even for strong correlations, almost
up to the Mott transition, and discuss the implications on superconductivity,
in particular the effect of the efficient screening on the Coulomb
pseudopotential and the electron-phonon coupling.
","[{""version"":""v1"",""created"":""Mon, 22 Nov 1999 08:23:07 GMT""}]","2009-10-31"
"cond-mat/9911336","Tetsuro Nikuni","T. Nikuni, A. Griffin and E. Zaremba","Two-fluid hydrodynamics of a Bose gas including damping from normal
  fluid transport coefficients","18 pages, revtex, 4 postscript figures, Submitted to the Canadian
  Journal of Physics for the Boris Stoicheff Festschrift issue",,"10.1139/cjp-78-5-6-415",,"cond-mat.stat-mech",,"  We extend our recent work on the two-fluid hydrodynamics of the condensate
and non-condensate in a trapped Bose gas by including the dissipation
associated with viscosity and thermal conduction. For purposes of illustration,
we consider the hydrodynamic modes in the case of a uniform Bose gas. A finite
thermal conductivity and shear viscosity give rise to a damping of the first
and second sound modes in addition to that found previously due to the lack of
diffusive equilibrium between the condensate and non-condensate. The
relaxational mode associated with this equilibration process is strongly
coupled to thermal fluctuations and reduces to the usual thermal diffusion mode
above the Bose-Einstein transition. In contrast to the standard Landau
two-fluid hydrodynamics, we predict a damped mode centered at zero frequency,
in addition to the usual second sound doublet.
","[{""version"":""v1"",""created"":""Mon, 22 Nov 1999 08:30:31 GMT""}]","2009-10-31"
"cond-mat/9911337","Maxim Yu. Kagan","M.Yu.Kagan (1), R.Fresard (2), M.Capezzali (3), H.Beck (2) ((1)
  P.L.Kapitza Institute for Physical Problems, Moscow, Russia, (2) Institut de
  Physique, Universite de Neuchatel, Neuchatel, Switzerland, (3) Department of
  Physics, Queen's University, Kingston, Canada)","One-electron spectral functions of the attractive Hubbard model at
  intermediate coupling","2 pages, LT22 Conference paper, phbauth and elsart style files
  included",,"10.1016/S0921-4526(99)02018-9",,"cond-mat.str-el",,"  We calculate the one-electron spectral function of the attractive-U Hubbard
model in two dimensions. We work in the intermediate coupling and low density
regime and evaluate analytically the self-energy. The results are obtained in a
framework based on the self-consistent T-matrix approximation. We also
calculate the chemical potential of the bound pairs as a function of
temperature. On the basis of this calculation we analyze the low-temperature
resistivity and specific heat in the normal state of this system. We compare
our results with recent beautiful tunneling experiments in the underdoped
regime of HTSC-materials.
","[{""version"":""v1"",""created"":""Mon, 22 Nov 1999 09:28:19 GMT""}]","2009-10-31"
"cond-mat/9911338",,"Mario Nicodemi (Imperial College, London, UK)","Domains growth and packing properties in driven granular media subject
  to gravity","7 pages, 6 postscript files for figures","Physica A 285, 267 (2000)","10.1016/S0378-4371(00)00207-7",,"cond-mat.stat-mech cond-mat.dis-nn",,"  We study the dynamical properties of recently introduced frustrated lattice
gas models (IFLG and Tetris) for granular media under gentle shaking. We
consider both the case where grains have inter-grain surface interactions and
the case where they have not, corresponding, for instance, to the presence or
absence of moisture in the packs. To characterise the grains packing structure,
we discuss the properties of density distribution. In particular, we consider
the phenomenon of grains domains formation under compaction. New results
amenable of experimental check are discussed along with some important
differences between the dynamics of the present models.
","[{""version"":""v1"",""created"":""Mon, 22 Nov 1999 09:55:35 GMT""}]","2009-10-31"
"cond-mat/9911339","Zikic Radomir","L. Dobrosavljevi\'c-Gruji\'c, R. Ziki\'c, and Z. Radovi\'c","Quasiparticle energy spectrum in ferromagnetic Josephson weak links","11 pages, 6 figures",,"10.1016/S0921-4534(00)00006-X",,"cond-mat.supr-con",,"  The quasiparticles energy spectrum in clean ferromagnetic weak links between
conventional superconductors is calculated. Large peaks in DOS, due to a
special case of Andreev reflection at the ferromagnetic barrier, correspond to
spin-splitt bound states. Their energies are obtained as a function of the
barrier thickness, exchange field strength, and of the macroscopic phase
difference $\phi$ at the link, related to the Josephson current. In the ground
state, $\phi$ can be 0 or $\pi$, depending on the ferromagnetic barrier
influence. Conditions for the appearence of the zero-energy bound states (ZES)
and for the spin polarized ground state (SPGS) are obtained analytically. It is
shown that ZES appear only outside the weak link ground state.
","[{""version"":""v1"",""created"":""Mon, 22 Nov 1999 11:38:48 GMT""}]","2009-10-31"
"cond-mat/9911340","Coveney","Bruce M. Boghosian and Peter V. Coveney","A Particulate Basis for an Immiscible Lattice-Gas Model","11 pages. Accepted for publication in Computer Physics Communications",,"10.1016/S0010-4655(00)00091-6",,"cond-mat.soft comp-gas nlin.CG",,"  We show that a phenomenological hydrodynamic lattice-gas model of two-phase
flow, developed by Rothman and Keller in 1988 and used extensively for
numerical simulations since then, can be derived from an underlying model of
particle interactions. From this result, we elucidate the nature of the
hydrodynamic limit of the Rothman-Keller model.
","[{""version"":""v1"",""created"":""Mon, 22 Nov 1999 12:06:49 GMT""}]","2009-10-31"
"cond-mat/9911341","A. O. Sousa","A.O. Sousa and S. Moss de Oliveira","The Penna model for biological ageing on a lattice: spatial consequences
  of child-care","8 pages, 6 Postscript figures","Eur. Phys. J. B 9, 365-369 (1999)",,,"cond-mat.stat-mech q-bio",,"  We introduce a square lattice into the Penna bit-string model for biological
ageing and study the evolution of the spatial distribution of the population
considering different strategies of child-care. Two of the strategies are
related to the movements of a whole family on the lattice: in one case the
mother cannot move if she has any child younger than a given age, and in the
other case if she moves, she brings these young children with her. A stronger
condition has also been added to the second case, considering that young
children die with a higher probability if their mothers die, this probability
decreasing with age. We show that a highly non uniform occupation can be
obtained when child-care is considered, even for an uniform initial occupation
per site. We also compare the standard survival rate of the model with that
obtained when the spacial lattice is considered (without any kind of
child-care).
","[{""version"":""v1"",""created"":""Mon, 22 Nov 1999 12:38:16 GMT""}]","2007-05-23"
"cond-mat/9911342","Joerg Lehmann","J\""org Lehmann, Peter Reimann, Peter H\""anggi","Surmounting Oscillating Barriers","4 pages, 4 figures","Phys. Rev. Lett. 84, 1639 (2000)","10.1103/PhysRevLett.84.1639",,"cond-mat.stat-mech",,"  Thermally activated escape over a potential barrier in the presence of
periodic driving is considered. By means of novel time-dependent path-integral
methods we derive asymptotically exact weak-noise expressions for both the
instantaneous and the time-averaged escape rate. The agreement with accurate
numerical results is excellent over a wide range of driving strengths and
driving frequencies.
","[{""version"":""v1"",""created"":""Mon, 22 Nov 1999 12:39:45 GMT""}]","2009-10-31"
"cond-mat/9911343","Carlos Rascon","C Rascon and AO Parry","Wetting at Non-Planar and Heterogeneous Substrates","6 pages, 3 figures. For the special issue of the Journal of Physics:
  Condensed Matter on the IV Liquid Matter Conference (Granada, Spain)",,"10.1088/0953-8984/12/8A/350",,"cond-mat",,"  We report results of wetting on non-planar and heterogeneous surfaces
calculated from an effective interfacial Hamiltonian model. The lack of
translational invariance along the substrate induces a series of structural
changes on the interface such as unbending and a number of non-thermodynamic
singularities and can modify the location of the wetting transition. We show
that the order of the wetting transition in the planar homogeneous system
strongly affects the behaviour of the non-planar and heterogeneous surfaces.
","[{""version"":""v1"",""created"":""Mon, 22 Nov 1999 12:47:46 GMT""}]","2009-10-31"
"cond-mat/9911344","Coveney","Keir E. Novik and Peter V. Coveney","Spinodal decomposition of off-critical quenches with a viscous phase
  using dissipative particle dynamics in two and three spatial dimensions","34 pages (11 figures); accepted for publication in Phys. Rev. E",,"10.1103/PhysRevE.61.435",,"cond-mat.soft comp-gas nlin.CG",,"  We investigate the domain growth and phase separation of
hydrodynamically-correct binary immiscible fluids of differing viscosity as a
function of minority phase concentration in both two and three spatial
dimensions using dissipative particle dynamics. We also examine the behavior of
equal-viscosity fluids and compare our results to similar lattice-gas
simulations in two dimensions.
","[{""version"":""v1"",""created"":""Mon, 22 Nov 1999 15:52:03 GMT""}]","2009-10-31"
"cond-mat/9911345","Frank Wiekhorst","M.W.Pieper, F. Wiekhorst, T.Wolf","Characterization of localized hole states in
  Pr_(1+x)Ba_(2-x)Cu_(3)O_(6+y) by nuclear magnetic resonance","17 pages, 12 figures, submitted to PRB",,"10.1103/PhysRevB.62.1392",,"cond-mat",,"  We investigated the charge distribution in
Pr_{1+x}Ba_{2-x}Cu_3O_{6+y}-crystals at liquid-He temperature by means of
^{63,65}Cu- and ^{141}Pr-NMR and NQR. The electric field gradients determined
for the different oxygen coordinations of Cu(1) on the chains confirm the model
that the hole states are localized in the O 2p - pi-orbitals of the
CuO_(2)-planes. The intensity and line-shape analysis of the Cu(1)- and
Pr-resonances in the oxygen doping series (x approx 0, y=0..1) and in the Pr/Ba
solid-solution series (at y=1) allows us to assign the Pr-resonance to Pr at
RE-sites. Therefore, we can investigate the charge distribution in the
CuO_(2)-Pr-CuO_(2)-layers by crystal field analysis of the Pr-signal. To
consistently describe our results with neutron scattering data we propose that
two Pr-states are present in the RE-layer, and ascribe them to Pr with and one
without a hole localized in the oxygen coordination shell. NMR detects only the
former, with a virtually nonmagnetic singlet ground state, while space-integral
techniques are dominated by the latter, due to a quasi-doublet ground state and
antiferromagnetism of its Pr-moments at low temperature.
","[{""version"":""v1"",""created"":""Mon, 22 Nov 1999 14:00:04 GMT""}]","2009-10-31"
"cond-mat/9911346","Laurent Frachebourg","L. Frachebourg and Ph. A. Martin (EPF Lausanne); J. Piasecki (Uni.
  Warsaw)","Ballistic aggregation: a solvable model of irreversible many particles
  dynamics","23 pages, 6 figures included",,"10.1016/S0378-4371(99)00585-3",,"cond-mat.stat-mech",,"  The adhesive dynamics of a one-dimensional aggregating gas of point particles
is rigorously described. The infinite hierarchy of kinetic equations for the
distributions of clusters of nearest neighbours is shown to be equivalent to a
system of two coupled equations for a large class of initial conditions. The
solution to these nonlinear equations is found by a direct construction of the
relevant probability distributions in the limit of a continuous initial mass
distribution. We show that those limiting distributions are identical to those
of the statistics of shocks in the Burgers turbulence. The analysis relies on a
mapping on a Brownian motion problem with parabolic constraints.
","[{""version"":""v1"",""created"":""Mon, 22 Nov 1999 13:56:48 GMT""}]","2009-10-31"
"cond-mat/9911347","Oleg Tchernyshyov","Oleg Tchernyshyov and Frank Wilczek (IAS)","Charged stripes from alternating static magnetic field","RevTeX, 3 pages, 3 encapsulated PostScript figures","Phys. Rev. B 62, 4208 (2000)","10.1103/PhysRevB.62.4208","IASSNS-HEP-99/100","cond-mat.str-el",,"  We motivate and perform a calculation of the energy of a cold fluid of
charged fermions in the presence of a striped magnetic background. We find that
a non-trivial value for the doping density on the walls is preferred
","[{""version"":""v1"",""created"":""Mon, 22 Nov 1999 15:27:21 GMT""}]","2007-05-23"
"cond-mat/9911348","Jean-Marc Luck","C. Godreche and J.M. Luck","Response of non-equilibrium systems at criticality: Exact results for
  the Glauber-Ising chain","27 pages. 3 figures. To appear in Journal of Physics A","Journal of Physics A 33 (2000) 1151","10.1088/0305-4470/33/6/305",,"cond-mat.stat-mech",,"  We investigate the non-equilibrium two-time correlation and response
functions and the associated fluctuation-dissipation ratio for the
ferromagnetic Ising chain with Glauber dynamics. The scaling behavior of these
quantities at low temperature and large times is studied in detail. This
analysis encompasses the self-similar domain-growth (aging) regime, the spatial
and temporal Porod regimes, and the convergence toward equilibrium. The
fluctuation-dissipation ratio admits a non-trivial limit value $X_\infty=1/2$
at zero temperature, and more generally in the aging regime.
","[{""version"":""v1"",""created"":""Mon, 22 Nov 1999 15:47:53 GMT""}]","2009-10-31"
"gr-qc/9911079","Hiroshi Umetsu","Hisao Suzuki, Eiichi Takasugi and Hiroshi Umetsu","Absorption rate of the Kerr-de Sitter black hole and the Kerr-Newman-de
  Sitter black hole","11 pages, LaTeX. Several typos are corrected","Prog.Theor.Phys. 103 (2000) 723-731","10.1143/PTP.103.723","EPHOU 99-012, OU-HET-333","gr-qc",,"  By using an analytic solution of the Teukolsky equation in the Kerr-de Sitter
and Kerr-Newman-de Sitter geometries, an analytic expression of the absorption
rate formulae for these black holes is calculated.
","[{""version"":""v1"",""created"":""Mon, 22 Nov 1999 06:48:27 GMT""},{""version"":""v2"",""created"":""Fri, 24 Mar 2000 09:42:42 GMT""}]","2009-10-31"
"gr-qc/9911080","Dzhunushaliev Vladimir","V. Dzhunushaliev and H.-J. Schmidt","Wormholes and Flux Tubes in the 7D Gravity on the Principal Bundle with
  SU(2) Gauge Group as the Extra Dimensions","20 pages, 8 figures, the quality of the figures are improved","Phys.Rev.D62:044035,2000","10.1103/PhysRevD.62.044035","UNIPO-MATH-99-November-18","gr-qc hep-th",,"  Vacuum solutions for multidimensional gravity on the principal bundle with
the SU(2) structural group as the extra dimensions are found and discussed.
This generalizes the results of Ref. \cite{vds3} from U(1) to the SU(2) gauge
group. The spherically symmetric solution with the off-diagonal components of
the multidimensional metric is obtained. It is shown that two types of
solutions exist: the first has a wormhole-like 4D base, the second is a
gravitational flux tube with two color and electric charges. The solution
depends only on two parameters: the values of the electric and magnetic fields
at the origin. In the plane of these parameters there exists a curve separating
the regions with different types of solutions. An analogy with the 5D solutions
is discussed.
","[{""version"":""v1"",""created"":""Mon, 22 Nov 1999 09:07:34 GMT""},{""version"":""v2"",""created"":""Fri, 4 Feb 2000 08:51:24 GMT""}]","2010-11-19"
"gr-qc/9911081","Marco Montuori","Yurij V. Baryshev (Astronomical Institute of the Saint-Petersburg
  State University, Saint-Petersburg, Russia)","On a possibility of scalar gravitational wave detection from the binary
  pulsar PSR 1913 +16","10 pages, no figures","Proceeding of the First Edoardo Amaldi Conference on
  ""Gravitational Wave Experiments"", eds. E.Coccia, G.Pizzella, F.Ronga, World
  Scientific Publ.Co., 1995, pp.251-260",,,"gr-qc astro-ph quant-ph",,"  It is shown that detecting or setting an upper limit on the scalar
gravitational radiation is a good experimental test of relativistic gravity
theories. The relativistic tensor-field theory of gravitation is revised and it
is demonstrated that the scalar monopole gravitational radiation must be added
to the usual quadrupole radiation. In the case of the binary pulsar PSR 1913+16
it is predicted the existence 0.735 % excess of the gravitational radiation due
to the scalar gravitational waves.
","[{""version"":""v1"",""created"":""Mon, 22 Nov 1999 11:16:13 GMT""}]","2007-05-23"
"gr-qc/9911082","Laszlo A. Gergely","L\'aszl\'o \'A. Gergely","Spin-spin effects in radiating compact binaries","12 pages, to appear in Phys. Rev. D","Phys.Rev. D61 (2000) 024035","10.1103/PhysRevD.61.024035",,"gr-qc",,"  The dynamics of a binary system with two spinning components on an eccentric
orbit is studied, with the inclusion of the spin-spin interaction terms
appearing at the second post-Newtonian order. A generalized true anomaly
parametrization properly describes the radial component of the motion. The
average over one radial period of the magnitude of the orbital angular momentum
$\bar{L}$ is found to have no nonradiative secular change. All spin-spin terms
in the secular radiative loss of the energy and magnitude of orbital angular
momentum are given in terms of $\bar{L}$ and other constants of the motion.
Among them, self-interaction spin effects are found, representing the second
post-Newtonian correction to the 3/2 post-Newtonian order Lense-Thirring
approximation.
","[{""version"":""v1"",""created"":""Mon, 22 Nov 1999 14:02:35 GMT""}]","2009-10-31"
"gr-qc/9911083","Julia Kopeikina","Sergei M. Kopeikin (Dept. of Phys. and Astron., Univ.
  Missouri-Columbia)","Lorentz Covariant Theory of Precise Doppler Measurements","4 pages, the afternoon talk at Journees Relativistes 1999, Weimar,
  Germany, September 1999",,,,"gr-qc astro-ph physics.space-ph",,"  The Lorentz covariant theory of precise Doppler measurements (PDM) based on
the retarded Li\'{e}nard-Wiechert solution of the Einstein equations is
described. An exact solution of equations of light propagation in the field of
arbitrary moving bodies, which drastically extends the range of applicability
of the new theory of PDM, is obtained. An explicit formula for the
gravitational shift of frequency is given in analytic form. The limiting cases
of the Doppler observations in gravitational lensing and of the spacecraft's
Doppler tracking are described in more detail. We also present the
post-Newtonian theory of the PDM developed for searching relativistic effects
in close optical binaries and massive planetary systems.
","[{""version"":""v1"",""created"":""Mon, 22 Nov 1999 13:54:13 GMT""}]","2007-05-23"
"hep-ex/9911029","David J. Miller","G. Abbiendi, et al, the OPAL collaboration","Tau decays with neutral kaons","21 pages, 6 figures, submitted to Eur. Phys. J. C","Eur.Phys.J.C13:213-223,2000","10.1007/s100520000317",,"hep-ex",,"  The branching ratio of the tau lepton to a neutral K meson is measured from a
sample of approximately 200,000 tau decays recorded by the OPAL detector at
centre-of-mass energies near the Z0 resonance. The measurement is based on two
samples which identify one-prong tau decays with KL and KS mesons. The combined
branching ratios are measured to be B(tau- -->pi- K0bar nutau) =
(9.33+-0.68+-0.49)x10^-3 B(tau- -->pi- K0bar [>=1pi0] nutau) =
(3.24+-0.74+-0.66)x10^-3 B(tau- -->K- K0bar [>=0pi0] nutau) =
(3.30+-0.55+-0.39)x10^-3 where the first error is statistical and the second
systematic.
","[{""version"":""v1"",""created"":""Sun, 21 Nov 1999 16:46:38 GMT""}]","2008-11-26"
"hep-ex/9911030","David J. Miller","G. Abbiendi, et al, the OPAL collaboration","Inclusive production of D*+- mesons in photon-photon collisions at
  sqrt(s) = 183 and 189 GeV and a first measurement of the the charm structure
  function of the photon","35 pages, 11 Figures, submitted to Eur. Phys. J. C","Eur.Phys.J.C16:579-596,2000","10.1007/s100520000420","CERN-EP/99-157","hep-ex",,"  The inclusive production of D*+- mesons in photon-photon collisions has been
measured using the OPAL detector at LEP at e+e- centre-of-mass energies of 183
and 189GeV. The D* mesons are reconstructed in their decay to D0pi+ with the D0
observed in the two decay modes Kpi+ and Kpi+pi-pi+. After background
subtraction, 100.4+-12.6(stat) D*+- mesons have been selected in events without
observed scattered beam electron (""anti-tagged"") and 29.8+-5.9 (stat) D*+-
mesons in events where one beam electron is scattered into the detector
(""single-tagged""). Direct and single-resolved events are studied separately.
Differential cross-sections as functions of the D* transverse momentum p_t and
pseudorapidity \eta are presented in the kinematic region 2<p_t<12GeV and
\eta<1.5. They are compared to next-to-leading order (NLO) perturbative QCD
calculations. The total cross-section for the process (e+e- to e+e-ccbar),
where the charm quarks are produced in the collision of two quasi-real photons,
is measured to be 842+-97(stat)+-75(syst)+-196(extrapolation)pb. A first
measurement of the charm structure function F2 of the photon is performed in
the kinematic range 0.0014<x<0.87 and 5<Q^2<100 GeV^2, and the result is
compared to a NLO perturbative QCD calculation.
","[{""version"":""v1"",""created"":""Sun, 21 Nov 1999 17:41:21 GMT""}]","2008-11-07"
"hep-ex/9911031","Bruce Winstein","B. Winstein","CP and T Violation in KL -> pi^+pi^-e^+e^-","To appear in the proceedings of the XIth Rencontre de Blois, June 27-
  July 3, 1999, 6 pages",,,"EFI 99-46","hep-ex",,"  I will here make some brief comments on the T- and CP- odd asymmetry observed
by KTeV in the KL -> pi^+pi^-e^+e^- decay.
","[{""version"":""v1"",""created"":""Mon, 22 Nov 1999 14:56:50 GMT""}]","2007-05-23"
"hep-ex/9911032","Catherine Bourge","Jean-Baptiste de VIVIE","Interpretation of HIGGS and SUSY searches in MSUGRA and GMSB models","8 pages",,,"LAL 99-58","hep-ex",,"  HIGGS and SUSY searches performed by the ALEPH Experiment at LEP are
interpreted in the framework of two constrained R-parity conserving models:
Minimal Supergravity and minimal Gauge Mediated Supersymmetry Breaking.
","[{""version"":""v1"",""created"":""Mon, 22 Nov 1999 15:57:08 GMT""}]","2007-05-23"
"hep-ph/9911421","Neal Weiner","Nima Arkani-Hamed, Lawrence Hall, David Smith, Neal Weiner (UC
  Berkeley, LBNL)","Exponentially Small Supersymmetry Breaking from Extra Dimensions","RevTex, 1 figure. Comment on mu problem added","Phys.Rev.D63:056003,2001","10.1103/PhysRevD.63.056003","UCB-PTH-99/52, LBNL-44596","hep-ph",,"  The supersymmetric ``shining'' of free massive chiral superfields in extra
dimensions from a distant source brane can trigger exponentially small
supersymmetry breaking on our brane of order e^{-2 pi R}, where R is the radius
of the extra dimensions. This supersymmetry breaking can be transmitted to the
superpartners in a number of ways, for instance by gravity or via the standard
model gauge interactions. The radius R can easily be stabilized at a size O(10)
larger that the fundamental scale. The models are extremely simple, relying
only on free, classical bulk dynamics to solve the hierarchy problem.
","[{""version"":""v1"",""created"":""Mon, 22 Nov 1999 08:09:05 GMT""},{""version"":""v2"",""created"":""Sat, 18 Dec 1999 02:26:49 GMT""}]","2008-11-26"
