"hep-ex/9911036","Nikolay I. Root","CMD2 collaboration","New measurement of the rare decay $\phi \to \eta' \gamma$ with CMD-2","12 pages, 4 figures, LaTex","Phys.Lett.B473:337-342,2000","10.1016/S0370-2693(99)01475-6","R.R.Akhmetshin et al., Preprint BudkerINP 99-11, Novosibirsk, 1999","hep-ex",,"  A new measurement of the rare decay \phi \to \eta' \gamma performed with the
CMD-2 detector at Novosibirsk is described. Of the data sample corresponding to
the integrated luminosity of 14.5 pb^{-1}, twenty one events have been selected
in the mode \eta'\to\pi^+\pi^-\eta, \eta\to\gamma\gamma. The following
branching ratio was obtained: B(\phi \to \eta' \gamma) = (8.2^{+2.1}_{-1.9} \pm
1.1) 10^{-5}.
","[{""version"":""v1"",""created"":""Wed, 24 Nov 1999 14:37:05 GMT""}]","2012-08-27"
"hep-lat/9911027","Hirosi Ooguri","Hirosi Ooguri","Gauge Theory and String Theory; An Introduction to the AdS/CFT
  Correspondence","To appear in the Proceedings of LATTICE 99; 5 pages, LaTeX","Nucl.Phys.Proc.Suppl.83:77-81,2000","10.1016/S0920-5632(00)91597-4",,"hep-lat",,"  Plenary talk at the conference, LATTICE 99, held in Pisa, Itay from June 29
to July 3, 1999.
","[{""version"":""v1"",""created"":""Tue, 23 Nov 1999 19:28:18 GMT""}]","2015-06-25"
"hep-lat/9911028","Juergen Engels","J. Engels and T. Mendes (University of Bielefeld)","Goldstone-mode effects and scaling function for the three-dimensional
  O(4) model","14 pages, 14 ps-figures, Latex2e","Nucl.Phys.B572:289-304,2000","10.1016/S0550-3213(00)00046-8","BI-TP 99/35","hep-lat cond-mat.stat-mech",,"  We investigate numerically the three-dimensional O(4) model on 24^3-120^3
lattices as a function of the magnetic field H. We verify explicitly the
singularities induced by Goldstone modes in the low-temperature phase of the
model, and show that they are also observed close to the critical temperature.
Our results are well described by the perturbative form of the model's magnetic
equation of state, with coefficients determined nonperturbatively from our
data. The resulting expression is used to generate the magnetization's scaling
function parametrically.
","[{""version"":""v1"",""created"":""Wed, 24 Nov 1999 12:52:17 GMT""}]","2010-11-19"
"hep-lat/9911029","Subhasis Basak","S. Basak and Asit K. De (SINP, Calcutta)","Chiral Gauge Theory on Lattice with Domain Wall Fermions","16 pages revtex, 5 postscript figures, PRD version","Phys.Rev. D64 (2001) 014504","10.1103/PhysRevD.64.014504",,"hep-lat hep-th",,"  We investigate a U(1) lattice chiral gauge theory with domain wall fermions
and compact gauge fixing. In the reduced model limit, our perturbative and
numerical investigations show that there exist no extra mirror chiral modes.
The longitudinal gauge degrees of freedom have no effect on the free domain
wall fermion spectrum consisting of opposite chiral modes at the domain wall
and at the anti-domain wall which have an exponentially damped overlap.
","[{""version"":""v1"",""created"":""Wed, 24 Nov 1999 14:24:11 GMT""},{""version"":""v2"",""created"":""Mon, 3 Jul 2000 15:10:27 GMT""},{""version"":""v3"",""created"":""Thu, 7 Jun 2001 12:21:49 GMT""}]","2009-10-31"
"hep-ph/9911447","Lesgourgues","Julien Lesgourgues (SISSA, Trieste)","Features in the primordial power spectrum of double D-term inflation","42 pages, 8 figures. Minor changes, version accepted in Nucl. Phys. B","Nucl.Phys.B582:593-626,2000","10.1016/S0550-3213(00)00301-1","SISSA 138/99/EP","hep-ph astro-ph",,"  Recently, there has been some interest for building supersymmetric models of
double inflation. These models, realistic from a particle physics point of
view, predict a broken-scale-invariant power spectrum of primordial
cosmological perturbations, that may explain eventual non-trivial features in
the present matter power spectrum. In previous works, the primordial spectrum
was calculated using analytic slow-roll approximations. However, these models
involve a fast second-order phase transition during inflation, with a stage of
spinodal instability, and an interruption of slow-roll. For our previous model
of double D-term inflation, we simulate numerically the evolution of quantum
fluctuations, taking into account the spinodal modes, and we show that the
semi-classical approximation can be employed even during the transition, due to
the presence of a second inflaton field. The primordial power spectrum
possesses a rich structure, and possibly, a non-Gaussian spike on observable
scales.
","[{""version"":""v1"",""created"":""Tue, 23 Nov 1999 17:04:17 GMT""},{""version"":""v2"",""created"":""Mon, 5 Jun 2000 11:43:48 GMT""}]","2014-11-17"
"hep-ph/9911451","Carlos Quimbay Fisica Unalcol","Rafael Hurtado (University of Wales), John Morales, and Carlos Quimbay
  (Universidad Nacional de Colombia)","Dispersion relations at finite temperature and density for nucleons and
  pions","LaTeX File, 10 pages, 2 Postscript figures","Acta Phys.Hung.New Ser.Heavy Ion Phys. 11 (2000) 373-381",,"FIUN-CP-99/2","hep-ph",,"  We calculate the nucleonic and pionic dispersion relations at finite
temperature T and non-vanishing chemical potentials $(\mu_f)$ in the context of
an effective chiral theory that describes the strong and electromagnetic
interactions for nucleons and pions. The dispersion relations are calculated in
the broken chiral symmetry phase, where the nucleons are massive and pions are
taken as massless. The calculation is performed at lowest order in the energy
expansion, working in the framework of the real time formalism of thermal field
theory in the Feynman gauge. These one-loop dispersion relations are obtained
at leading order with respect to T and $\mu_f$. We also evaluate the effective
masses of the quasi-nucleon and quasi-pion excitations in thermal and chemical
conditions as the ones of a neutron star.
","[{""version"":""v1"",""created"":""Tue, 23 Nov 1999 18:03:30 GMT""}]","2007-05-23"
"hep-ph/9911452","Jaume Guasch","Jaume Guasch, Wolfgang Hollik, Arnd Kraft","Radiative corrections to pair production of charged Higgs bosons at
  TESLA","LaTeX, 14 pages, 6 figures included. Talk presented at the 2nd
  ECFA/DESY Study on Physics and Detectors for a Linear Electron-Positron
  Collider, Obernai (France) 16-19th October, 1999",,,"KA-TP-19-1999","hep-ph",,"  Charged Higgs particles are a common feature of many extensions of the
Standard Model. While its existence with masses up to the TeV scale can be
probed at the Tevatron Run II and LHC hadron colliders, a precise determination
of its properties would have to wait for a high energy e+e- linear collider. We
have computed the complete one-loop electroweak corrections to the
cross-section for charged Higgs bosons pair production in e+e- collisions, in
the framework of general Two Higgs Doublet Models, as well as the Minimal
Supersymmetric Standard Model. A study is presented for typical values of the
model parameters, showing the general behaviour of the corrections.
","[{""version"":""v1"",""created"":""Tue, 23 Nov 1999 17:50:27 GMT""}]","2007-05-23"
"hep-ph/9911453","Stefan Leupold","Stefan Leupold (University of Giessen)","Test particle description of transport processes for states with a
  continuous mass spectrum","10 pages, LaTeX, no figures, Talk given at the workshop
  ``Kadanoff-Baym Equations --- Progress and Perspectives for Many-Body
  Physics'', Rostock, Germany, 20.-24. September 1999",,"10.1142/9789812793812_0028",,"hep-ph cond-mat nucl-th",,"  Aiming at a description of transport processes where the dynamically
generated width of the states is potentially large a transport equation beyond
the quasiparticle approximation is derived in first order gradient expansion.
An effective particle number is identified which is exactly conserved by the
coarse grained transport equation. Using a test particle ansatz for this
conserved quantity allows to rewrite the transport equation into equations of
motion for test particles. The two-body collision terms are formulated in terms
of the test particles which gain non-trivial renormalization factors due to the
coarse graining process.
","[{""version"":""v1"",""created"":""Tue, 23 Nov 1999 19:10:17 GMT""}]","2017-08-23"
"hep-ph/9911454","Narison Stephan","Stephan Narison (LPMT-Montpellier and KEK-Tsukuba)","Light Quark Masses 99","Latex2e two-column 13 pages 5 Tables + 1 figure. Review talk given at
  QCD 99 (Montpellier 7-13th July 1999) and plenary talk at QCD Confinement
  2000 (Osaka 7-10th March 2000) Report-n0: Montpellier preprint PM/99-50.
  Updated version and application to epsilon'/epsilon","Nucl.Phys.Proc.Suppl. 86 (2000) 242-254","10.1016/S0920-5632(00)00572-7",,"hep-ph hep-ex hep-lat nucl-th",,"  I give a short historical and a critical review of the determinations of
light quark masses from QCD at dawn of the next millennium. QCD spectral sum
rules combined with ChPT give, to order $\alpha_s^3$, the world average for the
running masses: $\bar{m}_s$(2 GeV)= $(118.9\pm 12.2)$ MeV,
$\bar{m}_d(2~{GeV})=(6.3\pm 0.8)$ MeV, $\bar{m}_u(2~{GeV})=(3.5\pm 0.4)$ MeV
and the corresponding values of the invariant masses given in Eq. 24. Lower and
upper bounds derived from the positivity of spectral moments are presented in
Tables 2 and 3. For a comparison, we critically review the recent lattice
results (section 8 and Table 5) and attempt to deduce the present {\it QCD
grand average} determination (Table 6): $\bar{m}_s$(2 GeV)= $(110.9\pm 8.8)$
MeV, to be used with a great care. Then, we deduce the value:
$B_6^{1/2}-0.45(\rm resp.~0.32)B_8^{3/2}\simeq 1.6\pm 0.4~(\rm resp.~1.1\pm
0.3)$ and the lower bound $1.1\pm 0.2$ (resp. $0.7\pm 0.1$), for the
combination of the penguin operators, governing the CP-violating parameters
$\epsilon'/\epsilon$ without (resp. with) the inclusion of the final state
interaction effects. The result signals a possible deviation from the leading
1/N prediction by about $1\sim 3\sigma$, which should be tested using accurate
non-perturbative calculations.
","[{""version"":""v1"",""created"":""Tue, 23 Nov 1999 19:18:14 GMT""},{""version"":""v2"",""created"":""Tue, 15 Feb 2000 20:26:01 GMT""}]","2009-10-31"
"hep-ph/9911455","Andrzej Czarnecki","Andrzej Czarnecki","Positronium properties","Talk given at the 39th Cracow School of Theoretical Physics,
  Zakopane, Poland, May 1999; 11 pages, latex","Acta Phys.Polon.B30:3837-3847,1999",,"BNL-HET-99/38","hep-ph",,"  This talk gives an elementary introduction to the basic properties of
positronium. Recent progress in theoretical studies of the hyperfine splitting
and lifetime of the ground state is reviewed. Sensitivity of these precisely
measured quantities to some New Physics effects is discussed.
","[{""version"":""v1"",""created"":""Tue, 23 Nov 1999 20:17:45 GMT""}]","2011-04-15"
"hep-ph/9911456",,"B. Magradze (A. Razmadze Mathematical Institute, Tbilisi Georgia)","Analytic Approach to Perturbative QCD","Latex-file, 19 pages, 2 tables, 51 references, to be published in
  Int. J. Mod. Phys.A","Int.J.Mod.Phys. A15 (2000) 2715-2734","10.1142/S0217751X00001117","RMI-99-06","hep-ph hep-th",,"  The two-loop invariant (running) coupling of QCD is written in terms of the
Lambert W function. The analyticity structure of the coupling in the complex
Q^2-plane is established. The corresponding analytic coupling is reconstructed
via a dispersion relation. We also consider some other approximations to the
QCD beta-function, when the corresponding couplings are solved in terms of the
Lambert function. The Landau gauge gluon propagator has been considered in the
renormalization group invariant analytic approach (IAA). It is shown that there
is a nonperturbative ambiguity in determination of the anomalous dimension
function of the gluon field. Several analytic solutions for the propagator at
the one-loop order are constructed. Properties of the obtained analytical
solutions are discussed.
","[{""version"":""v1"",""created"":""Tue, 23 Nov 1999 20:41:23 GMT""}]","2016-12-28"
"hep-ph/9911457","Walter Goldberger","Walter D. Goldberger and Mark B. Wise","Phenomenology of a Stabilized Modulus","10 pages, LaTeX; References added, minor revisions to the text","Phys.Lett.B475:275-279,2000","10.1016/S0370-2693(00)00099-X","CALT-68-2250","hep-ph",,"  We explore the phenomenology of a stabilized modulus field in the
Randall-Sundrum scenario. It is found that if the large separation between
branes arises from a small bulk scalar mass then the modulus (i.e. radion) is
likely to be lighter than the lowest Kaluza-Klein excitations of bulk fields,
and consequently may be the first direct signature of the model.
Four-dimensional general covariance completely determines the couplings of the
modulus to Standard Model fields. The strength of these couplings is determined
by a single parameter which is set by the TeV rather than the Planck scale.
","[{""version"":""v1"",""created"":""Tue, 23 Nov 1999 22:30:46 GMT""},{""version"":""v2"",""created"":""Thu, 16 Dec 1999 20:03:29 GMT""}]","2011-05-05"
"hep-ph/9911458","Emilio Torrente Lujan","E. Torrente-Lujan","Bounds on the Solar Antineutrino total Flux and Energy spectrum from the
  SK experiment","5 pages, 3 ps figures","Phys.Lett. B494 (2000) 255-261","10.1016/S0370-2693(00)01173-4","IFIC-99-46","hep-ph",,"  A search for inverse beta decay electron antineutrinos has been carried out
using the 825 days sample of solar data obtained at SK. The absence of a
significant signal, that is, contributions to the total SK background and their
angular variations has set upper bounds on a) the absolute flux of solar
antineutrinos originated from ${}^8 B$ neutrinos $\Phi_{\bar{\nu}}({}^8 B)=<
1.8\times 10^5 cm^{-2} s^{-1}$ which is equivalent to an averaged conversion
probability bound of P<3.5% (SSM-BP98 model) and b) their differential energy
spectrum, the conversion probability is smaller than 8% for all $E_{e,vis}>6.5$
MeV going down the 5% level above $E_{e,vis}\approx 10$ MeV. It is shown that
an antineutrino flux would have the net effect of enhancing the SK signal at
{\em hep} neutrino energies. The magnitude of this enhancement would highly
depend on the, otherwise rather uncertain, steepness of the solar neutrino
spectrum at these energies.
","[{""version"":""v1"",""created"":""Tue, 23 Nov 1999 21:59:24 GMT""}]","2009-10-31"
"hep-ph/9911459","Smaragda Lola","John Ellis, M.E.Gomez, G.K.Leontaris, S.Lola and D.V.Nanopoulos","Charged-Lepton-Flavour Violation in the Light of the Super-Kamiokande
  Data","29 pages, 12 figures. References added, typos corrected","Eur.Phys.J.C14:319-334,2000","10.1007/s100520000357","ACT-12/99, CERN-TH/99-237, CTP-TAMU-45/99, FISIST/22-99/CFIF","hep-ph",,"  Motivated by the data from Super-Kamiokande and elsewhere indicating
oscillations of atmospheric and solar neutrinos, we study
charged-lepton-flavour violation, in particular the radiative decays mu -> e
gamma and tau -> mu gamma, but also commenting on mu -> 3e and tau -> 3 mu/e
decays, as well as mu - e conversion on nuclei. We first show how the
renormalization group may be used to calculate flavour-violating soft
supersymmetry-breaking masses for charged sleptons and sneutrinos in models
with universal input parameters. Subsequently, we classify possible patterns of
lepton-flavour violation in the context of phenomenological neutrino mass
textures that accommodate the Super-Kamiokande data, giving examples based on
Abelian flavour symmetries. Then we calculate in these examples rates for mu ->
e gamma and tau ->mu gamma, which may be close to the present experimental
upper limits, and show how they may distinguish between the different generic
mixing patterns. The rates are promisingly large when the soft
supersymmetry-breaking mass parameters are chosen to be consistent with the
cosmological relic-density constraints. In addition, we discuss mu -> e
conversion on Titanium, which may also be accessible to future experiments.
","[{""version"":""v1"",""created"":""Tue, 23 Nov 1999 22:01:29 GMT""},{""version"":""v2"",""created"":""Sat, 18 Dec 1999 20:59:03 GMT""}]","2009-09-11"
"hep-ph/9911460","Nikolaos Kidonakis","Nikolaos Kidonakis and Vittorio Del Duca","Electroweak-boson hadroproduction at large transverse momentum:
  factorization, resummation, and NNLO corrections","15 pages LaTeX, 2 postscript figures","Phys.Lett. B480 (2000) 87-96","10.1016/S0370-2693(00)00356-7","FSU-HEP-991123, CERN-TH/99-339, DFTT 62/99","hep-ph",,"  We study the resummation of singular distributions for electroweak-boson
production at large transverse momentum in hadronic collisions. We describe the
factorization properties of the cross section near partonic threshold and
construct the resummed cross section at next-to-leading logarithmic accuracy in
moment space in terms of soft gluon anomalous dimensions. We present full
analytical results for the expansion of the resummed cross section up to
next-to-next-to-leading order. Our results can be applied to W, Z, and virtual
gamma production at hadron colliders.
","[{""version"":""v1"",""created"":""Tue, 23 Nov 1999 22:13:02 GMT""}]","2009-10-31"
"hep-ph/9911461","Andre Hoang","A. H. Hoang (CERN), A. V. Manohar (UC, San Diego)","Charm Effects in the $\bar{MS}$ Bottom Quark Mass from $\Upsilon$ Mesons","7 pages, revtex, 2 postscript figures","Phys.Lett.B483:94-98,2000","10.1016/S0370-2693(00)00595-5","CERN-TH/99-357, UCSD/PTH 99-21","hep-ph",,"  We study the shift in the $\Upsilon$ mass due to a non-zero charm quark mass.
This shift affects the value of the $\bar{\rm MS}$ $b$-quark mass extracted
from the $\Upsilon$ system by about -20 MeV, due to an incomplete cancellation
of terms that are non-analytic in the charm quark mass. The precise size of the
shift depends on unknown higher order corrections, and might have a
considerable uncertainty if they are large.
","[{""version"":""v1"",""created"":""Tue, 23 Nov 1999 23:02:14 GMT""}]","2011-01-25"
"hep-ph/9911462","Hitoshi Murayama","Alain J. Brizard, Hitoshi Murayama, Jonathan S. Wurtele (UC Berkeley,
  LBNL)","Magnetic Field Generation from Self-Consistent Collective
  Neutrino-Plasma Interactions","23 pages","Phys.Rev.E61:4410-4421,2000","10.1103/PhysRevE.61.4410","LBNL-45042, UCB-PTH-99/39","hep-ph",,"  A new Lagrangian formalism for self-consistent collective neutrino-plasma
interactions is presented in which each neutrino species is described as a
classical ideal fluid. The neutrino-plasma fluid equations are derived from a
covariant relativistic variational principle in which finite-temperature
effects are retained. This new formalism is then used to investigate the
generation of magnetic fields and the production of magnetic helicity as a
result of collective neutrino-plasma interactions.
","[{""version"":""v1"",""created"":""Wed, 24 Nov 1999 01:06:33 GMT""}]","2009-09-29"
"hep-ph/9911463","Gert Aarts","Gert Aarts (University of Heidelberg), Bert-Jan Nauta (University of
  Amsterdam) and Chris G. van Weert (University of Amsterdam)","Divergences in Real-Time Classical Field Theories at Non-Zero
  Temperature","31 pages with 7 eps figures","Phys.Rev. D61 (2000) 105002","10.1103/PhysRevD.61.105002","HD-THEP-99-49, ITFA-99-33","hep-ph hep-th",,"  The classical approximation provides a non-perturbative approach to
time-dependent problems in finite temperature field theory. We study the
divergences in hot classical field theory perturbatively. At one-loop, we show
that the linear divergences are completely determined by the classical
equivalent of the hard thermal loops in hot quantum field theories, and that
logarithmic divergences are absent. To deal with higher-loop diagrams, we
present a general argument that the superficial degree of divergence of
classical vertex functions decreases by one with each additional loop: one-loop
contributions are superficially linearly divergent, two-loop contributions are
superficially logarithmically divergent, and three- and higher-loop
contributions are superficially finite. We verify this for two-loop SU(N)
self-energy diagrams in Feynman and Coulomb gauges. We argue that hot,
classical scalar field theory may be completely renormalized by local (mass)
counterterms, and discuss renormalization of SU(N) gauge theories.
","[{""version"":""v1"",""created"":""Wed, 24 Nov 1999 01:30:47 GMT""}]","2009-10-31"
"hep-ph/9911464","B. Ananthanarayan","B. Ananthanarayan (Bangalore), P. N. Pandita (Shillong)","Renormalization Group Evolution and Infra-red Fixed Points in Minimal
  Supersymmetric Standard Model with Baryon and Lepton Number Violation","19 pages LaTeX with 6 figurs embedded as eps files Replaced with
  version to appear in Physical Review D","Phys.Rev.D62:036009,2000; Erratum-ibid.D63:099901,2001","10.1103/PhysRevD.62.036009 10.1103/PhysRevD.63.099901","IISc-CTS-9/99","hep-ph",,"  We study the renormalization group evolution and infra-red stable fixed
points of the Yukawa couplings and the soft supersymmetry breaking trilinear
couplings of the minimal supersymmetric standard model with baryon and lepton
number (and R-parity) violation involving the heaviest generations. We show
analytically that in the Yukawa sector there is only one infra-red stable fixed
point. This corresponds to non-trivial fixed point for the top-, bottom-quark
Yukawa couplings and the $B$ violating coupling $\lambda_{233}''$, and a
trivial one for the $\tau$-Yukawa coupling. All other possible fixed points are
either unphysical or unstable in the infra-red region. We then carry out an
analysis of the renormalization group equations for the soft supersymmetry
breaking trilinear couplings, and determine the corresponding fixed points for
these couplings. We also study the quasi-fixed point behaviour, both
algebraically and with numerical solutions of the evolution equations, of the
third generation Yukawa couplings and the baryon number violating coupling, and
those of the soft supersymmetry breaking trilinear couplings. From the analysis
of the fixed point behaviour, we obtain upper and lower bounds on the baryon
number violating coupling $\lambda_{233}''$, as well as on the supersymmetry
breaking trilinear couplings.
","[{""version"":""v1"",""created"":""Wed, 24 Nov 1999 06:26:53 GMT""},{""version"":""v2"",""created"":""Thu, 27 Apr 2000 11:54:05 GMT""}]","2014-11-17"
"hep-ph/9911465","Walter Grimus","W. Grimus and H. Neufeld","3-Neutrino Mass Spectrum from Combining Seesaw and Radiative Neutrino
  Mass Mechanisms","9 pages, Revtex, no figures; misprints corrected","Phys.Lett.B486:385-390,2000","10.1016/S0370-2693(00)00769-3","UWThPh-1999-71, IFIC-99-84","hep-ph",,"  We extend the Standard Model by adding a second Higgs doublet and a
right-handed neutrino singlet with a heavy Majorana mass term. In this model,
there are one heavy and three light Majorana neutrinos with a mass hierarchy
m_3 >> m_2 >> m_1 such that that only m_3 is non-zero at the tree level and
light because of the seesaw mechanism, m_2 is generated at the one-loop and m_1
at the two-loop level. We show that the atmospheric neutrino oscillations and
large mixing MSW solar neutrino transitions with $\Delta m^2_\mathrm{atm}
\simeq m_3^2$ and $\Delta m^2_\mathrm{solar} \simeq m_2^2$, respectively, are
naturally accommodated in this model without employing any symmetry.
","[{""version"":""v1"",""created"":""Wed, 24 Nov 1999 11:13:58 GMT""},{""version"":""v2"",""created"":""Wed, 26 Jan 2000 14:59:30 GMT""}]","2011-08-17"
"hep-ph/9911466","Yue-liang Wu","K.C. Chou (CAS), W. Palmer (OSU), E.A. Paschos (DOU) and Y.L. Wu (ITP)","Searching for Rephase-Invariant CP- and CPT-violating Observables in
  Meson Decays","21 pages, no figures, revised version for more readable and
  references added","Eur.Phys.J.C16:279-287,2000","10.1007/s100520050020","DO-TH-99-21, OHSTPY-HEP-T-99-026","hep-ph",,"  We present a general model-independent and rephase-invariant formalism that
cleanly relates CP and CPT noninvariant observables to the fundamental
parameters. Different types of CP and CPT violations in the K^0-, B^0-, B_s^0-
and D^0-systems are explicitly defined. Their importance for interpreting
experimental measurements of CP and CPT violations is emphasized. In
particular, we show that the time-dependent measurements allow one to extract a
clean signature of CPT violation.
","[{""version"":""v1"",""created"":""Wed, 24 Nov 1999 13:23:30 GMT""},{""version"":""v2"",""created"":""Fri, 4 Feb 2000 03:25:07 GMT""}]","2011-09-13"
"hep-ph/9911467","Volodymyr Uleshchenko","A. Szczurek, V. Uleshchenko","On the range of validity of the QCD-improved parton model","12 pages, LaTeX with 3 eps figures","Phys.Lett. B475 (2000) 120-126","10.1016/S0370-2693(00)00066-6",,"hep-ph",,"  Based on the world DIS data we extract the experimental F_2^p-F_2^n as a
function of Bjorken-x and photon virtuality Q^2, using two different methods.
Both methods lead to identical results. We find that the standard PDFs fail to
describe the experimental data below Q^2 < 7 GeV^2, which is much higher than
for F_2^p and F_2^d separately. The difference between PDFs and the
experimental data cannot be understood as due to nuclear effects in the
deuteron, and evidently suggests substantial nonsinglet higher-twist effects.
The trend of the experimental data is approximately explained by a recent
two-component model of the nucleon structure functions and suggests strong
Q^2-dependence of the Gottfried Sum, in disagreement with the parton model
interpretation. The large negative higher-twist effects can explain the
difference between the value of the Gottfied integral obtained recently by the
E866 Drell-Yan experiment at Fermilab and an older NMC result.
","[{""version"":""v1"",""created"":""Wed, 24 Nov 1999 13:36:32 GMT""}]","2009-10-31"
