"hep-ph/9911468","Abdelhak Djouadi","Abdelhak Djouadi (LPMT Montpellier)","Supersymmetry Effects on High-Precision Electroweak Observables","Latex, 18 pages, 6 figures, sprocl.sty included. Lecture given at X
  Escola de Particulas e Campos, Feb. 1999, Sao Paulo, Brazil",,,"PM/99-51","hep-ph",,"  I summarise the virtual effects of the new particles predicted by
supersymmetric extensions of the Standard Model on the high-precision
electroweak observables measured at LEP/SLC, the Tevatron and CLEO. I will then
discuss in some details the two-loop SUSY-QCD corrections to the $\rho$
parameter.
","[{""version"":""v1"",""created"":""Wed, 24 Nov 1999 13:55:51 GMT""}]","2007-05-23"
"hep-ph/9911469","Sergey Goloskokov","S.V.Goloskokov","Diffractive hadron production and pomeron coupling structure","6 pages, latex, 4 figures, to be published in Proc. of the
  International Bogolyubov Conference ""Problems of Theoretical and Mathematical
  Physics"", September 27- October 6, Moscow-Dubna-Kyiv",,,,"hep-ph",,"  Large-distance effects, which lead to the spin-flip part of the hadron
-pomeron coupling in QCD -models, are discussed. We study spin asymmetries in
exclusive reactions and in diffractive $Q \bar Q$ and vector meson production
which are sensitive to the spin-dependent part of the pomeron coupling.
","[{""version"":""v1"",""created"":""Wed, 24 Nov 1999 14:23:22 GMT""}]","2007-05-23"
"hep-ph/9911470","Renata Zukanovich Funchal","A. M. Gago (Instituto de Fisica, USP and Seccion Fisica, Departamento
  de Ciencias, Pontificia Universidad Catolica del Peru), L. P. Freitas
  (Instituto de Fisica, USP), O. L. G. Peres (Instituto de Fisica Gleb
  Wataghin,UNICAMP), R. Zukanovich Funchal (Instituto de Fisica,USP)","Testing Flavor Changing Neutrino Interactions in Long Baseline
  Experiments","21 pages with 7 figures, uses Elsart style and epsfig",,,"IFUSP-DFN/99-020","hep-ph",,"  We have investigated the possibility of discerning mass from flavor changing
neutrino interactions induced $\nu_\mu \to \nu_\tau$ oscillations in the long
baseline neutrino experiments K2K and MINOS. We have found that for virtually
any value of the flavor conserving parameter $\epsilon^\prime$ it will be
possible to, independently, distinguish these two mechanisms at K2K, if the
flavor changing parameter $\epsilon$ is in the range $\epsilon \gsim 0.77$, and
at MINOS, if $\epsilon \gsim 0.2$. Moreover, if K2K measures a depletion of the
expected $\nu_\mu$ flux then MINOS will either observe or discard completely
flavor changing neutrino oscillations.
","[{""version"":""v1"",""created"":""Wed, 24 Nov 1999 14:30:47 GMT""}]","2007-05-23"
"hep-ph/9911471","Nikolay Ivanov","N.Ya.Ivanov (YerPhI,Yerevan), A.Capella (LPT,Orsay),
  A.B.Kaidalov(ITEP,Moscow)","Single Spin Asymmetry in Heavy Flavor Photoproduction as a Test of pQCD","15 pages, ReVTeX, 13 .eps figures. The subsection added to correspond
  to journal version","Nucl.Phys.B586:382-396,2000","10.1016/S0550-3213(00)00399-0","LPT-ORSAY 99-98","hep-ph",,"  We analyze in the framework of pQCD the properties of the single spin
asymmetry in heavy flavor production by linearly polarized photons. At leading
order, the parallel- perpendicular asymmetry in azimuthal distributions of both
charm and bottom quark is predicted to be about 20% in a wide region of initial
energy. Our analysis shows that the next-to-leading order corrections
practically do not affect the Born predictions for the azimuthal asymmetry at
energies of the fixed target experiments. Both leading and next-to-leading
order predictions for the asymmetry are insensitive to within few percent to
theoretical uncertainties in the QCD input parameters: $m_{Q}$, $\mu_{R}$,
$\mu_{F}$, $\Lambda_{QCD}$ and in the gluon distribution function. We estimate
also nonperturbative contributions to azimuthal distributions due to the gluon
transverse motion in the target and the final quark fragmentation. Our
calculations show that nonperturbative corrections to a $B$-meson azimuthal
asymmetry are negligible. We conclude that measurements of the single spin
asymmetry would provide a good test of pQCD applicability to heavy flavor
production at fixed target energies.
","[{""version"":""v1"",""created"":""Wed, 24 Nov 1999 15:26:13 GMT""},{""version"":""v2"",""created"":""Fri, 6 Oct 2000 09:43:01 GMT""}]","2011-01-25"
"hep-th/9911179","Michael Bordag","M. Bordag and D.V. Vassilevich","Casimir force between Chern-Simons surfaces","8 pages, 1 figure","Phys.Lett.A268:75-80,2000","10.1016/S0375-9601(00)00159-6",,"hep-th",,"  We calculate the Casimir force between two parallel plates if the boundary
conditions for the photons are modified due to presence of the Chern-Simons
term. We show that this effect should be measurable within the present
experimental technique.
","[{""version"":""v1"",""created"":""Tue, 23 Nov 1999 16:37:24 GMT""}]","2008-11-26"
"hep-th/9911180","Ali Chamseddine","A. H. Chamseddine and W. A. Sabra (CAMS, AUB)","D=7 SU(2) Gauged Supergravity From D=10 Supergravity","10 pages. References added and some comments modified","Phys.Lett. B476 (2000) 415-419","10.1016/S0370-2693(00)00129-5","CAMS/99-04","hep-th",,"  The theory of SU(2) gauged seven-dimensional supergravity is obtained by
compactifying ten dimensional N=1 supergravity on the group manifold SU(2).
","[{""version"":""v1"",""created"":""Tue, 23 Nov 1999 17:04:55 GMT""},{""version"":""v2"",""created"":""Tue, 30 Nov 1999 16:46:10 GMT""}]","2009-10-31"
"hep-th/9911181",,"Dan N. Vollick","Cosmology on a Three-Brane","11 pages, LaTex. New solutions with a cosmological constant have been
  added","Class.Quant.Grav. 18 (2001) 1-10","10.1088/0264-9381/18/1/301",,"hep-th gr-qc hep-ph",,"  In this paper a general solution is found for a five dimensional orbifold
spacetime that induces a $k=0$ cosmology on a three-brane. Expressions for the
energy density and pressure on the brane in terms of the brane metric are
derived. Given a metric on the brane it is possible to find five dimensional
spacetimes that contain the brane. This calculation is carried out for an
inflationary universe and for a metric that corresponds to a radiation
dominated universe in standard cosmology. It is also shown that any $k=0$
cosmology can be embedded in a flat five dimensional orbifold spacetime and the
equation of the three-brane surface is derived. For an inflationary universe it
is shown that the surface is the usual hyperboloid representation of de Sitter
space, although it is embedded in an orbifold spacetime.
","[{""version"":""v1"",""created"":""Tue, 23 Nov 1999 20:01:20 GMT""},{""version"":""v2"",""created"":""Tue, 30 Nov 1999 17:58:46 GMT""},{""version"":""v3"",""created"":""Tue, 11 Apr 2000 21:43:28 GMT""}]","2009-10-31"
"hep-th/9911182","Asad Naqvi","Asad Naqvi","Propagators for massive symmetric tensor and p-forms in AdS(d+1)","22 pages","JHEP 9912 (1999) 025","10.1088/1126-6708/1999/12/025","MIT-CTP-2928","hep-th",,"  We construct propagators in Euclidean AdS(d+1) space-time for massive p-forms
and massive symmetric tensors.
","[{""version"":""v1"",""created"":""Tue, 23 Nov 1999 20:58:11 GMT""}]","2009-10-31"
"hep-th/9911183","Ali Kaya","Ali Kaya","Scalar Absorption by Noncommutative D3-branes","13 pages, Latex, corrected some typos (in the text)","JHEP 0001 (2000) 012","10.1088/1126-6708/2000/01/012",,"hep-th",,"  The classical cross section for low energy absorption of the RR-scalar by a
stack of noncommutative D3-branes in the large NS B-field limit is calculated.
In the spirit of AdS/CFT correspondence, this cross section is related to two
point function of a certain operator in noncommutative Yang-Mills theory.
Compared at the same gauge coupling, the result agrees with that of obtained
from ordinary D3-branes. This is consistent with the expectation that ordinary
and noncommutative Yang-Mills theories are equivalent below the
noncommutativity scale, but it is a nontrivial prediction above this scale.
","[{""version"":""v1"",""created"":""Tue, 23 Nov 1999 21:14:56 GMT""},{""version"":""v2"",""created"":""Wed, 12 Jan 2000 04:26:19 GMT""},{""version"":""v3"",""created"":""Sun, 30 Jan 2000 01:30:24 GMT""}]","2009-10-31"
"hep-th/9911184","Sayuri Miyagi","S. Miyagi","Yang-Mills instantons on 7-dimensional manifold of G_2 holonomy","9 pages LaTeX, 1 figure","Mod.Phys.Lett.A14:2595-2604,1999","10.1142/S0217732399002728",,"hep-th",,"  We investigate Yang-Mills instantons on a 7-dimensional manifold of G_2
holonomy. By proposing a spherically symmetric ansatz for the Yang-Mills
connection, we have ordinary differential equations as the reduced instanton
equation, and give some explicit and numerical solutions.
","[{""version"":""v1"",""created"":""Tue, 23 Nov 1999 22:56:04 GMT""}]","2010-11-19"
"hep-th/9911185","Francois Englert","F. Englert","Primordial Inflation","LaTeX, 24 pages, 4 figures, presented at the Erice International
  School on Basics and Highlights in Fundamental Physics, August 1999",,,"ULB-TH-99/21","hep-th gr-qc",,"  A macroscopic universe may emerge naturally from a Planck cell fluctuation by
unfolding through a stage of exponential expansion towards a homogeneous
cosmological background. Such primordial inflation requires a large and
presumably infinite degeneracy at the Planck scale, rooted in the unbounded
negative gravitational energy stored in conformal classes. This complex Planck
structure is consistent with a quantum tunneling description of the transition
from the Planck scale to the inflationary era and implies, in the limit of
vanishing Planck size, the Hartle-Hawking no-time boundary condition. On the
other hand, string theory give credence to the holographic principle and the
concomitant depletion of states at the Planck scale. The apparent
incompatibility of primordial inflation with holography either invalidates one
of these two notions or relegates the nature of the Planck size outside the
realm of quantum physics, as we know it.
","[{""version"":""v1"",""created"":""Tue, 23 Nov 1999 23:44:04 GMT""}]","2007-05-23"
"hep-th/9911186","Piljin Yi","Kimyeong Lee, Piljin Yi","Quantum Spectrum of Instanton Solitons in Five Dimensional
  Noncommutative U(N) Theories","14 pages, 1 figure, LaTeX","Phys.Rev.D61:125015,2000","10.1103/PhysRevD.61.125015","KIAS-P99104, SNUTP-99-048","hep-th",,"  We explore quantum states of instanton solitons in five dimensional
noncommutative Yang-Mills theories. We start with maximally supersymmetric U(N)
theory compactified on a circle S^1, and derive the low energy dynamics of
instanton solitons, or calorons, which is no longer singular. Quantizing the
low energy dynamics, we find N physically distinct ground states with a unit
Pontryagin number and no electric charge. These states have a natural D-string
interpretation. The conclusion remains unchanged as we decompactify S^1, as
long as we stay in the Coulomb phase by turning on adjoint Higgs expectation
values.
","[{""version"":""v1"",""created"":""Wed, 24 Nov 1999 01:09:50 GMT""}]","2010-11-19"
"hep-th/9911187","Mark Walton","Mark Walton","Affine Kac-Moody Algebras and the Wess-Zumino-Witten Model","68 pages, harvmac big, 24 figures, lecture notes, Istanbul, 8/98",,,,"hep-th",,"  These lecture notes are a brief introduction to Wess-Zumino-Witten models,
and their current algebras, the affine Kac-Moody algebras. After reviewing the
general background, we focus on the application of representation theory to the
computation of 3-point functions and fusion rules.
","[{""version"":""v1"",""created"":""Wed, 24 Nov 1999 01:26:57 GMT""}]","2007-05-23"
"hep-th/9911188","Juan Mendez","Juan Mendez","Electromagnetic Duality Based on Axiomatic Maxwell Equations","14 pages, LaTex and AMS-LaTex packages.New version, modified and
  reduced",,,,"hep-th",,"  No positive result has been obtained on the magnetic monopoles search. This
allows to consider different theoretical approaches as the proposed in this
paper, developed in the framework of the Einstein General Relativity. The
properties of second rank skew-symmetrical fields are the basis of
electromagnetic theories. In the space-time the Hodge duality of these fields
is narrowly related with the rotations in the SO(2) group. An axiomatic
approach to a dual electromagnetic theory is presented. The main result of this
paper is that the stress-energy tensor can be decomposed on two parts: the
parallel and the perpendicular. The parallel part is easily integrated on the
Lagrangian approach, while some problems appears with the perpendicular part. A
solution with the parallel part alone is found, it generates a non-standard
model of magnetic monopoles neutral to the electric charges.
","[{""version"":""v1"",""created"":""Wed, 24 Nov 1999 09:37:18 GMT""},{""version"":""v2"",""created"":""Tue, 1 Feb 2000 13:06:22 GMT""}]","2007-05-23"
"hep-th/9911189","John F. Wheater","Martin G. Harris and John F. Wheater","Peeling and Multi-critical Matter Coupled to Quantum Gravity","30 pages, 8 eps figures. Typos corrected; extended discussion at end,
  and at the beginning","Nucl.Phys. B586 (2000) 518-546","10.1016/S0550-3213(00)00432-6","OUTP-99-44P","hep-th",,"  We show how to determine the unknown functions arising when the peeling
decomposition is applied to multi-critical matter coupled to two-dimensional
quantum gravity and compute the loop-loop correlation functions. The results
that $\eta=2+2/(2K-3)$ and $\nu=1-3/2K$ agree with the slicing decomposition,
and satisfy Fisher scaling.
","[{""version"":""v1"",""created"":""Wed, 24 Nov 1999 10:43:22 GMT""},{""version"":""v2"",""created"":""Wed, 9 Feb 2000 09:36:01 GMT""},{""version"":""v3"",""created"":""Thu, 6 Jul 2000 09:57:32 GMT""}]","2009-10-31"
"hep-th/9911190","Ralph Blumenhagen","Carlo Angelantonj and Ralph Blumenhagen","Discrete Deformations in Type I Vacua","12 pages, TeX, harvmac, 4 figures, eq.(3.15) changed","Phys.Lett. B473 (2000) 86-93","10.1016/S0370-2693(99)01480-X","HUB-EP-99/60, LPTENS 99/38","hep-th",,"  We study supersymmetric orientifolds where the world-sheet parity
transformation is combined with a conjugation of some compact complex
coordinates. We investigate their T-duality relation to standard orientifolds
and discuss the origin of continuous and discrete moduli. In contrast to
standard orientifolds, the antisymmetric tensor describes a continuous
deformation, while the off-diagonal part of the metric is frozen to quantized
values and is responsible for the rank reduction of the gauge group. We also
give a geometrical interpretation of some recently constructed six-dimensional
permutational orientifolds.
","[{""version"":""v1"",""created"":""Wed, 24 Nov 1999 13:58:42 GMT""},{""version"":""v2"",""created"":""Fri, 17 Dec 1999 16:57:00 GMT""}]","2009-10-31"
"hep-th/9911191","Musongela Lubo","Musongela Lubo","Quantum Minimal Length and Transplanckian Photons","25 pages, 7 figures","Phys.Rev. D61 (2000) 124009","10.1103/PhysRevD.61.124009",,"hep-th",,"  In this paper we first give arguments supporting the idea that a B.T.Z black
hole can face a transplankian problem even when its mass is small. K.M.M
quantum theory is applied to the Hawking evaporation of the Schwarzchild and
B.T.Z black holes. Working in the physically safe quasi position
representation, we argue that the oscillating term present in a previous
analysis is removed so that actually one doesn't need an average procedure. We
expand the s wave function as the exponential of a series in the minimal length
of the new quantum theory. This reduces an infinite order differential equation
to a numerable set of finite order ones. We obtain the striking result that the
infinity of arbitrary constants induced by the order of the wave equation has
no physical meaning due to normalization. We finally construct gaussian wave
pacqets and study their trajectories. We suggest a quantitative description of
the non locality zone and its dependance on the K.M.M energy scale. Potential
incidences on unitarity are briefly evoqued.
","[{""version"":""v1"",""created"":""Wed, 24 Nov 1999 14:13:23 GMT""}]","2009-10-31"
"hep-th/9911192","Gesualdo Delfino","G. Delfino","Correlators in integrable quantum field theory. The scaling RSOS models","22 pages, latex","Nucl.Phys. B583 (2000) 597-613","10.1016/S0550-3213(00)00324-2",,"hep-th cond-mat",,"  The study of the scaling limit of two-dimensional models of statistical
mechanics within the framework of integrable field theory is illustrated
through the example of the RSOS models. Starting from the exact description of
regime III in terms of colliding particles, we compute the correlation
functions of the thermal, $\phi_{1,2}$ and (for some cases) spin operators in
the two-particle approximation. The accuracy obtained for the moments of these
correlators is analysed by computing the central charge and the scaling
dimensions and comparing with the exact results. We further consider the
(generally non-integrable) perturbation of the critical points with both the
operators $\phi_{1,3}$ and $\phi_{1,2}$ and locate the branches solved on the
lattice within the associated two-dimensional phase diagram. Finally we discuss
the fact that the RSOS models, the dilute $q$-state Potts model at and the O(n)
vector model are all described by the same perturbed conformal field theory.
","[{""version"":""v1"",""created"":""Wed, 24 Nov 1999 15:13:44 GMT""}]","2009-10-31"
"hep-th/9911193","Hyung Won Lee","Y.S. Myung, Gungwon Kang, H.W. Lee (Inje University)","Greybody factor for D3-branes in B field","some discussions and references are added, 10 pages, no figure,
  ReVTeX","Phys.Rev.D62:047503,2000","10.1103/PhysRevD.62.047503","INJE-TP-99-8","hep-th",,"  We calculate the effect of noncommutative spacetime on the greybody factor on
the supergravity side. For this purpose we introduce a system of D3-branes with
a constant NS $B$-field along their world volume directions ($x_2, x_3$).
Considering the propagation of minimally coupled scalar with non-zero momentum
along($x_2, x_3$), we derive an exact form of the greybody factor in $B$ field.
It turns out that $\sigma^{B\ne0}_l > \sigma^{B=0}_l$. This means that the
presence of $B$-field (the noncommutativity) suppresses the potential barrier
surrounding the black hole. As a result, it comes out the increase of greybody
factor.
","[{""version"":""v1"",""created"":""Wed, 24 Nov 1999 15:38:20 GMT""},{""version"":""v2"",""created"":""Mon, 29 Nov 1999 05:52:28 GMT""},{""version"":""v3"",""created"":""Sat, 19 Feb 2000 01:32:10 GMT""}]","2014-11-18"
"math-ph/9911030","Sardanashvily Gennadi","L.Mangiarotti and G.Sardanashvily","Jets and connections in commutative and noncommutative geometry","29 pages, LaTeX",,,,"math-ph math.DG math.MP",,"  It is emphasized that equivalent definitions of connections on modules over
commutative rings are not so in noncommutative geometry.
","[{""version"":""v1"",""created"":""Tue, 23 Nov 1999 16:50:43 GMT""}]","2007-05-23"
"math-ph/9911031","Alexander G. Ramm","A. G. Ramm","Krein's method in inverse scattering",,,,,"math-ph math.AP math.MP",,"  A detailed discussion of the Krein's results (applicable for solving the
inverse scattering problem) is given with complete proofs.
","[{""version"":""v1"",""created"":""Tue, 23 Nov 1999 20:09:25 GMT""}]","2007-05-23"
"math/9911184","Giorgio Ottaviani","Pavel I. Katsylo, Giorgio Ottaviani","Regularity of the Moduli Space of Instanton Bundles $MI_{\Bbb P^3}(5)$","13 pages, AMS-TEX",,,,"math.AG",,"  We prove that the moduli space of mathematical instanton bundles on ${\Bbb
P}^3$ with $c_2=5$ is smooth.
","[{""version"":""v1"",""created"":""Tue, 23 Nov 1999 16:32:17 GMT""}]","2007-05-23"
"math/9911185","William P. Thurston","John Conway, Olaf Delgado Friedrichs, Daniel H. Huson, William P.
  Thurston","On Three-Dimensional Space Groups","26 pages, 8 figures",,,,"math.MG math.GT",,"  An entirely new and independent enumeration of the crystallographic space
groups is given, based on obtaining the groups as fibrations over the plane
crystallographic groups, when this is possible. For the 35 ``irreducible''
groups for which it is not, an independent method is used that has the
advantage of elucidating their subgroup relationships. Each space group is
given a short ``fibrifold name'' which, much like the orbifold names for
two-dimensional groups, while being only specified up to isotopy, contains
enough information to allow the construction of the group from the name.
","[{""version"":""v1"",""created"":""Tue, 23 Nov 1999 20:22:31 GMT""}]","2007-05-23"
"math/9911186","Daniele Guido","Franca Figliolini, Daniele Guido","Inclusions of second quantization algebras","LaTex, 9 pages, requires cmsams-l.cls","in ""Stochastic Processes, Physics and Geometry: New Interplays.
  II: A Volume in Honor of Sergio Albeverio"", F. Gesztesy, H. Holden, J. Jost,
  S. Paycha, M. R\""ockner, S. Scarlatti, Editors, CMS Conference Proceedings,
  29. Providence, RI, 2000",,,"math.OA",,"  In this note we study inclusions of second quantization algebras, namely
inclusions of von Neumann algebras on the Fock space of a separable complex
Hilbert space H, generated by the Weyl unitaries with test functions in closed,
real linear subspaces of H. We show that the class of irreducible inclusions of
standard second quantization algebras is non empty, and that they are depth two
inclusions, namely the third relative commutant of the Jones' tower is a
factor. When the smaller vector space has codimension n into the bigger, we
prove that the corresponding inclusion of second quantization algebras is given
by a cross product with R^n. This shows in particular that the inlcusions
studied in hep-th/9703129, namely the inclusion of the observable algebra
corresponding to a bounded interval for the (n+p)-th derivative of the current
algebra on the real line into the observable algebra for the same interval and
the n-th derivative theory is given by a cross product with R^p. On the
contrary, when the codimension is infinite, we show that the inclusion may be
non regular (cf. M. Enock, R. Nest, J. Funct. Anal. 137 (1996), 466-543), hence
do not correspond to a cross product with a locally compact group.
","[{""version"":""v1"",""created"":""Tue, 23 Nov 1999 18:30:58 GMT""}]","2007-05-23"
"math/9911187","Chunsheng Ban","Chunsheng Ban, Lee J. McEwan, and Andr\'as N\'emethi","The Embedded Resolution of f(x,y)+z^2: (C^3,0) -> (C,0)","AMS-LaTeX v1.2, 17 pages",,,,"math.AG",,"  The goal of this paper is the presentation of an ``embedded resolution'' of
({f(x,y)+z^2=0},0) \subset (C^3,0) using the method of Jung.
","[{""version"":""v1"",""created"":""Tue, 23 Nov 1999 18:46:28 GMT""},{""version"":""v2"",""created"":""Wed, 24 Nov 1999 06:04:29 GMT""}]","2016-08-15"
"math/9911188","Carlos Gutierrez","Carlos Gutierrez (IMPA - Rio de Janeiro and ICMC-USP at Sao Carlos)","On $C^r-$closing for flows on 2-manifolds","7 pages, 1 figure",,"10.1088/0951-7715/13/6/301",,"math.DS",,"  For some full measure subset B of the set of iet's (i.e. interval exchange
transformations) the following is satisfied: Let X be a $C^r$, $1\le r\le
\infty$, vector field, with finitely many singularities, on a compact
orientable surface M. Given a nontrivial recurrent point $p\in M$ of X, the
holonomy map around p is semi-conjugate to an iet $E :[0,1) \to [0,1).$ If
$E\in B$ then there exists a $C^r$ vector field Y, arbitrarily close to X, in
the $C^r-$topology, such that Y has a closed trajectory passing through p.
","[{""version"":""v1"",""created"":""Tue, 23 Nov 1999 21:26:17 GMT""}]","2009-10-31"
"math/9911189","Yael Karshon","Yael Karshon and Susan Tolman","Centered complexity one Hamiltonian torus actions","30 pages. In the revised version,as an application of our main
  result, we construct a full packing of each of the Grassmanians Gr^+(2,R^5)
  and Gr^+(2,R^6) by two equal symplectic balls",,,,"math.SG math.AG math.DG",,"  We consider symplectic manifolds with Hamiltonian torus actions which are
""almost but not quite completely integrable"": the dimension of the torus is one
less than half the dimension of the manifold. We provide a complete set of
invariants for such spaces when they are ""centered"" and the moment map is
proper. In particular, this classifies the moment map preimages of all
sufficiently small open sets, which is an important step towards global
classification. As an application, we construct a full packing of each of the
Grassmanians Gr^+(2,R^5) and Gr^+(2,R^6) by two equal symplectic balls.
","[{""version"":""v1"",""created"":""Tue, 23 Nov 1999 22:39:30 GMT""},{""version"":""v2"",""created"":""Wed, 23 Feb 2000 19:13:24 GMT""}]","2007-05-23"
"math/9911190","Xiaoping Xu","Xiaoping xu","Simple conformal superalgebras of finite growth","40pages, Latex; To appear in Algebra Colloquium",,,,"math.QA math-ph math.MP math.RT",,"  In this paper, we construct six families of infinite simple conformal
superalgebra of finite growth based on our earlier work on constructing vertex
operator superalgebras from graded assocaitive algebras. Three subfamilies of
these conformal superalgebras are generated by simple Jordan algebras of types
A, B and C in a certain sense.
","[{""version"":""v1"",""created"":""Wed, 24 Nov 1999 03:46:18 GMT""}]","2007-05-23"
