"adap-org/9911006","Frank Schweitzer","Frank Schweitzer","Modelling Migration and Economic Agglomeration with Active Brownian
  Particles","For related work see http://ais.gmd.de/~frank/","Advances in Complex Systems, vol.1, no.1 (1998) 11-37",,,"adap-org cond-mat.stat-mech nlin.AO",,"  We propose a stochastic dynamic model of migration and economic aggregation
in a system of employed (immobile) and unemployed (mobile) agents which respond
to local wage gradients. Dependent on the local economic situation, described
by a production function which includes cooperative effects, employed agents
can become unemployed and vice versa. The spatio-temporal distribution of
employed and unemployed agents is investigated both analytically and by means
of stochastic computer simulations. We find the establishment of distinct
economic centers out of a random initial distribution. The evolution of these
centers occurs in two different stages: (i) small economic centers are formed
based on the positive feedback of mutual stimulation/cooperation among the
agents, (ii) some of the small centers grow at the expense of others, which
finally leads to the concentration of the labor force in different extended
economic regions. This crossover to large-scale production is accompanied by an
increase in the unemployment rate. We observe a stable coexistence between
these regions, although they exist in an internal quasistationary
non-equilibrium state and still follow a stochastic eigendynamics.
","[{""version"":""v1"",""created"":""Wed, 24 Nov 1999 09:36:20 GMT""}]","2007-05-23"
"astro-ph/9911421","Max Tegmark","Nikhil Padmanabhan, Max Tegmark, Andrew J. S. Hamilton","The power spectrum of the CfA/SSRS UZC galaxy redshift survey","Revised to match published ApJ version. Color figs and data at
  http://www.hep.upenn.edu/~max/uzc_frames.html or from max@physics.upenn.edu.
  14 ApJ pages, 20 figs","Astrophys.J.520:52-64,2001","10.1086/319700",,"astro-ph",,"  The combined CfA2/SSRS redshift catalog has recently been improved and made
public. We compute the redshift-space power spectrum of this catalog using the
regions at -2.5 < delta < 50 north (8h < alpha < 17h) and south (20h < alpha <
3h, b < -13) of the Galactic plane, where it is 98% complete down to Zwicky
magnitude 15.5 and contains 13,681 galaxies. Our analysis uses Heavens-Taylor
mode expansion, Karhunen-Loeve data compression and the Fisher matrix technique
to compute quadratic band power estimates. This allows an exact calculation of
window functions, including the integral constraint, in addition to the
production of a power spectrum with uncorrelated error bars. Our results with
this larger data set agree well with previous studies. We analyze 101Mpc/h and
130Mpc/h volume-limited subsets in addition to the full magnitude-limited
sample, and our results are well fit by, e.g., Lambda-CDM models with bias
b=1.2, 1.4 and 1.4, respectively. We estimate the effect of extinction using
the Schlegel, Finkbeiner & Davis dust map. Our results are exclusively for the
redshift space galaxy power spectrum, so they can only be compared with
theoretical predictions if appropriate corrections are made for biasing and
redshift space distortions.
","[{""version"":""v1"",""created"":""Tue, 23 Nov 1999 23:26:37 GMT""},{""version"":""v2"",""created"":""Wed, 24 Nov 1999 04:55:29 GMT""},{""version"":""v3"",""created"":""Tue, 27 Feb 2001 19:49:36 GMT""}]","2009-10-31"
"astro-ph/9911438","Denis Puy","L. Grenacher, Ph. Jetzer, D. Puy (PSI and Institute of Theoretical
  Physics-University of Zurich, Switzerland)","H2 molecules and cold clouds in cooling flow clusters","Poster presented at the International Conference ""H2 in Space"",
  IAP-Paris (France), September 18th-October 1st, 1999",,,"ZU-TH 36/99","astro-ph",,"  We investigated the cooling mechanism due to H2 and HD molecules in order to
determine the minimum temperature achievable by cold H2-HD clouds in cooling
flow clusters.
","[{""version"":""v1"",""created"":""Tue, 23 Nov 1999 16:35:00 GMT""}]","2007-05-23"
"astro-ph/9911439","Craig L. Sarazin","Craig L. Sarazin","Thermal and Nonthermal Effects of Merger Shocks in Clusters of Galaxies","To appear in Large Scale Structure in the X-ray Universe, editted by
  M. Plionis and I. Georgantopoulos (Paris: Editions Frontieres), in press. 4
  pages with 5 embedded Postscript figures in conf-X.sty",,,,"astro-ph",,"  Cluster mergers drive shocks into the intracluster medium which heat and
compress the thermal gas. X-ray observations of shocks can be used to determine
the geometry and kinematics of the merger. Merger shocks should also accelerate
relativistic particles. Electrons with gamma about 300 (E about 150 MeV) are
expected to be particularly common. Relativistic particles produce observed EUV
emission, hard X-ray tails, and diffuse radio emission. The predicted gamma-ray
fluxes of clusters should make them easily observable with GLAST.
","[{""version"":""v1"",""created"":""Tue, 23 Nov 1999 16:40:52 GMT""}]","2007-05-23"
"astro-ph/9911440","Jonathan R. Ellis","John Ellis (CERN)","Particles and Cosmology: Learning from Cosmic Rays","26 pages LaTeX, including 17 figures, Contribution to the Proceedings
  of the 26th International Cosmic-Ray Conference, Salt Lake City, August 1999",,"10.1063/1.1291467","CERN-TH/99-358","astro-ph",,"  The density budget of the Universe is reviewed, and then specific particle
candidates for non-bayonic dark matter are introduced, with emphasis on the
relevance of cosmic-ray physics. The sizes of the neutrino masses indicated by
recent atmospheric and solar neutrino experiments may be too small to
contribute much hot dark matter. My favoured candidate for the dominant cold
dark matter is the lightest supersymmetric particle, which probably weighs
between about 50 GeV and about 600 GeV. Strategies to search for it via cosmic
rays due to annihilations in the halo, Sun and Earth, or via direct scattering
experiments, are mentioned. Possible superheavy relic particles are also
discussed, in particular metastable string- or M-theory cryptons, that may be
responsible for the ultra-high-energy cosmic rays. Finally, it is speculated
that a non-zero contribution to the cosmological vacuum energy might result
from incomplete relaxation of the quantum-gravitational vacuum.
","[{""version"":""v1"",""created"":""Tue, 23 Nov 1999 17:33:35 GMT""}]","2009-10-31"
"astro-ph/9911441","Marcella","F. Caputo (Astron. Obs. of Roma), M. Marconi (Astron. Obs. of
  Capodimonte), I. Musella (Astron. Obs. of Capodimonte)","Theoretical models for classical cepheids: V. Multiwavelength relations","20 pages, 20 postscript figures, accepted for publication on
  Astronomy and Astrophysics","Astron.Astrophys.354:610-620,2000",,,"astro-ph",,"  From a theoretical study based on nonlinear, nonlocal and time-dependent
convective pulsating models at varying mass and chemical composition, we
present the predicted Period-Luminosity, Period-Color, Color-Color and
Period-Luminosity-Color relations in the BVRIJK bands for Classical Cepheids.
All the theoretical relations are, in various degrees, metallicity dependent
and the comparison with observed data for MC and Galactic Cepheids show a fair
agreement which supports the validity of the pulsating models.
","[{""version"":""v1"",""created"":""Tue, 23 Nov 1999 19:16:00 GMT""}]","2009-04-13"
"astro-ph/9911442","Curtis V. Manning","Curtis Manning, Daniel Stern, Hyron Spinrad and Andrew J. Bunker","A Serendipitous Search for Hy-Redshift Ly$Alpha$ Emission: A Case Study
  of Two Sources at $z\simeq 3$","Poster paper given at the conference ""The Hy-Redshift Universe:
  Galaxy Formation and Evolution at High Redshift"", held in Berkeley, June
  21-24, 1999 Uses latex style file hyfestconf.sty 4 pages, 2 figures, one
  table","Astronomical Society of the Pacific Conference Series Volume 193,
  eds. A. J. Bunker & W. J. M. van Breugel",,,"astro-ph",,"  In the course of our on-going search for serendipitous high-redshift LyA
emission in deep archival Keck spectra, we discovered two LyA emission line
candidates in a moderate dispersion ($\lambda/{\Delta \lambda} +~ 1200$)
spectrogram. Both lines have high equivalent width (EW_{obs}>= 450A), low
velocity dispersions ($\sigma_v ~ 60 km/s), and deconvolved effective radii
$r_e ~ 1.0 h_{50}^{-1}$ kpc. Their sizes and luminosities are suggestive of the
primeval galaxy model of Lin & Murray (1992), based on the self-similar
collapse of an isothermal sphere. We argue that the line emission is LyA, and
it is stellar in origin. The sources are consistent with being primeval.
","[{""version"":""v1"",""created"":""Tue, 23 Nov 1999 22:14:10 GMT""}]","2007-05-23"
"astro-ph/9911443","Amelia C. Ramirez","Amelia C. Ramirez (Universidade de Sao Paulo, Instituto Astronomico e
  Geofisico, IAG-USP), Ronaldo E. de Souza (IAG-USP and Steward Observatory,
  University of Arizona) and David Schade (Dominion Astrophysics Observatory)","Shape of the Galactic Orbits in the CNOC1 Clusters","Accepted for publication in ApJ, April 2000. Latex with aaspp4.sty,
  20 pages, 4 tables, 6 eps figures",,"10.1086/308633",,"astro-ph",,"  We present an analysis of the orbital properties in 9 intermediate-redshifts
cluster of the CNOC1 survey and we compare them to a control sample of 12
nearby clusters. Similar to the nearby elliptical galaxies, the bulge-dominated
galaxies in clusters at redshifts ~0.1-0.4 present orbits that are more
eccentric than those for disk-dominated galaxies. However, the orbital
segregation is less significant than that found for elliptical and spiral
galaxies in nearby cluster. When galaxies are separated by colors - red
galaxies with colors in the rest frame (U-V)_o > 1.4, and blue galaxies with
(U-V)_o =< 1.4 - the strongest orbital segregation is found. Therefore, the
segregation we found seems to modify more efficiently the star formation
activity than the internal shape of the galaxies. When we compare the orbits of
early-type galaxies at intermediate-redshift with those for z=0, they seem to
develop significant changes getting much more eccentric. A different behavior
is observed in the late-type galaxies, which present no-significant evolution
in their orbit shapes.
","[{""version"":""v1"",""created"":""Tue, 23 Nov 1999 22:40:17 GMT""}]","2009-10-31"
"astro-ph/9911446","Kim Weaver","K. A. Weaver, T. Heckman, and M. Dahlem","An X-ray Mini-survey of Nearby Edge-on Starburst Galaxies II. The
  Question of Metal Abundance","(accepted for publication in the Astrophysical Journal)",,"10.1086/308786",,"astro-ph",,"  (abbreviated) We have undertaken an X-ray survey of a far-infrared flux
limited sample of seven nearby edge-on starburst galaxies. Here, we examine the
two X-ray-brightest sample members NGC 253 and M 82 in a self-consistent
manner, taking account of the spatial distribution of the X-ray emission in
choosing our spectral models. There is significant X-ray absorption in the disk
of NGC 253. When this is accounted for we find that multi-temperature thermal
plasma models with significant underlying soft X-ray absorption are more
consistent with the imaging data than single-temperature models with highly
subsolar abundances or models with minimal absorption and non-equilibrium
thermal ionization conditions. Our models do not require absolute abundances
that are inconsistent with solar values or unusually supersolar ratios of the
alpha-burning elements with respect to Fe (as claimed previously). We conclude
that with current data, the technique of measuring abundances in starburst
galaxies via X-ray spectral modeling is highly uncertain.
  Based on the point-like nature of much of the X-ray emission in the PSPC
hard-band image of NGC 253, we suggest that a significant fraction of the
``extended'' X-ray emission in the 3-10 keV band seen along the disk of the
galaxy with ASCA and BeppoSAX (Cappi et al.) is comprised of discrete sources
in the disk, as opposed to purely diffuse, hot gas. This could explain the low
Fe abundances of ~1/4 solar derived for pure thermal models.
","[{""version"":""v1"",""created"":""Wed, 24 Nov 1999 04:53:06 GMT""}]","2009-10-31"
"astro-ph/9911447","Haehnelt","Martin G. Haehnelt (MPA), Matthias Steinmetz (Steward), and Michael
  Rauch (ESO)","Damped Lyman alpha absorber and the faint end of the galaxy luminosity
  function at high redshift","4 pages, LaTeX, emulateapj, 4 postscript figures included, submitted
  to ApJ",,"10.1086/308800",,"astro-ph",,"  We combine predictions for several hierarchical cosmogonies with
observational evidence on damped Lyman alpha systems to establish a
correspondence between the high redshift galaxy population and the properties
of damped Lyman alpha systems. We assume that high redshift galaxies and damped
Lyman alpha systems are hosted by the same dark matter halos and require
consistency between the predicted halo space density, the rate of incidence and
the velocity width distribution of damped Lyman alpha systems, and the observed
galaxy luminosity function at the bright end. We arrive at the following
results: (1) predicted impact parameters between the damped absorption system
and the luminous part of the absorbing galaxy are expected to be very small
(0.3 - 1arcsec) for most galaxies; (2) luminosities of galaxies causing damped
absorption are generally fainter than m_R = 25 and damped Lyman alpha systems
are predicted to sample preferentially the outer regions of galaxies at the
faint end of the galaxy luminosity function at high redshift. Therefore, DLAS
should currently provide the best probe of the progenitors of normal
present-day galaxies.
","[{""version"":""v1"",""created"":""Wed, 24 Nov 1999 10:54:03 GMT""}]","2009-10-31"
"astro-ph/9911448","Hideyuki Kamaya","Ryoichi Nishi and Hideyuki Kamaya","On the Decelerating Shock Instability of Plane-Parallel Slab with Finite
  Thickness","17 pages, 6 figures. The Astrophysical Journal Vol.532 in press",,"10.1086/308592","KUNS-1616","astro-ph",,"  Dynamical stability of the shock compressed layer with finite thickness is
investigated. It is characterized by self-gravity, structure, and shock
condition at the surfaces of the compressed layer. At one side of the shocked
layer, its surface condition is determined via the ram pressure, while at the
other side the thermal pressure supports its structure. When the ram pressure
dominates the thermal pressure, we expect deceleration of the shocked layer.
Especially, in this paper, we examine how the stratification of the
decelerating layer has an effect on its dynamical stability. Performing the
linear perturbation analysis, a {\it more general} dispersion relation than the
previous one obtained by one of the authors is derived. It gives us an
interesting information about the stability of the decelerating layer.
Importantly, the DSI (Decelerating Shock Instability) and the gravitational
instability are always incompatible. We also consider the evolution effect of
the shocked layer. In the early stages of its evolution, only DSI occurs. On
the contrary, in the late stages, it is possible for the shocked layer to be
unstable for the DSI (in smaller scale) and the gravitational instability (in
larger scale). Furthermore, we find there is a stable range of wavenumbers
against both the DSI and the gravitational instability between respective
unstable wavenumber ranges. These stable modes suggest the ineffectiveness of
DSI for the fragmentation of the decelerating slab.
","[{""version"":""v1"",""created"":""Wed, 24 Nov 1999 09:14:51 GMT""}]","2009-10-31"
"astro-ph/9911449","Andrew Blain","Andrew W. Blain (Cambridge)","Galactic morning: the Atacama Large Millimeter Array (ALMA) and the
  evolution of galaxies","10 pages, 3 figures, uses paspconf.sty. To appear in `Science with
  the Atacama Large Millimeter Array', ed. Al Wootten, PASP conf series,
  proceedings of a meeting in Washington DC 6-9 October 1999","'Science with the Atacama Large Millimeter Array' A. Wootten ed.
  ASP Conf. Ser. Vol. 235 (2001; ASP: San Francisco) pp. 261-270",,,"astro-ph",,"  The importance of the Atacama Large Millimeter Array (ALMA) to the study of
high-redshift dusty gas-rich galaxies is described. ALMA will have dramatically
greater sensitivity and angular resolution than existing millimetre(mm) and
submm-wave telescopes. Two key areas are emphasized: i) extremely deep galaxy
surveys down to flux densities of about 10 microJy, two orders of magnitude
deeper than can be reached using existing telescopes; ii) the study of known
high-redshift galaxies, quasars and gravitational lenses. The sensitivity of
ALMA will allow very faint galaxies to be detected, while its angular resolving
power avoids the problem of source confusion. Dust continuum emission,
molecular rotational line emission and atomic fine-structure line emission will
all be detected from high-redshift galaxies. Both the spatial structure of
continuum emission and the spatial and velocity structure of line emission will
be resolved, revealing the astrophysical processes at work in detail. These
programs are very complementary to surveys using the Next Generation Space
Telescope (NGST) and Planck Surveyor.
","[{""version"":""v1"",""created"":""Wed, 24 Nov 1999 10:22:58 GMT""}]","2007-05-23"
"astro-ph/9911450","Marcel Arnould","M. Arnould (1), G. Meynet (2), N. Mowlavi (2) ((1) Institut
  d'Astronomie et d'Astrophysique, Universit\'e Libre de Bruxelles, Belgium,
  (2) Observatoire de Gen\`eve, Switzerland)","Some selected comments on cosmic radioactivities","to appear in a special issue of Chemical Geology in honor of G. J.
  Wasserburg. Requires paspconf.sty; 6 figures",,,,"astro-ph",,"  Radionuclides with half-lives ranging from some years to billions of years
presumably synthesized outside of the solar system are now recorded in `live'
or `fossil' form in various types of materials, like meteorites or the galactic
cosmic rays. They bring specific astrophysical messages the deciphering of
which is briefly reviewed here, with special emphasis on the contribution of
Jerry Wasserburg and his collaborators to this exciting field of research. A
brief mention is also made to $\gamma$-ray line astrophysics. It provides an
interesting information on live short-lived radionuclides in the present
interstellar medium, and thus complements in a very important way the study of
extinct radionuclides in meteorites.
","[{""version"":""v1"",""created"":""Wed, 24 Nov 1999 10:32:02 GMT""}]","2007-05-23"
"astro-ph/9911451","Aaron Golden","Aaron Golden, Andy Shearer (National University of Ireland, Galway),
  Jerry Edelstein (UC Berkeley)","PSR B0656+14: Combined Optical, X-ray & EUV Studies","2 pages, 2 figures, to appear in the Proceedings of IAU Colloquium
  177 : ""Pulsar Astronomy - 2000 & Beyond"", Ed. Kramer, Wex & Wielebinski, ASP
  conf.Series. Uses newpasp.sty",,,,"astro-ph",,"  PSR B0656+14's high energy emission is consistent with that of combined
magnetospheric and thermal (surface & polar cap) emission. Uncertainties with
the radio-derived distance and X-ray instrumentation sensitivities complicate a
definitive thermal characterisation however. A re-analysis of combined
ROSAT/EUVE archival data in conjunction with integrated & phase-resolved
optical photometry is shown to constrain this characterisation.
","[{""version"":""v1"",""created"":""Wed, 24 Nov 1999 12:27:13 GMT""}]","2007-05-23"
"astro-ph/9911452","Martin Pohl","Martin Pohl and Reinhard Schlickeiser","On the conversion of blast wave energy into radiation in active galactic
  nuclei and gamma-ray bursts","Astronomy and Astrophysics, in press",,,,"astro-ph",,"  It has been suggested that relativistic blast waves may power the jets of AGN
and gamma-ray bursts (GRB). We address the important issue how the kinetic
energy of collimated blast waves is converted into radiation. It is shown that
swept-up ambient matter is quickly isotropised in the blast wave frame by a
relativistic two-stream instability, which provides relativistic particles in
the jet without invoking any acceleration process. The fate of the blast wave
and the spectral evolution of the emission of the energetic particles is
therefore solely determined by the initial conditions. We compare our model
with existing multiwavelength data of AGN and find remarkable agreement.
","[{""version"":""v1"",""created"":""Wed, 24 Nov 1999 12:40:32 GMT""}]","2007-05-23"
"astro-ph/9911453","Aaron Golden","Aaron Golden, Andy Shearer (National University of Ireland, Galway),
  Gregory Beskin (Special Astrophysical Observatory, Russia)","Unpulsed Optical Emission from the Crab Pulsar","2 pages, 2 figures, to appear in the Proceedings of IAU Colloquium
  177 : ""Pulsar Astronomy - 2000 & Beyond"", Ed. Kramer, Wex & Wielebinski, ASP
  conf.Series. Uses newpasp.sty",,,,"astro-ph",,"  Using the high speed 2-d TRIFFID photometer, we have obtained phase resolved
photometry of the Crab pulsar in UBV that allows us to flux the unpulsed light
curve component. Following de-extinction, weighted least-square fitting
indicates a power-law exponent of alpha = -0.62 +/- 0.49. This is steeper than
that reported for the peak components and its origin remains unclear with
respect to contemporary magnetospheric theory.
","[{""version"":""v1"",""created"":""Wed, 24 Nov 1999 13:46:23 GMT""}]","2007-05-23"
"astro-ph/9911454","Eduardo Ros","E. Ros, J.A. Zensus, A.P. Lobanov (Max-Planck-Institut fuer
  Radioastronomie, Bonn, Germany)","Total intensity and polarized emission of the parsec-scale jet in 3C345","13 pages, 13 figures, Accepted for publication in Astronomy &
  Astrophysics, main Journal","Astronomy & Astrophysics, 354, 55-66 (2000)",,,"astro-ph",,"  We have studied the parsec-scale structure of the quasar 3C345 at
\lambda\lambda 1.3, 2, 3.6, and 6 cm, using total intensity and linear
polarization images from 3 epochs of VLBA observations made in 1995.84,
1996.41, and 1996.81. The images show an unresolved ""core"" and a radio jet
extending over distances up to 25 milliarcseconds. At 1.3 and 2 cm, images of
the linearly polarized emission reveal an alignment of the electric vector with
the extremely curved inner section of the jet. At 6 cm, the jet shows strong
fractional polarization (m~15%), with the electric vector being oriented
perpendicular to the jet. This is consistent with the existence of a transition
from the shock-dominated to the plasma interaction-dominated emission regimes
in the jet, occurring at a distance of ~1.5 milliarcseconds from the ""core"".
","[{""version"":""v1"",""created"":""Wed, 24 Nov 1999 14:02:03 GMT""}]","2007-05-23"
"cond-mat/9911371","Roland Haberkern","R. Haberkern, C. Roth, R. Knoefler, F. Zavaliche, P. Haeussler","Electronic-Transport Properties of Al-Cu-Fe Thin Films","4 pages, 4 figures, Conf. Proc. ICQ6 (Tokyo, 1997)","Proceedings of the 6th Int. Conf. on quasicrystals;eds.: S.
  Takeuchi, T. Fujiwara; World Scientific (1998), p. 643",,,"cond-mat.mtrl-sci",,"  Amorphous samples of Al-Cu-Fe were crystallized to the icosahedral phase
under the control of electrical conductivity and thermopower at a rather small
temperature of T=720 K. A comparison between different annealing states of the
amorphous and the resulting quasicrystalline phase done on the same sample
shows aston-ishing parallels in conductivity and large differences in
thermopower.
","[{""version"":""v1"",""created"":""Tue, 23 Nov 1999 17:09:12 GMT""}]","2007-05-23"
"cond-mat/9911376","C. Sricheewin","A.S. Alexandrov and C. Sricheewin","Green's and spectral functions of the small Frolich polaron","RevTeX, 5 pages, 2 postscript figures, LaTeX processing problems
  corrected",,"10.1209/epl/i2000-00530-3",,"cond-mat.supr-con",,"  According to recent Quantum Monte Carlo simulations the small polaron theory
is practically exact in a wide range of the long-range (Frohlich)
electron-phonon coupling and adiabatic ratio. We apply the Lang-Firsov
transformation to convert the strong-coupling term in the Hamiltonian into the
form of an effective hopping integral and derive the single-particle Green's
function describing propagation of the small Frohlich polaron. One and two
dimensional spectral functions are studied by expanding the Green's function
perturbatively. Numerical calculations of the spectral functions are produced.
Remarkably, the coherent spectral weight (Z) and effective mass (Z')
renormalisation exponents are found to be different with Z'>>Z, which can
explain a small coherent spectral weight and a relatively moderate mass
enhancement in oxides.
","[{""version"":""v1"",""created"":""Tue, 23 Nov 1999 16:04:26 GMT""},{""version"":""v2"",""created"":""Fri, 26 Nov 1999 15:15:07 GMT""}]","2009-10-31"
"cond-mat/9911377","Giorgini Stefano","S. Giorgini (Trento University)","Collisionless dynamics of dilute Bose gases: Role of quantum and thermal
  fluctuations","26 pages, RevTex, 8 ps figures",,"10.1103/PhysRevA.61.063615",,"cond-mat",,"  We study the low-energy collective oscillations of a dilute Bose gas at
finite temperature in the collisionless regime. By using a time-dependent
mean-field scheme we derive for the dynamics of the condensate and
noncondensate components a set of coupled equations, which we solve
perturbatively to second order in the interaction coupling constant. This
approach is equivalent to the finite-temperature extension of the Beliaev
approximation and includes corrections to the Gross-Pitaevskii theory due both
to quantum and thermal fluctuations. For a homogeneous system we explicitly
calculate the temperature dependence of the velocity of propagation and damping
rate of zero sound. In the case of harmonically trapped systems in the
thermodynamic limit, we calculate, as a function of temperature, the frequency
shift of the low-energy compressional and surface modes.
","[{""version"":""v1"",""created"":""Tue, 23 Nov 1999 16:26:16 GMT""}]","2009-10-31"
