"cond-mat/9911378","Luis Craco","L. Craco, M. S. Laad and E. M\""uller-Hartmann","Disordered Hubbard model in $d=\infty$","7 pages, 6 figures, submitted to PRB",,,,"cond-mat.str-el",,"  We investigate the effects of static, diagonal disorder in the $d=\infty$
Hubbard model by treating the dynamical effects of local Hubbard correlations
and disorder on an equal footing. This is achieved by a proper combination of
the iterated perturbation theory and the coherent potential approximation.
Within the paramagnetic phase, we find that the renormalized Fermi liquid metal
phase of the pure Hubbard model is stable against disorder for small disorder
strengths. With increasing disorder, strong resonant scattering effects destroy
low-energy Fermi liquid coherence, leading to an {\it incoherent} metallic
non-FL state off half-filling. Finally, for large enough disorder, a {\it
continuous} transition to the Mott-Anderson insulating phase occurs. The nature
of the non-FL metallic phase, as well as the effects of the low energy
coherence (incoherence) on optical conductivity and electronic Raman spectra,
are considered in detail.
","[{""version"":""v1"",""created"":""Tue, 23 Nov 1999 17:09:01 GMT""}]","2007-05-23"
"cond-mat/9911379","Mark Bowick","Mark J. Bowick (Syracuse), David R. Nelson (Harvard) and Alex
  Travesset (Syracuse)","Interacting Topological Defects on Frozen Topographies","36 pages, LaTeX, 30 color eps figures (also available on request)","Phys. Rev. B62 (2000) 8738","10.1103/PhysRevB.62.8738","SU-4240-705","cond-mat.stat-mech cond-mat.soft",,"  We propose and analyze an effective free energy describing the physics of
disclination defects in particle arrays constrained to move on an arbitrary
two-dimensional surface. At finite temperature the physics of interacting
disclinations is mapped to a Laplacian Sine-Gordon Hamiltonian suitable for
numerical simulations. We then specialize to the case of a spherical crystal at
zero temperature. The ground state is analyzed as a function of the ratio of
the defect core energy to the Young's modulus. We argue that the core energy
contribution becomes less and less important in the limit R >> a, where R is
the radius of the sphere and a is the particle spacing. For large core energies
there are twelve disclinations forming an icosahedron. For intermediate core
energies unusual finite-length grain boundaries are preferred. The complicated
regime of small core energies, appropriate to the limit R/a goes to infinity,
is also addressed. Finally we discuss the application of our results to the
classic Thomson problem of finding the ground state of electrons distributed on
a two-sphere.
","[{""version"":""v1"",""created"":""Tue, 23 Nov 1999 17:30:25 GMT""}]","2009-10-31"
"cond-mat/9911380","Branko Stojkovic","Branko P. Stojkovic (Los Alamos), Z.G. Yu (Iowa State), A.L.
  Chernyshev (UC, Riverside), A.R. Bishop (Los Alamos), A.H. Castro Neto (UC,
  Riverside) and Niels Gronbech-Jensen (UC, Davis)","Charge ordering and long-range interactions in layered transition metal
  oxides: a quasiclassical continuum study","A number of minor changes; one figure removed; REVTEX","Phys. Rev. B 62, 4353 (2000).","10.1103/PhysRevB.62.4353",,"cond-mat",,"  The competition between long-range and short-range interactions among holes
moving in an antiferromagnet (AF), is studied within a model derived from the
spin density wave picture of layered transition metal oxides. A novel numerical
approach is developed which allows one to solve the problem at finite hole
densities in very large systems (of order hundreds of lattice spacings), albeit
in a quasiclassical limit, and to correctly incorporate the long-range part of
the Coulomb interaction. The focus is on the problem of charge ordering and the
charge phase diagram: at low temperatures four different phases are found,
depending on the strength of the magnetic (dipolar) interaction generated by
the spin-wave exchange, and the density of holes. The four phases are the
Wigner crystal, diagonal stripes, a grid phase (horizontal-vertical stripe
loops) and a glassy-clumped phase. In the presence of both in-plane and
out-of-plane charged impurities the stripe ordering is suppressed, although
finite stripe segments persist. At finite temperatures multiscale
(intermittency) dynamics is found, reminiscent of that in glasses. The dynamics
of stripe melting and its implications for experiments is discussed.
","[{""version"":""v1"",""created"":""Tue, 23 Nov 1999 20:55:15 GMT""},{""version"":""v2"",""created"":""Fri, 10 Mar 2000 22:40:57 GMT""}]","2009-10-31"
"cond-mat/9911381","Sergiy M. Komirenko","S. M. Komirenko (1), K. W. Kim (1), A. A.Demidenko (2), V. A. Kochelap
  (2), M. A. Stroscio (3) ((1) NCSU, Raleigh NC, (2) Institute of Semiconductor
  Physics, Kiev, Ukraine, (3) ARO, RTP NC)","Cerenkov generation of high-frequency confined acoustic phonons in
  quantum wells","4 pages, 2 figures. Submitted to APL",,"10.1063/1.126195",,"cond-mat.mes-hall cond-mat.mtrl-sci",,"  We analyze the Cerenkov emission of high-frequency confined acoustic phonons
by drifting electrons in a quantum well. We find that the electron drift can
cause strong phonon amplification (generation). A general formula for the gain
coefficient, alpha, is obtained as a function of the phonon frequency and the
structure parameters. The gain coefficient increases sharply in the short-wave
region. For the example of a Si/SiGe/Si device it is shown that the
amplification coefficients of the order of hundreds of 1/cm can be achieved in
the sub-THz frequency range.
","[{""version"":""v1"",""created"":""Tue, 23 Nov 1999 21:21:39 GMT""}]","2009-10-31"
"cond-mat/9911382","Michael C. Martin","Michael C. Martin and Wayne R. McKinney","The First Synchrotron Infrared Beamlines at the ALS: Spectromicroscopy
  and Fast Timing","10 pages, PDF format including figures. To be published in
  Ferroelectrics",,,"LBNL-44208","cond-mat.mtrl-sci cond-mat.str-el physics.bio-ph physics.optics",,"  Two recently commissioned infrared beamlines on the 1.4 bending magnet port
at the Advanced Light Source, LBNL, are described. Using a synchrotron as an IR
source provides three primary advantages: increased brightness, very fast light
pulses, and enhanced far-IR flux. The considerable brightness advantage
manifests itself most beneficially when performing spectroscopy on a
microscopic length scale. Beamline (BL) 1.4.3 is a dedicated FTIR
spectromicroscopy beamline, where a diffraction-limited spot size using the
synchrotron source is utilized. BL 1.4.2 consists of a vacuum FTIR bench with a
wide spectral range and step-scan capability. This BL makes use of the pulsed
nature of the synchrotron light as well as the far-IR flux. Fast timing is
demonstrated by observing the pulses from the electron bunch storage pattern at
the ALS. Results from several experiments from both IR beamlines will be
presented as an overview of the IR research currently being done at the ALS.
","[{""version"":""v1"",""created"":""Tue, 23 Nov 1999 22:22:46 GMT""}]","2007-05-23"
"cond-mat/9911383","Gaetano Bertoldi","Gaetano Bertoldi","Potts model: Duality, Uniformization and the Seiberg-Witten modulus","17 pages LaTeX, conjecture withdrawn",,,"MIT-CTP-2920","cond-mat hep-th",,"  The introduction of a modulus z(K), analogous to u=<tr phi^2> in the N=2 SUSY
SU(2) gauge theory solved by Seiberg and Witten, and whose defining property is
the invariance under the symmetry and duality transformations of the effective
coupling K, reveals an intriguing correspondence between the D=2 Ising and
Potts models on the square lattice. The moduli spaces of both models, the
spaces of inequivalent effective temperatures K, correspond to a
three-punctured sphere M_3=P^1(C)\{z=+1,-1,\infty}. Furthermore, in both
models, the locus of Fisher zeroes is given by the segment joining z_c=-1 to
z_c=+1.
","[{""version"":""v1"",""created"":""Tue, 23 Nov 1999 22:30:52 GMT""},{""version"":""v2"",""created"":""Tue, 14 Dec 1999 16:35:32 GMT""}]","2007-05-23"
"cond-mat/9911384","Adriaan A. Louis","A. A. Louis, R. Finken and J. P. Hansen","Crystallization and phase-separation in non-additive binary hard-sphere
  mixtures","4 pages, 4 figures, to appear in Phys. Rev. E","Phys. Rev. E. 61, R1028 (2000)","10.1103/PhysRevE.61.R1028",,"cond-mat.soft cond-mat.stat-mech",,"  We calculate for the first time the full phase-diagram of an asymmetric
non-additive hard-sphere mixture. The non-additivity strongly affects the
crystallization and the fluid-fluid phase-separation. The global topology of
the phase-diagram is controlled by an effective size-ratio y_{eff}, while the
fluid-solid coexistence scales with the depth of the effective potential well.
","[{""version"":""v1"",""created"":""Tue, 23 Nov 1999 23:40:37 GMT""}]","2009-10-31"
"cond-mat/9911385","Armando A. Aligia","A. A. Aligia (Centro Atomico Bariloche, Argentina)","Phase diagram of the one-dimensional extended attractive Hubbard model
  for large nearest-neighbor repulsion","6 pages, 3 figures, submitted to Phys. Rev. B","Phys. Rev. B 61, 7028 (2000)","10.1103/PhysRevB.61.7028",,"cond-mat.str-el cond-mat.supr-con",,"  We consider the extended Hubbard model with attractive on-site interaction U
and nearest-neighbor repulsions V. We construct an effective Hamiltonian
H_{eff} for hopping t<<V and arbitrary U<0. Retaining the most important terms,
H_{eff} can be mapped onto two XXZ models, solved by the Bethe ansatz. The
quantum phase diagram shows two Luttinger liquid phases and a region of phase
separation between them. For density n<0.422 and U<-4, singlet superconducting
correlations dominate at large distances. For some parameters, the results are
in qualitative agreement with experiments in BaKBiO.
","[{""version"":""v1"",""created"":""Wed, 24 Nov 1999 01:24:58 GMT""}]","2009-10-31"
"cond-mat/9911386","Ralf Bundschuh","R. Bundschuh","Asymmetric exclusion process and extremal statistics of random sequences","24 pages, 11 figures",,,,"cond-mat.stat-mech physics.bio-ph q-bio.QM",,"  An exact mapping is established between sequence alignment, one of the most
commonly used tools of computational biology, and the asymmetric exclusion
process, one of the few exactly solvable models of nonequilibrium physics. The
statistical significance of sequence alignments is characterized through
studying the total hopping current of the discrete time and space version of
the asymmetric exclusion process.
","[{""version"":""v1"",""created"":""Wed, 24 Nov 1999 01:55:10 GMT""}]","2007-05-23"
"cond-mat/9911387","Daniel C. Cabra","D. C. Cabra and M. D. Grynberg","Magnetization plateaux in dimerized spin ladder arrays","9 pages, RevTeX, 11 postscript figures","Phys. Rev. B 62, 337 (2000)","10.1103/PhysRevB.62.337","La Plata-Th 99/14","cond-mat",,"  We investigate the ground state magnetization plateaux appearing in spin 1/2
two-leg ladders built up from dimerized antiferromagnetic Heisenberg chains and
dimerized zig-zag interchain couplings. Using both Abelian bosonization and
Lanczos methods we find that the system yields rather unusual plateaux and
exhibits massive and massless phases for specific choices or ``tuning'' of
exchange interactions. The relevance of this behavior in the study of
NH_4CuCl_3 is discussed.
","[{""version"":""v1"",""created"":""Wed, 24 Nov 1999 05:03:54 GMT""},{""version"":""v2"",""created"":""Fri, 7 Jul 2000 22:48:00 GMT""}]","2009-10-31"
"cond-mat/9911388","Makoto Katori","Makoto Katori, Norio Konno, and Hideki Tanemura","Survival Probabilities for Discrete Time Models in One Dimension","9 pages, 1 figure; to be published in Journal of Statistical Physics,
  April 2000 (Vol 99, issue 1/2, a short communication)",,"10.1023/A:1018617328216",,"cond-mat.stat-mech cond-mat.soft",,"  We consider survival probabilities for the discrete time process in one
dimension, which is known as the Domany-Kinzel model. A convergence theorem for
infinite systems can be obtained in the nonattractive case.
","[{""version"":""v1"",""created"":""Wed, 24 Nov 1999 06:07:42 GMT""},{""version"":""v2"",""created"":""Thu, 25 Nov 1999 15:01:01 GMT""}]","2015-06-25"
"cond-mat/9911389","Kenichi Kasamatsu","Makoto Tsubota and Kenichi Kasamatsu","Josephson Current Flowing in Cyclically Coupled Bose-Einstein
  Condensates","4 pages, 3 figure, to be published in Journal of Physical Society of
  Japan",,"10.1143/JPSJ.69.1942",,"cond-mat.soft",,"  The Josephson effect in cyclically coupled Bose-Einstein condensates is
studied theoretically. We analyze the simultaneous Gross-Pitaevskii equations
with coupling terms between adjacent condensates. Depending on the initial
relative phases between condensates, Josephson current flows cyclically to make
a quantized vortex. Reducing the coupling between condensates changes the
motion from periodic to chaotic, thus suppressing the cyclic current. The
relation to the Kibble-Zurek mechanism is discussed.
","[{""version"":""v1"",""created"":""Wed, 24 Nov 1999 08:00:49 GMT""},{""version"":""v2"",""created"":""Sun, 28 May 2000 03:43:32 GMT""}]","2009-10-31"
"cond-mat/9911390","Andal Narayanan","Andal Narayanan and Hema Ramachandran","Density-Matrix approach to a Strongly Coupled Two-Component
  Bose-Einstein Condensate","11 Latex pages, 2 figures (Figure 3 was removed and the text chnaged
  accordingly)",,"10.1103/PhysRevA.62.055602",,"cond-mat",,"  The time evolution equations for average values of population and relative
phase of a strongly coupled two component BEC is derived analytically. The two
components are two hyper-fine states coupled by an external laser that drives
fast Rabi oscillations between these states. Specifically, this derivation
incorporates the two-mode model proposed in [1] for the strongly coupled
hyper-fine states of Rb. The fast Rabi cycle is averaged out and rate equations
are derived that represents the slow dynamics of the system. These include the
collapse and revival of Rabi oscillations and their subsequent dependence on
detuning and trap displacement as reported in experiments of [1]. A proposal to
create stable vortices is also given.
","[{""version"":""v1"",""created"":""Wed, 24 Nov 1999 08:50:45 GMT""},{""version"":""v2"",""created"":""Fri, 26 Nov 1999 11:12:17 GMT""}]","2009-10-31"
"cond-mat/9911393","Johan Vanacken","J. Vanacken, L. Trappeniers, K. Rosseel, W. Boon","Numerical Model for Calculating the Field Dependence of the Irreversible
  Magnetisation of Hard Ssuperconductors in High Pulsed Magnetic Fields","4 pages, PDF-file",,,,"cond-mat.supr-con",,"  In type II hard superconductors the irreversible magnetization shows an
impressive variety of different magnetic field dependencies. In this paper we
will try to describe the M(H) relation at fixed temperature To by a numerical
model in which we incorporate two features: the magnetic and electric field
dependency of the local critical current density j(To,H,E). The electric field
is determined by the magnetic field sweep rate; in effect E ~ dB/dt. We
confront the model with experimental pulsed field magnetization measurements
(PFMM) on a fast melt processed YBa2Cu3O7 sample.
","[{""version"":""v1"",""created"":""Wed, 24 Nov 1999 11:09:12 GMT""}]","2007-05-23"
"cond-mat/9911394","Dmitry Dmitriev","D.V.Dmitriev, V.Ya.Krivnov, A.A.Ovchinnikov","Exactly solvable spin ladder model with degenerate ferromagnetic and
  singlet states","10 pages, 6 figures, revtex. accepted to The European Physical
  Journal B","Eur.Phys.J. B14, 91 (2000)","10.1007/s100510050110",,"cond-mat.str-el",,"  We study the spin ladder model with interactions between spins on neighboring
rungs. The model Hamiltonian with the exact singlet ground state degenerated
with ferromagnetic state is obtained. The singlet ground state wave function
has a special recurrent form and depends on two parameters. Spin correlations
in the singlet ground state show double-spiral structure with period of spirals
equals to the system size. For special values of parameters they have
exponential decay. The spectrum of the model is gapless and there are
asymptotically degenerated excited states for special values of parameters in
the thermodynamic limit.
","[{""version"":""v1"",""created"":""Wed, 24 Nov 1999 12:48:02 GMT""}]","2009-10-31"
"cond-mat/9911395","Oleg Bulashenko","O. M. Bulashenko, J. M. Rubi, V. A. Kochelap","Suppression of non-Poissonian shot noise by Coulomb correlations in
  ballistic conductors","extended version 4 -> 8 pages, examples and figure added","Phys. Rev. B 62 (2000) 8184-8191","10.1103/PhysRevB.62.8184",,"cond-mat.mes-hall",,"  We investigate the current injection into a ballistic conductor under the
space-charge limited regime, when the distribution function of injected
carriers is an arbitrary function of energy F_c(epsilon). The analysis of the
coupled kinetic and Poisson equations shows that the injected current
fluctuations may be essentially suppressed by Coulomb correlations, and the
suppression level is determined by the shape of F_c(epsilon). This is in
contrast to the time-averaged quantities: the mean current and the spatial
profiles are shown to be insensitive to F_c(epsilon) in the leading-order terms
at high biases. The asymptotic high-bias behavior for the energy resolved
shot-noise suppression has been found for an arbitrary (non-Poissonian)
injection, which may suggest a new field of investigation on the optimization
of the injected energy profile to achieve the desired noise-suppression level.
","[{""version"":""v1"",""created"":""Wed, 24 Nov 1999 13:32:30 GMT""},{""version"":""v2"",""created"":""Tue, 26 Sep 2000 08:36:54 GMT""}]","2009-10-31"
"cond-mat/9911396","Michel Caffarel","Roland Assaraf and Michel Caffarel","Zero-variance principle for Monte Carlo algorithms","9 pages, Latex, to appear in Phys. Rev. Lett",,"10.1103/PhysRevLett.83.4682",,"cond-mat.stat-mech",,"  We present a general approach to greatly increase at little cost the
efficiency of Monte Carlo algorithms. To each observable to be computed we
associate a renormalized observable (improved estimator) having the same
average but a different variance. By writing down the zero-variance condition a
fundamental equation determining the optimal choice for the renormalized
observable is derived (zero-variance principle for each observable separately).
We show, with several examples including classical and quantum Monte Carlo
calculations, that the method can be very powerful.
","[{""version"":""v1"",""created"":""Wed, 24 Nov 1999 13:42:52 GMT""}]","2009-10-31"
"cond-mat/9911397","Peter Toth","P. Toth, A. P. Krekhov, L. Kramer and J. Peinke","Orientational transition in nematic liquid crystals under oscillatory
  Poiseuille flow","11 pages, 4 figures, submitted to Europhys. Lett",,"10.1209/epl/i2000-00336-3",,"cond-mat.soft",,"  We investigate the orientational behaviour of a homeotropically aligned
nematic liquid crystal subjected to an oscillatory plane Poiseuille flow
produced by an alternating pressure gradient. For small pressure amplitudes the
director oscillates within the flow plane around the initial homeotropic
position, whereas for higher amplitudes a spatially homogeneous transition to
out-of-plane director motion was observed for the first time. The orientational
transition was found to be supercritical and the measured frequency dependence
of the critical pressure amplitude in the range between 2 and 20 Hz was in
quantitative agreement with a recent theory.
","[{""version"":""v1"",""created"":""Wed, 24 Nov 1999 13:59:58 GMT""}]","2009-10-31"
"cond-mat/9911398","Ronald Fisch","R. Fisch","Random Field and Random Anisotropy Effects in Defect-Free
  Three-Dimensional XY Models","10 pages, including 2 figures, extensively revised","Phys. Rev. B, 62 (2000) 361","10.1103/PhysRevB.62.361",,"cond-mat.dis-nn",,"  Monte Carlo simulations have been used to study a vortex-free XY ferromagnet
with a random field or a random anisotropy on simple cubic lattices. In the
random field case, which can be related to a charge-density wave pinned by
random point defects, it is found that long-range order is destroyed even for
weak randomness. In the random anisotropy case, which can be related to a
randomly pinned spin-density wave, the long-range order is not destroyed and
the correlation length is finite. In both cases there are many local minima of
the free energy separated by high entropy barriers. Our results for the random
field case are consistent with the existence of a Bragg glass phase of the type
discussed by Emig, Bogner and Nattermann.
","[{""version"":""v1"",""created"":""Wed, 24 Nov 1999 14:59:19 GMT""},{""version"":""v2"",""created"":""Fri, 21 Jan 2000 16:08:13 GMT""}]","2009-10-31"
"gr-qc/9911089","Lior M. Burko","Lior M. Burko","Self-force approach for radiation reaction","Talk given at the 3rd Edoardo Amaldi Conference on Gravitational
  Waves, 12-16 July, 1999","Gravitational Waves: Third Edoardo Amaldi Conference, S. Meshkov
  (ed) (AIP, New York, 2000), p.p., 86-89","10.1063/1.1291844",,"gr-qc",,"  We overview the recently proposed mode-sum regularization prescription (MSRP)
for the calculation of the local radiation-reaction forces, which are crucial
for the orbital evolution of binaries. We then describe some new results which
were obtained using MSRP, and discuss their importance for gravitational-wave
astronomy.
","[{""version"":""v1"",""created"":""Tue, 23 Nov 1999 23:50:18 GMT""},{""version"":""v2"",""created"":""Mon, 13 Dec 1999 23:09:00 GMT""}]","2009-10-31"
"gr-qc/9911090","Norimasa Sugiura","Norimasa Sugiura, Ken-ichi Nakao and Tomohiro Harada","Distance-redshift relation in an isotropic inhomogeneous universe II:
  Spherically symmetric dust-shell universe","17 pages, 7 figures","Phys.Rev. D60 (1999) 103508","10.1103/PhysRevD.60.103508","KUNS-1550","gr-qc",,"  The relation between the angular diameter distance and redshift in a
spherically symmetric dust-shell universe is studied. We have discovered that
the relation agrees with that of an appropriate Friedmann-Lemaitre (FL) model
if we set a ``homogeneous'' expansion law and a ``homogeneous'' averaged
density field. This will support the averaging hypothesis that a universe looks
like a FL model in spite of small-scale fluctuations of density field, if its
averaged density field is homogeneous on large scales. We also study the
connection of the proper mass of a shell with the mass of gravitationally bound
objects. Combining this with the results of the distance-redshift relation, we
discuss an impact of the local inhomogeneities on determination of the
cosmological parameters through the observation of the locally inhomogeneous
universe.
","[{""version"":""v1"",""created"":""Wed, 24 Nov 1999 06:22:12 GMT""}]","2009-10-31"
"gr-qc/9911091","Hiroaki Terashima","Hiroaki Terashima (Univ. of Tokyo)","Entanglement entropy of the black hole horizon","28 pages, 5 figures, section 1 and the paragraph before subsection
  3.1 are improved and enlarged","Phys.Rev. D61 (2000) 104016","10.1103/PhysRevD.61.104016","UT-864","gr-qc hep-th",,"  We examine a possibility that, when a black hole is formed, the information
on the collapsed star is stored as the entanglement entropy between the outside
and the thin region (of the order of the Planck length) of the inside the
horizon. For this reason, we call this as the entanglement entropy of the black
hole ``horizon''. We construct two models, one is in the Minkowski spacetime
and the other is in the Rindler wedge. To calculate the entropy explicitly, we
assume that the thin regions of the order of the Planck length of the outside
and inside the horizon are completely entangled by quantum effects. We also use
a property of the entanglement entropy that it is symmetric under an
interchange of the observed and unobserved subsystems. Our setting and this
symmetric property substantially reduce the needed numerical calculation. As a
result of our analysis, we can explain the Bekenstein-Hawking entropy itself
(rather than its correction by matter fields) in the context of the
entanglement entropy.
","[{""version"":""v1"",""created"":""Wed, 24 Nov 1999 06:57:43 GMT""},{""version"":""v2"",""created"":""Mon, 17 Jan 2000 12:18:19 GMT""}]","2009-10-31"
"gr-qc/9911092","Amos Harpaz","A. Harpaz, N. Soker (University of Haifa, Oranim)","The Origin of the Radiation Reaction Force","10 pages, 2 figures","Int.J.Theor.Phys. 39 (2000) 2867-2874",,,"gr-qc physics.class-ph",,"  The emission of radiation from an accelerated charge is analyzed. It is found
that at zero velocity, the radiation emitted from the charge imparts no counter
momentum to the emitting charge, and no radiation reaction force is created by
the radiation. A reaction force is created by the stress force that exists in
the curved electric field of the charge, and the work done in overcoming this
force is the source of the energy carried by the radiation.
","[{""version"":""v1"",""created"":""Wed, 24 Nov 1999 13:25:06 GMT""}]","2007-05-23"
"hep-ex/9911035","Daniel M. Kaplan","Daniel M. Kaplan","Should ${\bar p}p\to{\bar\Lambda}\Lambda$ be revived?","2 pages. Presented at Hyperon 99, Fermilab, 27-29 Sept. 1999",,,"IIT-HEP-99/2","hep-ex hep-ph",,"  The continued interest of CP violation in hyperon decay (as well as many
other physics topics that could be addressed by such a facility) suggests that
a dedicated $\bar p$ storage ring at Fermilab ought to be reconsidered. With
recent and anticipated technical progress, sensitivity many orders of magnitude
beyond that achieved in LEAR may be possible, including 10^{-5} sensitivity for
the $\Lambda/{\bar\Lambda}$ CP-asymmetry parameter $A_\Lambda$.
","[{""version"":""v1"",""created"":""Wed, 24 Nov 1999 12:20:16 GMT""}]","2016-08-31"
