"hep-lat/9909067","Roberto De Pietri","G. Burgio, R. De Pietri, H.A. Morales-Tecotl, L.F. Urrutia, J.D.
  Vergara","Hamiltonian LGT in the complete Fourier analysis basis","LATTICE99 (theoretical developments), 3 pages","Nucl.Phys.Proc.Suppl. 83 (2000) 926-928","10.1016/S0920-5632(00)91847-4",,"hep-lat",,"  The main problem in the Hamiltonian formulation of Lattice Gauge Theories is
the determination of an appropriate basis avoiding the over-completeness
arising from Mandelstam relations. We short-cut this problem using Harmonic
analysis on Lie-Groups and intertwining operators formalism to explicitly
construct a basis of the Hilbert space. Our analysis is based only on
properties of the tensor category of Lie-Group representations. The Hamiltonian
of such theories is calculated yielding a sparse matrix whose spectrum and
eigenstates could be exactly derived as functions of the coupling $g^2$
","[{""version"":""v1"",""created"":""Thu, 9 Sep 1999 10:34:39 GMT""}]","2015-06-25"
"hep-lat/9909068",,"Enrico Meggiolaro","Gauge-invariant nonlocal quark condensates in QCD: a new interpretation
  of the lattice results","Talk given at the ``XVIIth International Symposium on Lattice Field
  Theory'', Pisa (Italy), June 29th - July 3rd, 1999 (LATTICE 99); 3 pages,
  LaTeX file, uses ``espcrc2.sty''; a mistake in Eq. (17) corrected plus other
  minor changes","Nucl.Phys.Proc.Suppl. 83 (2000) 512-514","10.1016/S0920-5632(00)91722-5","HD-THEP-99-38","hep-lat",,"  We study the asymptotic short-distance behaviour as well as the asymptotic
large-distance behaviour of the gauge-invariant quark-antiquark nonlocal
condensates in QCD. A comparison of some analytical results with the available
lattice data is performed.
","[{""version"":""v1"",""created"":""Thu, 9 Sep 1999 10:58:39 GMT""},{""version"":""v2"",""created"":""Tue, 12 Oct 1999 12:27:44 GMT""}]","2015-06-25"
"hep-lat/9909069","Elisabetta Pallante","Maarten Golterman, Elisabetta Pallante","On $K\to\pi\pi$ Decays in Quenched and Unquenched Chiral Perturbation
  Theory","LATTICE99(Matrix Elements), LaTeX(espcrc2.sty), 3p, 1 ps figure","Nucl.Phys.Proc.Suppl. 83 (2000) 250-252","10.1016/S0920-5632(00)91638-4",,"hep-lat hep-ph",,"  We calculate the logarithmic corrections to the matrix elements for
$K^+\to\pi^+$ and $K\to$vacuum (which are used on the lattice to determine
$K\to\pi\pi$ amplitudes), in one-loop quenched and unquenched Chiral
Perturbation Theory. We find that these corrections can be large. We also
discuss, and present some results for, the direct determination of $K\to\pi\pi$
amplitudes. In particular, we address effects from choosing $m_s=m_d$ and
vanishing external spatial momenta, finite volume and quenching. In the
quenched octet case, we find enhanced finite-volume contributions which may
make numerical estimates of this matrix element unreliable for large volumes.
","[{""version"":""v1"",""created"":""Thu, 9 Sep 1999 13:43:52 GMT""}]","2015-06-25"
"hep-lat/9909070","Alessandra Feo","Alessandra Feo, Robert Kirchner, Silke Luckmann, Istvan Montvay,
  Gernot M\""unster","Numerical simulations of dynamical gluinos in SU(3) Yang-Mills theory:
  first results","Talk presented at LATTICE99(Higgs,Yukawa,SUSY), Pisa (Italy); 3
  pages; to be published in Nucl. Phys. B (Proc. Suppl.)","Nucl.Phys.Proc.Suppl.83:661-663,2000","10.1016/S0920-5632(00)91768-7","DESY 99-138","hep-lat",,"  In a numerical Monte Carlo simulation of SU(3) Yang-Mills theory with
dynamical gluinos we have investigated the behaviour of the expectation value
of the scalar and pseudoscalar gluino condensates in order to determine the
phase structure. Preliminary results are presented as a function of the hopping
parameter.
","[{""version"":""v1"",""created"":""Thu, 9 Sep 1999 14:07:35 GMT""},{""version"":""v2"",""created"":""Sat, 11 Sep 1999 12:50:51 GMT""}]","2015-06-25"
"hep-lat/9909071","Robert Kirchner","Alessandra Feo, Robert Kirchner, Istvan Montvay, Anastassios Vladikas","Low-energy features of SU(2) Yang-Mills theory with light gluinos","Talk presented at LATTICE99(Higgs, Yukawa, SUSY), Pisa (Italy),3
  pages; to be published in Nucl. Phys. B (Proc. Suppl.)","Nucl.Phys.Proc.Suppl. 83 (2000) 670-672","10.1016/S0920-5632(00)91771-7","DESY 99-135","hep-lat",,"  We report on the latest results of the low-lying spectrum of bound states in
SU(2) Yang-Mills theory with light gluinos. The behavior of the disconnected
contributions in the critical region is analyzed. A first investigation of a
three-gluino state is also discussed.
","[{""version"":""v1"",""created"":""Thu, 9 Sep 1999 14:07:42 GMT""}]","2015-06-25"
"hep-lat/9909072",,"A. Hart (Edinburgh) and M. Teper (Oxford)","The topological susceptibility in `full' (UK)QCD","LaTeX. 4 PostScript figures. Contribution to LATTICE99(topology)","Nucl.Phys.Proc.Suppl. 83 (2000) 476-478","10.1016/S0920-5632(00)91710-9","Edinburgh 99/11","hep-lat",,"  We report first calculations of the topological susceptibility measured using
the field theoretic method on SU(3) gauge configurations produced by the UKQCD
collaboration with two flavours of dynamical, improved, Wilson fermions. Using
three ensembles with matched lattice spacing but differing sea quark mass we
find that hybrid Monte Carlo simulation appears to explore the topological
sectors efficiently, and a topological susceptibility consistent with
increasing linearly with the quark mass.
","[{""version"":""v1"",""created"":""Thu, 9 Sep 1999 14:33:04 GMT""}]","2015-06-25"
"hep-lat/9909073","Masataka Okamoto","CP-PACS Collaboration: A. Ali Khan, S. Aoki, R. Burkhalter, S. Ejiri,
  M. Fukugita, S. Hashimoto, N. Ishizuka, Y. Iwasaki, K. Kanaya, T. Kaneko, Y.
  Kuramashi, T. Manke, K. Nagai, M. Okamoto, M. Okawa, A. Ukawa, T. Yoshie","Equation of state for pure SU(3) gauge theory with RG improved action","LaTeX(espcrc2.sty), 3 pages, 4 eps figures, Talk presented at
  LATTICE99(finite temperature)","Nucl.Phys.Proc.Suppl. 83 (2000) 384-386",,"UTCCP-P-69","hep-lat",,"  We present results for the equation of state for pure SU(3) gauge theory
obtained with a renormalization-group (RG) improved action. The energy density
and pressure are calculated on a $16^3\times 4$ and a $32^3\times 8$ lattice
employing the integral method. Extrapolating the results to the continuum
limit, we find the energy density and pressure to be in good agreement with
those obtained with the standard plaquette action within the error of 3-4%.
","[{""version"":""v1"",""created"":""Thu, 9 Sep 1999 15:28:59 GMT""}]","2012-08-27"
"hep-ph/9909292","Bachir Moussallam","B. Moussallam (IPN, Orsay)","N_f Dependence of the Quark Condensate from a Chiral Sum Rule","22 pages, 4 figures. A few improvements and corrections made","Eur.Phys.J.C14:111-122,2000","10.1007/s100520050738","IPNO-DR 99-22","hep-ph",,"  How fast does the quark condensate in QCD-like theories vary as a function of
$N_f$ is inferred from real QCD using chiral perturbation theory at order
one-loop. A sum rule is derived for the single relevant chiral
coupling-constant, $L_6$. A model independent lower bound is obtained. The
spectral function satisfies a Weinberg-type superconvergence relation. It is
discussed how this, together with chiral constraints allows a solid evaluation
of $L_6$, based on experimental $\pi\pi-K\bar K$ S-wave T-matrix input. The
resulting value of $L_6$ is compatible with a strong $N_f$ dependence possibly
suggestive of the proximity of a chiral phase transition
","[{""version"":""v1"",""created"":""Wed, 8 Sep 1999 19:09:46 GMT""},{""version"":""v2"",""created"":""Thu, 28 Oct 1999 16:00:42 GMT""}]","2011-09-13"
"hep-ph/9909293","James M. Gelb","James M. Gelb (U.T. Arlington), S. P. Rosen (DOE)","A Mass Matrix for Atmospheric, Solar, and LSND Neutrino Oscillations","4 pages, 0 figures, minor text changes","Phys.Rev.D62:013003,2000","10.1103/PhysRevD.62.013003",,"hep-ph",,"  We construct a mass matrix for the four neutrino flavors, three active and
one sterile, needed to fit oscillations in all three neutrino experiments:
atmospheric, solar, and LSND, simultaneously. It organizes the neutrinos into
two doublets whose central values are about 1 eV apart, and whose splittings
are of the order of 10^(-3) eV. Atmospheric neutrino oscillations are described
as maximal mixing within the upper doublet, and solar as the same within the
lower doublet. Then LSND is a weak transition from one doublet to the other. We
comment on the Majorana versus Dirac nature of the active neutrinos and show
that our mass matrix can be derived from an S_2 x S_2 permutation symmetry plus
an equal splitting rule.
","[{""version"":""v1"",""created"":""Wed, 8 Sep 1999 16:13:52 GMT""},{""version"":""v2"",""created"":""Mon, 15 Nov 1999 22:14:41 GMT""},{""version"":""v3"",""created"":""Thu, 24 Feb 2000 17:50:17 GMT""}]","2011-02-07"
"hep-ph/9909294","Salvatore Mele","Salvatore Mele, Eusebio Sanchez","Study of Extra Space Dimensions in Vector Boson Pair Production at LEP","6 pages, 1 figure","Phys.Rev.D61:117901,2000","10.1103/PhysRevD.61.117901","CERN-EP/99-118","hep-ph",,"  Recent theoretical scenarios propose that quantum gravity effects may
manifest at LEP energies by means of gravitons that couple to Standard Model
particles and propagate into extra space dimensions. These predictions are
checked against the most recent experimental results on photon, W and Z pair
production. No deviations from the Standard Model expectations are found and
limits of the order of 1 TeV on the scale of these models are set.
","[{""version"":""v1"",""created"":""Wed, 8 Sep 1999 16:40:28 GMT""}]","2008-11-26"
"hep-ph/9909295","Christophe Royon","C.Royon (CEA, DAPNIA, Service de Physique des Particules, Centre
  d'Etudes de Saclay, France)","BFKL signatures at a linear collider","Invited talk given at the International Workshop on Linear Colliders
  (LCWS99), April 28- May 5, Sitges (Spain)",,,,"hep-ph",,"  The BFKL dynamics can be successfully tested at the future high energy
$e^+e^-$ linear collider. The total $\gamma^*\gamma^*$ cross-section is
calculated in the Leading Log QCD dipole picture of BFKL dynamics, and compared
with the one from 2-gluon exchange. The rapidity dependence of the
cross-section remains a powerful tool to increase the ratio between the BFKL
and the 2-gluon cross-sections and is more sensitive to BFKL effects, even in
the presence of higher order corrections. Other potential signals like
diffractive $J/ \Psi$ and 'forward' jet productions will also be discussed.
","[{""version"":""v1"",""created"":""Wed, 8 Sep 1999 17:32:11 GMT""}]","2007-05-23"
"hep-ph/9909296","Anupam Singh","Alan Chodos, Fred Cooper, Wenjin Mao, Hisakazu Minakata and Anupam
  Singh","A Two-dimensional Model with Chiral Condensates and Cooper Pairs having
  QCD-like Phase Structure","27 Pages, 7 embedded .eps figures, uses epsf","Phys.Rev. D61 (2000) 045011","10.1103/PhysRevD.61.045011","LA-UR-99-4846, TMUP-HEL-9911, YCTP-P23-99","hep-ph astro-ph hep-th nucl-th",,"  We generalize our previous model to an O(N) symmetric two-dimensional model
which possesses chiral symmetry breaking and superconducting (Cooper pair
condensates) phases at large-N. At zero temperature and density, the model can
be solved analytically in the large-N limit. We perform the renormalization
explicitly and obtain a closed form expression of the effective potential.
There exists a renormalization group invariant parameter $\delta$ that
determines which of the condensates exist in the vacuum. At finite temperatures
and densities, we map out the phase structure of the model by a detailed
numerical analysis of the renormalized effective potential. For $\delta$
positive and sufficiently large, the phase diagram in the $\mu$-$T$ (chemical
potential-temperature) plane exactly mimics the features expected for QCD with
two light flavors of quarks. At low temperatures there exists low-$\mu$ chiral
symmetry breaking and high-$\mu$ Cooper pair condensate regions which are
separated by a first-order phase transition. At high $\mu$, when the
temperature is raised, the system undergoes a second-order phase transition
from the superconducting phase to an unbroken phase in which both condensates
vanish. For a range of values of $\delta$ the theory possesses a tricritical
point ($\mu_{tc}$ and $T_{tc}$); for $\mu > \mu_{tc}$ ($\mu < \mu_{tc}$) the
phase transition from the low temperature chiral symmetry breaking phase to
unbroken phase is first-order (second-order). For the range of $\delta$ in
which the system mimics QCD, we expect the model to be useful for the
investigation of dynamical aspects of nonequilibrium phase transitions, and to
provide information relevant to the study of relativistic heavy ion collisions
and the dense interiors of neutron stars.
","[{""version"":""v1"",""created"":""Wed, 8 Sep 1999 21:27:27 GMT""}]","2009-10-31"
"hep-ph/9909297","Matthias Neubert","Yuval Grossman (SLAC), Alexander L. Kagan (Cincinatti), Matthias
  Neubert (SLAC)","Trojan Penguins and Isospin Violation in Hadronic B Decays","minor typographic errors corrected; version published in
  JHEP10(1999)029","JHEP9910:029,1999","10.1088/1126-6708/1999/10/029","SLAC-PUB-8243","hep-ph",,"  Some rare hadronic decays of B mesons, such as B->pi K, are sensitive to
isospin-violating contributions from physics beyond the Standard Model.
Although commonly referred to as electroweak penguins, such contributions can
often arise through tree-level exchanges of heavy particles, or through
strong-interaction loop diagrams. The Wilson coefficients of the corresponding
electroweak penguin operators are calculated in a large class of New Physics
models, and in many cases are found not to be suppressed with respect to the
QCD penguin coefficients. Several tests for these effects using observables in
B->pi K decays are discussed, and nontrivial bounds on the couplings of the
various New Physics models are derived.
","[{""version"":""v1"",""created"":""Wed, 8 Sep 1999 22:27:35 GMT""},{""version"":""v2"",""created"":""Tue, 2 Nov 1999 21:22:41 GMT""}]","2009-10-31"
"hep-ph/9909298","Kaustubh Agashe","K. Agashe and N.G. Deshpande (ITS, University of Oregon)","CLEO measurement of $B \to \pi^+ \pi^-$ and determination of weak phase
  $\alpha$","LaTeX file, 14 pages including 5 eps figures. Revised version with a
  slightly modified title. In the new version, we use QCD improved
  factorization. For the value of form factor used earlier, the conclusion that
  small Vub/Vcb is preferred leading to large error in alpha is unchanged. We
  have added results for a smaller value of the form factor. We also show that
  if Vub/Vcb is known, then it is possible to determine the correct value of
  sin 2 alpha. Typos corrected","Phys.Rev.D61:071301,2000","10.1103/PhysRevD.61.071301","OITS-678","hep-ph",,"  The CLEO collaboration has recently reported a (first) measurement of $BR (B
\to \pi^+ \pi^-) = (4.7^{+1.8}_{-1.5} \pm 0.6) \times 10^{-6}$. We study, using
recent results on QCD improved factorization, the implications of this
measurement for the determination of the CKM phase $\alpha$ and also for the
rate for $B \to \pi^0 \pi^0$. If the $B \to \pi^-$ form factor is large
$(\stackrel{>}{\sim} 0.3)$, then we find that the CLEO measurement favors small
$|V_{ub}/V_{cb}|$ so that the expected error (due to neglecting the QCD penguin
amplitude) in the measurement of $\alpha$ using {\em only} the time-dependent
analysis of the decay $B \to \pi^+ \pi^-$ is large $\sim 15^{\circ}$. However,
if $|V_{ub}/V_{cb}|$ is known, then it is possible to determine the correct
value of $\sin 2 \alpha$.
","[{""version"":""v1"",""created"":""Wed, 8 Sep 1999 22:56:43 GMT""},{""version"":""v2"",""created"":""Wed, 8 Sep 1999 23:03:28 GMT""},{""version"":""v3"",""created"":""Mon, 13 Sep 1999 23:19:00 GMT""},{""version"":""v4"",""created"":""Thu, 18 Nov 1999 22:48:59 GMT""},{""version"":""v5"",""created"":""Mon, 22 Nov 1999 22:29:58 GMT""}]","2009-12-30"
"hep-ph/9909299","J.-Alexis Rodriguez L.","R. Martinez, J-Alexis Rodriguez and M. Vargas (Dpto. de Fisica,
  Universidad Nacional de Colombia Bogota, Colombia)","Getting bounds on the mixing angles for a non-sequential bottom quark","5 pages, LateX,1 figure: eps format, 3 tables. Final version, to
  appear in Physical Review D","Phys.Rev.D63:017301,2001","10.1103/PhysRevD.63.017301",,"hep-ph",,"  We analyze the vertex Zff in the framework of models that add a new bottom
quark in a nonsequential way and we evaluate the tree level contribution to
LEP/SLC data $R_{b}$, $R_{l}$ and the total Z width $\Gamma_{Z}$. We obtain
bounds for the mixing angles through the experimentally allowed contour regions
of the parameters $\Lambda_{L,R}$ introduced here. In order to get a more
restrictive region, we also consider the experimental results for $B\to \nu \nu
X$ as well.
","[{""version"":""v1"",""created"":""Thu, 9 Sep 1999 00:37:43 GMT""},{""version"":""v2"",""created"":""Wed, 6 Oct 1999 14:53:29 GMT""},{""version"":""v3"",""created"":""Thu, 16 Dec 1999 13:26:15 GMT""},{""version"":""v4"",""created"":""Tue, 18 Jul 2000 13:47:12 GMT""}]","2014-11-17"
"hep-ph/9909300","Kazuhiro Tanaka","Jiro Kodaira (1), Kazuhiro Tanaka (2) ((1) Hiroshima Univ., (2)
  Juntendo Univ.)","Twist-3 polarized structure functions","6 pages LaTeX, talk given at the QCD 99 Euroconference, Montpellier,
  July 7-13, 1999","Nucl.Phys.Proc.Suppl. 86 (2000) 134-138","10.1016/S0920-5632(00)00555-7",,"hep-ph",,"  We review the nucleon's twist-3 polarized structure functions from the
viewpoint of gauge invariant, nonlocal light-cone operators in QCD. We discuss
a systematic treatment of the polarized structure functions and the
corresponding parton distribution functions. We emphasize unique features of
higher twist distributions, and the role of the QCD equations of motion to
derive their anomalous dimensions for Q^2-evolution.
","[{""version"":""v1"",""created"":""Thu, 9 Sep 1999 00:53:58 GMT""}]","2009-10-31"
"hep-ph/9909301","Morimitsu Tanimoto","Anna Kalliom\""aki, Jukka Maalampi and Morimitsu Tanimoto","Search for CP Violation at a Neutrino Factory in a Four-Neutrino Model","16 pages, latex, no figures, minor corrections","Phys.Lett.B469:179-187,1999","10.1016/S0370-2693(99)01252-6","HIP-1999-54/TH","hep-ph",,"  The CP violation effects in long baseline neutrino oscillations are studied
in the framework of a four-neutrino model (three active neutrinos and one
sterile neutrino). It is assumed that neutrino masses are devided into two
nearly degenerate pairs, as indicated by the oscillation data. Approximative
analytic expressions are derived for the probability differences $\Delta
P_{\a\b} \equiv P(\nu_\alpha \to \nu_\beta)- P(\bar\nu_\alpha \to
\bar\nu_\beta)$ taking into account the CP violation effect of the Earth's
crust. The matter effect is found to be small compared with the genuine CP
violation term, in contrast with the three-neutrino model.
","[{""version"":""v1"",""created"":""Thu, 9 Sep 1999 02:01:30 GMT""},{""version"":""v2"",""created"":""Mon, 1 Nov 1999 02:48:37 GMT""}]","2008-11-26"
"hep-ph/9909302","Hoang Ngoc Long","Hoang Ngoc Long and Vo Thanh Van","Quark Family Discrimination and Flavour-Changing Neutral Currents in the
  SU(3)_C X SU(3)_L X U(1) Model with Right-Handed Neutrinos","7 pages, no figures, to appear in J. Phys. G (1999), October issue","J.Phys.G25:2319-2324,1999","10.1088/0954-3899/25/12/302",,"hep-ph",,"  Contributions of flavour-changing neutral currents in the 3 3 1 model with
right-handed neutrinos to mass difference of the neutral meson system $\Delta
m_P (P = K, D, B)$ are calculated. Using the Fritzsch anzats on quark mixing,
we show that the third family should be different from the first two. We obtain
a lower bound on mass of the new heavy neutral gauge boson as 1.02 TeV.
","[{""version"":""v1"",""created"":""Thu, 9 Sep 1999 07:24:54 GMT""}]","2008-11-26"
"hep-ph/9909303","Zhi-Zhong Xing","Harald Fritzsch","CP Violation and the Light Quark Sector","LaTex 16 pages. Invited talk given at the 13th Rencontres de Physique
  de la Vallee d'Aoste, Results and Perspectives in Particle Physics, La
  Thuile, Aosta Valley, Italy, March 1999 (to appear in the proceedings)",,,"LMU-99-13","hep-ph",,"  In view of the observed strong hierarchy of quark masses, we discuss a new
description of flavor mixing which is particularly suited for models of quark
mass matrices based on flavor symmetries. The necessary and sufficient
conditions for CP violation are clarified. The emergence of CP violation is
primarily linked to a large phase difference (near 90^{\circ}) in the light
quark sector. The unitarity triangle is determined by the mass ratios of the
light quarks. We conclude that the unitarity triangle should be close or
identical to a rectangular triangle, and CP violation is maximal in this sense.
","[{""version"":""v1"",""created"":""Thu, 9 Sep 1999 09:34:39 GMT""}]","2007-05-23"
"hep-ph/9909304","Zhi-Zhong Xing","Harald Fritzsch, Zhi-zhong Xing","Maximal Neutrino Mixing and Maximal CP Violation","LaTex 12 pages (2 figures included)","Phys.Rev. D61 (2000) 073016","10.1103/PhysRevD.61.073016","LMU-99-09","hep-ph hep-ex",,"  We propose a phenomenological model of lepton mixing and CP violation based
on the flavor democracy of charge leptons and the mass degeneracy of neutrinos.
A nearly bi-maximal flavor mixing pattern, which is favored by current data on
atmospheric and solar neutrino oscillations, emerges naturally from this model
after explicit symmetry breaking. The rephasing-invariant strength of CP or T
violation can be as large as one percent, leading to significant probability
asymmetries between \nu_\mu \to \nu_e and \bar{\nu}_\mu \to \bar{\nu}_e (or
\nu_e \to \nu_\mu) transitions in the long-baseline neutrino experiments.
","[{""version"":""v1"",""created"":""Thu, 9 Sep 1999 09:42:26 GMT""}]","2009-10-31"
"hep-ph/9909305","Igor Solovtsov","I.L. Solovtsov and D.V. Shirkov","Analytic Approach in Quantum Chromodynamics","30 pages, LaTeX with epsfig.sty, 11 PostScript figures","Theor.Math.Phys. 120 (1999) 1220-1244; Teor.Mat.Fiz. 120 (1999)
  482-510","10.1007/BF02557245","JINR E2-99-244","hep-ph",,"  We investigate a new ``renormalization invariant analytic formulation'' of
calculations in quantum chromodynamics, where the renormalization group
summation is correlated with the analyticity with respect to the square of the
transferred momentum $Q^2$. The expressions for the invariant charge and matrix
elements are then modified such that the unphysical singularities of the ghost
pole type do not appear at all, being by construction compensated by additional
nonperturbative contributions. Using the new scheme, we show that the results
of calculations for a number of physical processes are stable with respect to
higher-loop effects and the choice of the renormalization prescription. Having
in mind applications of the new formulation to inelastic lepton-nucleon
scattering processes, we analyze the corresponding structure functions starting
from the general principles of the theory expressed by the Jost-Lehmann-Dyson
integral representation. We use a nonstandard scaling variable that leads to
modified moments of the structure functions possessing K\""all\'en-Lehmann
analytic properties with respect to $Q^2$. We find the relation between these
``modified analytic moments'' and the operator product expansion.
","[{""version"":""v1"",""created"":""Thu, 9 Sep 1999 12:14:03 GMT""}]","2009-10-31"
"hep-ph/9909306","Kenzo Ogure","K. Ogure and J. Sato","The Auxiliary Mass Method beyond the Local Potential Approximation","23 pages, 3 EPS figures","Prog.Theor.Phys. 106 (2001) 131-147","10.1143/PTP.106.131","UT-850","hep-ph",,"  We show that the evolution equation of the effective potential in the
auxiliary mass method corresponds to a leading approximation of a certain
series. This series is derived from an evolution equation of an effective
action using a derivative expansion. We derived an expression of the
next-to-leading approximation of the evolution equation, which is a
simultaneous partial differential equation.
","[{""version"":""v1"",""created"":""Thu, 9 Sep 1999 12:59:21 GMT""},{""version"":""v2"",""created"":""Tue, 14 Sep 1999 10:31:07 GMT""}]","2009-10-31"
"hep-ph/9909307","Yuanben Dai","Ming-qiu Huang, Cheng-zu Li (CCAST & CIS) and Yuan-ben Dai (ITP,CAS)","QCD sum rule analysis of the subleading Isgur-Wise form-factor
  tau_1(v.v') and tau_2(v.v') for B->D_1 l\bar\nu and B->D_2^* l\bar\nu","RevTeX, 18 pages including 3 PS figures","Phys.Rev. D61 (2000) 054010","10.1103/PhysRevD.61.054010",,"hep-ph",,"  We present a QCD sum rule calculation of the Isgur-Wise form-factor
tau_1(v.v') and tau_2(v.v') for the semileptonic decays B->D_1(2420)l\bar\nu
and B->D_2^*(2460)l\bar\nu in the framework of heavy quark effective theory.
These two universal functions, associated with the matching of the weak
currents in QCD onto those in the effective theory, appear at the order 1/m_Q
in the heavy quark expansion of meson weak decay form factors.
","[{""version"":""v1"",""created"":""Thu, 9 Sep 1999 14:18:40 GMT""}]","2009-10-31"
