"chao-dyn/9909016","Doron Cohen","Doron Cohen","Non Perturbative Destruction of Localization in the Quantum Kicked
  Particle Problem","4 pages, 1 figure. Written in 1991. Notes added 1999. New interest
  due to recent experiments",,,,"chao-dyn cond-mat nlin.CD quant-ph",,"  The angle coordinate of the Quantum Kicked Rotator problem is treated as if
it were an extended coordinate. A new mechanism for destruction of coherence by
noise is analyzed using both heuristic and formal approach. Its effectiveness
constitutes a manifestation of long-range non-trivial dynamical correlations.
Perturbation theory fails to quantify certain aspects of this effect. In the
perturbative case, for sufficiently weak noise, the diffusion coefficient
${\cal D}$ is just proportional to the noise intensity $\nu$. It is predicted
that in some generic cases one may have a non-perturbative dependence ${\cal
D}\propto\nu^{\alpha}$ with $0.35 < \alpha < 0.38$ for arbitrarily weak noise.
This work has been found relevant to the recently studied ionization of H-atoms
by a microwave electric field in the presence of noise. Note added (a):
Borgonovi and Shepelyansky have adopted this idea of non-perturbative
transport, and have demonstrated that the same effect manifests itself in the
tight-binding Anderson model with the same exponent $\alpha$. Note added (b):
The recent interest in the work reported here comes from the experimental work
by the Austin group and by the Auckland group. In these experiment the QKP
model is realized literally. However, the novel effect of non-perturbative
transport, reported in this Letter, has not been tested yet.
","[{""version"":""v1"",""created"":""Thu, 9 Sep 1999 13:08:38 GMT""}]","2007-05-23"
"cond-mat/9909127","Herbert A. Fertig","H.A. Fertig and W. Kohn","Symmetry of the Atomic Electron Density in Hartree, Hartree-Fock, and
  Density Functional Theory","11 pages, 6 figures. Expanded discussion of spherical harmonic
  expansion of Hartree density. Some typos corrected, references added","Phys.Rev.A62:052511,2000","10.1103/PhysRevA.62.052511",,"cond-mat.mtrl-sci",,"  The density of an atom in a state of well-defined angular momentum has a
specific finite spherical harmonic content, without and with interactions.
Approximate single-particle schemes, such as the Hartree, Hartree-Fock, and
Local Density Approximations, generally violate this feature. We analyze, by
means of perturbation theory, the degree of this violation and show that it is
small. The correct symmetry of the density can be assured by a
constrained-search formulation without significantly altering the calculated
energies. We compare our procedure to the (different) common practice of
spherically averaging the self-consistent potential. Kohn-Sham density
functional theory with the exact exchange-correlation potential has the correct
finite spherical harmonic content in its density; but the corresponding exact
single particle potential and wavefunctions contain an infinite number of
spherical harmonics.
","[{""version"":""v1"",""created"":""Wed, 8 Sep 1999 17:47:56 GMT""},{""version"":""v2"",""created"":""Tue, 14 Mar 2000 18:20:40 GMT""}]","2009-02-05"
"cond-mat/9909128","Alexander Chernyshev","A. L. Chernyshev, A. H. Castro Neto, and A. R. Bishop (UC Riverside
  and LANL)","Metallic stripe in two dimensions: stability and spin-charge separation","5 pages, 3 figures, RevTeX, version accepted for publication","Phys. Rev. Lett. 84, 4922 (2000)","10.1103/PhysRevLett.84.4922",,"cond-mat.str-el",,"  The problems of charge stripe formation, spin-charge separation, and
stability of the antiphase domain wall (ADW) associated with a stripe are
addressed using an analytical approach to the t-J_z model. We show that a
metallic stripe together with its ADW is the ground state of the problem in the
low doping regime. The stripe is described as a system of spinons and
magnetically confined holons strongly coupled to the two dimensional (2D) spin
environment with holon-spin-polaron elementary excitations filling a
one-dimensional band.
","[{""version"":""v1"",""created"":""Wed, 8 Sep 1999 20:53:37 GMT""},{""version"":""v2"",""created"":""Sat, 13 May 2000 00:37:52 GMT""}]","2009-10-31"
"cond-mat/9909129","Jerome Benoit","Jerome Benoit","Symmetry, Geometry, Topology and Spin: Heisenberg spins in the continuum
  limit/magnetic vesicles","thesis in french (92 pages/LaTeX)",,,,"cond-mat",,"  In this thesis I present my research on the exotic configurations of
antiferromagnetic systems characterised by a topological invariant. The
research presented outlines the construction of novel local antiferromagnetic
degrees of freedom for low dimensional antiferromagnetic lattices. This new
construction reproduces the real division algebra hierarchy satisfied by the
nonlinear sigma-model and reveals the presence of a novel local gauge field. I
have also studied elastic magnetic vesicles of spherical and toric genus in the
presence of a magnetic soliton. My studies reveal a global shrinking, with
local swellings in the regions where the soliton presents a spin-flip. The
geometrical origin of this novel phenomena led me to interpret the geometric
frustration of magnetic vesicles as the competition between the two topological
orders present. The microscopic mechanism and topological competition suggested
above go beyond the scope of this thesis, providing a microscopic explanation
for the Fermi-Bose transmutation and a way to deal with this type of exotic
physics.
","[{""version"":""v1"",""created"":""Wed, 8 Sep 1999 22:53:52 GMT""},{""version"":""v2"",""created"":""Thu, 9 Sep 1999 21:03:18 GMT""}]","2009-09-25"
"cond-mat/9909130","Sohrab Ismail-Beigi","Sohrab Ismail-Beigi and T. A. Arias","New Algebraic Formulation of Density Functional Calculation",,"Computer Physics Communications, vol 128, pp. 1-45 (June 2000)","10.1016/S0010-4655(00)00072-2",,"cond-mat.mtrl-sci",,"  This article addresses a fundamental problem faced by the ab initio
community: the lack of an effective formalism for the rapid exploration and
exchange of new methods. To rectify this, we introduce a novel, basis-set
independent, matrix-based formulation of generalized density functional
theories which reduces the development, implementation, and dissemination of
new ab initio techniques to the derivation and transcription of a few lines of
algebra. This new framework enables us to concisely demystify the inner
workings of fully functional, highly efficient modern ab initio codes and to
give complete instructions for the construction of such for calculations
employing arbitrary basis sets. Within this framework, we also discuss in full
detail a variety of leading-edge ab initio techniques, minimization algorithms,
and highly efficient computational kernels for use with scalar as well as
shared and distributed-memory supercomputer architectures.
","[{""version"":""v1"",""created"":""Wed, 8 Sep 1999 23:27:36 GMT""},{""version"":""v2"",""created"":""Tue, 28 Sep 1999 06:05:05 GMT""},{""version"":""v3"",""created"":""Wed, 10 May 2000 23:03:23 GMT""}]","2009-10-31"
"cond-mat/9909131","Vassilis Koulovassilopoulos","Giulia Iori (University of Essex) Vassilis Koulovassilopoulos
  (University of Athens)","Patterns of consumption in socio-economic models with heterogeneous
  interacting agents","21 pages, 30 ps figures, uses revtex.sty, epsf.sty, aps.sty",,,,"cond-mat.stat-mech cond-mat.dis-nn q-fin.GN",,"  We study consumption behaviour in systems with heterogeneous interacting
agents. Two different models are introduced, respectively with long and short
range interactions among agents. At any time step an agent decides whether or
not to consume a good, doing so if this provides positive utility. Utility is
affected by idiosyncratic preferences and costs as well as externalities from
other agents. Agents are ranked in classes and recognize peer, distinction and
aspiration groups. We simulate the system for different choices of the
parameters and identify different complex patterns: a steady state regime with
a variety of consumption modes of behaviour, and a wave/cycle regime. The cases
of fad and value goods are both analyzed.
","[{""version"":""v1"",""created"":""Thu, 9 Sep 1999 02:33:58 GMT""}]","2008-12-02"
"cond-mat/9909132","Altug Ozpineci","A. Ozpineci, D.M. Leitner, S. Ciraci","Reduced Density Matrix Approach to Phononic Dissipation in Friction","16 pages, 3 figures (included), revtex",,"10.1103/PhysRevB.62.10558",,"cond-mat",,"  Understanding mechanisms for energy dissipation from nanoparticles in contact
with large samples is a central problem in describing friction microscopically.
Calculation of the reduced density matrix appears to be the most suitable metho
to study such systems that are coupled to a large environment. In this paper
the time evolution of the reduced density matrix has been evaluated for an
arbitrary system coupled to a heat reservoir. The formalism is then applied to
study the vibrational relaxation following the stick-slip motion of a small
adsorbate on a surface. The frequency dependence of the relaxation time is also
determined.
","[{""version"":""v1"",""created"":""Thu, 9 Sep 1999 09:48:21 GMT""}]","2015-06-25"
"cond-mat/9909133","Boris N. Narozhny","B. N. Narozhny and I. L. Aleiner","Mesoscopic fluctuations of the Coulomb drag","4 pages, 4 eps figures",,"10.1103/PhysRevLett.84.5383",,"cond-mat",,"  We consider mesoscopic fluctuations of the Coulomb drag coefficient $\rho_D$
in the system of two separated two-dimensional electron gases. It is shown that
at low temperatures sample to sample fluctuations of $\rho_D$ exceed its
ensemble average. It means that in such a regime the sign of $\rho_D$ is random
and the temperature dependence almost saturates $\rho_D \sim 1/\sqrt{T}$.
","[{""version"":""v1"",""created"":""Thu, 9 Sep 1999 11:58:02 GMT""}]","2009-10-31"
"cond-mat/9909134","Stefan Feldkemper","S. Feldkemper, W. Weber","Superexchange via Cluster States: Calculations of Spin-Phonon Coupling
  Constants for CuGeO3","submitted to Phys.Rev. B",,"10.1103/PhysRevB.62.3816",,"cond-mat.str-el",,"  Calculations for spin-phonon coupling constants in CuGeO3 are presented,
applying fourth order superexchange perturbation theory to an extended Hubbard
model. In our treatment, the intermediate oxygen ligand states are described by
band-like cluster states, due to the presence of significant O(p)-O(p) hopping.
We also include the effect of the Ge ions on the O ligand states.
  We find a considerable q-dependence of the spin-phonon coupling. For the
pi-modes involved in the spin-Peierls transition, our results of the coupling
constants are in fair agreement with the work of Werner, Gros, and Braden. Yet
some discrepancies remain, especially concerning the coupling to the
vibrations, which modulate the O(2)-O(2)-Ge angle delta. Our studies of the
pressure dependence of the magnetic coupling constants J_1 and J_2 suggest,
that relatively large non-linear effects are present, even at small pressure
values, probably due to the existence of a `soft', van-der-Waals-type bond
direction in CuGeO3.
","[{""version"":""v1"",""created"":""Thu, 9 Sep 1999 12:58:13 GMT""}]","2009-10-31"
"cond-mat/9909135","Llorens Serra","Llorens Serra, Antonio Puente, Enrico Lipparini","Orbital current mode in elliptical quantum dots","4 REVTEX pages, 4 PDF figures, accepted in PRB:RC","PRB60,R13966(1999)","10.1103/PhysRevB.60.R13966",,"cond-mat.mes-hall",,"  An orbital current mode peculiar to deformed quantum dots is theoretically
investigated; first by using a simple model that allows to interpret
analytically its main characteristics, and second, by numerically solving the
microscopic equations of time evolution after an initial perturbation within
the time-dependent local-spin-density approximation. Results for different
deformations and sizes are shown.
","[{""version"":""v1"",""created"":""Thu, 9 Sep 1999 13:15:05 GMT""}]","2009-10-31"
"cond-mat/9909136","Gregory Brown","Gregory Brown, M. A. Novotny, Per Arne Rikvold (Florida State U)","Micromagnetic simulations of thermally activated magnetization reversal
  of nanoscale magnets","3 pages, revtex, submitted for MMM '99; Movies avaliable at
  http://www.scri.fsu.edu/~browngrg/micromag/","J. Appl. Phys. 87, 4792(2000).","10.1063/1.373161",,"cond-mat.mtrl-sci cond-mat.stat-mech",,"  Numerical integration of a stochastic Landau-Lifshitz-Gilbert equation is
used to study dynamic processes in single-domain nanoscale magnets at nonzero
temperatures. Special attention is given to including thermal fluctuations as a
Langevin term, and the Fast Multipole Method is used to calculate dipole-dipole
interactions. It is feasible to simulate these dynamics on the nanosecond time
scale for spatial discretizations that involve on the order of 10000 nodes
using a desktop workstation. The nanoscale magnets considered here are single
pillars with large aspect ratio. Hysteresis-loop simulations are employed to
study the stable and metastable configurations of the magnetization. Each
pillar has magnetic end caps. In a time-dependent field the magnetization of
the pillars is observed to reverse via nucleation, propagation, and coalescence
of the end caps. In particular, the end caps propagate into the magnet and meet
near the middle. A relatively long-lived defect is formed when end caps with
opposite vorticity meet. Fluctuations are more important in the reversal of the
magnetization for fields weaker than the zero-temperature coercive field, where
the reversal is thermally activated. In this case, the process must be
described by its statistical properties, such as the distribution of switching
times, averaged over a large number of independent thermal histories.
","[{""version"":""v1"",""created"":""Thu, 9 Sep 1999 13:52:35 GMT""},{""version"":""v2"",""created"":""Mon, 22 Nov 1999 20:40:28 GMT""}]","2009-10-31"
"cond-mat/9909137","David Reguera","J. M. Rubi and P. Mazur","Non-equilibrium Thermodynamics and Hydrodynamic Fluctuations",,,,,"cond-mat.stat-mech",,"  The reformulation of nonequilibirum thermodynamics, to include the treatment
of thermodynamic fluctuations, is applied to the hydrodynamic fluctuations of a
simple fluid. It is shown that the nonequilibrium thermodynamic scheme leads to
the explicit form of the Fokker-Planck equation which describes the time
behaviour of the probability distribution function of these hydrodynamic
fluctuations as well as the irreversible processes which are connected with
this behaviour.
","[{""version"":""v1"",""created"":""Thu, 9 Sep 1999 15:15:33 GMT""}]","2007-05-23"
"cond-mat/9909138","Ophir M. Auslaender","O. M. Auslaender, A. Yacoby, R. de Picciotto, K. W. Baldwin, L. N.
  Pfeiffer, and K. W. West","Experimental Evidence for Resonant-Tunneling in a Luttinger-Liquid","3 pages, 5 figures, corrected typos","Phys. Rev. Lett. 84, 1764 (2000).","10.1103/PhysRevLett.84.1764",,"cond-mat.mes-hall cond-mat.str-el",,"  We have measured the low temperature conductance of a one-dimensional island
embedded in a single mode quantum wire. The quantum wire is fabricated using
the cleaved edge overgrowth technique and the tunneling is through a single
state of the island. Our results show that while the resonance line shape fits
the derivative of the Fermi function the intrinsic line width decreases in a
power law fashion as the temperature is reduced. This behavior agrees
quantitatively with Furusaki's model for resonant tunneling in a
Luttinger-liquid.
","[{""version"":""v1"",""created"":""Thu, 9 Sep 1999 15:28:15 GMT""},{""version"":""v2"",""created"":""Wed, 15 Sep 1999 18:05:29 GMT""}]","2009-10-31"
"gr-qc/9909029","Keith H. Lockitch","Keith H. Lockitch","Stability and rotational mixing of modes in Newtonian and relativistic
  stars","157 pages, 32 ps figures/tables. Ph.D. thesis, University of
  Wisconsin - Milwaukee",,,"WISC-MILW-99-TH-13","gr-qc astro-ph",,"  Despite the recent excitement over the r-mode instability of rotating stars,
these modes are not yet well-understood for stellar models appropriate to
neutron stars - perfect fluid models in which both the equilibrium and
perturbed configurations obey the same one-parameter equation of state.
  In spherical stars of this kind, r-modes and g-modes form a degenerate
zero-frequency subspace. Rotation splits the degeneracy to zeroth order in the
star's angular velocity $\Omega$, and the resulting modes are generically
hybrids, whose limit as $\Omega\to 0$ is a stationary current with axial and
polar parts. Lindblom and Ipser have recently found these hybrid rotational
modes in an analytic study of the Maclaurin spheroids. This dissertation
studies them in Newtonian stars (both uniform density models and $n=1$
polytropes) and reports a first computation of the hybrid rotational modes of
relativistic stars.
","[{""version"":""v1"",""created"":""Wed, 8 Sep 1999 20:16:51 GMT""}]","2007-05-23"
"gr-qc/9909030","Anjan Ananda Sen.","A.A.Sen and N.Banerjee","Nonsingular static global string","Minor corrections added. Accepted for publication in Phys.Rev.D","Phys.Rev. D62 (2000) 047302","10.1103/PhysRevD.62.047302",,"gr-qc",,"  A new solution for the spacetime outside the core of a U(1) static global
string has been presented which is nonsingular. This is the first example of a
nonsingular spacetime around a static global string.}}
","[{""version"":""v1"",""created"":""Thu, 9 Sep 1999 09:09:30 GMT""},{""version"":""v2"",""created"":""Mon, 20 Dec 1999 09:03:08 GMT""},{""version"":""v3"",""created"":""Wed, 12 Apr 2000 10:27:44 GMT""}]","2009-10-31"
"gr-qc/9909031","Jeeva S. Anandan","Jeeva S. Anandan","Remarks on Cosmic Strings and Quantum Gravity","14 pages, Tex. Submitted in 1994 for publication in the proceedings
  of the Conference on Bose and 20th Century Physics, Calcutta, Jan. 1994,
  edited by Partha Ghose (Kluwer)",,,,"gr-qc",,"  A quantum equivalence principle is formulated by means of a gravitational
phase operator which is an element of the Poincare group. This is applied to
the spinning cosmic string which suggests that it may, but not necessarily,
contain gravitational torsion. A new exact solution of the Einstein-
Cartan-Sciama-Kibble equations for the gravitational field with torsion is
obtained everywhere for a cosmic string with uniform energy density, spin
density and flux. The quantization condition for fluxoid due to London and
DeWitt is generalized to include the spin flux. A novel effect due to the
quantized gravitational field of the cosmic string on the wave function of a
particle outside the string is used to show that spacetime points are not
meaningful in quantum gravity.
","[{""version"":""v1"",""created"":""Thu, 9 Sep 1999 13:28:33 GMT""}]","2007-05-23"
"hep-ex/9909014","G. Bauer","G. Bauer","CDF B spectroscopy results: B^** and B_c","3 Pages; Contribution to The International Europhysics Conference on
  High-Energy Physics (EPS-HEP 99), Tampere, Finland, July 15-21, 1999",,,"FERMILAB-Conf-99/227-E","hep-ex",,"  We report on two spectroscopy results from CDF. First, we observe the
orbitally excited $B^{**}$ mesons in $B \to \ell D^{(*)}X$ events. We find $28
\pm 6 \pm 3$% of light $B$ mesons produced are $B^{**}$ states. A collective
mass fit results in a $B_1$ mass of $5.71 \pm 0.02$ GeV/$c^2$. Secondly, we
observe $20.4^{+6.2}_{-5.5}$ decays of $B^+_c \to J/\psi \ell^+X$, with a $
6.40 \pm 0.39 \pm 0.13 {\rm GeV}/c^2$ mass and $ 0.46 ^{+0.18}_{-0.16} \pm 0.03
$ps lifetime. The production rate is in reasonable accordance with
expectations.
","[{""version"":""v1"",""created"":""Thu, 9 Sep 1999 01:44:46 GMT""}]","2007-05-23"
"hep-lat/9909060","Gabor Papp","Romuald A. Janik, Maciej A. Nowak, Gabor Papp and Ismail Zahed","Chiral Disorder in Two-Color QCD with Abelian External Fluxes","LATTICE99, 3 pages with espcrc2 style included","Nucl.Phys.Proc.Suppl. 83 (2000) 977-979","10.1016/S0920-5632(00)91863-2",,"hep-lat",,"  We investigate the effects of several Abelian external fluxes $\phi$, on the
Euclidean Dirac spectrum of light quarks in QCD with two colors. Our results
provide for a novel way of assessing the pion weak decay constant directly from
spectral fluctuations, and discriminating a flux-rich from a flux-poor vacuum,
using QCD lattice simulations.
","[{""version"":""v1"",""created"":""Wed, 8 Sep 1999 18:07:20 GMT""}]","2015-06-25"
"hep-lat/9909061","Frank X. lee","K.F. Liu, S.J. Dong, F.X. Lee, J.B. Zhang","Hadron Masses and Quark Condensate from Overlap Fermions","LATTICE99(Chiral Fermions), 3 pages, 6 figures","Nucl.Phys.Proc.Suppl. 83 (2000) 636-638","10.1016/S0920-5632(00)91760-2","UK/99-12","hep-lat",,"  We present results on hadron masses and quark condensate from Neuberger's
overlap fermion. The scaling and chiral properties and finite volume effects
from this new Dirac operator are studied. We find that the generalized
Gell-Mann-Oakes-Renner relation is well satisfied down to the physical u and d
quark mass range. We find that in the range of the lattice spacing we consider,
the $\pi$ and $\rho$ masses at a fixed $m_{\pi}/m_{\rho}$ ratio have weak
$O(a^2)$ dependence.
","[{""version"":""v1"",""created"":""Wed, 8 Sep 1999 19:07:52 GMT""},{""version"":""v2"",""created"":""Thu, 23 Sep 1999 20:48:11 GMT""}]","2015-06-25"
"hep-lat/9909062","Martin Stock","O. Jahn, F. Lenz, J.W. Negele, and M. Thiele","Center Vortices, Instantons, and Confinement","3 pages, 1 color figure, LaTeX209 using BoxedEPS and esprc2.sty
  (provided); talk presented by J.W. Negele to be published in Lattice99
  (Topology); email to negele@mitlns.mit.edu","Nucl.Phys.Proc.Suppl.83:524-526,2000","10.1016/S0920-5632(00)91726-2","MIT-CTP-2901","hep-lat",,"  We study the relation between center vortices and instantons in lattice QCD.
","[{""version"":""v1"",""created"":""Wed, 8 Sep 1999 22:32:31 GMT""}]","2015-06-25"
"hep-lat/9909063","Azusa Yamaguchi","Azusa Yamaguchi and Akio Sugamoto","Genetic Algorithm for Lattice Gauge Theory. on SU(2) and U(1) on 4
  dimensional lattice, how to hitchhike to thermal equilibrium state","3 pages 4 figures","Nucl.Phys.Proc.Suppl. 83 (2000) 837-839","10.1016/S0920-5632(00)91820-6","OCHA-PP-141","hep-lat",,"  Applying Genetic Algorithm for the Lattice Gauge Theory is formed to be an
effective method to minimize the action of gauge field on a lattice. In 4
dimensions, the critical point and the Wilson loop behaviour of SU(2) lattice
gauge theory as well as the phase transition of U(1) theory have been studied.
The proper coding methodi has been developed in order to avoid the increase of
necessary memory and the overload of calculation for Genetic Algorithm. How
hichhikers toward equlibrium appear against kidnappers is clarified.
","[{""version"":""v1"",""created"":""Thu, 9 Sep 1999 06:23:13 GMT""},{""version"":""v2"",""created"":""Mon, 13 Sep 1999 04:40:13 GMT""}]","2015-06-25"
"hep-lat/9909064","Azusa Yamaguchi","Azusa Yamaguchi and Hideo Nakajima","Landau Gauge Fixing supported by Genetic Algorithm","3 pages, 3 figures LATTICE'99(ALGORITHM)","Nucl.Phys.Proc.Suppl. 83 (2000) 840-842","10.1016/S0920-5632(00)91821-8","OCHA-PP-142","hep-lat",,"  A class of algorithms for the Landau gauge fixing is proposed, which makes
the steepest ascent (SA) method be more efficient by concepts of genetic
algorithm. Main concern is how to incorporate random gauge transformation (RGT)
%, mutation in genetic algorithm (GA) terminology, to gain higher achievement
of the minimal Landau gauge fixing, and to keep lower time consumption. One of
these algorithms uses the block RGT, and another uses RGT controlled by local
fitness density, and the last uses RGT determined by Ising Monte Carlo process.
We tested these algorithms on SU(2) lattice gauge theory in 4 dimension with
small $\beta$s, 2.0, 1.75 and 1.5, and report improvements in hit rate and/or
in time consumption, compared to other methods.
","[{""version"":""v1"",""created"":""Thu, 9 Sep 1999 06:27:32 GMT""}]","2015-06-25"
"hep-lat/9909065","Yoshio Kikukawa","Yoshio Kikukawa (Nagoya University)","Low energy effective action of domain-wall fermion and the
  Ginsparg-Wilson relation","LATTICE99(chiral fermions), 3 pages, LaTeX using espcrc2.sty",,,"DPNU-99-29","hep-lat",,"  We derive the effective action of the light fermion field of the domain-wall
fermion, which is referred as q(x) and \bar q(x) by Furman and Shamir. The
inverse of the effective Dirac operator turns out to be identical to the
inverse of the truncated overlap Dirac operator except a local contact term,
which would give the chiral symmetry breaking in the Ginsparg-Wilson relation.
We argue that there are direct relations between the low energy observables of
the domain-wall QCD and observables of the Ginsparg-Wilson fermion described by
the (truncated) overlap Dirac operator.
","[{""version"":""v1"",""created"":""Thu, 9 Sep 1999 07:52:16 GMT""}]","2007-05-23"
"hep-lat/9909066",,"UKQCD Collaboration, J. Garden","UKQCD's latest results for the static quark potential and light hadron
  spectrum with O(a) improved dynamical fermions","LATTICE99(QCD spectrum), corrected a typo","Nucl.Phys.Proc.Suppl. 83 (2000) 165-167","10.1016/S0920-5632(00)91612-8",,"hep-lat",,"  We present UKQCD's latest results for the static quark potential and light
hadron spectrum obtained from matched simulations using two flavours of
dynamical quarks. We report that using matched ensembles helps disentangle
screening effects from discretisation errors in the static quark potential.
","[{""version"":""v1"",""created"":""Thu, 9 Sep 1999 10:07:51 GMT""},{""version"":""v2"",""created"":""Sat, 11 Sep 1999 14:03:23 GMT""}]","2015-06-25"
