"astro-ph/9909143","Jaume Garriga","J. Garriga, V. F. Mukhanov, K. D. Olum, A. Vilenkin","Eternal inflation, black holes, and the future of civilizations","RevTeX, 14 pages, 6 figures. Minor corrections, improved figures","Int.J.Theor.Phys.39:1887-1900,2000","10.1023/A:1003602000709",,"astro-ph gr-qc hep-th",,"  We discuss the large-scale structure of the universe in inflationary
cosmology and the implications that it may have for the long-term future of
civilizations. Although each civilization is doomed to perish, it may be
possible to transmit its accumulated knowledge to future civilizations. We
consider several scenarios of this sort. If the cosmological constant is
positive, it eventually dominates the universe and bubbles of inflationary
phase begin to nucleate at a constant rate. Thermalized regions inside these
inflating bubbles will give rise to new galaxies and civilizations. It is
possible in principle to send a message to one of them. It might even be
possible to send a device whose purpose is to recreate an approximation of the
original civilization in the new region. However, the message or device will
almost certainly be intercepted by black holes, which nucleate at a much higher
rate than inflating bubbles. Formation of new inflating regions can also be
triggered by gravitational collapse, but again the probability is low, and the
number of attempts required for a positive outcome is enormous. The probability
can be higher if the energy scale of inflation is closer to the Planck scale,
but a high energy scale produces a tight bound on the amount of information
that can be transmitted. One can try to avoid quantum tunneling altogether, but
this requires a violation of quantum inequalities which constrain the magnitude
of negative energy densities. However, the limits of validity of quantum
inequalities are not clear, and future research may show that the required
violation is in fact possible. Therein lies the hope for the future of
civilizations.
","[{""version"":""v1"",""created"":""Wed, 8 Sep 1999 18:05:32 GMT""},{""version"":""v2"",""created"":""Tue, 19 Oct 1999 09:20:01 GMT""},{""version"":""v3"",""created"":""Tue, 16 May 2000 14:15:06 GMT""}]","2011-04-20"
"astro-ph/9909144","J. Robert Buchler","J. Robert Buchler","Nonlinear Pulsations of Convective Stellar Models","Proceedings of the IAU176 Colloquium, Budapest, Hungary, on ""The
  Impact of Large Scale Surveys on Pulsating Star Research"", Eds. L. Szabados &
  D. Kurtz to appear in ASP Conf. Ser",,,,"astro-ph",,"  We review the numerical modelling of the nonlinear pulsations of classical
variable stars with hydrocodes that include the effects of turbulent
convection. Despite their simplicity these turbulent convective recipes appear
to remove many of the difficulties that radiative codes faced. In particular,
the numerical modelling of double mode pulsations has become possible.
","[{""version"":""v1"",""created"":""Wed, 8 Sep 1999 18:45:05 GMT""}]","2007-05-23"
"astro-ph/9909145","Simon Prunet","S. Prunet, A. Blanchard","Warm photo-ionized IGM: a Clue for galaxy and cluster formation history?","14 pages, 12 figures, submitted to A&A",,,"CITA-99-29","astro-ph",,"  In this paper we investigate the overcooling problem and propose some
possible solutions. We show that the overcooling problem is generic to the
hierarchical picture of structure formation, as long as the cooling is actually
possible in small halos at high redshift. Solutions to this problem are likely
to be associated with some feedback mechanism, and probably imply the existence
of a warm IGM containing most of the cosmological baryons. We concentrate on
some possible solutions, mainly photoionization and bulk-heating of the IGM. We
show photoionization can act as a significant feedback mechanism but is not
strong enough to solve the entire overcooling problem. We therefore assume that
the IGM is maintained hot by some energy injection provided by supernova and
galaxy formation is then limited by this feedback mechanism. Such a self
regulated scheme allows us to compute the thermal history of the IGM...
(abridged)
","[{""version"":""v1"",""created"":""Wed, 8 Sep 1999 19:37:22 GMT""}]","2007-05-23"
"astro-ph/9909146","Bennett Link","B. Link (1 and 2), R. I. Epstein (2), J. M. Lattimer (3) ((1) Montana
  State University, (2) Los Alamos National Laboratory, (3) State University of
  New York, Stony Brook)","Pulsar Constraints on Neutron Star Structure and Equation of State","5 pages, including figures. To appear in Physical Review Letters","Phys.Rev.Lett.83:3362-3365,1999","10.1103/PhysRevLett.83.3362",,"astro-ph",,"  With the aim of constraining the structural properties of neutron stars and
the equation of state of dense matter, we study sudden spin-ups, glitches,
occurring in the Vela pulsar and in six other pulsars. We present evidence that
glitches represent a self-regulating instability for which the star prepares
over a waiting time. The angular momentum requirements of glitches in Vela
indicate that at least 1.4% of the star's moment of inertia drives these
events. If glitches originate in the liquid of the inner crust, Vela's
`radiation radius' must exceed ~12 km for a mass of 1.4 solar masses.
Observational tests of whether other neutron stars obey this constraint will be
possible in the near future.
","[{""version"":""v1"",""created"":""Wed, 8 Sep 1999 22:11:37 GMT""}]","2016-08-30"
"astro-ph/9909147","Thomas Michael Tauris","T. M. Tauris (1) and G. J. Savonije (1), ((1) Center for High-Energy
  Astrophysics, University of Amsterdam)","Formation of millisecond pulsars. I. Evolution of low-mass X-ray
  binaries with P > 2 days","Accepted for publication in A&A. 18 pages, 6 figures, 2 tables",,,,"astro-ph",,"  We have performed detailed numerical calculations of the non-conservative
evolution of close binary systems with low-mass (1.0-2.0 M_sun) donor stars and
a 1.3 M_sun accreting neutron star. Rather than using analytical expressions
for simple polytropes, we calculated the thermal response of the donor star to
mass loss, in order to determine the stability and follow the evolution of the
mass transfer. Tidal spin-orbit interactions and Reimers wind mass-loss were
also taken into account. We have re-calculated the correlation between orbital
period and white dwarf mass in wide binary radio pulsar systems. Furthermore,
we find an anti-correlation between orbital period and neutron star mass under
the assumption of the ""isotropic re-emission"" model and compare this result
with observations. We conclude that the accretion efficiency of neutron stars
is rather low and that they eject a substantial fraction of the transferred
material even when accreting at a sub-Eddington level. The mass-transfer rate
is a strongly increasing function of initial orbital period and donor star
mass. For relatively close systems with light donors (P < 10 days and M_2 < 1.3
M_sun) the mass-transfer rate is sub-Eddington, whereas it can be highly
super-Eddington by a factor of 10^4 for wide systems with relatively heavy
donor stars (1.6 - 2.0 M_sun) as a result of their deep convective envelopes.
We briefly discuss the evolution of X-ray binaries with donor stars in excess
of 2 M_sun.
  Based on our calculations we present evidence that PSR J1603-7202 evolved
through a phase with unstable mass transfer from a relatively heavy donor star
and therefore is likely to host a CO white dwarf companion.
","[{""version"":""v1"",""created"":""Wed, 8 Sep 1999 22:12:32 GMT""},{""version"":""v2"",""created"":""Thu, 9 Sep 1999 10:43:51 GMT""}]","2007-05-23"
"astro-ph/9909148","Thomas Michael Tauris","T. M. Tauris (1), R. P. Fender (1), E. P. J. van den Heuvel (1), H. M.
  Johnston (2), K. Wu (3) ((1) CHEAF, University of Amsterdam, (2)
  Anglo-Australian Observatory, Epping, (3) RCfTA, University of Sydney)","Circinus X-1: survivor of a highly asymmetric supernova","6 pages, 3 figues, 2 tables, accepted for publication in MNRAS","MNRAS 310, 1165, 1999","10.1046/j.1365-8711.1999.03068.x",,"astro-ph",,"  We have analyzed the kinematical parameters of Cir X-1 to constrain the
nature of its companion star, the eccentricity of the binary and the
pre-supernova parameter space. We argue that the companion is most likely to be
a low-mass (< 2.0 M_sun) unevolved star and that the eccentricity of the orbit
is 0.94 +/- 0.04. We have evaluated the dynamical effects of the supernova
explosion and we find it must have been asymmetric. On average, we find that a
kick of 740 km/s is needed to account for the recently measured radial velocity
of +430 km/s (Johnston, Fender & Wu) for this extreme system. The corresponding
minimum kick velocity is 500 km/s. This is the largest kick needed to explain
the motion of any observed binary system. If Cir X-1 is associated with the
supernova remnant G321.9-0.3 then we find a limiting minimum age of this
remnant of 60000 yr. Furthermore, we predict that the companion star has lost
10% of its mass as a result of stripping and ablation from the impact of the
supernova shell shortly after the explosion.
","[{""version"":""v1"",""created"":""Wed, 8 Sep 1999 22:32:51 GMT""}]","2009-10-31"
"astro-ph/9909149","Thomas Michael Tauris","T. M. Tauris (1), T. Sennels (2) ((1) University of Amsterdam, (2)
  Aarhus University)","Formation of the binary pulsars PSR B2303+46 and PSR J1141-6545 - young
  neutron stars with old white dwarf companions","9 pages, 4 figures, 2 tables, some revisions, accepted for
  publication in A&A Main Journal",,,,"astro-ph",,"  We have investigated the formation of the binary radio pulsars PSR B2303+46
and PSR J1141-6545 via Monte Carlo simulations of a large number of interacting
stars in binary systems. PSR B2303+46 has recently been shown (van Kerkwijk &
Kulkarni 1999) to be the first neutron star - white dwarf binary system
observed, in which the neutron star was born after the formation of the white
dwarf. We discuss the formation process for such a system and are able to put
constraints on the parameters of the initial ZAMS binary. We present
statistical evidence in favor of a white dwarf companion to the binary pulsar
PSR J1141-6545, just recently discovered in the Parkes Multibeam Survey. If
this is confirmed by observations this system will be the second one known in
which the neutron star was born after its white dwarf companion. We also
predict a minimum space velocity of 150 km/s for PSR J1141-6545, and show it
must have experienced an asymmetric SN in order to explain its low
eccentricity. Finally, we estimate the birthrate of these systems relative to
other binary pulsar systems and present the expected distribution of their
orbital periods, eccentricities and velocities.
","[{""version"":""v1"",""created"":""Wed, 8 Sep 1999 22:41:08 GMT""},{""version"":""v2"",""created"":""Thu, 9 Sep 1999 12:09:16 GMT""},{""version"":""v3"",""created"":""Tue, 11 Jan 2000 14:32:03 GMT""}]","2007-05-23"
"astro-ph/9909150","Jai-chan Hwang","J. Hwang","Conserved quantities in the perturbed Friedmann world model","4 pages, no figure, Proceedings of The 2nd Seoul Workshop on
  Gravitation and Cosmology","J.KoreanPhys.Soc.35:S633-S637,1999;
  J.KoreanPhys.Soc.35:S633-637,1999",,,"astro-ph gr-qc",,"  The evolutions of linear structures in a spatially homogeneous and isotropic
world model are characterized by some conserved quantities: the amplitude of
gravitational wave is conserved in the super-horizon scale, the perturbed
three-space curvature in the comoving gauge is conserved in the
super-sound-horizon scale, and the angular momentum of rotational perturbation
is generally conserved.
","[{""version"":""v1"",""created"":""Thu, 9 Sep 1999 04:06:00 GMT""}]","2008-11-26"
"astro-ph/9909151","Elio Antonello","E. Antonello, L. Mantegazza, D. Fugazza, M. Bossi (Osservatorio
  Astronomico di Brera, Milano-Merate, Italy)","Variable stars in nearby galaxies. II. Population I and II Cepheids in
  Field A of IC 1613","9 pages, 11 figures; submitted to Astronomy and Astrophysics",,,,"astro-ph",,"  The light curves of Cepheids and other variable stars in Field A of IC 1613,
obtained with a CCD and no filter ($Wh$ photometry), have been analyzed. It is
possible to separate first overtone from fundamental mode population I Cepheids
taking into account the pulsation amplitude, the shape of the light curve and
the period. The expected separation is verified in the period--luminosity $PL$
diagram. Light curve Fourier parameters have been compared with those of
Magellanic Clouds and galactic Cepheids, in order to point out the effects of
the very low metallicity of IC 1613 on the light curve shape. Population II
Cepheids of IC 1613 can be discriminated from those of population I in the $PL$
diagram, and, taking into account their color, from other red or blue
variables. Their $PL$ relation is consistent with that observed in globular
clusters, nearby dwarf spheroidal galaxies and LMC. We have shown it is
possible to apply the single-phase method for deriving standard photometry $PL$
relations for population I and II Cepheids; therefore with just one accurate
$BVRI$ observation it is possible to use the population I Cepheids for distance
determinations. Some unusual stars have been identified on the basis of
periods, light curve shapes and colors; they appear to be pulsating stars
laying on the extension of $PL$ relation of known anomalous Cepheids. A firmer
classification of these and other faint stars requires further deeper
multicolor observations.
","[{""version"":""v1"",""created"":""Thu, 9 Sep 1999 07:24:39 GMT""}]","2007-05-23"
"astro-ph/9909152","Wlodek Kluzniak","N. Stergioulas, W. Kluzniak, T. Bulik","Keplerian frequencies and innermost stable circular orbits of rapidly
  rotating strange stars","5 pg., 4 figs","Astron.Astrophys. 352, L116 (1999)",,,"astro-ph",,"  It has been suggested that the frequency in the co-rotating innermost stable
circular orbit (ISCO) about a compact stellar remnant can be determined through
X-ray observations of low-mass X-ray binaries, and that its value can be used
to constrain the equation of state of ultradense matter.
  Upon constructing numerical models of rapidly rotating strange (quark) stars
in general relativity, we find that for stars rotating at the equatorial
mass-shedding limit, the ISCO is indeed above the stellar surface, for a wide
range of central energy densities at a height equal to 11% of the
circumferential stellar radius, which scales inversely with the square root of
the energy density, of self-bound quark matter at zero presure. In contrast to
static stars, the ISCO frequencies of rapidly rotating strange stars can be as
low as 0.9 kHz for a 1.3 solar mass strange star. Hence, the presence of
strange stars in low-mass X-ray binaries cannot be excluded on the basis of the
currently observed frequencies of kHz QPOs, such as the cut-off frequency of
1066 Hz in 4U 1820-30.
","[{""version"":""v1"",""created"":""Thu, 9 Sep 1999 07:33:39 GMT""}]","2016-08-30"
"astro-ph/9909153","Sara L. Ellison","Chris R. Benn, Sara L. Ellison","LA Palma Night-Sky Brightness","Accepted for publication in New Astronomy Reviews","New Astron. Rev. 42 (1998) 503-507","10.1016/S1387-6473(98)00062-1",,"astro-ph",,"  The brightness of the moonless night sky above La Palma was measured on 427
CCD images taken with the Isaac Newton and Jacobus Kapteyn Telescopes on 63
nights during 1987 - 1996. The median sky brightness at high elevation, high
galactic latitude and high ecliptic latitude, at sunspot minimum, is B = 22.7,
V = 21.9, R = 21.0, similar to that at other dark sites. The main contributions
to sky brightness are airglow and zodiacal light. The sky is brighter at low
ecliptic latitude (by 0.4 mag); at solar maximum (by 0.4 mag); and at high
airmass (0.25 mag brighter at airmass 1.5). Light pollution (line + continuum)
contributes < 0.03 mag in U, approximately 0.02 mag in B, approximately 0.10
mag in V, approximately and 0.10 mag in R at the zenith.
  This paper is a summary of results which are presented in full elsewhere
(Benn & Ellison 1998, La Palma Technical Note 115).
","[{""version"":""v1"",""created"":""Thu, 9 Sep 1999 11:17:13 GMT""}]","2009-10-31"
"astro-ph/9909154","Alexander A. Gvozdev","A.A. Gvozdev and I.S. Ognev (Yaroslavl State University, Russia)","On the Possible Enhancement of the Magnetic Field by Neutrino Reemission
  Processes in the Mantle of a Supernova","8 pages, latex","JETP Lett. 69 (1999) 365-370","10.1134/1.568035","YARU-HE-99/06","astro-ph hep-ph",,"  URCA neutrino reemission processes under the conditions in the mantle of a
supernova with a strong toroidal magnetic field are investigated. It is shown
that parity violation in these processes can be manifested macroscopically as a
torque that rapidly spins up the region of the mantle occupied by such a field.
Neutrino spin-up of the mantle can strongly affect the mechanism of further
generation of the toroidal field, specifically, it can enhance the field in a
small neighborhood of the rigid-body-rotating core of the supernova remnant.
","[{""version"":""v1"",""created"":""Thu, 9 Sep 1999 13:15:43 GMT""}]","2015-06-24"
"astro-ph/9909155","Katrin Reblinsky","Katrin Reblinsky and Matthias Bartelmann (MPA, Garching)","Cluster deprojection with joint lensing, X-ray, and Sunyaev-Zeldovich
  data","2 pages including 2 figures, uses PASP conference proceedings style.
  Poster contribution to ""Gravitational Lensing: Recent Progress and Future
  Goals"", Boston University, July 1999, ed. T.G. Brainerd and C.S. Kochanek",,,,"astro-ph",,"  We propose a new cluster deprojection algorithm for recovering cluster
structure along the line of sight (los) based on the Richardson-Lucy (RL)
algorithm, which recovers a nonnegative theoretical distribution from a given
projection. To optimize our reconstruction we combine X-ray and
Sunyaev-Zeldovich (SZ) data with gravitational lensing maps. The combination of
these three data types constrains the structure of rich clusters of galaxies.
To validate our new approach, we apply the algorithm to gas-dynamical cluster
simulations. A reconstruction using the lensing potential is shown.
","[{""version"":""v1"",""created"":""Thu, 9 Sep 1999 13:49:42 GMT""}]","2007-05-23"
"astro-ph/9909156","Antonino Del Popolo","A. Del Popolo (1,2), M. Gambera (1,3) ((1) Istituto di Astronomia
  dell'Universita' di Catania, (2) Dipartimento di Matematica, Universita'
  Statale di Bergamo, (3) Osservatorio Astrofisico di Catania and CNR-GNA)","Non radial motions and the shapes and the abundance of clusters of
  galaxies","Accepted by A&A; 8 pages, 3 encapsulated figures",,,,"astro-ph",,"  We study the effect of non-radial motions on the mass function, the velocity
dispersion function (hereafter VDF) and on the shape of clusters of galaxies
using the model introduced in Del Popolo & Gambera (1998a,b; 1999). The mass
function of clusters, obtained using the quoted model, is compared with the
statistical data by Bahcall & Cen (1992a,b) and Girardi et al. (1998), while
the VDF is compared with the Center for Astrophysics (hereafter CfA) data by
Zabludoff et al. (1993) for local clusters and those of Mazure et al. (1996)
and Fadda et al. (1996). In both cases the model predictions are in good
agreement with the observational data showing once more how non-radial motions
can reduce many of the discrepancies between Cold Dark Matter (hereafter CDM)
model predictions and observational data. Finally we study the effect of
non-radial motions on the intrinsic shape of clusters of galaxies showing that
non-radial motions produce clusters less elongated with respect to CDM model in
agreement with de Theije et al. (1995, 1997) results.
","[{""version"":""v1"",""created"":""Thu, 9 Sep 1999 14:43:03 GMT""}]","2007-05-23"
"astro-ph/9909157","Floyd Stecker","F.W.Stecker (NASA/GSFC) and M.H. Salamon (Utah)","GLAST and the Extragalactic Gamma-ray Background","4 pages, 2 eps figures, published in Proc. 26th ICRC, Salt Lake City,
  UT, 1999, Vol. 3, pg. 313","Astrophys.Space Sci. 261 (1999) 327-330",,,"astro-ph",,"  We show that GLAST should be able to support or rule out the
unresolved-blazar hypothesis for the origin of the diffuse, extragalactic
gamma-ray background.
","[{""version"":""v1"",""created"":""Thu, 9 Sep 1999 14:53:36 GMT""}]","2007-05-23"
"astro-ph/9909158","Yehuda Hoffman","Yehuda Hoffman","Eigenmode Analysis of Radial Velocities","Contribution to ``Cosmic Flows. Towards an Understanding of
  Large-Scale Structure'', Workshop Victoria B.C., July 1999, eds. S. Courteau,
  M. Strauss, and J. Willick (ASP). 8 pages of LaTeX including 9 postscript
  figures",,,,"astro-ph",,"  Radial velocity surveys are examined in terms of eigenmode analysis within
the framework of CDM-like family of models. Rich surveys such as MARK III and
SFI, which consist of more than $10^{3}$ radial velocities, are found to have a
few tens of modes that are not noise dominated. Poor surveys, which have only a
few tens of radial velocities, are noise dominated across the eigenmode
spectrum. In particular, the bulk velocity of such surveys has been found to be
dominated by the more noisy modes. The MARK III and SFI are well fitted by a
tilted flat CDM model found by a maximum likelihood analysis and a $\chi^{2}$
statistics . However, a mode-by-mode inspection shows that a substantial
fraction of the modes lie outside the $90% $ confidence level. This implies
that although globally the CDM-like family of models seems to be consistent
with radial velocity surveys, in detail it does not. This might indicate a need
for a revised power spectrum or for some non-trivial biasing scheme.
","[{""version"":""v1"",""created"":""Thu, 9 Sep 1999 15:43:38 GMT""}]","2007-05-23"
"chao-dyn/9909013","B. C. Baj","Bidhan Chandra Bag and Deb Shankar Ray","Quantum noise-induced chaotic oscillations","minor corrections, new references added","Phys. Rev. E, 61 (2000) 3223","10.1103/PhysRevE.61.3223",,"chao-dyn nlin.CD",,"  We examine the weak quantum noise limit of Wigner equation for phase space
distribution functions. It has been shown that the leading order quantum noise
described in terms of an auxiliary Hamiltonian manifests itself as an
additional fluctuational degree of freedom which may induce chaotic and regular
oscillations in a nonlinear oscillator.
","[{""version"":""v1"",""created"":""Thu, 9 Sep 1999 08:41:23 GMT""},{""version"":""v2"",""created"":""Thu, 28 Oct 1999 09:38:56 GMT""}]","2009-10-31"
"chao-dyn/9909014","Doron Cohen","Doron Cohen and Eric J. Heller","Unification of perturbation theory, RMT and semiclassical considerations
  in the study of parametrically-dependent eigenstates","4 pages, 1 figure. Improved presentation. To be published in Phys.
  Rev. Lett","Phys. Rev. Lett. {\bf 84}, 2841 (2000).","10.1103/PhysRevLett.84.2841",,"chao-dyn cond-mat nlin.CD",,"  We consider a classically chaotic system that is described by an Hamiltonian
$H(Q,P;x)$ where x is a constant parameter. Our main interest is in the case of
a gas-particle inside a cavity, where $x$ controls a deformation of the
boundary or the position of a `piston'. The quantum-eigenstates of the system
are $|n(x)>$. We describe how the parametric kernel $P(n|m)=|<n(x)|m(x_0)>|^2$
evolves as a function of $\delta x = (x-x_0)$. We explore both the perturbative
and the non-perturbative regimes, and discuss the capabilities and the
limitations of semiclassical as well as of random-waves and
random-matrix-theory (RMT) considerations.
","[{""version"":""v1"",""created"":""Thu, 9 Sep 1999 12:20:16 GMT""},{""version"":""v2"",""created"":""Tue, 22 Feb 2000 14:22:36 GMT""}]","2009-10-31"
"chao-dyn/9909015","Doron Cohen","Doron Cohen, Felix M. Izrailev, Tsampikos Kottos","Wavepacket dynamics in energy space, RMT and quantum-classical
  correspondence","4 pages, 4 figures, improved version, to be published in Phys. Rev.
  Lett","Phys. Rev. Lett. 84, 2052 (2000).","10.1103/PhysRevLett.84.2052",,"chao-dyn cond-mat nlin.CD",,"  We apply random-matrix-theory (RMT) to the analysis of evolution of
wavepackets in energy space. We study the crossover from ballistic behavior to
saturation, the possibility of having an intermediate diffusive behavior, and
the feasibility of strong localization effect. Both theoretical considerations
and numerical results are presented. Using quantal-classical correspondence
(QCC) considerations we question the validity of the emerging dynamical
picture. In particular we claim that the appearance of the intermediate
diffusive behavior is possibly an artifact of the RMT strategy.
","[{""version"":""v1"",""created"":""Thu, 9 Sep 1999 12:46:22 GMT""},{""version"":""v2"",""created"":""Fri, 7 Jan 2000 13:42:41 GMT""}]","2009-10-31"
