"hep-ph/9909308","Sergio Pastor","Sergio Pastor and Julien Lesgourgues (SISSA and INFN, Trieste)","Relic neutrino asymmetry, CMB and large-scale structure","5 pages, 3 figures, to be published in Nucl. Phys. B (Proc. Supp.) as
  a contribution to the International Workshop on Particles in Astrophysics and
  Cosmology, Valencia (Spain), May 1999","Nucl.Phys.Proc.Suppl. 81 (2000) 47-51","10.1016/S0920-5632(99)00857-9","SISSA-106/99/EP","hep-ph",,"  We consider some consequences of the presence of a cosmological lepton
asymmetry in the form of neutrinos. A relic neutrino degeneracy enhances the
contribution of massive neutrinos to the present energy density of the
Universe, and modifies the power spectrum of radiation and matter. Comparing
with current observations of cosmic microwave background anisotropies and large
scale structure, we derive some constraints on the relic neutrino degeneracy
and on the spectral index in the case of a flat Universe with a cosmological
constant.
","[{""version"":""v1"",""created"":""Thu, 9 Sep 1999 15:13:57 GMT""}]","2009-10-31"
"hep-ph/9909309","Rainer Pullirsch","Tamas S. Biro, Natascha Hoermann, Harald Markum, Rainer Pullirsch","Chaos analyses in both phases of QED and QCD","Talk presented at QCD'99, 5 pages, 11 plots","Nucl.Phys.Proc.Suppl. 86 (2000) 403-407","10.1016/S0920-5632(00)00594-6",,"hep-ph chao-dyn hep-lat hep-th nlin.CD",,"  We analyze the leading Lyapunov exponents of U(1) and SU(2) gauge field
configurations on the lattice which are initialized by quantum Monte Carlo
simulations. We find that configurations in the strong coupling phase are
substantially more chaotic than in deconfinement.
","[{""version"":""v1"",""created"":""Thu, 9 Sep 1999 15:17:24 GMT""}]","2009-10-31"
"hep-th/9909041","Konstadinos Sfetsos","I. Bakas and K. Sfetsos","States and Curves of Five-Dimensional Gauged Supergravity","43 pages, latex. v2: a few clarifications have been made, typos
  corrected and some references added. Final version to appear in Nucl. Phys. B","Nucl.Phys. B573 (2000) 768-810","10.1016/S0550-3213(00)00014-6","CERN-TH/99-270","hep-th gr-qc hep-ph",,"  We consider the sector of N=8 five-dimensional gauged supergravity with
non-trivial scalar fields in the coset space SL(6,R)/SO(6), plus the metric. We
find that the most general supersymmetric solution is parametrized by six real
moduli and analyze its properties using the theory of algebraic curves. In the
generic case, where no continuous subgroup of the original SO(6) symmetry
remains unbroken, the algebraic curve of the corresponding solution is a
Riemann surface of genus seven. When some cycles shrink to zero size the
symmetry group is enhanced, whereas the genus of the Riemann surface is lowered
accordingly. The uniformization of the curves is carried out explicitly and
yields various supersymmetric configurations in terms of elliptic functions. We
also analyze the ten-dimensional type-IIB supergravity origin of our solutions
and show that they represent the gravitational field of a large number of
D3-branes continuously distributed on hyper-surfaces embedded in the
six-dimensional space transverse to the branes. The spectra of massless scalar
and graviton excitations are also studied on these backgrounds by casting the
associated differential equations into Schrodinger equations with non-trivial
potentials. The potentials are found to be of Calogero type, rational or
elliptic, depending on the background configuration that is used.
","[{""version"":""v1"",""created"":""Wed, 8 Sep 1999 19:52:42 GMT""},{""version"":""v2"",""created"":""Wed, 19 Jan 2000 10:11:16 GMT""}]","2009-10-31"
"hep-th/9909047","Massimo Porrati","L. Girardello, M. Petrini, M. Porrati and A. Zaffaroni","The Supergravity Dual of N=1 Super Yang-Mills Theory","20 pages, Latex. v2: References added and minor misprints corrected","Nucl.Phys. B569 (2000) 451-469","10.1016/S0550-3213(99)00764-6",,"hep-th",,"  We find an exact, N=1 supersymmetric kink solution of 5d gauged supergravity.
We associate this solution with the RG flow from N=4 super Yang-Mills theory,
deformed by a relevant operator, to pure N=1 super Yang-Mills in the IR. We
test this identification by computing various QFT quantities using the
supergravity dual: the tension of electric and magnetic strings and the gaugino
condensate. As demanded by our identification, our kink solution is a true
deformation of N=4, that exhibits confinement of quarks, magnetic screening,
and spontaneous chiral symmetry breaking.
","[{""version"":""v1"",""created"":""Wed, 8 Sep 1999 17:06:07 GMT""},{""version"":""v2"",""created"":""Tue, 5 Oct 1999 17:30:53 GMT""}]","2009-10-31"
"hep-th/9909048","Ichiro Oda","Ichiro Oda","Mass Hierarchy and Trapping of Gravity","11 pages, LaTex 2e","Phys.Lett. B472 (2000) 59-66","10.1016/S0370-2693(99)01423-9","EDO-EP-29","hep-th hep-ph",,"  We construct a model consisting of many D3-branes with only positive tension
in a five-dimensional anti-de Sitter space-time geometry. It is shown that this
type of model naturally realizes not only exponential mass hierarchy between
the Planck scale and the electroweak scale but also trapping of the graviton on
the D3-branes. It is pointed out that our model may have a flexibility to
explain the existence of more than one disparate mass scales, such as the
electroweak scale and the GUT scale, on the same D3-brane.
","[{""version"":""v1"",""created"":""Wed, 8 Sep 1999 18:56:22 GMT""}]","2009-10-31"
"hep-th/9909049","Emil J. Martinec","Emil J. Martinec","Black holes and the phases of brane thermodynamics","29 pages, 12 figures; lectures at Cargese 1999",,,"EFI-99-38","hep-th",,"  Introductory lectures on the relations between the thermodynamics of gauge
theory on branes and black holes, including the correspondence principle of
Horowitz and Polchinski, the AdS/CFT conjecture, and matrix theory.
","[{""version"":""v1"",""created"":""Wed, 8 Sep 1999 21:42:09 GMT""}]","2007-05-23"
"hep-th/9909050","Mauro Varela","R. Gianvittorio, A. Restuccia and J.F. Sanchez","Non Abelian TQFT and scattering of self dual field configuration","13 pages, Latex","Phys.Rev. D60 (1999) 124014","10.1103/PhysRevD.60.124014","SB/F/99-263","hep-th",,"  A non-abelian topological quantum field theory describing the scattering of
self-dual field configurations over topologically non-trivial Riemann surfaces,
arising from the reduction of 4-dim self-dual Yang-Mills fields, is introduced.
It is shown that the phase space of the theory can be exactly quantized in
terms of the space of holomorphic structures over stable vector bundles of
degree zero over Riemann surfaces. The Dirac monopoles are particular static
solutions of the field equations. Its relation to topological gravity is
discussed.
","[{""version"":""v1"",""created"":""Wed, 8 Sep 1999 23:47:39 GMT""}]","2009-10-31"
"hep-th/9909051","Mauro Varela","I. Martin, J. Ovalle and A. Restuccia","Stable Solutions of the Double Compactified D=11 Supermembrane Dual","14 pages, latex","Phys.Lett. B472 (2000) 77-82","10.1016/S0370-2693(99)01424-0",,"hep-th",,"  The hamiltonian formulation of the supersymmetric closed 2-brane dual to the
double compactified D=11 closed supermembrane is presented. The formulation is
in terms of two U(1) vector fields related by the area preserving constraint of
the SUSY 2-brane. Stable solutions of the field equations, which are local
minima of the hamiltonian, are found. In the semiclassical approximation around
the stable solutions the action becomes the reduction of D=10 Super-Maxwell to
the worldvolume. The solutions carry RR charges as a type of magnetic charges
associated with the worldvolume vector field. The geometrical interpretation of
the solution in terms of U(1) line bundles over the worldvolume is obtained.
","[{""version"":""v1"",""created"":""Thu, 9 Sep 1999 00:11:49 GMT""}]","2009-10-31"
"hep-th/9909053",,"Hang Bae Kim and Hyung Do Kim","Inflation and Gauge Hierarchy in Randall-Sundrum Compactification","9 pages, revtex, minor changes and more references added","Phys.Rev. D61 (2000) 064003","10.1103/PhysRevD.61.064003","KAIST-TH 99/07","hep-th gr-qc hep-ph",,"  We obtain the general inflationary solutions for the slab of five-dimensional
AdS spacetime where the fifth dimension is an orbifold $S^1/Z_2$ and two
three-branes reside at its boundaries, of which the Randall-Sundrum model
corresponds to the static limit. The investigation of the general solutions and
their static limit reveals that the RS model recasts both the cosmological
constant problem and the gauge hierarchy problem into the balancing problem of
the bulk and the brane cosmological constants.
","[{""version"":""v1"",""created"":""Thu, 9 Sep 1999 09:07:09 GMT""},{""version"":""v2"",""created"":""Tue, 14 Sep 1999 03:47:02 GMT""}]","2009-10-31"
"hep-th/9909054","Kristin Foerger","K. Foerger (Ecole Polytechnique)","Comments on Non-Supersymmetric Type I Vacua","4 pages, Latex, uses cargese.cls, proceedings of Cargese Summer
  School on ""Progress in String Theory and M theory""",,,"CPHT-PC736.0999","hep-th",,"  We review open descendants of non-supersymmetric type IIB asymmetric
orbifolds with zero cosmological constant. We find that supersymmetry remains
unbroken on the branes at all mass levels, whereas it is broken in the bulk.
","[{""version"":""v1"",""created"":""Thu, 9 Sep 1999 12:00:20 GMT""}]","2007-05-23"
"math-ph/9909009","Vladimir Kazakov","Edouard Brezin and Vladimir Kazakov","Universality of correlations of levels with discrete statistics","19 pages, LATEX, 1 figure",,"10.1007/s002200000259","LPTENS-99/32","math-ph hep-th math.CO math.MP math.RT",,"  We study the statistics of a system of N random levels with integer values,
in the presence of a logarithmic repulsive potential of Dyson type. This
probleme arises in sums over representations (Young tableaux) of GL(N) in
various matrix problems and in the study of statistics of partitions for the
permutation group. The model is generalized to include an external source and
its correlators are found in closed form for any N. We reproduce the density of
levels in the large N and double scaling limits and the universal correlation
functions in Dyson's short-distance scaling limit. We also study the statistics
of small levels.
","[{""version"":""v1"",""created"":""Thu, 9 Sep 1999 01:21:23 GMT""}]","2009-10-31"
"math/9909046","Lajos Molnar","Lajos Molnar","Multiplicative maps on ideals of operators which are local automorphisms","8 pages. To appear in Acta Sci. Math. (Szeged)",,,,"math.OA math.FA",,"  We present the following reflexivity-like result concerning the automorphism
group of the $C^*$-algebra B(H), H being a separable Hilbert space. Let
$\phi:B(H)\to B(H)$ be a multiplicative map (no linearity or continuity is
assumed) which can be approximated at every point by automorphisms of B(H)
(these automorphisms may, of course, depend on the point) in the operator norm.
Then $\phi$ is an automorphism of the algebra B(H).
","[{""version"":""v1"",""created"":""Thu, 9 Sep 1999 06:59:45 GMT""}]","2007-05-23"
"math/9909047","Lajos Molnar","Lajos Molnar","A reflexivity problem concerning the $C^*$-algebra $C(X)\otimes B(H)$","8 pages. To appear in Proc. Amer. Math. Soc",,,,"math.OA math.FA",,"  Let X be a compact Hausdorff space and let H be a separable Hilbert space. We
prove that the group of all order automorphisms of the $C^*$-algebra
$C(X)\otimes B(H)$ is algebraically reflexive.
","[{""version"":""v1"",""created"":""Thu, 9 Sep 1999 07:26:45 GMT""}]","2007-05-23"
"math/9909048","Lajos Molnar","Lajos Molnar","Some multiplicative preservers on $BH)$","13 pages. To appear in Linear Algebra Appl",,,,"math.OA math.FA",,"  In this paper we describe the form of those continuous multiplicative maps on
B(H) (H being a separable complex Hilbert space of dimension not less than 3)
which preserve the rank, or the corank. Furthermore, we characterize those
continuous *-semigroup endomorphisms of B(H) which are spectrum non-increasing.
","[{""version"":""v1"",""created"":""Thu, 9 Sep 1999 07:39:24 GMT""}]","2016-09-07"
"math/9909049","Lajos Molnar","Lajos Molnar","A generalization of Wigner's unitary-antiunitary theorem to Hilbert
  modules","27 pages. To appear in J. Math. Phys",,"10.1063/1.533044",,"math.FA math-ph math.MP math.OA",,"  Let H be a Hilbert $C^*$-module over a matrix algebra A. It is proved that
any function $T:H\to H$ which preserves the absolute value of the (generalized)
inner product is of the form $Tf=\phi(f)Uf$ $(f\in H)$, where $\phi$ is a
phase-function and U is an A-linear isometry. The result gives a natural
extension of Wigner's classical unitary-antiunitary theorem for Hilbert
modules.
","[{""version"":""v1"",""created"":""Thu, 9 Sep 1999 07:53:20 GMT""}]","2009-10-31"
"math/9909050","Alexander Stoimenow","A. Stoimenow","Vassiliev invariants and rational knots of unknotting number one","13 pages, 2 figures; revision 26 Nov 99: added reference [OTY],
  discussion of signatures, branched cover homology and 4-genera, more
  problems; revision 7 Sep 01: Theorem 1.2 slightly improved, a few other minor
  structural changes; revision 20 Dec 01: final version, Theorem 1.2 improved,
  2 sections removed","Topology 42(1) (2003), 227--241.",,,"math.GT",,"  Introducing a way to modify knots using $n$-trivial rational tangles, we show
that knots with given values of Vassiliev invariants of bounded degree can have
arbitrary unknotting number (extending a recent result of Ohyama, Taniyama and
Yamada). The same result is shown for 4-genera and finite reductions of the
homology group of the double branched cover. Closer consideration is given to
rational knots, where it is shown that the number of $n$-trivial rational knots
of at most $k$ crossings is for any $n$ asymptotically at least $C^{(\ln k)^2}$
for any $C<\sqrt[2\ln 2]{e}$.
","[{""version"":""v1"",""created"":""Thu, 9 Sep 1999 12:03:27 GMT""},{""version"":""v2"",""created"":""Fri, 26 Nov 1999 11:18:46 GMT""},{""version"":""v3"",""created"":""Fri, 7 Sep 2001 09:45:22 GMT""},{""version"":""v4"",""created"":""Thu, 20 Dec 2001 16:55:19 GMT""}]","2007-05-23"
"math/9909051","Denis V. Juriev","Denis V. Juriev","Interactive forces","Remark 2 on the actions of interactive forces is added",,,,"math.HO math-ph math.MP",,"  This short article is devoted to the dynamics of controlled (and, therefore,
open) systems. The internal forces, which appear only in the presence of
external free controls and depend explicitely on them, are considered. Such
interactive forces may be regarded as feedbacks generated in the system by the
external free controls. In particular, one is able to interpret the interactive
controls as couplings of free controls with the action of interactive forces;
such dynamical approach to the interactive systems often simplifies their
analysis and allows to perform their synthesis on a systematic level. The field
theoretic counterparts of interactive forces, the fields of interactive forces,
are also considered.
","[{""version"":""v1"",""created"":""Thu, 9 Sep 1999 14:22:50 GMT""},{""version"":""v2"",""created"":""Sat, 30 Oct 1999 22:48:51 GMT""}]","2007-05-23"
"nucl-th/9909016","Silas R. Beane","Silas R. Beane","Elusive Neutrons from Nuclei in Effective Field Theory","8 pages LaTeX and aipproc.sty, 3 figures (uses epsf). Corrected typos
  and references. Talk given at 11th International Light-Cone Workshop: New
  Directions in Quantum Chromodynamics, Seoul, Korea, June 1999","AIP Conf.Proc.494:383-390,1999","10.1063/1.1301687","DOE/ER/40762-193","nucl-th",,"  We review recent computations of neutral pion photoproduction and Compton
scattering on the deuteron in baryon chiral perturbation theory. Progress in
extracting the neutron electric dipole amplitude, which is relevant in neutral
pion photoproduction, and the neutron polarizabilities, which are relevant in
Compton scattering, is discussed.
","[{""version"":""v1"",""created"":""Wed, 8 Sep 1999 23:32:37 GMT""},{""version"":""v2"",""created"":""Fri, 10 Sep 1999 21:45:06 GMT""}]","2010-12-13"
"patt-sol/9909006","K. H. Andersen","K.H. Andersen","A Particle Model of Rolling Grain Ripples Under Waves","9 pages incl. figures. Revised version",,,,"patt-sol cond-mat.stat-mech nlin.PS physics.flu-dyn",,"  A simple model is presented for the formation of rolling grain ripples on a
flat sand bed by the oscillatory flow generated by a surface wave. An equation
of motion is derived for the individual ripples, seen as ""particles"", on the
otherwise flat bed. The model account for the initial apperance of the ripples,
the subsequent coarsening of the ripples and the final equilibrium state. The
model is related to physical parameters of the problem, and an analytical
approximation for the equilibrium spacing of the ripples is developed. It is
found that the spacing between the ripples scale with the square-root of the
non-dimensional shear stress (the Shields parameter) on a flat bed. The results
of the model are compared with measurements, and reasonable agreement between
the model and the measurements is demonstrated.
","[{""version"":""v1"",""created"":""Thu, 9 Sep 1999 10:43:18 GMT""},{""version"":""v2"",""created"":""Tue, 2 May 2000 15:46:39 GMT""}]","2007-05-23"
"physics/9909014","Constantin Brif","Constantin Brif (LIGO, Caltech)","Notes on anelastic effects and thermal noise in suspensions of test
  masses in interferometric gravitational-wave detectors","This is a mini-review of the subject; 17 pages, no figures",,,"LIGO-T990041-00-R","physics.ins-det gr-qc physics.gen-ph",,"  The thermal noise is expected to be one of the main limiting factors on the
sensitivity of interferometric gravitational-wave detectors like LIGO and
VIRGO. Thermal fluctuations of internal modes of the interferometer's test
masses and of suspension modes will dominate the noise spectrum at the
important frequency range between 50 and 200 Hz. It is assumed that losses in
the test masses and suspensions will occur mainly due to internal friction in
their materials, which is related to anelasticity effects in solids. The
present notes comprise some basic results on the theory of anelasticity and
thermal noise in pendulum suspensions. This collection is by no means complete
and focus on aspects which are of interest for the author.
","[{""version"":""v1"",""created"":""Wed, 8 Sep 1999 21:57:20 GMT""}]","2007-05-23"
"physics/9909015","Constantin Brif","Constantin Brif (LIGO, Caltech)","Optimization of thermal noise in multi-loop pendulum suspensions for use
  in interferometric gravitational-wave detectors","12 pages, 4 figures",,,"LIGO-P990028-00-R","physics.ins-det gr-qc physics.gen-ph",,"  We study the thermal-noise spectrum of multi-loop pendulum suspensions for
test masses in interferometric gravitational-wave detectors. The dependence of
the thermal noise on suspension parameters and on properties of the wire
material is discussed for the situation in which the losses are dominated by
the internal friction in the pendulum wires.
","[{""version"":""v1"",""created"":""Wed, 8 Sep 1999 22:08:29 GMT""}]","2007-05-23"
"physics/9909016","Alexandr K. Guts","Alexander K. Guts, Artem A. Zvyagintsev","Solution of the vacuum Einstein equations in Synthetic Differential
  Geometry of Kock-Lawvere","8 pages, LaTeX",,,,"physics.gen-ph",,"  The topos theory is a theory which is used for deciding a number of problems
of theory of relativity, gravitation and quantum physics. It is known that
topos-theoretic geometry can be successfully developed within the framework of
Synthetic Differential Geometry of Kock-Lawvere (SDG), the models of which are
serving the toposes, i.e. categories possessing many characteristics of
traditional Theory of Sets. In the article by using ideas SDG, non-classical
spherically symmetric solution of the vacuum Einstein equations is given.
","[{""version"":""v1"",""created"":""Thu, 9 Sep 1999 07:19:45 GMT""},{""version"":""v2"",""created"":""Tue, 5 Oct 1999 18:53:00 GMT""}]","2007-05-23"
"physics/9909017","Rodrigo Quian Quiroga","R. Quian Quiroga, J. Arnhold, K. Lehnertz, P. Grassberger","Kullback-Leibler and Renormalized Entropy: Applications to EEGs of
  Epilepsy Patients","15 pages, 4 Postscript figures. Submitted to Phys. Rev. E, 1999","Phys Rev. E, 2000; 62: 8380-8386","10.1103/PhysRevE.62.8380",,"physics.bio-ph chao-dyn cond-mat nlin.CD physics.comp-ph physics.data-an physics.med-ph q-bio",,"  Recently, renormalized entropy was proposed as a novel measure of relative
entropy (P. Saparin et al., Chaos, Solitons & Fractals 4, 1907 (1994)) and
applied to several physiological time sequences, including EEGs of patients
with epilepsy. We show here that this measure is just a modified
Kullback-Leibler (K-L) relative entropy, and it gives similar numerical results
to the standard K-L entropy. The latter better distinguishes frequency contents
of e.g. seizure and background EEGs than renormalized entropy. We thus propose
that renormalized entropy might not be as useful as claimed by its proponents.
In passing we also make some critical remarks about the implementation of these
methods.
","[{""version"":""v1"",""created"":""Thu, 9 Sep 1999 12:47:47 GMT""},{""version"":""v2"",""created"":""Thu, 23 Sep 1999 13:47:55 GMT""}]","2016-09-08"
"quant-ph/9909025","Toshihiko Ono","Toshihiko Ono","Structure behind Mechanics I: Foundation","20 pages; trimmed",,,,"quant-ph",,"  This paper proposes a basic theory on physical reality and a new foundation
for quantum mechanics and classical mechanics. It presents a scenario not only
to solve the problem of the arbitrariness on the operator ordering for the
quantization procedure, but also to clarify how the classical-limit occurs.
This paper is the first of the three papers into which the previous paper
quant-ph/9906130 has been separated for readability.
","[{""version"":""v1"",""created"":""Wed, 8 Sep 1999 17:49:29 GMT""},{""version"":""v2"",""created"":""Thu, 9 Sep 1999 03:08:28 GMT""},{""version"":""v3"",""created"":""Wed, 15 Sep 1999 04:07:36 GMT""}]","2007-05-23"
"quant-ph/9909026","Valerie Nowak","Stephen L. Adler and Lawrence P. Horwitz","Structure and Properties of Hughston's Stochastic Extension of the
  Schr\""odinger Equation","Plain Tex, no figures",,"10.1063/1.533255","IASSNS-HEP-99-83","quant-ph",,"  Hughston has recently proposed a stochastic extension of the Schr\""odinger
equation, expressed as a stochastic differential equation on projective Hilbert
space. We derive new projective Hilbert space identities, which we use to give
a general proof that Hughston's equation leads to state vector collapse to
energy eigenstates, with collapse probabilities given by the quantum mechanical
probabilities computed from the initial state. We discuss the relation of
Hughston's equation to earlier work on norm-preserving stochastic equations,
and show that Hughston's equation can be written as a manifestly unitary
stochastic evolution equation for the pure state density matrix. We discuss the
behavior of systems constructed as direct products of independent subsystems,
and briefly address the question of whether an energy-based approach, such as
Hughston's, suffices to give an objective interpretation of the measurement
process in quantum mechanics.
","[{""version"":""v1"",""created"":""Wed, 8 Sep 1999 21:12:59 GMT""}]","2015-06-26"
"quant-ph/9909027","Gennady Berman","G.P.Berman, G.D. Doolen, G.V. Lopez, and V.I. Tsifrinovich","Non-Resonant Effects in Implementation of Quantum Shor Algorithm","11 pages, 13 figures",,"10.1103/PhysRevA.61.042307",,"quant-ph",,"  We simulate Shor's algorithm on an Ising spin quantum computer. The influence
of non-resonant effects is analyzed in detail. It is shown that our ``$2\pi
k$''-method successfully suppresses non-resonant effects even for relatively
large values of the Rabi frequency.
","[{""version"":""v1"",""created"":""Wed, 8 Sep 1999 21:24:18 GMT""},{""version"":""v2"",""created"":""Thu, 9 Sep 1999 00:14:39 GMT""}]","2009-10-31"
"quant-ph/9909028","Viatcheslav V. Dobrovitski","M. I. Katsnelson, V. V. Dobrovitski, and B. N. Harmon","Propagation of local decohering action in distributed quantum systems","6 REVTeX pages, no figures. Introduction and discussion sections are
  extended","Phys. Rev. A 62, 022118 (July 2000)","10.1103/PhysRevA.62.022118",,"quant-ph",,"  We study propagation of the decohering influence caused by a local
measurement performed on a distributed quantum system. As an example, the gas
of bosons forming a Bose-Einstein condensate is considered. We demonstrate that
the local decohering perturbation exerted on the measured region propagates
over the system in the form of a decoherence wave, whose dynamics is governed
by elementary excitations of the system. We argue that the post-measurement
evolution of the system (determined by elementary excitations) is of importance
for transfer of decoherence, while the initial collapse of the wave function
has negligible impact on the regions which are not directly affected by the
measurement.
","[{""version"":""v1"",""created"":""Thu, 9 Sep 1999 06:04:58 GMT""},{""version"":""v2"",""created"":""Thu, 16 Sep 1999 17:08:24 GMT""},{""version"":""v3"",""created"":""Sun, 24 Sep 2000 08:06:02 GMT""}]","2009-10-31"
