"hep-ex/9909044","Salvatore Mele","L3 Collaboration","Search for Charged Higgs Bosons in e+e- Collisions at \sqrt{s} = 189 GeV",,"Phys.Lett.B466:71-78,1999","10.1016/S0370-2693(99)01100-4","CERN-EP/99-120","hep-ex",,"  A search for pair-produced charged Higgs bosons is performed with the L3
detector at LEP using data collected at a centre-of-mass energy of 188.6 GeV,
corresponding to an integrated luminosity of 176.4 pb^-1. Higgs decays into a
charm and a strange quark or into a tau lepton and its associated neutrino are
considered. The observed events are consistent with the expectations from
Standard Model background processes. A lower limit of 65.5 GeV on the charged
Higgs mass is derived at 95 % confidence level, independent of the decay
branching ratio Br(H^{+/-} -> tau nu).
","[{""version"":""v1"",""created"":""Sat, 25 Sep 1999 11:59:45 GMT""}]","2012-08-27"
"hep-ex/9909045","Salvatore Mele","L3 Collaboration","Measurement of Rb and BR(b-> l nu X) at LEP Using Double-Tag Methods",,"Eur.Phys.J.C13:47-61,2000",,"CERN-EP/99-121","hep-ex",,"  We present a combined measurement of Rb = \Gamma(Z -> bb) / \Gamma(Z
->hadrons) and the semileptonic branching ratio of b quarks in Z decays, BR(b->
l nu X), using double-tag methods. Two analyses are performed on one million
hadronic Z decays collected in 1994 and 1995. The first analysis exploits the
capabilities of the silicon microvertex detector. The tagging of b-events is
based on the large impact parameter of tracks from weak b-decays with respect
to the e+e- collision point. In the second analysis, a high-pt lepton tag is
used to enhance the b-component in the sample and its momentum spectrum is used
to constrain the model dependent uncertainties in the semileptonic b-decay. The
analyses are combined in order to provide precise determinations of Rb and
BR(b-> l nu X):
  Rb = 0.2174 +/- 0.0015 (stat.) +/- 0.0028 (sys.);
  BR(b-> l nu X) = (10.16 +/- 0.13 (stat.) +/- 0.30 (sys.)) %.
","[{""version"":""v1"",""created"":""Sat, 25 Sep 1999 12:24:25 GMT""}]","2012-08-27"
"hep-lat/9909156","Walter Wilcox","Walter Wilcox","Finite Volume Effects in Self Coupled Geometries","17 pages LaTeX, to appear in Ann. Phys","Annals Phys. 279 (2000) 65-80","10.1006/aphy.1999.5981","BU/HEPP/99-02","hep-lat",,"  By integrating the pressure equation at the surface of a self coupled
curvilinear boundary, one may obtain asymptotic estimates of energy shifts,
which is especially useful in lattice QCD studies of nonrelativistic bound
states. Energy shift expressions are found for periodic (antiperiodic) boundary
conditions on antipodal points, which require Neumann (Dirichlet) boundary
conditions for even parity states and Dirichlet (Neumann) boundary conditions
for odd parity states. It is found that averaging over periodic and
antiperiodic boundary conditions is an effective way of removing the asymptotic
energy shifts from the boundary. Asymptotic energy shifts from boxes with self
coupled walls are also considered and shown to be effectively antipodal. The
energy shift equations are illustrated by the solution of the bounded harmonic
oscillator and hydrogen atoms.
","[{""version"":""v1"",""created"":""Fri, 24 Sep 1999 17:04:35 GMT""}]","2009-10-31"
"hep-ph/9909506","J. B. Tausk","J. B. Tausk","Non-planar massless two-loop Feynman diagrams with four on-shell legs","Latex, 10 pages; 5 .eps files included with graphicx package","Phys.Lett. B469 (1999) 225-234","10.1016/S0370-2693(99)01277-0","Freiburg-THEP 99/10","hep-ph",,"  The non-planar Feynman diagram with seven massless, scalar propagators and
four on-shell legs (the crossed double box) is calculated analytically in
dimensional regularization. The non-planar diagram with six propagators is also
discussed.
","[{""version"":""v1"",""created"":""Fri, 24 Sep 1999 16:59:10 GMT""}]","2009-10-31"
"hep-ph/9909507","Jamal Jalilian-Marian","J. Jalilian-Marian","Shadowing of Gluons at RHIC and LHC","6 pages, 1 figure, Talk given at XXIX Int. Symp. on Multiparticle
  Dynamics (ISMD99), 9-13 August 1999, Providence, RI, USA",,,"LBNL - 44316 Abs","hep-ph",,"  We show estimates for shadowing of gluons at small values of $x$, appropriate
to RHIC and LHC experiments using a new evolution equation which takes into
account the effects of gluon recombination to all orders in gluon density. We
show that there is a significant depletion in the gluon density of large
nuclei.
","[{""version"":""v1"",""created"":""Fri, 24 Sep 1999 23:48:35 GMT""}]","2007-05-23"
"hep-ph/9909509",,"S. Kasuya and M. Kawasaki","Q-ball Formation through Affleck-Dine Mechanism","4 pages, RevTex, 3 postscript figures included, the published version","Phys.Rev.D61:041301,2000","10.1103/PhysRevD.61.041301",,"hep-ph",,"  We present the full nonlinear calculation of the formation of a Q-ball
through the Affleck-Dine (AD) mechanism by numerical simulations. It is shown
that large Q-balls are actually produced by the fragmentation of the condensate
of a scalar field whose potential is very flat. We find that the typical size
of a Q-ball is determined by the most developed mode of linearized
fluctuations, and almost all the initial charges which the AD condensate
carries are absorbed into the formed Q-balls, whose sizes and the charges
depend only on the initial charge densities.
","[{""version"":""v1"",""created"":""Sat, 25 Sep 1999 09:25:47 GMT""},{""version"":""v2"",""created"":""Wed, 6 Oct 1999 08:17:38 GMT""},{""version"":""v3"",""created"":""Mon, 28 Feb 2000 09:04:41 GMT""}]","2009-12-30"
"hep-ph/9909511","Daoneng Gao","Dao-Neng Gao and Mu-Lin Yan","Electromagnetic self-energies of the neutral pions: Contributions from
  vector resonances","Revtex, 8 pages, no figures","Phys.Lett. B495 (2000) 69-73","10.1016/S0370-2693(00)01175-8",,"hep-ph",,"  By employing vector meson dominance to establish the electromagnetic
interactions of hadrons, the electromagnetic self-energy of the neutral pions,
which receives the contributions from the vector resonances due to chiral
anomaly, is evaluated. This part of the electromagentic mass, which can
contribute to the mass difference of $\pi^\pm-\pi^0$, is finite and as
expected, is smaller than the contributions due to isospin symmetry breaking
and electromagnetic chiral logs corrections, however, could be compared with
the contribution from the short distance QCD.
","[{""version"":""v1"",""created"":""Sat, 25 Sep 1999 11:38:59 GMT""}]","2009-10-31"
"hep-ph/9909512","Tayalati Yahya","Y. Tayalati, J. Derkaoui","On the Resonant Spin Flavor Precession of the Neutrino in the Sun","LATEX, 26 pages, 15 figures","Astropart.Phys.14:351-363,2001","10.1016/S0927-6505(00)00120-1",,"hep-ph",,"  This work deals with the possible solution of the solar neutrino problem in
the framework of the resonant neutrino spin-flavor precession scenario. The
event rate results from the solar neutrino experiments as well as the recoil
electron energy spectrum from SuperKamiokande are used to constrain the free
parameters of the neutrino in this model. We consider two kinds of magnetic
profiles inside the sun. For both cases, a static and a twisting field are
discussed.
","[{""version"":""v1"",""created"":""Sat, 25 Sep 1999 14:51:17 GMT""}]","2011-05-23"
"hep-th/9909178","M. C. Dafon Barrozo","M. C. Daflon Barrozo (DAMTP, University of Cambridge)","Map of Heterotic and Type IIB Moduli in 8 Dimensions","37 pages, 14 figures, Latex; added references for the introduction;
  typos added","Nucl.Phys.B574:189-218,2000","10.1016/S0550-3213(99)00804-4","DAMTP-1999-130","hep-th",,"  Explicit relations among moduli of the Heterotic and Type IIB string theories
in 8 dimensions are obtained. We identify the BPS states responsible for gauge
enhancements in the type IIB theory and their dual partners in the Heterotic
theory compactified with and without Wilson lines. The masses of BPS states in
Type IIB string theory compactified on the base space of a elliptically fibred
K3 are computed explicitly for the special cases in which the complex structure
of the fibre is constant, ie, for constant scalar fields backgrounds.
","[{""version"":""v1"",""created"":""Fri, 24 Sep 1999 16:54:51 GMT""},{""version"":""v2"",""created"":""Fri, 8 Oct 1999 14:35:24 GMT""}]","2010-11-19"
"hep-th/9909180","Donam Youm","Donam Youm","(Generalized) Conformal Quantum Mechanics of 0-Branes and
  Two-Dimensional Dilaton Gravity","21 pages, LaTeX, version to appear in Nucl. Phys. B, an error in Eq.
  (49) corrected","Nucl.Phys. B573 (2000) 257-274","10.1016/S0550-3213(99)00735-X","CERN-TH/99-295","hep-th gr-qc",,"  We study the relation between the (generalized) conformal quantum mechanics
of 0-branes and the two-dimensional dilaton gravity. The two-dimensional
actions obtained from the supergravity effective actions for the (dilatonic)
0-branes through the compactification on a sphere are related to known
two-dimensional dilaton gravity models. The SL(2,R) symmetry of the
(generalized) conformal quantum mechanics is realized within such
two-dimensional models. The two-dimensional dilatonic gravity model derived
from the non-dilatonic 0-brane action is related to the Liouville theory and
therefore is conformal, whereas the two-dimensional model derived from the
dilatonic 0-brane action does not have the conformal symmetry.
","[{""version"":""v1"",""created"":""Fri, 24 Sep 1999 16:23:16 GMT""},{""version"":""v2"",""created"":""Tue, 30 Nov 1999 13:18:50 GMT""}]","2009-10-31"
"hep-th/9909181","Larisa Laperashvili","L. V. Laperashvili (ITEP, Moscow, Russia), H. B. Nielsen (NBI,
  Copenhagen, Denmark)","Phase Transition Couplings in the Higgsed Monopole Model","27 pages, 3 figures",,,,"hep-th",,"  Using a one-loop approximation for the effective potential in the Higgs model
of electrodynamics for a charged scalar field, we argue for the existence of a
triple point for the renormalized (running) values of the selfinteraction
$\lambda$ and the ""charge"" g given by $(\lambda_{run}, g^2) = (-{10/9}
\pi^2,{4/3}\sqrt{{5/3}}{\pi^2}) \approx(-11, 17)$. Considering the
beta-function as a typical quantity we estimate that the one-loop approximation
is valid with accuracy of deviations not more than 30% in the region of the
parameters: $0.2 \stackrel{<}{\sim}{\large \alpha, \tilde{\alpha}}
\stackrel{<}{\sim}1.35.$ The phase diagram given in the present paper
corresponds to the above-mentioned region of $\alpha, \tilde \alpha$. Under the
point of view that the Higgs particle is a monopole with a magnetic charge g,
the obtained electric fine structure constant turns out to be
$\alpha_{crit}\approx{0.18_5}$ by the Dirac relation. This value is very close
to the $\alpha_{crit}^{lat}\approx{0.20}$ which in a U(1) lattice gauge theory
corresponds to the phase transition between the ""Coulomb"" and confinement
phases. Such a result is very encouraging for the idea of an approximate
""universality"" (regularization independence) of gauge couplings at the phase
transition point. This idea was suggested by the authors in their earlier
papers.
","[{""version"":""v1"",""created"":""Fri, 24 Sep 1999 17:18:55 GMT""}]","2007-05-23"
"hep-th/9909183","Igor B. Samsonov","I.L. Buchbinder and I.B. Samsonov","On Holomorphic Effective Actions of Hypermultiplets Coupled to External
  Gauge Superfields","8 pages, no figures","Mod.Phys.Lett. A14 (1999) 2537-2544","10.1142/S0217732399002650",,"hep-th",,"  We study the structure of holomorphic effective action for hypermultiplet
models interacting with background super Yang-Mills fields. A general form of
holomorphic effective action is found for hypermultiplet belonging to arbitrary
representation of any semisimple compact Lie group spontaneously broken to its
maximal abelian subgroup. The applications of obtained results to
hypermultiplets in fundamental and adjoint representations of the SU(n), SO(n),
Sp(n) groups are considered.
","[{""version"":""v1"",""created"":""Sat, 25 Sep 1999 02:36:44 GMT""}]","2009-10-31"
"math/9909149","J. F. Feinstein","J.F. Feinstein, D.W.B. Somerset","Spectral synthesis for Banach Algebras II","27 pages plain tex; some explanations added",,,,"math.OA math.FA",,"  This paper continues the study of spectral synthesis and the topologies
$\tau_{\infty}$ and $\tau_r$ on the ideal space of a Banach algebra,
concentrating particularly on the class of Haagerup tensor products of
C$^*$-algebras. For this class, it is shown that spectral synthesis is
equivalent to the Hausdorffness of $\tau_{\infty}$. Under a weak extra
condition, spectral synthesis is shown to be equivalent to the Hausdorffness of
$\tau_r$.
","[{""version"":""v1"",""created"":""Fri, 24 Sep 1999 16:25:25 GMT""},{""version"":""v2"",""created"":""Fri, 12 May 2000 11:00:22 GMT""}]","2007-05-23"
"math/9909150","Valentin Ovsienko","V. Ovsienko and S. Tabachnikov","Projective geometry of polygons and discrete 4-vertex and 6-vertex
  theorems","LaTeX document, 16 pages, 5 figures",,,"CPT-99/P.3890","math.DG",,"  The paper concerns discrete versions of the three well-known results of
projective differential geometry: the four vertex theorem, the six affine
vertex theorem and the Ghys theorem on four zeroes of the Schwarzian
derivative. We study geometry of closed polygonal lines in $\bbRP^d$ and prove
that polygons satisfying a certain convexity condition have at least d+1
flattenings. This result provides a new approach to the above mentioned
classical theorems.
","[{""version"":""v1"",""created"":""Fri, 24 Sep 1999 16:51:41 GMT""}]","2007-05-23"
"math/9909151","Simon Willerton","Simon Willerton","The Kontsevich integral and algebraic structures on the space of
  diagrams","17 pages, many figures, to appear in the proceedings of Knots in
  Hellas 1998, cross-listed to Quantum Algebra. Feb 22nd 2000: sign error in
  definition of STU relation corrected",,,,"math.GT",,"  This paper is part expository and part presentation of calculational results.
The target space of the Kontsevich integral for knots is a space of diagrams;
this space has various algebraic structures which are described here. These are
utilized with Le's theorem on the behaviour of the Kontsevich integral under
cabling and with the Melvin-Morton Theorem, to obtain, in the Kontsevich
integral for torus knots, both an explicit expression up to degree five and the
general coefficients of the wheel diagrams.
","[{""version"":""v1"",""created"":""Fri, 24 Sep 1999 19:24:58 GMT""},{""version"":""v2"",""created"":""Sun, 26 Sep 1999 14:18:48 GMT""},{""version"":""v3"",""created"":""Tue, 22 Feb 2000 12:30:16 GMT""}]","2007-05-23"
"math/9909152","David Eppstein","David Eppstein","Tangent Spheres and Triangle Centers","3 pages, 1 figure","Amer. Math. Monthly 108(1):63-66, 2001","10.2307/2695679",,"math.MG",,"  Any four mutually tangent spheres in R^3 determine three coincident lines
through opposite pairs of tangencies. As a consequence, we define two new
triangle centers.
","[{""version"":""v1"",""created"":""Fri, 24 Sep 1999 20:52:55 GMT""}]","2010-01-21"
"math/9909153","Le Geismn","Chengyan Liu","Riemann Hypothesis","7 pages",,,,"math.GM",,"  Through an equivalent condition on the Farey series set forth by Franel and
Landau, we prove Riemann Hypothesis for the Riemann zeta-function and the
Dirichlet L-function.
","[{""version"":""v1"",""created"":""Sat, 25 Sep 1999 04:05:53 GMT""}]","2007-05-23"
"math/9909154","Le Geismn","Chengyan Liu","Sieve Method and Landau Problem","6 pages",,,,"math.GM",,"  We solve Landau's four unattackable problems, including Goldbach Conjecture
and Twin Prime Conjecture through sieve method.
","[{""version"":""v1"",""created"":""Sat, 25 Sep 1999 04:19:56 GMT""}]","2007-05-23"
"math/9909155","Danlybaeva A. K.","R. Myrzakulov and A.K. Danlybaeva","The L-equivalent counterpart of the M-III equation","Latex, 15 pages, no figures",,,"CNLP-1994-11","math.DG",,"  The connection between differential geometry of curves and the
(2+1)-dimensional integrable spin system - the M-III equation is established.
Using the presented geometrical formalism the L-equivalent counterpart of the
M-III equation is found.
","[{""version"":""v1"",""created"":""Sat, 25 Sep 1999 09:21:52 GMT""}]","2012-04-15"
"physics/9909053","Joel/Mary Carol Williams","Joel M. Williams (JMC Williams Consultants, Los Alamos, NM)","The MCAS Way","61 pages with figures in 41gif files",,,"JMCWC-MS-1144","physics.gen-ph",,"  The MCAS Way extends the MCAS concept of atomic orbitals to molecular
bonding. There are many examples given for each bonding type. Part I: The MCAS
atomic orbital concept. There are no spherical orbitals and spin pairing does
not occur through spin reversal. Quantum numbers do not validate coexistence in
identical space. Part II: Single bonds. There are no sigma-bonds wherein two
electrons occupy identical space on a line between nuclei; only off-axis (Xi)
bonding. Covalent bonding is purely electrostatic; just like ionic bonding.
Part III: Triple bonds. There are no Pi-bonds in a triple bond. Part IV: Simple
double bonds. There are no sigma bonds; only Pi| and Pi_ bonds. Part V:
Multiple bonds. The traditional Pi-cloud is only a group of reciprocating,
vertically pumping, electron pistons. Electrons conjugate by flowing around
nuclei in the nuclear plane. Atoms adopt a twelve-lobed (T12) orbital
arrangement for multiple bonding. Aromaticity is defined by 2(2n+1), not
(4n+2). Part VI: Miscellaneous compounds. Isoelectronic XO3, phosphorous and
its oxides, and boranes.
","[{""version"":""v1"",""created"":""Fri, 24 Sep 1999 20:56:44 GMT""},{""version"":""v2"",""created"":""Thu, 7 Oct 1999 15:48:36 GMT""},{""version"":""v3"",""created"":""Mon, 3 Jan 2000 21:45:36 GMT""}]","2007-05-23"
"quant-ph/9909076","Valerie Nowak","Stephen L. Adler","Derivation of the Lindblad Generator Structure by use of the It\^o
  Stochastic Calculus","Plain TEX, no figures or tables",,"10.1016/S0375-9601(99)00847-6","IASSNS-HEP-99/85","quant-ph",,"  We use the It\^o stochastic calculus to give a simple derivation of the
Lindblad form for the generator of a completely positive density matrix
evolution, by specialization from the corresponding global form for a
completely positive map. As a by-product, we obtain a generalized generator for
a completely positive stochastic density matrix evolution.
","[{""version"":""v1"",""created"":""Fri, 24 Sep 1999 20:31:44 GMT""}]","2009-10-31"
"quant-ph/9909077","C. Y. Chen","Changye Chen","Legitimacy of wave-function expansion","8 pages, 0 figure",,,,"quant-ph",,"  In this letter we investigate the common procedure in which any wave function
is expanded into a series of eigenfunctions. It is shown that as far as
dynamical systems are concerned the expanding procedure involves various
mathematical and physical difficulties. With or without introducing phase
factors, such expansions do not represent dynamical wave functions.
","[{""version"":""v1"",""created"":""Sat, 25 Sep 1999 03:44:44 GMT""}]","2007-05-23"
"quant-ph/9909078","Robert A. Herrmann","Robert A. Herrmann","The Encoding of Quantum State Information Within Subparticles","Plain Tex, 6 pages. In this version, significant uniqueness
  statements are added",,,,"quant-ph","http://arxiv.org/licenses/nonexclusive-distrib/1.0/","  A method is given by which the descriptive content of quantum state
information can be encoded into subparticle coordinates. This method is
consistent with the MA-model solution to the general grand unification problem.
Subparticle mechanisms via affine or linear transformations are also discussed.
","[{""version"":""v1"",""created"":""Sat, 25 Sep 1999 15:04:14 GMT""},{""version"":""v2"",""created"":""Mon, 21 Feb 2005 19:28:04 GMT""},{""version"":""v3"",""created"":""Fri, 8 Jul 2005 13:31:30 GMT""},{""version"":""v4"",""created"":""Wed, 29 Mar 2006 15:51:55 GMT""},{""version"":""v5"",""created"":""Sun, 6 Jan 2008 12:38:53 GMT""},{""version"":""v6"",""created"":""Sat, 20 Dec 2008 14:16:44 GMT""},{""version"":""v7"",""created"":""Mon, 22 Nov 2010 14:32:31 GMT""}]","2010-11-23"
