"quant-ph/9901015","Qiu-Yu Liu","Hong-Yi Fan (USTC, HeFei) and Q.Y. Liu (ICTP, Trieste)","Operator for Describing Polarization States of a Photon","This version (5 pages) will be published in the European Physical
  Journal D","Eur.Phys.J. D8 (2000) 399-402","10.1007/s100530050050",,"quant-ph",,"  Based on the quantized electromagnetic field described by the
Riemann-Silberstein complex vector $F$, we construct the eigenvector set of $%
F$, which makes up an orthonormal and complete representation. In terms of $% F
$ we then introduce a new operator which can describe the relative ratio of the
left-handed and right-handed polarization states of a polarized photon .In
$F^{\prime}s$ eigenvector basis the operator manifestly exhibits a behaviour
which is similar to a phase difference between two orientations of polarization
of a light beam in classical optics.
","[{""version"":""v1"",""created"":""Fri, 8 Jan 1999 16:11:27 GMT""},{""version"":""v2"",""created"":""Thu, 16 Sep 1999 17:40:00 GMT""}]","2009-10-31"
"quant-ph/9901016","Jun Yan","Guang-jiong Ni, Jun Yan","Lamb shift calculated by simple noncovariant method","9 pages, Revtex, 1 Postscript figure",,,,"quant-ph",,"  The Lamb Shift (LS) of Hydrogenlike atom is evaluated by a simple method of
quantum electrodynamics in noncovariant form, based on the relativistic
stationary Schr\""odinger equation. An induced term proportional to
$\overrightarrow{p}^4$ in the effective Hamiltonian is emphasized. Perturbative
calculation of second order leads to the LS of $ 1S_{1/2}$ state and that of
$2S_{1/2}-2P_{1/2}$ states in H atom with the high accuracy within 0.1%
","[{""version"":""v1"",""created"":""Fri, 8 Jan 1999 18:29:34 GMT""}]","2007-05-23"
"quant-ph/9901017","Sharon Jensen","H. Pierre Noyes","Thoughts on Commutation Relations and Measurement Accuracy","LaTex, 8 pages",,,"SLAC-PUB-7772","quant-ph",,"  We show that measuring the trajectories of charged particles to finite
accuracy leads to the commutation relations needed for the derivation of the
free space Maxwell equations using the {\it discrete ordered calculus} (DOC).
We note that the finite step length derivation of the discrete difference
version of the single particle Dirac equation implies the discrete version of
the p,q commutation relations for a free particle. We speculate that a careful
operational analysis of the change in momenta occurring in a step-wise
continuous solution of the discrete Dirac equation could supply the missing
source-sink terms in the DOC derivation of the Maxwell equations, and lead to a
finite and discrete (``renormalized'') quantum electrodynamics (QED).
","[{""version"":""v1"",""created"":""Fri, 8 Jan 1999 18:52:34 GMT""}]","2007-05-23"
"quant-ph/9901018","Jun Yan","Guang-jiong Ni, Weimin Zhou and Jun Yan","Comparison among Klein-Gordon equation, Dirac equation and Relativistic
  Stationary Schrodinger equation","10 pages, Revtex, 10 Postscript figures",,,,"quant-ph",,"  A particle is always not pure. It always contains hiding antiparticle
ingredient which is the essence of special relativity. Accordingly, the
Klein-Gordon (KG) equation and Dirac equation are restudied and compared with
the Relativistic Stationary Schr\""odinger Equation (RSSE). When an electron is
bound in a Hydrogenlike atom with pointlike nucleus having charge number $Z$,
the critical value of $Z, Z_c$, equals to 137 in Dirac equation whereas
$Z_c=\sqrt{M/\mu} (137)$ in RSSE with $M$ and $\mu$ being the total mass of
atom and the reduced mass of the electron.
","[{""version"":""v1"",""created"":""Fri, 8 Jan 1999 19:01:24 GMT""},{""version"":""v2"",""created"":""Fri, 25 Feb 2000 07:43:13 GMT""}]","2007-05-23"
"quant-ph/9901019","Shuichi Matsumoto","Shoju Kudaka and Shuichi Matsumoto","Uncertainty principle for proper time and mass","15 pages, accepted for publication in J. Math. Phys","J.Math.Phys. 40 (1999) 1237-1245","10.1063/1.532797",,"quant-ph",,"  We review Bohr's reasoning in the Bohr-Einstein debate on the photon box
experiment. The essential point of his reasoning leads us to an uncertainty
relation between the proper time and the rest mass of the clock. It is shown
that this uncertainty relation can be derived if only we take the fundamental
point of view that the proper time should be included as a dynamic variable in
the Lagrangian describing the system of the clock. Some problems and some
positive aspects of our approach are then discussed.
","[{""version"":""v1"",""created"":""Sat, 9 Jan 1999 07:49:30 GMT""}]","2009-10-31"
"quant-ph/9901020","Paulo Americo Maia Neto","J. P. F. Mendonca, P. A. Maia Neto and F. I. Takakura","Quantum photon emission from a moving mirror in the nonperturbative
  regime","11 pages, 3 figures. To be published in Optics Communications",,"10.1016/S0030-4018(98)00658-0",,"quant-ph",,"  We consider the coupling of the electromagnetic vacuum field with an
oscillating perfectly-reflecting mirror in the nonrelativistic approximation.
As a consequence of the frequency modulation associated to the motion of the
mirror, low frequency photons are generated. We calculate the photon emission
rate by following a nonperturbative approach, in which the coupling between the
field sidebands is taken into account. We show that the usual perturbation
theory fails to account correctly for the contribution of TM-polarized vacuum
fluctuations that propagate along directions nearly parallel to the plane
surface of the mirror.
  As a result of the modification of the field eigenfunctions, the resonance
frequency for photon emission is shifted from its unperturbed value.
","[{""version"":""v1"",""created"":""Sat, 9 Jan 1999 12:47:34 GMT""},{""version"":""v2"",""created"":""Mon, 1 Feb 1999 18:12:22 GMT""}]","2009-10-31"
