"cond-mat/9910139","Gyula Bene","Gyula Bene and Peter Szepfalusy","On the Thomas-Fermi approximation in the bulk of trapped Bose-Einstein
  condensed gases","4 pages, RevTeX, no figures, corrections and further results are
  included",,,,"cond-mat",,"  Corrections to the Thomas-Fermi-type solution of the Gross-Pitaevskii
equation are inevitable in order to get correctly the frequencies of the low
lying modes out of the Bogolyubov equations. These corrections are important in
the bulk, too, thus the failure of the Thomas-Fermi approximation is not
confined to the surface. We discuss this effect quantitatively and consider
similar phenomena of spin fluctuations in Bose-Einstein condensed gases in an
optical trap.
","[{""version"":""v1"",""created"":""Fri, 8 Oct 1999 18:48:23 GMT""},{""version"":""v2"",""created"":""Tue, 14 Mar 2000 18:04:57 GMT""}]","2007-05-23"
"cond-mat/9910140","Horacio S. Wio","J. A. Giampaoli, D. E. Strier, C. Batista, German Drazer and H. S. Wio","Exact expression for the diffusion propagator in a family of
  time-dependent anharmonic potentials","RevTex, 19 pgs. Accepted in Physical Review E",,"10.1103/PhysRevE.60.2540",,"cond-mat.stat-mech",,"  We have obtained the exact expression of the diffusion propagator in the
time-dependent anharmonic potential $V(x,t)={1/2}a(t)x^2+b\ln x$. The
underlying Euclidean metric of the problem allows us to obtain analytical
solutions for a whole family of the elastic parameter a(t), exploiting the
relation between the path integral representation of the short time propagator
and the modified Bessel functions. We have also analyzed the conditions for the
appearance of a non-zero flow of particles through the infinite barrier located
at the origin (b<0).
","[{""version"":""v1"",""created"":""Fri, 8 Oct 1999 19:50:00 GMT""}]","2009-10-31"
"cond-mat/9910141","Didier Sornette","Thomas Lux (Bonn University) and D. Sornette (CNRS/Univ. Nice and
  UCLA)","On Rational Bubbles and Fat Tails","20 pages, 3 figures, submitted to the Journal of Monetary Economics","Journal of Money, Credit and Banking, Part 1, vol. 34, No. 3,
  589-610 (August 2002)",,,"cond-mat.stat-mech q-fin.ST",,"  This paper addresses the statistical properties of time series driven by
rational bubbles a la Blanchard and Watson (1982), corresponding to
multiplicative maps, whose study has recently be revived recently in physics as
a mechanism of intermittent dynamics generating power law distributions. Using
insights on the behavior of multiplicative stochastic processes, we demonstrate
that the tails of the unconditional distribution emerging from such bubble
processes follow power-laws (exhibit hyperbolic decline). More precisely, we
find that rational bubbles predict a 'fat' power tail for both the bubble
component and price differences with an exponent smaller than 1, implying
absence of convergence of the mean. The distribution of returns is dominated by
the same power-law over an extended range of large returns. Although power-law
tails are a pervasive feature of empirical data, these numerical predictions
are in disagreement with the usual empirical estimates of an exponent between 2
and 4. It, therefore, appears that exogenous rational bubbles are hardly
reconcilable with some of the stylized facts of financial data at a very
elementary level.
","[{""version"":""v1"",""created"":""Fri, 8 Oct 1999 22:44:38 GMT""}]","2008-12-02"
"cond-mat/9910142","C. Stephen Hellberg","C. Stephen Hellberg and E. Manousakis","Reply to Comment on ""Stripes and the t-J Model""","1 page, RevTex",,,,"cond-mat.str-el cond-mat.supr-con",,"  This is a Reply to the Comment of S.R. White and D.J. Scalapino
[cond-mat/9907243] on our recent paper ``Stripes and the t-J Model'' [Physical
Review Letters 83, 132 (1999) and cond-mat/9812022].
","[{""version"":""v1"",""created"":""Sat, 9 Oct 1999 00:10:23 GMT""}]","2007-05-23"
"cond-mat/9910143","Jijun Zhao","Jijun Zhao, Alper Buldum, Jie Han, Jian Ping Lu","First principles study of Li intercalated carbon nanotube ropes","12 pages, 4 figures",,"10.1103/PhysRevLett.85.1706",,"cond-mat",,"  We studied Li intercalated carbon nanotube ropes by using first principles
methods. Our results show charge transfer between Li and C and small structural
deformation of nanotube due to intercalation. Both inside of nanotube and the
interstitial space are susceptible for intercalation. The Li intercalation
potential of SWNT rope is comparable to that of graphite and almost independent
of Li density up to around LiC$_2$, as observed in recent experiments. This
density is significantly higher than that of Li intercalated graphite, making
nanorope to be a promising candidate for anode material in battery
applications.
","[{""version"":""v1"",""created"":""Sat, 9 Oct 1999 02:40:15 GMT""},{""version"":""v2"",""created"":""Fri, 28 Jan 2000 21:46:25 GMT""}]","2009-10-31"
"cond-mat/9910144","Kravtsov Vladimir","V.E.Kravtsov, and B.L.Altshuler","On the relationship between the noise-induced persistent current and
  dephasing rate","4 pages, revtex","Phys. Rev. Lett., 84 (2000) 3394","10.1103/PhysRevLett.84.3394",,"cond-mat.mes-hall",,"  AC noise in disordered conductors causes both dephasing of the electron wave
functions and a DC current around a mesoscopic ring. We demonstrate that the
dephasing rate tau_{\phi}^{-1} in long wires and the DC current, induced by the
same noise and averaged over an ensemble of small rings are connected. The
ensemble-averaged h/2e flux harmonic <I> of the current and the dephasing rate
caused by the same uniform in space high frequency AC field are related in a
remarkably simple way: <I> tau_{\phi}=C e. Here e is an electron charge, and
the constant C depends on the Dyson symmetry class. For a pure potential
disorder the current <I> is diamagnetic C = -(4/\pi) and in the presence of
strong spin-orbit scattering it is paramagnetic C =(2/\pi). The relationship
seems to agree reasonably with experiments. This suggests that the two puzzles:
anomalously large persistent current [L.P.Levy et al., Phys.Rev.Lett., v.64,
2074 (1990)] and the low-temperature saturation of the dephasing [P.Mohanty et
al., Phys.Rev.Lett., v.78, 3366 (1997)] may have a common solution.
","[{""version"":""v1"",""created"":""Sat, 9 Oct 1999 13:35:28 GMT""}]","2009-10-31"
"gr-qc/9910030","Joel Smoller","Felix Finster, Joel Smoller, and Shing-Tung Yau","The Einstein-Dirac-Maxwell Equations - Black Hole Solutions","19 pages, LaTeX, 2 figures, to appear in the Proceedings of the IMS
  Conference on Differential Equations in Mechanics, Chinese University of Hong
  Kong, June 1999","Methods and Applications of Analysis 8 (2001) 623-634",,,"gr-qc math-ph math.AP math.MP",,"  In this summary article, we review and discuss the non-existence of
stationary black hole solutions for the Einstein-Dirac-Maxwell equations.
","[{""version"":""v1"",""created"":""Fri, 8 Oct 1999 16:41:07 GMT""}]","2007-05-23"
"gr-qc/9910031","Esposito Giampiero","Giampiero Esposito and Cosimo Stornaiolo","New Gauge Conditions in General Relativity: What Can We Learn from Them?","6 pages, Revtex. Talk given at the Conference ""Constrained Dynamics
  and Quantum Gravity, QG99"", Villasimius (Sardinia, Italy), September 13-17,
  1999","Nucl.Phys.Proc.Suppl. 88 (2000) 365-368","10.1016/S0920-5632(00)00803-3","DSF preprint 99/34","gr-qc",,"  The construction of conformally invariant gauge conditions for Maxwell and
Einstein theories on a manifold M is found to involve two basic ingredients.
First, covariant derivatives of a linear gauge (e.g. Lorenz or de Donder),
completely contracted with the tensor field representing the metric on the
vector bundle of the theory. Second, the addition of a compensating term,
obtained by covariant differentiation of a suitable tensor field built from the
geometric data of the problem. If the manifold M is endowed with an
m-dimensional positive-definite metric g, the existence theorem for such a
gauge in gravitational theory can be proved. If the metric g is Lorentzian,
which corresponds to general relativity, some technical steps are harder, but
one has again to solve integral equations on curved space-time to be able to
impose such gauges.
","[{""version"":""v1"",""created"":""Fri, 8 Oct 1999 17:19:34 GMT""}]","2009-10-31"
"hep-lat/9910020","Victor Lesk","UKQCD Collaboration: K. C. Bowler, C. M. Maynard (Edinburgh), L.
  Lellouch (CERN), J. Nieves (Granada), D. G. Richards (Jefferson Lab.), L. Del
  Debbio, J. M. Flynn, V. I. Lesk (Southampton)","An Investigation of the Soft Pion Relation in Quenched Lattice QCD","3 pages, 2 figures","Nucl.Phys.Proc.Suppl. 83 (2000) 313-315","10.1016/S0920-5632(00)91658-X","SHEP 99-14","hep-lat",,"  A lattice determination of the form factor and decay constants for the
semileptonic decay of heavy pseudoscalar (PS) mesons at zero recoil is
presented from which the soft pion relation is satisfied. Chiral extrapolation
of the form factor is performed at constant $q^2$. Pole dominance is used to
extrapolate the form factor in heavy quark mass. At the B mass, the form factor
at zero recoil lies somewhat below the ratio of decay constants; the relation
remains satisfied within error.
","[{""version"":""v1"",""created"":""Fri, 8 Oct 1999 16:06:30 GMT""}]","2015-06-25"
"hep-ph/9910275","Konstantin Matchev","Regina Demina (Kansas State U.), Joseph D. Lykken, Konstantin T.
  Matchev (Fermilab) and Andrei Nomerotski (Florida U.)","Stop and Sbottom Searches in Run II of the Fermilab Tevatron","30 pages, LaTeX, 10 figures","Phys.Rev.D62:035011,2000","10.1103/PhysRevD.62.035011","FERMILAB-PUB-99/259-T","hep-ph hep-ex",,"  We estimate the Tevatron Run II potential for top and bottom squark searches.
We find an impressive reach in several of the possible discovery channels. We
also study some new channels which may arise in non-conventional supersymmetry
models. In each case we rely on a detailed Monte Carlo simulation of the
collider events and the CDF detector performance in Run I.
","[{""version"":""v1"",""created"":""Fri, 8 Oct 1999 20:49:19 GMT""}]","2009-10-09"
"hep-ph/9910284","Mikhail Galynskii","M.V. Galynskii and S.M. Sikach","The diagonal spin basis and calculation of processes involving polarized
  particles","review, 50 pages, 6 figures","Phys.Part.Nucl. 29 (1998) 469-495; Fiz.Elem.Chast.Atom.Yadra 29
  (1998) 1133-1193","10.1134/1.953087",,"hep-ph",,"  The review of developed by the authors new techniques for covariant
calculation of matrix elements in QED, the so-called formalism of ""Diagonal
Spin Basis"" (DSB), is presented. In DSB spin 4-vectors of in- and out- fermions
are expressed just in terms of their 4-momenta. In this approach the little
Lorentz group, common for the initial and final states,is realized. This brings
the spin operators of in- and out-particles to coincidence. The developed
approach is valid both for massive fermions and for massless ones. There occur
no problems with accounting for spin flip amplitudes in it. Just 4-momenta of
particles participating in reactions are required in it to construct the
mathematical apparatus for calculations of matrix elements. We apply this
formalism to the next processes: 1) M\""oller and Bhabha bremsstrahlung
($e^{\pm}e^- \to e^{\pm}e^- \gamma$) in the ultrarelativistic limit when
initial particles and photon are helicity polarized; 2) Compton back-scattering
of photons of intensive circularly polarized laser wave on a beam of
longitudinally polarized ultrarelativistic electrons ($e+n\gamma_0 \to e+\gamma
$); 3) $e^+e^-$-pair production by a hard photon in simultaneous collision with
several laser beam photons ($\gamma+n \gamma_0 \to e^+ + e^-$); 4)
Bethe-Heitler process in the case of a linearly polarized photon emission by an
electron with account for proton recoil and form factors; 5) the reaction $ep
\to ep \gamma$ with proton polarizability being taken into account in the
kinematics when proton bremsstrahlung dominates; 6) orthopositronium 3-photon
annihilation ($e^+e^{-} \to 3 \gamma$).
","[{""version"":""v1"",""created"":""Fri, 8 Oct 1999 18:21:39 GMT""}]","2015-06-25"
"hep-ph/9910285","Haiming Hu","Bo Andersson, Haiming Hu","Few-Body States in Lund String Fragmentation Model","15 pages, 4 psfigs",,,"LU-TP/99-30","hep-ph",,"  The well-known Monte Carlo simulation packet JETSET is not built in order to
describe few-body states (in particular at the few GeV level in e^+e^-
annihilation as in BEPC). In this note we will develop the formalism to use the
basic Lund Model area law directly for Monte Carlo simulations
","[{""version"":""v1"",""created"":""Fri, 8 Oct 1999 19:45:48 GMT""}]","2007-05-23"
"hep-ph/9910287","Andrew Akeroyd","A.G. Akeroyd, A. Arhrib, C. Dove","Charged and Pseudoscalar Higgs production at a Muon Collider","11 pages Latex, 5 figures, formulae added in sections 2.2 and 2.3,
  extra discussion in section 2.3, references added","Phys.Rev. D61 (2000) 071702","10.1103/PhysRevD.61.071702",,"hep-ph",,"  We consider single charged Higgs ($H^{\pm}$) and pseudoscalar Higgs ($A^0$)
production in association with a gauge boson at $\mu^+\mu^-$ colliders. We find
that the tree-level t-channel and s-channel contributions to $\mu^+\mu^-\to
H^{\pm}W^{\mp}, A^0Z$ are enhanced for large values of $\tan\beta$, allowing
sizeable cross-sections whose analogies at $e^+e^-$ colliders would be very
small. These processes provide attractive new ways of producing such particles
at $\mu^+\mu^-$ colliders and are superior to the conventional methods in
regions of parameter space.
","[{""version"":""v1"",""created"":""Sat, 9 Oct 1999 05:34:47 GMT""},{""version"":""v2"",""created"":""Wed, 27 Oct 1999 15:43:22 GMT""}]","2009-10-31"
"hep-ph/9910288","Torbjorn Sjostrand","Torbj\""orn Sj\""ostrand","QCD Interconnection Effects","1+7 pages, 6 eps figures, to appear in the Proceedings of the
  Workshop on the development of future linear electron-positron colliders for
  particle physics studies and for research using free electon lasers, Lund,
  Sweden, 23-26 September 1999",,,"LU TP 99-31","hep-ph",,"  Heavy objects like the W, Z and t are short-lived compared with typical
hadronization times. When pairs of such particles are produced, the subsequent
hadronic decay systems may therefore become interconnected. We study such
potential effects at Linear Collider energies.
","[{""version"":""v1"",""created"":""Sat, 9 Oct 1999 09:54:19 GMT""}]","2007-05-23"
"hep-th/9910079","Peter Bantay","P. Bantay","Permutation orbifolds","10 pages","Nucl.Phys. B633 (2002) 365-378","10.1016/S0550-3213(02)00198-0",,"hep-th",,"  A general theory of permutation orbifolds is developed for arbitrary twist
groups. Explicit expressions for the number of primaries, the partition
function, the genus one characters, the matrix elements of modular
transformations and for fusion rule coefficients are presented, together with
the relevant mathematical concepts, such as Lambda-matrices and twisted
dimensions. The arithmetic restrictions implied by the theory for the allowed
modular representations in CFT are discussed. The simplest nonabelian example
with twist group S_3 is described to illustrate the general theory.
","[{""version"":""v1"",""created"":""Fri, 8 Oct 1999 17:17:58 GMT""}]","2009-10-31"
"hep-th/9910080","Ilya Shapiro","J.A. Helayel-Neto, A. Penna-Firme and I. L. Shapiro","Scalar QED $\hbar$-Corrections to the Coulomb Potential","LaTeX, 16 pages, 4 figures as one ps-file","JHEP 0001 (2000) 009","10.1088/1126-6708/2000/01/009","DF/UFJF-99/14","hep-th",,"  The leading long-distance 1-loop quantum corrections to the Coulomb potential
are derived for scalar QED and their gauge-independence is explicitly checked.
The potential is obtained from the direct calculation of the 2-particle
scattering amplitude, taking into account all relevant 1-loop diagrams. Our
investigation should be regarded as a first step towards the same programme for
effective Quantum Gravity. In particular, with our calculation in the framework
of scalar QED, we are able to demonstrate the incompleteness of some previous
studies concerning the Quantum Gravity counterpart.
","[{""version"":""v1"",""created"":""Fri, 8 Oct 1999 16:22:41 GMT""}]","2009-10-31"
"hep-th/9910081","Grojean","C. Grojean, J. Cline and G. Servant","Supergravity Inspired Warped Compactifications and Effective
  Cosmological Constants","17 pages, LaTeX, 1 figure. v2: references added and a comment about
  D-8 brane of massive IIA sugra included v3: improved argument on the
  effective cosmological constants quantization and clarified discussion on the
  supersymmetric issue of the solutions constructed. Final version to appear in
  NPB","Nucl.Phys.B578:259-276,2000","10.1016/S0550-3213(00)00157-7","LBNL 44356, UCB-PTH-99/49, McGill 99-32, Saclay t99/112","hep-th hep-ph",,"  We propose a supergravity inspired derivation of a Randall-Sundrum's type
action as an effective description of the dynamics of a brane coupled to the
bulk through gravity only. The cosmological constants in the bulk and on the
brane appear at the classical level when solving the equations of motion
describing the bosonic sector of supergravities in ten and eleven dimensions
coupled to the brane. They are related to physical quantities like the brane
electric charge and thus inherit some of their physical properties. The most
appealing property is their quantization: in d_\perp extra dimensions,
Lambda_brane goes like N and Lambda_bulk like N^{2/(2-d_perp)}. This dynamical
origin also explains the apparent fine-tuning required in the Randall-Sundrum
scenario. In our approach, the cosmological constants are derived parameters
and cannot be chosen arbitrarily; instead they are determined by the underlying
Lagrangian. Some of the branes we construct that support cosmological constant
in the bulk have supersymmetric properties: D3-branes of type IIB superstring
theory provide an explicit example.
","[{""version"":""v1"",""created"":""Fri, 8 Oct 1999 21:29:23 GMT""},{""version"":""v2"",""created"":""Wed, 20 Oct 1999 02:15:19 GMT""},{""version"":""v3"",""created"":""Thu, 9 Mar 2000 18:33:36 GMT""}]","2014-11-18"
"hep-th/9910082","Gary Horowitz","Gary T. Horowitz","Comments on Black Holes in String Theory","13 pages. Talk given at Strings '99, Potsdam, Germany","Class.Quant.Grav.17:1107-1116,2000","10.1088/0264-9381/17/5/320",,"hep-th gr-qc",,"  A very brief review is given of some of the developments leading to our
current understanding of black holes in string theory. This is followed by a
discussion of two possible misconceptions in this subject - one involving the
stability of small black holes and the other involving scale radius duality.
Finally, I describe some recent results concerning quasinormal modes of black
holes in anti de Sitter spacetime, and their implications for strongly coupled
conformal field theories (in various dimensions).
","[{""version"":""v1"",""created"":""Fri, 8 Oct 1999 22:10:39 GMT""}]","2011-04-15"
"hep-th/9910083","Hyung Won Lee","H. W. Lee, Y.S. Myung (Inje University)","Noncommutative Geometry and Anyonic Field Theory in the Magnetic Field","19 pages in ReVTeX, 3 embedded eps figures, minor correction was made
  between eq.(50) and (51), one reference is added",,,"INJE-TP-99-6","hep-th",,"  We consider an easy way to get the noncommutative spacetime in Minkowski
space. This corresponds to introducing a magnetic field ${\rm\bf B} = B \hat
{\rm\bf k}$ in the plane. We construct a green's function in coordinate space
which includes a Moyal phase factor. The projection to the lowest Landau
level(LLL) is necessary for a simple calculation. Using this green's function
and a second quantized formalism, we study the thermodynamic property of the
anyons on the noncommutative geometry. It turns out that the Moyal phase
factors contribute to the thermodynamic potential $\Omega$ as opposed to the
free-particle nature.
","[{""version"":""v1"",""created"":""Sat, 9 Oct 1999 06:52:46 GMT""},{""version"":""v2"",""created"":""Wed, 13 Oct 1999 07:01:12 GMT""}]","2007-05-23"
"hep-th/9910084","Libin Fu","Yishi Duan, Libin Fu and Hong Zhang","Topological current of point defects and its bifurcation","revtex,14 pages,no figure","Mod.Phys.Lett. A14 (1999) 2011-2023","10.1142/S0217732399002078",,"hep-th",,"  From the topological properties of a three dimensional vector order
parameter, the topological current of point defects is obtained. One shows that
the charge of point defects is determined by Hopf indices and Brouwer degrees.
The evolution of point defects is also studied. One concludes that there exist
crucial cases of branch processes in the evolution of point defects when the
Jacobian $D(\frac \phi x)=0$.
","[{""version"":""v1"",""created"":""Sat, 9 Oct 1999 07:13:15 GMT""}]","2009-10-31"
"hep-th/9910085","Martin Reuter","M. Reuter","Symplectic Dirac-K\""ahler Fields","86 pages, latex","J.Math.Phys. 40 (1999) 5593-5640","10.1063/1.533048","MZ-TH/99-43","hep-th math-ph math.MP",,"  For the description of space-time fermions, Dirac-K\""ahler fields
(inhomogeneous differential forms) provide an interesting alternative to the
Dirac spinor fields. In this paper we develop a similar concept within the
symplectic geometry of phase-spaces. Rather than on space-time, symplectic
Dirac-K\""ahler fields can be defined on the classical phase-space of any
Hamiltonian system. They are equivalent to an infinite family of metaplectic
spinor fields, i.e. spinors of Sp(2N), in the same way an ordinary
Dirac-K\""ahler field is equivalent to a (finite) mulitplet of Dirac spinors.
The results are interpreted in the framework of the gauge theory formulation of
quantum mechanics which was proposed recently. An intriguing analogy is found
between the lattice fermion problem (species doubling) and the problem of
quantization in general.
","[{""version"":""v1"",""created"":""Sat, 9 Oct 1999 07:13:24 GMT""}]","2009-10-31"
"math/9910047","Xiaonan Ma","Kefeng LIU, Xiaonan MA","On Family Rigidity Theorems I","22 pages. Duke Math. J. to appear",,,,"math.DG",,"  In this paper, we first prove a local family version of the
Atiyah-Bott-Segal-Singer Lefschetz fixed point formula, then we extend the
famous Witten's rigidity Theorems to the family case. Several family vanishing
theorems for elliptic genera are also proved.
","[{""version"":""v1"",""created"":""Fri, 8 Oct 1999 16:45:31 GMT""}]","2007-05-23"
"math/9910048","Ole H. Hald","O.H. Hald","Optimal prediction and the Klein-Gordon equation","18 pages",,"10.1073/pnas.96.9.4774","Berkeley CPAM #754","math.NA",,"  The method of optimal prediction is applied to calculate the future means of
solutions to the Klein-Gordon equation. It is shown that in an appropriate
probability space, the difference between the average of all solutions that
satisfy certain constraints at time t=0, and the average computed by an
approximate method, is small with high probability.
","[{""version"":""v1"",""created"":""Fri, 8 Oct 1999 20:26:17 GMT""}]","2022-06-08"
"math/9910049","Paul E. Gunnells","Eric Babson, Paul E. Gunnells, and Richard Scott","A smooth space of tetrahedra","25 pp., paper substantially revised, results unchanged",,,,"math.AG",,"  We construct a smooth symmetric compactification of the space of all labeled
tetrahedra in P^3.
","[{""version"":""v1"",""created"":""Fri, 8 Oct 1999 21:45:19 GMT""},{""version"":""v2"",""created"":""Wed, 28 Jun 2000 11:17:53 GMT""}]","2007-05-23"
"math/9910050","David B. Wilson","David B. Wilson","How to Couple from the Past Using a Read-Once Source of Randomness","28 pages, 2 figures","Random Structures and Algorithms 16(1):85--113, 2000","10.1002/(SICI)1098-2418(200001)16:1<85::AID-RSA6>3.0.CO;2-H","MSR-TR-99-44","math.PR",,"  We give a new method for generating perfectly random samples from the
stationary distribution of a Markov chain. The method is related to coupling
from the past (CFTP), but only runs the Markov chain forwards in time, and
never restarts it at previous times in the past. The method is also related to
an idea known as PASTA (Poisson arrivals see time averages) in the operations
research literature. Because the new algorithm can be run using a read-once
stream of randomness, we call it read-once CFTP. The memory and time
requirements of read-once CFTP are on par with the requirements of the usual
form of CFTP, and for a variety of applications the requirements may be
noticeably less. Some perfect sampling algorithms for point processes are based
on an extension of CFTP known as coupling into and from the past; for
completeness, we give a read-once version of coupling into and from the past,
but it remains unpractical. For these point process applications, we give an
alternative coupling method with which read-once CFTP may be efficiently used.
","[{""version"":""v1"",""created"":""Sat, 9 Oct 1999 01:23:54 GMT""}]","2012-06-19"
