"astro-ph/9910165","C. S. Kochanek","C.S. Kochanek (1), E.E. Falco (1), C.D. Impey (2), J. Lehar (1), B.A.
  McLeod (1) H.-W. Rix (3), C.R. Keeton (2), J.A. Munoz (1) and C.Y. Peng (2)
  ((1) Harvard-Smithsonian Center for Astrophysics (2) Steward Observatory,
  University of Arizona (3) Max-Planck-Institut fuer Astronomie)","The Evolution of Gravitational Lens Galaxies","10 pages, to appear in ""Gravitational Lensing: Recent Progress and
  Future Goals"" ASP conference series, eds. Brainerd T. & Kochanek C. S",,,,"astro-ph",,"  Most gravitational lens galaxies are early-type galaxies in relatively low
density environments. We show that they lie on the same fundamental plane as
early-type galaxies in both local and distant rich clusters. Their surface
brightness evolution requires a typical star formation epoch of z=2-3, almost
indistinguishable from that of rich cluster galaxies at comparable redshifts.
The restricted galaxy type range of the lenses means that photometric redshifts
work well even with only 1-3 filter photometry. We make preliminary
measurements of the mass and luminosity functions of the lens galaxies, and
find they are consistent with the standard model used for deriving cosmological
limits using lens statistics. As expected for a mass-weighted sample, they are
more massive and more luminous than the overall early-type galaxy population.
","[{""version"":""v1"",""created"":""Fri, 8 Oct 1999 16:15:51 GMT""}]","2007-05-23"
"astro-ph/9910166","Sebastiano Ghigna","Sebastiano Ghigna, Ben Moore (Durham, UK), Fabio Governato
  (Brera-Merate, Milano), George Lake, Tom Quinn and Joachim Stadel (Seattle,
  WA)","Density profiles and substructure of dark matter halos: converging
  results at ultra-high numerical resolution","19 pages, 13 figures, ApJ, in press. Text significantly clarified","Astrophys.J.544:616,2000","10.1086/317221",,"astro-ph",,"  Can N-body simulations reliably determine the structural properties of dark
matter halos? Focussing on a Virgo-sized galaxy cluster, we increase the
resolution of current ``high resolution simulations'' by almost an order of
magnitude to examine the convergence of the important physical quantities. We
have 4 million particles within the cluster and force resolution 0.5 kpc/h
(0.05% of the virial radius). The central density profile has a logarithmic
slope of -1.5, as found in lower resolution studies of the same halo,
indicating that the profile has converged to the ``physical'' limit down to
scales of a few kpc. Also the abundance of substructure is consistent with that
derived from lower resolution runs; on the scales explored, the mass and
circular velocity functions are close to power laws of exponents ~ -1.9 and -4.
Overmerging appears to be globally unimportant for suhalos with circular
velocities > 100 km/s. We can trace most of the cluster progenitors from z=3 to
the present; the central object (the dark matter analog of a cD galaxy)is
assembled between z=3 and 1 from the merging of a dozen halos with v_circ \sim
300 km/s. The mean circular velocity of the subhalos decreases by ~ 20% over 5
billion years, due to tidal mass loss. The velocity dispersions of halos and
dark matter globally agree within 10%, but the halos are spatially anti-biased,
and, in the very central region of the cluster, they show positive velocity
bias; however, this effect appears to depend on numerical resolution.
","[{""version"":""v1"",""created"":""Fri, 8 Oct 1999 16:28:36 GMT""},{""version"":""v2"",""created"":""Fri, 29 Sep 2000 10:29:51 GMT""}]","2008-11-26"
"astro-ph/9910167","Andrzej Udalski","A. Udalski","The Optical Gravitational Lensing Experiment. Red Clump Stars as a
  Distance Indicator","11 pages. Latex+psfig. Accepted for publictation in ApJ Letters.
  Major revision: 30% larger sample of Hipparcos red giants with spectroscopic
  metallicities and extended photometry of the LMC field red clump stars (9
  lines-of-sight). Due to journal space limitation, sections on comparison of
  the LMC red clump distance modulus with previous determinations and relations
  between the color indices and metallicity removed from this version",,"10.1086/312513",,"astro-ph",,"  We present relation of the mean I-band brightness of red clump stars on
metallicity. Red clump stars were proposed to be a very attractive standard
candle for distance determination. The calibration is based on 284 nearby red
giant stars whose high quality spectra allowed to determine accurate individual
metal abundances. High quality parallaxes (\sigma_\pi / \pi < 10%) and
photometry of these very bright stars come from Hipparcos measurements.
Metallicity of the sample covers a large range: -0.6<[Fe/H]<+0.2 dex. We find a
weak dependence of the mean I-band brightness on metallicity (about 0.13
mag/dex).
  What is more important, the range of metallicity of the Hipparcos sample
partially overlaps with metallicity of field giants in the LMC, thus making it
possible to determine the distance to the LMC by almost direct comparison of
brightness of the local Hipparcos red clump giants with that of LMC stars.
Photometry of field red clump giants in nine low extinction fields of the LMC
halo collected during the OGLE-II microlensing survey compared with the
Hipparcos red clump stars data yields the distance modulus to the LMC:
(m-M)_LMC=18.24+/-0.08 mag.
","[{""version"":""v1"",""created"":""Fri, 8 Oct 1999 16:33:32 GMT""},{""version"":""v2"",""created"":""Sun, 10 Oct 1999 11:58:20 GMT""},{""version"":""v3"",""created"":""Fri, 14 Jan 2000 15:35:00 GMT""}]","2009-10-31"
"astro-ph/9910168","A. J. Young","A. J. Young and C. S. Reynolds","Iron line reverberation mapping with Constellation-X","7 pages, 7 figures (some compressed postscript). Accepted for
  publication in ApJ",,"10.1086/308236",,"astro-ph",,"  The broad X-ray iron line seen in the spectra of many AGN is thought to
originate from the inner regions of the putative black hole accretion disk, and
hence provides a rare probe of that central region. In principle, future high
throughput X-ray spectrometers should be able to examine the temporal response
of this fluorescent line to flares in the X-ray continuum source (which
energizes this emission line) - i.e. iron line reverberation mapping will be
possible. It has been previously found that there are robust reverberation
signatures of the black hole spin, mass and the X-ray flare location above the
accretion disk. Here, we simulate observations of a bright Seyfert nucleus with
the proposed NASA mission Constellation-X and demonstrate the feasibility of
detecting these reverberation signatures with this mission. Hence, starting
with XMM in 1999, and maturing with Constellation-X in c2010, iron line
reverberation will open a new window on the innermost regions of AGN.
","[{""version"":""v1"",""created"":""Fri, 8 Oct 1999 17:16:05 GMT""}]","2009-10-31"
"astro-ph/9910169","A. R. Tieftrunk","S.T.Megeath and A.R.Tieftrunk","The Detection of Outflows in the IR-Quiet Molecular Core NGC 6334
  I(North)","4 pages, LaTeX, 3 ps figures, accepted by ApJL",,"10.1086/312374",,"astro-ph",,"  We find strong evidence for outflows originating in the dense molecular core
NGC 6334 I(North): a 1000 Msol molecular core distinguished by its lack of HII
regions and mid-IR emission. New observations were obtained of the SiO 2-1 and
5-4 lines with the SEST 15-m telescope and the H2 (1-0) S(1) line with the ESO
2.2-m telescope. The line profiles of the SiO transitions show broad wings
extending from -50 to 40 km/s, and spatial maps of the line wing emission
exhibit a bipolar morphology with the peaks of the red and blue wing separated
by 30"". The estimated mass loss rate of the outflow is comparable to those for
young intermediate to high-mass stars. The near-IR images show eight knots of
H2 emission. Five of the knots form a linear chain which is displaced from the
axis of the SiO outflow; these knots may trace shock excited gas along the path
of a second, highly collimated outflow. We propose that I(N) is a rare example
of a molecular core in an early stage of cluster formation.
","[{""version"":""v1"",""created"":""Fri, 8 Oct 1999 17:17:09 GMT""}]","2009-10-31"
"astro-ph/9910170","Nathalie Palanque-Delabrouille","ANTARES collaboration","Background Light in Potential Sites for the ANTARES Undersea Neutrino
  Telescope","18 pages, 8 figures, accepted for publication in Astroparticle
  Physics","Astropart.Phys.13:127-136,2000","10.1016/S0927-6505(99)00118-8",,"astro-ph hep-ex",,"  The ANTARES collaboration has performed a series of {\em in situ}
measurements to study the background light for a planned undersea neutrino
telescope. Such background can be caused by $^{40}$K decays or by biological
activity. We report on measurements at two sites in the Mediterranean Sea at
depths of 2400~m and 2700~m, respectively. Three photomultiplier tubes were
used to measure single counting rates and coincidence rates for pairs of tubes
at various distances. The background rate is seen to consist of three
components: a constant rate due to $^{40}$K decays, a continuum rate that
varies on a time scale of several hours simultaneously over distances up to at
least 40~m, and random bursts a few seconds long that are only correlated in
time over distances of the order of a meter. A trigger requiring coincidences
between nearby photomultiplier tubes should reduce the trigger rate for a
neutrino telescope to a manageable level with only a small loss in efficiency.
","[{""version"":""v1"",""created"":""Fri, 8 Oct 1999 17:45:27 GMT""}]","2012-08-27"
"astro-ph/9910171","Tim Naylor","M. W. Somers, T. Naylor","Post nova white dwarf cooling in V1500 Cygni","4 pages, 3 figures, A&A accepted",,,,"astro-ph",,"  We use the irradiated secondary star in the remnant of Nova Cyg 1975 as a
probe of the cooling white dwarf. At superior conjunction the flux in the B
band is dominated by the irradiated face of the secondary star. The heated face
produces an orbital modulation which is dependent on the strength of the
irradiating source. We demonstrate that the cooling rate of the white dwarf is
consistent with the theoretical model of Prialnik (1986).
","[{""version"":""v1"",""created"":""Fri, 8 Oct 1999 17:31:34 GMT""}]","2007-05-23"
"astro-ph/9910172","Cailin Nelson","C.A. Nelson (IGPP/LLNL, Uc Berkeley), K.H. Cook (IGPP/LLNL), P.
  Popowski (IGPP/LLNL), D.A. Alves (IGPP/LLNL,STSCI)","The Distance to the LMC via the Eclipsing Binary HV 2274","submitted to AJ, revised version, results unchanged, omission in
  acknowledgements corrected",,"10.1086/301268",,"astro-ph",,"  We present UBV photometry of the eclipsing binary Harvard Variable 2274 in
the Large Magellanic Cloud (LMC). The stellar parameters of this binary system
were calculated by Guinan et al. (1998a) who gave both a reddening towards HV
2274 of E(B-V) = 0.083 +/- 0.006 and a distance modulus to the LMC, mu_{LMC} =
18.42 +/- 0.007. The reddening of this system was also determined by Udalski et
al. (1998) who found E(B-V) = 0.149 +\- 0.015. With Udalski et al. (1998) B and
V photometry Guinan et al.(1998b) obtained E(B-V) = 0.120 +\- 0.009 and
mu_{LMC} = 18.30 +\- 0.07. Using our UBV photometry, we derive a reddening of
E(B-V)= 0.088 +\- 0.025, consistent with the original value of Guinan et al.
(1998a) and supporting a longer distance modulus to the LMC of about mu_{LMC} =
18.40 +\- 0.07. We stress the uncertainties inherent in ground-based UBV
photometry and the concomitant uncertainties in determining distances based
upon such photometry.
","[{""version"":""v1"",""created"":""Fri, 8 Oct 1999 23:50:15 GMT""},{""version"":""v2"",""created"":""Mon, 18 Oct 1999 22:36:11 GMT""}]","2009-10-31"
"astro-ph/9910173","Roy R. Gal","R. R. Gal, R. R. DeCarvalho, S. C. Odewahn, S. G. Djorgovski and V. E.
  Margoniner","The Northern Sky Optical Cluster Survey I: Detection of Galaxy Clusters
  in DPOSS","22 pages, 9 figures, accepted to AJ",,"10.1086/301185",,"astro-ph",,"  The Northern Sky Optical Cluster Survey is a project to create an objective
catalog of galaxy clusters over the entire high-galactic-latitude Northern sky,
with well understood selection criteria. We use the object catalogs generated
from the Digitized Second Palomar Sky Survey (DPOSS, Djorgovski et al. 1999) as
the basis for this survey. We apply a color criterion to select against field
galaxies, and use a simple adaptive kernel technique to create galaxy density
maps, combined with the bootstrap technique to make significance maps, from
which density peaks are selected. This survey attempts to eliminate some of the
subjective criteria and assumptions of past surveys, including detection by eye
(Abell 1958, ACO 1989) and assumed luminosity functions and cluster profiles
(PDCS, Postman et al. 1995). We also utilize more information (especially
colors) than the most similar recent survey, the APM (Dalton et al. 1992). This
paper presents the details of our cluster detection technique, as well as some
initial results for two small areas totaling ~60 square degrees. We find a mean
surface density of ~1.5 clusters per square degree, consistent with the
detection of richness class 0 and higher clusters to z~0.3. In addition, we
demonstrate an effective photometric redshift estimator for our clusters.
","[{""version"":""v1"",""created"":""Sat, 9 Oct 1999 00:12:49 GMT""}]","2016-08-30"
"astro-ph/9910175","Yong Zhong Qian","D. O. Caldwell (UCSB), G. M. Fuller (UCSD), Y.-Z. Qian (UMN)","Sterile neutrinos and supernova nucleosynthesis","29 pages, 3 postscript figures, submitted to Phys. Rev. D","Phys.Rev. D61 (2000) 123005","10.1103/PhysRevD.61.123005",,"astro-ph hep-ph nucl-th",,"  A light sterile neutrino species has been introduced to explain
simultaneously the solar and atmospheric neutrino puzzles and the results of
the LSND experiment, while providing for a hot component of dark matter.
Employing this scheme of neutrino masses and mixings, we show how
matter-enhanced active-sterile neutrino transformation followed by
active-active neutrino transformation can solve robustly the neutron deficit
problem encountered by models of r-process nucleosynthesis associated with
neutrino-heated supernova ejecta.
","[{""version"":""v1"",""created"":""Sat, 9 Oct 1999 01:35:59 GMT""}]","2009-10-31"
"chao-dyn/9910012","Bala Sundaram","Indubala I. Satija and Bala Sundaram","Quantized Orbits and Resonant Transport","REVTEX document - 8 pages + 3 postscript figures. Submitted to
  Phys.Rev.Lett",,"10.1103/PhysRevLett.84.4581",,"chao-dyn nlin.CD",,"  A tight binding representation of the kicked Harper model is used to obtain
an integrable semiclassical Hamiltonian consisting of degenerate ""quantized""
orbits. New orbits appear when renormalized Harper parameters cross integer
multiples of $\pi/2$. Commensurability relations between the orbit frequencies
are shown to correlate with the emergence of accelerator modes in the classical
phase space of the original kicked problem. The signature of this resonant
transport is seen in both classical and quantum behavior. An important feature
of our analysis is the emergence of a natural scaling relating classical and
quantum couplings which is necessary for establishing correspondence.
","[{""version"":""v1"",""created"":""Fri, 8 Oct 1999 16:26:39 GMT""}]","2009-10-31"
"chao-dyn/9910013","Peter D. Ditlevsen","P. D. Ditlevsen and P. Giuliani","Cascades in helical turbulence","4 pages, 4 figures",,,,"chao-dyn nlin.CD",,"  The existence of a second quadratic inviscid invariant, the helicity, in a
turbulent flow leads to coexisting cascades of energy and helicity. An
equivalent of the four-fifth law for the longitudinal third order structure
function, which is derived from energy conservation, is easily derived from
helicity conservation cite{Procaccia,russian}. The ratio of dissipation of
helicity to dissipation of energy is proportional to the wave-number leading to
a different Kolmogorov scale for helicity than for energy. The Kolmogorov scale
for helicity is always larger than the Kolmogorov scale for energy so in the
high Reynolds number limit the flow will always be helicity free in the small
scales, much in the same way as the flow will be isotropic and homogeneous in
the small scales. A consequence is that a pure helicity cascade is not
possible. The idea is illustrated in a shell model of turbulence.
","[{""version"":""v1"",""created"":""Fri, 8 Oct 1999 16:28:25 GMT""}]","2007-05-23"
"chao-dyn/9910014","Francesco Bonechi","F. Bonechi and S. De Bievre","Exponential mixing and log h time scales in quantized hyperbolic maps on
  the torus",,,"10.1007/s002200050831",,"chao-dyn math-ph math.MP nlin.CD",,"  We study the behaviour, in the simultaneous limits \hbar going to 0, t going
to \infty, of the Husimi and Wigner distributions of initial coherent states
and position eigenstates, evolved under the quantized hyperbolic toral
automorphisms and the quantized baker map. We show how the exponential mixing
of the underlying dynamics manifests itself in those quantities on time scales
logarithmic in \hbar. The phase space distributions of the coherent states,
evolved under either of those dynamics, are shown to equidistribute on the
torus in the limit \hbar going to 0, for times t between |\log\hbar|/(2\gamma)
and |\log|\hbar|/\gamma, where \gamma is the Lyapounov exponent of the
classical system. For times shorter than |\log\hbar|/(2\gamma), they remain
concentrated on the classical trajectory of the center of the coherent state.
The behaviour of the phase space distributions of evolved position eigenstates,
on the other hand, is not the same for the quantized automorphisms as for the
baker map. In the first case, they equidistribute provided t goes to \infty as
\hbar goes to 0, and as long as t is shorter than |\log\hbar|/\gamma. In the
second case, they remain localized on the evolved initial position at all such
times.
","[{""version"":""v1"",""created"":""Fri, 8 Oct 1999 17:00:50 GMT""}]","2009-10-31"
"cond-mat/9910129","George Stan","George Stan, Jacob M. Hartman, Vincent H. Crespi, Silvina M. Gatica,
  Milton W. Cole","Helium mixtures in nanotube bundles","3 pages, no figures, submitted to Phys. Rev. Lett",,"10.1103/PhysRevB.61.7288",,"cond-mat.stat-mech",,"  An analogue to Raoult's law is determined for the case of a 3He-4He mixture
adsorbed in the interstitial channels of a bundle of carbon nanotubes. Unlike
the case of He mixtures in other environments, the ratio of the partial
pressures of the coexisting vapor is found to be a simple function of the ratio
of concentrations within the nanotube bundle.
","[{""version"":""v1"",""created"":""Fri, 8 Oct 1999 19:54:22 GMT""}]","2009-10-31"
"cond-mat/9910134","Igor I. Smolyaninov","I.I. Smolyaninov, H.Y. Liang, S. Aggarwal, R. Ramesh, C.H. Lee, and
  C.C. Davis","Apertureless Near-Field Second Harmonic Microscopy with Bare Tapered
  Optical Fiber Tips","submitted to Phys.Rev.Letters","Optics Letters, 25, 835-837 (2000)","10.1364/OL.25.000835",,"cond-mat.mtrl-sci",,"  We present a near-field optical technique for second harmonic imaging using
bare tapered optical fiber tip illuminated with femtosecond laser pulses.
Enhancement of electric field at the tip of the fiber results in enhanced
second harmonic generation (SHG) from the sample region near the tip. This SH
emission is collected by the same tapered fiber. Spatial distribution of SHG
from thin ferroelectric Pb(Zr_xTi_1-x)O_3 films and model metal-ferroelectric
devices has been studied. Spatial resolution on the order of 80 nm has been
achieved. This is the first time diffraction limit is surpassed in SH
microscopic measurements. Electric field induced changes in SHG from individual
grains and/or domains of ferroelectric thin films have been observed.
","[{""version"":""v1"",""created"":""Fri, 8 Oct 1999 16:43:02 GMT""},{""version"":""v2"",""created"":""Tue, 12 Oct 1999 14:21:41 GMT""}]","2009-10-31"
"cond-mat/9910135",,"A. J. Bray (Manchester)","Random Walks in Logarithmic and Power-Law Potentials, Nonuniversal
  Persistence, and Vortex Dynamics in the Two-Dimensional XY Model","10 pages, 1 figure","Phys. Rev. E 62, 103 (2000)","10.1103/PhysRevE.62.103",,"cond-mat.stat-mech",,"  The Langevin equation for a particle (`random walker') moving in
d-dimensional space under an attractive central force, and driven by a Gaussian
white noise, is considered for the case of a power-law force, F(r) = -
Ar^{-sigma}. The `persistence probability', P_0(t), that the particle has not
visited the origin up to time t, is calculated. For sigma > 1, the force is
asymptotically irrelevant (with respect to the noise), and the asymptotics of
P_0(t) are those of a free random walker. For sigma < 1, the noise is
(dangerously) irrelevant and the asymptotics of P_0(t) can be extracted from a
weak noise limit within a path-integral formalism. For the case sigma=1,
corresponding to a logarithmic potential, the noise is exactly marginal. In
this case, P_0(t) decays as a power-law, P_0(t) \sim t^{-theta}, with an
exponent theta that depends continuously on the ratio of the strength of the
potential to the strength of the noise. This case, with d=2, is relevant to the
annihilation dynamics of a vortex-antivortex pair in the two-dimensional XY
model. Although the noise is multiplicative in the latter case, the relevant
Langevin equation can be transformed to the standard form discussed in the
first part of the paper. The mean annihilation time for a pair initially
separated by r is given by t(r) \sim r^2 ln(r/a) where a is a microscopic
cut-off (the vortex core size). Implications for the nonequilibrium critical
dynamics of the system are discussed and compared to numerical simulation
results.
","[{""version"":""v1"",""created"":""Fri, 8 Oct 1999 16:03:29 GMT""}]","2009-10-31"
"cond-mat/9910136","Oliver Redner","Oliver Redner and Michael Baake","Invaded cluster algorithm for critical properties of periodic and
  aperiodic planar Ising models","15 pages, 5 figures; v2: Fig. 5b replaced, minor changes","J. Phys. A 33 (2000) 3097-109","10.1088/0305-4470/33/16/304",,"cond-mat.stat-mech",,"  We demonstrate that the invaded cluster algorithm, recently introduced by
Machta et al, is a fast and reliable tool for determining the critical
temperature and the magnetic critical exponent of periodic and aperiodic
ferromagnetic Ising models in two dimensions. The algorithm is shown to
reproduce the known values of the critical temperature on various periodic and
quasiperiodic graphs with an accuracy of more than three significant digits. On
two quasiperiodic graphs which were not investigated in this respect before,
the twelvefold symmetric square-triangle tiling and the tenfold symmetric
T\""ubingen triangle tiling, we determine the critical temperature. Furthermore,
a generalization of the algorithm to non-identical coupling strengths is
presented and applied to a class of Ising models on the Labyrinth tiling. For
generic cases in which the heuristic Harris-Luck criterion predicts deviations
from the Onsager universality class, we find a magnetic critical exponent
different from the Onsager value. But also notable exceptions to the criterion
are found which consist not only of the exactly solvable cases, in agreement
with a recent exact result, but also of the self-dual ones and maybe more.
","[{""version"":""v1"",""created"":""Fri, 8 Oct 1999 16:42:50 GMT""},{""version"":""v2"",""created"":""Thu, 18 May 2000 13:14:56 GMT""}]","2009-10-31"
"cond-mat/9910137","Arkadi Odintsov","Arkadi A. Odintsov","Schottky barriers in carbon nanotube heterojunctions","new version, few small corrections are made 4 pages, 3 figures",,"10.1103/PhysRevLett.85.150",,"cond-mat.mes-hall",,"  We investigate electronic properties of heterojunctions between metallic and
semiconducting single-wall carbon nanotubes. Ineffective screening of the long
range Coulomb interaction in one-dimensional nanotube systems drastically
modifies the charge transfer phenomena compared to conventional semiconductor
heterostructures. The length of depletion region varies over a wide range (from
the nanotube radius to the nanotube length) sensitively depending on the doping
strength. The Schottky barrier gives rise to the asymmetry of the I-V
characteristics of heterojunctions, in agreement with recent experimental
results by Yao {\it et al.} and Fuhrer {\it et al.} Dynamic charge build-up
near the junction results in a step-like growth of the current at reverse bias.
","[{""version"":""v1"",""created"":""Fri, 8 Oct 1999 17:03:09 GMT""},{""version"":""v2"",""created"":""Mon, 11 Oct 1999 17:31:50 GMT""}]","2009-10-31"
"cond-mat/9910138","Hisao Nakanishi","Sonali Mukherjee and Hisao Nakanishi","Scaling for vibrational modes of fractals tethered at the boundaries","7 pages, 11 figures",,,,"cond-mat.stat-mech cond-mat.dis-nn",,"  Using a recently introduced mapping between a scalar elastic network tethered
at its boundaries and a diffusion problem with permanent traps, we study
various vibrational properties of progressively tethered disordered fractals.
Different scaling forms are proposed for different types of boundary tethering
and numerical investigation of the scaling is performed by the approximate
diagonalization of the corresponding large, sparse transition probability
matrices. Rather different localization behaviors are found for the leading
modes depending on the types of tethering.
","[{""version"":""v1"",""created"":""Fri, 8 Oct 1999 19:17:34 GMT""}]","2007-05-23"
