"math/9910051",,"Shigeki Matsutani","Submanifold Differential Operators in $\Cal D$-Module Theory I :
  Schr\""odinger Operators","AMS-Tex Use 24 pages",,,,"math.DG math-ph math.AP math.MP",,"  For this quarter of century, differential operators in a lower dimensional
submanifold embedded or immersed in real $n$-dimensional euclidean space
$\EE^n$ have been studied as quantum mechanical models, which are realized as
restriction of the operators in $\EE^n$ to the submanifold. For this decade,
the Dirac operators in the submanifold have been investigated in such a scheme
, which are identified with operators of the Frenet-Serret relation for a space
curve case and of the generalized Weierstrass relation for a conformal surface
case. These Dirac operators are concerned well in the differential geometry,
since they completely represent the submanifolds. In this and a future series
of articles, we will give mathematical construction of the differential
operators on a submanifold in $\EE^n$ in terms of $\DMod$-module theory and
rewrite recent results of the Dirac operators mathematically. In this article,
we will formulate Schr\""odinger operators in a low-dimensional submanifold in
$\EE^n$.
","[{""version"":""v1"",""created"":""Sat, 9 Oct 1999 04:06:46 GMT""},{""version"":""v2"",""created"":""Wed, 3 Nov 1999 12:58:03 GMT""},{""version"":""v3"",""created"":""Sun, 9 Jan 2000 11:22:29 GMT""}]","2007-05-23"
"math/9910052",,"Shigeki Matsutani","Submanifold Differential Operators in $\Cal D$-Module Theory II:
  Generalized Weierstrass and Frenet-Serret Relations as Dirac Equations","AMS-Tex Use 22 pages",,,,"math.DG math-ph math.AP math.MP",,"  This article is one of a series of papers. For this decade, the Dirac
operator on a submanifold has been studied as a restriction of the Dirac
operator in $n$-dimensional euclidean space $\EE^n$ to a surface or a space
curve as physical models. These Dirac operators are identified with operators
of the Frenet-Serret relation for a space curve case and of the generalized
Weierstrass relation for a conformal surface case and completely represent the
submanifolds. For example, the analytic index of Dirac operator of a space
curve is identified with its writhing number. As another example, the operator
determinants of the Dirac operators are closely related to invariances of the
immersed objects, such as Euler-Bernoulli and Willmore functionals for a space
curve and a conformal surface respectively. In this article, we will give
mathematical construction of the Dirac operator by means of $\Cal D$-module and
reformulate my recent results mathematically.
","[{""version"":""v1"",""created"":""Sat, 9 Oct 1999 05:24:01 GMT""},{""version"":""v2"",""created"":""Wed, 3 Nov 1999 12:58:52 GMT""},{""version"":""v3"",""created"":""Sun, 9 Jan 2000 11:22:50 GMT""}]","2007-05-23"
"math/9910053","H. Esnault","H\'el\`ene Esnault and I-Hsun Tsai","Determinant bundle in a family of curves, after A. Beilinson and V.
  Schechtman","6 pages, Latex 2e",,"10.1007/s002200050816",,"math.AG",,"  In Comm. Math. Physics 118 (1988), 651-701, A. Beilinson and V. Schechtman
define on the total space of a smooth family of curves a so-called trace
complex associated to a vector bundle, the 0-th relative cohomology of which is
the Atiyah algebra of the determinant bundle. Their proof reduces the general
case to the acyclic one. In particular, one needs a comparison of the image of
the trace complex for a bundle, and its twist by an \'etale multisection. We
analyse this and correct a point in the original proof.
","[{""version"":""v1"",""created"":""Sat, 9 Oct 1999 14:57:56 GMT""}]","2009-10-31"
"nucl-ex/9910008","Craig Ogilvie","L.Ahle, et al (E866 and E917 Collaborations)","Excitation Function of K$^+$ and $\pi^+$ Production in Au+Au Reactions
  at 2-10 AGeV","9 pages, 4 figures, submitted to Phys. Lett. B","Phys.Lett.B476:1-8,2000","10.1016/S0370-2693(00)00037-X",,"nucl-ex",,"  Positive pion and kaon production from Au+Au reactions have been measured as
a function of beam energy over the range 2.0-10.7~AGeV. Both the kaon and the
pion production cross-sections at mid-rapidity are observed to increase
steadily with beam kinetic energy. The ratio of K$^+$ to $\pi^+$ mid-rapidity
yields increases from 0.0271$\pm0.0015\pm0.0014$ at 2.0~AGeV to
0.202$\pm0.005\pm0.010$ at 10.7~AGeV and is larger than the K$^+$/$\pi^+$ ratio
from p+p reactions over the same beam energy region. There is no indication of
an onset of any new production mechanism in heavy-ion reactions in this energy
range beyond rescattering of hadrons.
","[{""version"":""v1"",""created"":""Fri, 8 Oct 1999 20:39:08 GMT""}]","2010-01-11"
"nucl-th/9910024","Antonio Miguel Lallena Rojo","J.E. Amaro, F. Arias de Saavedra, A.M. Lallena, G. Co', A. Fabrocini
  and S. Rashad","Electron scattering with a short-range correlation model","9 pages, 8 Postscript figures, RevTex",,,,"nucl-th",,"  The inclusive electromagnetic responses in the quasi-elastic region are
calculated with a model which considers the terms of the cluster expansion
containinga single correlation line. The validity of this model is studied by
comparing, in nuclear matter, its results with those of a complete calculation.
Results in finite nuclei for both one-and two-nucleon emission are presented.
","[{""version"":""v1"",""created"":""Fri, 8 Oct 1999 18:03:04 GMT""}]","2007-05-23"
"nucl-th/9910025","Michael Bender","M. Bender, K. Rutz, P.-G. Reinhard, J. A. Maruhn","Consequences of the center-of-mass correction in nuclear mean-field
  models","12 pages LATeX, needs EPJ style files, 5 eps figures, accepted for
  publication in Eur. Phys. J. A","Eur.Phys.J.A7:467-478,2000","10.1007/s100500050419",,"nucl-th",,"  We study the influence of the scheme for the correction for spurious
center-of-mass motion on the fit of effective interactions for self-consistent
nuclear mean-field calculations. We find that interactions with very simple
center-of-mass correction have significantly larger surface coefficients than
interactions for which the center-of-mass correction was calculated for the
actual many-body state during the fit. The reason for that is that the
effective interaction has to counteract the wrong trends with nucleon number of
all simplified schemes for center-of-mass correction which puts a wrong trend
with mass number into the effective interaction itself. The effect becomes
clearly visible when looking at the deformation energy of largely deformed
systems, e.g. superdeformed states or fission barriers of heavy nuclei.
","[{""version"":""v1"",""created"":""Fri, 8 Oct 1999 21:57:59 GMT""}]","2011-07-19"
"nucl-th/9910026","Michael Bender","K. Rutz, M. Bender, P.-G. Reinhard, J. A. Maruhn","Pairing Gap and Polarisation Effects","5 pages REVTeX, 5 eps figures, accepted for publication in Phys.
  Lett. B","Phys.Lett. B468 (1999) 1-6","10.1016/S0370-2693(99)01190-9",,"nucl-th",,"  The phenomenological adjustment of the nuclear pairing strength is usually
performed with respect to the odd-even staggering of the binding energies. We
find that the results strongly depend on the way in which the ground states of
the odd nuclei are computed. A thorough calculation including all time-even and
time-odd polarisation effects induced by the odd nucleon produces about 30%
reduced odd-even staggering as compared to the standard spherical calculations
in the relativistic mean-field model. The pairing strength must be enhanced by
about 20% to compensate for that effect. The enhanced strength has dramatic
consequences for the predicted deformation properties of the underlying
mean-field models, possibly implying that new adjustments of their parameters
become necessary as well.
","[{""version"":""v1"",""created"":""Fri, 8 Oct 1999 22:15:24 GMT""}]","2015-06-26"
"physics/9910009","Burkhard Militzer","Burkhard Militzer, E. L. Pollock","Variational Density Matrix Method for Warm Condensed Matter and
  Application to Dense Hydrogen","26 pages, 13 figures. submitted to Phys. Rev. E, October 1999",,"10.1103/PhysRevE.61.3470",,"physics.plasm-ph physics.comp-ph",,"  A new variational principle for optimizing thermal density matrices is
introduced. As a first application, the variational many body density matrix is
written as a determinant of one body density matrices, which are approximated
by Gaussians with the mean, width and amplitude as variational parameters. The
method is illustrated for the particle in an external field problem, the
hydrogen molecule and dense hydrogen where the molecular, the dissociated and
the plasma regime are described. Structural and thermodynamic properties
(energy, equation of state and shock Hugoniot) are presented.
","[{""version"":""v1"",""created"":""Fri, 8 Oct 1999 16:53:51 GMT""}]","2009-10-31"
"physics/9910010","Burkhard Militzer","Burkhard Militzer, William Magro, David Ceperley","Characterization of the State of Hydrogen","4 pages, 2 figures, proceedings of 9th International Workshop on the
  Physics of Nonideal Plasmas, Rostock, Germany, September 1999","Contrib. Plasma Phys. 39 (1999) 1-2, 151-154","10.1002/ctpp.2150390137",,"physics.plasm-ph physics.comp-ph",,"  Fermionic path integral Monte Carlo simulations have been applied to study
the equilibrium properties of the hydrogen and deuterium in the density and
temperature range of 1.6 < rs < 14.0 and 5000K < T < 167000K. We use this
technique to determine the phase diagram by identifying the plasma, the
molecular, atomic and metallic regime. We explain how one can identify the
phases in the path integral formalism and discuss the state of hydrogen for 5
points in the temperature-density plane. Further we will provide arguments for
the nature of the transitions between the regimes.
","[{""version"":""v1"",""created"":""Fri, 8 Oct 1999 18:06:25 GMT""}]","2015-06-26"
"physics/9910011","Alan W. P. Poon","A.W.P. Poon, R.J. Komar, C.E. Waltham, M.C. Browne, R.G.H. Robertson,
  N.P. Kherani, H.B. Mak","A Compact 3H(p,gamma)4He 19.8-MeV Gamma-Ray Source for Energy
  Calibration at the Sudbury Neutrino Observatory","33 pages (including 2 table, 12 figures) This is the revised
  manuscript, accepted for publication in NIM A. This revision relfects minor
  editorial changes from the previous version","Nucl.Instrum.Meth.A452:115-129,2000","10.1016/S0168-9002(00)00424-1",,"physics.ins-det",,"  The Sudbury Neutrino Observatory (SNO) is a new 1000-tonne D2O Cerenkov solar
neutrino detector. A high energy gamma-ray source is needed to calibrate SNO
beyond the 8B solar neutrino endpoint of 15 MeV. This paper describes the
design and construction of a source that generates 19.8-MeV gamma rays using
the 3H(p,gamma)4He reaction (``pt''), and demonstrates that the source meets
all the physical, operational and lifetime requirements for calibrating SNO. An
ion source was built into this unit to generate and to accelerate protons up to
30 keV, and a high purity scandium tritide target with a scandium-tritium
atomic ratio of 1:2.0+/-0.2 was included. This pt source is the first
self-contained, compact, and portable high energy gamma-ray source (E>10 MeV).
","[{""version"":""v1"",""created"":""Fri, 8 Oct 1999 20:40:56 GMT""},{""version"":""v2"",""created"":""Tue, 29 Feb 2000 22:09:05 GMT""}]","2008-11-26"
"quant-ph/9910040","Alberto C. de la Torre","A. C. de la Torre, A. Daleo, I. Garcia-Mata","The Photon-Box Bohr-Einstein Debate Demithologized","10 pages, revtex, no figures","Eur. J. Phys. 21, 253-260, 2000.",,,"quant-ph",,"  The legendary discussion between Einstein and Bohr concerning the photon box
experiment is critically analyzed. It is shown that Einstein's argument is
flawed and Bohr's reply is wrong.
","[{""version"":""v1"",""created"":""Fri, 8 Oct 1999 22:44:53 GMT""}]","2007-05-23"
"quant-ph/9910041","Susana F. Huelga","J. M. G. Sancho (1) and S. F. Huelga (1,2) ((1) Departamento de
  Fisica. Universidad de Oviedo. Spain. (2) Optics Section. The Blackett
  Laboratory. Imperial College. London, UK)","Measuring the entanglement of bipartite pure states","1 figure",,"10.1103/PhysRevA.61.042303",,"quant-ph",,"  The problem of the experimental determination of the amount of entanglement
of a bipartite pure state is addressed. We show that measuring a single
observable does not suffice to determine the entanglement of a given unknown
pure state of two particles. Possible minimal local measuring strategies are
discussed and a comparison is made on the basis of their best achievable
precision.
","[{""version"":""v1"",""created"":""Sat, 9 Oct 1999 10:46:24 GMT""}]","2009-10-31"
"quant-ph/9910042","Bassano Vacchini","L. Lanz, O. Melsheimer and B. Vacchini","Description of isolated macroscopic systems inside quantum mechanics","13 pages, latex, romp31 style, no figures, to appear in the
  Proceedings of the XXXI Symposium on Mathematical Physics (Torun, Poland), to
  be published in Rep. Math. Phys","Rep. Math. Phys. 46 (2000) 191-202","10.1016/S0034-4877(01)80023-9",,"quant-ph",,"  For an isolated macrosystem classical state parameters $\zeta(t)$ are
introduced inside a quantum mechanical treatment. By a suitable mathematical
representation of the actual preparation procedure in the time interval
$[T,t_0]$ a statistical operator is constructed as a solution of the Liouville
von Neumann equation, exhibiting at time $t$ the state parameters $\zeta(t')$,
$t_0\leq t' \leq t$, and {\it preparation parameters} related to times $T \leq
t'\leq t_0$. Relation with Zubarev's non-equilibrium statistical operator is
discussed. A mechanism for memory loss is investigated and time evolution by a
semigroup is obtained for a restricted set of relevant observables, slowly
varying on a suitable time scale.
","[{""version"":""v1"",""created"":""Sat, 9 Oct 1999 13:57:06 GMT""}]","2009-10-31"
"quant-ph/9910043","Jian-Wei Pan","Dik Bouwmeester, Jian-Wei Pan, Harald Weinfurter, and Anton Zeilinger","High-Fidelity Teleportation of Independent Qubits","13 pages, Latex, 5 figures(eps), to appear in Journal of Modern
  Optics",,"10.1080/09500340008244042",,"quant-ph",,"  Quantum teleportation is one of the essential primitives of quantum
communication. We suggest that any quantum teleportation scheme can be
characterized by its efficiency, i.e. how often it succeeds to teleport, its
fidelity, i.e. how well the input state is reproduced at the output, and by its
insensitivity to cross talk, i.e. how well it rejects an input state that is
not intended to teleport. We discuss these criteria for the two teleportation
experiments of independent qubits which have been performed thus far. In the
first experiment (Nature {\bf 390},575 (1997)) where the qubit states were
various different polarization states of photons, the fidelity of teleportation
was as high as 0.80 $\pm$ 0.05 thus clearly surpassing the limit of 2/3 which
can, in principle, be obtained by a direct measurement on the qubit and
classical communication. This high fidelity is confirmed in our second
experiment (Phys. Rev. Lett. {\bf 80}, 3891 (1998)), demonstrating entanglement
swapping, that is, realizing the teleportation of a qubit which itself is still
entangled to another one. This experiment is the only one up to date that
demonstrates the teleportation of a genuine unknown quantum state.
","[{""version"":""v1"",""created"":""Sat, 9 Oct 1999 14:08:52 GMT""}]","2015-06-26"
