"astro-ph/9910364","Jongsoo Kim","Jongsoo Kim (1), Jose Franco (2), S. S. Hong (3), Alfredo Santillan
  (2,4), Marco A. Martos(2) ((1)Korea Astronomy Observatory, (2)Instituto de
  Astronomia, UNAM, (3)Seoul National University, Korea, (4)Computo
  Aplicado-DGSCA, UNAM)","The Parker Instability in a Thick Galactic Gaseous Disk: I. Linear
  Stability Analysis and Nonlinear Final Equilibria","Accepted for publication in ApJ, 18 text pages with 8 figures",,"10.1086/308502",,"astro-ph",,"  A linear stability analysis of a multi-component and magnetized Galactic disk
model is presented. The disk model uses the observed stratifications for the
gas density and gravitational acceleration at the solar neighborhood and, in
this sense, it can be called a realistic model. The distribution of the total
gas pressure is defined by these observed stratifications, and the gaseous disk
is assumed isothermal. The initial magnetic field is taken parallel to the
disk, with a midplane value of 5 $\mu$G, and its stratification along the
z-axis is derived from the condition of magnetohydrostatic equilibrium in an
isothermal atmosphere. The resulting isothermal sound speed is $\sim 8.4$ km
s$^{-1}$, similar to the velocity dispersion of the main gas components within
1.5 kpc from midplane. The thermal-to-magnetic pressure ratio decreases with
$[z]$ and the warm model is Parker unstable. The dispersion relations show that
the fastest growing mode has a wavelength of about 3 kpc, for both symmetric
and antisymmetric perturbations, and the corresponding growth time scales are
of about $3\times 10^7$ years. The structure of the final equilibrium stage is
also derived, and we find that the midplane antisymmetric (MA) mode gathers
more gas in the magnetic valleys. The resulting MA gas condensations have
larger densities, and the column density enhancement is a factor of about 3
larger than the value of the initial stage. The unstable wavelengths and growth
times for the multi-component disk model are substantially larger than those of
a thin disk model, and some of the implications of these results are discussed.
","[{""version"":""v1"",""created"":""Wed, 20 Oct 1999 12:24:34 GMT""}]","2009-10-31"
"astro-ph/9910365","Tagger","Michel Tagger","Accretion-Ejection Instability and a ""Magnetic Flood"" scenario for GRS
  1915+105","Proceedingd of the 5th Compton Symposium, Portsmouth, Sept. 1999",,"10.1063/1.1303188",,"astro-ph",,"  We present an instability, occurring in the inner region of magnetized
accretion disks, which seems to be a good candidate to explain the
low-frequency QPO observed in many X-ray binaries. We then briefly show how, in
the remarkable case of the microquasar GRS 1915+105, identifying this QPO with
our instability leads to a scenario for the $\sim$ 30 mn cycles of this source.
In this scenario the cycles are controlled by the build-up of magnetic flux in
the disk.
","[{""version"":""v1"",""created"":""Wed, 20 Oct 1999 13:22:33 GMT""}]","2009-10-31"
"astro-ph/9910366","Ludovic van Waerbeke","L. Van Waerbeke (CITA), F. Bernardeau (SphT, Saclay), K. Benabed,
  (SphT, Saclay)","Lensing effect on the relative orientation between the Cosmic Microwave
  Background ellipticities and the distant galaxies","7 pages, 3 figures; uses emulateapj.sty; submitted to ApJ","Astrophysical Journal 540, 14-19 (2000)","10.1086/309301","Saclay SPhT T99/120","astro-ph",,"  The low redshift structures of the Universe act as lenses in a similar way on
the Cosmic Microwave Background light and on the distant galaxies (say at
redshift about unity). As a consequence, the CMB temperature distortions are
expected to be statistically correlated with the galaxy shear, exhibiting a
non-uniform distribution of the relative angle between the CMB and the galactic
ellipticities. Investigating this effect we find that its amplitude is as high
as a 10% excess of alignement between CMB and the galactic ellipticities
relative to the uniform distribution. The relatively high signal-to-noise ratio
we found should makes possible a detection with the planned CMB data sets,
provided that a galaxy survey follow up can be done on a sufficiently large
area. It would provide a complementary bias-independent constraint on the
cosmological parameters.
","[{""version"":""v1"",""created"":""Wed, 20 Oct 1999 13:29:46 GMT""}]","2009-10-31"
"astro-ph/9910368","Ciska Kemper","R.J. Sylvester (1), F. Kemper (2), M.J. Barlow (1), T. de Jong (2,3),
  L.B.F.M. Waters (2,4), A.G.G.M. Tielens (5,6), A. Omont (7) ((1) University
  College London, (2) University of Amsterdam, (3) SRON Utrecht, (4) KU Leuven,
  (5) Kapteijn Institute, Groningen, (6) SRON Groningen, (7) IAP, Paris)","2.4 - 197 micron spectroscopy of OH/IR stars: The IR characteristics of
  circumstellar dust in O-rich environments","7 figures, 15 pages. Accepted by A&A. A version with high resolution
  figures can be obtained from ftp://ceres.astro.uva.nl in directory /pub/ciska
  and is named H1687.ps",,,,"astro-ph",,"  Infrared spectra of a number of evolved O-rich stars have been obtained with
the Short- and Long- Wavelength spectrometers on board the Infrared Space
Observatory. The very broad wavelength coverage (2.4-197 micron) obtained by
combining observations made with the two spectrometers includes practically all
of the flux emitted by the sources, and allows us to determine the emission and
absorption features of the dense circumstellar dust shells. Agreement between
the fluxes obtained by the two instruments is generally very good; the largest
discrepancies are probably due to source variability. Our sample of oxygen-rich
AGB stars exhibits a wealth of spectral features due to crystalline silicates
and crystalline water ice in emission and absorption. In this study a
qualitative overview of all features due to crystalline silicates and water ice
in these high mass loss rate objects is presented. It seems that there is a
certain onset value for the mass loss rate above which these features appear in
the spectrum. Moreover, crystalline silicate emission features have been
detected for the first time at wavelengths where the amorphous silicates are
still in absorption, implying different spatial distributions for the two
materials. A spherically symmetric and an axi-symmetric geometry are proposed.
","[{""version"":""v1"",""created"":""Wed, 20 Oct 1999 15:34:12 GMT""}]","2007-05-23"
"chao-dyn/9910027","Piotr Garbaczewski","Piotr Garbaczewski","Stochastic modelling of nonlinear dynamical systems","in D. S. Broomhead, E. A. Luchinskaya, P. V. E. McClintock and T.
  Mullin, ed., ""Stochaos: Stochastic and Chaotic Dynamics in the Lakes"",
  American Institute of Physics, Woodbury, Ny, in press",,"10.1063/1.1302402",,"chao-dyn cond-mat nlin.CD quant-ph",,"  We develop a general theory dealing with stochastic models for dynamical
systems that are governed by various nonlinear, ordinary or partial
differential, equations. In particular, we address the problem how flows in the
random medium (related to driving velocity fields which are generically bound
to obey suitable local conservation laws) can be reconciled with the notion of
dispersion due to a Markovian diffusion process.
","[{""version"":""v1"",""created"":""Wed, 20 Oct 1999 10:13:45 GMT""}]","2009-10-31"
"chao-dyn/9910028","Piotr Garbaczewski","Piotr Garbaczewski and Robert Olkiewicz","Ornstein-Uhlenbeck-Cauchy Process","Latex file","J. Math. Phys. 41 (2000), 6843-6860","10.1063/1.1290054",,"chao-dyn cond-mat math-ph math.MP math.PR nlin.CD",,"  We combine earlier investigations of linear systems with L\'{e}vy
fluctuations [Physica {\bf 113A}, 203, (1982)] with recent discussions of
L\'{e}vy flights in external force fields [Phys.Rev. {\bf E 59},2736, (1999)].
We give a complete construction of the Ornstein-Uhlenbeck-Cauchy process as a
fully computable model of an anomalous transport and a paradigm example of
Doob's stable noise-supported Ornstein-Uhlenbeck process. Despite the
nonexistence of all moments, we determine local characteristics (forward drift)
of the process, generators of forward and backward dynamics, relevant
(pseudodifferential) evolution equations. Finally we prove that this random
dynamics is not only mixing (hence ergodic) but also exact. The induced
nonstationary spatial process is proved to be Markovian and quite apart from
its inherent discontinuity defines an associated velocity process in a
probabilistic sense.
","[{""version"":""v1"",""created"":""Wed, 20 Oct 1999 10:40:02 GMT""}]","2015-06-24"
"chao-dyn/9910029","Andrea Mazzino","P. Castiglione, R. Festa and A. Mazzino","Different transport regimes in a spatially-extended recirculating
  background","9 pages Latex; 5 figures",,"10.1016/S0375-9601(00)00209-7",,"chao-dyn nlin.CD",,"  Passive scalar transport in a spatially-extended background of roll
convection is considered in the time-periodic regime. The latter arises due to
the even oscillatory instability of the cell lateral boundary, here accounted
for by sinusoidal oscillations of frequency $\omega$. By varying the latter
parameter, the strength of anticorrelated regions of the velocity field can be
controled and the conditions under which either an enhancement or a reduction
of transport takes place can be created. Such two ubiquitous regimes are
triggered by a small-scale(random) velocity field superimposed to the
recirculating background. The crucial point is played by the dependence of
Lagrangian trajectories on the statistical properties of the small-scale
velocity field, e.g. its correlation time or its energy.
","[{""version"":""v1"",""created"":""Wed, 20 Oct 1999 10:43:32 GMT""}]","2009-10-31"
"cond-mat/9910286","Konstantin Kladko","Konstantin Kladko (Stanford)","On some upper bounds for spin velocity and instability of gapless state
  of 1-d Heisenberg chains","3 pages, RevTeX",,,,"cond-mat.str-el cond-mat.stat-mech",,"  We derive upper bounds for spin velocity in half-integer-spin Heisenberg
antiferromagnetic chains. We relate these upper bounds to the instability of
the gapless state, which is observed in frustrated systems.
","[{""version"":""v1"",""created"":""Tue, 19 Oct 1999 17:56:34 GMT""}]","2007-05-23"
"cond-mat/9910287","Viv Kendon","V M Kendon","A scaling theory of 3D spinodal turbulence","5 pages, no figures, revised version submitted to Phys Rev E Rapp
  Comm. Minor changes and clarifications","Phys Rev E 61(6) R6071 (2000)","10.1103/PhysRevE.61.R6071",,"cond-mat",,"  A new scaling theory for spinodal decomposition in the inertial hydrodynamic
regime is presented. The scaling involves three relevant length scales, the
domain size, the Taylor microscale and the Kolmogorov dissipation scale. This
allows for the presence of an inertial ""energy cascade"", familiar from theories
of turbulence, and improves on earlier scaling treatments based on a single
length: these, it is shown, cannot be reconciled with energy conservation. The
new theory reconciles the t^{2/3} scaling of the domain size, predicted by
simple scaling, with the physical expectation of a saturating Reynolds number
at late times.
","[{""version"":""v1"",""created"":""Tue, 19 Oct 1999 18:28:49 GMT""},{""version"":""v2"",""created"":""Fri, 18 Feb 2000 18:46:13 GMT""}]","2009-10-31"
"cond-mat/9910288","David Feder","David L. Feder, Charles W. Clark, and Barry I. Schneider","Nucleation of vortex arrays in rotating anisotropic Bose-Einstein
  condensates","5 pages, two embedded figures. To appear in Phys. Rev. A (RC)","Phys. Rev. A 61, 011601 (2000)","10.1103/PhysRevA.61.011601",,"cond-mat.stat-mech",,"  The nucleation of vortices and the resulting structures of vortex arrays in
dilute, trapped, zero-temperature Bose-Einstein condensates are investigated
numerically. Vortices are generated by rotating a three-dimensional,
anisotropic harmonic atom trap. The condensate ground state is obtained by
propagating the Gross-Pitaevskii equation in imaginary time. Vortices first
appear at a rotation frequency significantly larger than the critical frequency
for vortex stabilization. This is consistent with a critical velocity mechanism
for vortex nucleation. At higher frequencies, the structures of the vortex
arrays are strongly influenced by trap geometry.
","[{""version"":""v1"",""created"":""Tue, 19 Oct 1999 18:32:18 GMT""}]","2009-10-31"
"cond-mat/9910289","Irene Giardina","Andrea Cavagna, Irene Giardina and Giorgio Parisi","A new approach for the analytic computation of the Instantaneous Normal
  Modes spectrum","12 pages, 4 eps figures. Invited talk at the Conference: ""Unifying
  Concepts in Glass Physics"", ICTP Trieste, 15-18 September 1999",,"10.1088/0953-8984/12/29/301",,"cond-mat.stat-mech cond-mat.dis-nn",,"  In the context of the Instantaneous Normal Mode approach, the spectrum of the
Hessian of Hamiltonian is a key quantity to describe liquids behaviour. The
determination of the spectrum represents a major task for theoretical studies,
and has been addressed recently in various works. In this paper a new approach
for the analytic computation of the Hessian spectrum is presented. The one
dimensional case for a system of particles interacting via a purely repulsive
potential at low density is analyzed in details and the spectrum is computed
exactly also in the localized sector. Finally, the possible extensions of the
method are discussed, together with a comparison with different approaches to
the problem.
","[{""version"":""v1"",""created"":""Tue, 19 Oct 1999 19:32:42 GMT""}]","2009-10-31"
"cond-mat/9910290","Daniel Hone","Xian-Geng Zhao (CCAST) and Daniel W. Hone (Institute for Theoretical
  Physics, UCSB)","Zener transitions between dissipative Bloch bands. II: Current Response
  at Finite Temperature","5 pages, LateX, plus 5 postscript figures",,"10.1103/PhysRevB.62.5010","NSF-ITP-99-119","cond-mat",,"  We extend, to include the effects of finite temperature, our earlier study of
the interband dynamics of electrons with Markoffian dephasing under the
influence of uniform static electric fields. We use a simple two-band
tight-binding model and study the electric current response as a function of
field strength and the model parameters. In addition to the Esaki-Tsu peak,
near where the Bloch frequency equals the damping rate, we find current peaks
near the Zener resonances, at equally spaced values of the inverse electric
field. These become more prominenent and numerous with increasing bandwidth (in
units of the temperature, with other parameters fixed). As expected, they
broaden with increasing damping (dephasing).
","[{""version"":""v1"",""created"":""Tue, 19 Oct 1999 20:24:56 GMT""}]","2009-10-31"
"cond-mat/9910291","B. B. Beard","B.B. Beard (CBU), V. Chudnovsky (MIT), and P. Keller-Marxer (U. Bern)","Reconciling the correlation length for high-spin Heisenberg
  antiferromagnets","4 pages plus 3 EPS figures, submitted to PRL","Nucl.Phys.Proc.Suppl. 83 (2000) 682-684","10.1016/S0920-5632(00)91774-2",,"cond-mat.str-el hep-lat",,"  We present numerical results for the antiferromagnetic Heisenberg model
(AFHM) that definitively confirm that chiral perturbation theory, corrected for
cutoff effects in the AFHM, leads to a correct field-theoretical description of
the low-temperature behavior of the spin correlation length for spins $S \geq
1/2$. With two independent quantum Monte Carlo algorithms and a
finite-size-scaling technique, we explore correlation lengths up to $\xi
\approx 10^5$ lattice spacings a for spins S=1 and 5/2. We show how the recent
prediction of cutoff effects by P. Hasenfratz is approached for moderate
$\xi/a={\cal O}(100)$, and smoothly connects with other approaches to modeling
the AFHM at smaller correlation lengths.
","[{""version"":""v1"",""created"":""Tue, 19 Oct 1999 20:31:43 GMT""}]","2015-06-25"
"cond-mat/9910292","Kirill Shtengel","L. Chayes, Leonid P. Pryadko, Kirill Shtengel","Intersecting Loop Models on Z^D: Rigorous Results","LaTeX+elsart.cls; 30 p., 6 figs; submitted to Nucl. Phys. B; a few
  minor typos corrected","Nucl. Phys. B, 570, 590-614, (2000)","10.1016/S0550-3213(99)00780-4","IASSNS-HEP 99/47","cond-mat.stat-mech math-ph math.MP",,"  We consider a general class of (intersecting) loop models in D dimensions,
including those related to high-temperature expansions of well-known spin
models. We find that the loop models exhibit some interesting features - often
in the ``unphysical'' region of parameter space where all connection with the
original spin Hamiltonian is apparently lost. For a particular n=2, D=2 model,
we establish the existence of a phase transition, possibly associated with
divergent loops. However, for n >> 1 and arbitrary D there is no phase
transition marked by the appearance of large loops. Furthermore, at least for
D=2 (and n large) we find a phase transition characterised by broken
translational symmetry.
","[{""version"":""v1"",""created"":""Wed, 20 Oct 1999 07:43:03 GMT""},{""version"":""v2"",""created"":""Tue, 30 Nov 1999 07:08:22 GMT""}]","2007-05-23"
"cond-mat/9910293","Dantao Peng","Buoyu Hou, Dantao Peng and Ruihong Yue","The Exact Solution of the SU(3) Hubbard Model","19 pages, latex, no figures",,"10.1016/S0550-3213(00)00094-8","IMP-99-10-18","cond-mat",,"  The Bethe ansatz equations of the 1-D SU(3) Hubbard model are systematically
derived by diagonalizing the inhomogeneous transfer matrix of the XXX model. We
first derive the scattering matrix of the SU(3) Hubbard model through the
coordinate Bethe ansatz method. Then, with the help quantum inverse scattering
method we solve the nested transfer matrix and give the eigenvalues, the
eigenvectors and the Bethe ansatz equations. Finally, we obtain the exactly
analytic solution for the ground state.
","[{""version"":""v1"",""created"":""Wed, 20 Oct 1999 07:33:43 GMT""},{""version"":""v2"",""created"":""Mon, 25 Oct 1999 07:02:27 GMT""}]","2009-10-31"
"cond-mat/9910294","Alessandro Pelizzola","Alessandro Pelizzola","Cluster variation - Pade` approximants method for the simple cubic Ising
  model","8 RevTeX pages, 3 PostScript figures","Phys. Rev. E 61, 4915 (2000)","10.1103/PhysRevE.61.4915",,"cond-mat.stat-mech",,"  The cluster variation - Pade` approximant method is a recently proposed tool,
based on the extrapolation of low/high temperature results obtained with the
cluster variation method, for the determination of critical parameters in
Ising-like models. Here the method is applied to the three-dimensional simple
cubic Ising model, and new results, obtained with an 18-site basic cluster, are
reported. Other techniques for extracting non-classical critical exponents are
also applied and their results compared with those by the cluster variation -
Pade` approximant method.
","[{""version"":""v1"",""created"":""Wed, 20 Oct 1999 07:59:50 GMT""},{""version"":""v2"",""created"":""Tue, 6 Jun 2000 14:46:29 GMT""}]","2009-10-31"
"cond-mat/9910295","Miguel A. Munoz","F. de los Santos, and Miguel A. Mu\~noz","Renormalized Theory of Infinitely Driven Lattice Gases","To appear in Phys. Rev. E. 3 figures",,,,"cond-mat",,"  We use field theoretic renormalization group methods to study the critical
behavior of a recently proposed Langevin equation for driven lattice gases
under infinitely fast drive.
  We perform an expansion around the upper critical dimension, $d_c=4$, and
obtain the critical exponents to one loop order. The main features of the two
loop calculation are also outlined. The renormalized theory is shown to exhibit
a behavior different from the standard field theory for the DLG with finite
driving,
  {\em i.e.} it is not mean field like.
","[{""version"":""v1"",""created"":""Wed, 20 Oct 1999 07:53:15 GMT""}]","2007-05-23"
"cond-mat/9910296","Daniel Kandel","Helen R. Eisenberg and Daniel kandel","Wetting layer thickness and early evolution of epitaxially strained thin
  films","4 pages, 3 eps figures",,"10.1103/PhysRevLett.85.1286",,"cond-mat.mtrl-sci cond-mat.stat-mech",,"  We propose a physical model which explains the existence of finite thickness
wetting layers in epitaxially strained films. The finite wetting layer is shown
to be stable due to the variation of the non-linear elastic free energy with
film thickness. We show that anisotropic surface tension gives rise to a
metastable enlarged wetting layer. The perturbation amplitude needed to
destabilize this wetting layer decreases with increasing lattice mismatch. We
observe the development of faceted islands in unstable films.
","[{""version"":""v1"",""created"":""Wed, 20 Oct 1999 08:28:20 GMT""},{""version"":""v2"",""created"":""Tue, 14 Dec 1999 12:58:20 GMT""},{""version"":""v3"",""created"":""Thu, 16 Mar 2000 11:08:48 GMT""},{""version"":""v4"",""created"":""Thu, 13 Jul 2000 12:16:16 GMT""}]","2009-10-31"
"cond-mat/9910297","Mikko Karttunen","Mikko Karttunen, Mikko Haataja, K. R. Elder, and Martin Grant","Defects, order, and hysteresis in driven charge-density waves","Accepted to Phys. Rev. Lett. Click here for
  ""http://www-theory.mpip-mainz.mpg.de/~karttune/CDW/"", movies of driven CDWs","Phys. Rev. Lett. vol. 83, 3518-3521 (1999)","10.1103/PhysRevLett.83.3518",,"cond-mat.dis-nn",,"  We model driven two-dimensional charge-density waves in random media via a
modified Swift-Hohenberg equation, which includes both amplitude and phase
fluctuations of the condensate. As the driving force is increased, we find that
the defect density first increases and then decreases. Furthermore, we find
switching phenomena, due to the formation of channels of dislocations. These
results are in qualitative accord with recent dynamical x-ray scattering
experiments by Ringlandet al. and transport experiments by Lemay et al.
","[{""version"":""v1"",""created"":""Wed, 20 Oct 1999 08:57:17 GMT""}]","2009-10-31"
"cond-mat/9910298","Jari Penttila","J. S. Penttila, U. Parts, P. J. Hakonen, M. A. Paalanen and E. B.
  Sonin","Effect of quantum noise on Coulomb blockade in normal tunnel junctions
  at high voltages","9 pages, 4 figures, submitted to Phys. Rev. B","Phys. Rev. B 61, 10890 (2000)","10.1103/PhysRevB.61.10890",,"cond-mat.mes-hall",,"  We have investigated asymptotic behavior of normal tunnel junctions at
voltages where even the best ohmic environments start to look like RC
transmission lines. In the experiments, this is manifested by an exceedingly
slow approach to the linear behavior above the Coulomb gap. As expected on the
basis of the quantum theory taking into account interaction with the
environmental modes, better fits are obtained using 1/sqrt{V}- than 1/V-
dependence for the asymptote. These results agree with the horizon picture if
the frequency-dependent phase velocity is employed instead of the speed of
light in order to determine the extent of the surroundings seen by the
junction.
","[{""version"":""v1"",""created"":""Wed, 20 Oct 1999 11:04:21 GMT""}]","2019-10-01"
"cond-mat/9910299","Olle Gunnarsson","J.E. Han and O. Gunnarsson (Max-Planck-Institut fur
  Festkorperforschung, Stuttgart, Germany)","Phonon spectral function for an interacting electron-phonon system","4 pages, RevTeX, 2 eps figure","Phys. Rev. B 61, 8628 (2000)","10.1103/PhysRevB.61.8628",,"cond-mat.str-el",,"  Using exact diagonalzation techniques, we study a model of interacting
electrons and phonons. The spectral width of the phonons is found to be reduced
as the Coulomb interaction U is increased. For a system with two modes per
site, we find a transfer of coupling strength from the upper to the lower mode.
This transfer is reduced as U is increased. These results give a qualitative
explanation of differences between Raman and photoemission estimates of the
electron-phonon coupling constants for A3C60 (A= K, Rb).
","[{""version"":""v1"",""created"":""Wed, 20 Oct 1999 13:28:30 GMT""}]","2009-10-31"
"cond-mat/9910300","Beom Jun Kim","Beom Jun Kim and Petter Minnhagen","Magnetic-field dependence of dynamical vortex response in
  two-dimensional Josephson junction arrays and superconducting films","4 pages including 5 figures in two columns, final version","Phys. Rev. B 60, R15043 (1999)","10.1103/PhysRevB.60.R15043",,"cond-mat.supr-con",,"  The dynamical vortex response of a two-dimensional array of the resistively
shunted Josephson junctions in a perpendicular magnetic field is inferred from
simulations. It is found that, as the magnetic field is increased at a fixed
temperature, the response crosses over from normal to anomalous, and that this
crossover can be characterized by a single dimensionless parameter. It is
described how this crossover should be reflected in measurements of the complex
impedance for Josephson junction arrays and superconducting films.
","[{""version"":""v1"",""created"":""Wed, 20 Oct 1999 14:00:12 GMT""},{""version"":""v2"",""created"":""Thu, 2 Dec 1999 08:23:07 GMT""}]","2007-05-23"
"cond-mat/9910301","Pavel Exner","Pavel Exner and Hynek Kovarik","Magnetic strip waveguides","22 pages, a LaTeX source file with three eps figures","J. Phys. A33 (2000), 3297-3311","10.1088/0305-4470/33/16/317",,"cond-mat math-ph math.MP quant-ph",,"  We analyze the spectrum of the ""local"" Iwatsuka model, i.e. a two-dimensional
charged particle interacting with a magnetic field which is homogeneous outside
a finite strip and translationally invariant along it. We derive two new
sufficient conditions for absolute continuity of the spectrum. We also show
that in most cases the number of open spectral gaps of the model is finite. To
illustrate these results we investigate numerically the situation when the
field is zero in the strip being screened, e.g. by a superconducting mask.
","[{""version"":""v1"",""created"":""Wed, 20 Oct 1999 14:22:30 GMT""}]","2007-05-23"
