"cond-mat/9910302","Eduardo Mucciolo","M. A. M. de Aguiar, H. S. Brandi, Belita Koiller, Eduardo R. Mucciolo","Chaos in one-dimensional lattices under intense laser fields","9 pages, RevTex 3.0, EPSF (6 figures), to appear in Europhys. J. B",,"10.1007/s100510050137",,"cond-mat.mes-hall cond-mat.dis-nn",,"  A model is investigated where a monochromatic, spatially homogeneous laser
field interacts with an electron in a one-dimensional periodic lattice. The
classical Hamiltonian is presented and the technique of stroboscopic maps is
used to study the dynamical behavior of the model. The electron motion is found
to be completely regular only for small field amplitudes, developing a larger
chaotic region as the amplitude increases. The quantum counterpart of the
classical Hamiltonian is derived. Exact numerical diagonalizations show the
existence of universal, random-matrix fluctuations in the electronic energy
bands dressed by the laser field. A detailed analysis of the classical phase
space is compatible with the statistical spectral analysis of the quantum
model. The application of this model to describe transport and optical
absorption in semiconductor superlattices submitted to intense infrared laser
radiation is proposed.
","[{""version"":""v1"",""created"":""Wed, 20 Oct 1999 15:28:35 GMT""}]","2009-10-31"
"cond-mat/9910303","Mr. Ferenc Simon","Ferenc Simon, Andras Janossy, Ferenc Muranyi, Titusz Feher, Hideo
  Shimoda, Yoshihiro Iwasa, and Laszlo Forro","Magnetic resonance in the antiferromagnetic and normal state of
  NH_3K_3C_60","4 pages, 5 figures. Submitted to Phys. Rev. B",,"10.1103/PhysRevB.61.R3826",,"cond-mat.str-el cond-mat.mtrl-sci",,"  We report on the magnetic resonance of NH_3K_3C_60 powders in the frequency
range of 9 to 225 GHz. The observation of an antiferromagnetic resonance below
the phase transition at 40 K is evidence for an antiferromagnetically ordered
ground state. In the normal state, above 40 K, the temperature dependence of
the spin-susceptibilty measured by ESR agrees with previous static measurements
and is too weak to be explained by interacting localized spins in an insulator.
The magnetic resonance line width has an unusual magnetic-field dependence
which is large and temperature independent in the magnetically ordered state
and decreases rapidly above the transition. These observations agree with the
suggestion that NH_3K_3C_60 is a metal in the normal state and undergoes a
Mott-Hubbard metal to insulator transition at 40 K.
","[{""version"":""v1"",""created"":""Wed, 20 Oct 1999 15:44:38 GMT""}]","2009-10-31"
"gr-qc/9910064","Shingo Suzuki","Shingo Suzuki and Kei-ichi Maeda","Signature of chaos in gravitational waves from a spinning particle","14 pages, LaTeX, to appear in Phys. Rev. D","Phys.Rev. D61 (2000) 024005","10.1103/PhysRevD.61.024005","WU-AP/83/99","gr-qc",,"  A spinning test particle around a Schwarzschild black hole shows a chaotic
behavior, if its spin is larger than a critical value. We discuss whether or
not some peculiar signature of chaos appears in the gravitational waves emitted
from such a system. Calculating the emitted gravitational waves by use of the
quadrupole formula, we find that the energy emission rate of gravitational
waves for a chaotic orbit is about 10 times larger than that for a circular
orbit, but the same enhancement is also obtained by a regular ""elliptic"" orbit.
A chaotic motion is not always enhance the energy emission rate maximally. As
for the energy spectra of the gravitational waves, we find some characteristic
feature for a chaotic orbit. It may tell us how to find out a chaotic behavior
of the system. Such a peculiar behavior, if it will be found, may also provide
us some additional informations to determine parameters of a system such as a
spin.
","[{""version"":""v1"",""created"":""Wed, 20 Oct 1999 06:07:34 GMT""}]","2009-10-31"
"gr-qc/9910065","Claus Kiefer","C. Kiefer, D. Polarski, A.A. Starobinsky","Entropy of gravitons produced in the early Universe","8 pages, REVTEX, final version to match the version to be published
  in Phys. Rev. D; minor additions in the Introduction, results unchanged","Phys.Rev. D62 (2000) 043518","10.1103/PhysRevD.62.043518","Freiburg THEP-99/5","gr-qc astro-ph hep-th quant-ph",,"  Gravitons produced from quantum vacuum fluctuations during an inflationary
stage in the early Universe have zero entropy as far as they reflect the time
evolution (squeezing) of a pure state, their large occupation number
notwithstanding. A non-zero entropy of the gravitons (classical gravitational
waves (GW) after decoherence) can be obtained through coarse graining. The
latter has to be physically justified {\it and} should not contradict
observational constraints. We propose two ways of coarse graining for which the
fixed temporal phase of each Fourier mode of the GW background still remains
observable: one based on quantum entanglement, and another one following from
the presence of a secondary GW background. The proposals are shown to be
mutually consistent. They lead to the result that the entropy of the primordial
GW background is significantly smaller than it was thought earlier. The
difference can be ascribed to the information about the regular (inflationary)
initial state of the Universe which is stored in this background and which
reveals itself, in particular, in the appearance of primordial peaks (acoustic
peaks in the case of scalar perturbations) in the multipole spectra of the CMB
temperature anisotropy and polarization.
","[{""version"":""v1"",""created"":""Wed, 20 Oct 1999 07:43:47 GMT""},{""version"":""v2"",""created"":""Sat, 8 Apr 2000 11:02:43 GMT""}]","2009-10-31"
"gr-qc/9910066","Francesco Fucito","E.Coccia, F. Fucito, J. A. Lobo and M.Salvino","Scalar GW detection with a hollow spherical antenna","latex file, 9 pages","Phys.Rev. D62 (2000) 044019","10.1103/PhysRevD.62.044019",,"gr-qc astro-ph hep-th",,"  We study the response and cross sections for the absorption of GW energy in a
Jordan-Brans-Dicke theory by a resonant mass detector shaped as a hollow
sphere.
","[{""version"":""v1"",""created"":""Wed, 20 Oct 1999 11:21:18 GMT""}]","2009-10-31"
"gr-qc/9910067","Cai Rong-Gen","Rong-Gen Cai and Anzhong Wang","Late-time evolution of the Yang-Mills field in the spherically symmetric
  gravitational collapse","Revtex, 14 pages, no figures","Gen.Rel.Grav.31:1367-1382,1999","10.1023/A:1026737127191",,"gr-qc",,"  We investigate the late-time evolution of the Yang-Mills field in the
self-gravitating backgrounds: Schwarzschild and Reissner-Nordstr\""om
spacetimes. The late-time power-law tails develop in the three asymptotic
regions: the future timelike infinity, the future null infinity and the black
hole horizon. In these two backgrounds, however, the late-time evolution has
quantitative and qualitative differences. In the Schwarzschild black hole
background, the late-time tails of the Yang-Mills field are the same as those
of the neutral massless scalar field with multipole moment l=1. The late-time
evolution is dominated by the spacetime curvature. When the background is the
Reissner-Nordstr\""om black hole, the late-time tails have not only a smaller
power-law exponent, but also an oscillatory factor. The late-time evolution is
dominated by the self-interacting term of the Yang-Mills field. The cause
responsible for the differences is revealed.
","[{""version"":""v1"",""created"":""Wed, 20 Oct 1999 14:03:15 GMT""}]","2010-11-19"
"hep-ex/9910039","Iori","The SELEX Collaboration, M.Iori, et al","Charm hadroproduction results from Selex","Talk at HEP99, to be published in the Proceedings",,,,"hep-ex",,"  The SELEX experiment (E781) is 3-stage magnetic spectrometer for a high
statistics study of hadroproduction of charm baryons out to large x_F using 650
Gev Sigma-, pi- and p beams. The main features of the spectrometer are: a high
precision silicon vertex system, powerful particle identification provided by
TRD and RICH, forward Lambda decay spectrometer and 3-stage lead glass photon
detector. An experiment overview and spectrometer features are shown.
Reconstructed charm states and results on Lambda_c, D+ particles and
antiparticles produced by Sigma-, pi- and p beams at x_F>0.3 and asymmetry for
Lambda_c are presented.
","[{""version"":""v1"",""created"":""Tue, 19 Oct 1999 16:26:38 GMT""}]","2007-05-23"
"hep-ex/9910040","Dan Karmgard","B. Abbott, et. al","Search for Second Generation Leptoquark Pairs in pbar-p Collisions at
  sqrt(s) = 1.8 TeV","6 pages, 4 figures. Submitted to Phys. Rev. Lett","Phys.Rev.Lett.84:2088-2093,2000","10.1103/PhysRevLett.84.2088",,"hep-ex",,"  We have searched for second generation leptoquark (LQ) pairs in the
\mu\mu+jets channel using 94+-5 pb^{-1} of pbar-p collider data collected by
the D0 experiment at the Fermilab Tevatron during 1993-1996. No evidence for a
signal is observed. These results are combined with those from the \mu\nu+jets
and \nu\nu+jets channels to obtain 95% confidence level (C.L.) upper limits on
the LQ pair production cross section as a function of mass and $beta, the
branching fraction of a LQ decay into a charged lepton and a quark. Lower
limits of 200(180) GeV/c^2 for \beta=1(1/2) are set at the 95% C.L. on the mass
of scalar LQ. Mass limits are also set on vector leptoquarks as a function of
\beta.
","[{""version"":""v1"",""created"":""Tue, 19 Oct 1999 22:49:33 GMT""}]","2008-11-26"
"hep-ex/9910041","Mark Mandelkern","Mark Mandelkern and Jonas Schultz","The Statistical Analysis of Gaussian and Poisson Signals Near Physical
  Boundaries","20 pages, 4 figures. In press:JMP","J.Math.Phys. 41 (2000) 5701-5709","10.1063/1.533433",,"hep-ex",,"  We propose a construction of frequentist confidence intervals that is
effective near unphysical regions and unifies the treatment of two-sided and
upper limit intervals. It is rigorous, has coverage, is computationally simple
and avoids the pathologies that affect the Likelihood Ratio and related
constructions. Away from non-physical regions, the results are exactly the
usual central two-sided intervals. The construction is based on including the
physical constraint in the derivation of the estimator, leading to an estimator
with values that are confined to the physical domain.
","[{""version"":""v1"",""created"":""Wed, 20 Oct 1999 00:09:28 GMT""},{""version"":""v2"",""created"":""Wed, 8 Dec 1999 21:05:40 GMT""},{""version"":""v3"",""created"":""Fri, 21 Apr 2000 21:09:45 GMT""}]","2009-10-31"
"hep-ex/9910042","Valery V. Sinev","L.A. Mikaelyan","Chooz, Palo Verde, Krasnoyarsk","5 pages LaTeX 2.09. 4 PS figures. Talk given at TAUP'99, 6-10
  September 1999 y","Nucl.Phys.Proc.Suppl. 87 (2000) 284-287","10.1016/S0920-5632(00)00681-2",,"hep-ex",,"  This is a short review of the present ~ 1 km baseline oscillation
experi-ments at nuclear reactors. An idea of a new search for very small mixing
angle oscillations at Krasnoyarsk is also mentioned.
","[{""version"":""v1"",""created"":""Wed, 20 Oct 1999 10:26:39 GMT""}]","2009-10-31"
"hep-ex/9910043","Sabine Woelfle","ZEUS Collaboration","Measurement of the E(T,jet)^2/Q^2 dependence of forward-jet production
  at HERA","8 pages including 3 figures","Phys.Lett.B474:223-233,2000","10.1016/S0370-2693(99)01478-1","DESY-99-162","hep-ex",,"  The forward-jet cross section in deep inelastic ep scattering has been
measured using the ZEUS detector at HERA with an integrated luminosity of 6.36
pb^-1. The jet cross section is presented as a function of jet transverse
energy squared, E(T,jet)^2, and Q^2 in the kinematic ranges
10^-2<E(T,jet)^2/Q^2<10^2 and 2.5 10^-4<x<8.0 10^-2. Since the perturbative QCD
predictions for this cross section are sensitive to the treatment of the
log(E_T/Q)^2 terms, this measurement provides an important test. The measured
cross section is compared to the predictions of a next-to-leading order pQCD
calculation as well as to various leading-order Monte Carlo models. Whereas the
predictions of all models agree with the measured cross section in the region
of small E(T,Jet)^2/Q^2, only one model, which includes a resolved photon
component, describes the data over the whole kinematic range.
","[{""version"":""v1"",""created"":""Wed, 20 Oct 1999 11:59:39 GMT""}]","2012-08-27"
"hep-ex/9910044","Fabrizio Palla","Fabrizio Palla (INFN-Pisa)","An investigation on the b quark mass","3 pages, 1 figures",,,,"hep-ex",,"  In this article I will review the measurements of the b quark mass performed
by ALEPH and DELPHI and presented at the HEP99 Conference in Tampere. Very
clean effects of the mass running are observed, even if a wide spread in the
results and large systematic errors due to hadronization corrections prevent to
extract an average value of the running b quark mass.
","[{""version"":""v1"",""created"":""Wed, 20 Oct 1999 13:13:52 GMT""}]","2007-05-23"
"hep-ex/9910045","P. Bussey","ZEUS Collaboration","Measurement of inclusive prompt photon photoproduction at HERA","21 pages including 4 figures and 2 tables","Phys.Lett.B472:175-188,2000","10.1016/S0370-2693(99)01450-1","DESY-99-161","hep-ex",,"  First inclusive measurements of isolated prompt photons in photoproduction at
the HERA ep collider have been made with the ZEUS detector, using an integrated
luminosity of 38.4 pb$^{-1}$. Cross sections are given as a function of the
pseudorapidity and the transverse energy ($\eta^\gamma$, \eTg) of the photon,
for $\eTg > $ 5 GeV in the $\gamma p$ centre-of-mass energy range 134-285 GeV.
Comparisons are made with predictions from Monte Carlo models having
leading-logarithm parton showers, and with next-to-leading-order QCD
calculations, using currently available parameterisations of the photon
structure. For forward $\eta^\gamma$ (proton direction) good agreement is
found, but in the rear direction all predictions fall below the data.
","[{""version"":""v1"",""created"":""Wed, 20 Oct 1999 13:35:07 GMT""}]","2012-08-27"
"hep-lat/9910034","Matteo Beccaria","Matteo Beccaria, Carlo Presilla, Gian Fabrizio De Angelis, Giovanni
  Jona-Lasinio","An exact representation of the fermion dynamics in terms of Poisson
  processes","3 pages, LATTICE99 submission",,,,"hep-lat",,"  We present a simple derivation of a Feynman-Kac type formula to study
fermionic systems. In this approach the real time or the imaginary time
dynamics is expressed in terms of the evolution of a collection of Poisson
processes. A computer implementation of this formula leads to a family of
algorithms parametrized by the values of the jump rates of the Poisson
processes. From these an optimal algorithm can be chosen which coincides with
the Green Function Monte Carlo (GFMC) method in the limit when the latter
becomes exact.
","[{""version"":""v1"",""created"":""Wed, 20 Oct 1999 14:28:41 GMT""},{""version"":""v2"",""created"":""Fri, 19 Nov 1999 16:15:27 GMT""}]","2007-05-23"
"hep-ph/9910405","Arjun Berera","Arjun Berera","A Tale of Two Hard Pomerons","In press Physical Review D, 2000, 35 pages, 1 table, 8 figures, Latex","Phys.Rev. D62 (2000) 014015","10.1103/PhysRevD.62.014015","VAND-TH-99-10","hep-ph",,"  Two mechanisms are examined for hard double pomeron exchange dijet
production, the factorized model of Ingelman-Schlein and the nonfactorized
model of lossless jet production which exhibits the Collins-Frankfurt-Strikman
mechanism. Comparison between these two mechanisms are made of the total cross
section, $E_T$-spectra, and mean rapidity spectra. For both mechanisms, several
specific models are examined with the cuts of CDF, D\O and representative cuts
of LHC. Distinct qualitative differences are predicted by the two mechanisms
for the CDF $y_+$-spectra and for the $E_T$-spectra for all three experimental
cuts. The preliminary CDF and D\O experimental data for this process are
interpreted in terms of these two mechanisms. The $y_+$-spectra of the CDF data
is suggestive of domination by the factorized Ingelman-Schlein mechanism,
whereas the D\O data shows no greater preference for either mechanism. An
inconsistency is found amongst all the theoretical models in attempting to
explain the ratio of the cross sections given by the data from these two
experiments.
","[{""version"":""v1"",""created"":""Tue, 19 Oct 1999 16:36:48 GMT""},{""version"":""v2"",""created"":""Mon, 13 Mar 2000 17:37:05 GMT""}]","2009-10-31"
"hep-ph/9910406","Xin-Hua Li","Y.F.Gu (IHEP,Beijing), X.H.Li (U. of California, Riverside)","Ratio of Hadronic Decay Rates of J\psi and \psi(2S) and the \rho\pi
  Puzzle","8 pages, no figure, 4 tables","Phys.Rev. D63 (2001) 114019","10.1103/PhysRevD.63.114019","hep-ph/9910406 Subject: High Energy Physics - Phenomenology","hep-ph",,"  The so-called \rho\pi puzzle of J\psi and \psi(2S) decays is examined using
the experimental data available to date. Two different approaches were taken to
estimate the ratio of J\psi and \psi(2S) hadronic decay rates. While one of the
estimates could not yield the exact ratio of \psi(2S) to J\psi inclusive
hadronic decay rates, the other, based on a computation of the inclusive ggg
decay rate for
  \psi(2S) (J\psi) by subtracting other decay rates from the total decay rate,
differs by two standard deviations from the naive prediction of perturbative
QCD, even though its central value is nearly twice as large as what was naively
expected. A comparison between this ratio, upon making corrections for specific
exclusive two-body decay modes, and the corresponding experimental data
confirms the puzzles in
  J\psi and \psi(2S) decays. We find from our analysis that the exclusively
reconstructed hadronic decays of the \psi(2S) account for only a small fraction
of its total decays, and a ratio exceeding the above estimate should be
expected to occur for a considerable number of the remaining decay channels. We
also show that the recent new results from the BES experiment provide crucial
tests of various theoretical models proposed to explain the puzzle.
","[{""version"":""v1"",""created"":""Tue, 19 Oct 1999 17:10:55 GMT""},{""version"":""v2"",""created"":""Tue, 21 Nov 2000 18:24:30 GMT""},{""version"":""v3"",""created"":""Mon, 27 Nov 2000 21:56:18 GMT""}]","2016-09-06"
"hep-ph/9910407","Horacio Casini","H. Casini, J.C. D'Olivo and R. Montemayor","VEP oscillation solutions to the solar neutrino problem","revtex, 18 pages, 11 figures","Phys.Rev. D61 (2000) 105004","10.1103/PhysRevD.61.105004",,"hep-ph",,"  We study the solar neutrino problem within the framework of a parametrized
post-Newtonian formulation for the gravitational interaction of the neutrinos,
which incorporates a violation to the equivalence principle (VEP). Using the
current data on the rates and the energy spectrum we find two possible
oscillation solutions, both for a large mixing angle. One of them involves the
MSW effect in matter and the other corresponds to vacuum oscillations. An
interesting characteristic of this mechanism is that it predicts a semi-annual
variation of the neutrino flux. Our analysis provides new constraints for some
VEP parameters.
","[{""version"":""v1"",""created"":""Tue, 19 Oct 1999 18:47:28 GMT""}]","2009-10-31"
"hep-ph/9910408","Khalil Shaaban Said","Shaaban Khalil (Autonoma U. de Madrid & Ain Shams U., Cairo)","Non universal gaugino phases and the LSP relic density","10 pages, Latex2e, version to be appeared in Phys. Lett. B","Phys.Lett. B484 (2000) 98-102","10.1016/S0370-2693(00)00598-0",,"hep-ph",,"  The cosmological relic density of the lightest supersymmetric particle (LSP)
of type I string derived model is calculated. This model can accommodate large
values of CP violating phases, and the electron and neutron electric dipole
moments satisfy the experimental constraint. We show that the constraint from
the electric dipole moment on the ratio between the gaugino masses implies that
the mass of the LSP, which is bino like, is close to the lightest chargino. The
co-annihilation between them is very important to reduce the LSP relic density
to an interesting region. We show that the SUSY phases, although they are
large, have no significant effect on the relic density and on the the upper
bound imposed on the LSP mass. However, they are very significant for the
detection rates. We emphasize that the phase of the trilinear coupling increase
the direct and indirect detection rates.
","[{""version"":""v1"",""created"":""Tue, 19 Oct 1999 18:50:47 GMT""},{""version"":""v2"",""created"":""Wed, 17 May 2000 12:08:01 GMT""}]","2009-10-31"
"hep-ph/9910409","Jonathan Engel","J. Engel and P. Vogel","Neutralino Inelastic Scattering with Subsequent Detection of Nuclear
  Gamma Rays","7 pages, 1 figure in text, latex","Phys.Rev. D61 (2000) 063503","10.1103/PhysRevD.61.063503",,"hep-ph nucl-th",,"  We consider the potential benefits of searching for supersymmetric
dark-matter through its inelastic excitation, via the ""scalar current"", of
low-lying collective nuclear states in a detector. If such states live long
enough so that the gamma radiation from their decay can be separated from the
signal due to nuclear recoil, then background can be dramatically reduced. We
show how the kinematics of neutralino-nucleus scattering is modified when the
nucleus is excited and derive expressions for the form factors associated with
exciting collective states. We apply these results to two specific cases: 1)
the 5/2^+ state at 13 keV in 73Ge, and 2) the rotational and hence very
collective state 3/2^+ at 8 keV in 169Tm (even though observing the transition
down from that state will be difficult). In both cases we compare the form
factors for inelastic scattering with those for elastic scattering. The
inelastic cross section is considerably smaller than its elastic counterpart,
though perhaps not always prohibitively so.
","[{""version"":""v1"",""created"":""Tue, 19 Oct 1999 22:50:55 GMT""}]","2009-10-31"
"hep-ph/9910410","Robert Brandenberger","Robert H. Brandenberger","Inflationary Cosmology: Progress and Problems","43 pages, 8 figures Invited lectures at the International School on
  Cosmology, Kish Island, Iran, Jan. 22 - Feb. 4 1999, to be publ. in the
  proceedings (Kluwer, Dordrecht, 2000)",,,"BROWN-HET-1196","hep-ph astro-ph gr-qc hep-th",,"  These lecture notes intend to form a short pedagogical introduction to
inflationary cosmology, highlighting selected areas of recent progress such as
reheating and the theory of cosmological perturbations. Problems of principle
for inflationary cosmology are pointed out, and some new attempts at solving
them are indicated, including a nonsingular Universe construction by means of
higher derivative terms in the gravitational action, and the study of
back-reaction of cosmological perturbations.
","[{""version"":""v1"",""created"":""Wed, 20 Oct 1999 05:18:27 GMT""}]","2007-05-23"
"hep-ph/9910411","Z. J. Xiao","Zhenjun Xiao, Chong Sheng Li and Kuang-Ta Chao","Gluon penguin enhancements to inclusive charmless decays of b quark in
  the 2HDM with flavor changing couplings","Latex file, 14 pages with 6 PS or EPS figures. corrected some typos,
  added new references","Phys.Lett.B473:148-156,2000","10.1016/S0370-2693(99)01469-0",,"hep-ph",,"  We calculate the enhancements to the inclusive charmless decays of b quark,
$b \to s g, s q\bar{q}, sgg$, from gluon penguin diagrams induced by the
charged and neutral Higgs bosons $(H^{\pm}, h^0, H^0$, and A^0) in the
Two-Higgs-Doublet Model with flavor-changing couplings. Within the considered
parameter space, the new contributions from charged Higgs boson are dominant.
After including the new contributions, the branching ratio $BR(b \to sg)$ (q^2
=0) can be increased form $\sim 0.2%$ in the standard model to 4.4% and 2.6% in
the two-Higgs-doublet model for $m_{H^+}=100$ and 200 GeV, respectively. The
new contribution to the decay mode $b \to s q \bar{q}$ with q=(u,d,s) is,
however, numerically small and peaked at the lower q^2 region. The new
contribution to $b \to s gg$ can also be neglected.
","[{""version"":""v1"",""created"":""Wed, 20 Oct 1999 08:22:01 GMT""},{""version"":""v2"",""created"":""Sun, 24 Oct 1999 01:21:28 GMT""}]","2014-11-17"
"hep-ph/9910412","Matteo Cacciari","Matteo Cacciari","Soft-Gluon Resummation in Heavy Quarkonium Physics","15 pages, 6 figures, LaTeX2e","Nucl.Phys. B571 (2000) 185-196","10.1016/S0550-3213(99)00808-1","CERN-TH/99-312","hep-ph",,"  Soft-gluon resummation within the framework of heavy quarkonium
hadroproduction is considered. A few selected cases are studied in detail. A
sizeable increase of the cross sections with respect to the next-to-leading
order predictions with central factorization/renormalization scale choice can
generally be observed. Improvements in the dependence of the cross sections on
the two scales, especially when they are kept equal, are also found.
","[{""version"":""v1"",""created"":""Wed, 20 Oct 1999 15:28:08 GMT""}]","2009-10-31"
"hep-ph/9910413","Jack Paton","Gabriel Karl and Jack Paton","Gluonic states in two space dimensions","36 pages latex","Phys.Rev. D61 (2000) 074002","10.1103/PhysRevD.61.074002","OUTP-99-40P","hep-ph hep-lat",,"  We discuss the ``spectroscopy'' of gluonic states in systems with two space
dimensions, using simple models to mimic the results of lattice gauge theory
computations. We first discuss the quantum numbers of these systems, including
charge conjugation. Two types of systems are discussed in detail: ``gluelumps''
which have a heavy adjoint color charge at the origin and glueballs which are
composed entirely of glue. Both systems are discussed using the bag model and
the flux tube model. For glueballs the model spectra are compared with the
resulst of Teper. Both models capture many features of the numerical results.
","[{""version"":""v1"",""created"":""Wed, 20 Oct 1999 10:49:46 GMT""}]","2009-10-31"
