"hep-ex/9910062","Edward R. Kinney","A. Airapetian, et al. (The HERMES Collaboration)","Observation of a Single-Spin Azimuthal Asymmetry in Semi-Inclusive Pion
  Electro-Production","5 pages of RevTex, 3 ps figures, 2 tables","Phys.Rev.Lett.84:4047-4051,2000","10.1103/PhysRevLett.84.4047","DESY 99-149","hep-ex",,"  Single-spin asymmetries for semi-inclusive pion production in deep-inelastic
scattering have been measured for the first time. A significant target-spin
asymmetry of the distribution in the azimuthal angle phi of the pion relative
to the lepton scattering plane was observed for pi+ electro-production on a
longitudinally polarized hydrogen target. The corresponding analyzing power in
the sin(phi) moment of the cross section is 0.022 +/- 0.005 +/- 0.003. This
result can be interpreted as the effect of terms in the cross section involving
chiral-odd spin distribution functions in combination with a time-reversal-odd
fragmentation function that is sensitive to the transverse polarization of the
fragmenting quark.
","[{""version"":""v1"",""created"":""Thu, 28 Oct 1999 21:35:40 GMT""}]","2009-04-15"
"hep-lat/9910045","Artan Borici","Artan Borici","Lanczos Approach to the Inverse Square Root of a Large and Sparse Matrix","Expanded abstract, introduction and conclusions. References added","J.Comput.Phys.162:123-131,2000","10.1006/jcph.2000.6529",,"hep-lat",,"  I construct a Lanczos process on a large and sparse matrix and use the
results of this iteration to compute the inverse square root of the same
matrix. The algorithm is a stable version of an earlier proposal by the author.
It can be used for problems related to the matrix sign and polar decomposition.
The application here comes from the theory of chiral fermions on the lattice.
","[{""version"":""v1"",""created"":""Fri, 29 Oct 1999 13:35:42 GMT""},{""version"":""v2"",""created"":""Mon, 1 Nov 1999 11:18:39 GMT""},{""version"":""v3"",""created"":""Sun, 16 Jul 2000 07:29:36 GMT""}]","2011-07-19"
"hep-ph/9910527","Avtandil Tkabladze","J. Gegelia, G. Japaridze, A. Tkabladze, A. Khelashvili, and K.
  Turashvili","On the Gauge Invariance of the Z-Boson Mass","11 pages, LaTeX, talk presented at the Conference ""Quarks-92"",
  Zvenigorod Russia, 1992, comments added",,,,"hep-ph",,"  The different schemes for the definition of the Z boson mass are analyzed. It
is shown that the scheme, defining the mass as pole of the real part of the Z
boson propagator and the width as the imaginary part of the propagator at the
same point results in the gauge dependent results for these parameters in a
two-loop approximation. On the other hand, the scheme, where the mass and width
are related to the position of the pole of the propagator in the complex plane
leads to the gauge independent result. It is argued that the gauge dependence
of mass and width does not contradicts to the gauge invariance of the
amplitude.
","[{""version"":""v1"",""created"":""Thu, 28 Oct 1999 19:19:47 GMT""}]","2007-05-23"
"hep-ph/9910535",,"Michael Joyce, Kimmo Kainulainen, and Tomislav Prokopec","Quantum Transport Equations for a Scalar Field","16 pages, 2 figures, LaTeX with epsf macro","Phys.Lett. B474 (2000) 402-410","10.1016/S0370-2693(00)00041-1","NORDITA-99/67 HE, NBI-HE-99-42, UNIL-IPT/99-3, LPT Orsay 99-86","hep-ph hep-th nucl-th quant-ph",,"  We derive quantum Boltzmann equations from Schwinger-Dyson equations in
gradient expansion for a weakly coupled scalar field theory with a spatially
varying mass. We find that at higher order in gradients a full description of
the system requires specifying not only an on shell distribution function but
also a finite number of its derivatives, or equivalently its higher moments.
These derivatives describe quantum coherence arising as a consequence of
localization in position space. We then show that in the limit of frequent
scatterings coherent quantum effects are suppressed, and the transport
equations reduce to the single Boltzmann equation for particle density, in
which particles flow along modified semiclassical trajectories in phase space.
","[{""version"":""v1"",""created"":""Thu, 28 Oct 1999 17:43:56 GMT""}]","2009-10-31"
"hep-ph/9910536","Antonio O. Bouzas","Antonio O. Bouzas","Three and Two-Point One-Loop Integrals in Heavy Particle Effective
  Theories","16 pages, Latex2e, no figures","Eur.Phys.J.C12:643-653,2000","10.1007/s100520000277",,"hep-ph",,"  We give a complete analytical computation of three and two-point loop
integrals occurring in heavy-particle theories, involving a velocity change,
for arbitrary real values of the external masses and residual momenta.
","[{""version"":""v1"",""created"":""Thu, 28 Oct 1999 16:11:23 GMT""}]","2011-09-13"
"hep-ph/9910537","Sebastien Descotes","Sebastien Descotes, Luca Girlanda and Jan Stern (IPN-Orsay)","Paramagnetic effect of light quark loops on Chiral Symmetry Breaking","15 pages, Latex, using JHEP.cls (included), 1 PS figure","JHEP 0001 (2000) 041","10.1088/1126-6708/2000/01/041","IPNO-DR/99-27","hep-ph hep-lat",,"  We argue that light quark loops produce a paramagnetic suppression of
infrared-sensitive order parameters such as <qq>, as the number N_f of light
fermions increases. The possibly strong dependence of <qq> on N_f is related to
the observed Zweig rule violation in the scalar channel. Presuming the
existence of a chiral phase transition for not too large N_f, we discuss the
phenomenological possibilities of separately determining the two-flavour and
three-flavour condensates and the quark mass ratio r=2m_s/(m_u+m_d). The issue
is closely related to the interpretation of new forthcoming precise pi-pi data
at low energy.
","[{""version"":""v1"",""created"":""Thu, 28 Oct 1999 17:21:05 GMT""}]","2009-10-31"
"hep-ph/9910538","Luca Girlanda","Luca Girlanda (IPN-Orsay)","Measuring the quark condensate from the decays tau -> 3 pi + nu(tau)","contribution to QCD99, 4 pages, Latex, using espcrc2.sty (included),
  2 PS figure","Nucl.Phys.Proc.Suppl. 86 (2000) 207-210","10.1016/S0920-5632(00)00565-X","IPNO-DR/99-24","hep-ph",,"  The possibility of detecting the S-wave of the decays tau -> 3 pi + nu(tau)
in the threshold region is explored, with emphasis on the sensitivity to the
size of the quark antiquark condensate <qq>.
","[{""version"":""v1"",""created"":""Thu, 28 Oct 1999 17:13:13 GMT""}]","2009-10-31"
"hep-ph/9910539","Xiaotong Song","X. Song (University of Virginia)","Quark Spin and Orbital Angular Momentum in the Baryon","revised version, 23 pages, 3 figures",,,"INPP-UVA-99-01","hep-ph",,"  The spin and orbital angular momentum carried by different quark flavors in
the nucleon are calculated in the SU(3) chiral quark model with
symmetry-breaking. The model is extended to all octet and decuplet baryons. In
this model, the reduction of the quark spin, due to the spin dilution in the
chiral splitting processes, is transferred into the orbital motion of quarks
and antiquarks. The orbital angular momentum for each quark flavor in the
proton as function of the partition factor $\kappa$ and the chiral splitting
probability $a$ is shown. Although the total amount of the quark spin reduction
is canceled by the the equal amount increase of the quark orbital angular
momentum, the cancellation does not apply to each quark flavor. Especially, the
cancellation between the spin and orbital contributions in the baryon magnetic
moment is discussed. Comparisons of our results with other models are also
shown.
","[{""version"":""v1"",""created"":""Fri, 29 Oct 1999 03:13:40 GMT""},{""version"":""v2"",""created"":""Fri, 11 Aug 2000 00:02:02 GMT""}]","2007-05-23"
"hep-ph/9910540","Nikolai N. Achasov","N.N. Achasov (Sobolev Institute for Mathematics SB RAS)","On nature of scalar a_0(980) and f_0(980)-mesons","6 pages, LaTeX 2e, uses espcrc1.sty, Plenary Talk given at 8th
  International Conference on HADRON Spectroscopy (HADRON 99), Beijing, China,
  24-28 August 1999","Nucl.Phys.A675:279c-284c,2000","10.1016/S0375-9474(00)00266-9",,"hep-ph hep-ex",,"  It is presented a critical consideration of all unusual properties of the
scalar a_0(980) and f_0(980)-mesons in the four-quark, two-quark and molecular
models. The arguments are adduced that the four-quark model is more preferable.
It is discussed the complex of experiments that could finally resolve this
issue.
","[{""version"":""v1"",""created"":""Fri, 29 Oct 1999 04:00:25 GMT""}]","2014-11-17"
"hep-ph/9910541","Masayuki Matsuzaki","Masayuki Matsuzaki (Fukuoka University of Education)","Spatial structure of quark Cooper pairs in a color superconductor","10 pages, 3 figures. The frequency dependence of the gap and the
  limitation on the type I/type II discussion are mentioned briefly. To appear
  in Phys. Rev. D","Phys.Rev. D62 (2000) 017501","10.1103/PhysRevD.62.017501",,"hep-ph astro-ph nucl-th",,"  Spatial structure of Cooper pairs with quantum numbers color 3^*, I=J=L=S=0
in ud 2 flavor quark matter is studied by solving the gap equation and
calculating the coherence length in full momentum range without the weak
coupling approximation. Although the gap at the Fermi surface and the coherence
length depend on density weakly, the shape of the r-space pair wave function
varies strongly with density. This result indicates that quark Cooper pairs
become more bosonic at higher densities.
","[{""version"":""v1"",""created"":""Fri, 29 Oct 1999 08:43:48 GMT""},{""version"":""v2"",""created"":""Thu, 9 Mar 2000 09:01:19 GMT""}]","2009-10-31"
"hep-ph/9910542","Stephan Kolb","St. Kolb, M. Hirsch, H.V. Klapdor-Kleingrothaus, O. Panella","Collider Signatures of Sneutrino Cold Dark Matter","10 pages, 1 figure","Phys.Lett. B478 (2000) 262-268","10.1016/S0370-2693(00)00260-4",,"hep-ph",,"  Decays of sneutrinos are considered in the case that in the presence of
lepton-number violation in the sneutrino sector the lighter tau-sneutrino is
the Lightest Supersymmetric Particle and the Cold Dark Matter in the Universe.
In such circumstances the signals from sparticle decays differ considerably
from the ``standard'' case where the lightest neutralino is the Lightest
Supersymmetric Particle and it is found that in a wide range of parameters
compatible with the sneutrino Cold Dark Matter hypothesis signatures
characteristic for such a scenario should be easily observable at for example a
Next Linear Collider.
","[{""version"":""v1"",""created"":""Fri, 29 Oct 1999 12:06:08 GMT""},{""version"":""v2"",""created"":""Thu, 6 Apr 2000 16:47:57 GMT""}]","2009-10-31"
"hep-ph/9910543","Marc Chemtob","Marc Chemtob and Gr\'egory Moreau","Polarized Single Top Production at Leptonic Colliders from Broken R
  Parity Interactions Incorporating CP Violation","revtex file. 17 pages. 7 postscript figures. 1 table. The revised
  version includes an estimate of experimental uncertainties. Submitted to
  Phys. Rev. D","Phys.Rev. D61 (2000) 116004","10.1103/PhysRevD.61.116004","Saclay T99/124","hep-ph",,"  The contribution from the R parity violating interactions in the associated
production of a top quark with a charm antiquark is examined for high energy
leptonic colliders. We concentrate on the reactions associated with the
semileptonic top decay. A set of characteristic dynamical distributions for the
signal events is evaluated and the results contrasted against those from the
standard model W-boson pair production background. Next, we turn to a study of
a CP-odd observable, associated with the top spin, which leads to an asymmetry
in the energy distribution of the emitted charged leptons for the pair of
CP-conjugate final states, $b \bar l \nu \bar c$ and $ \bar b l \bar \nu c $. A
non vanishing asymmetry arises from a CP-odd phase, embedded in the R parity
violating coupling constants, through interference terms between the R parity
violating amplitudes at both the tree and loop levels.
","[{""version"":""v1"",""created"":""Fri, 29 Oct 1999 13:36:09 GMT""},{""version"":""v2"",""created"":""Fri, 7 Jan 2000 12:32:16 GMT""}]","2009-10-31"
"hep-ph/9910544","Philip G. Ratcliffe","Philip G. Ratcliffe","Theory Summary Talk","Presented at Hyperon99 Symposium, Fermilab, Batavia, Sept. 27-29,
  1999; 10 pages; uses hyperon99_paper.sty and setup.sty (included); and the
  following standard LaTeX packages: acromake, axodraw, cite, epsf, topcapt
  (not included); 1 eps figure file (using epsf)",,,,"hep-ph",,"  A summary is presented of the more theoretical aspects of the presentations
made at Hyperon~99. In addition, some material is covered which was not
presented at the symposium but which I feel is pertinent to the main theme of
hyperons and/or, more in particular, to discussions conducted during the
symposium.
","[{""version"":""v1"",""created"":""Fri, 29 Oct 1999 14:04:56 GMT""}]","2007-05-23"
"hep-ph/9910546","Tommy Ohlsson","Tommy Ohlsson and Hakan Snellman","Three flavor neutrino oscillations in matter","25 pages, 6 figures (PostScript), RevTeX","J.Math.Phys. 41 (2000) 2768-2788; Erratum-ibid. 42 (2001) 2345","10.1063/1.533270",,"hep-ph hep-th math-ph math.MP",,"  We derive analytic expressions for three flavor neutrino oscillations in the
presence of matter in the plane wave approximation using the Cayley-Hamilton
formalism. Especially, we calculate the time evolution operator in both flavor
and mass bases. Furthermore, we find the transition probabilities, matter mass
squared differences, and matter mixing angles all expressed in terms of the
vacuum mass squared differences, the vacuum mixing angles, and the matter
density. The conditions for resonance in the presence of matter are also
studied in some examples.
","[{""version"":""v1"",""created"":""Fri, 29 Oct 1999 15:13:28 GMT""},{""version"":""v2"",""created"":""Mon, 1 Nov 1999 08:34:58 GMT""},{""version"":""v3"",""created"":""Wed, 3 Nov 1999 08:22:16 GMT""},{""version"":""v4"",""created"":""Fri, 30 Jun 2000 18:59:51 GMT""}]","2009-10-31"
"hep-ph/9910547","Fl. Stancu","Fl. Stancu (Univ. of Liege)","Stability of Multiquark Systems","10 pages, aipproc.sty. Talk presented at the International Workshop
  on Hadron Physics ""Effective Theories of Low Energy QCD"", Coimbra, Portugal,
  September 10-15, 1999",,"10.1063/1.1303008",,"hep-ph",,"  We give a brief review of developments in the field of exotic hadrons formed
of more than three quarks and/or antiquarks. In particular we discuss the
stability of multiquark systems containing heavy flavours. We show that the
gluon exchange model and the chiral constituent quark model based on Goldstone
boson (pseudoscalar meson) exchange give entirely different results.
","[{""version"":""v1"",""created"":""Fri, 29 Oct 1999 15:52:13 GMT""}]","2009-10-31"
"hep-th/9910233","Nelson R. F. Braga","Henrique Boschi-Filho and Nelson R. F. Braga","Remark on the variational principle in the AdS/CFT correspondence for
  the scalar field","12 pages, no figures","Phys.Lett.B471:162-170,1999","10.1016/S0370-2693(99)01361-1",,"hep-th",,"  We discuss how the variational principle can be used as a criterion for
choosing, among scalar field actions implying the same equation of motion, the
appropriate one for the AdS/CFT correspondence.
","[{""version"":""v1"",""created"":""Thu, 28 Oct 1999 16:03:47 GMT""}]","2008-11-26"
"hep-th/9910234","Alexei A. Abrikosov jr.","Alexei A. Abrikosov Jr","Instantons in curvilinear coordinates","Talk given at the QCD-99 conference, June 1999, Montpellier, France.
  Primitive LaTeX, 7 pp","Nucl.Phys.Proc.Suppl. 86 (2000) 452-455","10.1016/S0920-5632(00)00603-4",,"hep-th",,"  The multi-instanton solutions by 'tHooft and Jackiw, Nohl & Rebbi are
generalized to curvilinear coordinates. Expressions can be notably simplified
by the appropriate gauge transformation. This generates the compensating
addition to the gauge potential of pseudoparticles. Singularities of the
compensating connection are irrelevant for physics but affect gauge dependent
quantities.
","[{""version"":""v1"",""created"":""Thu, 28 Oct 1999 16:13:50 GMT""}]","2009-10-31"
"hep-th/9910235","Jean-Loup Gervais","Jean-Loup Gervais","Solution Generating in Ten Dimensional Supersymmetric Classical
  Yang--Mills Theories","14 pages Latex",,,"LPTENS-99/20","hep-th math-ph math.MP nlin.SI solv-int",,"  In a recent paper (hep-th/9811108), Saveliev and the author showed that there
exits an on-shell light cone gauge where the non-linear part of the field
equations reduces to a (super) version of Yang's equations which may be solved
by methods inspired by the ones previously developed for self-dual Yang-Mills
equations in four dimensions. Later on (hep-th/9903218), the analogy between
these latter theories and the present ones was pushed further by writing down a
set of super partial linear differential equations which are the analogues of
the Lax pair of Belavin and Zakharov. Using this Lax representation, it is
shown in the present article that solution-generating techniques are at work,
which are similar to the ones developed for four dimensional self-dual
Yang-Mills theories in the late seventies.
","[{""version"":""v1"",""created"":""Thu, 28 Oct 1999 16:47:16 GMT""}]","2007-05-23"
"hep-th/9910236","Ori Ganor","Ori J. Ganor","Effects in Gauge Theories and a Harmonic Function on $E_{10}$","46pp LaTeX",,,"PUPT-1895","hep-th",,"  In a previous paper we conjectured that the structure of various gauge
theories as well as M-theory on $T^8$ is encoded in a unique function $\Xi$ on
the coset $E_{10}(Z)\backslash E_{10}(R)/K$ and that this function is harmonic
with respect to the $E_{10}(R)$ invariant metric. In this paper we elaborate on
the conjecture. We discuss various mass deformations of the D-instanton
integral and their realizations in $\Xi$. We then present a conjectured
prescription for extracting partition functions of the twisted little-string
theory out of $\Xi$. We also study various effects of combinations of branes
such as D0-branes near D4-branes with 2-form flux, D-instantons near Taub-NUT
metrics, and more, in terms of harmonic functions on $E_d(R)/K$. We propose
tests of the conjecture that are related to BPS states of global symmetries in
gauge theories.
","[{""version"":""v1"",""created"":""Thu, 28 Oct 1999 18:28:39 GMT""}]","2007-05-23"
"hep-th/9910237","Matteo Bertolini","M. Bertolini, M. Trigiante","Regular R-R and NS-NS BPS black holes","latex, 30 pages. Final version to appear on Int.J.Mod.Phys","Int.J.Mod.Phys. A15 (2000) 5017","10.1142/S0217751X0000207X","SISSA REF 129/99/EP,SWAT/243","hep-th",,"  We show in a precise group theoretical fashion how the generating solution of
regular BPS black holes of N=8 supergravity, which is known to be a solution
also of a simpler N=2 STU model truncation, can be characterized as NS-NS or
R-R charged according to the way the corresponding STU model is embedded in the
original N=8 theory. Of particular interest is the class of embeddings which
yield regular BPS black hole solutions carrying only R-R charge and whose
microscopic description can possibly be given in terms of bound states of
D-branes only. The microscopic interpretation of the bosonic fields in this
class of STU models relies on the solvable Lie algebra (SLA) method. In the
present article we improve this mathematical technique in order to provide two
distinct descriptions for type IIA and type IIB theories and an algebraic
characterization of S*T--dual embeddings within the N=8,d=4 theory. This
analysis will be applied to the particular example of a four parameter
(dilatonic) solution of which both the full macroscopic and microscopic
descriptions will be worked out.
","[{""version"":""v1"",""created"":""Thu, 28 Oct 1999 18:08:46 GMT""},{""version"":""v2"",""created"":""Wed, 3 Nov 1999 17:58:19 GMT""},{""version"":""v3"",""created"":""Tue, 15 Feb 2000 19:14:47 GMT""},{""version"":""v4"",""created"":""Thu, 17 Feb 2000 00:17:46 GMT""},{""version"":""v5"",""created"":""Wed, 24 May 2000 10:24:54 GMT""}]","2016-12-28"
"hep-th/9910238","Moshe Rozali","Moshe Rozali","Hypermultiplet Moduli Space and Three Dimensional Gauge Theories","8 pages, LATEX","JHEP 9912 (1999) 013","10.1088/1126-6708/1999/12/013","RU-NHETC-99-38","hep-th",,"  We establish a relation, conjectured recently by E. Witten, between the
hypermultiplet moduli space in compactifications of the heterotic string on an
A-D-E singularities, and the moduli spaces of three dimensional pure gauge
theories with the corresponding A-D-E gauge groups. It is possible to add a
bounded number of heterotic fivebranes sitting in the singularity, while (in
leading order in $\alpha'$) keeping the heterotic string perturbative. The
corresponding hypermultiplet moduli space is given by the moduli space of a
three dimensional gauge theory with matter.
","[{""version"":""v1"",""created"":""Thu, 28 Oct 1999 18:29:00 GMT""}]","2009-10-31"
"hep-th/9910239","Ying Jiang","Ying Jiang, Yishi Duan","A new topological aspect of the arbitrary dimensional topological
  defects","24 pages, 10 figures, Revtex","J.Math.Phys. 24 (2000) 6463","10.1063/1.1286981",,"hep-th",,"  We present a new generalized topological current in terms of the order
parameter field $\vec \phi$ to describe the arbitrary dimensional topological
defects. By virtue of the $% \phi$-mapping method, we show that the topological
defects are generated from the zero points of the order parameter field $\vec
\phi$, and the topological charges of these topological defects are topological
quantized in terms of the Hopf indices and Brouwer degrees of $\phi$-mapping
under the condition that the Jacobian $% J(\frac \phi v)\neq 0$. When $J(\frac
\phi v)=0$, it is shown that there exist the crucial case of branch process.
Based on the implicit function theorem and the Taylor expansion, we detail the
bifurcation of generalized topological current and find different directions of
the bifurcation. The arbitrary dimensional topological defects are found
splitting or merging at the degenerate point of field function $\vec \phi $ but
the total charge of the topological defects is still unchanged.
","[{""version"":""v1"",""created"":""Fri, 29 Oct 1999 01:50:49 GMT""},{""version"":""v2"",""created"":""Tue, 21 Dec 1999 07:05:17 GMT""},{""version"":""v3"",""created"":""Wed, 22 Dec 1999 07:37:11 GMT""}]","2016-09-06"
"hep-th/9910240","Roy B. Tumlos","Jose A. Magpantay (National Institute of Physics, U.P. Diliman Q.C.,
  Philippines)","The Parisi-Sourlas Mechanism in Yang-Mills Theory?","13 pages, LATEX","Int.J.Mod.Phys. A15 (2000) 1613-1628","10.1142/S0217751X00000720",,"hep-th",,"  The Parisi-Sourlas mechanism is exhibited in pure Yang-Mills theory. Using
the new scalar degrees of freedom derived from the non-linear gauge condition,
we show that the non-perturbative sector of Yang-Mills theory is equivalent to
a 4D O(1,3) sigma model in a random field. We then show that the leading term
of this equivalent theory is invariant under supersymmetry transformations
where (x^{2}+\thetabar\theta) is unchanged. This leads to dimensional reduction
proving the equivalence of the non-perturbative sector of Yang-Mills theory to
a 2D O(1,3) sigma model.
","[{""version"":""v1"",""created"":""Fri, 29 Oct 1999 03:48:16 GMT""}]","2009-10-31"
"hep-th/9910241","Josef Kluson","J. Kluson","D-branes from N non-BPS D9-branes in Type IIA theory","30 pages, corrected some typos","JHEP 0002:017,2000","10.1088/1126-6708/2000/02/017","MU-3467","hep-th",,"  We construct unstable system D8-brane+D8-antibrane as a kink solution on
world-volume of non-BPS D9-brane in Type IIA theory. Further we will make other
checks confirming validity of our appro.
","[{""version"":""v1"",""created"":""Fri, 29 Oct 1999 13:16:31 GMT""},{""version"":""v2"",""created"":""Mon, 15 Nov 1999 06:52:51 GMT""}]","2010-02-03"
"hep-th/9910242","Sanchez","M. P. Infante, N. Sanchez","Minimal String Driven Cosmology and its Predictions","22 pages Latex file, 2 figures",,,"DFTUZ/99/15","hep-th astro-ph gr-qc hep-ph",,"  We present a minimal model for the Universe evolution fully extracted from
effective String Theory. By linking this model with a minimal but well
established observational information, we prove that it gives realistic
predictions on early and current energy density and its results are compatible
with General Relativity. Interestingly enough, the predicted current energy
density is found $\Omega = 1$ and in anycase with lower limit $\Omega \geq
{4/9}$. On the other hand, the energy density at the exit of inflationary stage
gives also $\Omega|_{inf}=1$. This result shows an agreement with General
Relativity (spatially flat metric gives critical energy density) within an
unequivalent Non-Einstenian context (string low energy effective equations).
The order of magnitude of the energy density-dilaton coupled term at the
beginning of radiation dominated stage agrees with GUT scale. Without solving
the known problems about higher order corrections and graceful exit of
inflation, we find this model closer to the observational Universe properties
than the current available string cosmology scenarii. At a more fundamental
level, this model is by its construction close to the standard cosmological
evolution, and it is driven selfconsistently by the evolution of the string
equation of state itself. The inflationary String Driven stage is able to reach
an enough amount of inflation, describing a Big Bang like evolution for the
metric.
","[{""version"":""v1"",""created"":""Fri, 29 Oct 1999 14:09:39 GMT""}]","2007-05-23"
