"astro-ph/9910540","Fan Junhui","K.S. Cheng (Dept. of Phys. HKU), J.H. Fan (CfA, GNU), Z.G. Dai (Dept.
  of Astro. NJU)","The polarization and beaming effect for GRBs","15 pages, 1 figure, 1 table. revise the calculation, expand the
  discussion and add some references, submitted to MNRAS",,,,"astro-ph",,"  Both observations and theoretical models suggest that the emissions in
gamma-ray bursts (GRBs) and the afterglows are beamed. We argue that the recent
polarization measured in the afterglows gives further evidence of beaming in
GRBs. In this approach, we adopted the polarization-magnitude relation of BL
Lacertae objects to 4 GRBs with available polarization measurements and found
that the data of the 4 GRBs are consistent with the relation of BL Lacertae
objects. This result suggests that the emissions in GRBs are beamed and there
are similarities between GRBs and BL Lacertae objects (or generally blazars).
We suggest that the weak polarization of GRBs may result from low percentage of
orderly magnetic field in the shock front.
","[{""version"":""v1"",""created"":""Fri, 29 Oct 1999 12:12:39 GMT""},{""version"":""v2"",""created"":""Fri, 19 Nov 1999 08:28:32 GMT""}]","2007-05-23"
"astro-ph/9910541","Christine Cordula Dantas","Christine C. Dantas (1), Andre L. B. Ribeiro (2), Hugo V. Capelato
  (1), and Reinaldo R. de Carvalho(3) ((1)INPE, Brazil, (2) Unicamp, Brazil,
  (3) ON, Brazil)","The Two-Component Virial Theorem and the Physical Properties of Stellar
  Systems","13 pages, 2 figures, LaTeX, corrected few typos. This version matches
  the published version","ApJ 528, L5 (2000)","10.1086/312415",,"astro-ph",,"  Motivated by present indirect evidences that galaxies are surrounded by dark
matter halos, we investigate whether their physical properties can be described
by a formulation of the virial theorem which explicitly takes into account the
gravitational potential term representing the interaction of the dark halo with
the barionic or luminous component. Our analysis shows that the application of
such a ``two-component virial theorem'' not only accounts for the scaling
relations displayed, in particular, by elliptical galaxies, but also for the
observed properties of all virialized stellar systems, ranging from globular
clusters to galaxy clusters.
","[{""version"":""v1"",""created"":""Fri, 29 Oct 1999 12:18:20 GMT""},{""version"":""v2"",""created"":""Wed, 5 Apr 2000 20:56:22 GMT""}]","2009-10-31"
"astro-ph/9910542","Nami Mowlavi","Nami Mowlavi","Sodium production in asymptotic giant branch stars","18pages, also available at http://obswww.unige.ch/~mowlavi","A&A 350, 73-88",,,"astro-ph",,"  [condensed]
  A new scenario is presented for the production of Na23 in asymptotic giant
branch (AGB) stars. The scenario takes advantage of the periodic third
dredge-up episodes characterizing those stars, which mix primary C12 from their
intershell layers to their surface. Two successive interpulse/pulse/dredge-up
sequences are then required to produce Na23. During the first sequence carbon
and oxygen are converted into N14 by the hydrogen burning shell, and
subsequently transformed into Ne22 by the helium burning shell. During the
second sequence, Ne22 is converted into Na23 by the hydrogen burning shell,
which is brought to the surface by the subsequent dredge-up episode. The Na23
produced by this scenario is thus primary.
  The efficiency of this scenario is analyzed through standard evolutionary AGB
model predictions combined with synthetic calculations for the surface chemical
evolution. It is shown that primary Na23 can efficiently be produced as soon as
the surface C+N+O abundance enhancement reaches a certain level depending on
the stellar metallicity. The required surface C+N+O abundance enhancement
amounts to about 0.4 dex in solar metallicity stars, and to about 0.8 dex at a
metallicity five times less than solar.
  ...
","[{""version"":""v1"",""created"":""Fri, 29 Oct 1999 12:28:27 GMT""}]","2007-05-23"
"astro-ph/9910543","Fan Junhui","K.S. Cheng (Dept. of Phys. HKU), J.H. Fan (CfA, GNU), L. Zhang (Dept.
  of Phys. HKU)","Basic properties of Gamma-ray loud blazars","14 pages, 3 tables, A&A accepted",,,,"astro-ph",,"  In this paper, a method is proposed to determine the basic properties of
$\gamma$-ray loud blazars, among them the central black hole mass, M, the
Doppler factor, $\delta$, the propagation angle of the $\gamma$-rays with
respect to the symmetric axis of a two-temperature accretion disk, $\Phi$, and
the distance (i.e. the height above the accretion disk), d at which the
$\gamma$-rays are created, for seven $\gamma$-ray loud blazars with available
GeV variability timescales and in which the absorption effect of a $\gamma$-ray
and the beaming effect have been taken into account. Our results indicate that,
if we take the intrinsic $\gamma$-ray luminosity to be $\lambda$ times the
Eddington luminosity, $L_{\gamma}^{in} = \lambda L_{Edd.}$, the masses of the
blazars are in the range of $(4 \sim 131)\times 10^{7}M_{\odot}$, the Doppler
factors ($\delta$) lie in the range of 0.57 to 5.33 the angle ($\Phi$) is in
the range of $13^{\circ}$ to 43$^{\circ}$ and the distance (d) is in the range
of 26R_{g} to 411R_{g}. Our model results are independent of $\gamma$-ray
emission mechanisms but they do depend on the X-ray emission mechanism of the
accretion disk.
","[{""version"":""v1"",""created"":""Fri, 29 Oct 1999 12:32:42 GMT""}]","2007-05-23"
"astro-ph/9910544","Peter J. Wheatley","Peter J. Wheatley","The X-ray spectra of symbiotic stars","4 pages, to appear in the proceedings of the Bologna conference
  ""X-ray Astronomy 1999""",,,,"astro-ph",,"  Symbiotic stars are thought to show distinct X-ray emission from the
accreting object and from the colliding winds of the two stars. I show that the
colliding wind component is unnecessary. Instead, the spectra can be
interpreted as emission only from the compact object that is strongly absorbed
by the partially-ionised wind of the red giant. There remains no evidence of
any X-ray emission from colliding winds, and thus no need for a substantial
wind from the compact object.
","[{""version"":""v1"",""created"":""Fri, 29 Oct 1999 13:39:07 GMT""}]","2007-05-23"
"chao-dyn/9910039","Khodas Maxim","M. Khodas and S. Fishman","Relaxation and Diffusion for the Kicked Rotor",,,"10.1103/PhysRevLett.84.2837",,"chao-dyn nlin.CD",,"  The dynamics of the kicked-rotor, that is a paradigm for a mixed system,
where the motion in some parts of phase space is chaotic and in other parts is
regular is studied statistically. The evolution (Frobenius-Perron) operator of
phase space densities in the chaotic component is calculated in presence of
noise, and the limit of vanishing noise is taken is taken in the end of
calculation. The relaxation rates (related to the Ruelle resonances) to the
invariant equilibrium density are calculated analytically within an
approximation that improves with increasing stochasticity. The results are
tested numerically. The global picture of relaxation to the equilibrium density
in the chaotic component when the system is bounded and of diffusive behavior
when it is unbounded is presented.
","[{""version"":""v1"",""created"":""Thu, 28 Oct 1999 17:06:09 GMT""}]","2009-10-31"
"chao-dyn/9910040","Khodas Maxim","M. Khodas, S. Fishman, O. Agam","Relaxation to the Invariant Density for Kicked Rotor","24 pages, 7 figures",,"10.1103/PhysRevE.62.4769",,"chao-dyn nlin.CD",,"  The relaxation rates to the invariant density in the chaotic phase space
component of the kicked rotor (standard map) are calculated analytically for a
large stochasticity parameter, $K$. These rates are the logarithms of the poles
of the matrix elements of the resolvent, $ \hat{R}(z)=(z-\hat{U})^{-1} $, of
the classical evolution operator $\hat{U} $. The resolvent poles are located
inside the unit circle. For hyperbolic systems this is a rigorous result, but
little is known about mixed systems such as the kicked rotor. In this work, the
leading relaxation rates of the kicked rotor are calculated in presence of
noise, to the leading order in $1/\sqrt{K}$. Then the limit of vanishing noise
is taken and the relaxation rates are found to be finite, corresponding to
poles lying inside the unit circle. It is found that the slow relaxation rates,
in essence, correspond to diffusion modes in the momentum direction. Faster
relaxation modes intermix the motion in the momentum and the angle space. The
slowest relaxation rate of distributions in the angle space is calculated
analytically by studying the dynamics of inhomogeneities projected down to this
space. The analytical results are verified by numerical simulations.
","[{""version"":""v1"",""created"":""Thu, 28 Oct 1999 17:39:44 GMT""},{""version"":""v2"",""created"":""Wed, 17 May 2000 13:33:42 GMT""}]","2009-10-31"
"chao-dyn/9911001","Prot Pakonski","Prot Pakonski (Cracow)","Different Traces of Quantum Systems Having the Same Classical Limit","LaTeX 4 pages, 2 figures included, final published version","Physica E 9 (2001) 513-517","10.1016/S1386-9477(00)00255-1",,"chao-dyn nlin.CD quant-ph",,"  Many quantum systems may have the same classical limit. We argue that in the
classical limit their traces do not necessarily converge one to another. The
trace formula allows to express quantum traces by means of classical quantities
as sums over periodic orbits of the classical system. To explain the lack of
convergence of the traces we need the quantum corrections to the classical
actions of periodic orbits. The four versions of the quantum baker map on the
sphere serve as an illustration of this problem.
","[{""version"":""v1"",""created"":""Fri, 29 Oct 1999 15:48:30 GMT""},{""version"":""v2"",""created"":""Wed, 4 Apr 2001 13:56:58 GMT""}]","2009-10-31"
"cond-mat/9910481","Andrew R. Schwartz","Andrew Schwartz, Marc Scheffler, and Steven M. Anlage","Determination of the magnetization scaling exponent for single crystal
  La$_{0.8}$Sr$_{0.2}$MnO$_3$ by broadband microwave surface impedance
  measurements","4 pages; 3 figures included with epsfig; to be published in Phys.
  Rev. B Rapid Communications","Phys. Rev. B 61, R870 (2000).","10.1103/PhysRevB.61.R870",,"cond-mat.str-el",,"  Employing a broadband microwave reflection configuration, we have measured
the complex surface impedance, $Z_S(\omega,T)$, of single crystal
La$_{0.8}$Sr$_{0.2}$MnO$_3$, as a function of frequency (0.045-45 GHz) and
temperature (250-325 K). Through the dependence of the microwave surface
impedance on the magnetic permeability, $\hat\mu(\omega,T)$, we have studied
the local magnetic behavior of this material, and have extracted the
spontaneous magnetization, $M_0(T)$, in {\em zero applied field}. The broadband
nature of these measurements and the fact that no external field is applied to
the material provide a unique opportunity to analyze the critical behavior of
the spontaneous magnetization at temperatures very close to the ferromagnetic
phase transition. We find a Curie temperature $T_C=305.5\pm 0.5$ K and scaling
exponent $\beta=0.45\pm 0.05$, in agreement with the prediction of mean-field
theory. We also discuss other recent determinations of the magnetization
critical exponent in this and similar materials and show why our results are
more definitive.
","[{""version"":""v1"",""created"":""Thu, 28 Oct 1999 20:07:09 GMT""}]","2009-10-31"
"cond-mat/9910482","Andrey A. Kiselev","A. A. Kiselev and K. W. Kim","Progressive suppression of spin relaxation in 2D channels of finite
  width","6 pages, RevTeX, 4 figures (1a, 1b, 1c, 2)","Phys. Rev. B 61, 13115 (2000); follow-up paper: phys. stat. sol.
  (b) 221, 491 (2000)","10.1002/1521-3951(200009)221:1<491::AID-PSSB491>3.0.CO;2-I",,"cond-mat.mes-hall cond-mat.mtrl-sci",,"  We have investigated spatio-temporal kinetics of electron spin polarization
in semiconductor narrow 2D strip and explored the ability to manipulate spin
relaxation. Information about spin of the conduction electrons and mechanisms
of spin rotation is incorporated into transport Monte Carlo simulation program.
A model problem, involving linear-in-k splitting of the conduction band,
responsible for the D'yakonov-Perel' mechanism of spin relaxation in the
zinc-blende semiconductors and heterostructures, is solved numerically to yield
the decay of spin polarization of an ensemble of electrons in the 2D channel of
finite width. For very wide channels, a conventional 2D value of spin
relaxation is obtained. With decreasing channel width the relaxation time
soares rapidly by orders of magnitude. Surprisingly, the cross-over point
between 2D and quasi-1D behavior is found to be at tens of electron mean-free
paths. Thus, classically wide channels can effectively suppress electron spin
relaxation.
","[{""version"":""v1"",""created"":""Thu, 28 Oct 1999 19:19:59 GMT""}]","2015-06-25"
"cond-mat/9910483","Tomohiro Sasamoto","Tomohiro Sasamoto","One-Dimensional Partially Asymmetric Simple Exclusion Process on a Ring
  with a Defect Particle","23 pages, 1 figure","Phys. Rev. E 61 (2000) 4980--4990","10.1103/PhysRevE.61.4980",,"cond-mat.stat-mech",,"  The effect of a moving defect particle for the one-dimensional partially
asymmetric simple exclusion process on a ring is considered. The current of the
ordinary particles, the speed of the defect particle and the density profile of
the ordinary particles are calculated exactly. The phase diagram for the
correlation length is identified. As a byproduct, the average and the variance
of the particle density of the one-dimensional partially asymmetric simple
exclusion process with open boundaries are also computed.
","[{""version"":""v1"",""created"":""Fri, 29 Oct 1999 02:52:08 GMT""}]","2007-05-23"
"cond-mat/9910484","Cynthia J. Olson","J. F. Wambaugh, C. Reichhardt, C. J. Olson, F. Marchesoni, and Franco
  Nori","Superconducting Fluxon Pumps and Lenses","Phys. Rev. Lett. 83, in press (1999); 4 pages, 5 .gif figures;
  figures also available at http://www-personal.engin.umich.edu/~nori/ratchet","Phys. Rev. Lett. 83, 5106 (1999)","10.1103/PhysRevLett.83.5106",,"cond-mat.supr-con",,"  We study stochastic transport of fluxons in superconductors by alternating
current (AC) rectification. Our simulated system provides a fluxon pump,
""lens"", or fluxon ""rectifier"" because the applied electrical AC is transformed
into a net DC motion of fluxons. Thermal fluctuations and the asymmetry of the
ratchet channel walls induce this ""diode"" effect, which can have important
applications in devices, like SQUID magnetometers, and for fluxon optics,
including convex and concave fluxon lenses. Certain features are unique to this
novel two-dimensional (2D) geometric pump, and different from the previously
studied 1D ratchets.
","[{""version"":""v1"",""created"":""Fri, 29 Oct 1999 03:35:08 GMT""}]","2009-10-31"
"cond-mat/9910485","Zack Schlesinger","S. R. Garner, Y. W. Rodriguez, Z. Schlesinger (U.C., Santa Cruz), B.
  Bucher (ITR), Z. Fisk (NHMFL/FSU), J. L. Sarrao (LANL)","Observation of a new excitation in the mixed-valent state of YbInCu_4","4 pages, 3 postscript figures",,,,"cond-mat.str-el",,"  Infrared measurements are used to obtain conductivity as a function of
temperature and frequency in YbInCu_4, which exhibits an isostructural
transition to a mixed-valent state at T_v \simeq 42 K. In addition to a gradual
loss of spectral weight with decreasing temperature extending up to 1.5 eV,
sharp resonances appear in the mixed-valent state at 0 and 0.25 eV . These
features may be key to understanding both YbInCu_4 and the nature of the
mixed-valent Kondo state.
","[{""version"":""v1"",""created"":""Fri, 29 Oct 1999 08:01:39 GMT""}]","2007-05-23"
"cond-mat/9910486","Dr. Krisztina Kadas","Krisztina Kadas, Georg Kern and Jurgen Hafner","Electronic structure of the (111) and (-1-1-1) surfaces of cubic BN: A
  local-density-functional ab initio study","8 pages, 12 figures","Physical Review B, Vol. 60, No. 12., 1999, page 8719-8726","10.1103/PhysRevB.60.8719",,"cond-mat.mtrl-sci",,"  We present ab initio local-density-functional electronic structure
calculations for the (111) and (-1-1-1) surfaces of cubic BN. The energetically
stable reconstructions, namely the N adatom, N3 triangle models on the (111),
the (2x1), boron and nitrogen triangle patterns on the (-1-1-1) surface are
investigated. Band structure and properties of the surface states are discussed
in detail.
","[{""version"":""v1"",""created"":""Fri, 29 Oct 1999 09:12:36 GMT""}]","2009-10-31"
"cond-mat/9910487","Sven Burger","S. Burger, K. Bongs, S. Dettmer, W. Ertmer, K. Sengstock, A. Sanpera,
  G. V. Shlyapnikov, M. Lewenstein","Dark Solitons in Bose-Einstein Condensates","4 pages, including 4 figures in postscript, to be published in Phys.
  Rev. Lett","Phys. Rev. Lett. 83, 5198 (1999)","10.1103/PhysRevLett.83.5198",,"cond-mat quant-ph",,"  Dark solitons in cigar shaped Bose-Einstein condensates of Rubidium-87 are
created by a phase imprinting method. Coherent and dissipative dynamics of the
solitons has been observed.
","[{""version"":""v1"",""created"":""Fri, 29 Oct 1999 09:19:23 GMT""},{""version"":""v2"",""created"":""Thu, 25 Nov 1999 21:09:24 GMT""}]","2011-02-23"
"cond-mat/9910488","R. Hilfer","R. Hilfer, J. Widjajakusuma and B. Biswal, (ICA-1,Universit\""at
  Stuttgart, Stuttgart)","Macroscopic Dielectric Constant for Microstructures of Sedimentary Rocks","10 pages, Latex, paper to appear in: Granular Matter, vol. 2/2 (2000)","Granular Matter, vol. 2, page 137, (2000)",,,"cond-mat",,"  An approximate method to calculate dielectric response and relaxation
functions for water saturated sedimentary rocks is tested for realistic
threedimensional pore space images. The test is performed by comparing the
prediction from the approximate method against the exact solution. The
approximate method is based on image analysis and local porosity theory. An
empirical rule for the specification of the length scale in local porosity
theory is advanced. The results from the exact solution are compared to those
obtained using local porosity theory and various other approximate mixing laws.
The calculation based on local porosity theory is found to yield improved
quantitative agreement with the exact result.
","[{""version"":""v1"",""created"":""Fri, 29 Oct 1999 09:21:56 GMT""}]","2016-08-15"
"cond-mat/9910489","Edward Goldobin","E. Goldobin and A. V. Ustinov","Neighbor-junction state effect on the fluxon motion in a Josephson stack","6 pages + 4 figures, submitted to PRB","Phys. Rev. B 62, 1427 (2000)","10.1103/PhysRevB.62.1427",,"cond-mat.supr-con",,"  We study experimentally and theoretically the influence of phase-whirling
(resistive) state in one junction of a two-fold Josephson stack on the fluxon
motion in the other junction. In experiment, we measure the fluxon velocity
versus current in one junction as a function of the state (Meissner or
resistive) of the neighboring junction. The analysis, made for the limit of
high fluxon density, shows that the interaction with the resistive state
results in an increase of the effective damping for the moving fluxon and,
therefore, in reduction of its velocity. Numerical simulations confirm this
result for various fluxon densities. The experimental data are in good
agreement with the theoretical predictions. In addition, the fluxon step
measured experimentally has a rather peculiar structure with back and forth
bending regions which is understood as a manifestation of the photon absorption
in the neighboring junction.
","[{""version"":""v1"",""created"":""Fri, 29 Oct 1999 12:01:40 GMT""}]","2007-05-23"
"cond-mat/9910490","Gerardo Ortiz","G. Ortiz (1) and A.A. Aligia (2) ((1) Theoretical Division, Los Alamos
  National Laboratory, (2) Centro At\'omico Bariloche, Argentina)","How localized is an extended quantum system ?","5 pages; 1 figure (revtex)",,"10.1002/1521-3951(200007)220:1<737::AID-PSSB737>3.3.CO;2-0",,"cond-mat",,"  We elaborate on a geometric characterization of the electromagnetic
properties of matter. A fundamental complex quantity, z_{L}, is introduced to
study the localization properties of extended quantum systems. z_L, which
allows us to discriminate between conducting and non-conducting thermodynamic
phases, has an illuminating physical (and geometric) interpretation. Its phase
can be related to the expectation value of the position operator (and a Berry
phase), while its modulus is associated with quantum electric polarization
fluctuations (and a quantum metric). We also study the scaling behavior of z_L
in the one-dimensional repulsive Hubbard model.
","[{""version"":""v1"",""created"":""Fri, 29 Oct 1999 15:13:56 GMT""},{""version"":""v2"",""created"":""Mon, 1 Nov 1999 23:56:52 GMT""},{""version"":""v3"",""created"":""Tue, 2 Nov 1999 00:20:41 GMT""},{""version"":""v4"",""created"":""Thu, 4 Nov 1999 02:08:15 GMT""}]","2015-06-25"
"cond-mat/9910491","J. K. Jain","Vito W. Scarola, Kwon Park, and Jainendra K. Jain","Magneto-roton excitation of fractional quantum Hall effect: Comparison
  between theory and experiment","5 pages, 3 figures","Phys. Rev. B 61, 13064 (2000)","10.1103/PhysRevB.61.13064",,"cond-mat.mes-hall",,"  A major obstacle toward a {\em quantitative} verification, by comparison to
experiment, of the theory of the excitations of the fractional quantum Hall
effect has been the lack of a proper understanding of disorder. We circumvent
this problem by studying the {\em neutral} magneto-roton excitations, whose
energy is expected to be largely insensitive to disorder. The calculated
energies of the roton at 1/3, 2/5 and 3/7 fillings of the lowest Landau level
are in good agreement with those measured experimentally.
","[{""version"":""v1"",""created"":""Fri, 29 Oct 1999 15:18:39 GMT""}]","2018-09-25"
"cond-mat/9910492","Axel Gelfert","Axel Gelfert and Wolfgang Nolting","Absence of a Magnetic Phase Transition in Heisenberg, Hubbard, and
  Kondo-lattice (s-f) Films","LaTeX, 20 pages, accepted for publication in phys.stat.sol. (b)","phys.stat.sol. (b) 217, p. 805-818 (2000)","10.1002/(SICI)1521-3951(200002)217:2<805::AID-PSSB805>3.0.CO;2-P",,"cond-mat.str-el cond-mat.stat-mech math-ph math.MP",,"  The possibility of a magnetic phase transition in Heisenberg, Hubbard, and
s-f (Kondo-lattice) films is investigated. It is shown that, for any finite
temperature and any finite number of layers, the magnetization within every
layer must vanish. Thus, the Mermin-Wagner theorem is extended to a variety of
system geometries. We also comment on the microscopic interpretation of the
transition from two to three dimensions in the limit of an infinite number of
layers.
","[{""version"":""v1"",""created"":""Fri, 29 Oct 1999 15:35:23 GMT""}]","2015-06-25"
"gr-qc/9910104","Martin Bojowald","Martin Bojowald","Loop Quantum Cosmology II: Volume Operators","21 pages","Class.Quant.Grav.17:1509-1526,2000","10.1088/0264-9381/17/6/313","PITHA 99/33","gr-qc hep-th",,"  Volume operators measuring the total volume of space in a loop quantum theory
of cosmological models are constructed. In the case of models with rotational
symmetry an investigation of the Higgs constraint imposed on the reduced
connection variables is necessary, a complete solution of which is given for
isotropic models; in this case the volume spectrum can be calculated
explicitly. It is observed that the stronger the symmetry conditions are the
smaller is the volume spectrum, which can be interpreted as level splitting due
to broken symmetries. Some implications for quantum cosmology are presented.
","[{""version"":""v1"",""created"":""Thu, 28 Oct 1999 16:07:09 GMT""}]","2010-11-19"
"gr-qc/9910106","Ulrich H. Gerlach","Ulrich H. Gerlach","Paired Accelerated Frames","22 pages, Plain Tex, one figure. Also published in Proc. of the 7th
  Marcel Grossmann Meeting edited by R.T. Jantzen and G.M. Keiser (World
  Scientific, Singapore, 1996), 957-976. Related papers on accelerated frames
  are available at http://www.math.ohio-state.edu/~gerlach","Int.J.Mod.Phys.A11:3667-3688, 1996","10.1142/S0217751X96001711",,"gr-qc",,"  The geometrical and quantum mechanical basis for Davies' and Unruh's
acceleration temperature is traced to a type of quantum mechanical
(``achronal'') spin. Its existence and definition are based on pairs of
causally disjoint accelerated frames. For bosons the expected spin vector of
monochromatic particles is given by the ``Planckian power'' and the ``r.m.s.
thermal fluctuation'' spectra. Under spacetime translation the spin direction
precesses around that ``Planckian'' vector. By exhibiting the conserved
achronal spin four-current, we extend the identification of achronal spin from
single quanta to multiparticle systems. Total achronal spin conservation is
also shown to hold, even in the presence of quadratic interactions.
","[{""version"":""v1"",""created"":""Thu, 28 Oct 1999 16:02:25 GMT""}]","2015-06-25"
"gr-qc/9910107","Ulrich H. Gerlach","Ulrich H. Gerlach","Acceleration-induced carrier of the imprints of gravitation","3 pages, Latex. Based on the first of two talks given June 23-24,
  1997, at the 8th Marcel Grossmann Meeting. Html version and related papers
  available at http://www.math.ohio-state.edu/~gerlach","Proc. 8th Marcel Grossmann Meeting, edited by T. Piran (World
  Scientific, Singapore, 1999), 806-808",,,"gr-qc",,"  We exhibit a purely quantum mechanical carrier of the imprints of gravitation
by identifying for a relativistic charge a property which (i) is independent of
its mass and (ii) expresses the Poincare invariance of spacetime in the absence
of gravitation.
  This carrier is a Klein-Gordon-equation-determined vector field given by the
``Planckian power'' and the ``r.m.s. thermal fluctuation'' spectra. The
imprints themselves are deviations away from this vector field.
","[{""version"":""v1"",""created"":""Fri, 29 Oct 1999 15:47:37 GMT""}]","2016-08-31"
