"hep-th/9910251","Nathan Jacob Berkovits","Nathan Berkovits (IFT/UNESP, Sao Paulo)","Quantization of the Superstring in Ramond-Ramond Backgrounds","Corrected a few typos, Talk given at Strings `99 in Potsdam","Class.Quant.Grav.17:971-978,2000","10.1088/0264-9381/17/5/306","IFT-P.078/99","hep-th",,"  Sigma model actions are constructed for the Type II superstring compactified
to four and six dimensional curved backgrounds which can contain non-vanishing
Ramond-Ramond fields. These actions are N=2 worldsheet superconformally
invariant and can be covariantly quantized preserving manifest spacetime
supersymmetry. They are constructed using a hybrid version of superstring
variables which combines features of the Ramond-Neveu-Schwarz and Green-Schwarz
formalisms. For the $AdS_2\times S^2$ and $AdS_3\times S^3$ backgrounds, these
actions differ from the classical Greeen-Schwarz actions by a crucial kinetic
term for the fermions. Parts of this work have been done in collaborations with
M. Bershadsky, T. Hauer, W. Siegel, C. Vafa, E. Witten, S. Zhukov and B.
Zwiebach.
","[{""version"":""v1"",""created"":""Fri, 29 Oct 1999 22:38:06 GMT""},{""version"":""v2"",""created"":""Thu, 18 Nov 1999 16:57:30 GMT""}]","2011-04-15"
"math/9910167","William Arveson","William Arveson","Interactions in noncommutative dynamics","22 pages. Replacement corrects misnumbering of formulas in section 4.
  No change in mathematical content",,"10.1007/s002200050802",,"math.OA",,"  A mathematical notion of interaction is introduced for noncommutative
dynamical systems, i.e., for one parameter groups of *-automorphisms of $\Cal
B(H)$ endowed with a certain causal structure. With any interaction there is a
well-defined ""state of the past"" and a well-defined ""state of the future"". We
describe the construction of many interactions involving cocycle perturbations
of the CAR/CCR flows and show that they are nontrivial. The proof of
nontriviality is based on a new inequality, relating the eigenvalue lists of
the ""past"" and ""future"" states to the norm of a linear functional on a certain
C^*-algebra.
","[{""version"":""v1"",""created"":""Fri, 29 Oct 1999 16:54:31 GMT""},{""version"":""v2"",""created"":""Sun, 31 Oct 1999 00:47:53 GMT""},{""version"":""v3"",""created"":""Sun, 7 Nov 1999 01:35:12 GMT""}]","2009-10-31"
"math/9910168","Peter G. Casazza","Peter G. Casazza","The Art of Frame Theory","67 pages",,,,"math.FA",,"  Thye theory of frames for a Hilbert space plays a fundamental role in signal
processing, image processing, data compression, sampling theory and much more,
as well as being a fruitful area of research in abstract mathematics. In this
``tutorial'' on abstract frame theory, we will try to point out the major
directions of research in abstract frame theory and give some sample techniques
from each of the areas. We will also bring out some of the important open
questions, discuss some of the limitations of the existing theory, and point to
some new directions for research.
","[{""version"":""v1"",""created"":""Fri, 29 Oct 1999 18:19:47 GMT""}]","2007-05-23"
"math/9910169","Peter G. Casazza","Peter G. Casazza, Ole Christensen, and A.J.E.M. Janssen","Weyl-Heisenberg Frames, Translation Invariant Systems and the Walnut
  Representation","67 PAGES",,,,"math.FA",,"  We present a comprehensive analysis of the convergence properties of the
frame operators of Weyl-Heisenberg systems and shift-invariant systems, and
relate these to the convergence of the Walnut representation. We give a deep
analysis of necessary conditions and sufficient conditions for convergence of
the frame operator. We show that symmetric, norm and unconditional convergence
of the Walnut series are all different, but that weak and norm convergence are
the same, while there are WH-systems for which the Walnut representation has
none of these convergence properties. We make a detailed study of the
CC-Condition (a sufficient condition for WH-systems to have finite upper frame
bounds), and show that (for ab rational) a uniform version of this passes to
the Wexler-Raz dual. We also show that a condition of Tolimieri and Orr implies
the uniform CC-Condition. We obtain stronger results in the case when (g,a,b)
is a WH-system and ab is rational. For example, if ab is rational, then the
CC-Condition becomes equivalent to the unconditional convergence of the Walnut
representation - even in a more general setting. Many of the results are
generalized to shift-invariant systems. We give classifications for numerous
important classes of WH-systems including: (1) The WH-systems for which the
frame operator extends to a bounded operator on L^p(R), 1\leq p; (2) The
WH-systems for which the frame operator extends to a bounded operator on the
Wiener amalgam space; (3) The families of frames which have the same frame
operator.
","[{""version"":""v1"",""created"":""Fri, 29 Oct 1999 18:39:16 GMT""}]","2007-05-23"
"math/9910170","Nancy C. Wrinkle","Joan S. Birman, Nancy C. Wrinkle","On transversally simple knots","28 pages, 17 figures. Final revision includes a formula for computing
  the maximum Bennequin number for an iterated torus knot. Accepted for
  publication in Journal of Differential Geometry",,,,"math.GT",,"  Final revision. To appear in the Journal of Differential Geometry. This paper
studies knots that are transversal to the standard contact structure in
$\reals^3$, bringing techniques from topological knot theory to bear on their
transversal classification. We say that a transversal knot type $\cTK$ is {\it
transversally simple} if it is determined by its topological knot type $\cK$
and its Bennequin number. The main theorem asserts that any $\cTK$ whose
associated $\cK$ satisfies a condition that we call {\em exchange reducibility}
is transversally simple.
  As a first application, we prove that the unlink is transversally simple,
extending the main theorem in \cite{El}. As a second application we use a new
theorem of Menasco (Theorem 1 of \cite{Me}) to extend a result of Etnyre
\cite{Et} to prove that iterated torus knots are transversally simple. We also
give a formula for their maximum Bennequin number. We show that the concept of
exchange reducibility is the simplest of the constraints that one can place on
$\cK$ in order to prove that any associated $\cTK$ is transversally simple. We
also give examples of pairs of transversal knots that we conjecture are {\em
not} transversally simple.
","[{""version"":""v1"",""created"":""Fri, 29 Oct 1999 18:43:20 GMT""},{""version"":""v2"",""created"":""Thu, 18 Nov 1999 23:55:18 GMT""},{""version"":""v3"",""created"":""Fri, 6 Apr 2001 15:36:57 GMT""},{""version"":""v4"",""created"":""Wed, 11 Apr 2001 19:32:54 GMT""}]","2007-05-23"
"math/9910171","John Franks","John Franks (Northwestern University), David Richeson (Michigan State
  University)","Shift Equivalence and the Conley index","23 pages",,,,"math.DS",,"  In this paper we introduce filtration pairs for isolated invariant sets of
continuous maps. We prove the existence of filtration pairs and show that, up
to shift equivalence, the induced map on the corresponding pointed space is an
invariant of the isolated invariant set. Moreover, the maps defining the shift
equivalence can be chosen canonically. Lastly, we define partially ordered
Morse decompositions and prove the existence of Morse set filtrations for such
decompositions.
","[{""version"":""v1"",""created"":""Fri, 29 Oct 1999 19:03:58 GMT""}]","2007-05-23"
"math/9910172","Jose I. Liberati","Victor G. Kac and Jose I. Liberati","Quasifinite representations of W_{\infty}","Amstex, 18 pages",,,,"math.QA math.RT",,"  We classify the quasifinite highest weight modules over a family of
subalgebras W_{\infty}^{n} of the central extension W_{1+\infty} of the Lie
algebra of differential operators on the circle consisting of operators of
order \geq n. We classify the unitary quasifinite highest weight modules over
W_{\infty}=W_{\infty}^{1} and realize them in terms of unitary highest weight
representations of the Lie algebra of infinite matrices with finitely many
non-zero diagonals.
","[{""version"":""v1"",""created"":""Fri, 29 Oct 1999 20:14:01 GMT""}]","2007-05-23"
"math/9910173","Suemi Rodriguez Romo","Suemi Rodriguez-Romo","Actions of the Dipper-Donkin quantization GL_2 on the Clifford algebra
  C(1,3)","22 pages, 4 figures, LaTex2e","Communications in Algebra,27(9), 4307-4325 (1999)",,,"math.QA",,"  Following the method already developed for studying the actions of GL_q(2,C)
on the Clifford algebra C(1,3) and its quantum invariants (Commun. in Algebra
27, 1843-1878(1999)), we study the action on C(1,3) of the quantum group GL_2
constructed by Dipper and Donkin. We are able of proving that there exists only
two non-equivalent cases of actions with nontrivial ""perturbation"". The space
of invariants are trivial in both cases. We also prove that each irreducible
finite dimensional algebra representation of the quantum group GL_2, q^m\neq 1,
is one dimensional. By studying the cases with zero ""perturbation"" we find that
the cases with nonzero ""perturbation"" are the only ones with maximal possible
dimension for the operator algebra \Re.
","[{""version"":""v1"",""created"":""Fri, 29 Oct 1999 23:22:36 GMT""}]","2007-05-23"
"nucl-ex/9910017","Thomas Lefort","T. Lefort, L. Beaulieu, A. Botvina, D. Durand, K. Kwiatkowski, W.-c.
  Hsi, L. Pienkowski, B. Back, H. Breuer, S. Gushue, R.G. Korteling, R.
  Laforest E. Martin, E. Ramakrishnan, L.P. Remsberg, D. Rowland, A. Ruangma,
  V.E. Viola, E. Winchester, S.J. Yennello","Thermally-induced expansion in the 8 GeV/c $\pi^-$ + $^{197}$Au reaction","12 pages including 4 postscript figures","Phys.Rev. C62 (2000) 031604","10.1103/PhysRevC.62.031604",,"nucl-ex",,"  Fragment kinetic energy spectra for reactions induced by 8.0 GeV/c
$\rm{\pi^-}$ beams incident on a $\rm{^{197}}$Au target have been analyzed in
order to deduce the possible existence and influence of thermal expansion. The
average fragment kinetic energies are observed to increase systematically with
fragment charge but are nearly independent of excitation energy. Comparison of
the data with statistical multifragmentation models indicates the onset of
extra collective thermal expansion near an excitation energy of E*/A
$\rm{\approx}$ 5 MeV. However, this effect is weak relative to the radial
expansion observed in heavy-ion-induced reactions, consistent with the
interpretation that the latter expansion may be driven primarily by dynamical
effects such as compression/decompression.
","[{""version"":""v1"",""created"":""Fri, 29 Oct 1999 23:10:34 GMT""},{""version"":""v2"",""created"":""Tue, 9 Nov 1999 23:19:15 GMT""},{""version"":""v3"",""created"":""Fri, 19 Nov 1999 22:26:04 GMT""}]","2009-10-31"
"nucl-th/9910077","Calvin W. Johnson","C. W. Johnson and D. J. Dean","Sum rules regarding the sign problem in Monte Carlo shell model
  calculations","10 pages, 1 figure","Phys.Rev. C61 (2000) 044327","10.1103/PhysRevC.61.044327",,"nucl-th",,"  The Monte Carlo shell model is a powerful technique for computational nuclear
structure. Only a certain class of nuclear interactions, however, such as
pairing and quadrupole, are free of the numerical noise known as the sign
problem.This paper presents sum rules that relate the sign problem to the J=0
pairing matrix elements, thus illuminating the extrapolation procedure
routinely used for realistic shell-model interactions.
","[{""version"":""v1"",""created"":""Fri, 29 Oct 1999 16:14:23 GMT""}]","2009-10-31"
"physics/9910047","George Parzen","G. Parzen","Theory of the tune shift due to linear coupling","11 pages, PDF file",,,"BNL-46415","physics.acc-ph",,"  The presence of skew quadrupole fields will linearly couple the x and y
motions. The x and y motions can then be written as the sum of two normal modes
>. This paper presents analytical perturbation theory results for the tunes of
the normal modes. The results for the normal mode tunes are first found correct
to lowest order in the skew quadrupole fields. The results are then carried one
step further to include the next higher order terms in the skew quadrupole
fields. These analytical results show that for the higher order shift in the
tune, the important harmonics of the skew quadrupole field are the harmonics
near the sum of the tunes. However the harmonics closest to the sum of the
tunes do not contribute to the higher order tune splitting, the seperation of
the tunes, as they shift the two tunes about equally.This results in a lack of
a dominant harmonic for the higher order part of the tune splitting, which
complicates the understanding and correction of the higher order part of the
tune splitting.
","[{""version"":""v1"",""created"":""Fri, 29 Oct 1999 18:01:55 GMT""}]","2007-05-23"
"physics/9910048","Kukushkin A. B.","A.B. Kukushkin and V.A. Rantsev-Kartinov","Wild cables and survivability of macroscopic molecular structures in hot
  tokamak plasmas","6 pages LaTeX",,,,"physics.plasm-ph physics.atm-clus",,"  The evidences for tubular rigid-body structures are found in tokamak plasmas,
which are similar to long-living filaments observed in a Z-pinch ([1]
Kukushkin, Rantsev-Kartinov, Proc. 26-th EPS conf.,
http://epsppd.epfl.ch/cross/p2087.htm). These structures are suggested to be a
""wild cables"" produced by the channelling of EM energy pumped from the external
electric circuit and propagated to the plasma core in the form of the high
frequency EM waves along hypothetical (carbon) microsolid skeletons [1] which
are assembled during electric breakdown. It is shown that such skeletons may be
protected from the high-temperature ambient plasma by the TEM waves produced
thanks to the presence of microsolid skeletons.
","[{""version"":""v1"",""created"":""Fri, 29 Oct 1999 19:06:25 GMT""}]","2007-05-23"
"physics/9910049","Antonio del Rio Portilla","M. E. Larraga, J. A. del Rio (Centro de Investigacion en Energia,
  Universidad Nacional Autonoma de Mexico) and Anita Mehta (Oxford Physics,
  Clarendon Laboratory)","Possible Self-Organised Criticality and Dynamical Clustering of Traffic
  flow in Open Systems","5 pages, 8 figures",,,,"physics.class-ph",,"  We focus in this work on the study of traffic in open systems using a
modified version of an existing cellular automaton model. We demonstrate that
the open system is rather different from the closed system in its 'choice' of a
unique steady-state density and velocity distribution, independently of the
initial conditions, reminiscent of self-organised criticality. Quantities of
interest such as average densities and velocities of cars, exhibit phase
transitions between free flow and the jammed state, as a function of the
braking probability R in a way that is very different from closed systems.
Velocity correlation functions show that the concept of a dynamical cluster,
introduced earlier in the context of granular flow is also relevant for traffic
flow models.
","[{""version"":""v1"",""created"":""Fri, 29 Oct 1999 20:14:08 GMT""}]","2007-05-23"
"physics/9910050","H. E. Puthoff, . D.","Michael Ibison, Harold E. Puthoff, Scott R. Little","The speed of gravity revisited","10 pages, 4 figs, submitted to Physics Letters A on September 10,
  1999",,,,"physics.gen-ph",,"  Recently Van Flandern concluded from astrophysical data that gravity
propagates faster than light. We demonstrate that the data can be explained by
current theory that does not permit superluminal speeds. We explain the origin
of apparently instantaneous connections, first within EM, and then within
strong-field GR.
","[{""version"":""v1"",""created"":""Fri, 29 Oct 1999 22:14:50 GMT""}]","2016-09-08"
"quant-ph/9910122","John Smolin","Pawel Horodecki, John A. Smolin, Barbara M. Terhal and Ashish V.
  Thapliyal","Rank Two Bipartite Bound Entangled States Do Not Exist","5 pages LaTeX, many corrections and updated references",,,,"quant-ph",,"  We explore the relation between the rank of a bipartite density matrix and
the existence of bound entanglement. We show a relation between the rank,
marginal ranks, and distillability of a mixed state and use this to prove that
any rank n bound entangled state must have support on no more than an n \times
n Hilbert space. A direct consequence of this result is that there are no
bipartite bound entangled states of rank two. We also show that a separability
condition in terms of a quantum entropy inequality is associated with the above
results. We explore the idea of how many pure states are needed in a mixture to
cancel the distillable entanglement of a Schmidt rank n pure state and provide
a lower bound of n-1. We also prove that a mixture of a non-zero amount of any
pure entangled state with a pure product state is distillable.
","[{""version"":""v1"",""created"":""Fri, 29 Oct 1999 16:30:43 GMT""},{""version"":""v2"",""created"":""Fri, 4 Feb 2000 15:57:54 GMT""},{""version"":""v3"",""created"":""Wed, 6 Jun 2001 21:00:03 GMT""},{""version"":""v4"",""created"":""Thu, 16 Aug 2001 20:30:29 GMT""}]","2007-05-23"
